user_input,qa_context,reference,retrieved_contexts,response
울산 동구 지역산업 청년일리 사업의 주관 기관은 어디인가요?,"['정책 이름: 울산 동구 지역산업 청년일리 사업', '주관 기관:울산광역 동구 일리정책과 일리정책팀 052 209 4552']",울산광역 동구 일리정책과 일리정책팀,"['[Document(metadata={\'name\': \'울산 동구 지역산업맞춤형 청년일자리 사업\', \'source\': \'..\\\\data\\\\policy_result.json\'}, page_content=\'기관:울산 동구 정책 분야:일자리분야 지원 내용:  추진방법   울산광역시  2024년  지역 산업맞춤형 일자리창출 지원사업 일반 기초   공모  선정   사업내용    교육훈련  지역의 산업 수요에 맞는 인력양성  지역 고용문제 해결을 위해 실시하는 취업역량 강화 교육    취업연계  지역산업 수요에  원활한 구인 구직 매칭을 지원하는 사업    운영방법   사업기관과 약정체결 추진 사업 운영 기간:  사업기간   약정체결일 ~  24. 12. 사업 신청 기간:상시 연령:만 18세 ~ 39세 거주지 및 소득:  사업대상   동구지역 미취업 청년 18세 ~ 39세  주관 기관:울산광역시 동구 일자리정책과 일자리정책팀 052 209 4552  운영 기관:주관기관과 동일\'), Document(metadata={\'name\': \'울산 북구 청년창업 제조공간 지원\', \'source\': \'..\\\\data\\\\policy_result.json\'}, page_content=\'기관:울산 북구 정책 분야:일자리분야 지원 내용:  입주대상   창업 7년 미만 청년 창업기업 9개사   사업내용   청년 창업가 제조공간  엑설러레이팅 지원  강연   입주공간   9개소 제조공간 3  사무공간 6  사업 운영 기간:  사업기간    24. 1. ~ 12. 연중  사업 신청 기간:상시 연령:만 19세 ~ 39세 주관 기관:울산광역시 북구 경제일자리과 청년정책팀 052 241 7717  운영 기관:주관기관과 동일\'), Document(metadata={\'name\': \'울산 동구 청년센터 운영\', \'source\': \'..\\\\data\\\\policy_result.json\'}, page_content=\'기관:울산 동구 정책 분야:복지.문화분야 지원 내용:  위치   동구 명덕 5길 6 서부동  리얼소통발전소 3층    시설규모   130.7   사무실 44.35    청년인큐베이터 86.35       운영시간   월  토 10 00 ~ 18 00   화~ 금 10 00 ~ 21 00   휴무일   일  공휴일  운영인력   3명 센터장 1  팀원 2     기능   청년정책지원   청년정책연구 플랫폼  청년정책안내  정책의제 발굴   청년활동지원   커뮤니티 활성화  아이디어 공모  네트워크 구축   청년성장지원   청년창업지원  경험설계  직업탐방 운영  사업 신청 기간:상시 연령:만 19세 ~ 39세 주관 기관:울산광역시 동구 일자리정책과 청년정책팀 052 209 3485  운영 기관:울산동구청년센터 052 209 3486 \'), Document(metadata={\'name\': \'울산 지방공기업 청년고용의무제\', \'source\': \'..\\\\data\\\\policy_result.json\'}, page_content=\'기관:울산 정책 분야:일자리분야 지원 내용:  내용   지방공기업 정원의 100분의 3 이상 청년 미취업자 의무고용   청년고용촉진특별법 제5조 공공기관의 청년 미취업자 고용의무     기관   울산도시공사  울산시설공단 사업 운영 기간:연중 사업 신청 기간:상시 연령:만 19세 ~ 34세 거주지 및 소득:청년 미취업자 15세 이상 ~ 34세 이하  주관 기관:울산광역시 예산담당관 공공기관팀 052 229 2252  운영 기관:울산도시공사  울산시설공단\'), Document(metadata={\'name\': \'울산 동구 청년 문화강좌 개설  운영\', \'source\': \'..\\\\data\\\\policy_result.json\'}, page_content=\'기관:울산 동구 정책 분야:복지.문화분야 지원 내용:  사업내용   문화강좌 개설  운영 시 청년  유도 사업 신청 기간:상시 연령:만 18세 ~ 39세 거주지 및 소득:  사업대상   동구 거주 18세 ~ 39세 청년 주관 기관:울산광역시 동구 교육지원과 꽃바위문화담당팀 052 209 4332  운영 기관:주관기관과 동일\')], [{\'url\': \'http://www.ulkyung.kr/news/articleView.html?idxno=34570\', \'content\': ""울산시(시장 김두겸)가 행정안전부 주관 \'2023년 지역주도형 청년일자리사업\'에서 광역시 부문 우수기관으로 선정돼 행정안전부장관 기관 표창을 수상했다. 11일 시에 따르면 지역주도형 청년일자리사업은 지역 현장을 가장 잘 이해하고 있는 지자체가 지역 청년 일자리 창출 사업을 기획·운영할 수""}, {\'url\': \'https://www.ohmynews.com/NWS_Web/View/at_pg.aspx?CNTN_CD=A0002984952\', \'content\': \'울산시 \\\'지역주도형 청년일자리사업\\\' 우수 선정 - 오마이뉴스 오마이뉴스 이용가이드 모바일 이용안내 페북 트위터 유튜브 페북 트위터 페북 트위터 오마이뉴스 SNS 행정안전부가 \\\'2023년 지역주도형 청년일자리사업\\\' 추진한 결과 우수기관(광역시 부문)으로 선정되어 행정안전부장관 기관 표창을 수상한 울산시 담당부서는 수상 비결을 이처럼 밝혔다. 행안부 주관 \\\'지역주도형 청년일자리사업\\\'은 지역의 현장을 가장 잘 이해하고 있는 지방자치단체가 지역 청년 일자리 창출 사업을 기획･운영할 수 있도록 지원하는 사업이다. 울산시는 이번 수상에 대해\\xa0""지역주도형 청년일자리사업은 청년 눈높이에 맞는 일자리 발굴과 기업의 인건비 부담 경감을 통해 청년과 지역경제가 함께 성장할 수 있는 사업이다""라며 ""앞으로 이차전지를 비롯한 차세대 에너지, 문화콘텐츠 등 지역특화 일자리에 청년 고용을 촉진하는 정책적 노력을 계속할 계획이다""라고 밝혔다. 추천2 댓글 스크랩 페이스북 트위터 공유 10만인클럽10만인클럽 회원 박석철 (sisa) 내방 2005년 인터넷신문 <시사울산> 창간과 동시에 <오마이뉴스> 시민기자 활동 시작. 오마이뉴스 취재후원 오마이뉴스 이용가이드\'}]']",울산 동구 지역산업맞춤형 청년일자리 사업의 주관 기관은 울산광역시 동구 일자리정책과 일자리정책팀입니다. 연락처는 052-209-4552입니다.
울산 동구 지역산업 청년일리 사업의 지원 내용은 무엇인가요?,"['정책 이름: 울산 동구 지역산업 청년일리 사업', '지원 내용: 추진방법   울산광역  2024년  지역 산업 일리창출 지원사업 일반 기초   공모  선정   사업내용    교육훈련  지역의 산업 요에 맞는 인력양성  지역 고용문제 해결을 위해 실하는 취업역량 강화 교육    취업계  지역산업 요에  원활한 구인 구직 매칭을 지원하는 사업    운영방법   사업기관과 약정체결 추진']","지역의 산업에 맞는 인력양성과 취업역량 강화 교육, 원활한 구인 구직 매칭을 지원합니다.","[""[Document(metadata={'name': '울산 동구 지역산업맞춤형 청년일자리 사업', 'source': '..\\\\data\\\\policy_result.json'}, page_content='기관:울산 동구 정책 분야:일자리분야 지원 내용:  추진방법   울산광역시  2024년  지역 산업맞춤형 일자리창출 지원사업 일반 기초   공모  선정   사업내용    교육훈련  지역의 산업 수요에 맞는 인력양성  지역 고용문제 해결을 위해 실시하는 취업역량 강화 교육    취업연계  지역산업 수요에  원활한 구인 구직 매칭을 지원하는 사업    운영방법   사업기관과 약정체결 추진 사업 운영 기간:  사업기간   약정체결일 ~  24. 12. 사업 신청 기간:상시 연령:만 18세 ~ 39세 거주지 및 소득:  사업대상   동구지역 미취업 청년 18세 ~ 39세  주관 기관:울산광역시 동구 일자리정책과 일자리정책팀 052 209 4552  운영 기관:주관기관과 동일'), Document(metadata={'name': '울산 북구 청년창업 제조공간 지원', 'source': '..\\\\data\\\\policy_result.json'}, page_content='기관:울산 북구 정책 분야:일자리분야 지원 내용:  입주대상   창업 7년 미만 청년 창업기업 9개사   사업내용   청년 창업가 제조공간  엑설러레이팅 지원  강연   입주공간   9개소 제조공간 3  사무공간 6  사업 운영 기간:  사업기간    24. 1. ~ 12. 연중  사업 신청 기간:상시 연령:만 19세 ~ 39세 주관 기관:울산광역시 북구 경제일자리과 청년정책팀 052 241 7717  운영 기관:주관기관과 동일'), Document(metadata={'name': '울산 북구 취약노동자 건강지원 사업', 'source': '..\\\\data\\\\policy_result.json'}, page_content='기관:울산 북구 정책 분야:복지.문화분야 지원 내용:  내용   관내 청년 노동자 대상 건강지원 사업추진 사업 운영 기간:  사업기간    24. 1. ~ 11. 사업 신청 기간:상시 지원 규모(명):100명 연령:만 19세 ~ 39세 거주지 및 소득:  대상   울산 북구 청년 취약노동자 주관 기관:울산광역시 북구 경제일자리과 기업투자팀 052 241 8644  운영 기관:울산 북구보건소  울산 취약노동자 건강증진센터  울산근로자건강센터'), Document(metadata={'name': '울산 동구 청년 맞춤형  운영', 'source': '..\\\\data\\\\policy_result.json'}, page_content='기관:울산 동구 정책 분야:복지.문화분야 지원 내용:  주요내용   청년 모임 발굴  활성화  운영 지원   감정일기  기후일기  역사모임  청년 요구조사를 통한 5~6개 모임 구성 사업 운영 기간:  사업기간    24. 3. ~ 12. 사업 신청 기간:상시 연령:만 18세 ~ 39세 거주지 및 소득:  대 상   동구 거주  생활 청년  18세 ~ 39세  신청 절차:울산 동구 청년센터 052 209 3486  문의 주관 기관:울산광역시 동구 일자리정책과 청년정책팀 052 209 3486  운영 기관:울산 동구 청년센터 052 209 3486 '), Document(metadata={'name': '울산 동구 청소년한부모 자립지원', 'source': '..\\\\data\\\\policy_result.json'}, page_content='기관:울산 동구 정책 분야:복지.문화분야 지원 내용:  지원내용   아동양육비   청소년한부모 가족의 자녀. 1인 150천원 월   자립지원 촉진수당   신청일 기준 1년 내 취업활동  직업훈련  학업  자립활동  실적이 있는 가구. 가구당 100천원  월    검정고시  학습지원   학업이 단절되어 검정고시 준비응시생  청년한부모로서 중 고학교 재학생. 연 154만원 이내 사업 운영 기간:  사업기간    24. 1. ~ 12. 사업 신청 기간:상시 거주지 및 소득:  사업대상   기준 중위소득 65% 이하  모  부 나이가 24세 이하인 청소년 한부모 주관 기관:울산광역시 동구 가족정책과 여성청소년팀 052 209 3913  운영 기관:주관기관과 동일')], [{'url': 'https://www.bizinfo.go.kr/web/lay1/bbs/S1T122C128/AS/74/view.do?pblancId=PBLN_000000000095908', 'content': '기업마당>정책정보>지원사업 공고 지원사업 공고 지원사업 공고 지원사업 공고 [울산] 2024년 지역주도형 청년일자리사업 참여기업 모집 통합 공고 - 성장유망업종 기업일자리지원사업, 경력단절 이음을 위한 청년일자리사업 (지원사업별 최대 2인, 1인당 월 160만원x6개월) 지원 - 경력단절이음을 위한 청년일자리사업 : chj1637@ubpi.or.kr [성장유망업종 기업일자리지원사업] 052-283-7201 / [경력단절이음을 위한 청년일자리사업] 052-283-7203 [울산] 2024년 지역주도형 청년일자리사업 참여기업 모집 통합 공고 #청년일자리지원사업#울산청년#울산경제일자리진흥원#2024#미취업청년#지역주도형#채용#울산광역시#중견#인건비#중소기업#울산#인력 지역주도형 청년일자리사업 참여기업 모집 통합공고.pdf 스크랩 링크복사 QR코드 출처 바로가기 2025년 정부일반형 스마트공장 구축사업 공고(2025년 스마트 제조혁신 지원사업) 2025년 스마트 제조혁신 지원사업 통합 공고 2024년 대ㆍ중소 상생형 공동사업전환 참여기업 모집 공고 2024년 일학습병행 학습기업 모집 공고 2024년 과학기술정보통신부 ICT 분야 창업ㆍ벤처 지원사업(K-Global 프로젝트) 통합 공고 [울산] 남구 2024년 소상공인 경영주치의(컨설팅) 사업 모집 공고 2024.02.02 울산광역시 조회수 3409 앱스토어 사용자 및 플레이스토어 사용자 별 QR 코드 안내 테이블'}, {'url': 'https://www.ulsan.go.kr/s/ulsanyouth/bbs/view.do?mId=008001002000000000&bbsId=BBS_0000000000000309&dataId=39881', 'content': '울산청년정책플랫폼 U-PAGE > 청년정책정보 > 공모·지원사업 | 상세보기 전체메뉴로 바로가기 본문으로 바로가기 청년정책정보 공모·지원사업 문자 알림 신청 청년DB 청년DB 등록 안내 청년DB 등록 현황 청년DB 등록 신청 유관기관 현황 청년정책정보 공모·지원사업 문자 알림 신청 청년DB 청년DB 등록 안내 청년DB 등록 현황 청년DB 등록 신청 공모·지원사업 청년정책정보 청년정책정보 청년DB 공모·지원사업 공모·지원사업 문자 알림 신청 2024 청년도전지원사업 안내 링크 1 http://www.work.go.kr 울산동구청년센터와 함께하는 2024 청년도전지원사업 최대 170만원 지원! 🍀 모집기간 : 2023. 🍀 모집대상 : 울산 동구 거주중인 청년(만 18세~34세) * 만 35~39세는 방문신청(사전약속 필) 🍀 문의) 울산동구청년센터 청년도전지원사업팀 052-209-3484\\xa0\\xa0 유튜브 바로가기 울산시 대학청년지원단 인스타그램 새창 열기 (44675) 울산광역시 남구 중앙로 201 (신정동) 울산광역시 대학청년과 Tel. 052-229-7985 / E-mail. ah2020@korea.kr 유관사이트 바로가기 울산광역시 중구 울산광역시 남구 울산광역시 동구 울산광역시 북구 울산광역시 울주군'}]""]","울산 동구 지역산업맞춤형 청년일자리 사업의 지원 내용은 다음과 같습니다:

1. **취업역량 강화 교육**: 지역의 산업 수요에 맞는 인력을 양성하기 위한 교육훈련을 실시합니다. 이는 지역 고용 문제 해결을 위한 취업 역량을 강화하는 데 중점을 둡니다.

2. **취업 연계**: 지역 산업의 수요에 맞춰 구인과 구직의 원활한 매칭을 지원하는 사업입니다.

3. **운영 방법**: 사업 기관과 약정 체결 후 추진되며, 사업 운영 기간은 약정 체결일부터 2024년 12월까지입니다.

4. **신청 자격**: 만 18세에서 39세 사이의 동구 지역 미취업 청년을 대상으로 하며, 지원 신청은 상시로 가능합니다.

5. **주관 및 운영 기관**: 울산광역시 동구 일자리정책과 일자리정책팀이 주관하며, 운영 기관도 동일합니다. 연락처는 052-209-4552입니다.

이 사업은 지역 청년의 취업과 직업 교육에 중점을 두어, 지역 산업과의 연계를 통해 청년 일자리 창출을 목표로 하고 있습니다."
울산 동구 지역산업 청년일리 사업의 신청 가능한 연령대는 어떻게 되나요?,"['정책 이름: 울산 동구 지역산업 청년일리 사업', '연령:만 18세   39세']",만 18세부터 39세까지입니다.,"[""[Document(metadata={'name': '울산 동구 취업  문화 특강 운영', 'source': '..\\\\data\\\\policy_result.json'}, page_content='기관:울산 동구 정책 분야:복지.문화분야 지원 내용:  주요내용   청년들의 수요에 맞는 취업 문화 예술 특강 진행   청년정책  취업역량강화  인생설계  자산관리  원데이 클래스  사업 운영 기간:  사업기간    24. 1. ~ 12. 사업 신청 기간:상시 연령:만 18세 ~ 39세 거주지 및 소득:  대 상   동구 거주  생활 청년 18세 ~ 39세  주관 기관:울산광역시 동구 일자리정책과 청년정책팀 052 209 3486  운영 기관:주관기관과 동일'), Document(metadata={'name': '울산 동구 청년 AI 가상  면접체험 사업', 'source': '..\\\\data\\\\policy_result.json'}, page_content='기관:울산 동구 정책 분야:일자리분야 지원 내용:  주요내용   취업을 준비하는 청년에게 AI 가상 면접 체험 지원 사업 운영 기간:  사업기간    24. 2. ~ 12. 사업 신청 기간:상시 연령:만 18세 ~ 39세 거주지 및 소득:  대 상   18세 ~ 39세 청년 신청 절차:  방법   온라인 신청  현장 방문  주관 기관:울산광역시 동구 일자리정책과 청년정책팀 052 209 3487  운영 기관:울산 동구 청년센터 052 209 3485 '), Document(metadata={'name': '울산 지방공기업 청년고용의무제', 'source': '..\\\\data\\\\policy_result.json'}, page_content='기관:울산 정책 분야:일자리분야 지원 내용:  내용   지방공기업 정원의 100분의 3 이상 청년 미취업자 의무고용   청년고용촉진특별법 제5조 공공기관의 청년 미취업자 고용의무     기관   울산도시공사  울산시설공단 사업 운영 기간:연중 사업 신청 기간:상시 연령:만 19세 ~ 34세 거주지 및 소득:청년 미취업자 15세 이상 ~ 34세 이하  주관 기관:울산광역시 예산담당관 공공기관팀 052 229 2252  운영 기관:울산도시공사  울산시설공단'), Document(metadata={'name': '울산 북구 청년창업 제조공간 지원', 'source': '..\\\\data\\\\policy_result.json'}, page_content='기관:울산 북구 정책 분야:일자리분야 지원 내용:  입주대상   창업 7년 미만 청년 창업기업 9개사   사업내용   청년 창업가 제조공간  엑설러레이팅 지원  강연   입주공간   9개소 제조공간 3  사무공간 6  사업 운영 기간:  사업기간    24. 1. ~ 12. 연중  사업 신청 기간:상시 연령:만 19세 ~ 39세 주관 기관:울산광역시 북구 경제일자리과 청년정책팀 052 241 7717  운영 기관:주관기관과 동일'), Document(metadata={'name': '울산 동구 지역산업맞춤형 청년일자리 사업', 'source': '..\\\\data\\\\policy_result.json'}, page_content='기관:울산 동구 정책 분야:일자리분야 지원 내용:  추진방법   울산광역시  2024년  지역 산업맞춤형 일자리창출 지원사업 일반 기초   공모  선정   사업내용    교육훈련  지역의 산업 수요에 맞는 인력양성  지역 고용문제 해결을 위해 실시하는 취업역량 강화 교육    취업연계  지역산업 수요에  원활한 구인 구직 매칭을 지원하는 사업    운영방법   사업기관과 약정체결 추진 사업 운영 기간:  사업기간   약정체결일 ~  24. 12. 사업 신청 기간:상시 연령:만 18세 ~ 39세 거주지 및 소득:  사업대상   동구지역 미취업 청년 18세 ~ 39세  주관 기관:울산광역시 동구 일자리정책과 일자리정책팀 052 209 4552  운영 기관:주관기관과 동일')], [{'url': 'https://www.ulsan.go.kr/s/ulsanyouth/bbs/view.do?mId=008001002000000000&bbsId=BBS_0000000000000309&dataId=39881', 'content': '울산청년정책플랫폼 U-PAGE > 청년정책정보 > 공모·지원사업 | 상세보기 전체메뉴로 바로가기 본문으로 바로가기 청년정책정보 공모·지원사업 문자 알림 신청 청년DB 청년DB 등록 안내 청년DB 등록 현황 청년DB 등록 신청 유관기관 현황 청년정책정보 공모·지원사업 문자 알림 신청 청년DB 청년DB 등록 안내 청년DB 등록 현황 청년DB 등록 신청 공모·지원사업 청년정책정보 청년정책정보 청년DB 공모·지원사업 공모·지원사업 문자 알림 신청 2024 청년도전지원사업 안내 링크 1 http://www.work.go.kr 울산동구청년센터와 함께하는 2024 청년도전지원사업 최대 170만원 지원! 🍀 모집기간 : 2023. 🍀 모집대상 : 울산 동구 거주중인 청년(만 18세~34세) * 만 35~39세는 방문신청(사전약속 필) 🍀 문의) 울산동구청년센터 청년도전지원사업팀 052-209-3484\\xa0\\xa0 유튜브 바로가기 울산시 대학청년지원단 인스타그램 새창 열기 (44675) 울산광역시 남구 중앙로 201 (신정동) 울산광역시 대학청년과 Tel. 052-229-7985 / E-mail. ah2020@korea.kr 유관사이트 바로가기 울산광역시 중구 울산광역시 남구 울산광역시 동구 울산광역시 북구 울산광역시 울주군'}, {'url': 'https://blog.naver.com/PostView.naver?blogId=ulsanyouth_dong9&logNo=223345777097', 'content': 'NAVER 블로그 울산동구청년센터 블로그 검색 이 블로그에서 검색 첫 댓글을 남겨보세요  공유하기 메뉴 바로가기 본문 바로가기 내 블로그  이웃블로그  블로그 홈  로그인 사용자 링크 블로그 메뉴 프롤로그 블로그 울산동구청년센터 청년센터 프로그램 검색 글 검색 블로그 공지 목록 글 제목    작성일 공지 2024 동구 청년 해방의날 DAY OFF 개최안내 공지 울산동구청년센터 운영시간 변경 안내 공지 2023 동구 청년의 날 전체보기 207개의 글 전체보기 2024\\xa0청년도전지원사업 울산동구청년센터와 함께하는 2024 청년도전지원사업 울산동구청년센터 ・ 2024. 본문 기타 기능 🍀모집대상 : 울산동구 거주중인 청년 (만 18세~34세) 🍀신청방법 : 워크넷(www.work.go.kr) -> 고용복지정책 탭 -> 청년도전지원사업 -> 울산동구청년센터 클릭  *만 35~39세는 방문신청 (사전약속 필) 🍀문의) 울산동구청년센터 청년도전지원사업팀 052-209-3484 댓글 쓰기 이 글에 댓글 단 블로거 열고 닫기 이 블로그 전체 카테고리 글 글 목록 글 제목 작성일'}]""]","울산 동구 지역산업 맞춤형 청년일자리 사업의 신청 가능한 연령대는 만 18세에서 39세까지입니다. 이 사업은 동구 지역의 미취업 청년을 대상으로 하며, 해당 연령대의 청년들이 참여할 수 있습니다."
청년지원센터 더누림 플랫폼 운영 광주의 주관 기관은 어디인가요?,"['정책 이름: 청년지원센터 더누림 플랫폼 운영 광주', '주관 기관: 경기도 광주']",경기도 광주,"['[Document(metadata={\'name\': \'청년지원센터 더누림 플랫폼  운영 광주시 \', \'source\': \'..\\\\data\\\\policy_result.json\'}, page_content=\'기관:경기 광주시 정책 분야:일자리분야 지원 내용:  민간위탁 운영 사업 운영 기간:2024.1~12. 사업 신청 기간:상시 비고:2024.1.1.~2024.12.31. 연령:만 19세 ~ 39세 거주지 및 소득:  광주시 청년 누구나 신청 절차:  광주시 청년지원센터 홈페이지 신청 접수 심사 및 발표:  선착순 모집  선정자 개별 연락 주관 기관:  경기도 광주시 운영 기관:  광주시 청년지원센터 더누림플랫폼 \'), Document(metadata={\'name\': \' 전북청년 로컬 인 캠프 정읍  논두렁 할로윈 행사일  10.5~10.6 \', \'source\': \'..\\\\data\\\\policy_result.json\'}, page_content=\'기관:전북 정책 분야:.권리분야 지원 내용:전북청년허브센터에서 중앙청년지원센터와 함께 지방인구소멸 대응  농촌 문화향유권 확대를 위해정읍 청년활동가 발굴  체험을  지역사회  활성화를 위한전북청년 로컬 인 캠프  정읍 논두렁 할로윈 을 개최하오니 청년들의 많은 관심과  바랍니다.   일시   2024. 10. 5. 토 ~10. 6. 일  13 00~21 00   장소   정읍 카페 샘샘 정읍시 정우면 정신로 588    주요내용   청년창업기업 부스  체험  네트워킹  사업 신청 기간:미정 비고:  별도신청기간 없음   일시   2024. 10. 5. 토 ~10. 6. 일  13 00~21 00   장소   정읍 카페 샘샘 정읍시 정우면 정신로 588  참여 제한 대상:민국 누구나 주관 기관:전북청년허브센터 운영 기관:전북청년허브센터\'), Document(metadata={\'name\': \'청년마음건강지원사업 광주시 \', \'source\': \'..\\\\data\\\\policy_result.json\'}, page_content=\'기관:경기 광주시 정책 분야:복지.문화분야 지원 내용:  청년들에게 심리지원  사전 사후검사  상담  맞춤형  지원   기본 3개월 10회   최대 12개월 지원 가능 사업 운영 기간:  2024.1.1.~12.31. 사업 신청 기간:상시 비고:연중상시 거주지 및 소득:  소득 재산 기준 없음   1순위   자립준비청년  보호연장아동    2순위   정신건강복지센터 연계자    3순위   일반청년 신청 절차:  신청자 주소지 읍면동 신청접수 제출 서류:  신청서  동의서 읍면동비치     자한함 기관발급확인서  진단서 주관 기관:  경기도 광주시 운영 기관:  주관기관과 동일\'), Document(metadata={\'name\': \'청년 정신건강 지원 마인드링크 \', \'source\': \'..\\\\data\\\\policy_result.json\'}, page_content=\'기관:광주 정책 분야:복지.문화분야 지원 내용:정신건강의학적 상담  평가   초발정신질환자 사례관리       가족중재   사업 운영 기간:2024.01.01.~2024.12.31. 사업 신청 기간:상시 신청 절차:유관기관 의뢰 시 홈페이지 내 신청서 작성   개인 신청 시 전화 예약 제출 서류:센터 록 시 소견서 제출 주관 기관:광주광역시 복지건강국 건강정책과 광주광역시 북구보건소 운영 기관:전남대학교 산학협력단 북구보건소에서 위탁 \'), Document(metadata={\'name\': \'부여 청년센터 운영\', \'source\': \'..\\\\data\\\\policy_result.json\'}, page_content=\'기관:충남 부여군 정책 분야:.권리분야 지원 내용:  청년센터 대관  청년 운영 사업 운영 기간: 2024 01 01~2024 12 31 사업 신청 기간:상시 비고:  청년 우선 주관 기관:  행정복지국 전략사업과 운영 기관:  부여군 청년센터\')], [{\'url\': \'https://www.gjcity.go.kr/portal/bbs/view.do?bIdx=317085&ptIdx=1&mId=0201010000\', \'content\': \'새소식 | 알림마당 | 광주소식 | 광주시청 광주시 희망도시 행복광주 광주시 노인등록 통계 고향사랑기부제 안내 광주시 청년지원센터 「더누림 플랫폼」 8월 프로그램 홍보 - 일정 : 8.30.(수) 19:00~21:00   니트족 청년과 같이 무직 상태의 취업 및 교육 훈련을 받지 않은 취업 의사가 없는 청년의 사회 진입 지원 사업 - 일정 : 월 중 개인별 상시 운영   - 일정 : A반 8.14.(월) 16시~18시 // B반 8.14.(월) 19시~21시 - 사업 선정을 위한 정부지원사업 요목별 작성 방법 패밀리사이트 열기 닫기 패밀리사이트 열기 닫기 유관기관 및 시설단체 열기 닫기 유관기관 및 시설단체 열기 닫기 관련기관 사이트 열기 닫기 관련기관 사이트 열기 닫기 광주시 (12738) 경기도 광주시 행정타운로 50 광주시 페이스북 바로가기 광주시 카카오플러스 바로가기 광주시 블로그 바로가기 광주시 인스타그램 바로가기 광주시 유튜브 바로가기 광주시 광주시 노인등록 통계\'}, {\'url\': \'https://m.blog.naver.com/gjcityi/223058964353\', \'content\': \'청년 역량 향상 공간 \\\'더누림플랫폼\\\' : 네이버 블로그 본문 바로가기 카테고리 이동 광주시 공식 블로그 청년 역량 향상 공간 \\\'더누림플랫폼\\\' 광주시 공식블로그 이웃추가 본문 기타 기능 공유하기 ‘삶의 질 향상 되는 공간’ 2022년 7월 광주시에 청년지원센터가 문을 열었습니다. 공간 소개 청년 정보 소개 홈페이지에서는 일자리 및 교육, 주거 생활, 복지 문화, 참여 권리와 관련된 정보를 알 수 있습니다. 지식은 취업과 관련된 포토샵, 4차 산업 미디어, 퍼스널 진단, 법률, 드론, 바리스타 등 오픈 공간 및 독립 공간에 대해 신청 가능합니다. OA공간은 정보 검색, 복합기 및 제본기, 천공기, 코팅기, 재단기를 이용할 수 있습니다. 월~금 10:00~21:00 광주시 청년지원센터 더 누림 플랫폼경기도 광주시 광주대로55번길 21 2층 #광주시 댓글 1 공유하기 {""title"":""청년 역량 향상 공간 \\\'더누림플랫폼\\\'"",""source"":""https://blog.naver.com/gjcityi/223058964353"",""blogName"":""광주시 공.."",""domainIdOrBlogId"":""gjcityi"",""nicknameOrBlogId"":""광주시"",""logNo"":223058964353,""smartEditorVersion"":4,""meDisplay"":true,""lineDisplay"":true,""outsideDisplay"":true,""cafeDisplay"":true,""blogDisplay"":true} 댓글 1 공유하기 취소 이웃추가\'}]']",청년지원센터 더누림 플랫폼의 주관 기관은 경기도 광주시입니다. 이 정보는 저장된 데이터에서 확인할 수 있습니다.
청년지원센터 더누림 플랫폼 운영 광주의 신청 절차는 어떻게 되나요?,"['정책 이름: 청년지원센터 더누림 플랫폼 운영 광주', '신청 절차: 광주 청년지원센터 홈페이지 접']",광주 청년지원센터 홈페이지 접,"['[Document(metadata={\'name\': \'청년지원센터 더누림 플랫폼  운영 광주시 \', \'source\': \'..\\\\data\\\\policy_result.json\'}, page_content=\'기관:경기 광주시 정책 분야:일자리분야 지원 내용:  민간위탁 운영 사업 운영 기간:2024.1~12. 사업 신청 기간:상시 비고:2024.1.1.~2024.12.31. 연령:만 19세 ~ 39세 거주지 및 소득:  광주시 청년 누구나 신청 절차:  광주시 청년지원센터 홈페이지 신청 접수 심사 및 발표:  선착순 모집  선정자 개별 연락 주관 기관:  경기도 광주시 운영 기관:  광주시 청년지원센터 더누림플랫폼 \'), Document(metadata={\'name\': \'소셜믹스형 공공임대주택  청년주택 \', \'source\': \'..\\\\data\\\\policy_result.json\'}, page_content=\'기관:서울 금천구 정책 분야:주거분야 지원 내용:주거  자립기반이 취약한 청년층의 주거 공급 사업 신청 기간:미정 비고:수시 연령:만 19세 ~ 39세 거주지 및 소득:서울시 거주 공고문 필히 참고 신청 절차:모집공고를 통한 신청자 접수 주관 기관:금천구청 일자리청년과 운영 기관:02 2627 2587\'), Document(metadata={\'name\': \'청년 1 1 맞춤형 청년정책종합상담 자 모집 광진 \', \'source\': \'..\\\\data\\\\policy_result.json\'}, page_content=\'기관:서울 광진구 정책 분야:일자리분야 지원 내용:  진로  주거  마음건강  청년 일대일 맞춤형 정책상담  연계   대면 비대면 카카오톡  전화  화상채팅  상담    시 KU시네마테크 무료 영화쿠폰 증정 사업 신청 기간:상시 비고:연중 상시모집 연령:만 19세 ~ 39세 신청 절차:https   bit.ly 광진청년정책상담   선호 지역 청년센터  광진  선택 필수 기타 유익 정보:  심리정서 상담이 필요한  청년상담을  전문 상담 기관과 연계해드립니다.   긴급 위기 지원이 필요한 청년의  생활지원 긴급생활비  생필품  식료품    법률지원  의료지원 이 가능합니다. 문의   서울청년센터 광진 02 3409 3890 주관 기관:서울시 광진구청 운영 기관:서울청년센터 광진\'), Document(metadata={\'name\': \'면접정장 무료대여 사업 양주시 \', \'source\': \'..\\\\data\\\\policy_result.json\'}, page_content=\'기관:경기 양주시 정책 분야:일자리분야 지원 내용:면접정장 무료대여   남자   자켓  바지  셔츠  구두  벨트  넥타이   여자   자켓  스커트  바지  블라우스  구두 사업 신청 기간:상시 비고:2024.02.08 목  ~ 모집완료시까지 연령:만 19세 ~ 39세 신청 절차:온라인접수 청년센터 홈페이지 신청  기타 유익 정보:기타 자세한 모집요강  세부 내용은 상세페이지에서 내용을 참고하시기 바랍니다. 주관 기관:경기도 양주시 운영 기관:양주시청년센터\'), Document(metadata={\'name\': \'청년 마음건강 지원사업\', \'source\': \'..\\\\data\\\\policy_result.json\'}, page_content=\'기관:제주 정책 분야:복지.문화분야 지원 내용:  지원내용   대표 내용   지원 대상자  출생연도 기준 만 19세 이상 34세 이하 청년  소득 재산 기준 없음    우선지원대상  1순위 자립준비청년  보호연장아동  2순위 정신건강복지센터에서 연계 의뢰한 청년   시군구 담당자가 대상자의 자격 기준  여부 확인 후 예산 범위 내에서 자 선정   지원받을 수 있는 사항   전문심리상담  맞춤형  10회기     사전  사후검사 90분  각 1회   횟수에 포함    검사비용이 회기당 비용보다 적을  추가 상담   추가     전문심리상담   전문심리상담 맞춤형     1 1원칙  50분  총8회  종결상담 1회 마지막 상담 시    기간  기본 3개월 10회 이 원칙이며  재판정이 필요한  최대 12개월 지원  자립준비청년  보호연장아동 1순위 는 본인부담금이 면제   정신건강복지센터 연계자 2순위   일반청년 3순위 는 10% 본인부담금 A B형 택1  책정    A형    회당  가격 60 000원   정부지원금 54 000원 본인부담금 6 000원 B형    회당  가격 70 000원   정부지원금 63 000원 본인부담금 7 000원    기타 비고    는 월 4회  주 1회    개시일로부터 연속해서 하는 것이 원칙  자의 사정 으로 부득이하게 원칙과 달리 정하고자 하는   자와 기관 간 협의를  조정 후 가능 계약서 반영 필요    중도에 계약을 해지하고 기관을 변경한 자에 대해  변경 계약 시점으로 바우처 잔여기간만큼 연속적으로       횟수  시간은 사전 계약서에 반영  자가 원할   기관과 합의 과정 거쳐   횟수나 시간 연장할 수 있음  기관과 별도 계약 필요  추가부담은 본인부담  사업 신청 기간:2024년 01월01일 ~ 2024년 12월31일 비고:사업기간2024 01 01 ~ 2024 12 31 운영기간2024 01 01 ~ 2024 12 31 신청기간2024 01 01 ~ 2024 12 31 연령:만 19세 ~ 34세 신청 절차:  신청방법   오프라인 신청방법   주민록상 거주지 읍면동 주민센터에서 직접 방문    대상자 본인  친족  법정대리인  담당 공무원 직권 신청   사회보장급여 사회권 신청 변경 서    사회 자 준수사항 안내확인 동의서 제출   온라인 신청방법   복지로 로그인  신청 복지 신청 복지급여 신청 기타 청년마음건강지원  친족범위  배우자  8촌 이내의 혈족  4촌 이내의 인청  발급대상자가 심신미약  심신상실   발급대상자 동의 생략 가능  발급 담당 공무원이 직권 신청하는  시군구청장에게 보고  우선지원 대상자인   행복이음  기관발급 확인서를  확인 가능  사회보장급여 사회권  신청 변경 서 제1호 서식   사회 자 준수사항 안내확인 동의서 제2호 서식  주관 기관:행정시 제주시 주민복지과 서귀포시 주민복지과    제주시 주민복지과   서귀포시 주민복지과 운영 기관:행정시 제주시 주민복지과 서귀포시 주민복지과 \')], [{\'url\': \'https://m.blog.naver.com/gj-youth/223338290404\', \'content\': \'2024년 더 누림 플랫폼 홈페이지 개편! : 네이버 블로그 본문 바로가기 블로그 카테고리 이동 더 누림 플랫폼 2024년 더 누림 플랫폼 홈페이지 개편! 광주시 청년지원센터 이웃추가 본문 기타 기능 공유하기 2024년 더 누림 플랫폼 홈페이지가 더- 나은 환경에서, 광주시 청년이 프로그램을 신청하고 공간/물품을 이용할 수 있도록 첫 번째! 신청서 오 기재 및 광주시 청년여부 광주시 청년지원센터 이용을 희망하신다면 \\\'로그인&본인확인\\\' 필수이니 두 번째! 신청하신 프로그램과 공간, 물품을 확인할 수 있는 \\\'마이페이지\\\' 개설! 새롭게 개편된 더 누림 플랫폼에 더 나아진 센터가 #경기도 #광주시 #광주시청년지원센터 #더누림플랫폼 #누리온 #홈페이지 #변신 #편리하다 #깔끔하다 #광주시 댓글 0 공유하기 {""title"":""2024년 더 누림 플랫폼 홈페이지 개편!"",""source"":""https://blog.naver.com/gj-youth/223338290404"",""blogName"":""더 누림 플.."",""domainIdOrBlogId"":""gj-youth"",""nicknameOrBlogId"":""광주시 청년지원센터"",""logNo"":223338290404,""smartEditorVersion"":4,""meDisplay"":true,""lineDisplay"":true,""outsideDisplay"":true,""cafeDisplay"":true,""blogDisplay"":true} 이 블로그 홈 댓글 0 공유하기 광주시 청년지원센터(gj-youth) 님을 이웃추가하고 새글을 받아보세요 취소 이웃추가\'}, {\'url\': \'https://www.gjcity.go.kr/portal/bbs/view.do?bIdx=314711&ptIdx=1&mId=0201010000\', \'content\': ""새소식 | 알림마당 | 광주소식 | 광주시청 광주시 시립도서관 광주시 희망도시 행복광주 광주시 사회조사 광주시 노인등록 통계 광주시 여성통계 광주시 옴부즈만 광주시 응원가 광주시 청년지원센터 5월 프로그램 안내 광주시 청년지원센터입니다! - 지원대상 : 광주시 만19세~39세 (거주자 및 근무자)청년 누구나 가능 - 신청방법 : www.gj-youth.or.kr (광주시 청년지원센터\'누리집\')사이트 접속\\xa0\\xa0→ 원하는 프로그램 신청! 붙임\\xa0\\xa0광주시 청년지원센터 5월 프로그램 안내 1부. 패밀리사이트 열기 닫기 패밀리사이트 열기 닫기 유관기관 및 시설단체 열기 닫기 광주시 사회복지협의회 광주시 체육회 유관기관 및 시설단체 열기 닫기 관련기관 사이트 열기 닫기 관련기관 사이트 열기 닫기 광주시 (12738) 경기도 광주시 행정타운로 50 광주시 페이스북 바로가기 광주시 카카오플러스 바로가기 광주시 블로그 바로가기 광주시 인스타그램 바로가기 광주시 유튜브 바로가기 광주시 광주시 사회조사 광주시 노인등록 통계 광주시 여성통계 광주시 옴부즈만 광주시 응원가""}]']","광주시 청년지원센터의 더누림 플랫폼 운영에 대한 신청 절차는 다음과 같습니다:

1. **신청 대상**: 만 19세에서 39세까지의 광주시 거주 청년 누구나 신청할 수 있습니다.

2. **신청 방법**:
   - 광주시 청년지원센터 홈페이지에 접속합니다. ([홈페이지 링크](http://www.gj-youth.or.kr))
   - 원하는 프로그램을 선택하여 신청서를 작성합니다.

3. **신청 접수 및 심사**:
   - 신청은 상시 접수되며, 선착순 모집 방식으로 진행됩니다.
   - 선정된 신청자는 개별적으로 연락을 받게 됩니다.

4. **운영 기간**: 2024년 1월 1일부터 12월 31일까지 진행됩니다.

이 외에도 더 자세한 정보나 프로그램 내용에 대한 문의는 광주시 청년지원센터에 연락하시거나 홈페이지를 통해 확인하실 수 있습니다."
청년지원센터 더누림 플랫폼 운영 광주의 지원 대상 연령은 어떻게 되나요?,"['정책 이름: 청년지원센터 더누림 플랫폼 운영 광주', '연령: 만 19세 39세']",만 19세 39세,"['[Document(metadata={\'name\': \'청년지원센터 더누림 플랫폼  운영 광주시 \', \'source\': \'..\\\\data\\\\policy_result.json\'}, page_content=\'기관:경기 광주시 정책 분야:일자리분야 지원 내용:  민간위탁 운영 사업 운영 기간:2024.1~12. 사업 신청 기간:상시 비고:2024.1.1.~2024.12.31. 연령:만 19세 ~ 39세 거주지 및 소득:  광주시 청년 누구나 신청 절차:  광주시 청년지원센터 홈페이지 신청 접수 심사 및 발표:  선착순 모집  선정자 개별 연락 주관 기관:  경기도 광주시 운영 기관:  광주시 청년지원센터 더누림플랫폼 \'), Document(metadata={\'name\': \'인천광역시 청년미래센터\', \'source\': \'..\\\\data\\\\policy_result.json\'}, page_content=\'기관:인천 정책 분야:복지.문화분야 지원 내용:  초기 상담을  고립정도에  맞춤형  지원   공동생활  지원   가족지원 상담  자조모임   사업 신청 기간:상시 비고:상시 연령:만 19세 ~ 34세 거주지 및 소득:  대상   고립 은둔하고 있는 19~34세 인천 청년   출생년월 1989년8월~2005년12월 기준  35세 이상 39세 이하인 자 중 상담신청을 원하는  청년미래센터로 별도 문의 바랍니다. 주관 기관:인천광역시 복지정책과  보건복지부 운영 기관: 재 인천광역시사회원\'), Document(metadata={\'name\': \'찾아가는 청년정책 소통학교 전주 완주권역 \', \'source\': \'..\\\\data\\\\policy_result.json\'}, page_content=\'기관:전북 정책 분야:.권리분야 지원 내용:  권역별 지역 청년 네트워킹 장 마련  청년정책 발굴   청년정책 이해도 함양  정책제안 역량을 위한 지역청년정책발표 추진 사업 운영 기간:2024. 4. 25.  목  18 00~22 00 사업 신청 기간:상시 지원 규모(명):전주 완주권역 청년  관계자  30명 내외 비고:2024 04 04 목  ~ 상시 연령:만 19세 ~ 34세 참여 제한 대상:도내 청년정책에 관심 있는 지역 청년 누구나 30명 내외  신청 절차:  온라인신청 전북청년허브센터 홈페이지   jb2030.or.kr  주관 기관:전북청년허브센터 운영 기관:전북청년허브센터\'), Document(metadata={\'name\': \'울산 동구 청년 AI 가상  면접체험 사업\', \'source\': \'..\\\\data\\\\policy_result.json\'}, page_content=\'기관:울산 동구 정책 분야:일자리분야 지원 내용:  주요내용   취업을 준비하는 청년에게 AI 가상 면접 체험 지원 사업 운영 기간:  사업기간    24. 2. ~ 12. 사업 신청 기간:상시 연령:만 18세 ~ 39세 거주지 및 소득:  대 상   18세 ~ 39세 청년 신청 절차:  방법   온라인 신청  현장 방문  주관 기관:울산광역시 동구 일자리정책과 청년정책팀 052 209 3487  운영 기관:울산 동구 청년센터 052 209 3485 \'), Document(metadata={\'name\': \'청년 1 1 맞춤형 청년정책종합상담 자 모집 광진 \', \'source\': \'..\\\\data\\\\policy_result.json\'}, page_content=\'기관:서울 광진구 정책 분야:일자리분야 지원 내용:  진로  주거  마음건강  청년 일대일 맞춤형 정책상담  연계   대면 비대면 카카오톡  전화  화상채팅  상담    시 KU시네마테크 무료 영화쿠폰 증정 사업 신청 기간:상시 비고:연중 상시모집 연령:만 19세 ~ 39세 신청 절차:https   bit.ly 광진청년정책상담   선호 지역 청년센터  광진  선택 필수 기타 유익 정보:  심리정서 상담이 필요한  청년상담을  전문 상담 기관과 연계해드립니다.   긴급 위기 지원이 필요한 청년의  생활지원 긴급생활비  생필품  식료품    법률지원  의료지원 이 가능합니다. 문의   서울청년센터 광진 02 3409 3890 주관 기관:서울시 광진구청 운영 기관:서울청년센터 광진\')], [{\'url\': \'https://www.gjcity.go.kr/portal/bbs/view.do?bIdx=314711&ptIdx=1&mId=0201010000\', \'content\': ""새소식 | 알림마당 | 광주소식 | 광주시청 광주시 시립도서관 광주시 희망도시 행복광주 광주시 사회조사 광주시 노인등록 통계 광주시 여성통계 광주시 옴부즈만 광주시 응원가 광주시 청년지원센터 5월 프로그램 안내 광주시 청년지원센터입니다! - 지원대상 : 광주시 만19세~39세 (거주자 및 근무자)청년 누구나 가능 - 신청방법 : www.gj-youth.or.kr (광주시 청년지원센터\'누리집\')사이트 접속\\xa0\\xa0→ 원하는 프로그램 신청! 붙임\\xa0\\xa0광주시 청년지원센터 5월 프로그램 안내 1부. 패밀리사이트 열기 닫기 패밀리사이트 열기 닫기 유관기관 및 시설단체 열기 닫기 광주시 사회복지협의회 광주시 체육회 유관기관 및 시설단체 열기 닫기 관련기관 사이트 열기 닫기 관련기관 사이트 열기 닫기 광주시 (12738) 경기도 광주시 행정타운로 50 광주시 페이스북 바로가기 광주시 카카오플러스 바로가기 광주시 블로그 바로가기 광주시 인스타그램 바로가기 광주시 유튜브 바로가기 광주시 광주시 사회조사 광주시 노인등록 통계 광주시 여성통계 광주시 옴부즈만 광주시 응원가""}, {\'url\': \'https://www.welfarehello.com/community/hometownNews/c277bf64-6b8a-4da1-bbbc-420e42849b98\', \'content\': \'광주시 청년지원센터 「더누림 플랫폼」 6월 프로그램 안내 | 경기도 광주시 | 웰로 광주시 청년지원센터 「더누림 플랫폼」 6월 프로그램 안내 광주시 청년지원센터 더누림 플랫폼의 광주시 청년지원센터 『더 누림 플랫폼』더 많은 것을 누리며 다양한 기회를 찾아가는 광주시 청년 전용 공간 입니다. 광주시 청년지원센터 ☎ 031-8027-0371 {""title"":""광주시 청년지원센터 「더누림 플랫폼」 6월 프로그램 안내"",""source"":""https://blog.naver.com/gjcityi/223120745174"",""blogName"":""광주시 공.."",""blogId"":""gjcityi"",""domainIdOrBlogId"":""gjcityi"",""logNo"":223120745174,""smartEditorVersion"":4,""meDisplay"":true,""outsideDisplay"":true,""cafeDisplay"":true,""blogDisplay"":true,""lineDisplay"":true} #### 대전시 1500명 대상 2024년 하반기 청년월세 지급 24.12.24(화) 작성 #### #이벤트 국토교통부 <청년월세지원사업 영상 댓글 이벤트> 24.12.24(화) 작성 \\\'서울청년기지개센터\\\' 개소 24.12.19(목) 작성 \\\'2024 청년 취업 도전 프로젝트\\\' 발표회 개최 24.12.19(목) 작성 24.12.17(화) 작성 #### 제3회 광주시 청년지원센터 창업누림 로컬 창업 아이디어 공모전 24.12.16(월) 작성 #### 영화 \\\'다음, 소희\\\' 정주리 감독과 함께하는 토크콘서트 24.12.16(월) 작성 #### 가족돌봄 청년 지원 - 일상돌봄서비스 돌봄 부담 경감 24.12.16(월) 작성 24.12.16(월) 작성\'}]']",광주시 청년지원센터 더누림 플랫폼의 지원 대상 연령은 만 19세에서 39세까지입니다. 이 연령대의 광주시 거주 청년 누구나 신청할 수 있습니다.
아회복탄력성 개인심리상담 오산 정책의 주관 기관은 어디인가요?,"['정책 이름: 아회복탄력성 개인심리상담 오산', '기관:경기 오산', '정책 분야:복지.문화분야', '주관 기관:경기도 오산']",경기도 오산,"[""[Document(metadata={'name': '자아회복탄력성 개인심리상담 오산시 ', 'source': '..\\\\data\\\\policy_result.json'}, page_content='기관:경기 오산시 정책 분야:복지.문화분야 지원 내용:최초 신청후 상담사와 개별 일정을 조율하여 추가 상담진행 1회 50분씩 최대 6회    자아회복탄력성 향상을 위한 개인 심리상담   역경지수 회복과 대인관계 소통 향상   내면아이치유   마음챙김 인지행동   사업 신청 기간:상시 비고:사업기간   2024년 3월 26일~12월 중   매주 화 14 00~20 00 연령:만 19세 ~ 39세 거주지 및 소득:오산시에 거주  생활권으로 하는 19세~39세 청년 주관 기관:경기도 오산시 운영 기관:오산청년일자리지원센터 이루잡 031 8036 8046 '), Document(metadata={'name': '양산 청년 희망 하이패스 고립 은둔 청년  가족 회복지원 사업 ', 'source': '..\\\\data\\\\policy_result.json'}, page_content='기관:경남 양산시 정책 분야:복지.문화분야 지원 내용:  지원내용   1단계   심리 정서 활력 회복  예방   2단계   고립 해소 사회적 관계 형성   3단계   은둔 탈출 자립 성장 지원    전문상담  자기성장   전문상담 3회   취미  자기계발 4회   자기성장계획 3회    자립 성장 지원   청춘 장학금   1인당 20만원 30명 지원    청년 맞춤형 자립 일자리  구조  복지  정책    청년멘토매칭 친구 맺기    청년 동아리 지원 사업 신청 기간:2024년 05월01일 ~ 2024년 12월31일 연령:만 19세 ~ 39세 거주지 및 소득:  대상   양산시 거주 청년 19~39세 신청 절차:  신청   안내문 내 QR 코드   선발   고립 은둔 척도 작성 개별 통보 주관 기관:양산시   양산시 청년센터 청담 운영 기관:양산시 청년센터 청담 055 785 5123~5    웅상종합사회복지관 055 367 7616 '), Document(metadata={'name': '울주군 청년마음돌봄 1인 가구 자살예방사업  N 앤  혼자산다 ', 'source': '..\\\\data\\\\policy_result.json'}, page_content='기관:울산 울주군 정책 분야:복지.문화분야 지원 내용:  운영기관   울주군정신건강복지센터 울주군보건소 정신건강사업 수탁기관    사업내용   1인 가구 개별활동  체험 식사  운동  문화활동    운영   대학생  마인드스펙  자살예방교육 운영   편의점 자살예방 영상광고 송출  QR코드 활용 정신건강 자가검진   메타버스 활용  마인드커넥트  자살예방   9월 청년의 날 자살예방 행사 운영    사 업 비   3백만원 기금 1  시비 1  군비 1  사업 운영 기간:  사업기간    24. 1. ~ 12. 사업 신청 기간:상시 연령:만 19세 ~ 39세 거주지 및 소득:  사업대상   울주군 관내 청년 19세 ~ 39세  주관 기관:울주군보건소 의약건강팀 052 204 2732  운영 기관:울주군정신건강복지센터 052 262 1148 '), Document(metadata={'name': '서울시 청년동행센터', 'source': '..\\\\data\\\\policy_result.json'}, page_content='기관:서울 정책 분야:복지.문화분야 지원 내용:공적채무조정지원 개인회생 파산면책   공공재무상담  주거  일자리 복지 연계 1. 부채문제로 막막한 청년이라면    청년 채무상담   개인회생 파산 워크아웃  맞춤형 채무조정 상담   요건 충족 시 무료 법률지원  2. 나에게 꼭 맞는 돈 관리가 필요하다면    청년 재무코칭   1 1 맞춤형 재무상담  3. 청년을 위한 복지가 궁금하다면    주거  일자리  심리  복지정보   연계 사업 신청 기간:상시 연령:만 19세 ~ 39세 추가 단서 사항:  악성부채 채무조정상담  공공재무상담  일자리 주거 심리  복지 연계   모든 상담비용 무료 신청 절차:1644 0120 전화예약 홈페이지  서울금융복지상담센터     온라인 일반상담 예약  심사 및 발표:상시 주관 기관:복지정책실 운영 기관:서울시복지재단'), Document(metadata={'name': '청년마음건강지원사업 자 모집 양주시 ', 'source': '..\\\\data\\\\policy_result.json'}, page_content='기관:경기 양주시 정책 분야:복지.문화분야 지원 내용:  지원내용  3개월 간 총 10회의 전문심리상담    사전사후검사  개인 심리상담  필요한 검사를 통한 주된 문제  욕구 파악  회당 90분  사전 사후 각 1회   상담  맞춤형  1 1 원칙   심리 정서적 문제에  개입예방  관계상황적 스트레스 대처능력 향상   의사소통기술  대인관계 향상 도모  대상자 욕구에 맞춘    회당 50분  총 8회   종결상담  상담 종료 시 피드백  고위험군의  정신건강복지센터  의료기관 연계   1회   가격 1회당   인력 기준에  가격 차    A형  정부지원금 54 000원   본인부담금 6 000원  60 000원   일반적 심리문제를 겪고 있으나 정신건강  진료 에  부담감 없이 전문심리상담 를 받고자 하는      B형  정부지원금 63 000원 본인부담금 7 000원  70 000원   자립준비청년  보호연장아동  정신건강복지센터 방문자   욕구가 높거나 상대적으로 높은 수준의 상담 가 필요한    선택기준은 예시일 뿐  유형은 신청자가 선택 가능    유형은 인력의 자격기준에 의한 것으로  내용은 동일함   자립준비청년은  유형과  없이 본인부담금 면제  전액 지원  사업 신청 기간:미정 지원 규모(명):24명 비고:출생연도 기준  2024년 기준 출생일 1990. 1. 1. ~ 2005. 12. 31.까지 출생한 자 연령:만 19세 ~ 34세 신청 절차:  주민록상 거주지 읍 면 동 행정복지센터 방문신청   복지로 누리집 www.bokjiro.go.kr 과 모바일 앱  복지로   온라인 신청 신청절차   복지로 신청 복지신청 복지급여신청 청년마음건강지원  심사 및 발표:개별 통보 선정자  제출 서류:  사회보장급여 사회 권  신청 변경  신청서 행정복지센터 비치    사회 자 준수사항 안내확인 동의서 행정복지센터 비치    개인정보 수집   제3자  동의서 행정복지센터 비치    신청인 신분증   우선순위 증명자료 자립준비청년만     시군구  기관 시설  가정위탁지원센터 에서 발급한 보호 종료 확인서   바우처 카드 안내   국민행복카드 신용 체크    카드사 영업점 은행  우체국  카드센터  방문  홈페이지  콜센터를  신청하거나  읍면동에서  신청 시 카드사 콜센터 발급상담 전화를 함께 신청   기존 바우처 카드 보유자는 신청할 필요 없음 기타 유익 정보:  문의처   로이심리상담센터 청년마음건강 A B형   031 824 5400   소풍아동청소년 심리상담센터 청년마음건강 A B형   031 867 2027   숲속마을희망센터협동조합 청년마음건강 A B형   031 855 3455    율하모니 청년마음건강 A형   031 867 9872   테이크10아동발달센터 청년마음건강 A B형   031 928 5441 주관 기관:양주시청 운영 기관:로이심리상담센  소풍아동청소년 심리상담센터  숲속마을희망센터협동조합   율하모니 테이크10아동발달센터')], [{'url': 'https://youth.seoul.go.kr/infoData/youthPlcyInfo/view.do?key=2309160001&plcyBizId=R2024032521046', 'content': '자아회복탄력성 개인심리상담(오산시). 사업개요. 사업개요에 대한 상세내용입니다. 정책 유형, 복지.문화, 주관 기관, 경기도 오산시. 정책 소개, 오산시'}, {'url': 'https://www.designdb.com/usr/upload/board/zboardphotogallery249/20220406104034772_5268.0.pdf', 'content': '조사 내용은 포장산업 진흥정책 수립의. 좋은 기초자료로도 활용될 ... 수출은 해외시장의 구매력이 회복・. 증가되고,수출시장 다변화를 위한.'}]""]","오산시의 ""자아회복탄력성 개인심리상담"" 사업의 주관 기관은 경기도 오산시입니다. 이 프로그램은 오산청년일자리지원센터에서 운영됩니다."
아회복탄력성 개인심리상담 오산 정책의 지원 내용은 무엇인가요?,"['정책 이름: 아회복탄력성 개인심리상담 오산', '지원 내용:최초 상담사와 일정을 조율하여 상담진행 1회 50분씩 최대 6회 아회복탄력성 향상을 위한 개인 심리상담 역경지 회복과 대인관계 소통 향상 내면아이치유 마음챙김 인지행동']","최초 상담사와 일정을 조율하여 상담진행 1회 50분씩 최대 6회, 아회복탄력성 향상을 위한 개인 심리상담, 역경지 회복과 대인관계 소통 향상, 내면아이치유, 마음챙김 인지행동","['[Document(metadata={\'name\': \'자아회복탄력성 개인심리상담 오산시 \', \'source\': \'..\\\\data\\\\policy_result.json\'}, page_content=\'기관:경기 오산시 정책 분야:복지.문화분야 지원 내용:최초 신청후 상담사와 개별 일정을 조율하여 추가 상담진행 1회 50분씩 최대 6회    자아회복탄력성 향상을 위한 개인 심리상담   역경지수 회복과 대인관계 소통 향상   내면아이치유   마음챙김 인지행동   사업 신청 기간:상시 비고:사업기간   2024년 3월 26일~12월 중   매주 화 14 00~20 00 연령:만 19세 ~ 39세 거주지 및 소득:오산시에 거주  생활권으로 하는 19세~39세 청년 주관 기관:경기도 오산시 운영 기관:오산청년일자리지원센터 이루잡 031 8036 8046 \'), Document(metadata={\'name\': \'양산시 경남사회복지공동모금회 지원 은둔고립청년 사업 자 모집\', \'source\': \'..\\\\data\\\\policy_result.json\'}, page_content=\'기관:경남 양산시 정책 분야:복지.문화분야 지원 내용:  선발된 은둔 고립 청년 지원 내용    자기성장 계획서 작성    대상자가 희망하는 꿈  꿈은 직업이 아니라도 됨 ex  사람들 앞에서 말을 잘 하고 싶다 도 꿈으로 들어감    자기성장 계획서에  실천 지원    1 1 맞춤형 지원. 자가 희망 시 전문 임상심리 상담사 무료 지원    양산시 내 다양한 청년 자원연계    대상자가 원하는 곳에 마음쉼터 운영 예정  양산시의 청년지원 자원 체계 연계하여  무료 로 진행 사업 신청 기간:2024년 02월19일 ~ 2024년 12월31일 비고:2024 02 19 09 00 ~ 2024 12 31 18 00 연령:만 19세 ~ 39세 학력:고졸 미만 고교 재학 고졸 예정 고교 졸업 대학 재학 대졸 예정 대학 졸업 석 박사 전공:인문계열 사회계열 상경계열 이학계열 공학계열 예체능계열 농산업계열 취업 상태:재직자 자영업자 미취업자 프리랜서 일용근로자 창업자 단기근로자 영농종사자 특화 분야:중소기업 여성 저소득층 장애인 농업인 군인 지역인재 신청 절차:  링크 클릭   링크에 들어가서 자가 척도 작성시 추첨을  100명에게 5천원 상당의 기프티콘을  주관 기관:경남사회복지공동모금회 운영 기관:웅상종합사회복지관\'), Document(metadata={\'name\': \'울산 동구 청년 마음건강 사업\', \'source\': \'..\\\\data\\\\policy_result.json\'}, page_content=\'기관:울산 동구 정책 분야:복지.문화분야 지원 내용:  주요내용   정신건강 캠페인  자살예방 교육   정신건강 스크리닝 검진   상담     자살 고위험군 록 사례관리  정신건강 의료비 상담비 지원 사업 운영 기간:  사업기간    24. 1. ~ 12. 사업 신청 기간:상시 연령:만 18세 ~ 39세 거주지 및 소득:  대 상   동구 거주 18세 ~ 39세 청년 주관 기관:울산광역시 동구 건강관리과 치매정신팀 052 209 6943  운영 기관:주관기관과 동일\'), Document(metadata={\'name\': \'산재근로자 사회심리 재활 지원\', \'source\': \'..\\\\data\\\\policy_result.json\'}, page_content=\'기관:고용노동부 정책 분야:복지.문화분야 지원 내용:   심리상담   의료기관에서 실시하는 다차원 심리검사 지원  전문기관을 통한 집중 심리상담 지원    희망 찾기 사회 적응     희망찾기   4회기  6회기의 심리안정 지원     사회적응   1~3개월 간 심리안정  사회  직업능력 지원      재활스포츠  1인당 월 10만원 범위 내에서 3개월 간 지원    취미 활동반  1인당 월 8만원 범위 내에서 취미활동반 실비 지원    멘토링   멘토에게 활동 비용  교통비  식대 지원 사업 신청 기간:상시 비고:예산의 범위에서 수시 모집 거주지 및 소득:   심리상담   산재노동자  유족연금수급자격자  간병급여  상병보상연금 수급권자의 배우자 자녀    희망 찾기 사회 적응     희망 찾기    입원  통원  산재노동자   사회 적응    장해급 제1 14급 판정을 받은 자 장해판정을 받은 날로부터 5년 이내   2년 이상 통원 요양  자    재활스포츠  치료 종결이 임박한 통원 요양환자 중 장해가 남을 것이 예상되는 사람  산재 장해인 장해급 제 1~14급     취미 활동반  진폐증  진행성 질병으로 입원요양  산재노동자    멘토링   사회심리 재활이 필요한 자  잡코디네이터나 사회복지사 추천자  특화 분야:중소기업 저소득층 장애인 신청 절차:  근로복지공단  지사에 방문  우편  fax 신청 제출 서류:   공통  사회심리재활  신청서  재활스포츠 신청서  멘토링 멘티신청서 개별 제출    각 사업별 비용 청구서  증빙 자료 일체  심리상담  심리상담 비용청구서  출석확인 카드   희망찾기  희망찾기 사업계획서  진행일지  운영비용 청구서  교통비 청구내역서   사회적응  사업계획 승인  지원금 지급 신청서  정산서   재활스포츠  지원금청구서  출석관리대장   멘토링  활동비용  청구서  주관 기관:근로복지공단 재활보상부 운영 기관:근로복지공단 재활보상부\'), Document(metadata={\'name\': \'서울시 청년동행센터\', \'source\': \'..\\\\data\\\\policy_result.json\'}, page_content=\'기관:서울 정책 분야:복지.문화분야 지원 내용:공적채무조정지원 개인회생 파산면책   공공재무상담  주거  일자리 복지 연계 1. 부채문제로 막막한 청년이라면    청년 채무상담   개인회생 파산 워크아웃  맞춤형 채무조정 상담   요건 충족 시 무료 법률지원  2. 나에게 꼭 맞는 돈 관리가 필요하다면    청년 재무코칭   1 1 맞춤형 재무상담  3. 청년을 위한 복지가 궁금하다면    주거  일자리  심리  복지정보   연계 사업 신청 기간:상시 연령:만 19세 ~ 39세 추가 단서 사항:  악성부채 채무조정상담  공공재무상담  일자리 주거 심리  복지 연계   모든 상담비용 무료 신청 절차:1644 0120 전화예약 홈페이지  서울금융복지상담센터     온라인 일반상담 예약  심사 및 발표:상시 주관 기관:복지정책실 운영 기관:서울시복지재단\')], [{\'url\': \'https://www.dailian.co.kr/news/view/1342387/\', \'content\': ""\'오산청년 마음돌보기\' 프로그램은 전문심리상담사와 자아 회복 탄력성을 위한 1:1 개인 심리상담 관계회복을 위한 집단 그룹상담 심리검사(기질""}, {\'url\': \'https://m.blog.naver.com/irujob/223383138333\', \'content\': \'2024 [오산청년 마음 돌보기] 자아회복탄력성 개인심리상담 : 네이버 블로그 카테고리 이동 오산청년일자리지원센터 이루잡 ※최초 신청 후 상담사와 개별 일정을 조율하여 추가 상담 진행(1회 50분씩 최대 6회) 26.(화) ~ 12월 중 매주 화요일 14:00 ~ 20:00 ▶모집기간 : 3월 18일 (월) ~ 12월 종료 시까지 (상시) ▶참여인원 : 일 최대 6명 ▶최초 신청 후 상담사와 개별 일정을 조율하여 추상담 가능합니다.(1회 50분씩 최대 6회) ▶ 유의사항 1. 신청 취소를 원하실 경우, 상담 일자 전날 15시까지 이루잡으로 연락 부탁드립니다. 2. 당일 취소 및 지각은 노쇼로 간주되어 다음 프로그램 신청 시 선발에 불이익이 있을 수 있습니다. \\u200b▶최초 신청 후 상담사와 개별 일정을 조율하여 추가 상담 진행(1회 50분씩 최대 6회) 다음 이루잡 프로그램 신청 시 선발에 불이익이 있을 수 있습니다. {""title"":""2024 [오산청년 마음 돌보기] 자아회복탄력성 개인심리상담"",""source"":""https://blog.naver.com/irujob/223383138333"",""blogName"":""오산청년일.."",""domainIdOrBlogId"":""irujob"",""nicknameOrBlogId"":""이루잡"",""logNo"":223383138333,""smartEditorVersion"":4,""outsideDisplay"":true,""cafeDisplay"":true,""meDisplay"":true,""lineDisplay"":true,""blogDisplay"":true}\'}]']","오산시의 '자아회복탄력성 개인심리상담' 프로그램은 청년들을 위해 제공되는 심리 상담 서비스입니다. 이 프로그램의 주요 지원 내용은 다음과 같습니다:

1. **개인 심리상담**: 전문 상담사와 1:1로 진행되는 개인 심리상담을 통해 자아 회복 탄력성을 향상시키는 데 중점을 둡니다.

2. **상담 진행**: 최초 신청 후 상담사와 개별 일정을 조율하여 추가 상담을 진행할 수 있으며, 상담은 1회 50분씩 최대 6회까지 가능합니다.

3. **상담 시간**: 상담은 매주 화요일 오후 2시부터 8시까지 진행됩니다.

4. **대상**: 만 19세에서 39세 사이의 오산시에 거주하는 청년들이 참여할 수 있습니다.

5. **신청 기간**: 이 프로그램은 상시 신청이 가능하며, 2024년 3월 26일부터 12월 중까지 운영됩니다.

6. **연락처**: 상담 관련 문의는 오산청년일자리지원센터 '이루잡'으로 연락하면 됩니다 (전화: 031-8036-8046).

이 프로그램은 역경지수 회복, 대인관계 소통 향상, 내면아이 치유 및 마음챙김 인지행동을 통해 청년들의 심리적 안정을 돕는 것을 목표로 하고 있습니다."
아회복탄력성 개인심리상담 오산 정책의 운영 기관은 어디인가요?,"['정책 이름: 아회복탄력성 개인심리상담 오산', '운영 기관:오산청년일리지원센터 이루잡 031 8036 8046']",오산청년일리지원센터 이루잡,"['[Document(metadata={\'name\': \'자아회복탄력성 개인심리상담 오산시 \', \'source\': \'..\\\\data\\\\policy_result.json\'}, page_content=\'기관:경기 오산시 정책 분야:복지.문화분야 지원 내용:최초 신청후 상담사와 개별 일정을 조율하여 추가 상담진행 1회 50분씩 최대 6회    자아회복탄력성 향상을 위한 개인 심리상담   역경지수 회복과 대인관계 소통 향상   내면아이치유   마음챙김 인지행동   사업 신청 기간:상시 비고:사업기간   2024년 3월 26일~12월 중   매주 화 14 00~20 00 연령:만 19세 ~ 39세 거주지 및 소득:오산시에 거주  생활권으로 하는 19세~39세 청년 주관 기관:경기도 오산시 운영 기관:오산청년일자리지원센터 이루잡 031 8036 8046 \'), Document(metadata={\'name\': \'양산 청년 희망 하이패스 고립 은둔 청년  가족 회복지원 사업 \', \'source\': \'..\\\\data\\\\policy_result.json\'}, page_content=\'기관:경남 양산시 정책 분야:복지.문화분야 지원 내용:  지원내용   1단계   심리 정서 활력 회복  예방   2단계   고립 해소 사회적 관계 형성   3단계   은둔 탈출 자립 성장 지원    전문상담  자기성장   전문상담 3회   취미  자기계발 4회   자기성장계획 3회    자립 성장 지원   청춘 장학금   1인당 20만원 30명 지원    청년 맞춤형 자립 일자리  구조  복지  정책    청년멘토매칭 친구 맺기    청년 동아리 지원 사업 신청 기간:2024년 05월01일 ~ 2024년 12월31일 연령:만 19세 ~ 39세 거주지 및 소득:  대상   양산시 거주 청년 19~39세 신청 절차:  신청   안내문 내 QR 코드   선발   고립 은둔 척도 작성 개별 통보 주관 기관:양산시   양산시 청년센터 청담 운영 기관:양산시 청년센터 청담 055 785 5123~5    웅상종합사회복지관 055 367 7616 \'), Document(metadata={\'name\': \'울주군 청년마음돌봄 1인 가구 자살예방사업  N 앤  혼자산다 \', \'source\': \'..\\\\data\\\\policy_result.json\'}, page_content=\'기관:울산 울주군 정책 분야:복지.문화분야 지원 내용:  운영기관   울주군정신건강복지센터 울주군보건소 정신건강사업 수탁기관    사업내용   1인 가구 개별활동  체험 식사  운동  문화활동    운영   대학생  마인드스펙  자살예방교육 운영   편의점 자살예방 영상광고 송출  QR코드 활용 정신건강 자가검진   메타버스 활용  마인드커넥트  자살예방   9월 청년의 날 자살예방 행사 운영    사 업 비   3백만원 기금 1  시비 1  군비 1  사업 운영 기간:  사업기간    24. 1. ~ 12. 사업 신청 기간:상시 연령:만 19세 ~ 39세 거주지 및 소득:  사업대상   울주군 관내 청년 19세 ~ 39세  주관 기관:울주군보건소 의약건강팀 052 204 2732  운영 기관:울주군정신건강복지센터 052 262 1148 \'), Document(metadata={\'name\': \'청년마음건강지원사업 자 모집 고양시 \', \'source\': \'..\\\\data\\\\policy_result.json\'}, page_content=\'기관:경기 고양시 정책 분야:복지.문화분야 지원 내용:  지원내용  3개월 간 총 10회의 전문심리상담    사전사후검사  개인 심리상담  필요한 검사를 통한 주된 문제  욕구 파악  회당 90분  사전 사후 각 1회   상담  맞춤형  1 1 원칙   심리 정서적 문제에  개입예방  관계상황적 스트레스 대처능력 향상   의사소통기술  대인관계 향상 도모  대상자 욕구에 맞춘    회당 50분  총 8회   종결상담  상담 종료 시 피드백  고위험군의  정신건강복지센터  의료기관 연계   1회    가격 1회당   인력 기준에  가격 차    A형  정부지원금 54 000원   본인부담금 6 000원  60 000원   일반적 심리문제를 겪고 있으나 정신건강  진료 에  부담감 없이 전문심리상담 를 받고자 하는      B형  정부지원금 63 000원 본인부담금 7 000원  70 000원   자립준비청년  보호연장아동  정신건강복지센터 방문자   욕구가 높거나 상대적으로 높은 수준의 상담 가 필요한    자립준비청년  보호연장아동은  유형에 관계없이 본인부담금 면제   전액 지원    유형 A형  B형 은 신청자가 선택 사업 신청 기간:미정 지원 규모(명):40명 비고:  청년마음건강지원 사업종료예정으로 하반기 모집계획 없음. 연령:만 19세 ~ 34세 추가 단서 사항:  우선지원 대상    1순위  자립준비청년  보호연장아동    2순위  정신건강복지센터 연계    그 외  1  2순위 모집인원 미달 시 성비 고려 어느 한 성이 70%를 초과하지 못함   연장자 우선 신청 절차:주민록상 거주지 동 행정복지센터 방문신청  신분증 지참  심사 및 발표:2024. 2. 21. 수  이후 기우편 발송 예정 제출 서류:  구비서류 우선지원 대상자만 제출    자립준비청년  시군구  기관 발급 보호종료확인서   보호연장아동  시설확인서  위탁확인서 기타 유익 정보:  문의   고양시 민원콜센터   031 909 9000    고양시 복지정책과   031 8075 3494    동 행정복지센터 청년마음건강지원사업 담당자 주관 기관:고양시 운영 기관: 기관\'), Document(metadata={\'name\': \'직업 트라우마 센터 운영\', \'source\': \'..\\\\data\\\\policy_result.json\'}, page_content=\'기관:고용노동부 정책 분야:복지.문화분야 지원 내용:  전문가 상담  사후관리   사고충격에  심리안정 지속관리   외상 후 스트레스 장애 예방   직 간접 사고 피해자의 심리 안정   일상 직장생활 복귀 도모   필요 시 전문치료 연계 사업 운영 기간:연중 사업 신청 기간:상시 추가 단서 사항:사건을 직접 경험한 피해자 뿐만 아니라 사고를 목격한 사람  1차 피해자의 가족이나 친구  희생자의 유족  사건에 책임이 있다고 생각하는 사람  경찰 소방관  응급직에 종사 사고수습  업무 담당자 하는 사람  신청 절차:전국 직업트라우마센터 대표번호   1588 6497 주관 기관:고용노동부 운영 기관: 산업재해예방 안전보건공단\')], [{\'url\': \'https://www.kgnews.co.kr/news/article.html?no=786648\', \'content\': ""오산시, \'오산청년 마음돌보기\' 프로그램 운영 정치 인사 정치 인사 오산시, \'오산청년 마음돌보기\' 프로그램 운영 지명신 기자 msj@kgnews.co.kr ▲ 오산청년 마음돌보기 프로그램 홍보포스터. (사진=오산시 제공) 이번 ‘오산청년 마음돌보기’ 프로그램은 전문심리상담사와 ▲자아 회복 탄력성을 위한 1:1 개인 심리상담 ▲관계회복을 위한 집단 그룹상담 ▲심리검사(기질검사, 투사검사, 성격검사 등)를 통해 청년들의 심리·정서 지원을 돕는다. 한편, ‘오산청년 마음돌보기’는 오산 청년(19~39세) 누구나 참여할 수 있으며, 프로그램 참여 및 상세내용은 이루잡 블로그 및 오산청년 SNS 등을 통해 확인할 수 있고 이루잡으로 문의하면 된다. [ 경기신문 = 지명신 기자 ] 저작권자 © 경기신문 무단전재 및 재배포 금지 정치 우원식-경제단체장 비상간담회…“美·日·中·EU 의원 특사단 파견” 정치 윤석열 대통령 비상계엄 사태, ‘탄핵 찬성’ 73.6%, ‘내란죄 해당’ 69.5% 경기신문 모든 콘텐츠(영상,기사, 사진)는 저작권법의 보호를 받은바, 무단 전재와 복사, 배포 등을 금합니다.""}, {\'url\': \'http://www.osanilbo.com/32696\', \'content\': ""시작페이지로\\u3000l\\u3000즐겨찾기\\u3000l\\u3000RSS\\u3000l\\u3000편집 2024.12.26 [15:29] 전체기사\\u3000l\\u3000로그인\\u3000l\\u3000회원가입 오산시는 7월 1일부터 우울 및 불안으로 정서적 어려움이 있는 시민을 대상으로 전문 심리상담 서비스(바우처)를 제공하는 ‘전국민 마음투자 지원사업’을 시행한다고 밝혔다. 사업 첫해인 올해는 ▲정신건강복지센터, 대학교 상담센터, 청소년상담복지센터, Wee센터, 정신의료기관 등에서 심리상담이 필요하다고 인정하는 자 ▲국가 건강검진에서 중간 정도 이상의 우울이 확인된 자 ▲자립준비청년 및 보호연장아동 등을 대상으로 운영된다. 서비스 유형은 제공 인력의 자격에 따라 1급, 2급 유형으로 구분되며, 이용 요금은 1급 유형 8만원, 2급 유형 7만원이다. 이용자는 회당 이용 가격에서 정부지원금(4만 9000천원 ~ 8만원)을 제외한 차액을 기준 중위소득에 따라 본인부담금(면제 ~ 2만 4000천원)을 납부해야 한다. 댓글 댓글 작성 시 상대방에 대한 배려와 책임을 담아주세요. [포터] 경기 여주시 \'2023\'오곡나루축제\'개최 안성시, 2025년 적십자 특별회비 전달 Copyright ⓒ 오산일보.""}]']","자아회복탄력성 개인심리상담 오산시 정책의 운영 기관은 ""오산청년일자리지원센터 이루잡""입니다. 이 기관은 상담사와 개별 일정을 조율하여 청년들에게 심리상담 서비스를 제공하고 있으며, 상담은 최대 6회까지 진행됩니다."
울산 희망상가 품은 청년희망주택 건립 정책의 사업 운영 기간은 언제부터 언제까지인가요?,"['정책 이름: 울산 희망상가 품은 청년희망주택 건립', '사업 운영 기간: 사업기간 2019. 8. 2024. 1.']",2019년 8월부터 2024년 1월까지입니다.,"['[Document(metadata={\'name\': \'울산 신축 매입약정형 임대주택 공급사업\', \'source\': \'..\\\\data\\\\policy_result.json\'}, page_content=\'기관:울산 정책 분야:주거분야 지원 내용:  위 치   울산광역시 전역 대학가  교통편의지역  주거선호도가 높은 지역    규 모   임대주택 120호 청년 80호  신혼부부 40호     사 업 비   20 400백만원 국 7 320   기 9 800   시 3 280  사업 운영 기간:  사업기간   2024. 1. ~ 2025. 7. 사업 신청 기간:상시 연령:만 18세 ~ 39세 주관 기관:울산광역시 건축정책과 주거지원팀 052 229 4413  운영 기관:주관기관과 동일\'), Document(metadata={\'name\': \'울산 북구 매곡산업단지 내 행복주택 공급 지원\', \'source\': \'..\\\\data\\\\policy_result.json\'}, page_content=\'기관:울산 북구 정책 분야:주거분야 지원 내용:  사업주체   울산광역시  한국토지주택공사   위 치   매곡동 884 5번지 매곡3일반산업단지 내    사업규모   대지 2 734.1  시유지  연면적 16 234.62   지상 17층   세 대 수   행복주택 144세대 청년주택 129세대  전체새대 90%    총사업비   28 508백만원 국비 6 067  시비 6 957  기융 8 089  LH 7 395  사업 운영 기간:  사업기간    19. 4. ~  26. 8. 사업 신청 기간:상시 연령:만 19세 ~ 39세 주관 기관:울산광역시 북구 건축정책과 주택허가팀 052 214 8022  운영 기관:울산광역시  한국토지주택공사\'), Document(metadata={\'name\': \'울산 동구 청년노동자 공유주택 조성사업\', \'source\': \'..\\\\data\\\\policy_result.json\'}, page_content=\'기관:울산 동구 정책 분야:주거분야 지원 내용:  지원내용   임대보증금  임대료 일부 지원   사업예산   고향사량기부금 지정기금   공급유형   민 관 협약을 통한 임대형 공유주택 공급   공급물량   2026년까지 오피스텔 57호 임대 공급 사업 운영 기간:  기 간    23. ~ 계속사업 사업 신청 기간:상시 연령:만 18세 ~ 39세 거주지 및 소득:  대 상   18세 이상 39세 이하 무주택 청년노동자 주관 기관:울산광역시 동구 건축주택과 주택허가팀 052 209 3792  운영 기관:주관기관과 동일\'), Document(metadata={\'name\': \'울산 중구 청년 주거상담소 지정 운영\', \'source\': \'..\\\\data\\\\policy_result.json\'}, page_content=\'기관:울산 중구 정책 분야:주거분야 지원 내용:  지원금액   전 월세 환산보증금 보증금  월차임 100   7 000만원 이하 주택 임대차 계약 시 임차인의 중개 수수료 50% 감면 사업 운영 기간:  사업기간    24. 1. ~ 12.   2019년 중구지회 협약에  연장 사업 신청 기간:상시 연령:만 18세 ~ 34세 거주지 및 소득:  지원대상   중구에 거주 생활  전입예정인 18세 ~ 34세 이하 청년 신청 절차:  방법   재능기부 한 공인중개사 문의 후 신청   중개업소 목록   울산광역시 중구 홈페이지 참고 주관 기관:울산광역시 중구청 민원지적과 052 290 3485  운영 기관:주관기관과 동일\'), Document(metadata={\'name\': \'울산 남구 1사 1청년 채용사업\', \'source\': \'..\\\\data\\\\policy_result.json\'}, page_content=\'기관:울산 남구 정책 분야:일자리분야 지원 내용:  사업내용   남구 중소기업협의회와 MOU체결  1사 1청년 취업 연계 사업 운영 기간:2024. 3. ~ 12 사업 신청 기간:상시 연령:만 19세 ~ 39세 거주지 및 소득:  대상   남구 거주 19세 ~ 39세 이하 미취업 청년 주관 기관:울산광역시 남구 일자리정책과 청년정책팀 052 226 3122  운영 기관:주관기관과 동일\')], [{\'url\': \'https://www.yna.co.kr/view/AKR20221128006800057\', \'content\': ""울산 성안동에 청년희망주택 기공…창업 지원 상가도 갖춰 | 연합뉴스 영상 울산 성안동에 청년희망주택 기공…창업 지원 상가도 갖춰 이 뉴스 공유하기 닫기 카카오톡 페이스북 X 카카오 울산 성안동에 청년희망주택 기공…창업 지원 상가도 갖춰 울산시는 28일 중구 성안동에서 \'희망상가를 품은 청년희망주택\' 기공식을 열었다. 이 뉴스 공유하기 닫기 카카오톡 페이스북 X 카카오 울산 \'희망상가를 품은 청년희망주택\' 투시도[울산시 제공. (울산=연합뉴스) 김근주 기자 = 울산시는 28일 중구 성안동에서 \'희망상가를 품은 청년희망주택\' 기공식을 열었다. 울산시는 청년층 주거 안정과 주거 만족도 향상을 위해 남구 신정동, 중구 태화동 등에 2026년까지 사업비 410여억원을 들여서 청년희망주택 200호를 건설할 계획이다. 2024년 준공 울산 신정동 청년희망주택 건축설계 당선작 선정 제보는 카카오톡 okjebo <저작권자(c) 연합뉴스, 무단 전재-재배포, AI 학습 및 활용 금지> 2022/11/28 15:03 송고 영상 영상 기사   영상 기사   영상 기사   영상""}, {\'url\': \'https://www.ohmynews.com/NWS_Web/View/at_pg.aspx?CNTN_CD=A0002989780\', \'content\': \'울산 \\\'36호 성안동 청년희망주택\\\' 완공...\\\'시장 공약 이행\\\' - 오마이뉴스 오마이뉴스 이용가이드 모바일 이용안내 ▲ 2022년 11월 28일 울산 중구 성안동에서 열린 희망상가를 품은 청년희망주택 기공식. 김 시장 당선 후 울산광역시는 ""민선8기 이내에 430여 억 원을 들여 청년희망주택 8개소 220호를 공급한다""고 밝혔고\\xa0그 첫 사업으로 김 시장 취임 약 5개월 후인 지난해 11월 28일 중구 성안동에 \\\'희망상가를 품은 청년희망주택\\\'을 착공했다. 공약인 청년희망주택 중 첫 사례인\\xa0\\\'희망상가를 품은 청년희망주택\\\'은 지하 1층, 지상 4층, 연면적 1천800㎡ 규모에 창업지원 상가 2호와 희망주택 36호로 구성돼 청년들이 자유롭게 소통하면서 정보를 나눌 수 있도록 공사를 진행했고 1년 만인 최근 준공했다. 이 사업에 이어 울산시는 2024년 1월 38호 규모의 \\\'남구 신정동 청년희망주택\\\'을 착공할 예정이다. 한편 울산시가 입주자 모집에 나선 성안동 청년희망주택의 우선공급은 입주자 모집 공고일 기준(2023년 12월 28일) 무주택자로서 울산시에 거주하는 청년이면서 일정요건을 갖추면 가능하다. 추천1 댓글 스크랩 페이스북 트위터 공유\'}]']","울산 '희망상가를 품은 청년희망주택' 건립 정책의 사업 운영 기간은 2022년 11월 28일에 착공하여, 2024년 1월에 38호 규모의 '남구 신정동 청년희망주택' 착공을 예정하고 있으며, 전체 사업이 2026년까지 진행될 계획입니다."
울산 희망상가 품은 청년희망주택 건립 정책의 지원 대상 연령은 어떻게 되나요?,"['정책 이름: 울산 희망상가 품은 청년희망주택 건립', '연령: 만 18세 39세']",만 18세부터 39세까지입니다.,"['[Document(metadata={\'name\': \'주택 안심계약 도움 \', \'source\': \'..\\\\data\\\\policy_result.json\'}, page_content=\'기관:충남 정책 분야:주거분야 지원 내용:  청년 맞춤형 부동산 전문상담  집보기 동행  사업 운영 기간:  2024 01 01~2024 12 31 사업 신청 기간:상시 비고:  상시 연령:만 19세 ~ 45세 거주지 및 소득:  충남거주  거주예정 청년 연령은 시군 사정에  다름  신청 절차:  온라인 예정   유선신청 심사 및 발표:  신청자 개별 통지 유선   주관 기관:  충청남도 운영 기관:  15개 시군\'), Document(metadata={\'name\': \'청년안심주택 공급 매입 \', \'source\': \'..\\\\data\\\\policy_result.json\'}, page_content=\'기관:서울 정책 분야:주거분야 지원 내용:역세권 간선도로변 의 민간소유 토지를 체계적으로 개발 민간 주도 공공 지원 하여 쾌적하고 저렴한 주택을 공급함으로써 청년층의 주거안정을 도모하고 지역경제를 활성화하고자 함. 사업 신청 기간:상시 지원 규모(명):8 184실 공공 2 216실  민간 5 968실  비고:연간 상시   공고문 필히 참고 요망 연령:만 19세 ~ 39세 기타 유익 정보:  공공임대 문의   1600 3456   청년안심주택의 원활한 공급  운영을 위하여 사업자  입주자를 대상으로 종합적인 컨설팅  상담 지원 주관 기관:전략주택공급과 운영 기관:전략주택공급과\'), Document(metadata={\'name\': \' 제주특별자치도  제주특별자치도개발공사  한국토지주택공사 2024년 매입 임대주택 공급\', \'source\': \'..\\\\data\\\\policy_result.json\'}, page_content=\'기관:제주 정책 분야:주거분야 지원 내용:  지원받을 수 있는 사항   저렴한 임대조건으로 임대주택 지원    아래의 만  가능   본인과 부모소득 합계 평균소득 100% 이하  무주택자    지원상세   다가구  기존주택 매입 임대사업 정책이란      다가구  기존주택을 매입하여 개보수하거나 개량한 후 저소득 청년 신혼부부 에게 저렴한 임대조건으로 공급하여 주거안정 도모   입주대상자 상세안내  1. 무주택자인 미혼 청년    1순위   생계 주거 의료급여 수급자  한부모가족  차상위계층    2순위   본인과 부모의 월평균 소득이 전년도 도시근로자 가구당 월평균 소득의 100% 이하    3순위   1  2순위에 하지 아니하는 사람 중 본인의 월평균 소득이 전년도 도시근로자 가구당 월평균 소득의 100% 이하  2. 우선공급    아동복지시설 가정위탁 포함 에서 퇴소 예정이거나 퇴소한지 5년이 지나지 아니한 사람    청소년 쉼터에서 퇴소 예정이거나 퇴소한지 5년이 지나지 아니한 사람 청소년 쉼터를 2년 이상 한 사람에 한 한다  중 여성가족부장관이 주거지원이 필요 하다고 인정하여 공공주택사업자에게 통보한 사람 사업 신청 기간:2024년 01월01일 ~ 2024년 12월31일 비고:사업기간2024 01 01 ~ 2024 12 31 운영기간2024 01 01 ~ 2024 12 31 신청기간2024 01 01 ~ 2024 12 31 연령:만 19세 ~ 39세 거주지 및 소득:  지원 대상자   다가구  기존주택 매입 후 저소득층에게 공급   19세 39세 무주택 저소득 청년  신혼부부 고령자  추가 단서 사항:지역기준  제주도  제주시  서귀포시 주관 기관:제주특별자치도 운영 기관:제주특별자치도  제주특별자치도개발공사  한국토지주택공사   주택정책팀\'), Document(metadata={\'name\': \'울산 희망상가 품은 청년희망주택 건립\', \'source\': \'..\\\\data\\\\policy_result.json\'}, page_content=\'기관:울산 정책 분야:주거분야 지원 내용:  위 치   울산광역시 중구 성안동 393 2   규 모   부지면적 1 311.6   연면적 1 805   지하 1층 지상 4층   1층   희망상가 2호   지역커뮤니티시설    2 ~ 4층   청년희망주택 36호     사 업 비   7 369백만원 국 2 419시 4 950  사업 운영 기간:  사업기간   2019. 8. ~ 2024. 1. 사업 신청 기간:상시 연령:만 18세 ~ 39세 주관 기관:울산광역시 건축정책과 주거지원팀  052 229 4412  운영 기관:주관기관과 동일\'), Document(metadata={\'name\': \'울산 남구 청년 자격시험 응시료 지원사업\', \'source\': \'..\\\\data\\\\policy_result.json\'}, page_content=\'기관:울산 남구 정책 분야:일자리분야 지원 내용:  기간    24. 3. ~ 12.   대상   울산 남구에 6개월 이상 거주한 19세 ~ 39세 청년    주요내용   어학  자격증 시험 응시료 지원 최대 10만원  청년 자부담 20% 포함  사업 신청 기간:상시 연령:만 19세 ~ 39세 신청 절차:  문의   울산광역시 남구 일자리정책과 일자리정책팀 052 226 3122  주관 기관:울산광역시 남구 일자리정책과 일자리정책팀 052 226 3122  운영 기관:주관기관과 동일\')], [{\'url\': \'https://www.yna.co.kr/view/AKR20221128006800057\', \'content\': ""울산 성안동에 청년희망주택 기공…창업 지원 상가도 갖춰 | 연합뉴스 영상 울산 성안동에 청년희망주택 기공…창업 지원 상가도 갖춰 이 뉴스 공유하기 닫기 카카오톡 페이스북 X 카카오 울산 성안동에 청년희망주택 기공…창업 지원 상가도 갖춰 울산시는 28일 중구 성안동에서 \'희망상가를 품은 청년희망주택\' 기공식을 열었다. 이 뉴스 공유하기 닫기 카카오톡 페이스북 X 카카오 울산 \'희망상가를 품은 청년희망주택\' 투시도[울산시 제공. (울산=연합뉴스) 김근주 기자 = 울산시는 28일 중구 성안동에서 \'희망상가를 품은 청년희망주택\' 기공식을 열었다. 울산시는 청년층 주거 안정과 주거 만족도 향상을 위해 남구 신정동, 중구 태화동 등에 2026년까지 사업비 410여억원을 들여서 청년희망주택 200호를 건설할 계획이다. 2024년 준공 울산 신정동 청년희망주택 건축설계 당선작 선정 제보는 카카오톡 okjebo <저작권자(c) 연합뉴스, 무단 전재-재배포, AI 학습 및 활용 금지> 2022/11/28 15:03 송고 영상 영상 기사   영상 기사   영상 기사   영상""}, {\'url\': \'https://www.ohmynews.com/NWS_Web/View/at_pg.aspx?CNTN_CD=A0002989780\', \'content\': \'울산 \\\'36호 성안동 청년희망주택\\\' 완공...\\\'시장 공약 이행\\\' - 오마이뉴스 오마이뉴스 이용가이드 모바일 이용안내 ▲ 2022년 11월 28일 울산 중구 성안동에서 열린 희망상가를 품은 청년희망주택 기공식. 김 시장 당선 후 울산광역시는 ""민선8기 이내에 430여 억 원을 들여 청년희망주택 8개소 220호를 공급한다""고 밝혔고\\xa0그 첫 사업으로 김 시장 취임 약 5개월 후인 지난해 11월 28일 중구 성안동에 \\\'희망상가를 품은 청년희망주택\\\'을 착공했다. 공약인 청년희망주택 중 첫 사례인\\xa0\\\'희망상가를 품은 청년희망주택\\\'은 지하 1층, 지상 4층, 연면적 1천800㎡ 규모에 창업지원 상가 2호와 희망주택 36호로 구성돼 청년들이 자유롭게 소통하면서 정보를 나눌 수 있도록 공사를 진행했고 1년 만인 최근 준공했다. 이 사업에 이어 울산시는 2024년 1월 38호 규모의 \\\'남구 신정동 청년희망주택\\\'을 착공할 예정이다. 한편 울산시가 입주자 모집에 나선 성안동 청년희망주택의 우선공급은 입주자 모집 공고일 기준(2023년 12월 28일) 무주택자로서 울산시에 거주하는 청년이면서 일정요건을 갖추면 가능하다. 추천1 댓글 스크랩 페이스북 트위터 공유\'}]']","울산 희망상가 품은 청년희망주택 건립 정책의 지원 대상 연령은 만 18세에서 39세까지입니다. 이 정책은 청년층의 주거 안정과 만족도 향상을 목표로 하며, 성안동에 위치한 청년희망주택은 청년들에게 저렴한 주거 공간을 제공하고 창업 지원 상가도 함께 구성되어 있습니다."
울산 희망상가 품은 청년희망주택 건립 정책의 주관 기관은 어디인가요?,"['정책 이름: 울산 희망상가 품은 청년희망주택 건립', '주관 기관: 울산광역 건축정책과 주거지원팀 052 229 4412']",울산광역 건축정책과 주거지원팀입니다.,"['[Document(metadata={\'name\': \'울산 희망상가 품은 청년희망주택 건립\', \'source\': \'..\\\\data\\\\policy_result.json\'}, page_content=\'기관:울산 정책 분야:주거분야 지원 내용:  위 치   울산광역시 중구 성안동 393 2   규 모   부지면적 1 311.6   연면적 1 805   지하 1층 지상 4층   1층   희망상가 2호   지역커뮤니티시설    2 ~ 4층   청년희망주택 36호     사 업 비   7 369백만원 국 2 419시 4 950  사업 운영 기간:  사업기간   2019. 8. ~ 2024. 1. 사업 신청 기간:상시 연령:만 18세 ~ 39세 주관 기관:울산광역시 건축정책과 주거지원팀  052 229 4412  운영 기관:주관기관과 동일\'), Document(metadata={\'name\': \'울산 중구 청년 주거상담소 지정 운영\', \'source\': \'..\\\\data\\\\policy_result.json\'}, page_content=\'기관:울산 중구 정책 분야:주거분야 지원 내용:  지원금액   전 월세 환산보증금 보증금  월차임 100   7 000만원 이하 주택 임대차 계약 시 임차인의 중개 수수료 50% 감면 사업 운영 기간:  사업기간    24. 1. ~ 12.   2019년 중구지회 협약에  연장 사업 신청 기간:상시 연령:만 18세 ~ 34세 거주지 및 소득:  지원대상   중구에 거주 생활  전입예정인 18세 ~ 34세 이하 청년 신청 절차:  방법   재능기부 한 공인중개사 문의 후 신청   중개업소 목록   울산광역시 중구 홈페이지 참고 주관 기관:울산광역시 중구청 민원지적과 052 290 3485  운영 기관:주관기관과 동일\'), Document(metadata={\'name\': \'청년안심주택 공급 매입 \', \'source\': \'..\\\\data\\\\policy_result.json\'}, page_content=\'기관:서울 정책 분야:주거분야 지원 내용:역세권 간선도로변 의 민간소유 토지를 체계적으로 개발 민간 주도 공공 지원 하여 쾌적하고 저렴한 주택을 공급함으로써 청년층의 주거안정을 도모하고 지역경제를 활성화하고자 함. 사업 신청 기간:상시 지원 규모(명):8 184실 공공 2 216실  민간 5 968실  비고:연간 상시   공고문 필히 참고 요망 연령:만 19세 ~ 39세 기타 유익 정보:  공공임대 문의   1600 3456   청년안심주택의 원활한 공급  운영을 위하여 사업자  입주자를 대상으로 종합적인 컨설팅  상담 지원 주관 기관:전략주택공급과 운영 기관:전략주택공급과\'), Document(metadata={\'name\': \'울산 북구 청년 전월세 비용 경감 청년 주거급여 분리지급 \', \'source\': \'..\\\\data\\\\policy_result.json\'}, page_content=\'기관:울산 북구 정책 분야:주거분야 지원 내용:  대상   주거급여 수급가구 내 30세 미만 미혼 청년으로 부모와 행정구역을 달리해 거주하면서청년명의로 임대차계약 체결한 사람    24. 중위소득 기준 47%   48% 완화    지원내용   부모가구와 분리하여 주거급여를 별도 지급   지역  가구원수 별 기준임대료 상한으로 실제 임차료 지급    24. 1인가구 기준 지급액 203 000원   216 000원으로 증가 사업 운영 기간:  사업기간   연중 사업 신청 기간:상시 지원 규모(명):30명 연령:만 19세 ~ 29세 주관 기관:울산광역시 북구 노인장애인과 생활보장팀 052 241 7623  운영 기관:주관기관과 동일\'), Document(metadata={\'name\': \'울산 상안지구 행복주택 건립\', \'source\': \'..\\\\data\\\\policy_result.json\'}, page_content=\'기관:울산 정책 분야:주거분야 지원 내용:  위 치   울산광역시 북구 상안동 343 일원   세 대 수   행복주택 102세대 신혼부부  사회초년생 81세대  전체새대 80%     사 업 비   37 965백만원 국 4 022 기금 5 363  도시공사 28 580  사업 운영 기간:  사업기간   2017. ~ 2026. 사업 신청 기간:상시 주관 기관:울산도시공사 주택사업팀 052 219 8457  운영 기관:주관기관과 동일\')], [{\'url\': \'https://www.yna.co.kr/view/AKR20221128006800057\', \'content\': ""울산 성안동에 청년희망주택 기공…창업 지원 상가도 갖춰 | 연합뉴스 영상 울산 성안동에 청년희망주택 기공…창업 지원 상가도 갖춰 이 뉴스 공유하기 닫기 카카오톡 페이스북 X 카카오 울산 성안동에 청년희망주택 기공…창업 지원 상가도 갖춰 울산시는 28일 중구 성안동에서 \'희망상가를 품은 청년희망주택\' 기공식을 열었다. 이 뉴스 공유하기 닫기 카카오톡 페이스북 X 카카오 울산 \'희망상가를 품은 청년희망주택\' 투시도[울산시 제공. (울산=연합뉴스) 김근주 기자 = 울산시는 28일 중구 성안동에서 \'희망상가를 품은 청년희망주택\' 기공식을 열었다. 울산시는 청년층 주거 안정과 주거 만족도 향상을 위해 남구 신정동, 중구 태화동 등에 2026년까지 사업비 410여억원을 들여서 청년희망주택 200호를 건설할 계획이다. 2024년 준공 울산 신정동 청년희망주택 건축설계 당선작 선정 제보는 카카오톡 okjebo <저작권자(c) 연합뉴스, 무단 전재-재배포, AI 학습 및 활용 금지> 2022/11/28 15:03 송고 영상 영상 기사   영상 기사   영상 기사   영상""}, {\'url\': \'https://www.ohmynews.com/NWS_Web/View/at_pg.aspx?CNTN_CD=A0002989780\', \'content\': \'울산 \\\'36호 성안동 청년희망주택\\\' 완공...\\\'시장 공약 이행\\\' - 오마이뉴스 오마이뉴스 이용가이드 모바일 이용안내 ▲ 2022년 11월 28일 울산 중구 성안동에서 열린 희망상가를 품은 청년희망주택 기공식. 김 시장 당선 후 울산광역시는 ""민선8기 이내에 430여 억 원을 들여 청년희망주택 8개소 220호를 공급한다""고 밝혔고\\xa0그 첫 사업으로 김 시장 취임 약 5개월 후인 지난해 11월 28일 중구 성안동에 \\\'희망상가를 품은 청년희망주택\\\'을 착공했다. 공약인 청년희망주택 중 첫 사례인\\xa0\\\'희망상가를 품은 청년희망주택\\\'은 지하 1층, 지상 4층, 연면적 1천800㎡ 규모에 창업지원 상가 2호와 희망주택 36호로 구성돼 청년들이 자유롭게 소통하면서 정보를 나눌 수 있도록 공사를 진행했고 1년 만인 최근 준공했다. 이 사업에 이어 울산시는 2024년 1월 38호 규모의 \\\'남구 신정동 청년희망주택\\\'을 착공할 예정이다. 한편 울산시가 입주자 모집에 나선 성안동 청년희망주택의 우선공급은 입주자 모집 공고일 기준(2023년 12월 28일) 무주택자로서 울산시에 거주하는 청년이면서 일정요건을 갖추면 가능하다. 추천1 댓글 스크랩 페이스북 트위터 공유\'}]']",울산 희망상가 품은 청년희망주택 건립 정책의 주관 기관은 울산광역시 건축정책과 주거지원팀입니다. 연락처는 052-229-4412입니다.
예술인 고용보험 정책의 주관 기관은 어디인가요?,"['정책 이름: 예술인 고용보험 정책', '기관:고용노동부']",고용노동부,"['[Document(metadata={\'name\': \'예술인 고용보험 정책\', \'source\': \'..\\\\data\\\\policy_result.json\'}, page_content=\'기관:고용노동부 정책 분야:일자리분야 지원 내용:고용보험 적용 실업급여  출산전후 급여 지급   보험료 예술인과 사업주는 소득 전체 1.6%의 반반인 각각 0.8%씩 균하게 부담 사업 신청 기간:상시 비고:2020.12.10 ~ 상시 연령:만 0세 ~ 65세 거주지 및 소득:근로자가 아닌 예술인 복지법에  예술인  대통령령이 정하는 사람 중 문화예술용역 계약을 체결하고  다른 사람을 사용하지 않고 자신이 직접 노무를 하는 사람  문학 미술 사진 건축 음악 국악 무용 연극 영화 연예 만화  11개 분야의 프리랜서 예술인 중 문화예술용역계약을 체결한 사람  다른 사람을 사용하지 않고 직접 문화예술활동  노무 을 하는 예술인  취업 상태:프리랜서  일용근로자  단기근로자 추가 단서 사항:1. 실업급여   수급요건  이직일 이전 24개월 동안 피보험 단위기간이 9개월 이상   지급수준  구직급여일액은 기초일액의 60퍼센트  상한액은 근로자와 동일 66 000원   기초일액  마지막 이직일 전 1년 간 신고된 보수총액을  기간의 총일수로 나눈 금액   지급기간  피보험기간  연령에  120 ~ 270일 지급  2. 출산전후 급여   수급요건  출산 유산  사산 일 전 피보험단위기간이 3개월 이상일 것   지급수준  1년간 월평균 보수의 100퍼센트 상한액 월 200만원  하한액 60만원    지급기간  출산전후를 더하여 90일 한 번에 둘 이상 자녀를 임신한  120일  참여 제한 대상:중복수혜 불가 1. 문화예술용역 계약의 월평균소득 50만원 미만인  단기예술인  1개월 미만 계약자 은 일정소득 미충족시에도 고용보험 적용  단  계약건별 합산한 월평균소득이 50만원이상인   예술인의 직접신청에 의하여 당연적용 2. 65세 이상 신규계약자 3. 근로자인 예술인 신청 절차:고용보험 가입 신청은 원칙적으로 사업주가 신고  단  개별 계약의 월평균소득이 50만원 미만이어도여러 계약을 합하여 월평균소득이 50만원 이상인   예술인이 직접 고용보험 가입 신청  기타 유익 정보:  가입 요건은 고용 대신 문화예술용역  계약임 사업주와 예술인이 체결한 문화예술용역  계약의 기간과 소득으로 고용보험 가입   계약 금액이 월평균 50만원 이상이면 당연가입 소득이 월급여 형태가 아니어도  예술인의 대가 보수  지급 시 사업주가 0.7% 원천징수하여 22.7월분부터 0.8% 원천징수  사업주의 보험료와 함께 매월 납부   50만원 미만의 소득도 다른 계약 건과 합산하여 월평균소득 50만원이면 가입 가능 이  예술인이 직접 피보험자격 소득합산신청서 제출하여 고용보험 가입   피보험자격 이중취득이 가능 근로자고용보험   예술인고용보험  예술인고용보험   예술인고용보험 이중가입 가능   실업급여 수급 중 일부 소득활동을 인정 예술인은 실업인정대상 기간 중 소득이 발생한 에는 구직급여일액을 전부 감액하거나  일부 감액하고 지급함 주관 기관:고용노동부\'), Document(metadata={\'name\': \'농기계종합보험 보험료 지원\', \'source\': \'..\\\\data\\\\policy_result.json\'}, page_content=\'기관:농림축산식품부 정책 분야:복지.문화분야 지원 내용:  보험료의 100분의 50이상 일반농 50%  영세농 70% 을 국고에서 지원 사업 신청 기간:상시 비고:상시신청 연령:만 19세 ~ 99세 거주지 및 소득:  보험대상 농기계 12종 를 소유  관리하며 농업경영체에 록된 19세 이상의 농업인  농업법인  전공:제한없음 농산업계열 취업 상태:영농종사자 특화 분야:농업인 지역인재 추가 단서 사항:   농어업인의 안전보험  안전재해예방에  법률 에  농업경영체에 록된 자를 피보험자로 하여 보험계약을 체결하는 자   19세 이상의 농업인   대인배상 대물배상 자기신체사고      필수   농기계손해 적재농산물 선택 에 보험기간을 모두 1년으로 가입하는  신청 절차:지역농협에 방문하여 신청 제출 서류:  신청 청약 서   보험목적물 증빙자료   농업경영체 록 농업인확인   주관 기관:농림축산식품부 운영 기관:NH농협손해보험\'), Document(metadata={\'name\': \'청년 정신건강 지원 마인드링크 \', \'source\': \'..\\\\data\\\\policy_result.json\'}, page_content=\'기관:광주 정책 분야:복지.문화분야 지원 내용:정신건강의학적 상담  평가   초발정신질환자 사례관리       가족중재   사업 운영 기간:2024.01.01.~2024.12.31. 사업 신청 기간:상시 신청 절차:유관기관 의뢰 시 홈페이지 내 신청서 작성   개인 신청 시 전화 예약 제출 서류:센터 록 시 소견서 제출 주관 기관:광주광역시 복지건강국 건강정책과 광주광역시 북구보건소 운영 기관:전남대학교 산학협력단 북구보건소에서 위탁 \'), Document(metadata={\'name\': \'과천시 반려동물 보험가입 지원 사업\', \'source\': \'..\\\\data\\\\policy_result.json\'}, page_content=\'기관:경기 과천시 정책 분야:복지.문화분야 지원 내용:  상해치료비  1사고당 100만원 한도  연간 1마리당 300만원 한도 자기부담금 5만원  보상비율 50%    배상 책임   1사고당 1 000만원 자기부담금 3만 원     청구 사유 발생 시 보험사에 직접 청구 02 3471 5109  사업 신청 기간:2024년 08월31일 ~ 2025년 08월30일 비고:2024 08 31 토  ~ 2025 08 30 토  거주지 및 소득:가입 대상  과천에 주민록을  거주 과천시민의 반려견 묘  학력:고졸 미만 고교 재학 고졸 예정 고교 졸업 대학 재학 대졸 예정 대학 졸업 석 박사 전공:인문계열 사회계열 상경계열 이학계열 공학계열 예체능계열 농산업계열 취업 상태:재직자 자영업자 미취업자 프리랜서 일용근로자 창업자 단기근로자 영농종사자 특화 분야:저소득층 신청 절차:별도 절차 없이 자동 가입  보험사에 보험금 직접 청구 주관 기관:과천시 기후환경과 동물보호팀 운영 기관:과천시 기후환경과 동물보호팀\'), Document(metadata={\'name\': \' 건강보험  임의계속가입제도\', \'source\': \'..\\\\data\\\\policy_result.json\'}, page_content=\'기관:보건복지부 정책 분야:주거분야 지원 내용:  임의계속가입자 보험료    보수월액보험료가 산정된 최근 12개월간의 보수월액을 평균한 금액 연도별 직장가입자 보험료율 50퍼센트 경감   소득월액보험료   36개월 동안은 지역보험료 대신 임의계속가입자 보험료 납부   직장가입자와 동일하게 피부양자 재 가능 사업 신청 기간:상시 비고: 지역가입자가 된 이후 최초로 고지 받은 지역보험료의 납부기한에서 2개월이 지나기 이전까지 2013.05.22.부터 개정시행  거주지 및 소득:  사용관계가 끝난 사람 퇴사자  중 직장가입자로서의 자격을 유지한 기간이 보건복지부령으로 정하는 기간 동안 통산 1년 이상인 사람  법 제110조   2018.07.01.부터 개정시행    퇴직 이전 18개월 기간 동안 직장가입자로서의 자격을 유지한 기간이 통산 1년 이상인 사람으로  종전의 직장가입자보험료 보수월액보험료 소득월액보험료 를 납부하고자 공단에 신청한 자 추가 단서 사항:  국민건강보험법 제110조 제1항에 의거 임의계속가입 자격은 지역가입자가 된 후 최초로 고지받은 지역보험료 납부기한에서 2개월이 지나기 이전까지 신청하여야 하고  제2항에 의거 임의계속을 신청한 자가 최초로 고지한 임의계속 보험료를 그 납부기한부터 2개월이 지난 날까지 납부하지 않을  임의계속 가입자 자격이 상실되며 지역가입자로 변동   임의계속 세대의 소득  재산변동 으로 임의계속가입자로서의 자격을 더 이상 유지하지 않으려는 사람은 임의계속탈퇴 신청서를 작성하여 공단에 제출하여야 하며   임의계속가입자는 임의계속탈퇴 신청서가 공단에 접수된 날의 다음 날로 그 자격이 상실됨 신청 절차:  가까운 건강보험공단 지사에 방문하여 임의계속가입 신청   부득이한 사유로 방문이 곤란할  FAX  우편  유선 으로 신청  신청서 양식은 참고사이트1 참조  기타 유익 정보:거주지 근처 지사찾기   nhis about retrieveBranchList.do 주관 기관:보건복지부 운영 기관:국민건강보험공단\')], [{\'url\': \'http://www.kawf.kr/aei/empArtinsure.do\', \'content\': \'사업주가 예술인과 문화예술용역 계약을 체결한 후 대상 예술인을 근로복지공단에 피보험자로 신고하면 예술인 고용보험 가입됩니다. 예술인 고용보험에 가입해 일정 기간 보험료를 납부하고 일정 기준(피보험단위기간)을 충족하면, 예술인은 비자발적 실업 상태일 때 ‘구직급여’를 받을 수 있으며, 여성인 경우 출산(유산 · 사산 포함)으로 일을 하지 못하는 기간에 대한 급여를 받을 수 있습니다. 12월 10일 예술인 고용보험 시행 사업장: 예술인과 계약한 사업주가 사업자가 아니어도, 근로복지공단에 예술인 사업장으로 성립 신고한 후 예술인 고용보험 신고 업무를 할 수 있습니다. 예술인이 여러 사업장에서 같은 시기에 각각 근로계약 또는 문화예술용역 관련 계약을 체결하는 경우 각 사업장에서 모두 고용보험 피보험자격을 취득할 수 있습니다. 예술인 고용보험 대상이 아닌 경우 *   2024.04.152024 예술인 고용보험 설명회(2024년 3월 26일 개최) 근로복지공단 예술인고용보험센터 예술인 고용보험 가입 지원 및 피보험자 자격관리 문의 : 1588-0075 (평일 09:00 ~18:00) 팩스 : 0505-290-3203\'}, {\'url\': \'https://www.moel.go.kr/policy/policydata/view.do?bbs_seq=20201200578\', \'content\': ""이 누리집은 대한민국 공식 전자정부 누리집입니다. 공식 누리집 주소 확인하기go.kr 주소를 사용하는 누리집은 대한민국 정부기관이 관리하는 누리집입니다. 누리집 안내지도 크게 메뉴 검색 메뉴 검색 결과 닫기 통합검색 열기 통합검색 자동완성 닫기 통합검색 닫기 보도 및 홍보자료 누리집 안내지도 누리집 안내지도 누리집 배너 모음 누리집 이용안내 누리집 이용안내 보도 및 홍보자료 누리집 안내지도 누리집 배너 모음 누리집 이용안내 전체메뉴 닫기 보도 및 홍보자료 예술인 고용보험 현장 적용 안내서(문화예술용역 운영지침서, 20.12.7. 예술인 고용보험 관련 안내서입니다. 1. 예술인 고용보험 적용대상인 \'문화예술용역 및 관련 계약에 관한 사항\' 2. 예술인 고용보험 신고절차, 보험료 및 구직급여 산정방식 등 제도 상세 내용 3. 사례별 예상 질문 및 답변 등 소속기관(지청 및 위원회) 소속기관(지청 및 위원회) 업무별 누리집 업무별 누리집 산하기관 및 관련 단체 산하기관 및 관련 단체""}]']","예술인 고용보험 정책의 주관 기관은 **고용노동부**입니다. 이 정책은 예술인과 사업주 간의 문화예술용역 계약을 통해 예술인이 고용보험에 가입할 수 있도록 지원합니다. 고용보험 가입 후 일정 기간 보험료를 납부하면, 예술인은 비자발적 실업 상태일 때 구직급여를 받을 수 있으며, 출산(유산 및 사산 포함)으로 인해 일을 하지 못하는 경우에도 급여를 지급받을 수 있습니다."
예술인 고용보험 정책에서 실업급여를 받기 위한 피보험 기간 요건은 무엇인가요?,['추가 단서 사항:1. 실업급여 급요건 이직일 이전 24개월 동안 피보험 위기간이 9개월 이상'],이직일 이전 24개월 동안 피보험 위기간이 9개월 이상이어야 합니다.,"[""[Document(metadata={'name': '예술인 고용보험 정책', 'source': '..\\\\data\\\\policy_result.json'}, page_content='기관:고용노동부 정책 분야:일자리분야 지원 내용:고용보험 적용 실업급여  출산전후 급여 지급   보험료 예술인과 사업주는 소득 전체 1.6%의 반반인 각각 0.8%씩 균하게 부담 사업 신청 기간:상시 비고:2020.12.10 ~ 상시 연령:만 0세 ~ 65세 거주지 및 소득:근로자가 아닌 예술인 복지법에  예술인  대통령령이 정하는 사람 중 문화예술용역 계약을 체결하고  다른 사람을 사용하지 않고 자신이 직접 노무를 하는 사람  문학 미술 사진 건축 음악 국악 무용 연극 영화 연예 만화  11개 분야의 프리랜서 예술인 중 문화예술용역계약을 체결한 사람  다른 사람을 사용하지 않고 직접 문화예술활동  노무 을 하는 예술인  취업 상태:프리랜서  일용근로자  단기근로자 추가 단서 사항:1. 실업급여   수급요건  이직일 이전 24개월 동안 피보험 단위기간이 9개월 이상   지급수준  구직급여일액은 기초일액의 60퍼센트  상한액은 근로자와 동일 66 000원   기초일액  마지막 이직일 전 1년 간 신고된 보수총액을  기간의 총일수로 나눈 금액   지급기간  피보험기간  연령에  120 ~ 270일 지급  2. 출산전후 급여   수급요건  출산 유산  사산 일 전 피보험단위기간이 3개월 이상일 것   지급수준  1년간 월평균 보수의 100퍼센트 상한액 월 200만원  하한액 60만원    지급기간  출산전후를 더하여 90일 한 번에 둘 이상 자녀를 임신한  120일  참여 제한 대상:중복수혜 불가 1. 문화예술용역 계약의 월평균소득 50만원 미만인  단기예술인  1개월 미만 계약자 은 일정소득 미충족시에도 고용보험 적용  단  계약건별 합산한 월평균소득이 50만원이상인   예술인의 직접신청에 의하여 당연적용 2. 65세 이상 신규계약자 3. 근로자인 예술인 신청 절차:고용보험 가입 신청은 원칙적으로 사업주가 신고  단  개별 계약의 월평균소득이 50만원 미만이어도여러 계약을 합하여 월평균소득이 50만원 이상인   예술인이 직접 고용보험 가입 신청  기타 유익 정보:  가입 요건은 고용 대신 문화예술용역  계약임 사업주와 예술인이 체결한 문화예술용역  계약의 기간과 소득으로 고용보험 가입   계약 금액이 월평균 50만원 이상이면 당연가입 소득이 월급여 형태가 아니어도  예술인의 대가 보수  지급 시 사업주가 0.7% 원천징수하여 22.7월분부터 0.8% 원천징수  사업주의 보험료와 함께 매월 납부   50만원 미만의 소득도 다른 계약 건과 합산하여 월평균소득 50만원이면 가입 가능 이  예술인이 직접 피보험자격 소득합산신청서 제출하여 고용보험 가입   피보험자격 이중취득이 가능 근로자고용보험   예술인고용보험  예술인고용보험   예술인고용보험 이중가입 가능   실업급여 수급 중 일부 소득활동을 인정 예술인은 실업인정대상 기간 중 소득이 발생한 에는 구직급여일액을 전부 감액하거나  일부 감액하고 지급함 주관 기관:고용노동부'), Document(metadata={'name': '상해보험 가입비 지원 만원의행복보험 ', 'source': '..\\\\data\\\\policy_result.json'}, page_content='기관:과학기술정보통신부 정책 분야:복지.문화분야 지원 내용:  보험계약자는 1년 만기의  1만원  3년 만기의  3만원 보험료 납입하며  나머지 보험료는 과학기술정보통신부장관이 납입   보장내용   재해를 직접적인 원인으로 사망하였을 때 2 000만원 보장   재해입원급부금   재해로 인하여 그 치료를 직접목적으로 4일 이상 입원하였을 때 3일 초과 입원일수 1일당  120일 한도  1만원   재해수술급부금   재해로 인하여 그 치료를 직접목적으로 수술을 받았을 때 수술 1회당  1종수술 10만원  2종수술 20만원  3종수술 30만원  4종수술 50만원  5종수술 100만원   만기급부금   보험기간이 끝날때까지 살아 있을 때   1년만기 1만원  3년만기 3만원 사업 신청 기간:상시 비고:가입기간 우체국에  상이 연령:만 15세 ~ 65세 거주지 및 소득:  만15~65세 기초생활수급자  차상위계층   국민기초생활보장법에서 정한 기초생활수급자  차상위계층 특화 분야:저소득층 신청 절차:우체국에 방문하여 신청 제출 서류:  수급자  차상위계층 증명서   수급자증명서   생계 의료 주거 교육급여 중 1   차상위계층  아래 증명서류 중 1   한부모가족증명서   자활근로자확인서   차상위계층확인서   차상위본인부담경감대상자확인서   장애인연금 장애수당 장애아동수당대상자확인서 단  장애인연금 구분이  차상위초과부가급여 에 체크된  제외    사회보장급여 결정 적합  통지서 발급일 1년 이내로  증명내용이 수급자  차상위계층을 확인할 수 있는 에만 유효    주민록본   확인서류 발급자 본인 가입시 미제출  세대원 가입시 제출 주관 기관:과학기술정보통신부 운영 기관:우체국보험고객센터'), Document(metadata={'name': '조기재취업수당', 'source': '..\\\\data\\\\policy_result.json'}, page_content='기관:고용노동부 정책 분야:일자리분야 지원 내용:재취업한 날의 전날을 기준으로 소정급여일수를 1 2 이상 남기고 재취업한   남아 있는 구직급여의 1 2을 조기재취업수당으로 지급 사업 신청 기간:상시 비고:상시 거주지 및 소득:1. 재취업한 날의 전날을 기준으로 고용보험법 제50조에  소정급여일수를 2분의 1이상 남긴 상태이어야 함 2. 12개월 이상 계속하여 고용된  사업을 영위한    사업주가 변경되더라도 기간의 단절 없이 계속 고용되어 12개월 이상 근무한 이어야 함     건설 일용근로자로 재취업한 에도 재취업한 날부터 매달 10일 이상 일용근로한 달이 12개월 이상이어야 함 3. 재취업한 시점의 사업주가 다음의 요건에 하는 사업주가 아닐 것    최후 이직한 사업의 사업주에게 재고용된     최후 이직한 사업의 사업주와 된 사업주로서 최종 이직 당시의 사업주와 합병 분할되거나 그 사업을 넘겨받은 사업주에게 재고용된     실업 신고일 이전 채용을 약속한 사업주에게 고용된     고용노동부 장관이 고시한 임금액 이상인 직장에 취직한   24년 고시 월 임금액  5 740 000원     국가공무원법  지방공무원법에  공무원으로 임용된  단  별정직  임기제 공무원 제외 취업 상태:구직급여 수급자 추가 단서 사항:지급요건  아래 요건 모두 충족 1  재취업한 날의 전날을 기준으로 고용보험법 제50조에  소정급여일수를 2분의 1이상 남긴 상태여야 함 2  12개월 이상 계속하여 고용된  사업을 영위한     사업주가 변경되더라도 기간의 단절 없이 계속 고용되어 12개월 이상 근무한 이어야 함    건설 일용근로자로 재취업한 에도 재취업한 날부터 매달 10일 이상 일용근로한 달이 12개월 이상이어야 함 3. 재취업한 시점의 사업주가 다음의 요건에 하는 사업주가 아닐 것   최후 이직한 사업의 사업주에게 재고용된    최후 이직한 사업의 사업주와 된 사업주로서 최종 이직 당시의 사업주와 합병 분할되거나 그 사업을 넘겨받은 사업주에게 재고용된    실업 신고일 이전 채용을 약속한 사업주에게 고용된    고용노동부 장관이 고시한 임금액 이상인 직장에 취직한   24년 고시 월 임금액  5 740 000원    국가공무원법  지방공무원법에  공무원으로 임용된  단  별정직  임기제 공무원 제외 참여 제한 대상:자영업자 고용보험 임의가입자로서 구직급여를 지급받은 자는 조기재취업수당 적용 제외 신청 절차:재취업한 날  사업을 시작한 날부터 12개월이 경과한 이후 관할 고용센터 구직급여를 지급받았던 고용센터 에 조기재취업수당 청구서   증빙서류 제출 사후지급  심사 및 발표:심사 후 개별 발표 제출 서류:  조기재취업수당 청구서    근로자  수급자격증  재직증명서  근로계약서  12개월 이상 고용되었음을 증명하는 서류    자영업자  수급자격증  사업설명서  사무실 임대차계약서  사업자록증  12개월간 매출증빙내역  사업을 개시  영위하였음을 증명하는 서류   기타 사실관계를 입증할 근거자료  주관 기관:고용노동부 운영 기관:고용복지플러스센터'), Document(metadata={'name': '농기계종합보험 보험료 지원', 'source': '..\\\\data\\\\policy_result.json'}, page_content='기관:농림축산식품부 정책 분야:복지.문화분야 지원 내용:  보험료의 100분의 50이상 일반농 50%  영세농 70% 을 국고에서 지원 사업 신청 기간:상시 비고:상시신청 연령:만 19세 ~ 99세 거주지 및 소득:  보험대상 농기계 12종 를 소유  관리하며 농업경영체에 록된 19세 이상의 농업인  농업법인  전공:제한없음 농산업계열 취업 상태:영농종사자 특화 분야:농업인 지역인재 추가 단서 사항:   농어업인의 안전보험  안전재해예방에  법률 에  농업경영체에 록된 자를 피보험자로 하여 보험계약을 체결하는 자   19세 이상의 농업인   대인배상 대물배상 자기신체사고      필수   농기계손해 적재농산물 선택 에 보험기간을 모두 1년으로 가입하는  신청 절차:지역농협에 방문하여 신청 제출 서류:  신청 청약 서   보험목적물 증빙자료   농업경영체 록 농업인확인   주관 기관:농림축산식품부 운영 기관:NH농협손해보험'), Document(metadata={'name': ' 건강보험  임의계속가입제도', 'source': '..\\\\data\\\\policy_result.json'}, page_content='기관:보건복지부 정책 분야:주거분야 지원 내용:  임의계속가입자 보험료    보수월액보험료가 산정된 최근 12개월간의 보수월액을 평균한 금액 연도별 직장가입자 보험료율 50퍼센트 경감   소득월액보험료   36개월 동안은 지역보험료 대신 임의계속가입자 보험료 납부   직장가입자와 동일하게 피부양자 재 가능 사업 신청 기간:상시 비고: 지역가입자가 된 이후 최초로 고지 받은 지역보험료의 납부기한에서 2개월이 지나기 이전까지 2013.05.22.부터 개정시행  거주지 및 소득:  사용관계가 끝난 사람 퇴사자  중 직장가입자로서의 자격을 유지한 기간이 보건복지부령으로 정하는 기간 동안 통산 1년 이상인 사람  법 제110조   2018.07.01.부터 개정시행    퇴직 이전 18개월 기간 동안 직장가입자로서의 자격을 유지한 기간이 통산 1년 이상인 사람으로  종전의 직장가입자보험료 보수월액보험료 소득월액보험료 를 납부하고자 공단에 신청한 자 추가 단서 사항:  국민건강보험법 제110조 제1항에 의거 임의계속가입 자격은 지역가입자가 된 후 최초로 고지받은 지역보험료 납부기한에서 2개월이 지나기 이전까지 신청하여야 하고  제2항에 의거 임의계속을 신청한 자가 최초로 고지한 임의계속 보험료를 그 납부기한부터 2개월이 지난 날까지 납부하지 않을  임의계속 가입자 자격이 상실되며 지역가입자로 변동   임의계속 세대의 소득  재산변동 으로 임의계속가입자로서의 자격을 더 이상 유지하지 않으려는 사람은 임의계속탈퇴 신청서를 작성하여 공단에 제출하여야 하며   임의계속가입자는 임의계속탈퇴 신청서가 공단에 접수된 날의 다음 날로 그 자격이 상실됨 신청 절차:  가까운 건강보험공단 지사에 방문하여 임의계속가입 신청   부득이한 사유로 방문이 곤란할  FAX  우편  유선 으로 신청  신청서 양식은 참고사이트1 참조  기타 유익 정보:거주지 근처 지사찾기   nhis about retrieveBranchList.do 주관 기관:보건복지부 운영 기관:국민건강보험공단')], [{'url': 'https://eco.economical-life.com/entry/예술인-실업급여-신청-조건-및-신청-절차', 'content': '예술인이 실업급여를 신청하려면, 고용보험 가입 기간, 비자발적 퇴직 사유, 구직 활동 요건을 충족해야 합니다. 실업급여 자발적 퇴사 예외 사유 및 신청 조건 일반적으로 자발적으로 퇴사한 경우 실업급여를 받을 수 없지만, 예외적으로 받을 수 있는 경우가 있습니다. 실업급여 수급 기간 동안 예술인은 재취업을 위한 활동을 지속해야 하며, 구직 활동을 증명해야 실업급여가 계속 지급됩니다. 예술인도 일반 구직자와 마찬가지로 매월 1회 이상의 구직 활동을 통해 재취업 의지를 증명해야 하며, 이를 통해 실업급여 수급 자격을 유지할 수 있습니다. 실업급여 신청 후 구직 활동 인정 조건과 활동 방법 실업급여 수급자는 수급 기간 동안 재취업을 위한 구직 활동을 적극적으로 이행해야 하며, 이를 고용센터에 정기적으로 보고해야 합니다. 실업 인정 방식: 고용센터는 예술인의 구직 활동 증빙 자료를 확인하고, 구직 활동이 충분하지 않을 경우 실업급여 지급을 제한할 수 있습니다.'}, {'url': 'https://shinyhyun.com/entry/예술인-실업급여-조건-금액-기간-신청방법-총정리', 'content': '예술인 실업급여 조건, 금액, 기간, 신청방법 총정리 예술인 실업급여 조건, 금액, 기간, 신청방법 총정리 이번시간에는 예술업에 종사하시는 분들이 실업급여 혜택을 받는 조건 및 금액, 기간, 신청방법 등에 대하여 총정리해 드리겠습니다. 예술인 실업급여 수령여부 확인하기 👉 수급자격자가 소정급여일수 기간 중 재취업하여\\xa06개월 이상 고용 또는 사업을 영위한 경우 남은 지급액 일부 또는 전액을 조기 재취업수당으로\\xa0수령할 수 있습니다. 실업급여 수급자격 요건을 갖춘 경우\\xa0신분증(주민등록증 또는 운전면허증)을 가지고 거주지 관할 고용센터를 방문하여 실업신고를 합니다. Q. 이직일 전 24개월 간 근로다 및 예술인 제77조 6 제1항의 노무제공자 중 둘 이상 해당되는 경우 피보험자 단위기간은 어떻게 되나요? 노무제공자 실업급여 조건, 금액, 기간, 신청방법 총정리 단기 예술인 실업급여 조건, 금액, 기간, 신청방법 총정리 일용직 실업급여 조건, 금액, 기간, 신청방법 총정리'}]""]","예술인이 실업급여를 받기 위해서는 다음과 같은 조건을 충족해야 합니다:

1. **고용보험 가입 기간**: 이직일 이전 24개월 동안 피보험 단위기간이 9개월 이상이어야 합니다. 즉, 예술인은 고용보험에 가입되어 있어야 하며, 일정 기간 동안 보험료를 납부한 기록이 필요합니다.

2. **비자발적 퇴직 사유**: 일반적으로 자발적으로 퇴사한 경우 실업급여를 받을 수 없지만, 예외적으로 인정되는 사유가 있을 수 있습니다. 예를 들어, 경영상의 이유로 사업이 종료되거나, 계약이 만료될 경우 등이 해당됩니다.

3. **구직 활동 요건**: 실업급여를 수급하기 위해서는 재취업을 위한 활동을 지속적으로 해야 하며, 이를 고용센터에 정기적으로 보고해야 합니다. 예술인은 매월 1회 이상의 구직 활동을 통해 재취업 의지를 증명해야 합니다.

4. **기타 조건**: 실업급여 수급자는 수급 기간 동안 구직 활동을 인정받아야 하며, 구직 활동이 충분하지 않을 경우 실업급여 지급이 제한될 수 있습니다.

5. **조기재취업수당**: 재취업한 날의 전날을 기준으로 소정급여일수를 1/2 이상 남기고 재취업한 경우, 남아 있는 구직급여의 1/2을 조기재취업수당으로 지급받을 수 있습니다.

이러한 조건을 모두 충족하면 예술인은 실업급여를 신청할 수 있으며, 신청 절차는 거주지 관할 고용센터를 방문하여 필요한 서류를 제출하는 방식으로 진행됩니다."
예술인 고용보험 정책에 따라 출산전 급여의 상한액은 얼마인가요?,['추가 단서 사항:2. 출산전 급여 지급준 1년간 월평균 보의 100퍼센트 상한액 월 200만원'],월 200만원,"[""[Document(metadata={'name': '예술인 고용보험 정책', 'source': '..\\\\data\\\\policy_result.json'}, page_content='기관:고용노동부 정책 분야:일자리분야 지원 내용:고용보험 적용 실업급여  출산전후 급여 지급   보험료 예술인과 사업주는 소득 전체 1.6%의 반반인 각각 0.8%씩 균하게 부담 사업 신청 기간:상시 비고:2020.12.10 ~ 상시 연령:만 0세 ~ 65세 거주지 및 소득:근로자가 아닌 예술인 복지법에  예술인  대통령령이 정하는 사람 중 문화예술용역 계약을 체결하고  다른 사람을 사용하지 않고 자신이 직접 노무를 하는 사람  문학 미술 사진 건축 음악 국악 무용 연극 영화 연예 만화  11개 분야의 프리랜서 예술인 중 문화예술용역계약을 체결한 사람  다른 사람을 사용하지 않고 직접 문화예술활동  노무 을 하는 예술인  취업 상태:프리랜서  일용근로자  단기근로자 추가 단서 사항:1. 실업급여   수급요건  이직일 이전 24개월 동안 피보험 단위기간이 9개월 이상   지급수준  구직급여일액은 기초일액의 60퍼센트  상한액은 근로자와 동일 66 000원   기초일액  마지막 이직일 전 1년 간 신고된 보수총액을  기간의 총일수로 나눈 금액   지급기간  피보험기간  연령에  120 ~ 270일 지급  2. 출산전후 급여   수급요건  출산 유산  사산 일 전 피보험단위기간이 3개월 이상일 것   지급수준  1년간 월평균 보수의 100퍼센트 상한액 월 200만원  하한액 60만원    지급기간  출산전후를 더하여 90일 한 번에 둘 이상 자녀를 임신한  120일  참여 제한 대상:중복수혜 불가 1. 문화예술용역 계약의 월평균소득 50만원 미만인  단기예술인  1개월 미만 계약자 은 일정소득 미충족시에도 고용보험 적용  단  계약건별 합산한 월평균소득이 50만원이상인   예술인의 직접신청에 의하여 당연적용 2. 65세 이상 신규계약자 3. 근로자인 예술인 신청 절차:고용보험 가입 신청은 원칙적으로 사업주가 신고  단  개별 계약의 월평균소득이 50만원 미만이어도여러 계약을 합하여 월평균소득이 50만원 이상인   예술인이 직접 고용보험 가입 신청  기타 유익 정보:  가입 요건은 고용 대신 문화예술용역  계약임 사업주와 예술인이 체결한 문화예술용역  계약의 기간과 소득으로 고용보험 가입   계약 금액이 월평균 50만원 이상이면 당연가입 소득이 월급여 형태가 아니어도  예술인의 대가 보수  지급 시 사업주가 0.7% 원천징수하여 22.7월분부터 0.8% 원천징수  사업주의 보험료와 함께 매월 납부   50만원 미만의 소득도 다른 계약 건과 합산하여 월평균소득 50만원이면 가입 가능 이  예술인이 직접 피보험자격 소득합산신청서 제출하여 고용보험 가입   피보험자격 이중취득이 가능 근로자고용보험   예술인고용보험  예술인고용보험   예술인고용보험 이중가입 가능   실업급여 수급 중 일부 소득활동을 인정 예술인은 실업인정대상 기간 중 소득이 발생한 에는 구직급여일액을 전부 감액하거나  일부 감액하고 지급함 주관 기관:고용노동부'), Document(metadata={'name': '예술인 생활안정자금 대출  신청 매월 1일~10일  예산소진시까지 ', 'source': '..\\\\data\\\\policy_result.json'}, page_content='기관:문화체육관광부 정책 분야:복지.문화분야 지원 내용:대출한도최고 7백만원 이내  긴급생활자금은 최고 5백만원까지  대출 신청조건에  심사 후 승인 최소대출금액  50만원 이상    대출금 지급 시 하나은행 계좌만 가능하므로 사전에 계좌 개설 필요 사업 신청 기간:상시 비고:대출용도  결혼자금  의료비  부모 요양비  장례비  긴급 생활자금 거주지 및 소득:신청일 현재 예술활동증명 보유자 대출금 지급까지 한국신용정보원의 일반신용정보관리규약에  이상이 없는   참여 제한 대상:제한조건 1  미성년자 만 19세 미만  2  본인  배우자가 생활안정자금대출을 보유한  3  휴대폰 본인인증 미 통과자 본인이 아닌   4  신진예술인 5  재외국민 6  긴급 생활자금의  직전년도 기준 소득금액증명원상 소득 2 000만원 초과인 자 주관 기관:문화체육관광부 한국예술인복지재단 운영 기관:한국예술인복지재단'), Document(metadata={'name': '중소기업 취업자 소득세 감면 청년 ', 'source': '..\\\\data\\\\policy_result.json'}, page_content='기관:국세청 정책 분야:복지.문화분야 지원 내용:  취업시기별 소득세 감면율과 감면 한도   취업일   18.1.1~ 22.12.31.   감면율 90%  감면 한도 150만원    취업일   23.1.1~ 23.12.31.   감면율 90%  감면 한도 200만원   세법개정으로 2023.1.1.이후 발생하는 소득분부터 감면한도 연간 200만원으로 상향 사업 운영 기간:특례적용기한  2026. 12. 31. 까지 사업 신청 기간:상시 비고:연령 계산 시 군복무기간 최대 6년 은 차감하고 계산함 연령:만 15세 ~ 34세 취업 상태:재직자 특화 분야:중소기업 근로자 추가 단서 사항:  감면대상 중소기업    중소기업기본법  제2조에  중소기업으로서  조세특례제한법 시행령  제27조 제3항에  다음의 감면대상 업종을 주된 사업으로 영위하여야 함    통계청장이 고시하는 한국표준산업분류표 통계법  22 에  판단 참여 제한 대상:  감면 대상 제외 근로자    법인세법 시행령  제40조 제1항 각 호의 어느 하나에 하는 임원    기업의 최대주주  최대출자자 개인사업자의 에는 대표자 와 그 배우자    에 하는 자의 직계존속 비속 그 배우자 포함    국세기본법 시행령  제1조의2  제1항에  친족관계인 사람   소득세법  제14조 제3항 제2호에  일용근로자   다음의 어느 하나에 하는 보험료 의 납부사실이 확인되지 아니하는 사람    국민연금법  제3조 제1항 제11호  제12호에  부담금  기여금    국민건강보험법 제69조에  직장가입자의 보험료    단  국민연금법 제6조 단서  국민건강보험법 제5조 제1항 단서에  가입대상이 되지않는  제외 신청 절차: 근로자   중소기업  감면신청서 제출   감면적용 받으려는 근로자는 원천징수의무자에게 중소기업 취업자 소득세 감면 신청서  를 취업일이 속하는 달의 다음 달 말일까지 제출 제출 서류:중소기업 취업자 소득세 감면 신청서  중소기업 취업자 소득세 감면 대상 명세서 사업주 작성   주민록본  병역증명서 청년 근로자의  필요시 제출   원천징수 영수증 기타 유익 정보:국세상담센터    126 주관 기관:기획재정부 소득세제과 운영 기관:국세청'), Document(metadata={'name': '농기계종합보험 보험료 지원', 'source': '..\\\\data\\\\policy_result.json'}, page_content='기관:농림축산식품부 정책 분야:복지.문화분야 지원 내용:  보험료의 100분의 50이상 일반농 50%  영세농 70% 을 국고에서 지원 사업 신청 기간:상시 비고:상시신청 연령:만 19세 ~ 99세 거주지 및 소득:  보험대상 농기계 12종 를 소유  관리하며 농업경영체에 록된 19세 이상의 농업인  농업법인  전공:제한없음 농산업계열 취업 상태:영농종사자 특화 분야:농업인 지역인재 추가 단서 사항:   농어업인의 안전보험  안전재해예방에  법률 에  농업경영체에 록된 자를 피보험자로 하여 보험계약을 체결하는 자   19세 이상의 농업인   대인배상 대물배상 자기신체사고      필수   농기계손해 적재농산물 선택 에 보험기간을 모두 1년으로 가입하는  신청 절차:지역농협에 방문하여 신청 제출 서류:  신청 청약 서   보험목적물 증빙자료   농업경영체 록 농업인확인   주관 기관:농림축산식품부 운영 기관:NH농협손해보험'), Document(metadata={'name': '조기재취업수당', 'source': '..\\\\data\\\\policy_result.json'}, page_content='기관:고용노동부 정책 분야:일자리분야 지원 내용:재취업한 날의 전날을 기준으로 소정급여일수를 1 2 이상 남기고 재취업한   남아 있는 구직급여의 1 2을 조기재취업수당으로 지급 사업 신청 기간:상시 비고:상시 거주지 및 소득:1. 재취업한 날의 전날을 기준으로 고용보험법 제50조에  소정급여일수를 2분의 1이상 남긴 상태이어야 함 2. 12개월 이상 계속하여 고용된  사업을 영위한    사업주가 변경되더라도 기간의 단절 없이 계속 고용되어 12개월 이상 근무한 이어야 함     건설 일용근로자로 재취업한 에도 재취업한 날부터 매달 10일 이상 일용근로한 달이 12개월 이상이어야 함 3. 재취업한 시점의 사업주가 다음의 요건에 하는 사업주가 아닐 것    최후 이직한 사업의 사업주에게 재고용된     최후 이직한 사업의 사업주와 된 사업주로서 최종 이직 당시의 사업주와 합병 분할되거나 그 사업을 넘겨받은 사업주에게 재고용된     실업 신고일 이전 채용을 약속한 사업주에게 고용된     고용노동부 장관이 고시한 임금액 이상인 직장에 취직한   24년 고시 월 임금액  5 740 000원     국가공무원법  지방공무원법에  공무원으로 임용된  단  별정직  임기제 공무원 제외 취업 상태:구직급여 수급자 추가 단서 사항:지급요건  아래 요건 모두 충족 1  재취업한 날의 전날을 기준으로 고용보험법 제50조에  소정급여일수를 2분의 1이상 남긴 상태여야 함 2  12개월 이상 계속하여 고용된  사업을 영위한     사업주가 변경되더라도 기간의 단절 없이 계속 고용되어 12개월 이상 근무한 이어야 함    건설 일용근로자로 재취업한 에도 재취업한 날부터 매달 10일 이상 일용근로한 달이 12개월 이상이어야 함 3. 재취업한 시점의 사업주가 다음의 요건에 하는 사업주가 아닐 것   최후 이직한 사업의 사업주에게 재고용된    최후 이직한 사업의 사업주와 된 사업주로서 최종 이직 당시의 사업주와 합병 분할되거나 그 사업을 넘겨받은 사업주에게 재고용된    실업 신고일 이전 채용을 약속한 사업주에게 고용된    고용노동부 장관이 고시한 임금액 이상인 직장에 취직한   24년 고시 월 임금액  5 740 000원    국가공무원법  지방공무원법에  공무원으로 임용된  단  별정직  임기제 공무원 제외 참여 제한 대상:자영업자 고용보험 임의가입자로서 구직급여를 지급받은 자는 조기재취업수당 적용 제외 신청 절차:재취업한 날  사업을 시작한 날부터 12개월이 경과한 이후 관할 고용센터 구직급여를 지급받았던 고용센터 에 조기재취업수당 청구서   증빙서류 제출 사후지급  심사 및 발표:심사 후 개별 발표 제출 서류:  조기재취업수당 청구서    근로자  수급자격증  재직증명서  근로계약서  12개월 이상 고용되었음을 증명하는 서류    자영업자  수급자격증  사업설명서  사무실 임대차계약서  사업자록증  12개월간 매출증빙내역  사업을 개시  영위하였음을 증명하는 서류   기타 사실관계를 입증할 근거자료  주관 기관:고용노동부 운영 기관:고용복지플러스센터')], [{'url': 'https://naturallee-me.com/entry/예술인-고용보험-출산전후급여-신청-방법과-지원금액은-얼마-지원받으면서-일해도-되나요', 'content': '예술인 고용보험 출산전후급여 신청 방법과 지원금액은 얼마? 출산일(유산일 또는 사산일) 현재 고용보험 취득자일 경우 : 출산일(유산일 또는 사산일) 전 에술인 자격으로 고용보험 가입기간이 3개월 이상 되어야 합니다. 출산일(유산일 또는 사산일) 현재 고용보험 미취득자일 경우 : 출산일(유산일 또는 사산일) 전 18개월 중 예술인 자격으로 고용보험 가입기간이 3개월 이상 되어야 합니다. 출산일(유산일 또는 사산일) 현재 고용보험 취득자일 경우 : 출산전후급여는 출산일(유산일 또는 사산일) 직전 1년간의 월평균 보수액만큼 지원받을 수 있습니다. 출산일(유산일 또는 사산일) 현재 고용보험 미취득자일 경우 : 출산일(유산일 또는 사산일) 직전 18개월간의 월평균 보수액만큼 지원받을 수 있습니다. 매 30일에 대하여 출산일 직전 1년간 월평균 보수의 15/40에 해당하는 금액 (단 월평균 보수가 1,333,340원 미만일 경우 50만 원 , 월평균 보수가 400만 원 초과할 경우 150만 원으로 봄) → 노무제공을 통한 소득이 월평균 보수의 15/40보다 미만이라면 노무를 제공해도 관계없음\\xa0'}, {'url': 'https://www.nodong.kr/instruction/2158747', 'content': '고시 (2024년 적용) 예술인 출산전후급여등 상한액 및 하한액 고시(2023-87호).hwp 고시 고시 고시 고시 고시 고시 고시 고시 고시 고시 고시 고시 고시 고시 고시 고시 고시 고시 고시 고시 고시 고시 고시 고시 고시 고시 고시 고시 고시 고시 고시 고시 고시 고시 고시 고시 고시 고시 고시 고시 고시 고시 고시 고시 고시 고시 고시 고시 고시 고시 고시 고시 고시 고시 고시 고시 고시 고시 고시 고시 고시 고시 고시 고시 고시 고시 고시 고시 고시 고시 고시 고시 고시 고시 고시 고시 고시 고시 고시 고시 고시 고시 고시 고시 고시 고시 고시 고시 고시 고시 고시 고시 고시 고시 고시 고시 고시 고시 고시 고시 고시 고시 고시 고시 고시 고시 고시 고시 고시 고시'}]""]","예술인 고용보험 정책에 따라 출산전후 급여의 상한액은 월 200만원입니다. 출산전후 급여는 출산일(유산일 또는 사산일) 전 피보험 단위기간이 3개월 이상 있어야 하며, 1년간 월평균 보수의 100%가 지급되지만, 상한액은 200만원으로 설정되어 있습니다. 하한액은 60만원입니다."
울산웹툰캠퍼스 운영의 주관 기관은 어디인가요?,"['정책 이름: 울산웹툰캠퍼스 운영', '기관:울산', '정책 분야:일리분야', '지원 내용:  사업목표   울산 만화 웹툰산업 육성  일리 창출   지원내용   작가입주실  창작 교육설 운영  인력양성', '사업 운영 기간:2024. 1.   12.', '사업 신청 기간:상', '연령:만 19세   39세', '거주지 및 소득:  지원대상   만화 웹툰 작가  웹툰산업 분야 진로 청년', '주관 기관:울산광역 문화예술과 문화산업팀 052 229 3755', '운영 기관:울산정보산업진흥원 울산웹툰캠퍼스  052 243 7263']",울산광역 문화예술과 문화산업팀,"['[Document(metadata={\'name\': \'울산 중구 1040 인생학교 운영\', \'source\': \'..\\\\data\\\\policy_result.json\'}, page_content=\'기관:울산 중구 정책 분야:일자리분야 지원 내용:  운영기간    24. 5. ~11.   장 소   평생학습관  관내 문화역사 시설  원도심 내 카페     내 용   1040 가족 중 구 학  2030 화남금녀의 소통카페  3040 세계시민교육 전문가 양성 학습형 일자리  미래교육 연계  사업 신청 기간:상시 거주지 및 소득:  대 상   1040 세대 중구민 아동 포함한 가족  20대 30대 청년층  주관 기관:울산광역시 중구 중구청 교욱지원과 052 290 4768  운영 기관:주관기관과 동일\'), Document(metadata={\'name\': \'울산 북구 미래를 위한 교육패러다임  온택트 강좌  운영\', \'source\': \'..\\\\data\\\\policy_result.json\'}, page_content=\'기관:울산 북구 정책 분야:교육분야 지원 내용:  운영체계   북구 평생학습관 홈페이지  각종 소셜네트워크 Youtube  zoom     세부내용   전문컨텐츠 기관과 업무협약에 의한 온라인 강좌   국가공인자격증 과정 유료    사회복지사  보육교사   국가록민간자격증과정 무료    방과후지도사  총 90개 강좌   외국어강좌 무료    영어  일본어  중국어  총 40개 강좌   국가평생학습포털 늘배움  k MOOC 온라인 강의 연계 사업 운영 기간:  운영기간   연중 사업 신청 기간:상시 거주지 및 소득:  수강대상   북구민 전체 주관 기관:울산광역시 북구 교육청소년과 평생학습팀 052 219 7394  운영 기관:주관기관과 동일\'), Document(metadata={\'name\': \'울산웹툰캠퍼스 운영\', \'source\': \'..\\\\data\\\\policy_result.json\'}, page_content=\'기관:울산 정책 분야:일자리분야 지원 내용:  사업목표   울산 만화 웹툰산업 육성  일자리 창출   지원내용   작가입주실  창작 교육시설 운영  인력양성  사업 운영 기간:2024. 1. ~ 12. 사업 신청 기간:상시 연령:만 19세 ~ 39세 거주지 및 소득:  지원대상   만화 웹툰 작가  웹툰산업 분야 진로 청년  주관 기관:울산광역시 문화예술과 문화산업팀 052 229 3755  운영 기관:울산정보산업진흥원 울산웹툰캠퍼스  052 243 7263 \'), Document(metadata={\'name\': \'울산 직업교육 혁신지구 사업\', \'source\': \'..\\\\data\\\\policy_result.json\'}, page_content=\'기관:울산 정책 분야:교육분야 지원 내용:  사업내용   그린모빌리티 사업  교육과정 운영   그린모빌리티  지역대학과 연계한 일학습병행 시스템 구축    울산시 교육청  중심 지역사회와 협력하는 직업교육 협력체계 구축   사 업 비   20억원 국 10  시 4  교육청 6    기관   울산광역시청 사업 운영 기간:  사업기간   2024. 3. ~ 2025. 2. 사업 신청 기간:상시 거주지 및 소득:  사업대상   관내 직업계고 학생 주관 기관:울산광역시 경제정책관 일자리팀 052 229 2753  운영 기관:울산광역시교육청\'), Document(metadata={\'name\': \'울산광역시 청년지원센터 설치  운영\', \'source\': \'..\\\\data\\\\policy_result.json\'}, page_content=\'기관:울산 정책 분야:.권리분야 지원 내용:  위치   종하이노베이션 3층 코딩교육장 신정동 689 1번지    사업면적   320.474  96.94평    시설현황   다목적실  소회의실  휴게실  물품보관소     사업내용   소통  휴게  회의  상담  공유업무  역량개발 공간조성 운영 사업 운영 기간:  사업기간   2024. 1. ~ 12. 사업 신청 기간:상시 연령:만 19세 ~ 39세 주관 기관:울산광역시 대학청년지원단 청년정책팀 052 229 7983  운영 기관:주관기관과 동일\')], [{\'url\': \'https://www.facebook.com/p/울산웹툰캠퍼스-100084814867108/\', \'content\': ""울산웹툰캠퍼스, Ulsan, Korea. 1 like · 2 were here. 웹툰산업의 공익을 위해 웹툰 작가님과 기업을 지원해주는 울산정보산업진흥원 산하 기관 \'울산웹툰캠퍼스\' 입니다.""}, {\'url\': \'https://www.youtube.com/watch?v=97YNE60tOmE\', \'content\': \'울산정보산업진흥원 웹툰캠퍼스는 예비 및 현업 웹툰 작가들의 꿈을 펼칠 수 있는 창작 지원 공간입니다. 최신 웹툰 장비와 다양한 교육\'}]']",울산웹툰캠퍼스 운영의 주관 기관은 울산광역시 문화예술과 문화산업팀입니다.
울산웹툰캠퍼스 운영에서 지원대상은 누구인가요?,"['정책 이름: 울산웹툰캠퍼스 운영', '기관:울산', '정책 분야:일리분야', '지원 내용:  사업목표   울산 만화 웹툰산업 육성  일리 창출   지원내용   작가입주실  창작 교육설 운영  인력양성', '사업 운영 기간:2024. 1.   12.', '사업 신청 기간:상', '연령:만 19세   39세', '거주지 및 소득:  지원대상   만화 웹툰 작가  웹툰산업 분야 진로 청년', '주관 기관:울산광역 문화예술과 문화산업팀 052 229 3755', '운영 기관:울산정보산업진흥원 울산웹툰캠퍼스  052 243 7263']",만화 웹툰 작가 및 웹툰산업 분야 진로 청년,"[""[Document(metadata={'name': '울산웹툰캠퍼스 운영', 'source': '..\\\\data\\\\policy_result.json'}, page_content='기관:울산 정책 분야:일자리분야 지원 내용:  사업목표   울산 만화 웹툰산업 육성  일자리 창출   지원내용   작가입주실  창작 교육시설 운영  인력양성  사업 운영 기간:2024. 1. ~ 12. 사업 신청 기간:상시 연령:만 19세 ~ 39세 거주지 및 소득:  지원대상   만화 웹툰 작가  웹툰산업 분야 진로 청년  주관 기관:울산광역시 문화예술과 문화산업팀 052 229 3755  운영 기관:울산정보산업진흥원 울산웹툰캠퍼스  052 243 7263 '), Document(metadata={'name': '울산 산학일체형 도제학교 지원사업', 'source': '..\\\\data\\\\policy_result.json'}, page_content='기관:울산 정책 분야:교육분야 지원 내용:  지원내용   일학습병행   기관   울산광역시교육청 사업 운영 기간:  사업기간   2024. 3. ~ 2025. 2. 사업 신청 기간:상시 거주지 및 소득:  지원대상   울산공업고학교 자동화기계과 79명 주관 기관:울산광역시 경제정책관 일자리지원팀 052 229 2753  운영 기관:울산광역시교육청'), Document(metadata={'name': '울산 남구 청년 멘토단 운영', 'source': '..\\\\data\\\\policy_result.json'}, page_content='기관:울산 남구 정책 분야:일자리분야 지원 내용:  장소   남구 대학로 130  2층 무거동  청년일자리카페   지원내용   청년일자리카페를  취업한 선배 중 공기업 사기업 멘토단 구성   청년 멘토단 네트워크 구축   멘토단 대상 간담회  역량강화 교육  사업 운영 기간:2024. 1. ~ 12. 사업 신청 기간:상시 연령:만 19세 ~ 39세 거주지 및 소득:  대상   청년일자리카페를  취업한 취업선배 20명 신청 절차:  문의   울산광역시 남구 청년일자리카페 052 260 2702  주관 기관:울산광역시 남구 일자리정책과 청년정책팀 052 226 2701  운영 기관:울산광역시 남구 청년일자리카페 052 260 2702 '), Document(metadata={'name': '울산 북구 미래를 위한 교육패러다임  온택트 강좌  운영', 'source': '..\\\\data\\\\policy_result.json'}, page_content='기관:울산 북구 정책 분야:교육분야 지원 내용:  운영체계   북구 평생학습관 홈페이지  각종 소셜네트워크 Youtube  zoom     세부내용   전문컨텐츠 기관과 업무협약에 의한 온라인 강좌   국가공인자격증 과정 유료    사회복지사  보육교사   국가록민간자격증과정 무료    방과후지도사  총 90개 강좌   외국어강좌 무료    영어  일본어  중국어  총 40개 강좌   국가평생학습포털 늘배움  k MOOC 온라인 강의 연계 사업 운영 기간:  운영기간   연중 사업 신청 기간:상시 거주지 및 소득:  수강대상   북구민 전체 주관 기관:울산광역시 북구 교육청소년과 평생학습팀 052 219 7394  운영 기관:주관기관과 동일'), Document(metadata={'name': '울산 남구 소상공인 경영주치의 컨설팅 사업', 'source': '..\\\\data\\\\policy_result.json'}, page_content='기관:울산 남구 정책 분야:일자리분야 지원 내용:  지원내용   총 3회 이내 방문 컨설팅 실시   온라인 홍보마케팅 경영진단 창업 매장관리 세무상담     혜택사항   환경개선사업 온라인마케팅컨텐츠 사업 지원 시 가산점 6점 부여 사업 운영 기간:2024. 2월 5일 월  ~ 선착순 완료 시 마감 사업 신청 기간:상시 지원 규모(명):50명  선착순 모집  비고:2024. 2. 5  월  ~ 모집완료 시 마감 거주지 및 소득:  지원대상   공고일 기준 울산시 남구 소재 소상공인  남구 거주 예비창업자   사업자록증상 울산시 남구 내에 사업장 개인  법인 본사기준 이 소재  소상공인 보호  지원에  법  상의 소상공인 개인  법인 에 하는 업체 광업 제조업 건설업  운수업 상시근로자수 10명 미만 그 밖의 업종 상시근로자수 5명 미만    주민록상 울산 남구에 거주하는 예비창업자 추가 단서 사항:공고문 참고 참여 제한 대상:  지원제외   남구 소상공인 경영컨설팅 지원사업 기 수혜자   도박  유흥  불건전 업종  사치 향락적 업종  공고문 붙임1 참고    대기업 운영 프랜차이즈 직영점  가맹점   허위  기타 부정한 방법으로 신청한 소상공인 신청 절차:  신청방법   방문  이메일 접수   방문접수   울산 남구 달삼로 48번길 11  1층  울산 남구 사회적경제지원센터    이메일 접수   suekim9129 korea.kr  접수확인 전화   심사 및 발표:공고문 참고 제출 서류:  신청서류    공통  지원신청서  서식1     공통  개인 정보 수집  조회  동의서  서식2     공통  신분증 사본    소상공인  사업자록증  사업자록증명 사본    예비창업자  주민록본 사본 기타 유익 정보:공고문 참고 주관 기관:울산광역시 남구 소상공인진흥과 소상공인지원팀 052 226 3153  운영 기관:주관기관과 동일')], [{'url': 'https://www1.uc.ac.kr/ceo/index.php?pCode=MN9000034&mode=view&idx=1314', 'content': '창업창직교육센터 울산과학대학교 Link Service CAMPUS SERVICE UC MOOC 학과 UC CUBE 창업창직교육센터 창업창직교육센터 창업창직교육센터 주메뉴 울산청년CEO 울산웹툰캠퍼스는 울산 특화 웹툰 콘텐츠 제작 및 창작 지원, 웹툰 작가 발굴과 예비 작가 양성을 위해 웹툰 작가 및 웹툰 기업을 모집하고자 합니다. 울산 웹툰 산업의 주역이 될 분들을 적극 지원하오니 많은 신청 바랍니다. 일시장소 : 2022.07.28.(목) 19:00, 울산 중구 종가로 406-21, 울산비즈파크 6층 설 명 자 :\\xa0 울산과학대학교 인재개발팀장 외 관계기관 종사자 설명내용 : 울산웹툰캠퍼스 입주작가 모집 공고문 및 신청유의사항 설명 참석자 지원\\xa0 다. 설명회 참석자 석식 지원 본교 디지털콘텐츠디자인학과 학생 등 웹툰에 관심있는 학생들의 적극적인 지원 바랍니다. 사전 참석 의사를 알려주시기 바랍니다.(학과, 학번, 성명, 연락처) 인재개발팀장 2022년 청년 아이디어 도전 트랙 전문대 재학생 대상 교육생 모집공고 Copyright(c)2018 울산청년CEO.'}, {'url': 'https://www.youthcenter.go.kr/youngPlcyUnif/youngPlcyUnifDtl.do?bizId=R2024052123101', 'content': '울산웹툰캠퍼스 입주 작가 및 입주 기업 모집 ○ 입주 기간 : 입주 계약 체결일로부터 2년 (계약일로부터 1년 후 활동성과 평가 진행), 1년 단위 연장 신청 및 심사를 통해 최대 4년 가능 ○ 입주 기간 : 입주 계약 체결일로부터 2년, 1년 단위 연장 신청 및 심사를 통해 최대 4년 가능 ○ 웹툰(예비)작가 : 주민등록상 주소지가 울산광역시인 자 또는 울산광역시 소재 대학교에 재학 혹은 휴학 중인 자 또는 입주 계약 체결일로부터 30일 이내에 울산광역시 내로의 주소이전을 서약한 자로서, 웹툰 및 만화 관련 분야 작가 혹은 작가를 희망하는 예비작가 및 작가 ※ 만 19세 이상 지원 가능(2005년 1월 1일 이후 출생자) - 정부, 지자체 또는 공공기관으로부터 지원 사업 전반에 참여 제한된 개인 및 사업자 “ 울산웹툰캠퍼스 입주 작가 및 입주 기업 모집 ” 와 동일분야 청년정책'}]""]","울산웹툰캠퍼스 운영의 지원대상은 다음과 같습니다:

1. **웹툰 작가**: 만화 및 웹툰 관련 분야에서 활동 중이거나 활동을 희망하는 작가.
2. **예비 작가**: 웹툰 및 만화 관련 분야에 관심이 있는 만 19세 이상의 청년(2005년 1월 1일 이후 출생자).
3. **거주 조건**: 주민등록상 주소지가 울산광역시에 있거나, 울산광역시 소재 대학교에 재학 중이거나 휴학 중인 자, 또는 입주 계약 체결일로부터 30일 이내에 울산광역시 내로 주소 이전을 서약한 자.

이외에도, 울산웹툰캠퍼스는 웹툰 산업의 육성과 창작 지원을 위해 다양한 프로그램과 자원을 제공하고 있습니다."
울산웹툰캠퍼스 운영의 사업 운영 기간은 언제까지인가요?,"['정책 이름: 울산웹툰캠퍼스 운영', '기관:울산', '정책 분야:일리분야', '지원 내용:  사업목표   울산 만화 웹툰산업 육성  일리 창출   지원내용   작가입주실  창작 교육설 운영  인력양성', '사업 운영 기간:2024. 1.   12.', '사업 신청 기간:상', '연령:만 19세   39세', '거주지 및 소득:  지원대상   만화 웹툰 작가  웹툰산업 분야 진로 청년', '주관 기관:울산광역 문화예술과 문화산업팀 052 229 3755', '운영 기관:울산정보산업진흥원 울산웹툰캠퍼스  052 243 7263']",2024년 1월부터 12월까지,"['[Document(metadata={\'name\': \'울산 남구 취업준비교실\', \'source\': \'..\\\\data\\\\policy_result.json\'}, page_content=\'기관:울산 정책 분야:일자리분야 지원 내용:  운영기간   2024. 4. ~ 12.  총 20회  월별 2~3회    자세한 일정 포스터 참고    운영시간   회별 1시간 30분  14 00~15 30     장소   울산 남구 대학로 130  2층 청년일자리카페    교육내용   문 이과 통합 취업준비전략   산업분석  기업  직무분석 방법   기업별 자기소개서 항목분석  작성법   NCS 직업기초능력평가 길라잡이 사업 신청 기간:상시 지원 규모(명):  모집인원   회별 10명 내외 비고: 일정별 선착순 접수 연령:만 19세 ~ 39세 거주지 및 소득:울산 지역 19~39세 청년 구직자 누구나 신청 절차:  모집방법   방문  전화접수   052 260 2700  구글링크 QR코드를 통한 온라인 접수  QR코드   포스터 참고 주관 기관:울산광역시 남구 청년일자리카페    052 260 2700  운영 기관:주관기관과 동일\'), Document(metadata={\'name\': \'울산 북구 평생학습 야간과정 운영\', \'source\': \'..\\\\data\\\\policy_result.json\'}, page_content=\'기관:울산 북구 정책 분야:교육분야 지원 내용:  세부내용   요리과정 운영  학습관 시설 오븐  커피머신 을 활용한 야간 요리과정   생활문화 인문교양 과정 운영  태블릿 pc드로잉  홈패션  은공예  과정 사업 운영 기간:  운영기간    24. 1. ~ 12. 사업 신청 기간:상시 거주지 및 소득:  수강대상   직장인  취 창업준비생  경력단절여성  주관 기관:울산광역시 북구 교육청소년과 평생학습팀 052 241 7394  운영 기관:울산 북구 평생학습관 052 241 7396 \'), Document(metadata={\'name\': \'울산 꿈틀 라운지 취업 창업 커뮤니티 공간  운영\', \'source\': \'..\\\\data\\\\policy_result.json\'}, page_content=\'기관:울산 정책 분야:일자리분야 지원 내용: 취 창업 커뮤니티 공간 1층     위 치  울산 남구 일자리종합센터 1층   운영시간   평일 10 00~18 00  1일 최대 4시간    야간 시범운영  화 목요일 21시까지   용도   취 창업 네트워킹  교육  멘토링 공간  사업 신청 기간:상시 비고:상시 운영 거주지 및 소득:취 창업을 준비하는 구민  관내 창업기업  6인이상~10인 이하  신청 절차:  방법   남구 일자리포털 온라인 신청 대관신청 후 승인    대관 운영없는 시간의  개방형으로 자유롭게  주관 기관:울산 남구 일자리종합센터  226 3190 운영 기관:주관기관과 동일\'), Document(metadata={\'name\': \'울산웹툰캠퍼스 운영\', \'source\': \'..\\\\data\\\\policy_result.json\'}, page_content=\'기관:울산 정책 분야:일자리분야 지원 내용:  사업목표   울산 만화 웹툰산업 육성  일자리 창출   지원내용   작가입주실  창작 교육시설 운영  인력양성  사업 운영 기간:2024. 1. ~ 12. 사업 신청 기간:상시 연령:만 19세 ~ 39세 거주지 및 소득:  지원대상   만화 웹툰 작가  웹툰산업 분야 진로 청년  주관 기관:울산광역시 문화예술과 문화산업팀 052 229 3755  운영 기관:울산정보산업진흥원 울산웹툰캠퍼스  052 243 7263 \'), Document(metadata={\'name\': \'울산대학교 대학일자리플러스센터 거점형 \', \'source\': \'..\\\\data\\\\policy_result.json\'}, page_content=\'기관:울산 정책 분야:일자리분야 지원 내용:  연사업비   720백만원 국 420  시 125  대학 175    사업내용   진로탐색  통합상담 지원  취업컨설팅  일자리 매칭       인력현황   12명 정규직 5  계약직 7  사업 운영 기간:  운영기간   2024.3 ~ 2025. 2.   최초시행 2022. 3. 사업 신청 기간:상시 연령:만 19세 ~ 39세 주관 기관:경제정책관 일자리지원팀 052 229 2753  운영 기관:울산대학교 대학일자리플러스센터 052 259 5753 \')], [{\'url\': \'https://blog.naver.com/PostView.naver?blogId=ji95200&logNo=223576687203\', \'content\': \'블로그 블로그 검색 블로그 메뉴 2024 울산 청년정책 울산웹툰캠퍼스 운영 안내 사업 공고 저는 오늘은 ""울산웹툰캠퍼스 운영"" 키워드에 울산웹툰캠퍼스 운영 개최 안내소식을 전해드리고자  [울산웹툰캠퍼스 로고] 울산웹툰캠퍼스 소개 울산웹툰캠퍼스 울산광역시 중구 종가로 406-21 6층 울산웹툰캠퍼스 울산광역시 중구 종가로 406-21 6층 울산웹툰캠퍼스 (도로명) 울산광역시 중구 종가로 406-21 6층 울산웹툰캠퍼스 : 네이버 블로그 blog.naver.com 울산웹툰캠퍼스 외부 전경 웹툰(예비)작가 & 기업을 지원하는 울산웹툰캠퍼스! 울산웹툰캠퍼스 내부모습 울산웹툰캠퍼스 운영 만화(웹툰) 작가, 예비 작가를 위한 공간 및 사업목표 : 울산 만화 및 웹툰산업 육성 및 일자리 창출 지원내용 : 작가입주실 및 창작 교육시설 운영, 인력양성 등 만화 및 웹툰 작가, 웹툰산업 분야 진로 청년 등 울산정보산업진흥원 울산웹툰캠퍼스 이상으로, 울산웹툰캠퍼스 운영 안내의 건이었습니다. 이 글에 댓글 단 블로거 열고 닫기 이 블로그 전체 카테고리 글 글 검색\'}, {\'url\': \'https://blog.naver.com/PostView.naver?blogId=ucwebtoon&logNo=222884350035\', \'content\': ""블로그 울산웹툰캠퍼스 블로그 검색 블로그 홈  블로그 메뉴 블로그 블로그 공지 울산웹툰캠퍼스 소개영상 공지 <2023 울산 웹툰 페스티벌> 개최 울산웹툰캠퍼스 교육 프로그램 운영 안내 울산웹툰캠퍼스 ・ 2022. 웹툰 입문과정 (10월 1일 ~ 9일 주말) 웹툰 작가 양성과정 (10월 8일 ~ 23일 주말) 기초 드로잉 과정 (10월 29일 ~ 11월 6일 주말) 웹툰에 관심있는 분들의 많은 신청 부탁드립니다 ~ ✨ 웹툰 입문과정 네이버 웹툰 \'한림체육관\'을 연재 중인 이석재 작가님이 강의를 진행해 주십니다. 이번 기회를 통해 웹툰에 한 발짝 다가가세요 ~ 🦶 웹툰 작가 양성과정 웹툰 제작 스킬을 높이고 싶으신 분! 제작 중인 웹툰에 대한 피드백이 필요하신 분! 김명현 작가님이 강의를 진행해 주십니다. 웹툰에 대한 기초 내용부터, 장비를 이용한 웹툰 창작까지~! 울산웹툰캠퍼스 교육 프로그램 울산웹툰캠퍼스 이 블로그 전체 카테고리 글 검색 글 검색""}]']",울산웹툰캠퍼스 운영의 사업 운영 기간은 2024년 1월부터 12월까지입니다. 이 기간 동안 만화 웹툰 작가 및 웹툰 산업 분야에 진로를 희망하는 청년들을 위한 다양한 지원 프로그램이 제공될 예정입니다.
청년 월세지원사업의 지원 금액은 얼마인가요?,"['정책 이름: 청년 월세지원사업', '지원 내용: 월 최대 20만원 임차료 지원 최대12개월']",월 최대 20만원,"['[Document(metadata={\'name\': \'청년 월세 한시 특별지원\', \'source\': \'..\\\\data\\\\policy_result.json\'}, page_content=\'기관:세종 정책 분야:주거분야 지원 내용:  지원내용  월 최대 20만원씩 최대 12개월 지원  지급기간   24년 3월~  26년 12월 소득 재산  요건 검증을 거쳐 지원대상 결정 통지 후  24년 3월부터 지급   신청 월 기준 청년이 당월에 지출한 월세부터 지급 매달 25일  사업 운영 기간:  사업기간   24. 2. ~  26. 12.   신청기간   24.2.26.부터 1년간  사업 신청 기간:2024년 02월26일 ~ 2024년 12월31일 비고:  신청기간   24.2.26.부터 1년간  연령:만 19세 ~ 34세 거주지 및 소득:   청년가구  청년 배우자 직계비속 동일 주소지에 거주  민법상 가족   민법상 가족의 범위  배우자  직계혈족  형제자매   직계혈족의 배우자  배우자의 직계혈족  배우자의 형제자매 생계를 같이하는 에 한함     원가구  청년가구 1촌 이내 직계 혈족 부모     소득평가액  상시근로소득 기타사업소득 재산소득 공적이전소득 근로소득공제 근로 사업소득의 30%     근로소득은 건강보험공단  공적기관의 월평균보수액 자료로 확인함.     재산가액  일반재산가액 자동차가액 부채 주택구입 임차보증금 용도만 인정    원가구 구성  소득 재산 조사가 불필요한   청년가구만 판단   만 30세 이상 신청일 기준   혼인  이혼   미혼부 모   만 30세 미만 미혼 청년가구의 소득이 중위소득 50% 이상으로 부모와 생계를 달리하는 청년   사실혼인  사실혼관계증명 필요 제3자와 혼인관계 없으며  1년 이상 동거해야 함. 주민록본 추가 제출  참여 제한 대상:  지원대상  19~34세 부모와 따로 거주하는 무주택청년  청약통장 가입 필수     소득 재산 요건  원가구 소득 100% 이하이면서 재산 470백만원 이하   청년가구 소득 60% 이하이면서 재산 122백만원 이하    주택요건  임차보증금 5천만원이하  월세 70만원 이하 신청 절차:  온라인신청  복지로 홈페이지 www.bokjiro.go.kr   어플리케이션   방문신청  세종시청 청년정책담당관 4층  구비서류 제출 필요  주관 기관:세종시청 운영 기관:세종시청\'), Document(metadata={\'name\': \'경북 상주시 청년 주거 임차비 지원사업 지역 정착 창업사업 자 대상 \', \'source\': \'..\\\\data\\\\policy_result.json\'}, page_content=\'기관:경북 상주시 정책 분야:주거분야 지원 내용:지원내용  청년 주거 월세의 80%를 지원  최대 30만원 한도  1인 최대 10개월간 지원  지원대상  상주시 청년 만 19세 ~ 39세 이하 이고  지역 정착 창업사업 자   지역정착 창업사업  서울시 지역연계형 청년 창업 지원사업  청년창업 지역정착 지원사업  청년예비창업가 육성사업  지역주도형 청년 일자리 사업  상주시 전통시장 빈점포 창업지원사업  경북 상문동 로컬 업앤다운 지원사업 사업 신청 기간:상시 지원 규모(명):15명 비고:연중상시 연령:만 19세 ~ 39세 거주지 및 소득:상주시 청년 만 19세 ~ 39세 이하 이고  지역 정착 창업사업 자 취업 상태:자영업자 창업자 영농종사자 특화 분야:지역인재 신청 절차:이메일  우편  방문 접수 제출 서류:지원신청서  개인정보 수집동의서  임대차 계약서  주민록초본  주관 기관:상주시청 미래정책실 운영 기관:상주시청 미래정책실\'), Document(metadata={\'name\': \'청년일자리 도약장려금\', \'source\': \'..\\\\data\\\\policy_result.json\'}, page_content=\'기관:고용노동부 정책 분야:일자리분야 지원 내용:신규채용 청년 1인당 월 최대 60만원씩 1년간 지원  최초 채용 후 2년 근속시 480만원 일시지급 2년간 최대 1 200만원  사업 운영 기간:2024.1.1.~12.31. 사업 신청 기간:2024년 01월01일 ~ 2024년 12월31일 지원 규모(명):  기업은 기준 피보험자 수의 50%까지  비수도권 지역은 100%까지 지원받을 수 있음   지원대상 청년 1인당 지원금은 1년차 연 최대 720만원 월 60만원 12개월   2년차 최대 480만원 24개월 근속시  비고:상시 연령:만 15세 ~ 34세 거주지 및 소득: 기업    사업 신청 직전 월부터 이전 1년간 평균 고용보험 피보험자 수가 5인 이상인 우선지원 대상기업 사업주  지식 문화콘텐츠 신재생에너지 산업  미래유망기업  지역주력산업  고용위기지역 소재 기업  특별고용지원업종 은 1인 이상도 가능   소비향락업  업종  국가  공공기관  임시  일용 인력 공급업  근로자 파견업  임금체불 중대 산업재해 발생 으로 명단 공표  기업 은  제한   구체적인 자격  제한 요건 은 청년일자리도약장려금 사업 운영지침에서 확인  청년    채용일 기준 4개월 이상 실업상태인 만15세~34세 취업애로청년  단  고졸 이하 학력  고용촉진장려금 대상  국민취업지원제도 자  청년도전지원사업 수료자  폐자영업자  최종학교 졸업일 이후 채용일까지 고용보험 총 가입기간이 12개월 미만인 청년 은 실업기간이 4개월 미만이어도 지원   사업주의 배우자  직계 존비속  외국인  중앙부처  지방자치단체로부터 다른 인건비 지원을 받는 청년  채용일 기준 고학교  대학교 재학 자 은 지원 제외   구체적인 청년 요건 은 청년일자리도약장려금 사업 운영지침에서 확인 학력:채용일 기준 고학교  대학교 재학 휴학 포함  자는 지원 제외 취업 상태:재직자 추가 단서 사항:  근로조건   정규직 채용 후 6개월 고용유지   계약직 채용시 채용일로부터 3개월 이내 정규직 전환   주 30시간 이상 근로  최저임금 이상 지급   고용보험 가입 필수   채용요건    24.1.1. 이후 채용된 청년   원칙적으로 사업 신청 후 채용된 청년을 지원   단   24.1.1. 이후 채용된 청년 중 채용일로부터 3개월 이내에 신청한  지원 가능   인위적 감원 방지   사업 신청 직전 1개월부터 청년의 지원금 지급기간까지 인위적 감원 금지   단  예산 사정에  신청  지원대상 선정은 조기에 마감될 수 있으며  먼저 채용한 기업에 우선 지원 참여 제한 대상:  사업주의 배우자  직계 존비속  외국인  중앙부처  지방자치단체로부터 다른 인건비 지원을 받는 청년  채용일 기준 고학교  대학교재학 자 은 지원 제외   구체적인 요건  자격은 운영지침 반드시 확인필요 신청 절차:신청방법  지원절차  신청  기업이 운영기관에 채용계획 제출 전산시스템 활용    운영기관의 검토  승인   운영기관 기업 간 지원협약 체결  채용  기업은 청년 채용 후 운영기관에 채용명단 제출  6개월 간 고용 유지하며 임금지급  장려금 신청  6개월 고용유지기간 도래 후 운영기관에 장려금 신청  지원금 지급  운영기관은 사전 심사 후 고용센터에 지급 검토보고서 제출  고용센터에서 최종 심사 후 기업에 지원금 지급 주관 기관:고용노동부 운영 기관:고용노동부\'), Document(metadata={\'name\': \'광주형 청년일자리 공제\', \'source\': \'..\\\\data\\\\policy_result.json\'}, page_content=\'기관:광주 정책 분야:일자리분야 지원 내용:청년이 2년간 500만원을 적립하면 기업 200만원 과 광주시 300만원 가 각각 적립  만기공제금 1 000만원 지원 사업 운영 기간:2024.06.19.~2024.12.31. 사업 신청 기간:2024년 06월19일 ~ 2024년 12월31일 비고:2024 06 19 ~ 2024 12 31    모집 청년 200명  완료 시까지  신청 절차:온라인 접수 광주광역시기업지원시스템     회원가입   기업지원사업정보   일자리지원   2024년 광주형 청년일자리 공제 신청주체   기업  가입신청을 희망하는 청년의 서류는 기업이 취합하여 일괄 제출 주관 기관:광주광역시 교육청년국 청년정책과 운영 기관:광주경제진흥상생일자리재단\'), Document(metadata={\'name\': \'울산 북구 청소년한부모 자립지원\', \'source\': \'..\\\\data\\\\policy_result.json\'}, page_content=\'기관:울산 북구 정책 분야:복지.문화분야 지원 내용:  내용   아동양육비   아동 당 월 35 ~ 40만원   0~1세 자녀  40만원   2세 이상 자녀  35만원   아동양육비 지원 시 150 ~ 200천원 지급    자립지원촉진수당   가구당 월 10만원   1년 단위   최근 1년 내 학업 직업훈련 취업  자립 활동에 한 가구    검정고시 학습비   가구별 연 154만원 한도 지원 사업 운영 기간:  사업기간   연중 사업 신청 기간:상시 거주지 및 소득:  대상   24세 이하 저소득 청소년한부모 가구 주관 기관:울산광역시 북구 가족정책과 여성정책팀 052 241 7674   운영 기관:주관기관과 동일\')], [{\'url\': \'https://kira.zeronoa.com/entry/서울특별시-청년월세지원금-조건-신청-방법-혜택-총정리\', \'content\': ""서울특별시에서는 청년들의 주거비 부담을 덜어주기 위해 \'청년월세지원\' 사업을 운영하고 있습니다. 이 제도는 청년 1인 가구를 대상으로 월 최대 20만 원을 최대 12개월 동안 지원하며, 총 240만 원까지 혜택 을 받을 수 있습니다. 아래에서 지원 조건, 신청 방법, 제출 서류, 선정 기준, 주의 사항을""}, {\'url\': \'https://bujalab.com/entry/2025년-청년월세-지원사업-신청방법-자격-금액-소득기준-총정리\', \'content\': \'2025년 청년월세 지원사업 신청방법 자격 금액 소득기준 총정리 이번 사업은 월 최대 20만 원, 연 최대 240만 원을 지원하며, 거주 요건 폐지 등으로 더욱 많은 청년들이 혜택을 받을 수 있게 되었는데요. 👉 [청년월세 지원 신청] 바로가기 ✅ 지원 대상 및 신청 자격 신청 조건 기존 월세 지원 사업 수혜자: 국토부 또는 지자체의 월세 지원을 받는 중이라면 신청 불가 👉 [복지로 청년월세 지원 신청] 바로가기 ✅ ✅ 신청 기간 청년들의 주거비 부담을 덜어주는 청년월세 특별지원사업은 1년간 최대 240만 원을 지원하며, 거주 요건 폐지 등으로 더 많은 청년들이 혜택을 누릴 수 있습니다. [정책 & 지원금] - 청년내일채움공제 조건 및 만기수령 가이드 2025년 국가장학금 신청 기준 구간 유형 다자녀 총정리 2025년 노인 일자리 신청 자격 조건 급여 종류 총정리\'}]']","청년 월세 한시 특별지원 사업에 대한 정보는 다음과 같습니다:

- **지원 내용**: 월 최대 20만원씩, 최대 12개월 동안 지원. 총 지원 금액은 240만원입니다.
- **지급 기간**: 2024년 3월부터 2026년 12월까지.
- **신청 기간**: 2024년 2월 26일부터 2024년 12월 31일까지.
- **지원 대상**: 만 19세에서 34세 사이의 청년으로, 부모와 따로 거주하는 무주택 청년이어야 하며, 청약통장 가입이 필수입니다. 소득과 재산 요건을 충족해야 합니다.
  - 소득 기준: 원가구 소득 100% 이하, 청년가구 소득 60% 이하.
  - 재산 기준: 원가구 재산 470만원 이하, 청년가구 재산 122만원 이하.
- **신청 방법**: 온라인 신청은 복지로 홈페이지(www.bokjiro.go.kr) 또는 어플리케이션을 통해 가능하며, 방문 신청은 세종시청 청년정책담당관에서 할 수 있습니다.
- **구비 서류**: 신청 시 필요한 서류는 지원신청서, 개인정보 수집 동의서, 임대차 계약서, 주민등록초본 등이 있습니다.

더불어, 경북 상주시에서 운영하는 청년 주거 임차비 지원사업도 있습니다. 이 사업은 청년 주거 월세의 80%를 지원하며, 최대 30만원까지, 10개월 동안 지원합니다. 지원 대상은 상주시의 만 19세에서 39세 이하의 청년으로, 지역 정착 창업사업자여야 합니다.

이와 같은 정보는 청년들이 주거비 부담을 덜고 안정적인 주거 환경을 마련하는 데 도움이 됩니다. 추가적인 세부 사항이나 다른 지원 프로그램에 대한 정보가 필요하시다면 말씀해 주세요!"
청년 월세지원사업의 신청 기간은 언제부터 언제까지인가요?,"['정책 이름: 청년 월세지원사업', '사업 신청 기간:2024년 03월01일   2024년 12월31일']",2024년 03월01일   2024년 12월31일,"['[Document(metadata={\'name\': \'청년 소상공인을 위한 고민상담소\', \'source\': \'..\\\\data\\\\policy_result.json\'}, page_content=\'기관:서울 중구 정책 분야:교육분야 지원 내용:청년 소상공인을 위한 심리교육 사업 신청 기간:2024년 06월21일 ~ 2024년 12월31일 비고:  모집기간  2024.6.21. 금  ~ 상시모집 연령:만 19세 ~ 34세 거주지 및 소득:19세이상 34세이하 청년사장님 사업자록증 확인  취업 상태:청년 소상공인 신청 절차:  신청방법   서울심리지원 제4권역 중부 센터 홈페이지  포스터 QR 신청   첨부파일 필수 확인 주관 기관:서울시 중구청 운영 기관:행복잇다 사회적협동조합\'), Document(metadata={\'name\': \'청년 뉴딜일자리  청년 모집 시흥시 \', \'source\': \'..\\\\data\\\\policy_result.json\'}, page_content=\'기관:경기 시흥시 정책 분야:일자리분야 지원 내용:  사업기간   2024. 5. ~ 12.   지원혜택   취업지원   청년 뉴딜일자리 기업에 일자리연계   기타지원   자 기본 교육  심화 교육 지원    채용분야  형태   기업   신한세라믹   근무기간   2024. 5. ~ 12.   급여   월 2 060 740원 이상  단 채용기업체에  달라질 수 있음   주요업무   연구개발 or 영업관리    보다 상세한 내용은 공고문을 확인해주세요. 사업 신청 기간:상시 지원 규모(명):  모집인원   1명 비고:  모집기간   2024.05.20.~채용 완료 시까지 연령:만 0세 ~ 39세 거주지 및 소득:  지원대상   만 39세 이하 미취업 청년 신청 절차:  신청방법   이메일 접수 shyouthjob korea.kr  주관 기관:  시흥시 청년청소년과  031 310 3693 \'), Document(metadata={\'name\': \'제9기 충북청년광장 구성 운영\', \'source\': \'..\\\\data\\\\policy_result.json\'}, page_content=\'기관:충북 정책 분야:.권리분야 지원 내용:  도정 청년정책제안 팀별 프로젝트 운영  청년정책 모니터링 활동  청년 중심 보장을 위한 간담회의  토론회  온라인 정책제안 추진 사업 운영 기간:2024. 1월 ~ 12월 사업 신청 기간:상시 비고:충북청년광장 회원모집 1월~2월    청년정책 제안 연중  연령:만 19세 ~ 39세 거주지 및 소득:도내 39세 이하 청년 신청 절차:충북청년희망센터 홈페이지 참고충북청년광장 회원모집 1월~2월  신청 심사 및 발표:충북청년희망센터 홈페이지 참고 제출 서류:충북청년희망센터 홈페이지 참고 주관 기관:충청북도 인구청년정책담당관 청년지원팀\'), Document(metadata={\'name\': \'해외취업정착지원금\', \'source\': \'..\\\\data\\\\policy_result.json\'}, page_content=\'기관:고용노동부 정책 분야:일자리분야 지원 내용:  취업 후 1개월   250만원   취업 후 6개월   100만원   취업 후 12개월   150만원 사업 운영 기간:2024.1.1.~12.31. 사업 신청 기간:상시 지원 규모(명):3 900명 지원 인원 달성 시 조기 마감될 수 있음  비고:상시 연령:만 15세 ~ 34세 거주지 및 소득:  만 34세 이하 89.1. 1. 이후 출생자 인 자   신청자 본인  부모  배우자  자녀의 합산소득이 6분위 이하인 자   월드잡플러스 사전 구직록 회원가입  후 근로계약서를 작성한 자 근로계약서 작성 전 입사한 는 입사일 기준    기준 취업일 이후 해외취업한 자   취업인정기준을 충족한 자    취업비자 취득  연봉 1 700만원 이상  근로계약 1년 이상  단순노무직종은 제외   소득분위  기준 취업일 은 사이트 사업공고를  반드시 세부내용 확인 필요 취업 상태:취업비자 취득  단순 노무직종 제외  연봉 1 700만원 이상  근로계약기간 1년 이상  취업 업체 다국적기업   추가 단서 사항:  만 34세 이하 89.1.1 이후 출생자 인 자   신청자 본인  부모  배우자  자녀의 합산소득이 6분위 이하인 자    미혼인   취업일자 전월 납입한 본인과 부모의 건강보험료 합산액이 기준 금액 이하인 자 장기요양보험료는 제외  미납자는 부과액 기준     기혼인   취업일자 전월 납입한 신청자 본인  배우자  자녀의 건강보험료 합산액이 기준 금액 이하인 자 장기요양보험료는 제외  미납자는 부과액 기준    월드잡플러스 사전 구직록 회원가입  후 근로계약서를 작성한 자 근로계약서 작성 전 입사한 는 입사일 기준으로 함    21.2 년도 취업자는 홈페이지 취업일 자부터 본인 신청기한 내 신청 가능 참여 제한 대상:  월드잡플러스 블랙리스트 재  3년간 공단 해외취업 지원사업  불가   해외취업정착지원금   해외취업성공장려금 을 이미 지원받은  1차 지원금만 지원받은 에도 동일   동일 차수 중복지원  정착지원금 내 중복수혜가 발생한    지원금에 신청한 동일한 해외취업사실로 지방자치단체 유사사업을 지원받은     해외취업정착지원금 심의위원회 에서 지원 불가로 의결한  신청 절차:  모바일 신청   월드잡플러스 앱 설치   접속   회원가입   로그인   마이페이지   정착지원금 신청하기 클릭   PC 신청   월드잡플러스 홈페이지 접속   회원가입   로그인  마이페이지   정착지원금 신청하기 클릭 심사 및 발표:  서류 신청일 기준 한달에 두 번 1일~15일  16일~말일  승인된 신청서류의 출입국기록조회를 마친 뒤 다음 달 익월  10일  20일 경 지급   예시    23.1.2. 1.15. 신청   2.10. 지급   23.1.16. 1.31. 신청   2.20. 지급   출입국 기록 추가 확인  기타 사유 발생 시 지급일자 지연될 수 있음 제출 서류:지원금 신청시기별 상이   사이트 사업공고 참조  주관 기관:고용노동부 운영 기관:한국산업인력공단\'), Document(metadata={\'name\': \'소셜믹스형 공공임대주택  청년주택 \', \'source\': \'..\\\\data\\\\policy_result.json\'}, page_content=\'기관:서울 금천구 정책 분야:주거분야 지원 내용:주거  자립기반이 취약한 청년층의 주거 공급 사업 신청 기간:미정 비고:수시 연령:만 19세 ~ 39세 거주지 및 소득:서울시 거주 공고문 필히 참고 신청 절차:모집공고를 통한 신청자 접수 주관 기관:금천구청 일자리청년과 운영 기관:02 2627 2587\')], [{\'url\': \'https://blog.naver.com/PostView.naver?blogId=class_insurance_&logNo=223364168083\', \'content\': \'블로그 검색 따라서 청년가구와 원가구의 소득 및 재산을 함께 확인하게 되는데 혹시나 부모님의 재산이 많거나 소득이 높은 경우에는 신청이 어려울 수 있습니다. 만약 청년이 30세 이상인 경우나 혼인 또는 미혼부모인 경우, 부모와 생계 및 주거를 달리하는 것으로 인정된 경우에는 본인 가구에 대해서만 기준을 적용할 수 있습니다. 다만 실질적으로 도움이 필요한 청년들을 위한 사업이기 때문에 월세를 지원받는 도중에 거주지가 이전되는 경우에는 일시적으로 중단될 수 있습니다. 이때는 새로운 임대차계약서 제출을 통해서 변경신청을 해야 하며, 변경신청이 가능한 경우에 한해서 12개월 분에 대한 잔여 비용을 모두 지원받을 수 있습니다. 청년월세지원은 2024년 2월 26일부터 1년간 수시로 신청할 수 있습니다. 만약 2월에 신청하면 3월부터 바로 20만원씩 월세 비용을 지원받을 수 있으며, 그 이후부터는 신청한 달을 기준으로 지급일을 소급 적용해서 지원합니다. 참고로 복지로 홈페이지에서는 현재 모의계산을 통해서 신청대상 여부를 확인해 볼 수 있습니다.\'}, {\'url\': \'https://m.blog.naver.com/noyoujeong/223389812931\', \'content\': \'청년월세 특별지원 사업 신청기간 및 지원대상, 조건 총정리 : 네이버 블로그 청년월세 특별지원 사업 신청기간 및 지원대상, 조건 총정리 🙋🏻\\u200d♀️ 지원대상 : 19세~34세 청년 / 부모님과 따로 거주, 월세 70만원 및 보증금 5천만원 이하 주택에 거주하는 무주택자(청약통장 가입자) 가구* 청년가구* 원가구중위소득(*소득 평가액)60% 이하(1인가구 기준 월 134만원)100% 이하(3인가구 기준 월 471만원)자산(*재산가액)1.22억 이하4.7억 이하보증금/월세보증금 5천만원*월세 70만원 이하청약통장가입여부 확인(최초 납입금액인 2만원 입금) 청년 본인가구 소득, 재산만 확인하는 경우 단, 지자체의 월세 지원이나 1차 청년월세 특별지원 등 청년 계층에 대한 현금성 월세 지원 사업을 통해 이미 지원받고 있는 경우는 지원종료 후 신청가능 3. 청년 본인 및 청년가구 가구원이 주택을 소유(분양권, 입 주권, 공유 지분 소유 포함) 하거나, 주거 점유형태가 자가 • 전세인 경우 청년 및 취약계층을 위한 월세 지원사업에 {""title"":""청년월세 특별지원 사업 신청기간 및 지원대상, 조건 총정리"",""source"":""https://blog.naver.com/noyoujeong/223389812931"",""blogName"":""맛집요정의.."",""domainIdOrBlogId"":""noyoujeong"",""nicknameOrBlogId"":""유댕쓰"",""logNo"":223389812931,""smartEditorVersion"":4,""meDisplay"":true,""lineDisplay"":true,""outsideDisplay"":true,""cafeDisplay"":true,""blogDisplay"":true}\'}]']","청년 월세 특별지원 사업의 신청 기간은 2024년 2월 26일부터 1년간 수시로 신청할 수 있습니다. 신청을 하면, 3월부터 월세 비용을 지원받을 수 있으며, 이후 신청한 달을 기준으로 지급일이 소급 적용됩니다. 지원 대상은 만 19세에서 34세의 청년으로, 부모님과 따로 거주하며, 월세가 70만원 이하인 무주택자입니다. 자세한 사항은 복지로 홈페이지를 참고하시기 바랍니다."
청년 월세지원사업의 대상 연령은 어떻게 되나요?,"['정책 이름: 청년 월세지원사업', '연령:만 19세   34세']",만 19세   34세,"['[Document(metadata={\'name\': \'청년월세 한시 특별지원 사업 문경시 \', \'source\': \'..\\\\data\\\\policy_result.json\'}, page_content=\'기관:경북 문경시 정책 분야:주거분야 지원 내용:  대상자    청년기본법 상 청년 만 19~34세 이하 으로 부모님과 별도 거주하고  임차보증금 5천만원  월세 60만원 이하 주택에 거주하는 무주택자   지원한도   실제 납부하는 임대료를 최대 240만원 월 최대 20만원 까지 최대 12개월 회  동안 매월 분할 지원   지원자격   청년가구 소득 기준 중위소득 60% 이하  원가구 소득 기준 중위소득 100% 이하   신청기간    24.2. ~  25.2.   지급기간    24.2. ~  26.2. 사업 운영 기간:2024 02 26~2025 02 25 사업 신청 기간:2024년 03월01일 ~ 2025년 02월25일 지원 규모(명):실제 납부하는 임대료를 최대 240만원 월 최대 20만원 까지 최대 12개월 회  동안 매월 분할 지원 비고:2024 03 01~2025 02 25 연령:만 19세 ~ 34세 주관 기관:국토교통부 운영 기관:문경시청 일자리경제과 \'), Document(metadata={\'name\': \'청년층직업지도 CAP  \', \'source\': \'..\\\\data\\\\policy_result.json\'}, page_content=\'기관:고용노동부 정책 분야:교육분야 지원 내용:청년 취업준비생의 직업진로 선택을 지원하고  취업서류 작성  면접기술 강화  구직기술 강화 지원 사업 운영 기간:연중 사업 신청 기간:상시 지원 규모(명):각 집단별 15~18명 내외 비고:상시  단  과정별 상이  연령:만 15세 ~ 34세 거주지 및 소득:  만 15세 ~ 만 34세 이하 청년   청년구직자  대학생  청년은 누구나  가능 취업 상태:미취업자 신청 절차:   온라인  워크넷 WORK.GO.KR    고용복지정책   구직자취업역량 강화    선택 신청    오프라인  지역 고용센터를 방문   CAP  참가신청 접수   담당자와 협의     심사 및 발표:신청   대상자 선정    운영 제출 서류:별도 제출 서류 없음 기타 유익 정보:소요 기간   15~18명의 소그룹  1회 4일간 하루 6시간씩 진행 총 24시간  주관 기관:고용노동부 운영 기관:전국 고용센터 취업지원과 \'), Document(metadata={\'name\': \'집단상담 청년층 직업지도 \', \'source\': \'..\\\\data\\\\policy_result.json\'}, page_content=\'기관:제주 정책 분야:교육분야 지원 내용:지원내용   사업량   만15~34세 청년층 대상  7회     사업기간   2024. 1 ~ 12월    주요내용   취업에 어려움을 겪고있는 청년 층 대상으로 취업의욕을 고취시키고 구직기술을 향상시켜주는  운영 사업 신청 기간:미정 비고:사업기간2024 01 01 ~ 2024 12 31 운영기간2024 01 01 ~ 2024 12 31모집시 신청기간2024 01 01 ~ 2024 12 31모집시 연령:만 19세 ~ 34세 취업 상태:근로기준   4대보험 직장인  불가  사업자 불가 참여 제한 대상:근로기준   4대보험 직장인  불가  사업자 불가 주관 기관:제주특별자치도   고용센터 취업지원총괄팀  운영 기관:제주특별자치도\'), Document(metadata={\'name\': \'울산 남구 키즈와 맘 청년몰 활성화 지원\', \'source\': \'..\\\\data\\\\policy_result.json\'}, page_content=\'기관:울산 남구 정책 분야:일자리분야 지원 내용:  장 소   신정평화시장 청년몰   내 용   청년 상인 임차료 지원  청년몰 판로개척  단골고객 확보 사업 운영 기간:2024. 1. ~ 12. 사업 신청 기간:상시 연령:만 19세 ~ 39세 주관 기관:울산광역시 남구 경제정책과 지역경제팀 052 226 5652  운영 기관:주관기관과 동일\'), Document(metadata={\'name\': \'울산 남구 청년 테마특강 운영\', \'source\': \'..\\\\data\\\\policy_result.json\'}, page_content=\'기관:울산 남구 정책 분야:복지.문화분야 지원 내용:  운영   연 4회 분기별 1회    주요내용   청년들의 니즈 needs 를 반영한 다양한 주제의 특강 운영으로  청년들의 역량개발  필요 정보 지   청년들이 자유롭게 소통 교류할 수 있는 기회  공간  사업 신청 기간:상시 연령:만 19세 ~ 39세 거주지 및 소득:  대상   남구 거주  활동 청년 19세 ~ 39세  주관 기관:울산광역시 남구 일자리정책과 청년정책팀 052 226 3123  운영 기관:주관기관과 동일\')], [{\'url\': \'https://semojeong.com/entry/청년월세지원-조건-신청방법-지원금액-대상자-선정-기준-총정리\', \'content\': \'청년월세지원 조건, 신청방법, 지원금액, 대상자 선정 기준 총정리 - 세상의 모든 정보 - 세모정 청년월세지원 조건, 신청방법, 지원금액, 대상자 선정 기준 총정리 3. 청년월세지원 금액과 지원 기간 소득, 연령, 주택 조건 검토 후 지원 대상자 선정 월 최대 20만 원, 10개월 지원 청년 월세 보조금 최대 12개월 지원 주거비 부담 완화를 위한 청년 월세 지원 정책 운영 안양시 청년 일자리 정책: 취업 지원 프로그램과 창업 지원금 활용 방법 안양시 청년 주거 지원 정책: 월세 지원부터 전세자금 대출까지 경기도 청년 창업 정책 지원 프로그램: 창업 자금 지원, 보조금, 정책 ⋯ 경기도 청년 창업 인프라: 창업 공간 지원, 창업 네트워크, 협업 공간 ⋯ 경기도 청년 창업지원: 창업 자금 지원, 창업 교육, 창업 인프라 활용 ⋯ 경기도 청년 전세자금 대출 지원: 조건, 신청 방법, 이자율\'}, {\'url\': \'https://jumbbang02.tistory.com/entry/청년월세-지원제도-혜택-정리-신청-자격-및-대상-신청방법\', \'content\': ""매달 최대 20만 원까지 지원받을 수 있어요! 이 제도는 최대 4년간 지원받을 수 있어요. 예를 들어, 청년 전세 지원 사업이나 행복주택 등 다른 주거 지원을 받고 있더라도 이 제도의 혜택을 받을 수 있어요. 이 제도를 통해 많은 청년들이 주거 걱정에서 벗어나 더 나은 미래를 꿈꿀 수 있길 바라요. 청년월세 지원은 최대 12개월까지 받을 수 있어요. 다른 용도로 사용하다 적발되면 지원금 회수는 물론, 향후 지원 대상에서 제외될 수 있어요. 청년월세 지원금을 받고 있다고 해서 다른 주거 지원 프로그램에 참여할 수 없는 건 아니에요. 예를 들어, \'청년 전세 지원 사업\'이나 \'행복주택\' 등의 프로그램과 동시에 혜택을 받을 수 있어요. 청년월세 지원금을 받는 분들은 연말정산 시 월세 세액공제를 받을 수 있어요. 청년들의 주거 안정을 위한 청년월세 지원제도, 정말 든든한 버팀목이 되어주고 있어요.""}]']","청년 월세 지원 사업의 대상 연령은 만 19세에서 34세 이하입니다. 이 지원 사업은 청년기본법에 따라 정의된 청년을 대상으로 하며, 부모와 별도로 거주하고 있는 무주택자를 지원합니다."
청년일리창출사업의 운영 기간은 언제인가요?,"['정책 이름: 청년일리창출사업', '사업 운영 기간:2024.01.01. 2024.12.31.']",2024년 1월 1일부터 2024년 12월 31일까지입니다.,"[""[Document(metadata={'name': ' 동구 청년도전 지원사업', 'source': '..\\\\data\\\\policy_result.json'}, page_content='기관:인천 동구 정책 분야:일자리분야 사업 운영 기간:2024. 3. 19. 화  ~ 10. 31. 목   별  기수별 운영 일정 상이 사업 신청 기간:미정 비고:사업기간   2024.3.19~10.31  별   기수별 운영 일정 상이  연령:만 18세 ~ 39세 거주지 및 소득:  대상   아래 조건 중 1개 이상을 충족하는 미취업 청년    구직단념청년  사업 신청일 이전 6개월 이상 취업 교육 직업훈련  이력이 없는 만18~34세 청년     자립준비청년  아동복지시설 에서 퇴소한 5년 이내  퇴소 연장한 만18~34세 청년     청소년복지시설 입 퇴소 청년  청소년복지시설에서 6개월 이상 보호한 만18~34세 청년     북한이탈청년  북한을 이탈한 자로서 만18~34세 청년     지역특화청년      다문화 가정  미혼모 부   한부모가정  생계형 아르바이트 주 30시간 미만 근로   국가유공자가구원 중 취업지원 대상자인 만 18~34세 청년     취업 의 문제로 1년이상 졸업을 유예하거나  휴학  만 18~34세 청년     장기구직  청년  휴   폐업한 자영업 청년  결혼   육아로 경력 단절된 여성 청년 중 만 35~39세 청년 주관 기관:인천광역시 동구 운영 기관:유유기지 동구청년21'), Document(metadata={'name': '청년축제 강북구 ', 'source': '..\\\\data\\\\policy_result.json'}, page_content='기관:서울 강북구 정책 분야:.권리분야 지원 내용:  청년의 날 청년주간 을 맞이하여 청년이 소통하고 즐길 수 있는  운영   청년사업 홍보부스  포토존  플리마켓 운영   지역 내 청년단체  대학교   운영   청년 힐링   지역 청년예술인 기반 문화공연  사업 신청 기간:미정 비고:청년의 날   매년 9월 세 번째 토요일 연령:만 19세 ~ 39세 거주지 및 소득:19~39세 강북구 거주  활동 청년 기타 유익 정보:강북구청 일자리청년과 02 901 2642 주관 기관:강북구청 일자리청년과 운영 기관:주관기관'), Document(metadata={'name': '청년 창업자 네트워킹 지원', 'source': '..\\\\data\\\\policy_result.json'}, page_content='기관:충남 계룡시 정책 분야:일자리분야 지원 내용:  네트워킹데이 운영을 통한 청년 창업자들 간의 교류 지원   매 짝수월 마지막 월요일 오후 7시 사업 운영 기간:  2024.01.01.~2024.12.31. 사업 신청 기간:상시 지원 규모(명):  20명 이하 회 비고:  매 짝수월 네트워킹데이 전일까지 연령:만 18세 ~ 39세 거주지 및 소득:  사업자 대표 신청 절차:  청년지원팀   전화 접수 심사 및 발표:  네트워킹데이 1주일 전 안내 제출 서류:  사업자록증 주관 기관:  경제산업과 운영 기관:  계룡시'), Document(metadata={'name': '경북청년예비창업가육성사업', 'source': '..\\\\data\\\\policy_result.json'}, page_content='기관:경북 정책 분야:일자리분야 지원 내용:  사업목적   좋은 아이템과 기술력을 갖고 있는 예비  초기 청년창업가들에게 사업화지원으로 청년창업 촉진   사업내용   1명당 창업활동비 15백만원 지원 창업활동비 12  교육  3     상품화제작  마케팅  시장 개척  지식재산권 인증  창업활동비     창업컨설팅  창업교육  간접지원 사업 운영 기간:2024 01 01~2024 12 31 사업 신청 기간:미정 지원 규모(명):  사 업 량   21개시군 성주 제외   청년창업가100명 비고:미정 연령:만 19세 ~ 39세 추가 단서 사항:  사업대상   만39세 이하 예비  창업 1년이내인 자 주관 기관:경상북도 운영 기관:시군'), Document(metadata={'name': ' 금산군  금빛시장 청년몰 청년상인 모집 운영', 'source': '..\\\\data\\\\policy_result.json'}, page_content='기관:충남 금산군 정책 분야:일자리분야 지원 내용:  청년 창업자에게 저렴한 임대료로 점포  사업 운영 기간:  2024.01.01.~2024.12.31. 사업 신청 기간:상시 지원 규모(명):  22개점포 비고:  2024.01.01.~2024.12.31. 연령:만 18세 ~ 39세 거주지 및 소득:  사업자록증을 소지하지 않은 창업 희망자 취업 상태:  미취업자 참여 제한 대상:  사업자를 소지한 자 신청 절차:  공고시 금산군에 직접 신청 심사 및 발표:  사업 공고시 참조 주관 기관:  금산군청 운영 기관:  금산군청 경제산업국 경제과')], [{'url': 'https://1350.moel.go.kr/home/hp/data/faqView.do?faq_idx=1000001959', 'content': '- 2 단계: 기업의 청년채용 단계. 기업은 지원대상 청년을 채용일로부터 10 일 이내 채용자 명단을 「 청년 일자리 창출지원 사업 누리집 」 을 통해 운영기관에 제출, 운영기관은 채용자의 적격 여부를 검토하여 10 일 이내 기업에 승인. (보완필요시 연장 가능)'}, {'url': 'https://blog.naver.com/PostView.naver?blogId=nangmanturtle&logNo=223248270856', 'content': '블로그 검색 → 참고로, 22년 채용자의 경우 1년간 960만 원을 지원하였다고 한다면 23년 이후 채용자부터는 2년간 최대 1,200만 원까지 지원받을 수 있도록 지원 수준이 확대되었다. 만약 사업 참여 신청 전에 청년을 먼저 채용한 경우, 3개월 이내 사업 참여 신청을 반드시 해야 지원 가능하다. → 참여 신청일 기준 업력이 1년 이상인 기업은 연 매출액 기준 (21년, 22년 중 택일)이 일정 수준 이상이어야 지원 대상에 포함된다. 가정 밖 학교 밖 청년 등 안정적인 자립을 위해 정부 지원이 필요하다고 판단한 청년 및 북한 이탈 청년도 지원 대상에 포함되었다.(2023년 개편 / 확대된 사항임) 기본적으로 청년 일자리 창출 지원 사업 누리집에서 담당하여 운영하는 기관을 지정하여 참여 신청을 하면 되는데, 본인의 기업 소재지 인근에 위치한 운영 기관을 찾아서 지원하면 된다.'}]""]","청년 일자리 창출 지원 사업의 운영 기간은 2023년 기준으로 2년간 최대 1,200만 원까지 지원받을 수 있는 것으로 확대되었습니다. 구체적인 운영 기간에 대한 언급은 없으나, 참여 신청은 사업 참여 신청일 기준으로 3개월 이내에 이루어져야 하며, 기업은 청년을 채용한 후 10일 이내에 채용자 명단을 제출해야 합니다. 따라서, 청년 채용과 관련된 구체적인 일정은 각 기업의 상황에 따라 달라질 수 있습니다. 

자세한 내용은 청년 일자리 창출 지원 사업 누리집에서 확인하실 수 있습니다."
청년일리창출사업에 지원하려면 어떤 연령대여야 하나요?,"['정책 이름: 청년일리창출사업', '연령:만 19세   39세']",만 19세에서 39세 사이여야 합니다.,"['[Document(metadata={\'name\': \'2024년 전통시장 청년상인 지원사업 안내\', \'source\': \'..\\\\data\\\\policy_result.json\'}, page_content=\'기관:전북 정책 분야:일자리분야 지원 내용:창업지원  성장지원  판로지원 사업 신청 기간:상시 비고:상시 연령:만 18세 ~ 39세 거주지 및 소득:전통시장  상점가에서 영업  만 39세 이하 청년상인 신청 절차:지원별로 상이  첨부된 파일 참고 심사 및 발표:지원별로 상이  첨부된 파일 참고 제출 서류:지원별로 상이  첨부된 파일 참고 주관 기관: 재 청년상인육성재단 운영 기관: 재 청년상인육성재단\'), Document(metadata={\'name\': \'집단상담 청년층 직업지도 \', \'source\': \'..\\\\data\\\\policy_result.json\'}, page_content=\'기관:제주 정책 분야:교육분야 지원 내용:지원내용   사업량   만15~34세 청년층 대상  7회     사업기간   2024. 1 ~ 12월    주요내용   취업에 어려움을 겪고있는 청년 층 대상으로 취업의욕을 고취시키고 구직기술을 향상시켜주는  운영 사업 신청 기간:미정 비고:사업기간2024 01 01 ~ 2024 12 31 운영기간2024 01 01 ~ 2024 12 31모집시 신청기간2024 01 01 ~ 2024 12 31모집시 연령:만 19세 ~ 34세 취업 상태:근로기준   4대보험 직장인  불가  사업자 불가 참여 제한 대상:근로기준   4대보험 직장인  불가  사업자 불가 주관 기관:제주특별자치도   고용센터 취업지원총괄팀  운영 기관:제주특별자치도\'), Document(metadata={\'name\': \'2024년 청년 자격증 취득 지원사업\', \'source\': \'..\\\\data\\\\policy_result.json\'}, page_content=\'기관:경북 고령군 정책 분야:일자리분야 지원 내용:  지원대상   18세 이상 45세 이하 취업을 준비 중 미취업 인 청년   공인어학 시험의  요건 충족 시 시험응시료 최대 5회   증명서 발급 비용만 지원 가능 사업 운영 기간:2024 02 26~2024 12 20 사업 신청 기간:미정 지원 규모(명):15명 정도 비고:미정 연령:만 18세 ~ 45세 주관 기관:고령군 운영 기관:고령군\'), Document(metadata={\'name\': \'청년층직업지도 CAP  \', \'source\': \'..\\\\data\\\\policy_result.json\'}, page_content=\'기관:고용노동부 정책 분야:교육분야 지원 내용:청년 취업준비생의 직업진로 선택을 지원하고  취업서류 작성  면접기술 강화  구직기술 강화 지원 사업 운영 기간:연중 사업 신청 기간:상시 지원 규모(명):각 집단별 15~18명 내외 비고:상시  단  과정별 상이  연령:만 15세 ~ 34세 거주지 및 소득:  만 15세 ~ 만 34세 이하 청년   청년구직자  대학생  청년은 누구나  가능 취업 상태:미취업자 신청 절차:   온라인  워크넷 WORK.GO.KR    고용복지정책   구직자취업역량 강화    선택 신청    오프라인  지역 고용센터를 방문   CAP  참가신청 접수   담당자와 협의     심사 및 발표:신청   대상자 선정    운영 제출 서류:별도 제출 서류 없음 기타 유익 정보:소요 기간   15~18명의 소그룹  1회 4일간 하루 6시간씩 진행 총 24시간  주관 기관:고용노동부 운영 기관:전국 고용센터 취업지원과 \'), Document(metadata={\'name\': \'경북청년예비창업가육성사업\', \'source\': \'..\\\\data\\\\policy_result.json\'}, page_content=\'기관:경북 정책 분야:일자리분야 지원 내용:  사업목적   좋은 아이템과 기술력을 갖고 있는 예비  초기 청년창업가들에게 사업화지원으로 청년창업 촉진   사업내용   1명당 창업활동비 15백만원 지원 창업활동비 12  교육  3     상품화제작  마케팅  시장 개척  지식재산권 인증  창업활동비     창업컨설팅  창업교육  간접지원 사업 운영 기간:2024 01 01~2024 12 31 사업 신청 기간:미정 지원 규모(명):  사 업 량   21개시군 성주 제외   청년창업가100명 비고:미정 연령:만 19세 ~ 39세 추가 단서 사항:  사업대상   만39세 이하 예비  창업 1년이내인 자 주관 기관:경상북도 운영 기관:시군\')], [{\'url\': \'https://news.sbs.co.kr/news/endPage.do?news_id=N1004898193\', \'content\': \'청년 일자리 창출을 위한 세액·소득세 감면 등 세제지원 혜택을 받을 수 있는 나이의 상한선이 29세에서 34세로 확대됩니다. 정부는 21일 이낙연\'}, {\'url\': \'https://m.blog.naver.com/bizupjhk2515/223191845333\', \'content\': \'청년일자리지원사업 지원내용 및 금액 신청방법 : 네이버 블로그 카테고리 이동 알엔디비즈파트너 공식 블로그 청년일자리지원사업 지원내용 및 금액 신청방법 5인 이상 우선지원대상기업에서 취업애로 청년을 정규직으로 고용할 시에 지원금을 지급하는 사업인데요. 만 15~34세의 6개월 이상 실업, 고졸 이하 학력, 국민취업지원제도참여자, 고용촉진장려금 지원대상, 자립지원필요 청년, 북한이탈청년, 최종학교 졸업 후 일한 기간이 1년 미만이어야 합니다. 청년을 정규직으로 채용하고 6개월 이상 고용을 유지해야 하며 주 30시간 이상 근로 및 최저임금 이상 지급, 고용보험 가입, 매출액 일정수준 이상 등이어야 합니다. 청년에게는 꾸준하고 안정적인 일자리를 지원하는 동시에 기업은 지원금과 좋은 인력을 얻게 되는 일석이조 사업이라고 할 수 있습니다. 청년을 채용하신 후에는 말씀드렸다시피 6개월 고용 유지가 기본이기 때문에 6개월 이후에 지원금을 신청하실 수가 있습니다. 2023년에는 지원 요건이 매우 까다로워졌기 때문에 기업의 요건으로는 5인 이상 50인 미만인 건설 제조업 중소기업이면 가능합니다. {""title"":""청년일자리지원사업 지원내용 및 금액 신청방법"",""source"":""https://blog.naver.com/bizupjhk2515/223191845333"",""blogName"":""알엔디비즈.."",""domainIdOrBlogId"":""bizupjhk2515"",""nicknameOrBlogId"":""알엔디비즈파트너"",""logNo"":223191845333,""smartEditorVersion"":4,""meDisplay"":true,""lineDisplay"":true,""outsideDisplay"":true,""cafeDisplay"":true,""blogDisplay"":true}\'}]']","청년 일자리 창출 사업에 지원하기 위해서는 만 15세부터 34세까지의 청년이 해당됩니다. 이 사업은 특히 6개월 이상 실업 상태에 있는 청년, 고졸 이하 학력의 청년, 국민취업지원제도 참여자, 자립지원이 필요한 청년 및 북한이탈청년을 우선 지원하는 내용이 포함되어 있습니다. 또한, 정규직으로 고용된 청년은 주 30시간 이상 근무하고 최저임금 이상을 지급받아야 하며, 고용보험에도 가입되어 있어야 합니다."
청년일리창출사업의 주관 기관은 어디인가요?,"['정책 이름: 청년일리창출사업', '주관 기관:은평구청 사회적경제과 청년지원팀']",은평구청 사회적경제과 청년지원팀입니다.,"['[Document(metadata={\'name\': \'청년축제 강북구 \', \'source\': \'..\\\\data\\\\policy_result.json\'}, page_content=\'기관:서울 강북구 정책 분야:.권리분야 지원 내용:  청년의 날 청년주간 을 맞이하여 청년이 소통하고 즐길 수 있는  운영   청년사업 홍보부스  포토존  플리마켓 운영   지역 내 청년단체  대학교   운영   청년 힐링   지역 청년예술인 기반 문화공연  사업 신청 기간:미정 비고:청년의 날   매년 9월 세 번째 토요일 연령:만 19세 ~ 39세 거주지 및 소득:19~39세 강북구 거주  활동 청년 기타 유익 정보:강북구청 일자리청년과 02 901 2642 주관 기관:강북구청 일자리청년과 운영 기관:주관기관\'), Document(metadata={\'name\': \'전남 청년성장프로젝트 청년카페\', \'source\': \'..\\\\data\\\\policy_result.json\'}, page_content=\'기관:전남 정책 분야:일자리분야 지원 내용:  사업내용  미취업 청년 의 구직단념을 예방하기 위해 맞춤형    청년고용정책 연계  인프라   청년의 일상 유지  심리상담 에 필요한 청년 친화적 공간  시설  인프라   이벤트 홀  공유 주방  VR 체험방  청춘 놀이터  스터디 룸  창업 연구소  비즈팩토리  소회의실       초기상담을  자 특성 파악 후 일상 생활  구직의욕 유지   개인 맞춤형  설계 제안  심리적 소진 청년에게 1 1 심리 상담 지원  후속 지원  청년일경험지원  청년도전지원사업  국민취업지원제도  국민내일배움카드  청년고용정책을 연계 지원하고  자 취업상태  지속적 관리     상세 내용   선재 업고 취업   직장 적응에 어려움을 겪은 청년  졸업 후 진로 결정에 어려움이 있는 청년에게 진로   적성 파악을 통한 경력  재 설계   못말리는 직장인   경제   금융   노동법 교육  불공정 채용이나 직장내 비즈니스 매너. 상담 화법  기초 지식 습득을  직업에  이해도를 높이고 취업  장기근속 도모를 위한 사회초년생 기본교육   꽁꽁얼어붙은면접위로 고양이가 걸어다닙니다   청년이 스스로 성장하고 싶은 목표를 달성하기 위해 지원하고 자기주도적 취업준비생을 대상으로 이력서 쓰기  AI면접  정책현장 방문을 통한 니트청년일상지원 취업워밍업   원영적 사고  전문 심리상담가가 1 1 개별 심리상담을 지원하고 심리적 회복을  일생생활 복귀  구직의욕 제고  추가적인 심층 상담 필요시 최대 10회 지원  사업 운영 기간:2024년 4월 ~ 2024년 11월 사업 신청 기간:상시 지원 규모(명):  600명 20시간 심리상담  200명 3회 비고:2024년 4월 1일 ~ 선착순 연령:만 15세 ~ 45세 거주지 및 소득:15세 ~ 45세 미취업 청년  15~18세  중  고학교 재학생  미진학 검정고시    19~45세  대학교 재학생  취업준비생 신청 절차:전화 문의  070 5001 1786   온라인 신청 네이버폼  기타 유익 정보:수료 시 선물 증정  수료증  대상에 맞는 맞춤  개설 주관 기관:고용노동부  전라남도 운영 기관: 재 전남인력개발원\'), Document(metadata={\'name\': \'영천시 청년창업대학 지원사업\', \'source\': \'..\\\\data\\\\policy_result.json\'}, page_content=\'기관:경북 영천시 정책 분야:일자리분야 지원 내용: 현장중심 창업교육   실전창업교육  현장방문 유니콘 기업  청년사관학교     멘토링지원 영천기업협의회  청년사관학교 출신 CEO      우수수료생 샘플제작 지원 사업 운영 기간:2024 03 01~2024 12 31 사업 신청 기간:미정 지원 규모(명):관내 청년 예비 창업자 15명 비고:미정 주관 기관:영천시 운영 기관:경북자동차임베디드연구원\'), Document(metadata={\'name\': \'서울 청년 밀키트 창업지원\', \'source\': \'..\\\\data\\\\policy_result.json\'}, page_content=\'기관:서울 정책 분야:일자리분야 지원 내용:민관 보유 창업 인프라를 활용한 청년 밀키트 창업 지원으로 준비된 창업가 양성 사업 신청 기간:상시 지원 규모(명):기수별 창업교육 운영 3개 기수  비고:연중 상시 연령:만 19세 ~ 39세 주관 기관:농수산유통담당관 운영 기관:서울농수산식품공사\'), Document(metadata={\'name\': \'2024 꿈이음 청춘카페 지원사업\', \'source\': \'..\\\\data\\\\policy_result.json\'}, page_content=\'기관:경북 정책 분야:복지.문화분야 지원 내용:  청년설발  지원   취창업 준비  19세~39세 주소지가 경북인 청년 선발  카페음료모바일 7만포인트 지급  취창업  지원    꿈이음카페모집    유동인구가 많고 접근성이 좋은 대학가  교통거점  선정 취창업   발굴  운영    지역기업 모집   청년일자리 창출 우수기업  지역특화 청년창업기업  선정 사업 운영 기간:미정 사업 신청 기간:미정 비고:미정   자 모집은  시군별 상이 연령:만 19세 ~ 39세 거주지 및 소득:  사업대상   7개 시군  포항 경주  구미 영천  경산 영양  영덕  에 주소를 둔 19세 ~ 39세 미취업 청년   시군 소재 대학교 재학생 휴학생 대학원생포함  중 경상북도 내 주소를 둔 19세 ~39세 미취업 청년 취업 상태:미취업 주관 기관:지역별 상이 운영 기관:지역별 상이\')], [{\'url\': \'https://www.moel.go.kr/news/notice/noticeView.do?bbs_seq=20221201183\', \'content\': \'공식 누리집 주소 확인하기go.kr 주소를 사용하는 누리집은 대한민국 정부기관이 관리하는 누리집입니다. 크게 메뉴 검색 메뉴 검색 결과 닫기 통합검색 열기 통합검색 자동완성 닫기 통합검색 닫기 보도 및 홍보자료 누리집 배너 모음 누리집 이용안내 누리집 이용안내 보도 및 홍보자료 누리집 배너 모음 누리집 이용안내 전체메뉴 닫기 2023년 청년일경험지원사업 통합지원센터 모집 공고 고용노동부 공고 제2022 - 533호 2023년도 청년일경험지원사업 통합지원센터 모집 공고 고용노동부는 ？국가를 당사자로 하는 계약에 관한 법률？ 제8조 및 같은 법 시행령 제33조에 따라 2023년도 청년일경험지원사업 통합지원센터 선정을 위해 아래와 같이 공고하오니, 사업을 운영하고자 하는 기관은 붙임 공고문 및 과업지시서를 참고하시어\\xa02023.1.9(월) 17시까지 신청하여 주시기 바랍니다. (세종특별자치시 한누리대로 422 정부세종청사 11동, 고용노동부 청년취업지원과) 2023년 청년일경험 통합지원센터 과업지시서.hwp 다운로드 바로보기 소속기관(지청 및 위원회) 소속기관(지청 및 위원회) 산하기관 및 관련 단체 산하기관 및 관련 단체\'}, {\'url\': \'http://www.startupdaily.kr/news/articleView.html?idxno=4231\', \'content\': ""‘2023 미래내일 일경험 프로젝트형(청년주도) 사업’ 운영기관 워크잡, 쿨리지코너 부산센터와 청년예비창업가 육성 < 스타트업 < 기사본문 - 스타트업데일리 ‘2023 미래내일 일경험 프로젝트형(청년주도) 사업’ 운영기관 워크잡, 쿨리지코너 부산센터와 청년예비창업가 육성 ‘2023 미래내일 일경험 프로젝트형(청년주도) 사업’ 운영기관 워크잡, 쿨리지코너 부산센터와 청년예비창업가 육성 고용노동부\\xa0사업의\\xa0일환인\\xa0대학일자리플러스센터\\xa05개소와\\xa0보건복지부\\xa0및\\xa0지자체\\xa0일자리\\xa0사업을\\xa0위탁\\xa0운영하는\\xa0기업인\\xa0\'워크잡\'은\\xa0역량\\xa0있는\\xa0스타트업\\xa0및\\xa0소셜벤처\\xa0육성에\\xa0힘쓰고\\xa0있는\\xa0‘쿨리지코너\\xa0부산센터’와\\xa0함께\\xa0부산\\xa0내\\xa0200명의\\xa0청년을\\xa0대상으로\\xa0시행되는\\xa0고용노동부\\xa0\'2023년\\xa0미래내일\\xa0일경험\\xa0프로젝트형(청년주도)\\xa0사업’을\\xa0활발히\\xa0진행한다고 밝혔다. 두\\xa0팀을\\xa0포함한\\xa0총\\xa010개\\xa0팀이\\xa0각기\\xa0다양한\\xa0주제로\\xa0프로젝트\\xa0사업을\\xa0수행하고\\xa0있으며,\\xa011월\\xa0중\\xa0진행되는\\xa0\'2023년\\xa0미래내일\\xa0일경험\\xa0사업’\\xa0우수\\xa0프로젝트\\xa0공모전을\\xa0통해\\xa0선발\\xa0과정을\\xa0거친\\xa0뒤\\xa0서울에서\\xa0진행하는\\xa0전국\\xa0콘퍼런스\\xa0전시에\\xa0참여할\\xa0예정이다.""}]']","청년일리창출사업의 주관 기관은 고용노동부입니다. 이 사업은 청년의 일 경험을 지원하기 위해 다양한 프로그램을 운영하며, 각 지역의 대학일자리플러스센터와 협력하여 진행됩니다. 예를 들어, '2023 미래내일 일경험 프로젝트형(청년주도) 사업'은 고용노동부의 일환으로 운영되고 있습니다."
청년안심주택 공급 매입 정책을 주관하는 기관은 어디인가요?,"['정책 이름: 청년안심주택 공급 매입', '주관 기관: 전략주택공급과']",전략주택공급과,"[""[Document(metadata={'name': '청년행복주택 청년을 위한 공적임대주택 공급 ', 'source': '..\\\\data\\\\policy_result.json'}, page_content='기관:국토교통부 정책 분야:주거분야 지원 내용:  청년들의 주거복지 실현을 위해 청년공공임대주택 청년행복주택  청년전세임대주택  사업과 청년 공공지원 민간주택임대 청년매입임대 다가구  사업 실시   시세 대비 저렴한 임대료  보증금과 안정적인 거주 기간 을 보장 사업 신청 기간:상시 지원 규모(명): 입주자 모집공고 확인 비고:수시 모집   입주자 모집공고 확인  연령:만 19세 ~ 39세 거주지 및 소득: 입주자 모집공고 확인 학력: 공공임대  사회초년생  대학생  취업준비생  공공지원민간임대  무주택 청년 특화 분야: 공공임대   청년전세임대  대학생  취업준비생 추가 단서 사항:행복주택 자가진단의  마이홈 공공주택 통합  행복주택 자가진단 가능  hws portal dgn moveSelfDiagnosisHappyView.do 참여 제한 대상: 입주자 모집공고 확인 신청 절차:  LH청약센터    임대주택     행복주택  클릭 제출 서류: 입주자 모집공고 확인 주거  지원대상 요건은 다양한 공급유형과 순위 에  서로 다른 요건들을 요구함 반드시  공고 확인 방법에  과거 공고문 참고   공고문의 요건 재확인 필요 주관 기관:국토교통부 민간임대정책과 운영 기관:LH공사'), Document(metadata={'name': '주택 안심계약 도움 ', 'source': '..\\\\data\\\\policy_result.json'}, page_content='기관:충남 정책 분야:주거분야 지원 내용:  청년 맞춤형 부동산 전문상담  집보기 동행  사업 운영 기간:  2024 01 01~2024 12 31 사업 신청 기간:상시 비고:  상시 연령:만 19세 ~ 45세 거주지 및 소득:  충남거주  거주예정 청년 연령은 시군 사정에  다름  신청 절차:  온라인 예정   유선신청 심사 및 발표:  신청자 개별 통지 유선   주관 기관:  충청남도 운영 기관:  15개 시군'), Document(metadata={'name': '청년안심주택 공급 매입 ', 'source': '..\\\\data\\\\policy_result.json'}, page_content='기관:서울 정책 분야:주거분야 지원 내용:역세권 간선도로변 의 민간소유 토지를 체계적으로 개발 민간 주도 공공 지원 하여 쾌적하고 저렴한 주택을 공급함으로써 청년층의 주거안정을 도모하고 지역경제를 활성화하고자 함. 사업 신청 기간:상시 지원 규모(명):8 184실 공공 2 216실  민간 5 968실  비고:연간 상시   공고문 필히 참고 요망 연령:만 19세 ~ 39세 기타 유익 정보:  공공임대 문의   1600 3456   청년안심주택의 원활한 공급  운영을 위하여 사업자  입주자를 대상으로 종합적인 컨설팅  상담 지원 주관 기관:전략주택공급과 운영 기관:전략주택공급과'), Document(metadata={'name': '소셜믹스형 공공임대주택  청년주택 ', 'source': '..\\\\data\\\\policy_result.json'}, page_content='기관:서울 금천구 정책 분야:주거분야 지원 내용:주거  자립기반이 취약한 청년층의 주거 공급 사업 신청 기간:미정 비고:수시 연령:만 19세 ~ 39세 거주지 및 소득:서울시 거주 공고문 필히 참고 신청 절차:모집공고를 통한 신청자 접수 주관 기관:금천구청 일자리청년과 운영 기관:02 2627 2587'), Document(metadata={'name': ' 제주특별자치도  제주특별자치도개발공사  한국토지주택공사 2024년 매입 임대주택 공급', 'source': '..\\\\data\\\\policy_result.json'}, page_content='기관:제주 정책 분야:주거분야 지원 내용:  지원받을 수 있는 사항   저렴한 임대조건으로 임대주택 지원    아래의 만  가능   본인과 부모소득 합계 평균소득 100% 이하  무주택자    지원상세   다가구  기존주택 매입 임대사업 정책이란      다가구  기존주택을 매입하여 개보수하거나 개량한 후 저소득 청년 신혼부부 에게 저렴한 임대조건으로 공급하여 주거안정 도모   입주대상자 상세안내  1. 무주택자인 미혼 청년    1순위   생계 주거 의료급여 수급자  한부모가족  차상위계층    2순위   본인과 부모의 월평균 소득이 전년도 도시근로자 가구당 월평균 소득의 100% 이하    3순위   1  2순위에 하지 아니하는 사람 중 본인의 월평균 소득이 전년도 도시근로자 가구당 월평균 소득의 100% 이하  2. 우선공급    아동복지시설 가정위탁 포함 에서 퇴소 예정이거나 퇴소한지 5년이 지나지 아니한 사람    청소년 쉼터에서 퇴소 예정이거나 퇴소한지 5년이 지나지 아니한 사람 청소년 쉼터를 2년 이상 한 사람에 한 한다  중 여성가족부장관이 주거지원이 필요 하다고 인정하여 공공주택사업자에게 통보한 사람 사업 신청 기간:2024년 01월01일 ~ 2024년 12월31일 비고:사업기간2024 01 01 ~ 2024 12 31 운영기간2024 01 01 ~ 2024 12 31 신청기간2024 01 01 ~ 2024 12 31 연령:만 19세 ~ 39세 거주지 및 소득:  지원 대상자   다가구  기존주택 매입 후 저소득층에게 공급   19세 39세 무주택 저소득 청년  신혼부부 고령자  추가 단서 사항:지역기준  제주도  제주시  서귀포시 주관 기관:제주특별자치도 운영 기관:제주특별자치도  제주특별자치도개발공사  한국토지주택공사   주택정책팀')], [{'url': 'https://news.seoul.go.kr/citybuild/archives/509679', 'content': '청년안심주택(공공임대) 매입업무 처리기준 < 주택 < 서울특별시 서울특별시 서울도시계획헌장 소개 2030 도시기본계획 소개 한강변관리기본계획 소개 도시계획 소개 돈의문 박물관마을 소개 공동체주택 소개 정비사업 통합심의위원회 심의 결과 건축신속행정 소개 사업 소개 사업 소개 건설기술 자료실 품질시험소 소개 공동체주택 소개 정비사업 통합심의위원회 심의 결과 건축신속행정 소개 사업 소개 사업 소개 서울특별시 신혼부부안심주택 관련 자료 서울특별시 어르신안심주택 관련 자료 청년안심주택 간선도로 현황(참고자료) 서울시 청년안심주택 공식 홈페이지 서울시 청년안심주택 소개영상 청년안심주택 건설자금 융자지원관련 공고문 및 신청서양식 청년안심주택 사전검토단 회의 신청 샘플(참고용) 청년안심주택 건립 및 운영기준 청년안심주택(역세권 청년주택) 사업인가 완료 사업장 현황 상업성 광고, 저작권 침해, 저속한 표현, 특정인에 대한 비방, 명예훼손, 정치적 목적, 유사한 내용의 반복적 글, 개인정보 유출,그 밖에 공익을 저해하거나 운영 취지에 맞지 않는 댓글은 서울특별시 조례 및 개인정보보호법에 의해 통보없이 삭제될 수 있습니다.'}, {'url': 'https://soco.seoul.go.kr/youth/main/main.do', 'content': '청년안심주택 공식홈페이지 바로가기 메뉴 청년안심주택 청년안심주택? 단지별 정보 금융지원 금융지원 안내 청년안심주택 임대보증금 지원 서울시 청년월세지원 로그인 메뉴 메뉴 청년안심주택 닫기 청년안심주택?more 단지별 정보 금융지원 안내 청년안심주택 임대보증금 지원 서울시 청년월세지원 청년안심주택? 단지별 정보 금융지원 금융지원 안내 청년안심주택 임대보증금 지원 서울시 청년월세지원 원하시는 청년주택을 찾아보세요. 우리동네 청년안심주택을 찾아보세요 [공공임대] 2024년 3차 청년안심주택 입주자 모집공고문 2024-12-23 [민간임대] 건대입구역 더포디엄860 입주자 모집공고문 2024-12-19 [안내] 2024년도 2분기 청년안심주택 공공지원민간임대 관리비 부과 현황 2024-10-15 [안내] 2024년도 1분기 청년안심주택 공공지원민간임대 관리비 부과 현황 2024-07-02 [안내] (8/1부터) 접수 시간 변경 안내(청년안심주택 임대보증금 지원) 2024-07-02 08] 청년안심주택(2) 편 2024-05-07 자주 찾는 자료 2030청년안심주택 관련 방문자가 자주찾는 자료 모집공고 단지별 정보 공급현황 금융지원 FAQ 서울시 홈페이지 서울시 주거포털 [04375] 서울시 용산구 백범로99길 40, 용산베르디움프렌즈 102동 2층'}]""]","청년안심주택 공급 매입 정책을 주관하는 기관은 서울특별시의 전략주택공급과입니다. 이 기관은 청년층의 주거 안정을 도모하기 위해 역세권 및 간선도로변의 민간소유 토지를 체계적으로 개발하고, 저렴한 임대주택을 공급하는 사업을 운영하고 있습니다."
청년안심주택 공급 매입 정책의 지원 연령대는 어떻게 되나요?,"['정책 이름: 청년안심주택 공급 매입', '연령: 만 19세 - 39세']",만 19세 - 39세,"[""[Document(metadata={'name': '주택 안심계약 도움 ', 'source': '..\\\\data\\\\policy_result.json'}, page_content='기관:충남 정책 분야:주거분야 지원 내용:  청년 맞춤형 부동산 전문상담  집보기 동행  사업 운영 기간:  2024 01 01~2024 12 31 사업 신청 기간:상시 비고:  상시 연령:만 19세 ~ 45세 거주지 및 소득:  충남거주  거주예정 청년 연령은 시군 사정에  다름  신청 절차:  온라인 예정   유선신청 심사 및 발표:  신청자 개별 통지 유선   주관 기관:  충청남도 운영 기관:  15개 시군'), Document(metadata={'name': '청년행복주택 청년을 위한 공적임대주택 공급 ', 'source': '..\\\\data\\\\policy_result.json'}, page_content='기관:국토교통부 정책 분야:주거분야 지원 내용:  청년들의 주거복지 실현을 위해 청년공공임대주택 청년행복주택  청년전세임대주택  사업과 청년 공공지원 민간주택임대 청년매입임대 다가구  사업 실시   시세 대비 저렴한 임대료  보증금과 안정적인 거주 기간 을 보장 사업 신청 기간:상시 지원 규모(명): 입주자 모집공고 확인 비고:수시 모집   입주자 모집공고 확인  연령:만 19세 ~ 39세 거주지 및 소득: 입주자 모집공고 확인 학력: 공공임대  사회초년생  대학생  취업준비생  공공지원민간임대  무주택 청년 특화 분야: 공공임대   청년전세임대  대학생  취업준비생 추가 단서 사항:행복주택 자가진단의  마이홈 공공주택 통합  행복주택 자가진단 가능  hws portal dgn moveSelfDiagnosisHappyView.do 참여 제한 대상: 입주자 모집공고 확인 신청 절차:  LH청약센터    임대주택     행복주택  클릭 제출 서류: 입주자 모집공고 확인 주거  지원대상 요건은 다양한 공급유형과 순위 에  서로 다른 요건들을 요구함 반드시  공고 확인 방법에  과거 공고문 참고   공고문의 요건 재확인 필요 주관 기관:국토교통부 민간임대정책과 운영 기관:LH공사'), Document(metadata={'name': '서울시 청년안심주택 공공지원민간임대  임대보증금 지원', 'source': '..\\\\data\\\\policy_result.json'}, page_content='기관:서울 정책 분야:주거분야 지원 내용:  임차보증금의 30% 무이자 지원 청년   최대 4 500만원  신혼부부   최대 6 000만원    임차보증금이 1억원 이하인  50% 무이자 지원 청년  신혼부부   최대 4 500만원  사업 신청 기간:상시 비고:신규 입주 예정 일 3주 전까지 방문신청 평일 10 00 ~15 00 점심시간 없이 운영  연령:만 19세 ~ 39세 거주지 및 소득:  소득기준 2024년 3월 1일 이후 접수자 기준    청년   신청자 본인 1인 가구  소득 기준 전년도 도시근로자 가구원수별 가구당 월평균 100%이하 3 482 296원     신혼부부   신호부부  자녀 합산 소득 기준 전년도 도시근로자 가구원수별 가구당 월평균 소득 120%이하 2인가구 6 498 854원   3인가구 8.638.379원    자산기준    청년   신청자 본인 자산 기준 2억 7 300만원 이하    신혼부부   신혼부부  자녀 합산 자산 기준 3억 4 500만원 이하 신청 절차:  임대차 계약 후 청년안심주택 종합지원센터 방문신청 방문신청 시 지원약정서 작성  구비서류 제출    신청기간   신규 입주 예정 일 3주 전까지 방문 신청 평일 10 00~15 00 점심시간 없이 운영    신청장소   서울특별시 용산구 백범로99길 40  용산베르디움프렌즈 102동 상가동  2층  청년안심주택 종합지원센터   최초 계약 시는 입주개시 예저 일 3주전까지 방문 신청 최소 3주 기간 소요    문의전화   1600 3456 제출 서류:서울시 청년안심주택 공공지원민간임대  임대보증금 지원 신청 안내문 참고 기타 유익 정보:  청년안심주택 임대보증금 예산 소진시 지원 불가   청년안심주태 공공임대  입주자 신청 불가   청년안심주택 임대보증금 지원과 서울시 청년 신혼부부 임차보증금 이자지원사업 중복 신청 불가   접수 후 입대차 계약 내용 변경 불가   문의전화   1600 3456 주관 기관:서울시청 전략주택공급과 운영 기관:주관기관과 동일'), Document(metadata={'name': '2024년 청년 월세 주거비 지원사업', 'source': '..\\\\data\\\\policy_result.json'}, page_content='기관:경북 고령군 정책 분야:주거분야 지원 내용:  지원대상   아래 요건을 모두 충족하는 자   고령군 거주  거주 예정인 18세 이상 45세 청년   청년 1인가구  청년 신혼부부 혼인신고일 7년 이내    임차보증금 5천만원 이하이면서 월세 50만원 이하의 주택에 월세로 거주하는 전국 기준 무주택자   가구당 기준 중위소득 180% 이하 사업 운영 기간:2024 03 11~2024 12 20 사업 신청 기간:미정 지원 규모(명):70명 정도 비고:미정 연령:만 18세 ~ 45세 주관 기관:고령군 운영 기관:고령군'), Document(metadata={'name': 'G밸리 하우스  청년주택 ', 'source': '..\\\\data\\\\policy_result.json'}, page_content='기관:서울 금천구 정책 분야:주거분야 지원 내용:주거  자립기반이 취약한 청년층의 주거 공급 사업 신청 기간:미정 비고:미정 연령:만 19세 ~ 39세 거주지 및 소득:서울시 거주 추후 공고문 참고 신청 절차:모집공고를 통한 신청자 접수 주관 기관:금천구청 일자리청년과 청년동행팀 운영 기관:주관기관과 동일')], [{'url': 'https://gyulgyul-2.com/entry/2024년-2차-청년안심주택-놓치지-마세요-상세-정보와-지원-방법-총정리', 'content': '2024년 2차 청년안심주택, 놓치지 마세요! 2024년 2차 청년안심주택, 놓치지 마세요! 바로 2024년 2차 청년안심주택 모집이 시작되었다는 소식입니다. 이번 포스팅에서는 2024년 2차 청년안심주택에 대한 자세한 정보와 지원 방법을 알려드리겠습니다. 1. 2024년 2차 청년안심주택이란 무엇인가요? 2024년 2차 청년안심주택은 서울시에서 추진하는 청년 주택 공급 사업의 일환으로, 청년들의 주거 안정을 위해 마련된 공공임대주택입니다. 2024년 2차 청년안심주택의 지원 대상은 입주자 모집공고일(2024. 기준) 현재 19세 이상 39세 이하로서 무주택요건을 충족하고 계층별 소득, 총 자산 요건을 충족하는 청년 및 신혼부부 청년안심주택 입주자 선정은 소득, 자산, 가구 구성 등을 종합적으로 고려하여 이루어집니다. 청년: 무주택자 / 신혼부부: 무주택세대구성원 6세이하 자녀가 있는 한부모가족\\xa03순위\\xa0 자녀가 없는 (예비) 신혼부부4순위\\xa0 6세 이하 자녀가 있는 혼인 가구 2024년 2차 청년안심주택은 청년들의 주거 안정을 위한 소중한 기회입니다. 서울시, 주거지원, 청년 정책, 청년안심주택, 청년주택'}, {'url': 'https://blog.okfngroup.com/content/what-is-youth-safe-housing', 'content': '가족 유형에 따라 결혼한 지 7년 이내의 신혼부부 외에도 예비신혼부부, 신생아 가구, 보호 대상 한부모가족, 6세 이하 자녀가 있는 한부모 가족 또는 혼인 가구, 기타 혼인 가구(5순위)로 분류되어 신청할 수 있어요. 신혼부부형은 소득과 순위, 총자산, 자동차 가액에 따라 신혼부부Ⅰ 유형과 신혼부부Ⅱ 유형으로 나눌 수 있어요. 신혼부부Ⅰ 유형의 총자산 조건은 3억 4,500만 원 이하여야 하고, 자동차 가액은 3,708만 원 이하면 충족할 수 있어요. 청년안심주택 임대보증금 지원 사업은 2023년 2월 1일 접수자부터 소득 및 자산가액 기준을 모두 충족해야 신청할 수 있는데요. ### 금 투자 방법 총정리 2024 – 금통장 만들기, 금 현물투자, 금테크 금 투자는 크게 직접투자와 간접투자로 나눌 수 있어요. 자동차 담보대출의 뜻과 조건, 그리고 무직자를 대상으로 하는 자동차 담보대출 추천 상품 4개를 함께 알아보세요.* 2024.10.11'}]""]","2024년 청년안심주택의 지원 연령대는 만 19세 이상부터 39세 이하입니다. 이 정책은 청년들의 주거 안정을 위해 마련된 공공임대주택으로, 무주택 요건을 충족해야 하며, 소득 및 자산 요건을 만족해야 합니다. 신청 가능 대상을 보다 구체적으로 나누면, 예비 신혼부부나 6세 이하 자녀가 있는 가구 등도 포함될 수 있습니다. 

서울시의 청년안심주택은 청년 및 신혼부부를 위한 주거 지원 정책으로, 일반적으로 입주자 모집공고일 기준으로 연령이 설정됩니다. 추가로, 청년안심주택의 자산 및 소득 기준은 매년 조사되어 변경될 수 있으므로, 구체적인 내용은 모집공고를 통해 확인하는 것이 중요합니다."
청년안심주택 공급 매입 정책에 대한 공공임대 문의 전화번호는 무엇인가요?,"['정책 이름: 청년안심주택 공급 매입', '기타 유익 정보: 공공임대 문의 1600 3456']",1600 3456,"[""[Document(metadata={'name': '2024년 공공임대주택 공급', 'source': '..\\\\data\\\\policy_result.json'}, page_content='기관:제주 정책 분야:주거분야 지원 내용:  지원내용   대표 내용   지원 대상자    공공임대주택 건설 공급  공공주택 건립 부지 매입 추진   사회초년생  대학생  신혼부부  저소득층 노인계층 취약계층 의 주거안정 도모를 위한 공공임대주택 공급   19세 39세 대학생  청년  신혼부부  한부모     지원받을 수 있는 사항   공공임대주택 입주     아래의 만  가능   본인과 부모소득 합계 소득이 평균소득 100%이하   무주택자    지원상세   공공주택 공급 정책이란     사회초년생  대학생  신혼부부  저소득층 노인계층 취약계층 의 주거안정 도모를 위한 사업    더 자세한 내용 알아보기   제주시권역 주거복지 센터 064 753 9500   서귀포시권역 주거복지 센터 064 767 9500   한국토지주택공사 콜센터 1670 0002 사업 신청 기간:2024년 01월01일 ~ 2024년 12월31일 비고:사업기간2016 01 01 ~ 2027 12 31 운영기간2024 01 01 ~ 2024 12 31 신청기간2024 01 01 ~ 2024 12 31 연령:만 19세 ~ 39세 거주지 및 소득:지역기준   제주도  제주시  서귀포시 추가 단서 사항:  더 자세한 내용 알아보기   제주시권역 주거복지 센터 064 753 9500   서귀포시권역 주거복지 센터 064 767 9500   한국토지주택공사 콜센터 1670 0002 주관 기관:제주특별자치도   주택토지과 주택정책팀  운영 기관:제주특별자치도   주택토지과 주택정책팀 '), Document(metadata={'name': '소셜믹스형 공공임대주택  청년주택 ', 'source': '..\\\\data\\\\policy_result.json'}, page_content='기관:서울 금천구 정책 분야:주거분야 지원 내용:주거  자립기반이 취약한 청년층의 주거 공급 사업 신청 기간:미정 비고:수시 연령:만 19세 ~ 39세 거주지 및 소득:서울시 거주 공고문 필히 참고 신청 절차:모집공고를 통한 신청자 접수 주관 기관:금천구청 일자리청년과 운영 기관:02 2627 2587'), Document(metadata={'name': '주택 안심계약 도움 ', 'source': '..\\\\data\\\\policy_result.json'}, page_content='기관:충남 정책 분야:주거분야 지원 내용:  청년 맞춤형 부동산 전문상담  집보기 동행  사업 운영 기간:  2024 01 01~2024 12 31 사업 신청 기간:상시 비고:  상시 연령:만 19세 ~ 45세 거주지 및 소득:  충남거주  거주예정 청년 연령은 시군 사정에  다름  신청 절차:  온라인 예정   유선신청 심사 및 발표:  신청자 개별 통지 유선   주관 기관:  충청남도 운영 기관:  15개 시군'), Document(metadata={'name': '서울시 청년안심주택 공공지원민간임대  임대보증금 지원', 'source': '..\\\\data\\\\policy_result.json'}, page_content='기관:서울 정책 분야:주거분야 지원 내용:  임차보증금의 30% 무이자 지원 청년   최대 4 500만원  신혼부부   최대 6 000만원    임차보증금이 1억원 이하인  50% 무이자 지원 청년  신혼부부   최대 4 500만원  사업 신청 기간:상시 비고:신규 입주 예정 일 3주 전까지 방문신청 평일 10 00 ~15 00 점심시간 없이 운영  연령:만 19세 ~ 39세 거주지 및 소득:  소득기준 2024년 3월 1일 이후 접수자 기준    청년   신청자 본인 1인 가구  소득 기준 전년도 도시근로자 가구원수별 가구당 월평균 100%이하 3 482 296원     신혼부부   신호부부  자녀 합산 소득 기준 전년도 도시근로자 가구원수별 가구당 월평균 소득 120%이하 2인가구 6 498 854원   3인가구 8.638.379원    자산기준    청년   신청자 본인 자산 기준 2억 7 300만원 이하    신혼부부   신혼부부  자녀 합산 자산 기준 3억 4 500만원 이하 신청 절차:  임대차 계약 후 청년안심주택 종합지원센터 방문신청 방문신청 시 지원약정서 작성  구비서류 제출    신청기간   신규 입주 예정 일 3주 전까지 방문 신청 평일 10 00~15 00 점심시간 없이 운영    신청장소   서울특별시 용산구 백범로99길 40  용산베르디움프렌즈 102동 상가동  2층  청년안심주택 종합지원센터   최초 계약 시는 입주개시 예저 일 3주전까지 방문 신청 최소 3주 기간 소요    문의전화   1600 3456 제출 서류:서울시 청년안심주택 공공지원민간임대  임대보증금 지원 신청 안내문 참고 기타 유익 정보:  청년안심주택 임대보증금 예산 소진시 지원 불가   청년안심주태 공공임대  입주자 신청 불가   청년안심주택 임대보증금 지원과 서울시 청년 신혼부부 임차보증금 이자지원사업 중복 신청 불가   접수 후 입대차 계약 내용 변경 불가   문의전화   1600 3456 주관 기관:서울시청 전략주택공급과 운영 기관:주관기관과 동일'), Document(metadata={'name': '자립준비청년 LH 건설임대주택 우선지원 대상자 추천', 'source': '..\\\\data\\\\policy_result.json'}, page_content='기관:한국토지주택공사 정책 분야:주거분야 지원 내용:자립준비청년 보호종료아동 의 신속한 주거생활  자립지원을 위한 LH 건설임대주택 영구  국민  행복  우선 지원   지원기간  최초 임대기간은 2년으로 하되  갱신조건 충족 시 2년 단위 재계약 가능    임대조건  보증금 1백만원 적용  기본 보증금과의 보증금 차액은 임대료로 전환    자격검증  국민 영구 행복주택의 입주자격  주택 소득 자산기준 동일하게 적용하되  신청자 본인 기준으로 검증    지원절차   대상자  기관  이메일 신청    아동권리보장원  매월 대상자 추천    LH  대상자 희망수요 지역  임대유형  감안하여 임대주택 물색  배정   입주까지 최소 3~6개월 이상 소요 예정  건설임대주택에 한해 입주기준 1회 지원 사업 운영 기간:2024.01.01 ~ 2024. 12. 31. 예정  사업 신청 기간:상시 지원 규모(명):전국 000명 비고:공고기간 참고 연령:만 18세 이상 거주지 및 소득:  6개월 이내 퇴소예정자  보호연장아동  보호종료 5년이내 아동   18세 이상 단  6개월 내 퇴소예정자라면 미성년자도 신청 가능 신청 절차:자립정보ON 알림 소식 공지사항  2024년 자립준비청년 건설임대주택 우선지원 대상자 추천 안내  확인 후  양식 작성하여 메일 jarip ncrc.or.kr 로 제출 심사 및 발표:한국토지주택공사에서 자격검증 후 대상자에게 임대차 계약 안내  개발 안내 제출 서류:아동추천명단  보호종료확인서  개인정보수집동의서 기타 유익 정보:문의  LH 유스타트 상담센터 1670 2288  주관 기관:한국토지주택공사 운영 기관:아동권리보장원')], [{'url': 'https://www.i-sh.co.kr/main/lay2/program/S1T294C295/www/brd/m_241/view.do?seq=272550', 'content': '통합검색 열기 전체 메뉴 보기 로그인 회원가입 공고 및 공지 전체 전체 공고 및 공지는 서울주택도시공사에서 시행하는 각종 분양, 임대, 청약, 보상, 이주, 설계 등의 대내외 공개가 필요한 사항들에 대해 고객 여러분께 알려드리는 곳입니다. 첨부  [수정] 2024년 1차 청년안심주택 공고문-최종(웹용).pdf 미리보기 2024년 1차 청년안심주택(공공임대) 입주자 모집공고(2024. ■ 모집공고일 : 2024. - 단지 및 공급호수 등 자세한 사항은 공고문을 확인하여 주시기 바랍니다. 3. 29.) 현재 19세 이상 39세 이하로서 무주택요건을 충족하고 계층별 소득, 총자산 요건을 충족하는 청년 및 신혼부부 - 인터넷 및 모바일로만 신청 가능합니다. ■ 서류심사대상자 발표 : 2024. - 기타 자세한 사항은 첨부된 공고문을 확인하여 주시기 바랍니다. ■ 신청문의 : 서울주택도시공사 콜센터 T.1600-3456 이전글/다음글 이전글 서초 성뒤마을 공공주택지구(A1) 건축설계공모 공고 다음글 SH 서울주택도시공사 로그인 회원가입'}, {'url': 'https://soco.seoul.go.kr/youth/main/main.do', 'content': '청년안심주택 공식홈페이지 바로가기 메뉴 청년안심주택 청년안심주택? 단지별 정보 금융지원 금융지원 안내 청년안심주택 임대보증금 지원 서울시 청년월세지원 로그인 메뉴 메뉴 청년안심주택 닫기 청년안심주택?more 단지별 정보 금융지원 안내 청년안심주택 임대보증금 지원 서울시 청년월세지원 청년안심주택? 단지별 정보 금융지원 금융지원 안내 청년안심주택 임대보증금 지원 서울시 청년월세지원 원하시는 청년주택을 찾아보세요. 우리동네 청년안심주택을 찾아보세요 [공공임대] 2024년 3차 청년안심주택 입주자 모집공고문 2024-12-23 [민간임대] 건대입구역 더포디엄860 입주자 모집공고문 2024-12-19 [안내] 2024년도 2분기 청년안심주택 공공지원민간임대 관리비 부과 현황 2024-10-15 [안내] 2024년도 1분기 청년안심주택 공공지원민간임대 관리비 부과 현황 2024-07-02 [안내] (8/1부터) 접수 시간 변경 안내(청년안심주택 임대보증금 지원) 2024-07-02 08] 청년안심주택(2) 편 2024-05-07 자주 찾는 자료 2030청년안심주택 관련 방문자가 자주찾는 자료 모집공고 단지별 정보 공급현황 금융지원 FAQ 서울시 홈페이지 서울시 주거포털 [04375] 서울시 용산구 백범로99길 40, 용산베르디움프렌즈 102동 2층'}]""]","청년안심주택 공급 매입 정책에 대한 공공임대 문의 전화번호는 다음과 같습니다:

- **서울주택도시공사 콜센터**: 1600-3456

이 번호로 문의하시면 청년안심주택 관련 정보 및 지원 사항에 대해 자세한 안내를 받으실 수 있습니다. 추가적인 정보가 필요하시면 서울시 주거포털을 방문하시거나, 해당 기관에 직접 연락해 보시기 바랍니다."
동차부품구 청년일리지원 정책의 지원 내용을 알려주세요.,"['정책 이름: 동차부품구 청년일리지원', '지원 내용:  신규 채용 청년근로 인건비  집체교육  네트워킹  구소 운영비 지원']","신규 채용 청년근로 인건비, 집체교육, 네트워킹, 구소 운영비 지원","[""[Document(metadata={'name': '광주시 청년 1인가구 이사지원 사업 독립응원 패키지 ', 'source': '..\\\\data\\\\policy_result.json'}, page_content='기관:경기 광주시 정책 분야:주거분야 지원 내용:  지원대상  2024. 1. 1. 이후 광주시 전입  광주시 내에서 이사한 19세~39세 청년 1인 가구   광주시 전출 제외   지원내용  1인 최대 500 000원 한도 실비지원  생애 1회    지원항목  이사비 차량 대여비  운반비  포장비   집수리 전구  문고리   입주청소  이사에 실제 사용한 금액 최대 500 000원 실비지원   부동산 중개 보수 중개 수수료  불포함 사업 신청 기간:상시 비고:  접수기간   매월 1일~10일  매월 20일까지 선정대상자 개별 문자 전송  매월 25일까지 지역화폐 충전   모집완료시 종료   선정  지급   평일 기준으로 주말  공휴일 제외 연령:만 19세 ~ 39세 거주지 및 소득:  소득기준   가구당 기준 중위소득 180% 이하    개인 고지금액을 기준으로 하되  소득이 없는 청년의  가구소득 기준으로 판단    신청인 혹은 가구 의 건강보험료 고지금액  전입신고 기준월 이  2024년 건강보험료 소득판정 기준표상 기준 중위소득 180% 이하   건강보험료 고지금액 조회가 어려운  별도의 소득 증빙자료를 요청할 수 있음   이사비 지원액 예산 초과 시  접수 완료 순으로 선착순 지급 신청 절차:  온라인 신청 청년지원센터 홈페이지   공지 사항   신청서 다운로드   이메일 제출    접 수 처  광주시 청년지원센터   gj youth naver.com   주관 기관:광주시 청년지원센터   031 8027 0371 '), Document(metadata={'name': '청년 활성화 지원사업', 'source': '..\\\\data\\\\policy_result.json'}, page_content='기관:서울 강서구 정책 분야:.권리분야 지원 내용:1. 강서구 청년기구 운영 청년정책 공론장 운영  2. 강창맨 강서청년 창업지원 멘토링   3. 청년이 맘편히 일하는 강서 직업 강연   4. 푸르름 마음 치유 학교 음악 미술 치료   사업 신청 기간:미정 지원 규모(명):20명 이상 비고:연내 연령:만 19세 ~ 39세 거주지 및 소득:강서구 거주하며 재직  재학  청년 누구나 취업 상태:미취업자  재직자 신청 절차:1. 강서구청 홈페이지 접속 2.  내용 확인 3. 신청서류 제출 예정  4. 개별 사업기간 중 신청 기타 유익 정보:청년 미달 시 재공고 주관 기관:강서구청 일자리정책과'), Document(metadata={'name': '청년친화강소기업 선정', 'source': '..\\\\data\\\\policy_result.json'}, page_content='기관:고용노동부 정책 분야:일자리분야 지원 내용:  청년 지원내용   청년이 선호하는 근로여건을 갖춘 청년친화강소기업을 선정하여 기업 정보     기업 지원내용   기업정보   워크넷을  기업현황  채용정보   기업 현장정보를 청년의 시각으로 전달하는 기업탐방기 게시   인센티브   정기 세무조사 선정 제외 우대  각종 사업  선정시 우대    일학습병행학습기업 선정  가족친화인증기업 선정  폭염재난예방 대책설비 지원  청년채용박람회 개최  병역지엉업체 지정  신한은행 특별협약 보증 우대  사업 운영 기간:2024.1.1.~12.31. 사업 신청 기간:상시 비고:상시 거주지 및 소득: 기업  고용보험법상 우선지원대상기업 참여 제한 대상:  근로기준법 제43조의 2에  체불사업주 명단공개  기업 사업주    최근 2년 이내 산업안전보건법 제10조에  산업재해 발생건수  공표 기업   최근 2년 이내 근로자가 부당해고 구제를 신청하여 부당해고로 결정  판정 확정된 기업   최근 2년 이내 직장 내 괴롭힘  성폭력  성희롱으로 적발되어 처벌 확정  과태료 부과 기업   최근 2년 연속 전년 대비 매출액 15%이상 감소 기업    신용평가급 이 BB 미만 기업   상호출자제한기업 집단  공공기관  지방공기업   10인 미만 기업 건설업 30인 미만    소비향락업  중소기업인력지원특별법 제외 업종  고용알선업  인력공급업 신청 절차:별도없음 심사 및 발표:별도없음 주관 기관:고용노동부 운영 기관: 사 벤처기업협회'), Document(metadata={'name': '전북청년 로컬 인 캠프 남원 높이 날아오르다 일시   10.3~10.6 ', 'source': '..\\\\data\\\\policy_result.json'}, page_content='기관:전북 정책 분야:.권리분야 지원 내용:전북청년허브센터에서 중앙청년지원센터  남원청년센터 청년마루와 함께 남원청년정책  청년창업기업 전시홍보 판매 체험부스 운영을 지역 내 청년정책 인식제고와 청년활동 지원을 위해전북청년 로컬 인 캠프  남원 높이 날아오르다 를 개최하오니 청년들의 많은 관심과  바랍니다.   일시   2024. 10. 3. 목 ~10. 6. 일  10 00~18 00   장소   남원종합스포츠타운 남원시 충정로 341    주요내용   청년창업기업 부스  체험  네트워킹  사업 신청 기간:미정 비고:별도 신청없음   일시   2024. 10. 3. 목 ~10. 6. 일  10 00~18 00   장소   남원종합스포츠타운 남원시 충정로 341  참여 제한 대상:민국 누구나 주관 기관:전북청년허브센터 운영 기관:전북청년허브센터'), Document(metadata={'name': '경북 상주시 청년 주거 임차비 지원사업 지역 정착 창업사업 자 대상 ', 'source': '..\\\\data\\\\policy_result.json'}, page_content='기관:경북 상주시 정책 분야:주거분야 지원 내용:지원내용  청년 주거 월세의 80%를 지원  최대 30만원 한도  1인 최대 10개월간 지원  지원대상  상주시 청년 만 19세 ~ 39세 이하 이고  지역 정착 창업사업 자   지역정착 창업사업  서울시 지역연계형 청년 창업 지원사업  청년창업 지역정착 지원사업  청년예비창업가 육성사업  지역주도형 청년 일자리 사업  상주시 전통시장 빈점포 창업지원사업  경북 상문동 로컬 업앤다운 지원사업 사업 신청 기간:상시 지원 규모(명):15명 비고:연중상시 연령:만 19세 ~ 39세 거주지 및 소득:상주시 청년 만 19세 ~ 39세 이하 이고  지역 정착 창업사업 자 취업 상태:자영업자 창업자 영농종사자 특화 분야:지역인재 신청 절차:이메일  우편  방문 접수 제출 서류:지원신청서  개인정보 수집동의서  임대차 계약서  주민록초본  주관 기관:상주시청 미래정책실 운영 기관:상주시청 미래정책실')], [{'url': 'https://blog.3o3.co.kr/2025_young_generation/', 'content': '2025 청년 지원 정책 모아보기 2025 청년 지원 정책 모아보기 그중 청년 지원 정책을 위한 예산 항목을 모아봤어요. 2. 청년 연구자 장학금, 연구 장려금 지원 지원: 석사는 월 150만원, 박사는 월 200만원 지급 대상: 석사, 박사 과정에 있는 청년 연구자 지원: 석사는 월 100만원, 박사는 월 210만원의 연구 장려금 지급 3. 청년 자산형성, 주거 도약 원스톱 지원 지원: 월 40만 원~70만원이었던 정부 매칭 금액이 모두 70만원으로 상향 지원: 훈련 취업 수당 480.4만원을 지급 및 2년 근속 시 추가 장려금 480만원 지원 구직단념 청년 취업 지원 지원: 취업 프로그램 운영과 더불어 월 50만원의 참여수당 지급 5. 청년 예술인 지원 국립 예술단체 등에서 교육을 받을 수 있는 청년 교육단원 선발 및 다양한 공연에 참여 기회 제공 청년 교육단원: 350명 → 600명으로 확대'}, {'url': 'https://ruleho.com/entry/청년지원-제도-정책-총정리', 'content': '디지털 청년고민해결단\\xa0 온라인 멘토링    전국  2024-2.19-11.29 (선착순)   39세 이하 청년   청년 선배가 ICT분야 취,창업 ,진로와 관련된 고민 조언등을 멘토링  온라인 청년월세 한시 특별지원    전국  상시 모집   -만19세-34세 독립청년가구중 소득이 중위소득 60%이하이면서, 원가구 소득이 중위소득 100%이하    최대240만원 (월 최대 20만원) 온라인 청년 임차보증금 이자 지원  서울  상시  - 만 19 - 39세 이하인 자 최대 2년 (만 40세 도달시 까지)  온라인 2030 무료건강검진 전국  상시  -만 20-39세   -검진항목:비만,시각/청각,고혈압,신장질환 온라인 청년 국가기술자격시험 응시료 지원  전국  2024.1.2- 소진시 까지    -만34세 이하 청년 누구나 -한국산업인력공단이 수행하는 자격시험 응시료 연3회 50% 할인 온라인 일자리 채움 청년지원금    전국  상시  -2023.10.1-2024.9.30 기간에 취업한 청년으로 만15세 이상 34세 이하    -3개월 근속시 100만원 지급 청년 마음건강 지원  전국  상시  -만19세 이상 34세 이하'}]""]","청년 일자리 지원 정책에 대한 내용을 아래와 같이 정리해드리겠습니다.

### 청년 일자리 지원 정책

1. **청년 지원금**
   - **대상**: 만 15세 이상 34세 이하의 청년
   - **내용**: 2023년 10월 1일부터 2024년 9월 30일까지 취업한 청년에게 3개월 근속 시 100만원 지급

2. **온라인 청년 임차보증금 이자 지원**
   - **대상**: 만 19세~39세 이하 청년
   - **내용**: 최대 2년 동안 지원 (만 40세 도달 시까지)

3. **온라인 청년 월세 한시 특별지원**
   - **대상**: 만 19세~34세 독립 청년 가구 중 소득이 중위소득 60% 이하
   - **내용**: 최대 240만원 지원 (월 최대 20만원)

4. **온라인 청년 국가기술자격시험 응시료 지원**
   - **대상**: 만 34세 이하 청년
   - **내용**: 한국산업인력공단이 수행하는 자격시험 응시료 연 3회 50% 할인

5. **청년 마음건강 지원**
   - **대상**: 만 19세 이상 34세 이하 청년
   - **내용**: 정신 건강 관련 지원 및 프로그램 운영

6. **디지털 청년 고민해결단**
   - **대상**: 39세 이하 청년
   - **내용**: ICT 분야의 취업, 창업, 진로에 관한 온라인 멘토링 제공

이외에도 다양한 청년 지원 정책이 있으며, 각 정책의 세부 사항은 해당 기관이나 웹사이트를 통해 확인하실 수 있습니다. 청년 일자리와 관련된 정책은 지속적으로 업데이트되고 있으니, 주기적으로 확인하는 것이 좋습니다."
동차부품구 청년일리지원 정책의 사업 운영 기간은 언제인가요?,"['정책 이름: 동차부품구 청년일리지원', '사업 운영 기간:2023.01.01. 2024.12.31.']",2023.01.01.부터 2024.12.31.까지,"['[Document(metadata={\'name\': \'청년정책위원회 운영\', \'source\': \'..\\\\data\\\\policy_result.json\'}, page_content=\'기관:인천 동구 정책 분야:.권리분야 지원 내용:  지역 청년과의 소통창구  현장 의견수렴   구정 와 정책 제안 발굴    청년정책에  기본계획 수립과정   사업 운영 기간:2024.1. ~ 12. 사업 신청 기간:미정 비고:사업기간   2024.1~12 연령:만 19세 ~ 39세 거주지 및 소득:  거주지   제한없음  소득   지역 청년 주관 기관:인천광역시 동구 일자리경제과 운영 기관:인천광역시 동구 일자리경제과\'), Document(metadata={\'name\': \'청년 행복알바사업 구리시 \', \'source\': \'..\\\\data\\\\policy_result.json\'}, page_content=\'기관:경기 구리시 정책 분야:일자리분야 지원 내용:  사업기간   2024. 1. ~ 2.   7. ~ 8.  총 4개월    사업내용   공공업무 보조    근무장소   시청  사업소 각 부서  동 행정복지센터   자 임금  근로조건   시 급9 860원 2024년 최저임금    교통비 간식비  부대비용 지급1일 5 000원   주 연차수당 지급4대보험 가입   근로시간주20시간  일 4시간 주5일근무    근무시간 외 휴게시간 30분  사업 신청 기간:미정 지원 규모(명):  모집대상 사업개시일 현재 19세~39세 이하 구리시 거주 미취업 청년 80명.  취약계층  지역경제 침체로 생계지원이 필요한 청년 우선선발. 비고:  모집공고기간   2024. 5월 4째주 예정 연령:만 19세 ~ 39세 주관 기관:  구리시 일자리경제과 일자리정책팀 031 550 8323 \'), Document(metadata={\'name\': \'경북 청년CEO 마일스톤 지원사업\', \'source\': \'..\\\\data\\\\policy_result.json\'}, page_content=\'기관:경북 정책 분야:일자리분야 지원 내용:   1년차  사업화자금 시제품제작  홍보 마케팅  제품디자인  장비임차료  컨설팅   1인당 연 1 500만원 지원  맞춤형 레벨업 추가 지원 1인당 1 000만원     2년차  청년을 추가 신규  채용 시  청년의 인건비 1년 연 2 400만원  지원   1년차 사업종료 후 6개월 내 청년 신규 채용시 지원    전문가 연계를  밀착형 기업진단 컨설팅  운영   창업기업의 디자인  국내 외 전시회  직무역량강화    우수청년인재 채용 연계 ex. 희망이음사업  대학생 인턴십  를 통한 지역 창업기업 우선 추천 사업 운영 기간:2023 01 01~2023 12 31 사업 신청 기간:미정 지원 규모(명):도내 만 39세 이하의 창업 청년 창업 3년 이상   7년 이내 청년  5명 비고:미정 연령:만 19세 ~ 39세 주관 기관: 재 경북테크노파크 운영 기관: 재 경북테크노파크 경북청년창업지원센터\'), Document(metadata={\'name\': \'청년 창업자 네트워킹 지원\', \'source\': \'..\\\\data\\\\policy_result.json\'}, page_content=\'기관:충남 계룡시 정책 분야:일자리분야 지원 내용:  네트워킹데이 운영을 통한 청년 창업자들 간의 교류 지원   매 짝수월 마지막 월요일 오후 7시 사업 운영 기간:  2024.01.01.~2024.12.31. 사업 신청 기간:상시 지원 규모(명):  20명 이하 회 비고:  매 짝수월 네트워킹데이 전일까지 연령:만 18세 ~ 39세 거주지 및 소득:  사업자 대표 신청 절차:  청년지원팀   전화 접수 심사 및 발표:  네트워킹데이 1주일 전 안내 제출 서류:  사업자록증 주관 기관:  경제산업과 운영 기관:  계룡시\'), Document(metadata={\'name\': \'부여 청년센터 운영\', \'source\': \'..\\\\data\\\\policy_result.json\'}, page_content=\'기관:충남 부여군 정책 분야:.권리분야 지원 내용:  청년센터 대관  청년 운영 사업 운영 기간: 2024 01 01~2024 12 31 사업 신청 기간:상시 비고:  청년 우선 주관 기관:  행정복지국 전략사업과 운영 기관:  부여군 청년센터\')], [{\'url\': \'https://2030.go.kr/common.FileDownload.do?file_id=FILE_000000000003410&sec_code=undefined\', \'content\': \'제8조(청년정책 기본계획의 수립) ① 국무총리는 5년마다 청년정책에 관한 기본계획 (이하 ""기본계획""이라 한다)을 수립·시행하여야 한다. 제9조(연도별 시행계획의 수립·시행 등) ① 관계 중앙행정기관의 장과 특별시장·광역\'}, {\'url\': \'https://korea.kr/briefing/pressReleaseView.do?newsId=156653054\', \'content\': \'지역 청년을 위한 일자리 정책, 2030자문단과 청년 공무원이 만들어요 - 보도자료 | 브리핑룸 | 대한민국 정책브리핑 본문 바로가기 메인메뉴 바로가기 대한민국 정책브리핑 뉴스 뉴스 멀티미디어 뉴스 최근 1년 외교/안보 접기 부처 접기 상세검색 닫기 검색 닫기 공유 닫기 지역 청년을 위한 일자리 정책, 2030자문단과 청년 공무원이 만들어요 글자크기 설정 닫기 1. 타인의 메일주소, 전화번호, 주민등록번호 등의 개인정보 또는 해당 정보를 게재하는 경우 4. 욕설 및 비속어의 사용 및 특정 인종, 성별, 지역 또는 특정한 정치적 견해를 비하하는 용어를 게시하는 경우 9. 공인이나 특정이슈와 관련된 당사자 및 당사자의 주변인, 지인 등을 가장 또는 사칭하여 글을 게시하는 경우 동일한 제목, 내용의 글 또는 일부분만 변경해서 글을 반복 게재하는 경우 국무조정실 국토부 “도심항공교통 상용화, 전용 배터리 없어도 가능” 2024.12.26 대한민국 정책브리핑 뉴스레터 구독하고 선물받자!\'}]']",동차부품구 청년일자리 지원 정책의 사업 운영 기간은 2024년 1월 1일부터 2024년 12월 31일까지입니다.
동차부품구 청년일리지원 정책의 주관 기관은 어디인가요?,"['정책 이름: 동차부품구 청년일리지원', '주관 기관:광주광역 청년정책관']",광주광역 청년정책관,"['[Document(metadata={\'name\': \'청년정책위원회 운영\', \'source\': \'..\\\\data\\\\policy_result.json\'}, page_content=\'기관:인천 동구 정책 분야:.권리분야 지원 내용:  지역 청년과의 소통창구  현장 의견수렴   구정 와 정책 제안 발굴    청년정책에  기본계획 수립과정   사업 운영 기간:2024.1. ~ 12. 사업 신청 기간:미정 비고:사업기간   2024.1~12 연령:만 19세 ~ 39세 거주지 및 소득:  거주지   제한없음  소득   지역 청년 주관 기관:인천광역시 동구 일자리경제과 운영 기관:인천광역시 동구 일자리경제과\'), Document(metadata={\'name\': \'청년친화강소기업 선정\', \'source\': \'..\\\\data\\\\policy_result.json\'}, page_content=\'기관:고용노동부 정책 분야:일자리분야 지원 내용:  청년 지원내용   청년이 선호하는 근로여건을 갖춘 청년친화강소기업을 선정하여 기업 정보     기업 지원내용   기업정보   워크넷을  기업현황  채용정보   기업 현장정보를 청년의 시각으로 전달하는 기업탐방기 게시   인센티브   정기 세무조사 선정 제외 우대  각종 사업  선정시 우대    일학습병행학습기업 선정  가족친화인증기업 선정  폭염재난예방 대책설비 지원  청년채용박람회 개최  병역지엉업체 지정  신한은행 특별협약 보증 우대  사업 운영 기간:2024.1.1.~12.31. 사업 신청 기간:상시 비고:상시 거주지 및 소득: 기업  고용보험법상 우선지원대상기업 참여 제한 대상:  근로기준법 제43조의 2에  체불사업주 명단공개  기업 사업주    최근 2년 이내 산업안전보건법 제10조에  산업재해 발생건수  공표 기업   최근 2년 이내 근로자가 부당해고 구제를 신청하여 부당해고로 결정  판정 확정된 기업   최근 2년 이내 직장 내 괴롭힘  성폭력  성희롱으로 적발되어 처벌 확정  과태료 부과 기업   최근 2년 연속 전년 대비 매출액 15%이상 감소 기업    신용평가급 이 BB 미만 기업   상호출자제한기업 집단  공공기관  지방공기업   10인 미만 기업 건설업 30인 미만    소비향락업  중소기업인력지원특별법 제외 업종  고용알선업  인력공급업 신청 절차:별도없음 심사 및 발표:별도없음 주관 기관:고용노동부 운영 기관: 사 벤처기업협회\'), Document(metadata={\'name\': \'전북청년 로컬 인 캠프 남원 높이 날아오르다 일시   10.3~10.6 \', \'source\': \'..\\\\data\\\\policy_result.json\'}, page_content=\'기관:전북 정책 분야:.권리분야 지원 내용:전북청년허브센터에서 중앙청년지원센터  남원청년센터 청년마루와 함께 남원청년정책  청년창업기업 전시홍보 판매 체험부스 운영을 지역 내 청년정책 인식제고와 청년활동 지원을 위해전북청년 로컬 인 캠프  남원 높이 날아오르다 를 개최하오니 청년들의 많은 관심과  바랍니다.   일시   2024. 10. 3. 목 ~10. 6. 일  10 00~18 00   장소   남원종합스포츠타운 남원시 충정로 341    주요내용   청년창업기업 부스  체험  네트워킹  사업 신청 기간:미정 비고:별도 신청없음   일시   2024. 10. 3. 목 ~10. 6. 일  10 00~18 00   장소   남원종합스포츠타운 남원시 충정로 341  참여 제한 대상:민국 누구나 주관 기관:전북청년허브센터 운영 기관:전북청년허브센터\'), Document(metadata={\'name\': \'강남 청년의 날 행사\', \'source\': \'..\\\\data\\\\policy_result.json\'}, page_content=\'기관:서울 강남구 정책 분야:.권리분야 지원 내용:청년문화행사  청년정책 경진대회  체험 홍보부스 운영  사업 신청 기간:미정 비고:청년의 날 9월 셋째주 토요일  연령:만 19세 ~ 39세 거주지 및 소득:만19세~39세 청년 누구나 주관 기관:서울시 강남구 일자리정책과 청년정책팀 운영 기관:주관기관 동일\'), Document(metadata={\'name\': \'울산시 위원회 청년위원  비율 향상\', \'source\': \'..\\\\data\\\\policy_result.json\'}, page_content=\'기관:울산 정책 분야:.권리분야 지원 내용:  사업대상   시 소관 위원회 203개   주요내용   시위원회 청년위원 위촉률 확대   임기만료 위원회  신규 구성 위원회 대상 청년위원  독려    각종 정책토론회  포럼  공청회  청년위원  지원   각종 청년정책 추진 시 당사자 의견수렴을 위한 청년 지원 사업 운영 기간:  기 간   2024. 1. ~ 12. 사업 신청 기간:상시 연령:만 19세 ~ 39세 주관 기관:울산광역시 대학청년지원단 청년정책팀 052 229 7982  운영 기관:주관기관과 동일\')], [{\'url\': \'https://www.etnews.com/20230714000039\', \'content\': ""지역주도형 청년일자리사업 \'자동차산업 활력제고를 위한 청년고용 창출 지원사업\'이 지역의 우수 청년인력의 역외유출을 방지하고, 지역""}, {\'url\': \'https://korea.kr/briefing/pressReleaseView.do?newsId=156653054\', \'content\': \'지역 청년을 위한 일자리 정책, 2030자문단과 청년 공무원이 만들어요 - 보도자료 | 브리핑룸 | 대한민국 정책브리핑 본문 바로가기 메인메뉴 바로가기 대한민국 정책브리핑 뉴스 뉴스 멀티미디어 뉴스 최근 1년 외교/안보 접기 부처 접기 상세검색 닫기 검색 닫기 공유 닫기 지역 청년을 위한 일자리 정책, 2030자문단과 청년 공무원이 만들어요 글자크기 설정 닫기 1. 타인의 메일주소, 전화번호, 주민등록번호 등의 개인정보 또는 해당 정보를 게재하는 경우 4. 욕설 및 비속어의 사용 및 특정 인종, 성별, 지역 또는 특정한 정치적 견해를 비하하는 용어를 게시하는 경우 9. 공인이나 특정이슈와 관련된 당사자 및 당사자의 주변인, 지인 등을 가장 또는 사칭하여 글을 게시하는 경우 동일한 제목, 내용의 글 또는 일부분만 변경해서 글을 반복 게재하는 경우 국무조정실 국토부 “도심항공교통 상용화, 전용 배터리 없어도 가능” 2024.12.26 대한민국 정책브리핑 뉴스레터 구독하고 선물받자!\'}]']","제공된 정보에 따르면, ""자동차산업 활력제고를 위한 청년고용 창출 지원사업""의 주관 기관에 대한 구체적인 내용은 포함되어 있지 않습니다. 그러므로, 해당 사업의 주관 기관을 정확히 알기 위해서는 공식적인 정부 발표나 관련 보도자료를 확인해야 할 것입니다. 

하지만, 다른 문서에서 청년 관련 정책에 대한 주관 기관으로는 인천광역시 동구, 고용노동부, 전북청년허브센터, 서울시 강남구, 울산광역시 대학청년지원단 등이 명시되어 있습니다. 더 많은 구체적인 정보가 필요하시다면 해당 정책에 대한 공식적인 자료를 확인하시기를 권장합니다."
울산 구 청년 면접정장 무료대여 디딤돌 옷드림의 대여 기간은 어떻게 되나요?,"['정책 이름: 울산 구 청년 면접정장 무료대여 디딤돌 옷드림', '지원 내용: 대여기간 3박 4일 4회']",대여 기간은 3박 4일입니다.,"['[Document(metadata={\'name\': \'울산 동구 청년 면접정장 대여 사업\', \'source\': \'..\\\\data\\\\policy_result.json\'}, page_content=\'기관:울산 동구 정책 분야:일자리분야 지원 내용:  대여품목   면접용 정장 재킷  바지 스머트  셔츠 블라우스  넥타이   구두   대여기간   3박 4일 연 3회 가능  사업 운영 기간:  사업기간    24. 1. ~ 12. 사업 신청 기간:상시 연령:만 18세 ~ 39세 거주지 및 소득:  대 상   동구 거주 주민록  청년 구직자 18세 ~ 39세  신청 절차:울산동구청년센터 문의 052 209 3487  제출 서류:  구비서류   신분증  주민록  초본  면접응시 증빙자료 주관 기관:울산광역시 동구 일자리정책과 청년정책팀 052 209 3487  운영 기관:울산 동구 청년센터 052 209 3487 \'), Document(metadata={\'name\': \'2024년 익산시 청년 면접 정장 대여사업\', \'source\': \'..\\\\data\\\\policy_result.json\'}, page_content=\'기관:전북 익산시 정책 분야:일자리분야 지원 내용:  미취업 구직 청년에게 면접 정장 무료 대여   대여품목  정장 상 하의   셔츠  블라우스  넥타이  구두     대여기간  대여일로부터 3박 4일    대여횟수  1인당 연 3회   일반 교육  모의 면접  대학교 원  면접  자는 지원 제외 사업 신청 기간:상시 비고:예산 소진 시까지 연령:만 18세 ~ 39세 거주지 및 소득:익산시에 거주하는 만 18~39세 미취업 구직 청년 취업 상태:미취업자 참여 제한 대상:익산시에 거주하는 만 18~39세 미취업 구직 청년 신청 절차:  신청 방법  온라인 신청 youthforest.iksan.go.kr    신청절차 1. 신청접수  신청서  구비서류 제출 2. 쿠폰수신  예약 링크  쿠폰 번호 문자확인 3. 정장수령  택배 면접일 전날 수령  4. 정장반납  대여일로부터 3박4일 내 반납 택배 착불 반납  제출 서류:  대여 신청서 붙임 1    개인정보 동의서 붙임 2    주민록초본   주민록초본은 신청일 이후 발급분만 인정   면접 증빙자료   면접 증빙자료 면접 통보 메일  문자   자료  필수   증빙자료의 대상자가 본인임을 특정할 수 있어야 증빙자료로 인정 응시번호만 제출하는  X  대상자 본인의 이름과 응시번호가 함께 나온 캡처본 O  기타 유익 정보:문의  익산시청 기업일자리과  063 859 7358  주관 기관:익산시 운영 기관:익산시\'), Document(metadata={\'name\': \'서울시 취업날개 운영\', \'source\': \'..\\\\data\\\\policy_result.json\'}, page_content=\'기관:서울 정책 분야:일자리분야 지원 내용:면접용 정장 무료대여 사업 운영 기간:2024.01.01~2024.12.31 사업 신청 기간:2024년 01월01일 ~ 2024년 12월31일 지원 규모(명):48 000명 비고:2024.01.01~2024.12.31 연령:만 15세 ~ 39세 추가 단서 사항:대여업체 문의가능 연락처   드림윙즈 홍대점 마포구 동교동 161 5  3층 홍대입구역 1번출구 도보 1분 02 547 4782   마이스윗인터뷰 신촌점 서대문구 신촌로 87 8  3~4층 신촌역 1번출구 도보 1분 070 8160 3010   마이스윗인터뷰 사당점 관악구 승방6길 34  1층 사당역 5번출구 도보 5분 02 522 3010   마이스윗인터뷰 천호점 강동구 천호대로151길 36  8층 천호역 2번출구 도보 3분 0507 1413 3027   마이스윗인터뷰 영포점 영포구 국회대로 547  2층 영포구청역 3번출구 도보 4분 0507 1412 3027   슈트 갤러리 논현점 서초구 신반포로 337  2~3층 논현역 5번출구 도보 1분 02 3443 6009   슈트 갤러리 충정로점 서대문구 신촌로 37길 75  1층 충정로역 7번출구 도보 3분 02 363 6009   스완제이 노원점 노원구 동일로 1426  5층 노원역 3번출구 도보 1분 0507 1348 7108   스타일딜리셔스 슈트패브릭  청담점 강남구 선릉로152길 32  5층 압구정로데오역 4번출구 도보 10분 070 4196 9606   야베스컬렉션 이수점 서초구 방배천로24길 17  3층 이수역 5번출구 도보 5분 02 1833 5389   열린옷장 건대점 광진구 아차산로 213  5층 건대입구역 1번출구 도보 1분 02 6929 1020   체인지 레이디 왕십리점 성동구 왕십리로 24나길 20  4층 왕십리역 2번출구 도보 5분 02 6204 1517   체인지 레이디 강남점 강남구 역삼로3길 17 6  3층 강남역 4번출구 도보 5분 070 5220 0307   종로신사 종로점  종로구 종로 223  우교빌딩 4층 종로5가역 3번 출구 도보 1분 02 743 1850    24년 개관  참여 제한 대상:  실제 회사 면접에 하는 만 대여 인정 대학원 면접  모의면접에 할  불인정    증빙서류가 없는  대여 불가  대여시 증빙서류 지참 신청 절차:서울일자리포털 사이트 회원 로그인 후  취업날개 사이트 이동하여 온라인 신청 심사 및 발표:마이스윗인터뷰 신촌 사당 천호 영포점    열린옷장 건대입구    체인지레이디 왕십리 강남    슈트갤러리 논현 충정로    스완제이 노원   야베스컬렉션 이수    스타일딜리셔스 청담    드림윙즈 홍대   종로신사 종로점  14 곳에서 대여가 가능. 대여기간은 3박4일. 제출 서류:  서울 거주 사실 혹은 서울 소재 학교 재학생 졸업생임을 증명할 수 있는 서류   실제 면접을 보는 회사의 면접확인 서류를 회사명  면접일  연락처 이 보여지도록 캡처하여 업로드   전화로 면접을 통보받았을  취업지원 사실을 확인할 수 있는 자료 제출 기타 유익 정보:연간 1인당 최대 10회까지 무료대여 가능 2회부터는 온라인 대여 가능  처음 대여했을 때 측정했던 치수를 토대로 택배  직접수령 가능 주관 기관:경제일자리기획관 일자리정책과 청년일자리팀\'), Document(metadata={\'name\': \'울산 동구 청년 AI 가상  면접체험 사업\', \'source\': \'..\\\\data\\\\policy_result.json\'}, page_content=\'기관:울산 동구 정책 분야:일자리분야 지원 내용:  주요내용   취업을 준비하는 청년에게 AI 가상 면접 체험 지원 사업 운영 기간:  사업기간    24. 2. ~ 12. 사업 신청 기간:상시 연령:만 18세 ~ 39세 거주지 및 소득:  대 상   18세 ~ 39세 청년 신청 절차:  방법   온라인 신청  현장 방문  주관 기관:울산광역시 동구 일자리정책과 청년정책팀 052 209 3487  운영 기관:울산 동구 청년센터 052 209 3485 \'), Document(metadata={\'name\': \'2024 구직청년 면접 정장 대여\', \'source\': \'..\\\\data\\\\policy_result.json\'}, page_content=\'기관:대전 정책 분야:일자리분야 지원 내용:  면접정장 무료대여   대여품목     여성  재킷  블라우스  치마  구두    남성  재킷  셔츠  넥타이  바지  벨트 구두 대여불가    대여기간  2박 3일   1인 연간 3회  가능   대여업체     가온유니폼  여성  남성 정장 각 1세트 중구 보문로 89     253 5336      슈트갤러리  여성  남성 정장 각 1세트 중구 오류로31 103동 221호  222호     524 9007      아모르메이크업  여성 정장 1세트 서구 계룡로 339번길 19     301 3436  사업 신청 기간:2024년 04월11일 ~ 2024년 12월31일 비고:2024. 4. 11. 목  ~ 12월   예산 소진시 조기마감 연령:만 19세 ~ 39세 참여 제한 대상:  사업대상  18~39세 이하 대전시 거주 청년 구직자  고용보험 미가입자  주 근무시간 30시간 미만인 자  마이스터 고학교의 에는 3학년 재학생도 대여 가능 신청 절차:  방법  온라인 신청   대여승인   접수증 출력  예약   방문대여   방문반납 2박 3일    온라인 만족도조사  상 하반기 문자 발송    온라인 신청   대전청년포털   홈페이지에서 신청   경로  대전청년포털   청년지원   대전청년사업   취업지원   신청하기 제출 서류:1  정장대여신청서 개인정보동의서 포함  1부 2  주민록본  초본 1부  신청일 기준 1개월 이내 발급  3  미취업 증빙서류  고용보험 자격이력내역서  주 30시간 미만 근로계약서    고용 산재보험 토탈 홈페이지   에서 발급 가능 4  면접 증빙서류   회사명  면접일  회사 연락처가 보이도록 출력   문자  이메일  홈페이지 면접통보 시 화면 캡쳐 후 출력 제출 기타 유익 정보:  대여신청  취소는 방문예정일 2일 전까지만 가능합니다. 예시  4월 20일 방문예정일   4월 18일까지만 신청  취소 가능   예약신청 승인은 월요일 9시 ~ 금요일 18시까지만 진행 되오니 유의하시기 바랍니다.  주말  공휴일  대체휴무일 은 승인불가  주관 기관:대전청년내일재단 청년지원팀 운영 기관:대전청년내일재단 청년지원팀   042  719 8434\')], [{\'url\': \'https://www.junggu.ulsan.kr/suit/intro/info.jsp\', \'content\': \'본문 바로가기 주메뉴 바로가기 페이지하단 바로가기 디딤돌 옷드림이란?취업을 준비하는 중구 거주 청년구직자들의 구직비용 부담을 덜어주기 위해 면접에 필요한 정장을 무료로 대여해 드리는 서비스입니다.자켓, 바지, 스커트, 셔츠, 블라우스, 넥타이를 보유 하고있으며 면접에 필요한모든 아이템을 한 곳에서 빌릴 수 있습니다. - 주말(토, 일)과 공휴일은 전날 오후 6시까지의 신청내역만 승인처리가 가능합니다. 대여 방법을 알고 싶습니다.홈페이지에서 신청, 승인 후, 업체 방문하여 대여 가능합니다. 대여횟수 및 기간 01. 대여기간 연장 시 1일당 대여비의 20%씩 추가비용 본인 부담 05. 현장 본인확인 : 주민등록증, 운전면허증(생년월일 및 주소확인 가능한 신분증) 등 울산 중구 거주확인 : 주민등록초본(대여 신청 시 전자문서지갑 열람코드 입력)\\xa0 전자문서지갑 사용법 안내 면접 증빙자료 : 대여 신청 시 첨부파일 제출 면접증빙서류 예시 보기 운영업체 현장 방문하여 검수 확인 후 반납\'}, {\'url\': \'https://www.welfarehello.com/community/hometownNews/e45bcf12-8314-491c-a1f2-81a2e9918db5\', \'content\': \'2023 청년 면접정장 대여사업 <디딤돌 옷드림> | 울산광역시 중구 | 웰로 2023 청년 면접정장 대여사업 <디딤돌 옷드림> 👨\\u200d💼 2023 청년 면접정장 대여사업 <디딤돌 옷드림>👞 23년 청년 면접정장 대여사업을 실시합니다😄 ✅ 대상 : 만 19세 ~ 34세 이하 중구 거주 청년구직자 울산 #울산중구 #누구나살고싶은 #종갓집중구 #면접 #면접정장 #면접정장대여 #정장대여 #일자리 #옷드림 #취업 {""title"":""2023 청년 면접정장 대여사업 <디딤돌 옷드림>"",""source"":""https://blog.naver.com/usjunggu/222974526218"",""blogName"":""울산광역시.."",""blogId"":""usjunggu"",""domainIdOrBlogId"":""usjunggu"",""logNo"":222974526218,""smartEditorVersion"":4,""meDisplay"":true,""lineDisplay"":true,""outsideDisplay"":false,""cafeDisplay"":true,""blogDisplay"":true} #### 겨울 먹거리 가득한 울산 성남동 울산큰애기 청년야시장 24.12.21(토) 작성 #### 역사와 낭만이 공존하는 울산 병영성 24.12.21(토) 작성 #### 아이들과 운동하기 좋은 울산 중구 함월구민운동장 24.12.21(토) 작성 #### 울산 최초의 한옥 도서관 “외솔한옥도서관” 24.12.21(토) 작성 #### 울산 중구 산전만화도서관에서 여유 있게 연말 보내기 24.12.20(금) 작성 #### 울산 겨울방학 아이와 가볼 만한 곳 만화방 노래방 탁구장 있는 울산학생교육문화회관 24.12.20(금) 작성\'}]']","울산 중구의 청년 면접정장 무료 대여 사업인 ""디딤돌 옷드림""의 대여 기간은 대여일로부터 3박 4일입니다. 또한, 대여를 연장할 경우 1일당 대여비의 20%를 추가로 부담해야 합니다. 대여를 신청하기 위해서는 주민등록증이나 운전면허증과 같은 신분증과 주민등록초본을 제출해야 합니다. 면접 증빙자료도 함께 첨부해야 하며, 주말과 공휴일은 전날 오후 6시까지의 신청 내역만 승인 처리됩니다."
울산 구 청년 면접정장 무료대여 디딤돌 옷드림의 지원 연령은 어떻게 되나요?,"['정책 이름: 울산 구 청년 면접정장 무료대여 디딤돌 옷드림', '연령: 만 19세 39세']",지원 연령은 만 19세부터 39세까지입니다.,"['[Document(metadata={\'name\': \'울산 동구 청년 AI 가상  면접체험 사업\', \'source\': \'..\\\\data\\\\policy_result.json\'}, page_content=\'기관:울산 동구 정책 분야:일자리분야 지원 내용:  주요내용   취업을 준비하는 청년에게 AI 가상 면접 체험 지원 사업 운영 기간:  사업기간    24. 2. ~ 12. 사업 신청 기간:상시 연령:만 18세 ~ 39세 거주지 및 소득:  대 상   18세 ~ 39세 청년 신청 절차:  방법   온라인 신청  현장 방문  주관 기관:울산광역시 동구 일자리정책과 청년정책팀 052 209 3487  운영 기관:울산 동구 청년센터 052 209 3485 \'), Document(metadata={\'name\': \'울산 남구 키즈와 맘 청년몰 활성화 지원\', \'source\': \'..\\\\data\\\\policy_result.json\'}, page_content=\'기관:울산 남구 정책 분야:일자리분야 지원 내용:  장 소   신정평화시장 청년몰   내 용   청년 상인 임차료 지원  청년몰 판로개척  단골고객 확보 사업 운영 기간:2024. 1. ~ 12. 사업 신청 기간:상시 연령:만 19세 ~ 39세 주관 기관:울산광역시 남구 경제정책과 지역경제팀 052 226 5652  운영 기관:주관기관과 동일\'), Document(metadata={\'name\': \'울산 동구 청년 면접정장 대여 사업\', \'source\': \'..\\\\data\\\\policy_result.json\'}, page_content=\'기관:울산 동구 정책 분야:일자리분야 지원 내용:  대여품목   면접용 정장 재킷  바지 스머트  셔츠 블라우스  넥타이   구두   대여기간   3박 4일 연 3회 가능  사업 운영 기간:  사업기간    24. 1. ~ 12. 사업 신청 기간:상시 연령:만 18세 ~ 39세 거주지 및 소득:  대 상   동구 거주 주민록  청년 구직자 18세 ~ 39세  신청 절차:울산동구청년센터 문의 052 209 3487  제출 서류:  구비서류   신분증  주민록  초본  면접응시 증빙자료 주관 기관:울산광역시 동구 일자리정책과 청년정책팀 052 209 3487  운영 기관:울산 동구 청년센터 052 209 3487 \'), Document(metadata={\'name\': \'2024년 익산시 청년 면접 정장 대여사업\', \'source\': \'..\\\\data\\\\policy_result.json\'}, page_content=\'기관:전북 익산시 정책 분야:일자리분야 지원 내용:  미취업 구직 청년에게 면접 정장 무료 대여   대여품목  정장 상 하의   셔츠  블라우스  넥타이  구두     대여기간  대여일로부터 3박 4일    대여횟수  1인당 연 3회   일반 교육  모의 면접  대학교 원  면접  자는 지원 제외 사업 신청 기간:상시 비고:예산 소진 시까지 연령:만 18세 ~ 39세 거주지 및 소득:익산시에 거주하는 만 18~39세 미취업 구직 청년 취업 상태:미취업자 참여 제한 대상:익산시에 거주하는 만 18~39세 미취업 구직 청년 신청 절차:  신청 방법  온라인 신청 youthforest.iksan.go.kr    신청절차 1. 신청접수  신청서  구비서류 제출 2. 쿠폰수신  예약 링크  쿠폰 번호 문자확인 3. 정장수령  택배 면접일 전날 수령  4. 정장반납  대여일로부터 3박4일 내 반납 택배 착불 반납  제출 서류:  대여 신청서 붙임 1    개인정보 동의서 붙임 2    주민록초본   주민록초본은 신청일 이후 발급분만 인정   면접 증빙자료   면접 증빙자료 면접 통보 메일  문자   자료  필수   증빙자료의 대상자가 본인임을 특정할 수 있어야 증빙자료로 인정 응시번호만 제출하는  X  대상자 본인의 이름과 응시번호가 함께 나온 캡처본 O  기타 유익 정보:문의  익산시청 기업일자리과  063 859 7358  주관 기관:익산시 운영 기관:익산시\'), Document(metadata={\'name\': \'면접 준비 청년 헤어스타일링 무료지원 남양주시 \', \'source\': \'..\\\\data\\\\policy_result.json\'}, page_content=\'기관:경기 남양주시 정책 분야:일자리분야 지원 내용:  지원내용   면접 준비 청년 헤어스타일링 무료지원   지원혜택   1인 연 최대 2회이며  업체별 가능한 시술 종류와 월 대상인원은 변동 가능 사업 신청 기간:상시 연령:만 19세 ~ 39세 거주지 및 소득:  남양주시에 주민록이 되어있는 19세 이상 39세 이하  면접을 앞둔  서류전형 합격일 후부터 면접일까지  청년 신청 절차:1호점   센느  경춘로 490 힐스테이트 지금디포레  2238호  네이버예약 2호점   바인  해밀예당1로200번길 13 4  103호  유선접수   0507 1359 3706 3호점   기분좋은날  도농로 중촌1길6  1층  유선접수   010 5206 9538 주관 기관:남양주시 청년정책과   031 590 8539 \')], [{\'url\': \'https://www.welfarehello.com/community/hometownNews/e45bcf12-8314-491c-a1f2-81a2e9918db5\', \'content\': \'2023 청년 면접정장 대여사업 <디딤돌 옷드림> | 울산광역시 중구 | 웰로 2023 청년 면접정장 대여사업 <디딤돌 옷드림> 👨\\u200d💼 2023 청년 면접정장 대여사업 <디딤돌 옷드림>👞 23년 청년 면접정장 대여사업을 실시합니다😄 ✅ 대상 : 만 19세 ~ 34세 이하 중구 거주 청년구직자 울산 #울산중구 #누구나살고싶은 #종갓집중구 #면접 #면접정장 #면접정장대여 #정장대여 #일자리 #옷드림 #취업 {""title"":""2023 청년 면접정장 대여사업 <디딤돌 옷드림>"",""source"":""https://blog.naver.com/usjunggu/222974526218"",""blogName"":""울산광역시.."",""blogId"":""usjunggu"",""domainIdOrBlogId"":""usjunggu"",""logNo"":222974526218,""smartEditorVersion"":4,""meDisplay"":true,""lineDisplay"":true,""outsideDisplay"":false,""cafeDisplay"":true,""blogDisplay"":true} #### 겨울 먹거리 가득한 울산 성남동 울산큰애기 청년야시장 24.12.21(토) 작성 #### 역사와 낭만이 공존하는 울산 병영성 24.12.21(토) 작성 #### 아이들과 운동하기 좋은 울산 중구 함월구민운동장 24.12.21(토) 작성 #### 울산 최초의 한옥 도서관 “외솔한옥도서관” 24.12.21(토) 작성 #### 울산 중구 산전만화도서관에서 여유 있게 연말 보내기 24.12.20(금) 작성 #### 울산 겨울방학 아이와 가볼 만한 곳 만화방 노래방 탁구장 있는 울산학생교육문화회관 24.12.20(금) 작성\'}, {\'url\': \'https://www.welfarehello.com/community/hometownNews/c2c9de91-fa24-4f26-8c49-5e95cfddca29\', \'content\': \'청년면접정장 무료대여 사업. 울산중구 디딤돌 옷드림👨\\u200d💼👩\\u200d💼 중구에서 청년 구직자에게. 면접정장을 빌려드리고 있습니다🎀. 청년 구직자분들은. 많이 이용해주세요〰🙂 신청대상: 주민등록상 주소지가 욼산 중구인 청년 구직자(19세~39세)\'}]']","울산 중구에서 시행하는 '청년 면접정장 대여사업 <디딤돌 옷드림>'은 만 19세에서 34세 이하의 중구 거주 청년 구직자를 대상으로 하고 있습니다. 이 사업은 청년들이 면접을 준비하는 데 필요한 정장을 무료로 대여해주는 프로그램으로, 중구에 거주하는 청년들에게 큰 도움이 될 것으로 기대됩니다. 신청은 중구청 관련 부서에 문의하여 진행할 수 있습니다."
울산 구 청년 면접정장 무료대여 디딤돌 옷드림을 주관하는 기관은 어디인가요?,"['정책 이름: 울산 구 청년 면접정장 무료대여 디딤돌 옷드림', '주관 기관: 울산광역 구청 정책사업 052 290 8323']",주관 기관은 울산광역 구청 정책사업입니다.,"[""[Document(metadata={'name': '울산 동구 청년 면접정장 대여 사업', 'source': '..\\\\data\\\\policy_result.json'}, page_content='기관:울산 동구 정책 분야:일자리분야 지원 내용:  대여품목   면접용 정장 재킷  바지 스머트  셔츠 블라우스  넥타이   구두   대여기간   3박 4일 연 3회 가능  사업 운영 기간:  사업기간    24. 1. ~ 12. 사업 신청 기간:상시 연령:만 18세 ~ 39세 거주지 및 소득:  대 상   동구 거주 주민록  청년 구직자 18세 ~ 39세  신청 절차:울산동구청년센터 문의 052 209 3487  제출 서류:  구비서류   신분증  주민록  초본  면접응시 증빙자료 주관 기관:울산광역시 동구 일자리정책과 청년정책팀 052 209 3487  운영 기관:울산 동구 청년센터 052 209 3487 '), Document(metadata={'name': '2024년 익산시 청년 면접 정장 대여사업', 'source': '..\\\\data\\\\policy_result.json'}, page_content='기관:전북 익산시 정책 분야:일자리분야 지원 내용:  미취업 구직 청년에게 면접 정장 무료 대여   대여품목  정장 상 하의   셔츠  블라우스  넥타이  구두     대여기간  대여일로부터 3박 4일    대여횟수  1인당 연 3회   일반 교육  모의 면접  대학교 원  면접  자는 지원 제외 사업 신청 기간:상시 비고:예산 소진 시까지 연령:만 18세 ~ 39세 거주지 및 소득:익산시에 거주하는 만 18~39세 미취업 구직 청년 취업 상태:미취업자 참여 제한 대상:익산시에 거주하는 만 18~39세 미취업 구직 청년 신청 절차:  신청 방법  온라인 신청 youthforest.iksan.go.kr    신청절차 1. 신청접수  신청서  구비서류 제출 2. 쿠폰수신  예약 링크  쿠폰 번호 문자확인 3. 정장수령  택배 면접일 전날 수령  4. 정장반납  대여일로부터 3박4일 내 반납 택배 착불 반납  제출 서류:  대여 신청서 붙임 1    개인정보 동의서 붙임 2    주민록초본   주민록초본은 신청일 이후 발급분만 인정   면접 증빙자료   면접 증빙자료 면접 통보 메일  문자   자료  필수   증빙자료의 대상자가 본인임을 특정할 수 있어야 증빙자료로 인정 응시번호만 제출하는  X  대상자 본인의 이름과 응시번호가 함께 나온 캡처본 O  기타 유익 정보:문의  익산시청 기업일자리과  063 859 7358  주관 기관:익산시 운영 기관:익산시'), Document(metadata={'name': '울산 동구 청년문화예술 활성화 지원사업', 'source': '..\\\\data\\\\policy_result.json'}, page_content='기관:울산 동구 정책 분야:복지.문화분야 지원 내용:  장 소   청년센터 거점공간  일산해수욕장 일대   주요내용   청년 활동가 발굴   노래  춤  문화예술 영역별 청년 활동가 발굴  활동 지원   청년 버스킹 창고 운영   앰프  마이크  조명  무대장치  청년 버스킹 활동에 필요한 장비 대여 사업 운영 기간:  사업기간    24. 3. ~ 12. 사업 신청 기간:상시 연령:만 19세 ~ 39세 주관 기관:울산광역시 동구 일자리정책과 청년정책팀 052 209 3485  운영 기관:주관기관과 동일'), Document(metadata={'name': '울산 동구 청년 AI 가상  면접체험 사업', 'source': '..\\\\data\\\\policy_result.json'}, page_content='기관:울산 동구 정책 분야:일자리분야 지원 내용:  주요내용   취업을 준비하는 청년에게 AI 가상 면접 체험 지원 사업 운영 기간:  사업기간    24. 2. ~ 12. 사업 신청 기간:상시 연령:만 18세 ~ 39세 거주지 및 소득:  대 상   18세 ~ 39세 청년 신청 절차:  방법   온라인 신청  현장 방문  주관 기관:울산광역시 동구 일자리정책과 청년정책팀 052 209 3487  운영 기관:울산 동구 청년센터 052 209 3485 '), Document(metadata={'name': '울산 남구 키즈와 맘 청년몰 활성화 지원', 'source': '..\\\\data\\\\policy_result.json'}, page_content='기관:울산 남구 정책 분야:일자리분야 지원 내용:  장 소   신정평화시장 청년몰   내 용   청년 상인 임차료 지원  청년몰 판로개척  단골고객 확보 사업 운영 기간:2024. 1. ~ 12. 사업 신청 기간:상시 연령:만 19세 ~ 39세 주관 기관:울산광역시 남구 경제정책과 지역경제팀 052 226 5652  운영 기관:주관기관과 동일')], [{'url': 'https://www.junggu.ulsan.kr/suit/', 'content': '디딤돌옷드림-울산중구 면접정장 무료대여 본문 바로가기 주메뉴 바로가기 페이지하단 바로가기 대여사업 안내 면접복장 도움말 정장대여 공지사항 울산 중구청에서 정장을 무료로 빌려 드립니다 청년구직자들의 구직비용 부담을 덜어주기 위해 면접에 필요한 정장을 무료로 대여해드립니다. [공지] 2024년도 청년 면접정장 대여사업 「디딤돌... [휴무공지] 추석연휴 휴무 안내 [휴무공지] 설 연휴 휴무 안내 [공지] 2023년도 청년 면접정장 대여사업 「디딤돌 ... 공지사항 더보기 정장대여 서비스 대여절차 울산 중구 취업준비 청년들의 사회진출을 응원하겠습니다. 대여방법 정독01정장대여서비스 홈페이지에서내용 확인 후 대여 예약하기 클릭 본인인증 및 신청02본인인증 후 면접정장 대여서비스를신청한다. 업체방문03운영업체를 방문하여 예약자 확인 후피팅 및 대여한다. 면접정장 도움말 및 치수 측정 울산 중구 취업준비 청년들의 사회진출을 응원하겠습니다. 남자 면접복장 도움말 여자 면접복장 도움말 [44475] 울산광역시 중구 단장골길1 (복산동) 중구청 일자리정책과\\xa0\\xa0\\xa0대표전화 : 052-290-8323 첫번째 페이지 이동 두번째 페이지 이동 세번째 페이지 이동 네번째 페이지 이동'}, {'url': 'https://jerry-jerry.tistory.com/203', 'content': '울산 중구 청년 무료 면접정장대여사업 디딤돌 옷드림(지원대상/지원내용/신청방법) 오늘은 울산 중구 청년구직자를 위한 울산 중구 면접정장대여 사업 디딤돌 옷드림에 대해 알아보겠습니다. 울산 중구 면접정장 무료대여 디딤돌 옷드림 - 만 19세~39세 이하의 중구 청년 구직자 ※ 대여기간 연장 시 1일당 대여비의 20%씩 추가비용 본인 부담 ※ 별도의 연장없이 반납이 늦어질 경우 1일당 대여비의 30%씩 본인 부담 - 면접 증빙자료(대여 신청 시 첨부파일 제출) 큐넷 국가기술자격시험 응시료 지원사업(지원대상/지원내용/신청방법) 큐넷 국가기술자격시험 응시료 지원사업(지원대상/지원내용/신청방법) 오블완, 울산 디딤돌 옷드림, 울산 면접정장 무료대여, 울산 중구 면접준비, 울산 중구 청년 지원, 울산 청년 구직자, 울산 청년구직자, 울산 취업, 울산 취업지원, 티스토리챌린지 현재글울산 중구 청년 무료 면접정장대여사업 디딤돌 옷드림(지원대상/지원내용/신청방법) 다음글청주시 청년 구직자 면접정장 무료대여 서비스 희망날개(지원대상/지원내용/이용절차) 청주시 청년 구직자 면접정장 무료대여 서비스 희망날개(지원대상/지원내용/이용절차)'}]""]","울산 중구 청년 면접정장 무료대여 사업인 ""디딤돌 옷드림""을 주관하는 기관은 울산광역시 중구청 일자리정책과입니다. 이 사업은 만 19세에서 39세 이하의 중구 청년 구직자를 대상으로 하며, 면접 증빙자료를 제출하면 정장을 무료로 대여받을 수 있습니다. 대여 기간은 정해져 있으며, 연장 시 추가 비용이 발생할 수 있습니다."
논산 청년결혼축하금 지원사업의 지원 금액은 얼마인가요?,"['정책 이름: 논산 청년결혼축하금 지원사업', '지원 내용: 1부부당 700만원 지원 분할지급 1차 300만원 2차 200만원 3차 200만원']","1부부당 700만원이 지원되며, 분할지급으로 1차 300만원, 2차 200만원, 3차 200만원이 지급됩니다.","['[Document(metadata={\'name\': \'울산 동구 청소년한부모 자립지원\', \'source\': \'..\\\\data\\\\policy_result.json\'}, page_content=\'기관:울산 동구 정책 분야:복지.문화분야 지원 내용:  지원내용   아동양육비   청소년한부모 가족의 자녀. 1인 150천원 월   자립지원 촉진수당   신청일 기준 1년 내 취업활동  직업훈련  학업  자립활동  실적이 있는 가구. 가구당 100천원  월    검정고시  학습지원   학업이 단절되어 검정고시 준비응시생  청년한부모로서 중 고학교 재학생. 연 154만원 이내 사업 운영 기간:  사업기간    24. 1. ~ 12. 사업 신청 기간:상시 거주지 및 소득:  사업대상   기준 중위소득 65% 이하  모  부 나이가 24세 이하인 청소년 한부모 주관 기관:울산광역시 동구 가족정책과 여성청소년팀 052 209 3913  운영 기관:주관기관과 동일\'), Document(metadata={\'name\': \'청년 부동산 중개수수료  이사비 지원사업 안성시 \', \'source\': \'..\\\\data\\\\policy_result.json\'}, page_content=\'기관:경기 안성시 정책 분야:주거분야 지원 내용:  중개수수료  이사비 포함하여 1인당 최대 50만원 한도내 실비지원 2년동안 1회  사업 신청 기간:2024년 06월01일 ~ 2024년 12월31일 비고:2024.6.1~ 예산소진시까지 연령:만 19세 ~ 39세 거주지 및 소득:  2024년 6월 1일 이후 안성시로 전입  안성시 내에서 이사 후 전입신고 완료한 청년가구 주민록본상 동거인 배우자  형제 자매  이 있는 도 지원가능   19세~39세 1984.1.2~2005.12.31.  단  신청일 기준 민법상 성년이어야 함  세대주 임대차계약서 기준 임차인은 신청자 청년 본인이어야 함   소득기준  가구당 기준 중위소득 170% 이하   재산기준  신청자 청년 본인 무주택자   주택기준  2024년 6월 1일 이후 거래금액 2억원 이하 매매  전월세    자세한 자격기준은 참고사이트 의 공고문 확인 필수 신청 절차:  온라인 신청 잡아바 어플라이  제출 서류:  참고사이트  공고문 확인 기타 유익 정보:  문의  안성시청 사회복지과 031 678 6858  주관 기관:경기도 안성시 운영 기관:경기도 안성시\'), Document(metadata={\'name\': \'울산시 공공기관 청년인턴 채용사업\', \'source\': \'..\\\\data\\\\policy_result.json\'}, page_content=\'기관:울산 정책 분야:일자리분야 지원 내용:  지원금액   1인 월 1 850천원 인건비에 한함    채용기관   인원   울산연구원  7개 기관   81명   시비  자부담  6개 기관 51명    자부담  1개 기관 30명    운영방법   기관별 직무와 예산상황  감안 자율적 채용 운영 사업 운영 기간:  사업기간   2024. 4. ~ 12.   기관별 3 ~ 6개월 채용 사업 신청 기간:상시 지원 규모(명):81명 연령:만 15세 ~ 34세 거주지 및 소득:  대상   울산에 주민록을 둔 15세 ~ 34세 미취업 청년 주관 기관:울산광역시 대학청년지원단 청년정책팀 052 229 7983  운영 기관:울산연구원  7개 기관\'), Document(metadata={\'name\': \'익산시 청년도전지원사업\', \'source\': \'..\\\\data\\\\policy_result.json\'}, page_content=\'기관:전북 익산시 정책 분야:일자리분야 지원 내용:  주   밀착상담  사례관리  자신감 회복  진로탐색  취업 역량 강화  외부연계활동  자율활동     별 지원 내용  도전  5주 40시간 이상  이수 시 수당 50만원  도전    15주 120시간 이상  이수 시 수당 150만원 50만원 3회   이수인센티브  취업인센티브 지원  도전    25주 200시간 이상  이수 시 수당 250만원 50만원 5회   이수  취업 활동  취업인센티브 지원 사업 운영 기간:2024. 1. 18. ~ 2024. 12. 31. 사업 신청 기간:상시 비고:상시 연령:만 18세 ~ 39세 거주지 및 소득:  익산시 주민록상 주소지 기준 에 거주하는 만 18세~39세 청년    구직단념청년  사업 신청일 이전 6개월 이상 취업 교육 직업훈련  이력이 없고  구직단념청년 문답표 21점 이상 만점 30점 인 만 18~34세 청년    자립준비청년  아동복지시설 에서 보호받고 퇴소한 자 중 퇴소 5년이내의 청년  퇴소 대상자임에도 불구하고 퇴소일을 연장한 만 18~34세 청년    청소년복지시설 입 퇴소 청년   청소년복지지원법  제31조에  청소년복지시설 청소년쉼터  청소년자립지원관  청소년회복지원시설  에서 6개월 이상 합산 불가능  보호한 만 18~34세 청년    북한이탈청년  북한을 이탈한 자로서 만 18세~34세 청년    지역특화  위 자에 하지 않은 청년  지자체 조례 에서 지원의 필요성이 있다고 인정하는 청년 취업 상태:최근 6개월간 취업  교육 직업훈련  이력이 없는 청년 특화 분야:자립준비청년  청소년 쉼터  시설 입퇴소 청년  북한이탈 청년  지역특화청년  신청 절차:  구글  워크넷 신청 심사 및 발표:  개별연락 기타 유익 정보:문의 063 918 6081~4 주관 기관:익산청년시청 운영 기관:사 캠틱종합기술원\'), Document(metadata={\'name\': \'2024년 청년 취업수당 지원사업\', \'source\': \'..\\\\data\\\\policy_result.json\'}, page_content=\'기관:강원 고성군 정책 분야:일자리분야 지원 내용:강원 고성군 사업체에 취업한 관내 거주 청년 공고일기준 만19세~39세 에 대해 월30만원씩 1년간 지원 사업 운영 기간:2024년 연중상시 예산소진시 지원마감  사업 신청 기간:상시 지원 규모(명):15명  예산소진시 신청마감  비고:신청접수   2024. 1월~12월 모집완료시까지  연령:만 19세 ~ 39세 거주지 및 소득: 2024.1.10. 기준 고성군에거주 만19~39세 청년 1984.1.11. ~ 2005.1.10.사이 출생자    소득 무관   2023.8.1.이후 관내 업체에 정규직으로 취업한 청년 취업 상태:재직자 추가 단서 사항:  사업 기업 체   신청일 현재 관내 관할세무서에 사업자록을 한 관내 소재 업체  4대보험 가입자 기준  근로자가 3인 이상인 업체   정규직 이란 사업대상 조건  정년보장  계약기간의 정함이 없는 근로자 근로계약서 기재    전일제 근로자 주 30시간 이상 근무    4대보험 필수 가입    2023년 직접일자리사업 중앙부처 자치단체 합동지침 고용노동부  준용 참여 제한 대상:  중소기업 인력지원 특별법 제3조 적용범위 의 지원 제외 업체  보조금 취지상 지원이 적합하지 않은 업종    부동산업  일반유흥 주점업  무도유흥 주점업  기타 주점업  기타 갬블링업 무도장 운영업  단순노무  일시사역인부     공무원  공공기관  공공단체  공기업  운영비  인건비를 지원받는 기관    정부 취업성공수당  청년내일채움공제  강원도 안심공제수령자  강원도 정규직 취직지원 의 청년 고용촉진 지원사업에  자  타 사업 지원 종료 이후 신청 가능     사업주의 직계존비속 배우자  형제자매    공고일~지원기간 내 주민록상 타지역 전출 이력이 있는     지원도중 육아휴직 의 사유로 실질적인 급여 지급이 중지된      상기 기재된 사항 이외의 에 대해서는 실무자의 자체 판단에 따름 신청 절차:  취업 후 공고문의 최초 신청서류 지참하여 군청 경제체육과 일자리육성팀 방문접수   심사 후 지원확정매월 청구서류 제출  매월 25일까지전월분에 청구서류 제출   1월분 수당 2.25.까지 신청  심사 및 발표:신청시 일주일이내 심사 결과 개별 통보 제출 서류:  최초신청 시     2024년 청년 취업수당 지원 신청서 서식 1    개인정보 수집 동의서 지원자  서식 2    개인정보 수집 동의서 사업장  서식 3    주민록 본  초본 1부   근로계약서 사본 1부   4대보험 사업장 가입자 명부 1부   통장사본 본인명의 통장  1부   매월청구서류     지원여부 확정 후  매월 25일까지 전월분에  청구 예  1월분 수당   2. 25.까지 신청   청구서 도장지참  1부   4대보험 가입내역확인서 1부   급여명세서 1부   임금입금확인증 거래내역증빙  1부 주관 기관:고성군청 경제체육과 일자리육성팀 운영 기관:고성군\')], [{\'url\': \'https://www.welfarehello.com/policy/eeaec0b5-aadf-4fc6-a2ff-08d5e8027d15\', \'content\': \'논산시 청년결혼축하금 지원사업 | 충청남도 논산시 | 웰로 논산시 청년결혼축하금 지원사업 최대 700만 원 부부 중 한 명이 이미 지원받은 경우에는 반액만 지급됩니다. 지원금액은 부부당 700만 원으로 3차에 걸쳐 분할 지급됩니다. 1차는 300만 원이 혼인신고 6개월 이후 신청 시 지급됩니다. 2차와 3차는 처음 신청일부터 각각 2년, 3년 후 200만 원씩 지급됩니다. ※ 부부 중 1명이 결혼축하금을 지원받았던 경우 반액만 지급 ○ 지원금액 : 1부부당 700만 원(3차 분할 지급) - 1차 : 300만 원 (혼인신고 6개월 경과 후 지원금 신청 시) - 2차 : 200만 원 (결혼축하금 최초 신청일로부터 2년 경과 후) - 3차 : 200만 원 (결혼축하금 최초 신청일로부터 3년 경과 후) - 청년결혼축하금 지원사업 이행서약서 1부 - 주민등록초본(주소변경 이력 포함) 및 혼인관계증명서(상세) 부부 각 1부\'}, {\'url\': \'https://mraz106.tistory.com/entry/논산-청년-결혼축하금-신청방법및-지원자격-안내\', \'content\': ""블로그 내 검색 검색 논산지역정보 2023년 청년결혼축하금 지원사업을 시행한다고 합니다. 사업기간 : 2023년 1월 ~2023년 12월 3차 : 200만원 (결혼축하금 최초 신청일로부터 3년 경과 후) 나이 : 혼인신고일 기준, 부부 모두 18세 이상 ~ 45세 이하인 부부 (국적) 1명 이상 내국인(부부 모두 외국인인 경우는 지원대상에 해당하지 않음) 혼인신고일 기준 계속하여 부부 중 1명 이상이 논산시에 6개월 이상 주민등록을 두고 거주할 것 결혼축하금 최초 신청일 현재 부부 모두 시에 주민등록(외국인 배우자의 경우 주민등록표에 등재)을 두고 거주 청년결혼축하금 지원신청서 및 개인정보 수집, 제공, 이용 동의서 1부 논산시+청년결혼축하금+지원사업+공고문.hwp \'논산지역정보\' 카테고리의 다른 글 논산에서 인천공항 가는방법(요금,시간표)\\xa0\\xa0(0) 2023.07.07 논산에서 건양대병원 가는방법 알려드려요.(버스,기차)\\xa0\\xa0(0)  2023.06.07 논산에서 인천공항 가는방법(요금,시간표) 논산에서 건양대병원 가는방법 알려드려요.(버스,기차) 논산지역정보 논산 맛집 지하철 시간표 버스 시간표 맛집""}]']","논산시 청년결혼축하금 지원사업은 부부당 최대 700만 원을 지원하며, 이는 3차에 걸쳐 분할 지급됩니다. 구체적인 지급 내용은 다음과 같습니다:

- **1차 지급**: 300만 원 (혼인신고 6개월 이후 신청 시 지급)
- **2차 지급**: 200만 원 (결혼축하금 최초 신청일로부터 2년 경과 후)
- **3차 지급**: 200만 원 (결혼축하금 최초 신청일로부터 3년 경과 후)

단, 부부 중 한 명이 이미 지원받은 경우에는 반액인 350만 원만 지급됩니다. 지원을 받기 위해서는 부부 모두 18세 이상 45세 이하이어야 하며, 혼인신고일 기준으로 주민등록을 논산시에 두고 거주해야 합니다."
논산 청년결혼축하금 지원사업의 신청 기간은 언제인가요?,"['정책 이름: 논산 청년결혼축하금 지원사업', '사업 신청 기간: 2024년 01월01일 2024년 12월31일']",2024년 01월 01일부터 2024년 12월 31일까지입니다.,"['[Document(metadata={\'name\': \'청년월세 한시 특별지원사업\', \'source\': \'..\\\\data\\\\policy_result.json\'}, page_content=\'기관:충남 논산시 정책 분야:주거분야 지원 내용:  실제 월세 범위내에서 월 최대 20만원 지원 사업 운영 기간:  2024. 3. ~ 2026. 12. 사업 신청 기간:2024년 02월01일 ~ 2025년 02월31일 비고:  2024. 2. ~ 2025. 2. 연령:만 19세 ~ 34세 거주지 및 소득:  논산시 1년이상 주소를 둔자   거주하는 본인  시민 자녀 신청 절차:  주소지 읍면동사무소   정부24 심사 및 발표:  담당부서 검토 후 지원대상자 확정 제출 서류: 재학 입학 증명서  주민록본  통장사본 주관 기관:  국토교통부 운영 기관:  논산시 인구청년교육과\'), Document(metadata={\'name\': \'전남청년부부 결혼축하금 지원\', \'source\': \'..\\\\data\\\\policy_result.json\'}, page_content=\'기관:전남 정책 분야:복지.문화분야 지원 내용:  지원액   부부당 200만원 사업 신청 기간:상시 지원 규모(명):5 000부부 비고:혼인신고일 기준 6개월이 경과되는 날부터 신청가능하며 혼인신고일 기준 1년 6개월 이내 신청 연령:만 0세 ~ 49세 거주지 및 소득:  다음 조건을 모두 충족하는 청년부부    연령  혼인신고일 기준  남녀 모두 49세 이하    혼인  2022. 7. 4. 이후 혼인신고 한 부부    부부 모두  청년부부 결혼축하금  수령 이력이 없어야 함 생애 1회     거주      요건을 모두 충족하는 청년부부   결혼축하금 신청일 직전까지 부부 모두 계속해서 도내에 6개월 이상 주소를  거주   신청일부터 지급일까지 부부 모두 도내에 주소를  거주하고  1명 신청자 은  시군 결혼축하금을 신청한 시군 에 주소를  거주  신청자가 아닌 1명은 도내 주소 이전 가능  신청일~지급일까지 단 하루라도 타 시도 전출 시 지급 제외  추가 단서 사항:  시 군별 지원 인원 상이   목포시   547부부   여수시   870부부   순천시   913부부   나주시   367부부   광양시   637부부   담양군   91부부   곡성군   47부부   구례군   57부부   고흥군   90부부   보성군   76부부   화순군   110부부   장흥군   72부부   강진군   86부부   해남군   131부부   영암군   128부부   무안군   348부부   함평군   71부부   영광군   51부부   장성군   74부부   완도군   100부부   진도군   65부부   신안군   69부부    시 군별 지원 인원은 상황에  조정될 수 있음 신청 절차:  신청시기   혼인신고일 기준  6개월이 경과되는 날부터 신청가능하며 혼인신고일 기준 1년 6개월 이내 신청   예시  혼인신고일 2022. 7. 4.   신청시기 2023. 1. 3. ~ 2024. 1. 2.   신청방법   사업기간   2024. 1. ~ 12.   신 청 자   부부 중 1명   신청방법   평일 월~금  09 00~18 00에 방문 신청   공휴일 제외   접 수 처   주민록상 주소지 관할 읍 면 동 주민센터 심사 및 발표:  지급시기   청년부부 결혼축하금 신청한 달의 다음 달 10일    예시  1월 신청   2월 10일 지급   2월 신청   3월 10일 지급    단  지급일이 공휴일인   공휴일이 끝난 다음 날 지급    예시  6. 10. 일요일   6. 11. 월요일에 결혼축하금 지급 제출 서류:  청년부부 결혼축하금 신청서 1부   개인정보 수집   동의서 1부   주민록초본 주소변경 이력 포함  부부 각 1부   주민록번호는 전체가 나와야 하며  개명한  개명체크란에 필히 체크해야 함   혼인관계증명서 부부 각 1부   통장 사본 1부   외국인 배우자와 혼인한   외국인록증 사본  주민록본 각 1부 추가 제출   부부 중 1명이 외국인인 에도 신청자격  신청시기 동일하게 적용   외국인이 초혼인지 확인해야 할    혼인상황확인서   과거 혼인여부 사실 가능한 서류 제출   부부 모두 외국인인 는 지원대상자에 되지 않음 주관 기관:전라남도 운영 기관:전라남도\'), Document(metadata={\'name\': \'청년 소상공인을 위한 고민상담소\', \'source\': \'..\\\\data\\\\policy_result.json\'}, page_content=\'기관:서울 중구 정책 분야:교육분야 지원 내용:청년 소상공인을 위한 심리교육 사업 신청 기간:2024년 06월21일 ~ 2024년 12월31일 비고:  모집기간  2024.6.21. 금  ~ 상시모집 연령:만 19세 ~ 34세 거주지 및 소득:19세이상 34세이하 청년사장님 사업자록증 확인  취업 상태:청년 소상공인 신청 절차:  신청방법   서울심리지원 제4권역 중부 센터 홈페이지  포스터 QR 신청   첨부파일 필수 확인 주관 기관:서울시 중구청 운영 기관:행복잇다 사회적협동조합\'), Document(metadata={\'name\': \'청년 면접정장 대여비 지원 사업 가평군 \', \'source\': \'..\\\\data\\\\policy_result.json\'}, page_content=\'기관:경기 가평군 정책 분야:일자리분야 지원 내용:  사업 내용   사업기간   2024. 1. ~ 12. 예산 소진 시까지    2024년 면접자 가능    지원대상   가평군에 주소를 둔 취업 준비를 하는 청년  2024. 1. 1. 기준 만15세 ~ 만39세 이하     일반교육  모의면접  대학교 원  면접  자 제외   대여내용    대여품목   정장 상 하의   셔츠  블라우스  넥타이  구두     대여기간   3~4일 대여한 사업장 상황에  상이     방법   개별로 원하는 업체에서 면접정장을 대여 선결제 후  비용 청구    지원내용    지원금액   1인당 1회 최대 10만원 이내     지급방법   계좌 입금 신청자 제출서류 심사 후 지급  사업 신청 기간:상시 비고: 예산 소진 시까지  연령:만 15세 ~ 39세 신청 절차:  가평군 홈페이지  에서 신청서 다운로드  작성 후  증빙서류와 함께 일자리정책과 청년팀 로 직접  이메일 kws1049 korea.kr  제출   2024년에 실시한 면접 자에 한하여 지원 가능   면접정장 대여비 지원은 1인 연 1회로 제한 제출 서류:청년 면접정장 대여비 지원 신청서 1부. 개인정보 수집   제3자  동의서 1부. 신청자 유의사항 확인서 1부. 주민록본 1부.  신청자 본인만 주민록번호 포함 제출  면접응시 증빙자료 1부. 면접정장 대여확인서  대여점 증빙서류 1부. 면접정장 대여 지출증빙서 1부.  신청자 명의 통장사본 1부. 주관 기관:경기도 가평군 운영 기관:가평군 일자리정책과 청년팀  연락처   031 580 4169\'), Document(metadata={\'name\': \'중소기업 정규직 프로젝트 영덕군 \', \'source\': \'..\\\\data\\\\policy_result.json\'}, page_content=\'기관:경북 영덕군 정책 분야:일자리분야 지원 내용:관내 중소기업을 대상으로 미취업 청년  결혼이민자  새터민  취약계층의 취업과 정규직 전환 지원 총 600만원 지원  기업 300만원  인턴 300만원   기업   인턴 1명당 월 150만원   2개월 인턴기간   인턴   정규직 전환일로부터 3개월차와 10개월 차에 각 150만원   2번 지급 사업 운영 기간:2024 02 27~2024 12 31 사업 신청 기간:미정 지원 규모(명):영덕군 관내 중소기업  청년 비고:2024. 2. 27. ~ 사업비 소진시까지 연령:만 19세 이상 주관 기관:경상북도 운영 기관:영덕군청 일자리경제과 \')], [{\'url\': \'https://mraz106.tistory.com/entry/논산-청년-결혼축하금-신청방법및-지원자격-안내\', \'content\': ""블로그 내 검색 검색 논산지역정보 2023년 청년결혼축하금 지원사업을 시행한다고 합니다. 사업기간 : 2023년 1월 ~2023년 12월 3차 : 200만원 (결혼축하금 최초 신청일로부터 3년 경과 후) 나이 : 혼인신고일 기준, 부부 모두 18세 이상 ~ 45세 이하인 부부 (국적) 1명 이상 내국인(부부 모두 외국인인 경우는 지원대상에 해당하지 않음) 혼인신고일 기준 계속하여 부부 중 1명 이상이 논산시에 6개월 이상 주민등록을 두고 거주할 것 결혼축하금 최초 신청일 현재 부부 모두 시에 주민등록(외국인 배우자의 경우 주민등록표에 등재)을 두고 거주 청년결혼축하금 지원신청서 및 개인정보 수집, 제공, 이용 동의서 1부 논산시+청년결혼축하금+지원사업+공고문.hwp \'논산지역정보\' 카테고리의 다른 글 논산에서 인천공항 가는방법(요금,시간표)\\xa0\\xa0(0) 2023.07.07 논산에서 건양대병원 가는방법 알려드려요.(버스,기차)\\xa0\\xa0(0)  2023.06.07 논산에서 인천공항 가는방법(요금,시간표) 논산에서 건양대병원 가는방법 알려드려요.(버스,기차) 논산지역정보 논산 맛집 지하철 시간표 버스 시간표 맛집""}, {\'url\': \'https://jwgm.kr/454000000179\', \'content\': \'충청남도 논산시 논산시 청년결혼축하금 지원 지원금 목록 - 국가 지원금 신청방법 모음 국가 지원금 신청 방법 모음 [충청남도 논산시] 논산시 청년결혼축하금 지원 신청기한 ○ 논산시 청년결혼축하금 지원 - 지원금액 : 1부부당 700만원(3차 분할 지급) ○ 2023. - 신청기한 : 혼인신고일로부터 6개월이 경과한 날부터 1년 이내 * 혼인 : 부부 중 1명 이상이 초혼 * 혼인신고일 기준 계속하여 부부 중 1명이상 시에 6개월 이상 주소를 두고 거주 * 결혼축하금 최초 신청일 현재 부부 시에 주소를 두고 거주 * 3차 신청시까지 부부모두 시에 주소를 두고 혼인관계 유지 ○ 온라인 신청 ○ 방문 신청 1. 개인정보 이용.수집.제공에 관한 동의서 1부 2. 주민등록초본(주소변경 이력 포함) 부부 각 1부 3. 혼인관계증명서(상세) 부부 각 1부 4. 통장 사본 1부 5. 외국인등록사실증명서 1부.(배우자가 외국인일 경우)\'}]']","논산시의 청년결혼축하금 지원사업에 대한 정보는 다음과 같습니다:

### 지원 내용
- **지원금액**: 1부부당 700만원 (3차 분할 지급)
  
### 신청 기간
- **신청기한**: 혼인신고일로부터 6개월이 경과한 날부터 1년 이내

### 신청 자격
- 부부 중 1명 이상이 초혼이어야 함
- 혼인신고일 기준으로 계속하여 부부 중 1명이상 논산시에 6개월 이상 주민등록을 두고 거주해야 함
- 결혼축하금 최초 신청일 현재 부부 모두 논산시에 주민등록을 두고 거주해야 함
- 결혼관계 유지가 필요함 (3차 신청시까지)

### 신청 방법
- **온라인 신청** 및 **방문 신청** 가능
- 제출 서류:
  1. 개인정보 이용.수집.제공에 관한 동의서 1부
  2. 주민등록초본 (주소변경 이력 포함) 부부 각 1부
  3. 혼인관계증명서 (상세) 부부 각 1부
  4. 통장 사본 1부
  5. 외국인등록사실증명서 1부 (배우자가 외국인일 경우)

이 정보는 논산시의 청년결혼축하금 지원사업에 대한 공식 정책과 함께, 실시간 웹 검색 결과를 통해 확인된 내용을 바탕으로 작성되었습니다. 추가적인 정보나 세부사항은 해당 기관의 공식 웹사이트나 관련 부서에 문의하시기 바랍니다."
논산 청년결혼축하금 지원사업의 신청 절차는 어떻게 되나요?,"['정책 이름: 논산 청년결혼축하금 지원사업', '신청 절차: 주소지 읍면동사무소 정부24']",주소지 읍면동사무소나 정부24를 통해 신청할 수 있습니다.,"[""[Document(metadata={'name': '전남청년부부 결혼축하금 지원', 'source': '..\\\\data\\\\policy_result.json'}, page_content='기관:전남 정책 분야:복지.문화분야 지원 내용:  지원액   부부당 200만원 사업 신청 기간:상시 지원 규모(명):5 000부부 비고:혼인신고일 기준 6개월이 경과되는 날부터 신청가능하며 혼인신고일 기준 1년 6개월 이내 신청 연령:만 0세 ~ 49세 거주지 및 소득:  다음 조건을 모두 충족하는 청년부부    연령  혼인신고일 기준  남녀 모두 49세 이하    혼인  2022. 7. 4. 이후 혼인신고 한 부부    부부 모두  청년부부 결혼축하금  수령 이력이 없어야 함 생애 1회     거주      요건을 모두 충족하는 청년부부   결혼축하금 신청일 직전까지 부부 모두 계속해서 도내에 6개월 이상 주소를  거주   신청일부터 지급일까지 부부 모두 도내에 주소를  거주하고  1명 신청자 은  시군 결혼축하금을 신청한 시군 에 주소를  거주  신청자가 아닌 1명은 도내 주소 이전 가능  신청일~지급일까지 단 하루라도 타 시도 전출 시 지급 제외  추가 단서 사항:  시 군별 지원 인원 상이   목포시   547부부   여수시   870부부   순천시   913부부   나주시   367부부   광양시   637부부   담양군   91부부   곡성군   47부부   구례군   57부부   고흥군   90부부   보성군   76부부   화순군   110부부   장흥군   72부부   강진군   86부부   해남군   131부부   영암군   128부부   무안군   348부부   함평군   71부부   영광군   51부부   장성군   74부부   완도군   100부부   진도군   65부부   신안군   69부부    시 군별 지원 인원은 상황에  조정될 수 있음 신청 절차:  신청시기   혼인신고일 기준  6개월이 경과되는 날부터 신청가능하며 혼인신고일 기준 1년 6개월 이내 신청   예시  혼인신고일 2022. 7. 4.   신청시기 2023. 1. 3. ~ 2024. 1. 2.   신청방법   사업기간   2024. 1. ~ 12.   신 청 자   부부 중 1명   신청방법   평일 월~금  09 00~18 00에 방문 신청   공휴일 제외   접 수 처   주민록상 주소지 관할 읍 면 동 주민센터 심사 및 발표:  지급시기   청년부부 결혼축하금 신청한 달의 다음 달 10일    예시  1월 신청   2월 10일 지급   2월 신청   3월 10일 지급    단  지급일이 공휴일인   공휴일이 끝난 다음 날 지급    예시  6. 10. 일요일   6. 11. 월요일에 결혼축하금 지급 제출 서류:  청년부부 결혼축하금 신청서 1부   개인정보 수집   동의서 1부   주민록초본 주소변경 이력 포함  부부 각 1부   주민록번호는 전체가 나와야 하며  개명한  개명체크란에 필히 체크해야 함   혼인관계증명서 부부 각 1부   통장 사본 1부   외국인 배우자와 혼인한   외국인록증 사본  주민록본 각 1부 추가 제출   부부 중 1명이 외국인인 에도 신청자격  신청시기 동일하게 적용   외국인이 초혼인지 확인해야 할    혼인상황확인서   과거 혼인여부 사실 가능한 서류 제출   부부 모두 외국인인 는 지원대상자에 되지 않음 주관 기관:전라남도 운영 기관:전라남도'), Document(metadata={'name': '서산시 둘째이후 영유아 양육비 지원', 'source': '..\\\\data\\\\policy_result.json'}, page_content='기관:충남 서산시 정책 분야:복지.문화분야 지원 내용:둘째아 이후 출생자녀에 대하여 1인당 매월 10만원씩 3세까지 양육비 지급 사업 신청 기간:상시 비고:상시신청 거주지 및 소득:둘째 이후 자녀에 대하여 출생일을 기준으로 3세 이하인 자녀이며 서산시 관내에 주민록을  실제로 거주하고 있는 출산 가정에 한함. 학력:고졸 미만 고교 재학 고졸 예정 고교 졸업 대학 재학 대졸 예정 대학 졸업 석 박사 전공:인문계열 사회계열 상경계열 이학계열 공학계열 예체능계열 농산업계열 취업 상태:재직자 자영업자 미취업자 프리랜서 일용근로자 단기근로자 영농종사자 특화 분야:여성 저소득층 신청 절차:정부24 행복출산 사이트 신청  portal onestopSvc happyBirth  ~ text %ED%96%89%EB%B3%B5%EC%B6%9C%EC%82%B0.%20%EC%B6%9C%EC%82%B0%20%ED%9B%84  주관 기관:서산시 기획예산담당관실 운영 기관:서산시 기획예산담당관실'), Document(metadata={'name': '양산시 경남사회복지공동모금회 지원 은둔고립청년 사업 자 모집', 'source': '..\\\\data\\\\policy_result.json'}, page_content='기관:경남 양산시 정책 분야:복지.문화분야 지원 내용:  선발된 은둔 고립 청년 지원 내용    자기성장 계획서 작성    대상자가 희망하는 꿈  꿈은 직업이 아니라도 됨 ex  사람들 앞에서 말을 잘 하고 싶다 도 꿈으로 들어감    자기성장 계획서에  실천 지원    1 1 맞춤형 지원. 자가 희망 시 전문 임상심리 상담사 무료 지원    양산시 내 다양한 청년 자원연계    대상자가 원하는 곳에 마음쉼터 운영 예정  양산시의 청년지원 자원 체계 연계하여  무료 로 진행 사업 신청 기간:2024년 02월19일 ~ 2024년 12월31일 비고:2024 02 19 09 00 ~ 2024 12 31 18 00 연령:만 19세 ~ 39세 학력:고졸 미만 고교 재학 고졸 예정 고교 졸업 대학 재학 대졸 예정 대학 졸업 석 박사 전공:인문계열 사회계열 상경계열 이학계열 공학계열 예체능계열 농산업계열 취업 상태:재직자 자영업자 미취업자 프리랜서 일용근로자 창업자 단기근로자 영농종사자 특화 분야:중소기업 여성 저소득층 장애인 농업인 군인 지역인재 신청 절차:  링크 클릭   링크에 들어가서 자가 척도 작성시 추첨을  100명에게 5천원 상당의 기프티콘을  주관 기관:경남사회복지공동모금회 운영 기관:웅상종합사회복지관'), Document(metadata={'name': '첫살림 지원 사업 신청 안내 경기도 ', 'source': '..\\\\data\\\\policy_result.json'}, page_content='기관:경기 정책 분야:주거분야 지원 내용: 지원금액   1인 최대 100만원까지 신청 가능  지원내용   주거 독립 후 생활에 필요한 가전  가구  물품을 지원 소모품 신청 불가  사업 신청 기간:상시 지원 규모(명):  지원인원   10명 내외 비고:  지원시기  2024년 2월 ~ 12월 예산 소진 시 사업 마감  연령:만 18세 ~ 26세 거주지 및 소득:  신청자격   아래 요건을 모두 충족하는 자   경기남부가정위탁지원센터 지원 아동 아동  보호자가 관할지역 내 거주    만 26세 이하 보호연장아동   위탁부모와 분리되어 첫 독립을 시작하는 아동   6월 15일 신규 웰컴워크숍 가 가능한 아동 제출 서류:  제출서류   첫살림 지원 신청서  개인정보수집  동의서   첨부파일 다운이 안 되는  센터로 문의해주시기 바랍니다.  주관 기관:  경기남부가정위탁지원센터 031 234 3980 '), Document(metadata={'name': '울산 남구 저소득층 청년 취업면접 수당 지원', 'source': '..\\\\data\\\\policy_result.json'}, page_content='기관:울산 정책 분야:일자리분야 지원 내용:  지원금액  면접 1회당 20만원  1회 한함  사업 신청 기간:2024년 03월01일 ~ 2024년 12월31일 비고:2024.3.1. ~ 2024.12.31.  예산소진 시 조기 종료 연령:만 18세 ~ 39세 거주지 및 소득:  모집대상  남구거주 18세 이상 39세 이하 저소득층 청년   신청자격   소득인정액 중위소득 100%이하 청년 1985.1.1. ~ 2006.12.31.    2024.3.1. 이후 면접에 응시한 자 참여 제한 대상:  취업 목적이 아닌 각종 교육  훈련 과정에 하기 위한 면접인    사회 통념상 취업을 위한 면접에 응시했다고 인정할 수 없는    취업 의사가 없음에도 수당을 목적으로 면접에 응한 것이 확인된    직계 존비속  배우자  가족이 대표자인 사업장 에 지원하는  신청 절차:  신청장소  주소지 동 행정복지센터 제출 서류:면접확인서  면접기업 채용 공고문 3개월이상 일자리   건강보험자격득실확인서  건강보험료납부확인서  주민록본 주관 기관:울산광역시 남구 복지지원과 운영 기관:주소지 동 행정복지센터')], [{'url': 'https://gyang-info.com/entry/논산시-청년결혼축하-지원금-신청자격-및-신청방법', 'content': '논산시 청년결혼축하 지원금 신청자격 및 신청방법 논산시 청년결혼축하 지원금 신청자격 및 신청방법 최대 현금 700만 원을 받을 수 있다고 하니, 신청자격과 신청방법에 대해 얼른 알아보겠습니다. ● 혼인신고일 기준, 부부 모두 18세 이상 ~ 45세 이하 ● 혼인신고일 기준 부부 중 1명 이상이 논산시에서 6개월 이상 거주한 자 ● 총 700만 원 지급(3회 분할 지급) ● 1차 신청 시 300만 원 지급(혼인 신고 6개월 경과 후 신청) ● 2차 신청 시 200만 원 지급(결혼축하금 최초 신청일로부터 2년 후) ● 3차 신청 시 200만 원 지급(결혼축하금 최초 신청일로부터 3년 후) ● 논산시 읍·면·동 복지센터에서 방문 접수 지금까지 논산시 결혼축하금 지원 사업을 알려드렸습니다. 최대 60만원 지원 2023년 노후화된 가정용 보일러를 친환경 보일러로 교체해 주는 지원 사업에 대해 알아보겠습니다. 이메일: help@abaeksite.com | 운영자 : 아로스  '}, {'url': 'https://irondle.com/entry/wedding-gift', 'content': '논산시는 청년들의 결혼을 장려하고 결혼 시 정착하는데 경제적 도움을 주고자 청년결혼축하금을 7월 초부터 시행한다고 합니다. 지원대상, 지원금액, 신청 기한, 신청방법 등 자세하게 알아보겠습니다. 결혼축하금 최초 신청일 현재 부부 모두가 논산시에 주민등록을 두고 있어야 합니다. 3차 신청까지 부부 모두 논산시에 주민등록을 두고 혼인관계가 유지되고 있어야 합니다. ※ 혼인신고일 이후 6개월 지난 시점부터 1년 안에 신청하셔야 합니다. 1차: 300만 원 / 혼인신고 6개월 경과 후 지원금 신청이 가능합니다. 2차: 200만 원 / 결혼축하금 최초 신청일로부터 2년 경과 후에 신청가능합니다. 3차: 200만 원 / 결혼축하금 최초 신청일로부터 3년 경과 후에 신청가능합니다. 시간제 보육 서비스 지원 대상 및 신청 방법 시간제 보육 서비스는 말 그대로 내가 원하는 시간에만 아이를 맡길 수 있고 그 시간만큼 보육료를 지불하는 방식입니다. 시간제 보육 서비스 지원 대상 및 신청 방법 2023.06.17'}]""]","논산시 청년결혼축하금 지원사업에 대한 신청 절차는 다음과 같습니다:

1. **신청 자격**:
   - 혼인신고일 기준으로 부부 모두 18세 이상 ~ 45세 이하이어야 합니다.
   - 혼인신고일 기준으로 부부 중 1명 이상이 논산시에 6개월 이상 거주한 자이어야 합니다.

2. **지원 금액 및 지급 방식**:
   - 총 700만 원이 지급되며, 3회에 걸쳐 분할 지급됩니다.
     - **1차 지급**: 300만 원 (혼인신고 6개월 경과 후 신청 가능)
     - **2차 지급**: 200만 원 (결혼축하금 최초 신청일로부터 2년 후 신청 가능)
     - **3차 지급**: 200만 원 (결혼축하금 최초 신청일로부터 3년 후 신청 가능)

3. **신청 기간**:
   - 혼인신고일 이후 6개월이 경과된 시점부터 1년 이내에 신청해야 합니다.

4. **신청 방법**:
   - 논산시 읍·면·동 복지센터에서 방문 접수해야 합니다.

5. **기타 사항**:
   - 부부 모두 혼인관계가 유지되고, 신청 시점까지 논산시에 주민등록을 두고 있어야 합니다.

신청을 원하시는 경우, 가까운 읍·면·동 복지센터를 방문하여 자세한 상담을 받으시기 바랍니다."
유스타트 주택청약 종합저축 지원사업의 주관 기관은 어디인가요?,"['정책 이름: 유스타트 주택청약 종합저축 지원사업', '기관:경남', '지원 내용: 립준비청년의 주거 복지를 위한 주택청약종합저축 납입지원금 지원', '주관 기관:적십사']",적십사,"['[Document(metadata={\'name\': \'유스타트 주택청약 종합저축 지원사업\', \'source\': \'..\\\\data\\\\policy_result.json\'}, page_content=\'기관:경남 정책 분야:주거분야 지원 내용:  자립준비청년의 주거 복지를 위한 주택청약종합저축 납입지원금 지원   우리은행 주택청약종합저축  청년우대형 주택청약종합저축  별도자격요건 필요  통장 개설    매월 주택청약종합저축 계좌로 2만원 자동이체   지원예산  1인당 월 2만원씩 24개월 지원  본인 자금으로 1회 납입 후 2회~25회차까지 납입금 지원    신청기간은 모집 마감시까지 사업 신청 기간:상시 비고:2024.01.16.~2024.01.24. 연령:만 19세 ~ 34세 거주지 및 소득:퇴소했거나 재원중이거나 보호가 종료된 아동 만18세~34세  1 000명 신청 절차:온라인 홈페이지 바로가기  신청 주관 기관:적십자사 운영 기관:주관기관과 동일\'), Document(metadata={\'name\': \'청년안심주택 공급 매입 \', \'source\': \'..\\\\data\\\\policy_result.json\'}, page_content=\'기관:서울 정책 분야:주거분야 지원 내용:역세권 간선도로변 의 민간소유 토지를 체계적으로 개발 민간 주도 공공 지원 하여 쾌적하고 저렴한 주택을 공급함으로써 청년층의 주거안정을 도모하고 지역경제를 활성화하고자 함. 사업 신청 기간:상시 지원 규모(명):8 184실 공공 2 216실  민간 5 968실  비고:연간 상시   공고문 필히 참고 요망 연령:만 19세 ~ 39세 기타 유익 정보:  공공임대 문의   1600 3456   청년안심주택의 원활한 공급  운영을 위하여 사업자  입주자를 대상으로 종합적인 컨설팅  상담 지원 주관 기관:전략주택공급과 운영 기관:전략주택공급과\'), Document(metadata={\'name\': \'수원도시재단 안심 집 찾기\', \'source\': \'..\\\\data\\\\policy_result.json\'}, page_content=\'기관:경기 수원시 정책 분야:주거분야 지원 내용:  주택물색 희망하는 대상자 수요파악  기초상담   공인중개사 연계 주택물색 동행  사업 신청 기간:상시 거주지 및 소득:지원대상   수원시  공간거주자   수원시 거주 청년  사회 초년생 포함    기타 가 필요한 수원시민 신청 절차:수원도시재단 홈페이지 신청서작성 후 이메일 접수 tskim sscf2016.or.kr  주관 기관:수원도시재단 운영 기관:수원도시재단 주거복지센터 1551 5915 \'), Document(metadata={\'name\': \'울산 동구 전세보증금 반환보증 보증료 지원\', \'source\': \'..\\\\data\\\\policy_result.json\'}, page_content=\'기관:울산 동구 정책 분야:주거분야 지원 내용:  지원내용   전세보증금반환보증에 가입한 보증료 전부  일부 지원  보증기관   주택도시보증공사 HUG    한국주택금융공사 HF    SGI서울보증   신청인이 기 납부한 보증료를 최대 30만원  신청인 본인 계좌로 이체   청년  신혼부부   기 납부한 보증료의 100% 지원  최대 30만원    청년 외   기 납부한 보증료의 90% 지원  최대 30만원  사업 신청 기간:2024년 03월04일 ~ 2024년 12월31일 비고:2024. 3. 4. 부터 신청 가능  연중  연령:만 19세 ~ 39세 거주지 및 소득:  신청대상   거주지   신청일 기준 보증효력이 유효한 전세보증금반환보증에 가입한 울산광역시 동구 거주자   외국인  재외국민은 지원 제외   연령   전 연령   소득   청년    연소득 5천만원 이하  기혼자는 부부 합산    청년 외   연소득 6천만원 이하  기혼자는 부부 합산    신혼부부     부부 합산 연소득 7천5백만원 이하    울산광역시 청년 기본 조례에  연령 만19세 ~ 만39세     혼인신고일로부터 7년 이내   주택   임대차계약서 보증금이 3억원 이하인 주민록 주소지와 일치하는 주거용 주택 추가 단서 사항:공고문 참고 참여 제한 대상:공고문 참고 신청 절차:울산광역시 동구청 건축주택과 방문 신청 심사 및 발표:공고문 참고 제출 서류:공고문 참고 기타 유익 정보:공고문 참고 주관 기관:울산광역시 동구 건축주택과  052 209 3793  운영 기관:주관기관과 동일\'), Document(metadata={\'name\': \'전세사기 피해예방을 위한 주택 안심계약 상담 창구 운영\', \'source\': \'..\\\\data\\\\policy_result.json\'}, page_content=\'기관:전북 전주시 정책 분야:주거분야 지원 내용:  상담내용   1. 주택 전 월세 계약상담 전세 계약 유의사항  2. 주거정책안내 맞춤형 지원정보     운영장소   전주시청 1층 민원실 내 상담창구   운영시간   매주 화요일 주1회  14 00 ~ 17 00  사업 신청 기간:2024년 10월10일 ~ 2024년 12월31일 비고:2024.10.10~12.31 연령:만 18세 ~ 39세 거주지 및 소득:전주시 거주  거주 예정 청년 사회초년생   신청 절차:방문상담  유선상담 주관 기관:전주시청 운영 기관:도시계획과\')], [{\'url\': \'https://m.blog.naver.com/knredcross/223146354099\', \'content\': \'오는 7월 14일까지 진행되는 유스타트 주택청약종합저축 지원사업을 알고 계시나요? 한국토지주택공사(LH)가 우리은행, 대한적십자사와 자립준비청년을 위해 주택청약종합저축액 납입을 지원하는 ‘유스타트(Youth+Start) 주택청약저축 프로그램은 주거공간을 직접 제공하는 것뿐만 아니라 주택청약종합저축 가입·저축액 납입을 지원해 자립준비청년들이 자립할 수 있는 기반을 마련하는 프로그램입니다. 1인당 월 2만 원씩 24개월 지원!! 지원 예산: 1인당 월 2만 원씩 24개월 지원 또한 대한적십자사는 대상자 모집 및 선정, 주택청약종합저축 통장 관리를 담당하는 형식으로 진행되는데요. 대한적십자사 유스타트 주택청약종합저축 바로 가기 서류 발급 시 유의사항은 자격 및 기타 증빙은 최근 3개월 이내 발급된 서류만 인정되니 최신 서류\\u200b를 준비해 주세요! ※ 자격 및 기타 증빙은 최근 3개월 이내 발급된 서류만 인정(보호종료아동확인서 제외) 오늘 알려드린 신청방법 및 지원 요건을 자세히 확인해 보시고 해당되시는 분들은 7/14일 전까지 대한적십자사 홈페이지를 통해 신청해 주시기 바랍니다. 주거비지원 #청년지원정책 #주택청약종합저축 #유스타트주택청약종합저축지원 청년정책 #지원정책 #주거비지원정책 #청년주거비지원 #주택청약\'}, {\'url\': \'http://www.wlv.kr/news/articleView.html?idxno=2649262\', \'content\': ""[워라벨타임스] 한국토지주택공사(LH)가 우리은행, 대한적십자사와 손잡고 자립준비청년의 주택청약종합저축액 납입을 지원하는 유스타트(Youth+Start) 주택청약저축 프로그램\'을 진행한다.11일 LH에 따르면 세 기관은 지난 9일 LH 서울지역본부에서 이한준 LH 사장, 이원덕 우리은""}]']",유스타트 주택청약 종합저축 지원사업의 주관 기관은 대한적십자사입니다. 이 사업은 한국토지주택공사(LH)와 우리은행과 협력하여 자립준비청년들의 주택청약종합저축 납입을 지원하는 프로그램입니다.
유스타트 주택청약 종합저축 지원사업은 어떤 연령대를 대상으로 하나요?,"['정책 이름: 유스타트 주택청약 종합저축 지원사업', '연령:만 19세 34세']",만 19세 34세,"[""[Document(metadata={'name': '유스타트 주택청약 종합저축 지원사업', 'source': '..\\\\data\\\\policy_result.json'}, page_content='기관:경남 정책 분야:주거분야 지원 내용:  자립준비청년의 주거 복지를 위한 주택청약종합저축 납입지원금 지원   우리은행 주택청약종합저축  청년우대형 주택청약종합저축  별도자격요건 필요  통장 개설    매월 주택청약종합저축 계좌로 2만원 자동이체   지원예산  1인당 월 2만원씩 24개월 지원  본인 자금으로 1회 납입 후 2회~25회차까지 납입금 지원    신청기간은 모집 마감시까지 사업 신청 기간:상시 비고:2024.01.16.~2024.01.24. 연령:만 19세 ~ 34세 거주지 및 소득:퇴소했거나 재원중이거나 보호가 종료된 아동 만18세~34세  1 000명 신청 절차:온라인 홈페이지 바로가기  신청 주관 기관:적십자사 운영 기관:주관기관과 동일'), Document(metadata={'name': '주택 안심계약 도움 ', 'source': '..\\\\data\\\\policy_result.json'}, page_content='기관:충남 정책 분야:주거분야 지원 내용:  청년 맞춤형 부동산 전문상담  집보기 동행  사업 운영 기간:  2024 01 01~2024 12 31 사업 신청 기간:상시 비고:  상시 연령:만 19세 ~ 45세 거주지 및 소득:  충남거주  거주예정 청년 연령은 시군 사정에  다름  신청 절차:  온라인 예정   유선신청 심사 및 발표:  신청자 개별 통지 유선   주관 기관:  충청남도 운영 기관:  15개 시군'), Document(metadata={'name': '울산 중구 청년 주거상담소 지정 운영', 'source': '..\\\\data\\\\policy_result.json'}, page_content='기관:울산 중구 정책 분야:주거분야 지원 내용:  지원금액   전 월세 환산보증금 보증금  월차임 100   7 000만원 이하 주택 임대차 계약 시 임차인의 중개 수수료 50% 감면 사업 운영 기간:  사업기간    24. 1. ~ 12.   2019년 중구지회 협약에  연장 사업 신청 기간:상시 연령:만 18세 ~ 34세 거주지 및 소득:  지원대상   중구에 거주 생활  전입예정인 18세 ~ 34세 이하 청년 신청 절차:  방법   재능기부 한 공인중개사 문의 후 신청   중개업소 목록   울산광역시 중구 홈페이지 참고 주관 기관:울산광역시 중구청 민원지적과 052 290 3485  운영 기관:주관기관과 동일'), Document(metadata={'name': '기존 주택매입 청년임대', 'source': '..\\\\data\\\\policy_result.json'}, page_content='기관:인천 정책 분야:주거분야 지원 내용:  주변 전세가 대비 30% 이하  전용면적 50 이하 다가구  다세대  연립주택  자세한 사항은 아래 참고사이트 클릭하여 확인바랍니다. 사업 운영 기간:2024.1. ~ 12. 사업 신청 기간:미정 비고:사업기간   2024.1~12 연령:만 19세 ~ 39세 거주지 및 소득:  거주지   제한없음   소득   무주택자인 미혼청년 대학생  취업준비생  19세이상 39세이하    1순위  생계 주거 의료급여수급자    2순위  본인 부모 월평균소득 100%   3순위  본인 월평균소득 100%   대상   19세 이상 39세 이하 무주택 미혼 청년 주관 기관:인천광역시 주택정책과 운영 기관:인천도시공사'), Document(metadata={'name': '청년월세 한시 특별지원 사업 예천군 ', 'source': '..\\\\data\\\\policy_result.json'}, page_content='기관:경북 예천군 정책 분야:주거분야 지원 내용: 청년기본법 상 청년 19~34세 이하 으로 부모님과 별도 거주하는 무주택자에 대하여 실제 납부하는 임대료를 최대 240만원 월 최대 20만원 까지 최대 12개월 회  동안 매월 분할 지원 사업 운영 기간:2024 02 26~2026 12 31 사업 신청 기간:2024년 02월26일 ~ 2025년 02월25일 지원 규모(명):19세 이상 34세 이하 부모와 별도 거주 무주택청년 비고:2024 02 26~2025 02 25 연령:만 19세 ~ 34세 주관 기관:국토교통부 운영 기관:국토교통부')], [{'url': 'https://biz.chosun.com/real_estate/real_estate_general/2022/12/11/A77QZHFTNFHDHGO62SRTFLS5NM/', 'content': 'LH, 자립준비청년 주택청약종합저축 2년간 지원 - 조선비즈 2024년 12월 27일(금) LH, 자립준비청년 주택청약종합저축 2년간 지원 한국토지주택공사(LH)가 우리은행, 대한적십자사와 자립준비청년을 위해 주택청약종합저축액 납입을 지원하는 ‘유스타트(Youth+Start) 주택청약저축 프로그램’을 실시한다고 11일 밝혔다. 이한준 LH 사장(왼쪽)이 신희영 대한적십자사 회장(가운데), 이원덕 우리은행장과 지난 9일 LH 서울지역본부에서 ’자립준비청년의 주거자립 지원을 위한 업무협약’을 마치고 기념촬영을 하고 있다./LH제공 LH와 우리은행은 매년 아동보호시설 퇴소 후 5년 이내인 자립준비청년 1000명을 대상으로, 1인당 월 2만원씩 2년간 총 48만 원의 저축액을 지원한다. 한편 세 기관은 지난 9일 LH 서울지역본부에서 이한준 LH 사장, 이원덕 우리은행장, 신희영 대한적십자사 회장이 참석한 가운데 ‘자립준비청년의 주거자립 지원을 위한 업무협약’을 체결했다. 부동산 많이 본 뉴스 많이 본 뉴스 [단독] 강남 대부업체 2000억 폰지사기 의혹… 서울시·금감원 감독 공백에 7년 방치 연예 많이 본 뉴스 인터넷신문등록번호: 서울 아01175 (등록일자: 2010년 3월 19일)'}, {'url': 'https://m.blog.naver.com/knredcross/223146354099', 'content': '오는 7월 14일까지 진행되는 유스타트 주택청약종합저축 지원사업을 알고 계시나요? 한국토지주택공사(LH)가 우리은행, 대한적십자사와 자립준비청년을 위해 주택청약종합저축액 납입을 지원하는 ‘유스타트(Youth+Start) 주택청약저축 프로그램은 주거공간을 직접 제공하는 것뿐만 아니라 주택청약종합저축 가입·저축액 납입을 지원해 자립준비청년들이 자립할 수 있는 기반을 마련하는 프로그램입니다. 1인당 월 2만 원씩 24개월 지원!! 지원 예산: 1인당 월 2만 원씩 24개월 지원 또한 대한적십자사는 대상자 모집 및 선정, 주택청약종합저축 통장 관리를 담당하는 형식으로 진행되는데요. 대한적십자사 유스타트 주택청약종합저축 바로 가기 서류 발급 시 유의사항은 자격 및 기타 증빙은 최근 3개월 이내 발급된 서류만 인정되니 최신 서류\\u200b를 준비해 주세요! ※ 자격 및 기타 증빙은 최근 3개월 이내 발급된 서류만 인정(보호종료아동확인서 제외) 오늘 알려드린 신청방법 및 지원 요건을 자세히 확인해 보시고 해당되시는 분들은 7/14일 전까지 대한적십자사 홈페이지를 통해 신청해 주시기 바랍니다. 주거비지원 #청년지원정책 #주택청약종합저축 #유스타트주택청약종합저축지원 청년정책 #지원정책 #주거비지원정책 #청년주거비지원 #주택청약'}]""]","유스타트 주택청약 종합저축 지원사업은 만 19세에서 34세 사이의 자립준비청년을 대상으로 하고 있습니다. 이 사업은 아동 보호시설 퇴소 후 5년 이내의 청년이 해당되며, 지원 내용으로는 매월 2만 원씩 24개월 동안 주택청약종합저축 납입을 지원합니다."
유스타트 주택청약 종합저축 지원사업의 지원 금액은 얼마인가요?,"['정책 이름: 유스타트 주택청약 종합저축 지원사업', '지원 내용: 립준비청년의 주거 복지를 위한 주택청약종합저축 납입지원금 지원', '지원예산 1인당 월 2만원씩 24개월 지원']",1인당 월 2만원씩 24개월 지원,"[""[Document(metadata={'name': '유스타트 주택청약 종합저축 지원사업', 'source': '..\\\\data\\\\policy_result.json'}, page_content='기관:경남 정책 분야:주거분야 지원 내용:  자립준비청년의 주거 복지를 위한 주택청약종합저축 납입지원금 지원   우리은행 주택청약종합저축  청년우대형 주택청약종합저축  별도자격요건 필요  통장 개설    매월 주택청약종합저축 계좌로 2만원 자동이체   지원예산  1인당 월 2만원씩 24개월 지원  본인 자금으로 1회 납입 후 2회~25회차까지 납입금 지원    신청기간은 모집 마감시까지 사업 신청 기간:상시 비고:2024.01.16.~2024.01.24. 연령:만 19세 ~ 34세 거주지 및 소득:퇴소했거나 재원중이거나 보호가 종료된 아동 만18세~34세  1 000명 신청 절차:온라인 홈페이지 바로가기  신청 주관 기관:적십자사 운영 기관:주관기관과 동일'), Document(metadata={'name': '2024년 자립준비청년 청년 유형  전세임대', 'source': '..\\\\data\\\\policy_result.json'}, page_content='기관:한국토지주택공사 정책 분야:주거분야 지원 내용:  전세보증금 지원한도액  지원가능 주택면적  단독형 1인  수도권 1.2억원   광역시 9 500만원   기타 도 지역 8 500만원  쉐어형 2인 수도권 1.5억원   광역시 1.2억원   기타 도 지역 1억원  쉐어형 3인 이상  수도권 2억원   광역시 1.5억원   기타 도 지역 1.2억원   셰어형을 원하는  단독형으로 신청  입주대상자 선정 안내를 받은 후  지역본부에 연락하여 셰어형으로으로 요청 셰어형은 동성만 지원가능. 단  남매는 허용     호당 전용면적 85  이하여야 하며  가구원이 5인 이상인  셰어형에 한함  전용면적 85 를 초과한 주택 지원가능   지역별 지원한도액을 초과하는 주택은 임차권을 LH에게 귀속하고 호당 지원한도액을 초과하는 금액을 입주대상자가 부담하는 조건으로   1호에 1인 입주 시 호당 지원한도액의 150%이내  2인 이상 입주 시 셰어형에 한함  지원한도액의 200% 이내만 지원가능    지원가능주택   당첨자가 신청한 지역의 전용면적 85  이하 전세  보증부월세로 계약 가능한 주택  단독  다가구  다세대  연립주택  아파트  주거용 오피스텔     부채비율 전세지원금 포함 총부채 주택가격 이 90% 이하인 주택   주거용 오피스텔의  바닥난방이 되며  별도로 취사   세면시설  화장실을 갖추어 주거용 사실상 사용 으로 가능하여야 함   보증부월세 전세임대주택의  매월 지급하는 월세는 입주대상자가 직접 임대인에게 지급하여야 하며  1년치 월세에 하는 금액을 계약시 기본보증금 외에 추가부담 전세계약 만료시 반환함 하여야함  단  수도권 60만원   광역시 45만원   기타지역 40만원  한도의 보증부월세는 입주대상자가 원할  3개월치 월세에 하는 금액만 입주자가 부담하고 9개월치 월세는 임차료 지급보증으로 대체가능    임대조건   임대보증금   100만원   월임대료     22세 이하 무이자    전세임대주택 거주 5년 이내 50%감면  단  다른 우대금리와 중복적용 불가     전세임대주택 거주 5년 이후 보증금 지원 규모별 연 1.0~2.0%   우대금리 적용     청년 1순위   0.5%p  단  다른 우대금리와 중복적용 불가      1자녀 0.2%P  2자녀 0.3%P  3자녀이상 0.5%P  단  최저금리는 1.0%      생계   의료급여 수급자 0.2%P  단  최저금리는 1.0%      월 임대료  우대금리 은 주택도시기금 운용계획 융자조건에  변경 가능    주거급여 수급세대의  지자체에서 신청자 계좌로 지급되던 주거급여액이 LH 계좌로 지급되며 금액은 월 임대료로 자동 수납처리됨    주거급여법 제7조제4항에 의거 공사가 직접 수납하며 보증부월세 계약은 제외    임대기간  2년    최초 임대기간 경과 후 2년 단위로 최대 14회 재계약 가능하나  4회를 초과하여 재계약을 체결할 때에는 무주택세대구성원으로서 아래 재계약 기준을 충족하여야 함   재계약기준     4회를 초과하여 재계약 체결 시  무주택세대구성원으로서 소득기준  자산기준 전년도 도시근로자 가구원수별 가구당 월평균소득의 105% 이하  영구임대주택 자산기준  을  충족하여야 하며  미 충족 시 1회에 한해 재계약 체결 가능하나 임대보증금  임대료가 80% 할증 사업 신청 기간:상시 비고:모집시기에  정시  수시합격자  재학생  모집대상이 달라질 수 있으므로 사전 문의 필요 연령:만 19세 ~ 39세 거주지 및 소득:신청일 현재 무주택자 특화 분야:자립준비청년 추가 단서 사항:  지원대상   신청일 현재 본인이 무주택자이면서  아동복지법  제16조  제16조의3에  가정위탁 보호조치가 종료되거나 아동복지시설에서 퇴소한지 5년 이내인 사람   보호조치를 연장한 자  보호조치 종료 예정자  시설 퇴소예정자 포함  혼인 자는 제외   지원불가주택   입주대상자  배우자의 직계 존 비속 소유의 주택  법인 소유의 공공임대주택   기부본상 압류 가압류 가기 신탁기 임차권기  소유권행사에 제한이 되는 가처분  예고기 이 있는  권리관계 말소 후 신청 가능    토지 소유자와 건물 소유자가 다른 주택 단  각각의 소유자 모두와 전세계약 체결하는   토지지분 일부를 소유하고 있는 건물 소유주와 전세계약 체결하는 는 가능    서울보증보험 주 의 전세임대주택신용보험  전세금보장신용보험의 보험사고자로서 서울보증보험 주 에  동 보험사고  채무를 완제하지 아니한 임대인 소유의 주택   서울보증보험 주 의 전세임대주택신용보험 가입 불가한 주택   기타 우리 공사가 재난 재해 의 우려로 방침으로 정하여 공급을 제한하는 주택 소급적용 가능  신청 절차:  신청방법  청년 전세임대 청약은 인터넷으로만 신청 가능   LH청약플러스   임대주택 청약신청    신청절차  입주신청 LH청약센터   대상자발표 예비자포함    전세주택 물색 입주대상자    전세주택 물색 입주대상자   입주 심사 및 발표:입주대상자 선정안내   신청일로부터 최소 4주 소요 제출 서류:주민록표본  가족관계증명서  개인정보    제3자  동의서  자립준비청년 증명서   모든 발급서류는 신청일 기준 2주일 이내 발급분에 한함 기타 유익 정보:전세임대 통합콜센터  1670 0002 주관 기관:한국토지주택공사 LH  운영 기관:한국토지주택공사 LH '), Document(metadata={'name': ' 제주특별자치도 2024년 일하는 청년 보금자리 지원사업  기업 지원 사업 ', 'source': '..\\\\data\\\\policy_result.json'}, page_content='기관:제주 정책 분야:주거분야 지원 내용:  지원받을 수 있는 사항   숙소 임차료의 60% 주택보조금의 80%   1년간 월 최대 30만원 지원 기업지원   생애2회    무주택 청년 근로자에게 숙소  주택보조금을 지원하고 있는 상시근로자 1인 이상 도내 중소기업에게 숙소 임차료 지원 사업 신청 기간:2024년 01월01일 ~ 2024년 12월31일 비고:사업기간2024 01 01 ~ 2024 12 31 운영기간2024 01 01 ~ 2024 12 31예산소진시까지 신청기간2024 01 01 ~ 2024 12 31분기별 1 4 7 10월  1일부터 10일까지 연령:만 19세 ~ 39세 추가 단서 사항:지역기준  제주도  제주시  서귀포시 참여 제한 대상:  아래의 만  가능   상시근로자 1인 이상 도내 중소기업   소득이 월 급여 358만원 미만 근로자에게 숙소 지원 시 신청 절차:온라인 신청접수 도청   도청 문의 방문  주관 기관:제주특별자치도   경제일자리과 운영 기관:제주특별자치도   경제일자리과'), Document(metadata={'name': '청년 월세지원사업', 'source': '..\\\\data\\\\policy_result.json'}, page_content='기관:충남 아산시 정책 분야:주거분야 지원 내용:  월 최대 20만원 임차료 지원  최대12개월 사업 운영 기간:  2024. 3.~2024. 12 사업 신청 기간:2024년 03월01일 ~ 2024년 12월31일 비고:  연중 연령:만 19세 ~ 34세 거주지 및 소득:  부모와 별도 거주하는 무주택 저소득 청년 주관 기관:  아산시 운영 기관:  아산시'), Document(metadata={'name': '신혼부부 주택전세자금 대출이자 지원', 'source': '..\\\\data\\\\policy_result.json'}, page_content='기관:충남 태안군 정책 분야:주거분야 지원 내용:  주택전세자금 대출이자 100만원 이내   3년간 지원 사업 운영 기간:  2024. 1.~ 12. 사업 신청 기간:매년 01월01일 ~ 12월31일 지원 규모(명):  15명 비고:  2024. 1.~ 12. 연령:만 18세 ~ 45세 거주지 및 소득:  부부합산 기준중위소득 180% 이하 무주택 가구 신청 절차:  주소지 읍면사무소   방문신청 심사 및 발표:  군 신속허가과 제출 서류: 본  혼인관계증명서  소득증빙자료  주관 기관:  태안군 산업건설국 신속허가과 운영 기관:  태안군청')], [{'url': 'https://grouphome.kr:44460/pages/page_153.php?sn=13226', 'content': 'Home>열린공지 자립준비청년을 위한 주택청약종합저축 납입금 지원사업 안내 □ 사업명 : 유스타트 주택청약저축 지원사업 □ 사업내용 :\\xa0대한적십자사와 LH-우리은행이 함께하는 자립준비청년의 주거안정 지원을 위한 주택청약종합저축 납입금 지원 □ 지원내용 : 주택청약종합저축 납입금 지원(2만원씩 24개월간) □ 신청방법 : 대한적십자사 홈페이지 /홈페이지 신청 불가시 이메일(program@redcross.or.kr) 신청 대한적십자사 홈페이지 안내 : www.redcross.or.kr - SOS지원신청 - 자립준비청년(주택청약저축)-신청하기 유스타트 주택청약종합저축 지원사업 홈페이지 안내문 파일 유스타트_주택청약종합저축 지원 안내문(시각장애인용 포함) 유스타트 주택청약종합저축 사업신청서 및 개인정보수집이용제공동의서 양식 자립준비청년을 위한 주택청약종합저축 납입금 지원사업 유스타트_주택청약종합저축_지원_안내문.hwp (132.5KB,167) 첨부- 유스타트 주택청약종합저축 사업신청서 및 개인정보수집이용제공동의서 양식.hwp (78.5KB,129) 945 [한국아동복지협회] 드림텍-유니퀘스트 그룹 이공계열 인재 지원사업 4기 모집 안내\\xa0  한국아동복지협회    2024-12-26  49 936 [지파운데이션] 사회복지시설 공기청정기 물품 지원사업 신청 안내 (~11/28)    지파운데이션  2024-11-27  420 935 [초록우산] 스케쳐스코리아 따뜻한 겨울나기 지원사업 신청 안내  초록우산    2024-11-26  870 제목+내용'}, {'url': 'https://m.blog.naver.com/knredcross/223146354099', 'content': '오는 7월 14일까지 진행되는 유스타트 주택청약종합저축 지원사업을 알고 계시나요? 한국토지주택공사(LH)가 우리은행, 대한적십자사와 자립준비청년을 위해 주택청약종합저축액 납입을 지원하는 ‘유스타트(Youth+Start) 주택청약저축 프로그램은 주거공간을 직접 제공하는 것뿐만 아니라 주택청약종합저축 가입·저축액 납입을 지원해 자립준비청년들이 자립할 수 있는 기반을 마련하는 프로그램입니다. 1인당 월 2만 원씩 24개월 지원!! 지원 예산: 1인당 월 2만 원씩 24개월 지원 또한 대한적십자사는 대상자 모집 및 선정, 주택청약종합저축 통장 관리를 담당하는 형식으로 진행되는데요. 대한적십자사 유스타트 주택청약종합저축 바로 가기 서류 발급 시 유의사항은 자격 및 기타 증빙은 최근 3개월 이내 발급된 서류만 인정되니 최신 서류\\u200b를 준비해 주세요! ※ 자격 및 기타 증빙은 최근 3개월 이내 발급된 서류만 인정(보호종료아동확인서 제외) 오늘 알려드린 신청방법 및 지원 요건을 자세히 확인해 보시고 해당되시는 분들은 7/14일 전까지 대한적십자사 홈페이지를 통해 신청해 주시기 바랍니다. 주거비지원 #청년지원정책 #주택청약종합저축 #유스타트주택청약종합저축지원 청년정책 #지원정책 #주거비지원정책 #청년주거비지원 #주택청약'}]""]","유스타트 주택청약 종합저축 지원사업은 자립준비청년을 위한 프로그램으로, 지원 금액은 1인당 매월 2만원씩 24개월 동안 지원됩니다. 따라서, 총 지원 금액은 48만원입니다. 이 사업은 대한적십자사와 LH-우리은행이 협력하여 진행하며, 신청은 대한적십자사 홈페이지를 통해 가능합니다."
해외취업아카데미 정책을 주관하는 기관은 어디인가요?,"['정책 이름: 해외취업아카데미', '기관:고용노동부', '주관 기관:고용노동부']",고용노동부,"[""[Document(metadata={'name': '해외취업지원', 'source': '..\\\\data\\\\policy_result.json'}, page_content='기관:대전 정책 분야:일자리분야 지원 내용:해외취업 역량 강화  취업 알선  운영   해외 전문인재 양성   해외 취업을 위한 어학교육  이력서  면접 교육  취업알선  지원    찾아가는 해외취업 설명회   각 대학교  방문하여 해외취업 정책  주요국가 취업정보  정보  6회  회당 40명 내외  사업 신청 기간:상시 연령:만 19세 ~ 39세 거주지 및 소득:대전 거주  해외취업 희망 구직자 18세 이상 39세 이하 청년  300명 내외 신청 절차:대전비즈  www.djbea.or.kr biz 을  신청 주관 기관:대전일자리지원센터 운영 기관:대전일자리경제진흥원 일자리지원센터 042 719 8324 '), Document(metadata={'name': '천안시 일자리종합지원센터 운영', 'source': '..\\\\data\\\\policy_result.json'}, page_content='기관:충남 천안시 정책 분야:교육분야 지원 내용:  구인구직을 위한 취업지원    취업상담  알선   취업교육 운영   구인기업 발굴   찾아가는 일자리 상담소 운영    구인구직 만남의 날 운영  사업 운영 기간:  연중 사업 신청 기간:상시 비고:  연중 거주지 및 소득:  천안시민 제출 서류:  신분증   구인구직신청서   사업자록증사본   구인기업인    홈페이지 참조 기타 유익 정보:  천안시일자리종합지원센터 문의 주관 기관:  일자리경제과 운영 기관:  천안시일자리종합지원센터'), Document(metadata={'name': '해외취업알선', 'source': '..\\\\data\\\\policy_result.json'}, page_content='기관:고용노동부 정책 분야:일자리분야 지원 내용:  구직자 지원내용   해외 일자리 정보    필요 시 상담 홈페이지 해외취업상담에서 별도 신청     구인기업 지원내용   구인조건에 적합한 구직자 모집  알선     요청 시 면접 지원  면접장소  사업 운영 기간:2024.1.1.~12.31. 사업 신청 기간:상시 비고:상시 거주지 및 소득:  구직자 자격   월드잡 개인회원 가입 후 이력서  자기소개서를 작성한 사람 구직자 누구나    구인기업 자격   다국적기업  현지로컬기업  국내기업 현지법인  한상기업  민국 인력채용을 희망하는 기업으로 근무지가 해외인 기업   월드잡 기업 인증 시 현지의 사업자록증에 하는 서류  현지 실존 여부 증빙서류를 제출하여야 하며  공단은 기업체 사실유무 확인을 위해 현지 재외공관 에 사실 확인을 요청할 수 있음.   월드잡에 재한 모집공고의 근로조건은 추후 채용예정자와 근로계약 체결 시 반드시 이행해야 함. 신청 절차:  구직자   개인회원 기업  구직회원 록   구인공고 지원   서류심사  면접  채용전형 진행   결과 통보  출국수속 진행   근무시작   구인기업   기업회원 록   구인공고작성   구직자 모집  지원자 이력서 전달   서류심사  면접 채용전형 진행   결과 통보  출국수속 진행   근무시작 제출 서류:  구직자   월드잡플러스 이력서 록  공개로 설정   구인기업   월드잡플러스 구인공고 록 주관 기관:고용노동부 운영 기관:한국산업인력공단'), Document(metadata={'name': '청년테마별 취업지원', 'source': '..\\\\data\\\\policy_result.json'}, page_content='기관:대구 정책 분야:교육분야 지원 내용:  내용  청년 니즈에 맞는 취업캠프 운영   청년구직자를 대상으로 취업컨설팅  자기소개서 작성법  취업에 필요한 정보를 하고 1박 2일 캠프 으로 진행하여 집중력 있는 취업지원    지역기업 바로알기 인사담당자 토크콘서트   지역청년이 지역 우수기업에 직접 방문하여 기업과 산업의 이해도를 제고하고 현장에서 인사담당자가 직접 전하는 기업의 인재상  채용정보 을 토크콘서트를  상호 소통의 장 마련   취업역량개발을 위한 진로컨설팅  구직 청년들에게 필요한 자기분석  직무조사  역량분석  전략수립  모의면접  취업전문 컨설턴트와 1 1 단계별 맞춤형 컨설팅을  취업역량강화 사업 신청 기간:미정 비고:기간   2024. 3월 ~ 12월 신청 절차:신청    홈페이지 신청 주관 기관:대구광역시 고용노동정책과 운영 기관:대구상공회의소'), Document(metadata={'name': '청년성장프로젝트 경산시 ', 'source': '..\\\\data\\\\policy_result.json'}, page_content='기관:경북 경산시 정책 분야:교육분야 지원 내용:  청년카페  미취업 청년 의 구직 의욕 고취를 위한 맞춤형   심리상담  인프라를 하며 기존의 청년고용정책과 연계   직장적응  신입직원 직장적응  지원  CEO  중간관리자 대상 청년친화 조직문화 교육  사업 운영 기간:2024 04 01~2024 12 31 사업 신청 기간:미정 비고:미정 주관 기관:경상북도 운영 기관:경산')], [{'url': 'https://www.moel.go.kr/news/enews/report/enewsView.do?news_seq=14714', 'content': '공식 누리집 주소 확인하기go.kr 주소를 사용하는 누리집은 대한민국 정부기관이 관리하는 누리집입니다. 자동완성 닫기 통합검색 닫기 누리집 배너 모음 누리집 이용안내 누리집 이용안내 누리집 배너 모음 누리집 이용안내 한국산업인력공단, 해외취업연수과정 선정 및 연수생 모집 시작 해외취업연수사업은 어학과 직무교육, 취업상담 및 알선과 현지 정착을 위한 생활 정보 등을 제공하는 해외기업 수요 맞춤형 인재 양성 프로그램(K-Move 스쿨)이다. 호텔관광학과를 다니며 해외취업의 꿈을 갖게 된 연수생 ㄴ씨도 학교에서 운영하는 K-무브 스쿨 싱가포르 연수 과정을 통해 현지 호텔에 취업했다. 공단은 국가.직종별 취업 인정 연봉 기준을 상향하고, 연수 종료 후 1년 6개월까지 연수생의 애로사항 확인 및 조치, 장기비자 발급 정보 공유 등 사후관리 모니터링을 통해 연수생이 더 나은 현지 생활을 할 수 있도록 개선.운영하고 있다. 2.28 2023 해외취업연수과정 선정 및 모집시작(한국산업인력공단).hwpx 다운로드 바로보기 2.28 2023 해외취업연수과정 선정 및 모집시작(한국산업인력공단).pdf 다운로드 바로보기'}, {'url': 'https://korea.kr/briefing/pressReleaseView.do?newsId=156585884', 'content': '- 2023년 2차 해외취업연수 26개 과정 선정, 9월1일부터 연수생 413명 모집 한국산업인력공단(이사장 직무대행 김영중, 이하 공단)은 2023년도 하반기(정기2차) 해외취업연수사업(K-Move스쿨) 운영기관 24개(26개 과정)를 선정하고, 9월 1일부터 순차적으로 413명의 연수생을 모집한다. [참고] 해외취업연수사업'}]""]","해외취업아카데미 정책을 주관하는 기관은 한국산업인력공단입니다. 이 기관은 해외취업 연수 과정을 운영하여 어학, 직무 교육, 취업 상담 및 알선, 그리고 현지 정착을 위한 생활 정보를 제공하는 프로그램인 K-Move 스쿨을 통해 해외 전문 인재를 양성하고 있습니다."
해외취업아카데미의 지원 내용은 무엇인가요?,"['정책 이름: 해외취업아카데미', '지원 내용:  해외 취업에 필요한 역량 교육 무료 지원   진로계획 립   이력서 작성법   영문 인터뷰  모의면접 도움   비즈니스 영어  독일어  일본어 교육']","해외 취업에 필요한 역량 교육 무료 지원, 진로계획 립, 이력서 작성법, 영문 인터뷰 모의면접 도움, 비즈니스 영어, 독일어, 일본어 교육","[""[Document(metadata={'name': '해외취업아카데미', 'source': '..\\\\data\\\\policy_result.json'}, page_content='기관:고용노동부 정책 분야:일자리분야 지원 내용:  해외 취업에 필요한 역량 교육 무료 지원   진로계획 수립   이력서 작성법   영문 인터뷰  모의면접 도움   비즈니스 영어  독일어  일본어 교육 사업 운영 기간:2024.01.01.~12.31. 사업 신청 기간:상시 거주지 및 소득: 를 희망하는 구직자 누구나 신청 절차:  월드잡플러스 신청페이지 링크 에서 해외취업 아카데미  확인   희망  선택 후 신청  로그인  이력서 작성 필요  주관 기관:고용노동부 운영 기관:한국산업인력공단'), Document(metadata={'name': '취업희망', 'source': '..\\\\data\\\\policy_result.json'}, page_content='기관:고용노동부 정책 분야:교육분야 지원 내용:  지원금.보조금   국민취업지원제도  유형 자 중 청년층이 3일 이상 운영하는 집단상담을 수료하는  10만원의 취업활동비용 취업활동계획 수립 수당 을 추가 지급   운영방법   12명 내외의 소그룹을 구성하여 4일 총 24시간  간  운영 사업 운영 기간:2024.1.1.~12.31. 사업 신청 기간:상시 지원 규모(명):각 집단별 8~12명 소그룹  4일 24시간 비고:상시 거주지 및 소득:취업에 도움이 필요하신 구직자 접수상담 후 참가가능  취업 상태:미취업자 추가 단서 사항:  이런 분들이 하시면 좋습니다.   자신감을 증진하고 싶은 분   회사 취업 후 인간관계 적응을 더 잘 하고 싶은 분   취업에 대해 도움이 필요하신 분   다른 사람들과 의사소통  취업과 회사생활을 즐겁게 하고 싶은 분   나에 대해 알아보고 취업 희망을 하고 싶은 분   대인관계를 더 좋게 하고 싶은 분 신청 절차:   온라인  고용24 누리집에 로그인 후   취업지원   취업역량강화  메뉴로 이동하여 집단상담 하단에 있는  취업희망  클릭하여  희망 고용센터  과정 선택하여 신청    오프라인  가까운 고용센터를 방문하여 담당자 상담을  참가 신청 주관 기관:고용노동부 운영 기관:전국 고용센터'), Document(metadata={'name': '해외일경험 지원사업 WELL ', 'source': '..\\\\data\\\\policy_result.json'}, page_content='기관:고용노동부 정책 분야:일자리분야 지원 내용:   청년  국가별 지원금  월 체재비 지원   국가별 지원금 준비금    국가별 지원금의 70%  현지 일경험 개시    국가별 지원금 수료금    국가별지원금의 30%  현지 일경험 수료    체재비   월 150만원 28일 미만시 일할 계산  1일단 53 570원     국가별지원금   미국 300   캐나다 호주 뉴질랜드 200   독일 150   말레이시아 100   일본 베트남 필리핀 50  사업 운영 기간:2024.11.30.까지 사업 신청 기간:상시 지원 규모(명):500명 연령:만 15세 ~ 34세 거주지 및 소득:  만 34세 이하    군필자 의무복무기간에  최대 39세 이하 학력:  대학 전문대학 졸업예정자  졸업자로서 미취업자이거나 4년제 이상 대학의 1 2 이상 마친자 취업 상태:  미취업자 단  주 30시간 미만 일자리에 근무하는 자는 미취업으로 간주  추가 단서 사항:  운영형태   공모형 운영기관    공모를  선정된 운영기관이 해외기업을 발굴하고 기업과 협약을  국내 청년들에게 해외 일경험     프로젝트형 공단    공단이 직접  협업기관과 함께 해외기업을 발굴하고 기업과 협약을  국내 청년들에게 해외 일경험     프로젝트형 내 자체형 공단이 기업발굴   협업형 협업기관이 발굴  구성 참여 제한 대상:  정부재정지원 사업 중복 자 제외 신청 절차:  월드잡 플러스  채용 모집   해외일경험 WELL  클릭 후  관심공고 지원 심사 및 발표:  서류  면접을  선발  자세한 사항은 모집공고를  확인 기타 유익 정보:  문의처   한국산업인력공단 해외취업지원부   052 714 8492  8497  8690  8807  8843 주관 기관:고용노동부 운영 기관:한국산업인력공단'), Document(metadata={'name': '청년 일경험 기업탐방형  ', 'source': '..\\\\data\\\\policy_result.json'}, page_content='기관:제주 정책 분야:일자리분야 지원 내용:  지원내용   대표 내용   지원 대상자   직업 세계와 산업 현장에  체험 기회    도내 미취업청년 만15세 ~ 34세    고교생  1~2학년 3학년   대학생  재학생 졸업 예정자   청년 장병    취업준비생  졸업생  고교생 3학년  대학생 졸업 예정자  분류  지원받을 수 있는 사항    청년들에게 직업 세계와 산업 현장에  체험 기회를   지원상세   중소기업 청년직무체험  정책이란     청년들에게 다양한 직업 세계  산업 현장에  체험 기회를 하고    우수한 중소 강소 기업에  정보를 하는    내용    1유형  기업탐방  인사담당자 CEO 특강  직원과의 대화  취업전략 수립 으로 구성   1일 5시간 이상  5일 이내     2유형  직무역량 향상 초점 맞추어 직무이해  CEO전문가 특강    직무경험  프로젝트    역량강화  모의면접  멘토링   구성    1일 5시간 이상  8~10일 이내  더 자세한 내용 알아보기     index.do 사업 신청 기간:미정 비고:사업기간2024 01 01 ~ 2024 12 31 운영기간2024 01 01 ~ 2024 12 31   모집 시  신청기간2024 01 01 ~ 2024 12 31   모집 시  연령:만 19세 ~ 39세 취업 상태:근로기준   4대보험 직장인  불가  사업자 불가 추가 단서 사항:지역기준  제주도  제주시  서귀포시 주관 기관:고용센터 취업지원총괄팀  운영 기관:고용센터 취업지원총괄팀 '), Document(metadata={'name': '천안시 일자리종합지원센터 운영', 'source': '..\\\\data\\\\policy_result.json'}, page_content='기관:충남 천안시 정책 분야:교육분야 지원 내용:  구인구직을 위한 취업지원    취업상담  알선   취업교육 운영   구인기업 발굴   찾아가는 일자리 상담소 운영    구인구직 만남의 날 운영  사업 운영 기간:  연중 사업 신청 기간:상시 비고:  연중 거주지 및 소득:  천안시민 제출 서류:  신분증   구인구직신청서   사업자록증사본   구인기업인    홈페이지 참조 기타 유익 정보:  천안시일자리종합지원센터 문의 주관 기관:  일자리경제과 운영 기관:  천안시일자리종합지원센터')], [{'url': 'https://mansawin.com/entry/해외취업지원-알아보기-신청하기', 'content': '관리 K-Move스쿨 : 구인기업이 요구하는 어학 및 직무능력, 생활문화 등에 대한 맞춤형 \\xa0교육(연수) 과정 제공 - 지원대상 : 만 15세 ~ 34세 이하 / 취업일 기준 본인, 부모 및 배우자, 자녀의 합산 소득의 6분위 소득 이하 가구원, 월드잡플러스 내 사전 구직등록자, 취업비자, 연봉 1,700만원 이상으로 근로계약서를 작성한 자(단순 노무직종 제외) (해외통합정보망) 해외취업 : 인턴, 봉사, 창업 등 해외 진출 관련 정보 통합 제공 플랫폼 운영 (국내해외취업센터) 해외취업 희망 청년 등을 대상으로 상담 및 컨설팅, 역량강화를 위한 서비스(아카데미), 정보 등 제공(서울, 부산) (해외취업촉진인프라지원) 국내, 외 네트워크를 활용하여 해외 일자리\\xa0 발굴 및 취업지원(K-Move 센터운영, Global Talent Fair(글로벌일자리대전 개최) 등) - 자세한 선정기준은 월드잡플러스 사이트 (www.worldjob.or.kr) 참고 - 월드잡플러스 홈페이지 (www.worldjob.or.kr)를 통해 신청 - 사업별로 상이하므로 자세한 내용은 월드잡플러스 사이트 (www.worldjob.or.kr) 공지사항 참고'}, {'url': 'https://lifeupstory.com/해외취업지원-완벽가이드/', 'content': '해외취업 초보용 가이드 완벽 정리(feat.단계별 필수 해외취업 지원 프로그램) - Life Up Story 해외취업 초보용 가이드 완벽 정리(feat.단계별 필수 해외취업 지원 프로그램) 취업 성공 후 추가 지원 받기 (feat.해외취업 정착지원금) 어떤 직업으로 해외취업을 도전할지 정했다면 이제 해외취업에 대한 다양한 정보를 수집할 차례입니다. <해외취업 완전정복 가이드북 바로 가기> 월드잡플러스에선 해외취업 구직자를 대상으로 입문/심화로 나눠 다양한 온오프라인 무료 교육 프로그램을 진행하고 있습니다. <월드잡플러스 무료 해외취업아카데미 바로 가기> <해외취업 연수 프로그램 신청 바로 가기> <해외 일경험 신청 바로 가기> <무료 이력서(영문,일문) 컨설팅 바로 가기> 월드잡플러스를 비롯해 잡코리아와 같은 일반 채용 사이트에서도 다양한 해외취업 구인 정보를 얻을 수 있습니다. 해외채용 공고 바로 가기 월드잡플러스 해외채용 공고 바로 가기 취업 성공 후 추가 지원 받기 (feat.해외취업 정착지원금) <출국 전 오리엔테이션 프로그램 신청 바로 가기>'}]""]","해외취업아카데미는 고용노동부의 지원 프로그램으로, 해외 취업에 필요한 다양한 역량을 교육하는 무료 프로그램입니다. 이 아카데미에서는 다음과 같은 지원 내용이 제공됩니다:

1. **역량 교육**: 해외 취업에 필요한 다양한 교육을 무료로 제공합니다. 여기에는 진로 계획 수립, 이력서 작성법, 영문 인터뷰 및 모의 면접 등이 포함됩니다.
   
2. **언어 교육**: 비즈니스 영어뿐만 아니라 독일어, 일본어 교육도 진행됩니다.

3. **신청 절차**: 구직자는 월드잡플러스의 신청 페이지에서 '해외취업 아카데미'를 선택하고 신청할 수 있습니다. 이력서 작성을 위해 로그인이 필요합니다.

4. **사업 운영 기간**: 2024년 1월 1일부터 12월 31일까지 운영됩니다.

5. **신청 자격**: 거주지 및 소득에 제한 없이 해외 취업을 희망하는 구직자 누구나 신청 가능합니다.

이 프로그램은 해외 취업을 희망하는 청년들에게 실질적인 지원을 제공하여, 그들의 취업 경쟁력을 높이는 데 기여하고자 합니다."
해외취업아카데미의 사업 운영 기간은 언제인가요?,"['정책 이름: 해외취업아카데미', '사업 운영 기간:2024.01.01. 12.31.']",2024.01.01. 12.31.,"['[Document(metadata={\'name\': \'해외 K Move 센터 운영\', \'source\': \'..\\\\data\\\\policy_result.json\'}, page_content=\'기관:고용노동부 정책 분야:일자리분야 사업 운영 기간:2024.1.1.~12.31. 사업 신청 기간:2024년 01월01일 ~ 2024년 12월31일 비고:상시 연령:만 15세 ~ 34세 취업 상태:미취업자 신청 절차:월드잡플러스를  해외 K Move 센터 정보 확인 주관 기관:고용노동부 운영 기관:무역투자진흥공사 KOTRA \'), Document(metadata={\'name\': \'해외취업지원\', \'source\': \'..\\\\data\\\\policy_result.json\'}, page_content=\'기관:대전 정책 분야:일자리분야 지원 내용:해외취업 역량 강화  취업 알선  운영   해외 전문인재 양성   해외 취업을 위한 어학교육  이력서  면접 교육  취업알선  지원    찾아가는 해외취업 설명회   각 대학교  방문하여 해외취업 정책  주요국가 취업정보  정보  6회  회당 40명 내외  사업 신청 기간:상시 연령:만 19세 ~ 39세 거주지 및 소득:대전 거주  해외취업 희망 구직자 18세 이상 39세 이하 청년  300명 내외 신청 절차:대전비즈  www.djbea.or.kr biz 을  신청 주관 기관:대전일자리지원센터 운영 기관:대전일자리경제진흥원 일자리지원센터 042 719 8324 \'), Document(metadata={\'name\': \'충남 지역혁신형 창업가 성장지원\', \'source\': \'..\\\\data\\\\policy_result.json\'}, page_content=\'기관:충남 정책 분야:일자리분야 지원 내용:  약2억원   변동 가능 사업 운영 기간:  2023.1.1.~2025.12.31. 사업 신청 기간:2023년 01월01일 ~ 2025년 12월31일 비고:  신규모집 종료  대체모집 수시운영 연령:만 19세 ~ 39세 거주지 및 소득: 도내 주소를 가진 창업한 지 7년 이전 청년창업자 취업 상태:  초기창업청년 추가 단서 사항: 대체모집 여부 문의    충남창조경제혁신센터 주관 기관:  충남 운영 기관:  충남창조경제혁신센터\'), Document(metadata={\'name\': \'국내해외취업센터 운영\', \'source\': \'..\\\\data\\\\policy_result.json\'}, page_content=\'기관:고용노동부 정책 분야:일자리분야 지원 내용:  구직자 지원내용   해외 일자리 정보    필요 시 상담 홈페이지 해외취업상담에서 별도 신청     구인기업 지원내용   구인조건에 적합한 구직자 모집  알선     요청 시 면접 지원  면접장소  사업 운영 기간:2024.1.1.~12.31. 사업 신청 기간:상시 비고:상시 연령:만 15세 ~ 34세 거주지 및 소득:  구직자 자격   월드잡 개인회원 가입 후 이력서  자기소개서를 작성한 사람 구직자 누구나    구인기업 자격   다국적기업  현지로컬기업  국내기업 현지법인  한상기업  민국 인력채용을 희망하는 기업으로 근무지가 해외인 기업   월드잡 기업 인증 시 현지의 사업자록증에 하는 서류  현지 실존 여부 증빙서류를 제출하여야 하며  공단은 기업체 사실유무 확인을 위해 현지 재외공관 에 사실 확인을 요청할 수 있음. 월드잡에 재한 모집공고의 근로조건은 추후 채용예정자와 근로계약 체결 시 반드시 이행해야 함. 취업 상태:미취업자 신청 절차:직접 방문  월드잡플러스를  예약 가능 주관 기관:고용노동부 운영 기관:한국산업인력공단\'), Document(metadata={\'name\': \'면접사진 촬영 고양시 \', \'source\': \'..\\\\data\\\\policy_result.json\'}, page_content=\'기관:경기 고양시 정책 분야:일자리분야 지원 내용:  내용   취업 준비에 필요한 이력서 면접용 증명사진 촬영 지원   촬영   더본스튜디오  주엽역 8번 출구    일정   2024년 3월 ~ 예산소진시 마감 매주 금요일   시간   일자별 신청 순서대로 임의 배치 금 10 00~19 00  사업 신청 기간:상시 비고:선착순 상시 접수 연령:만 18세 ~ 39세 거주지 및 소득:  고양시 거주 재학 재직 청년 주관 기관:고양시 청취다방 031 8075 2870 \')], [{\'url\': \'https://www.syu.ac.kr/blog/k-move/\', \'content\': \'1.사업개요 사 업 명 : 2024년도 해외취업연수사업 (K-Move스쿨) 사업목표: 해외진출을 목표로 하는 학생(2024. 08/2025. 02 졸업예정자)에게 해외 산업현장에서 요구하는 교육과정을 개설하여 국내에서 연수교육을 실시하고 글로벌 인재 양성을 통한 해외 기업에서의 인턴십 기회 제공\'}, {\'url\': \'https://www.moel.go.kr/news/enews/report/enewsView.do?news_seq=15404\', \'content\': ""- 2023년 2차 해외취업연수 26개 과정 선정, 9월1일부터 연수생 413명 모집 한국산업인력공단(이사장 직무대행 김영중, 이하 \'공단\')은 2023년도 하반기(정기2차) 해외취업연수사업(K-Move스쿨) 운영기관 24개(26개 과정)를 선정하고, 9월 1일부터 순차적으로 413명의 연수생을 모집한다.""}]']",해외취업아카데미의 사업 운영 기간은 2024년 8월부터 2025년 2월까지입니다. 이 프로그램은 해외 진출을 목표로 하는 학생들에게 해외 산업현장에서 요구하는 교육과정을 제공하여 글로벌 인재 양성을 목표로 하고 있습니다.
청년 커리어 고민 솔루션 ALL Question 안양 정책의 지원 내용은 무엇인가요?,"['청년 커리어 고민 솔루션 ALL Question 안양', '경기 안양', '일리분야', '청년의 고민을 현직가 답해주는 온라인 멘토링', '진로 대학 취업 이직 온라인 상담', '실무 취업고민 상담사례 열람', 'AI 기소개서 튜토리얼 분석', '기타 세한 세부 내용은 참고 사이트를 해주세요.']","청년의 고민을 현직가 답해주는 온라인 멘토링, 진로 대학 취업 이직 온라인 상담, 실무 취업고민 상담사례 열람, AI 기소개서 튜토리얼 분석을 지원합니다.","['[Document(metadata={\'name\': \'서울청년센터 양천\', \'source\': \'..\\\\data\\\\policy_result.json\'}, page_content=\'기관:서울 양천구 정책 분야:복지.문화분야 지원 내용:청년종합상담  자원연계  지역청년간소통  문화생활 지원  지역밀착형 청년공간  청년 맞춤형  운영 사업 운영 기간:2024.1~2024.12 사업 신청 기간:상시 비고:각 마다 운영기간 상이함 연령:만 19세 ~ 39세 거주지 및 소득:만19세 이상 39세 이하 청년 주관 기관:양천구청 기획재정국 일자리경제과 운영 기관:양천구\'), Document(metadata={\'name\': \'울산 청년정책 제안 경연대회\', \'source\': \'..\\\\data\\\\policy_result.json\'}, page_content=\'기관:울산 정책 분야:.권리분야 지원 내용:  주요내용   정책 컨설팅을 통한 내실 있는 청년제안 발굴  분과별 토론  정책의제 도출  구체화  집중 멘토링   컨설팅을 통한 분과별 정책제안서 검토 작성    추진방법   제안서 접수   1차 심사   전문가 컨설팅   최종 심사    팀구성   10개팀 30명 정도 팀당 3명 정도  사업 운영 기간:  시 기   2024. 7. ~ 11. 사업 신청 기간:미정 연령:만 19세 ~ 39세 거주지 및 소득:  대상   울산에 거주하거나 활동하는 19세 ~ 39세 청년 주관 기관:울산광역시 대학청년지원단 청년정책팀 052 229 7982  운영 기관:주관기관과 동일\'), Document(metadata={\'name\': \'학생 친화형 24시간 고민상담 채널  라임 \', \'source\': \'..\\\\data\\\\policy_result.json\'}, page_content=\'기관:교육부 정책 분야:.권리분야 지원 내용:  실시간 채팅 전화 화상 대면  단계별 상담   전문적 심리검사 코칭기법 적용한 기분관리 콘텐츠    일상 속에서 가벼운 고민이 있는 학생부터 심리 정서적으로 불안 정도가 높은 학생까지 모든 학생의 마음건강 지원 사업 신청 기간:상시 비고:연중 상시 주관 기관:교육부 학생건강정책관 사회정서성장지원과 운영 기관:주관기관 동일\'), Document(metadata={\'name\': \'서울 청년포털 청년 몽땅 정보통  운영\', \'source\': \'..\\\\data\\\\policy_result.json\'}, page_content=\'기관:서울 정책 분야:.권리분야 지원 내용:  중앙정부와 지자체별 칸막이로 관리되는 청년정책 정보 통합 추진   중앙정부  서울시  모든 청년정책 연계  통합검색 기반 구축    개인별 맞춤정보 검색  적기에 선제적 을  청년 확대 사업 신청 기간:상시 비고:상시  거주지 및 소득:제한 없음 주관 기관:서울시청 미래청년기획단 운영 기관:주관기관과 동일\'), Document(metadata={\'name\': \'청년층직업지도 CAP  \', \'source\': \'..\\\\data\\\\policy_result.json\'}, page_content=\'기관:고용노동부 정책 분야:교육분야 지원 내용:청년 취업준비생의 직업진로 선택을 지원하고  취업서류 작성  면접기술 강화  구직기술 강화 지원 사업 운영 기간:연중 사업 신청 기간:상시 지원 규모(명):각 집단별 15~18명 내외 비고:상시  단  과정별 상이  연령:만 15세 ~ 34세 거주지 및 소득:  만 15세 ~ 만 34세 이하 청년   청년구직자  대학생  청년은 누구나  가능 취업 상태:미취업자 신청 절차:   온라인  워크넷 WORK.GO.KR    고용복지정책   구직자취업역량 강화    선택 신청    오프라인  지역 고용센터를 방문   CAP  참가신청 접수   담당자와 협의     심사 및 발표:신청   대상자 선정    운영 제출 서류:별도 제출 서류 없음 기타 유익 정보:소요 기간   15~18명의 소그룹  1회 4일간 하루 6시간씩 진행 총 24시간  주관 기관:고용노동부 운영 기관:전국 고용센터 취업지원과 \')], [{\'url\': \'https://www.welfarehello.com/community/hometownNews/4ab68c85-b6fc-4fed-b572-1f70386e5aab\', \'content\': \'무엇이든 물어보살, 청년 커리어 고민 솔루션 「ALL Question」 | 경기도 안양시 | 웰로 무엇이든 물어보살, 청년 커리어 고민 솔루션 「ALL Question」 청년 커리어 고민 솔루션 청년 커리어 고민 솔루션 「ALL Question」을 1. 진로, 대학, 취업, 이직 등 온라인 상담 3. AI 자기소개서 튜토리얼 및 분석을 해주는 서비스를 제공하고 있습니다. ALL Q를 이용할 수 있습니다. 원하는 내용을 확인할 수 있습니다. 자소서 튜토리얼, AI 자소서 분석기, 자소서 첨삭, 면접 스터디 등 최대 3~5명의 현직자에게 다양한 답변을 받을 수 있습니다. 현직자에게 자소서 첨삭을 받을 수 있습니다. 예상 질문 및 가이드를 받을 수 있습니다. AI 자소서 분석기 페이지에서 작성된 자소서 내용을 복사, 붙여넣기 한 후에 자세한 결과를 확인할 수 있습니다. 청년 커리어 고민 솔루션 {""title"":""무엇이든 물어보살, 청년 커리어 고민 솔루션 「ALL Question」"",""source"":""https://blog.naver.com/tvanyanggokr/223376254453"",""blogName"":""안양시 공.."",""blogId"":""tvanyanggokr"",""domainIdOrBlogId"":""tvanyanggokr"",""logNo"":223376254453,""smartEditorVersion"":4,""lineDisplay"":true,""meDisplay"":true,""outsideDisplay"":true,""cafeDisplay"":true,""blogDisplay"":true}\'}, {\'url\': \'https://www.anyang.go.kr/youth/contents.do?key=4499\', \'content\': ""청년 커리어 고민 솔루션「ALL Question」운영 - 안양청년광장 주메뉴 토글 청년 ALL 지도 청년 자원봉사 프로그램 공모사업 청년 역량강화 프로그램 운영 안양1번가 청년공간 조성 청년 어학·자격시험 응시료 및 수강료 지원 청년 일자리박람회 개최 대학 일자리센터 운영 지원 청년 커리어 고민 솔루션「ALL Question」운영 청년 전·월세보증금 대출이자 지원사업 안양 청년 이사비 지원 사업 안양 청년 학자금대출 연체자 신용회복 지원사업 청년 정신건강 외래치료비 지원 찾아가는 정신건강상담실 \'청년 비상구\' 주메뉴 닫기 청년 커리어 고민 솔루션「ALL Question」운영 청년 어학·자격시험 응시료 및 수강료 지원 청년 일자리박람회 개최 대학 일자리센터 운영 지원 청년 커리어 고민 솔루션「ALL Question」운영 청년 커리어 고민 솔루션 「ALL Question」 운영 안양시 거주 또는 활동(직장 또는 학교 등) 하고 있는 청소년, 청년 매뉴얼 확인하기 ALL Q 바로가기 청년 CHATGPT 안양시 운영 안양시 운영 선택""}]']","안양시에서 운영하는 청년 커리어 고민 솔루션「ALL Question」의 지원 내용은 다음과 같습니다:

1. **온라인 상담 서비스**: 진로, 대학, 취업, 이직 등 다양한 주제에 대한 온라인 상담을 제공.
2. **AI 자기소개서 튜토리얼 및 분석**: AI를 활용한 자소서 튜토리얼과 분석 서비스 제공.
3. **현직자 멘토링**: 최대 3~5명의 현직자에게 자소서 첨삭, 예상 질문 및 면접 가이드를 받을 수 있는 기회 제공.
4. **면접 스터디**: 면접 준비를 위한 스터디 기회를 제공.

이러한 프로그램은 안양시에 거주하거나 활동하는 청소년 및 청년을 대상으로 하며, 이들 청년에 대한 다양한 커리어 지원을 목적으로 하고 있습니다."
청년 커리어 고민 솔루션 ALL Question 안양 정책의 신청 절차는 어떻게 되나요?,"['청년 커리어 고민 솔루션 ALL Question 안양', '경기 안양', '16세 18세 안양청년광장 회원가입 ALL Q', '19세 39세 안양청년광장 회원가입 인재록 완료 ALL Q']","16세부터 18세는 안양청년광장 회원가입 후 ALL Q를, 19세부터 39세는 안양청년광장 회원가입 및 인재록 완료 후 ALL Q를 통해 신청 가능합니다.","['[Document(metadata={\'name\': \'청년 커리어 고민 솔루션  ALL Question   안양시 \', \'source\': \'..\\\\data\\\\policy_result.json\'}, page_content=\'기관:경기 안양시 정책 분야:일자리분야 지원 내용:  청년의 고민을 현직자가 답해주는 온라인 멘토링    진로  대학  취업  이직  온라인 상담   실무 취업고민 상담사례 열람   AI 자기소개서 튜토리얼  분석    기타 자세한 세부 내용은 참고 사이트를 확인해주세요. 사업 신청 기간:상시 비고:운영시기   2024. 3. 4 ~ 계속 연령:만 16세 ~ 39세 거주지 및 소득:  안양시 거주  활동 직장  학교   하고 있는 청소년  청년   생년월일   2005. 3. 2. ~ 2008. 12. 31. 신청 절차:  16세~18세   안양청년광장 회원가입   ALL Q    19세~39세   안양청년광장 회원가입   인재록 완료   ALL Q  주관 기관:경기도 안양시\'), Document(metadata={\'name\': \'제9기 충북청년광장 구성 운영\', \'source\': \'..\\\\data\\\\policy_result.json\'}, page_content=\'기관:충북 정책 분야:.권리분야 지원 내용:  도정 청년정책제안 팀별 프로젝트 운영  청년정책 모니터링 활동  청년 중심 보장을 위한 간담회의  토론회  온라인 정책제안 추진 사업 운영 기간:2024. 1월 ~ 12월 사업 신청 기간:상시 비고:충북청년광장 회원모집 1월~2월    청년정책 제안 연중  연령:만 19세 ~ 39세 거주지 및 소득:도내 39세 이하 청년 신청 절차:충북청년희망센터 홈페이지 참고충북청년광장 회원모집 1월~2월  신청 심사 및 발표:충북청년희망센터 홈페이지 참고 제출 서류:충북청년희망센터 홈페이지 참고 주관 기관:충청북도 인구청년정책담당관 청년지원팀\'), Document(metadata={\'name\': \'서울 청년포털 청년 몽땅 정보통  운영\', \'source\': \'..\\\\data\\\\policy_result.json\'}, page_content=\'기관:서울 정책 분야:.권리분야 지원 내용:  중앙정부와 지자체별 칸막이로 관리되는 청년정책 정보 통합 추진   중앙정부  서울시  모든 청년정책 연계  통합검색 기반 구축    개인별 맞춤정보 검색  적기에 선제적 을  청년 확대 사업 신청 기간:상시 비고:상시  거주지 및 소득:제한 없음 주관 기관:서울시청 미래청년기획단 운영 기관:주관기관과 동일\'), Document(metadata={\'name\': \'청년마음 건강사업\', \'source\': \'..\\\\data\\\\policy_result.json\'}, page_content=\'기관:세종 정책 분야:복지.문화분야 지원 내용:  관내 청년을 대상으로 전문적인 심리상담   소득기준 없음     기간  3개월 재판정을  최대 1년까지 연장 가능  사업 신청 기간:2024년 01월01일 ~ 2024년 12월31일 비고: 24년 예산 소진시 까지 ~ 연령:만 19세 ~ 34세 거주지 및 소득:   대상  만19세~34세  1990.1.1.~2005.12.31.출생자  참여 제한 대상:  만19세~34세  1990.1.1.~2005.12.31.출생자  신청 절차: 신청방법  주민록상 읍 면 동 주민센터 방문    신청인  자 본인  친족  법정대리인 후견인    각 신분증 지참 제출 서류:  신분증  사회보장급여신청서  개인정보 동의서  붙임  주관 기관:세종시 운영 기관:세종시 지역사회 지원단\'), Document(metadata={\'name\': \'강북구 청년네트워크 운영\', \'source\': \'..\\\\data\\\\policy_result.json\'}, page_content=\'기관:서울 강북구 정책 분야:.권리분야 지원 내용:  청년 네트워크 멤버쉽 혜택   우수 표창장 수여  위촉장과 수료증  증서 발행  청년 성장 학교 우선     청년 취업 지원    이력서  자기소개서  모의면접  면접용 사진촬영    청년  정책 안내   청년  공모사업  청년  정책 안내    청년    워크숍  강북구 청년네트워크 회의 지원 사업 운영 기간:청년네트워크 4기  임기   2024. 7.~2025. 12  사업 신청 기간:미정 지원 규모(명):50명 비고:2024.07 연령:만 19세 ~ 39세 거주지 및 소득:강북구에 관심있거나 생활권을 둔 청년 만 19세~39세 미만  신청 절차:강북구 청년네트워크 신청 링크  온라인 신청 주관 기관:강북구청 일자리청년과 운영 기관:주관기관과 동일\')], [{\'url\': \'https://www.welfarehello.com/community/hometownNews/af81b9ce-e4dd-456c-848c-9dd836ce342d\', \'content\': \'청년 커리어 고민 솔루션 「ALL Question」 운영 | 경기도 안양시 | 웰로 청년 커리어 고민 솔루션 「ALL Question」 운영 청년 커리어 고민 솔루션 「ALL Question」 운영 청년 커리어 고민 솔루션 ✅ 운영기간 ✅ ✅ 운영대상 ✅ 안양시 거주 또는 활동(직장 또는 학교 등) 하고 있는 ✅ 운영내용 ✅ 청년의 고민을 현직자가 답해주는 온라인 멘토링 서비스 ✔ 진로, 대학, 취업, 이직 등 온라인 상담 ✔ AI 자기소개서 분석 ✅ 이용방법 ✅ 16세 ~ 18세「안양청년광장」 회원가입 → ALL Q 이용* 생년월일 : 2005. 3119세 ~ 39세「안양청년광장」 회원가입 → 인재등록 완료 → ALL Q 이용 🔽 안양청년광장 홈페이지 🔽 안양청년광장 www.anyang.go.kr 청년 커리어 고민 솔루션 「ALL Question」에 {""title"":""💛 청년 커리어 고민 솔루션 「ALL Question」 운영"",""source"":""https://blog.naver.com/tvanyanggokr/223366937280"",""blogName"":""안양시 공.."",""blogId"":""tvanyanggokr"",""domainIdOrBlogId"":""tvanyanggokr"",""logNo"":223366937280,""smartEditorVersion"":4,""blogDisplay"":true,""meDisplay"":true,""lineDisplay"":true,""outsideDisplay"":true,""cafeDisplay"":true} #### 안양시민이 선정한 <안양시 10대 뉴스> 24.12.26(목) 작성\'}, {\'url\': \'https://www.welfarehello.com/community/hometownNews/4ab68c85-b6fc-4fed-b572-1f70386e5aab\', \'content\': \'무엇이든 물어보살, 청년 커리어 고민 솔루션 「ALL Question」 | 경기도 안양시 | 웰로 무엇이든 물어보살, 청년 커리어 고민 솔루션 「ALL Question」 청년 커리어 고민 솔루션 청년 커리어 고민 솔루션 「ALL Question」을 1. 진로, 대학, 취업, 이직 등 온라인 상담 3. AI 자기소개서 튜토리얼 및 분석을 해주는 서비스를 제공하고 있습니다. ALL Q를 이용할 수 있습니다. 원하는 내용을 확인할 수 있습니다. 자소서 튜토리얼, AI 자소서 분석기, 자소서 첨삭, 면접 스터디 등 최대 3~5명의 현직자에게 다양한 답변을 받을 수 있습니다. 현직자에게 자소서 첨삭을 받을 수 있습니다. 예상 질문 및 가이드를 받을 수 있습니다. AI 자소서 분석기 페이지에서 작성된 자소서 내용을 복사, 붙여넣기 한 후에 자세한 결과를 확인할 수 있습니다. 청년 커리어 고민 솔루션 {""title"":""무엇이든 물어보살, 청년 커리어 고민 솔루션 「ALL Question」"",""source"":""https://blog.naver.com/tvanyanggokr/223376254453"",""blogName"":""안양시 공.."",""blogId"":""tvanyanggokr"",""domainIdOrBlogId"":""tvanyanggokr"",""logNo"":223376254453,""smartEditorVersion"":4,""lineDisplay"":true,""meDisplay"":true,""outsideDisplay"":true,""cafeDisplay"":true,""blogDisplay"":true}\'}]']","청년 커리어 고민 솔루션「ALL Question」의 신청 절차는 다음과 같습니다:

1. **16세~18세 청소년**:
   - **안양청년광장 회원가입** 후, **ALL Q** 서비스를 이용할 수 있습니다.
   - 생년월일 기준: 2005년 3월 2일 ~ 2008년 12월 31일 출생자.

2. **19세~39세 청년**:
   - **안양청년광장 회원가입** 후, **인재 등록**을 완료해야 합니다.
   - 이후 **ALL Q** 서비스를 이용할 수 있습니다.

신청은 온라인으로 진행되며, 자세한 내용은 안양청년광장 홈페이지에서 확인할 수 있습니다."
청년 커리어 고민 솔루션 ALL Question 안양 정책의 운영 기간은 언제부터인가요?,"['청년 커리어 고민 솔루션 ALL Question 안양', '경기 안양', '운영기 2024. 3. 4 계속']",운영 기간은 2024년 3월 4일부터 계속됩니다.,"[""[Document(metadata={'name': '청년 커리어 고민 솔루션  ALL Question   안양시 ', 'source': '..\\\\data\\\\policy_result.json'}, page_content='기관:경기 안양시 정책 분야:일자리분야 지원 내용:  청년의 고민을 현직자가 답해주는 온라인 멘토링    진로  대학  취업  이직  온라인 상담   실무 취업고민 상담사례 열람   AI 자기소개서 튜토리얼  분석    기타 자세한 세부 내용은 참고 사이트를 확인해주세요. 사업 신청 기간:상시 비고:운영시기   2024. 3. 4 ~ 계속 연령:만 16세 ~ 39세 거주지 및 소득:  안양시 거주  활동 직장  학교   하고 있는 청소년  청년   생년월일   2005. 3. 2. ~ 2008. 12. 31. 신청 절차:  16세~18세   안양청년광장 회원가입   ALL Q    19세~39세   안양청년광장 회원가입   인재록 완료   ALL Q  주관 기관:경기도 안양시'), Document(metadata={'name': '서울청년센터 양천', 'source': '..\\\\data\\\\policy_result.json'}, page_content='기관:서울 양천구 정책 분야:복지.문화분야 지원 내용:청년종합상담  자원연계  지역청년간소통  문화생활 지원  지역밀착형 청년공간  청년 맞춤형  운영 사업 운영 기간:2024.1~2024.12 사업 신청 기간:상시 비고:각 마다 운영기간 상이함 연령:만 19세 ~ 39세 거주지 및 소득:만19세 이상 39세 이하 청년 주관 기관:양천구청 기획재정국 일자리경제과 운영 기관:양천구'), Document(metadata={'name': '부여 청년센터 운영', 'source': '..\\\\data\\\\policy_result.json'}, page_content='기관:충남 부여군 정책 분야:.권리분야 지원 내용:  청년센터 대관  청년 운영 사업 운영 기간: 2024 01 01~2024 12 31 사업 신청 기간:상시 비고:  청년 우선 주관 기관:  행정복지국 전략사업과 운영 기관:  부여군 청년센터'), Document(metadata={'name': '청년이어드림지원금', 'source': '..\\\\data\\\\policy_result.json'}, page_content='기관:제주 정책 분야:.권리분야 지원 내용:  사업개요    사업기간   24.1.1.~12.31.    대상  정책 코디네이팅을 희망하는 도내 청년 1 500명   5개년간  23년 청년인구 161천명의 10% 수준 16 000명  달성을 목표로 하며  정책 수요  행정 여건 을 종합적으로 고려하여 사업 규모 검토    사업비  450백만원    지급액  미취업청년 10 ~ 60만원   취업청년 5 ~ 25만원    지급수단  지역화폐 탐나는전  지급    상담주기  상담간 정책상담 정책재상담  정책상담 피드백상담  최소 30일    지급방식  1단계 상담    2단계 연계    3단계 피드백  단계별 지급     1단계  맞춤형 상담 완료 시 지급 미취업 취업 차 지급     미취업  10만원    취업  5만원     2단계  연계 유무에  지급방식 상이    비용지급 없음       중위소득 100% 초과하거나 취업자  비용 지급 없음     중위소득 100% 이하인 미취업자  사회활동지원비 30만원 지급     3단계  정책 피드백 완료 시 20만원 지급   정책 연계 미연계 청년 대상 단순 설문조사가 아닌 직접 인터뷰 진행   3단계 지급액을 늘려 청년들이 3단계까지 꾸준히 할 수 있는 동기 부여  청년정책 재설계를 위한 내실있는 데이터 축적 도모    지원상세   청년이어드림지원금 추진배경    도내청년의 상황에 맞춤 맞춤형 정책 전달체계 미비  개별적 파편적 정보전달에  정보의 비대칭 발생    청년정책에  인지도  율이 낮고  공급자 중심의 정책 공급으로 정책 재설계 필요    인지도 30~40% 내외  율 5%내외     청년의 정책 를 높여 청년과 청년보장제를 연결하고  정책상담  피드백 데이터에 근거하여 청년보장제의 빈공간을 채워나가는 선순환체계 구축    기존 청년수당과의 차이점     기존청년수당  지원 조건에 하는 청년이 신청을 하면 지급     청년이어드림지원금  도내 청년 중 상담 연계 피드백의 각 단계별 를 완료한  지급    1단계 상담의  취업여부에  지원금의 차이 있으며  2단계 연계의  정책 미연계된 중위소득 100%이하인 미취업자에 한해 사회활동지원비 30만원  지급  3단계 피드백 상담은 20만원의 지원금을 지급하여 청년들의  유도   청년이어드림간소화   정부정책 디지털플랫폼정부 실현계획 과 연계하여 민간플랫폼 을 활용한 간편상담  구비서류 ZERO화 추진  24.4월부터 적용 예정  사업 신청 기간:2024년 01월01일 ~ 2024년 12월31일 비고:사업기간2024 01 01 ~ 2024 12 31 운영기간2024 01 01 ~ 2024 12 31 신청기간2024 01 01 ~ 2024 12 31 주관 기관:제주특별시 운영 기관:제주특별시'), Document(metadata={'name': ' 동구 청년도전 지원사업', 'source': '..\\\\data\\\\policy_result.json'}, page_content='기관:인천 동구 정책 분야:일자리분야 사업 운영 기간:2024. 3. 19. 화  ~ 10. 31. 목   별  기수별 운영 일정 상이 사업 신청 기간:미정 비고:사업기간   2024.3.19~10.31  별   기수별 운영 일정 상이  연령:만 18세 ~ 39세 거주지 및 소득:  대상   아래 조건 중 1개 이상을 충족하는 미취업 청년    구직단념청년  사업 신청일 이전 6개월 이상 취업 교육 직업훈련  이력이 없는 만18~34세 청년     자립준비청년  아동복지시설 에서 퇴소한 5년 이내  퇴소 연장한 만18~34세 청년     청소년복지시설 입 퇴소 청년  청소년복지시설에서 6개월 이상 보호한 만18~34세 청년     북한이탈청년  북한을 이탈한 자로서 만18~34세 청년     지역특화청년      다문화 가정  미혼모 부   한부모가정  생계형 아르바이트 주 30시간 미만 근로   국가유공자가구원 중 취업지원 대상자인 만 18~34세 청년     취업 의 문제로 1년이상 졸업을 유예하거나  휴학  만 18~34세 청년     장기구직  청년  휴   폐업한 자영업 청년  결혼   육아로 경력 단절된 여성 청년 중 만 35~39세 청년 주관 기관:인천광역시 동구 운영 기관:유유기지 동구청년21')], [{'url': 'https://www.facebook.com/anyanglove/posts/788009316702757/', 'content': '진로·취업·이직 등 고민을 하고 계신가요? 類 청년 커리어 고민 솔루션 「ALL Question」를 통해 그동안의 고민! 시~원하게 해결하세요! 운영기간 : 2024. 3. 4.(월) ~ 계속 운영대상 : 16세 ~ 39세 안양시 거주 또는 활동(직장 또는 학교 등) 하고 있는 청소년, 청년 운영내용 : 청년의 고민을 현직자가 답해주는'}, {'url': 'https://m.blog.naver.com/tvanyanggokr/223572220267', 'content': '본문 바로가기 블로그 안양시 공식 블로그 본문 기타 기능 내일을 준비하는 청년특별도시 안양! 안양청년 커리어 고민솔루션 ALL Q 🔽 안양청년광장 홈페이지 🔽 🔽 안양청년광장 홈페이지 🔽 ☎ 거주지 관할 동 행정복지센터 ☎ LH 전담 콜센터 (1600-0777) www.bokjiro.go.kr www.bokjiro.go.kr 전월세보증금에 대한 신규 대출 추천 및 해당 대출 실행 시 연 2% 이내 이자지원 ✔ 청년 본인 및 부부합산 총 순자산(동산,부동산 등) 가액이 3억 5천만원 이상인 경우 청년 학자금 대출 연체자 신용회복 지원 ▸이메일 신청 : ahdenmj98@korea.kr 청년공간 「범계역 청년출구」  9월 프로그램 운영 <문화로운 청년생활> “뽀득뽀득 친환경 천연 비누만들기” / 김미경 강사 <문화로운 청년생활> “나답게 꿈을 꾸다(미술활동)” / 강희진 강사 온라인 신청 : https://linkon.id/youthexit ◇운영시간 : 10시-21시(화~토) / 11시-17시(일) ◇휴관일 : 매주 월요일과 공휴일 ◇공간 이용에 관한 문의 : 031) 476-9371 www.instagram.com 청년특별도시'}]""]","안양시의 청년 커리어 고민 솔루션인 **""ALL Question""**의 운영 기간은 **2024년 3월 4일부터 계속 운영**됩니다. 이 프로그램은 청소년 및 청년들이 진로, 취업, 이직 등의 고민을 현직자와의 온라인 멘토링을 통해 해결할 수 있도록 지원합니다."
인천 스타트업파크 청년을 위한 창업 지원 정책의 지원 내용은 무엇인가요?,"['정책 이름: 인천 스타트업파크 청년을 위한 창업 지원', '지원 내용: 청년 스타트업 네트워킹, 청년 인턴을 선발하여 국제 전회 참가 스타트업 파견 지원, 청년 스타트업 인큐베이션, 인천 유관기관의 추천 우 청년 스타트업 제품 고도화 지원, 청년 스타트업 엑셀러레이팅, 인천지역 AC 창업기획 선정 스타트업 투 보육 지원']","청년 스타트업 네트워킹, 청년 인턴을 선발하여 국제 전회 참가 스타트업 파견 지원, 청년 스타트업 인큐베이션, 인천 유관기관의 추천 우 청년 스타트업 제품 고도화 지원, 청년 스타트업 엑셀러레이팅, 인천지역 AC 창업기획 선정 스타트업 투 보육 지원","[""[Document(metadata={'name': '인천 스타트업파크 청년을 위한 창업 지원', 'source': '..\\\\data\\\\policy_result.json'}, page_content='기관:인천 정책 분야:일자리분야 지원 내용:  청년 스타트업 네트워킹   청년 인턴을 선발하여 국제 전시회 참가 스타트업 파견 지원   청년 스타트업 인큐베이션   인천 유관기관의 추천 우수 청년 스타트업 제품  고도화 지원   청년 스타트업 엑셀러레이팅   인천지역 AC 창업기획자  선정  스타트업 투자  보육 지원 사업 운영 기간:2024.1. ~ 12. 사업 신청 기간:2024년 01월01일 ~ 2024년 12월31일 연령:만 18세 ~ 39세 거주지 및 소득:  거주지   제한없음   소득       대상   청년 창업자 주관 기관:인천광역시 경제자유구역청 스마트시티과 운영 기관:인천테크노파크 스타트업파크센터'), Document(metadata={'name': '경북청년예비창업가육성사업', 'source': '..\\\\data\\\\policy_result.json'}, page_content='기관:경북 정책 분야:일자리분야 지원 내용:  사업목적   좋은 아이템과 기술력을 갖고 있는 예비  초기 청년창업가들에게 사업화지원으로 청년창업 촉진   사업내용   1명당 창업활동비 15백만원 지원 창업활동비 12  교육  3     상품화제작  마케팅  시장 개척  지식재산권 인증  창업활동비     창업컨설팅  창업교육  간접지원 사업 운영 기간:2024 01 01~2024 12 31 사업 신청 기간:미정 지원 규모(명):  사 업 량   21개시군 성주 제외   청년창업가100명 비고:미정 연령:만 19세 ~ 39세 추가 단서 사항:  사업대상   만39세 이하 예비  창업 1년이내인 자 주관 기관:경상북도 운영 기관:시군'), Document(metadata={'name': '청년창업 컨설팅 멘토링 지원 기업 모집  파주시 ', 'source': '..\\\\data\\\\policy_result.json'}, page_content='기관:경기 파주시 정책 분야:일자리분야 지원 내용:  사 업 명  청년창업 컨설팅 멘토링 지원   과제기간  컨설팅 멘토링 시작일로부터 2개월 이내   지원규모  5명 내외   지원금액  기업 당 1백만원 4회 기준    세부지원내용은 공고문 참고 사업 신청 기간:2024년 08월30일 ~ 2024년 12월30일 비고:  신청기간  2024.08.21. ~ 예산 소진 시 까지 거주지 및 소득:  파주청년창업지원센터 입주기업 팀  신청 절차:  신청방법  신청서류 이메일 제출 youni1004 gtp.or.kr  기타 유익 정보:  문 의 처  파주청년창업지원센터 운영실 031 940 9797 주관 기관:파주시   재 경기테크노파크 운영 기관:파주시   재 경기테크노파크'), Document(metadata={'name': '청년 활성화 지원사업', 'source': '..\\\\data\\\\policy_result.json'}, page_content='기관:서울 강서구 정책 분야:.권리분야 지원 내용:1. 강서구 청년기구 운영 청년정책 공론장 운영  2. 강창맨 강서청년 창업지원 멘토링   3. 청년이 맘편히 일하는 강서 직업 강연   4. 푸르름 마음 치유 학교 음악 미술 치료   사업 신청 기간:미정 지원 규모(명):20명 이상 비고:연내 연령:만 19세 ~ 39세 거주지 및 소득:강서구 거주하며 재직  재학  청년 누구나 취업 상태:미취업자  재직자 신청 절차:1. 강서구청 홈페이지 접속 2.  내용 확인 3. 신청서류 제출 예정  4. 개별 사업기간 중 신청 기타 유익 정보:청년 미달 시 재공고 주관 기관:강서구청 일자리정책과'), Document(metadata={'name': '서울 청년 밀키트 창업지원', 'source': '..\\\\data\\\\policy_result.json'}, page_content='기관:서울 정책 분야:일자리분야 지원 내용:민관 보유 창업 인프라를 활용한 청년 밀키트 창업 지원으로 준비된 창업가 양성 사업 신청 기간:상시 지원 규모(명):기수별 창업교육 운영 3개 기수  비고:연중 상시 연령:만 19세 ~ 39세 주관 기관:농수산유통담당관 운영 기관:서울농수산식품공사')], [{'url': 'https://youth.incheon.go.kr/youthpolicy/youthPolicyInfoDetail.do?poly_seq=21&keyword=창업', 'content': '인천청년정책-인천 스타트업파크 청년을 위한 창업 지원 | 인천청년포털>인천청년정책>청년정책검색 청년 자격증 응시료 지원 대학일자리플러스센터 운영 지원 청년 주택임차보증금 이자 지원 인천 전세보증금반환보증 보증료 지원 인천 전입청년 1인가구 환영상자 지원 군복무 인천청년 상해보험 지원 자립정착금 지원 공공기관 청년 아르바이트 운영 국제기구 직업체험 프로그램 청년 자격증 응시료 지원 대학일자리플러스센터 운영 지원 청년 주택임차보증금 이자 지원 인천 전세보증금반환보증 보증료 지원 인천 전입청년 1인가구 환영상자 지원 군복무 인천청년 상해보험 지원 자립정착금 지원 국제기구 직업체험 프로그램 인천 스타트업파크 청년을 위한 창업 지원 청년 스타트업 네트워킹 : 청년 인턴을 선발하여 국제 전시회 참가 스타트업 파견 지원 청년 스타트업 인큐베이션 : 인천 유관기관의 추천 우수 청년 스타트업 제품·서비스 고도화 지원 청년 스타트업 엑셀러레이팅 : 인천지역 AC(창업기획자) 선정, 스타트업 투자 및 보육 지원 인천광역시 인천광역시 21554 인천광역시 남동구 정각로 29(구월동)'}, {'url': 'https://youth.incheon.go.kr/job/startup.jsp', 'content': '인천스타트업파크 운영-2024년 인천 스타트업파크 「청년 스타트업 네트워킹」 사업 | 인천청년포털>일자리>창업지원 청년 자격증 응시료 지원 대학일자리플러스센터 운영 지원 청년 주택임차보증금 이자 지원 인천 전세보증금반환보증 보증료 지원 인천 전입청년 1인가구 환영상자 지원 청년 자격증 응시료 지원 대학일자리플러스센터 운영 지원 청년 주택임차보증금 이자 지원 인천 전세보증금반환보증 보증료 지원 인천 전입청년 1인가구 환영상자 지원 청년 자격증 응시료 지원 대학일자리플러스센터 운영 지원 지원대상 : 인천 소재 대학교 및 대학원 재학생, 휴학생, 졸업생 또는 인천으로 주소지가 등록된 청년 전문적인 마케팅 교육 실시 후 우수한 청년 10명을 선발하여 기업이 참가하는 글로벌전시회(CES2025)에 파견 지원 - 최종 선발 청년 10명 : 활동비 지원(100만원), 글로벌전시회 참가 지원(항공 및 숙박 500만원 이내) 지원조건 : 마케팅 실무 역량을 키우고 스타트업에 관심 있는 인천 소재 대학(원)생·미취업 청년 (공고일 기준 만 39세 이하)'}]""]","인천 스타트업파크 청년을 위한 창업 지원 정책은 다음과 같은 내용을 포함하고 있습니다:

1. **청년 스타트업 네트워킹**: 청년 인턴을 선발하여 국제 전시회에 참가할 스타트업을 파견 지원합니다.

2. **청년 스타트업 인큐베이션**: 인천 유관기관의 추천을 받은 우수 청년 스타트업 제품 및 서비스에 대한 고도화 지원을 제공합니다.

3. **청년 스타트업 엑셀러레이팅**: 인천지역의 창업기획자를 선정하고 스타트업에 대한 투자 및 보육 지원을 실시합니다.

4. **운영 기간**: 이 사업은 2024년 1월부터 12월까지 진행됩니다.

5. **신청 기간**: 사업 신청은 2024년 1월 1일부터 12월 31일까지 가능합니다.

6. **지원 대상**: 만 18세에서 39세까지의 청년 창업자를 대상으로 하며, 거주지에 제한은 없습니다.

7. **주관 및 운영 기관**: 이 사업은 인천광역시 경제자유구역청 스마트시티과에서 주관하며, 인천테크노파크 스타트업파크센터가 운영합니다.

이 정책은 청년 창업을 촉진하고, 창업에 필요한 다양한 지원을 통해 인천 지역의 창업 생태계를 활성화하는 것을 목표로 하고 있습니다."
인천 스타트업파크 청년을 위한 창업 지원 정책의 주관 기관은 어디인가요?,"['정책 이름: 인천 스타트업파크 청년을 위한 창업 지원', '주관 기관: 인천광역 경제유구역청 스마트티과']",인천광역 경제유구역청 스마트티과,"['[Document(metadata={\'name\': \'인천 스타트업파크 청년을 위한 창업 지원\', \'source\': \'..\\\\data\\\\policy_result.json\'}, page_content=\'기관:인천 정책 분야:일자리분야 지원 내용:  청년 스타트업 네트워킹   청년 인턴을 선발하여 국제 전시회 참가 스타트업 파견 지원   청년 스타트업 인큐베이션   인천 유관기관의 추천 우수 청년 스타트업 제품  고도화 지원   청년 스타트업 엑셀러레이팅   인천지역 AC 창업기획자  선정  스타트업 투자  보육 지원 사업 운영 기간:2024.1. ~ 12. 사업 신청 기간:2024년 01월01일 ~ 2024년 12월31일 연령:만 18세 ~ 39세 거주지 및 소득:  거주지   제한없음   소득       대상   청년 창업자 주관 기관:인천광역시 경제자유구역청 스마트시티과 운영 기관:인천테크노파크 스타트업파크센터\'), Document(metadata={\'name\': \'영천시 청년창업대학 지원사업\', \'source\': \'..\\\\data\\\\policy_result.json\'}, page_content=\'기관:경북 영천시 정책 분야:일자리분야 지원 내용: 현장중심 창업교육   실전창업교육  현장방문 유니콘 기업  청년사관학교     멘토링지원 영천기업협의회  청년사관학교 출신 CEO      우수수료생 샘플제작 지원 사업 운영 기간:2024 03 01~2024 12 31 사업 신청 기간:미정 지원 규모(명):관내 청년 예비 창업자 15명 비고:미정 주관 기관:영천시 운영 기관:경북자동차임베디드연구원\'), Document(metadata={\'name\': \'경북 청년CEO 마일스톤 지원사업\', \'source\': \'..\\\\data\\\\policy_result.json\'}, page_content=\'기관:경북 정책 분야:일자리분야 지원 내용:   1년차  사업화자금 시제품제작  홍보 마케팅  제품디자인  장비임차료  컨설팅   1인당 연 1 500만원 지원  맞춤형 레벨업 추가 지원 1인당 1 000만원     2년차  청년을 추가 신규  채용 시  청년의 인건비 1년 연 2 400만원  지원   1년차 사업종료 후 6개월 내 청년 신규 채용시 지원    전문가 연계를  밀착형 기업진단 컨설팅  운영   창업기업의 디자인  국내 외 전시회  직무역량강화    우수청년인재 채용 연계 ex. 희망이음사업  대학생 인턴십  를 통한 지역 창업기업 우선 추천 사업 운영 기간:2023 01 01~2023 12 31 사업 신청 기간:미정 지원 규모(명):도내 만 39세 이하의 창업 청년 창업 3년 이상   7년 이내 청년  5명 비고:미정 연령:만 19세 ~ 39세 주관 기관: 재 경북테크노파크 운영 기관: 재 경북테크노파크 경북청년창업지원센터\'), Document(metadata={\'name\': \'청년 공간 운영\', \'source\': \'..\\\\data\\\\policy_result.json\'}, page_content=\'기관:부산 사하구 정책 분야:.권리분야 지원 내용:   지원내용 창업공간지원  창업교육  상담  인큐베이팅  멘토링  청년취업역량강화 교육  메이커  운영  사업 신청 기간:상시 연령:만 19세 ~ 39세 거주지 및 소득:  청년 누구나 추가 단서 사항:   주요기능 창업보육 청년활동지원    조성시설 입주공간  시제품제작실  세미나실  스터디룸  공유카페  영상작업실  참여 제한 대상:  없음 제출 서류:공고 확인 주관 기관:  사하구 일자리복지과\'), Document(metadata={\'name\': \'재정역량UP클래스\', \'source\': \'..\\\\data\\\\policy_result.json\'}, page_content=\'기관:인천 정책 분야:복지.문화분야 지원 내용: 청년 대상 금융  부동산  재정  온 오프라인 교육 추진  청년에게 꼭 필요한 근로 근로기준법  근로계약    금융 지식 부동산 계약  재테크  저축  소비 방법   함양을 위한 온 오프라인 교육   재무교육을  과다 채무 위험 예방  안정적 재무 구축 기반 조성 사업 운영 기간:2024. 4. ~ 10. 사업 신청 기간:미정 비고:2024.4~10 연령:만 19세 ~ 39세 거주지 및 소득: 19세이상 39세 이하 인천시 청년   주민록지  재 휴학 재직 장소가 인천광역시인 청년 주관 기관:인천광역시 청년정책담당관 운영 기관:인천테크노파크\')], [{\'url\': \'https://youth.incheon.go.kr/youthpolicy/youthPolicyInfoDetail.do?poly_seq=21&keyword=창업\', \'content\': \'인천청년정책-인천 스타트업파크 청년을 위한 창업 지원 | 인천청년포털>인천청년정책>청년정책검색 청년 자격증 응시료 지원 대학일자리플러스센터 운영 지원 청년 주택임차보증금 이자 지원 인천 전세보증금반환보증 보증료 지원 인천 전입청년 1인가구 환영상자 지원 군복무 인천청년 상해보험 지원 자립정착금 지원 공공기관 청년 아르바이트 운영 국제기구 직업체험 프로그램 청년 자격증 응시료 지원 대학일자리플러스센터 운영 지원 청년 주택임차보증금 이자 지원 인천 전세보증금반환보증 보증료 지원 인천 전입청년 1인가구 환영상자 지원 군복무 인천청년 상해보험 지원 자립정착금 지원 국제기구 직업체험 프로그램 인천 스타트업파크 청년을 위한 창업 지원 청년 스타트업 네트워킹 : 청년 인턴을 선발하여 국제 전시회 참가 스타트업 파견 지원 청년 스타트업 인큐베이션 : 인천 유관기관의 추천 우수 청년 스타트업 제품·서비스 고도화 지원 청년 스타트업 엑셀러레이팅 : 인천지역 AC(창업기획자) 선정, 스타트업 투자 및 보육 지원 인천광역시 인천광역시 21554 인천광역시 남동구 정각로 29(구월동)\'}, {\'url\': \'https://www.ifez.go.kr/main/pst/view.do?pst_id=noti03&pst_sn=271709\', \'content\': \'IFEZ - ""요람에서 TIPS까지…인천스타트업파크 청년 지원 사업 시작"" ○ 인천경제자유구역청과 인천테크노파크가 스타트업 육성을 통한 청년들의 일자리 창출 등을 위해 이른바 ‘요람에서 TIPS(Tech Incubator Program for Startup)’로 이어지는 청년 지원 사업들을 올해 처음으로 시작, 관심을 모으고 있다. ○ ‘청년 스타트업 브랜치’ 등 3개의 프로그램들은 청년들을 위한 스타트업 창업 교육 등 제공, 청년 사업자들을 대상으로 하는 스타트업의 기술검증 등에 대한 자문, 중소벤처기업부의 기술 창업 투자 프로그램인 TIPS 등에 선정될 수 있도록 지원하는 것으로 구성돼 있다. ○ 먼저 청년 스타트업 브랜치 프로그램은 관내 청년들을 대상으로 스타트업 창업과 4차 산업 기술 기반 실무교육을 운영, 네트워킹을 통해 스타트업들에게 우수 인력 확보 기회를 제공한다. ○ 또 청년이 함께하는 창업마당 프로그램은 스마트시티, 바이오융합 등 4차 산업 혁명 기술 기반 관련 우수 청년 스타트업 발굴·육성을 위해 지원을 지속한다.\'}]']",인천 스타트업파크 청년을 위한 창업 지원 정책의 주관 기관은 인천광역시 경제자유구역청입니다. 운영 기관은 인천테크노파크 스타트업파크센터입니다.
인천 스타트업파크 청년을 위한 창업 지원 정책의 연령 제한은 어떻게 되나요?,"['정책 이름: 인천 스타트업파크 청년을 위한 창업 지원', '연령: 만 18세 - 39세']",만 18세 - 39세,"[""[Document(metadata={'name': '인천 스타트업파크 청년을 위한 창업 지원', 'source': '..\\\\data\\\\policy_result.json'}, page_content='기관:인천 정책 분야:일자리분야 지원 내용:  청년 스타트업 네트워킹   청년 인턴을 선발하여 국제 전시회 참가 스타트업 파견 지원   청년 스타트업 인큐베이션   인천 유관기관의 추천 우수 청년 스타트업 제품  고도화 지원   청년 스타트업 엑셀러레이팅   인천지역 AC 창업기획자  선정  스타트업 투자  보육 지원 사업 운영 기간:2024.1. ~ 12. 사업 신청 기간:2024년 01월01일 ~ 2024년 12월31일 연령:만 18세 ~ 39세 거주지 및 소득:  거주지   제한없음   소득       대상   청년 창업자 주관 기관:인천광역시 경제자유구역청 스마트시티과 운영 기관:인천테크노파크 스타트업파크센터'), Document(metadata={'name': '청도군 청년창업 지역정착 지원사업', 'source': '..\\\\data\\\\policy_result.json'}, page_content='기관:경북 청도군 정책 분야:일자리분야 지원 내용:  사업대상   만 39세 이하 전국 청년 개인  팀 최대 2명  구성을 통한 신청 가능   지원내용   청년 1인당 사업화자금  활동비 20백만원 최대 2년간 지원    1년차 사업의 효과를 평가하여 2년차 지원 대상에서 제외할 수 있음    사업내용   지역자원과 특산품 을 활용한 관광상품  기념품 개발 판매 미술  음악  사진  청년문화예술 창작활동 지원 전시 체험공간  청년카페  음식점  게스트하우스  운영 사업 운영 기간:2024 01 01~2024 12 31 사업 신청 기간:미정 지원 규모(명):  사업비   50백만원   지원규모   2명 비고:미정 주관 기관:청도군청 운영 기관:경상북도 경제진흥원'), Document(metadata={'name': '청년창업 사업장 임차료 지원사업', 'source': '..\\\\data\\\\policy_result.json'}, page_content='기관:경북 영천시 정책 분야:일자리분야 지원 내용:월 임차료 50만원 한도 내 지원 창업자 20% 부담  최대 12개월 지원 사업 운영 기간:2024 04 01~2024 12 31 사업 신청 기간:미정 지원 규모(명):영천시 소재 청년창업자 20명 정도 비고:미정 연령:만 19세 ~ 45세 거주지 및 소득:사업장 소재지  대표자 주소지가 영천시이며 창업 3년 이내 청년창업자 추가 단서 사항:만 19 ~ 45세 이하의 청년창업가 주관 기관:영천시 운영 기관:경북자동차임베디드연구원'), Document(metadata={'name': '재정역량UP클래스', 'source': '..\\\\data\\\\policy_result.json'}, page_content='기관:인천 정책 분야:복지.문화분야 지원 내용: 청년 대상 금융  부동산  재정  온 오프라인 교육 추진  청년에게 꼭 필요한 근로 근로기준법  근로계약    금융 지식 부동산 계약  재테크  저축  소비 방법   함양을 위한 온 오프라인 교육   재무교육을  과다 채무 위험 예방  안정적 재무 구축 기반 조성 사업 운영 기간:2024. 4. ~ 10. 사업 신청 기간:미정 비고:2024.4~10 연령:만 19세 ~ 39세 거주지 및 소득: 19세이상 39세 이하 인천시 청년   주민록지  재 휴학 재직 장소가 인천광역시인 청년 주관 기관:인천광역시 청년정책담당관 운영 기관:인천테크노파크'), Document(metadata={'name': '2024년 청년성장프로젝트 사업 청년카페 운영 ', 'source': '..\\\\data\\\\policy_result.json'}, page_content='기관:경북 김천시 정책 분야:일자리분야 지원 내용:  사업내용   청년의 구직단념예방을 위한 맞춤형    청년고용정책 연계   인프라    청년 심리상담 에 필요한 청년 친화적 공간  시설  인프라         초기상담을  개인 맞춤형  설계 제안   심리적 소진 청년에게 심리상담 지원 1인당 최대 10회    니트화 예방  발굴을 주된 목적으로 하여 지역 청년의 일자리 상황  정주여건 에 부합하는 다양한  개설    경력재설계 은 필수   이외 마음관리  의사소통능력강화  취업준비  후속지원   청년고용정책을 촘촘히 연계 지원하고  자 취업상태  관리   청년일경험지원  청년도전지원사업  국민취업지원제도  국민내일배움카드 직업훈련      지원내용   초기상담    자와의 1 1 상담을  욕구  관심 직종  개별특성을 파악하고 개인 맞춤형  설계 제안  청년성장프로젝트 사업 이해    맞춤형    20시간 이수 사업 운영 기간:2024 03 01~2024 12 31 사업 신청 기간:미정 지원 규모(명):  사업목표     200명  심리상담 400명 비고:2024 03 01~2024 10 31 연령:만 19세 ~ 39세 주관 기관:경상북도  김천시청 일자리경제과 운영 기관:김천대학교 산학협력단')], [{'url': 'https://youth.incheon.go.kr/job/startup.jsp', 'content': '인천스타트업파크 운영-2024년 인천 스타트업파크 「청년 스타트업 네트워킹」 사업 | 인천청년포털>일자리>창업지원 청년 자격증 응시료 지원 대학일자리플러스센터 운영 지원 청년 주택임차보증금 이자 지원 인천 전세보증금반환보증 보증료 지원 인천 전입청년 1인가구 환영상자 지원 청년 자격증 응시료 지원 대학일자리플러스센터 운영 지원 청년 주택임차보증금 이자 지원 인천 전세보증금반환보증 보증료 지원 인천 전입청년 1인가구 환영상자 지원 청년 자격증 응시료 지원 대학일자리플러스센터 운영 지원 지원대상 : 인천 소재 대학교 및 대학원 재학생, 휴학생, 졸업생 또는 인천으로 주소지가 등록된 청년 전문적인 마케팅 교육 실시 후 우수한 청년 10명을 선발하여 기업이 참가하는 글로벌전시회(CES2025)에 파견 지원 - 최종 선발 청년 10명 : 활동비 지원(100만원), 글로벌전시회 참가 지원(항공 및 숙박 500만원 이내) 지원조건 : 마케팅 실무 역량을 키우고 스타트업에 관심 있는 인천 소재 대학(원)생·미취업 청년 (공고일 기준 만 39세 이하)'}, {'url': 'https://sajangnimtoday.com/인천-창업-지원/', 'content': '1. 인천 청년 창업 지원 사업 청년창업 챌린지 1. 인천 청년 창업 지원 사업 청년창업 챌린지 대중견기업 협업 오픈이노베이션 지원 사업은 인천시 소재 스타트업 기업과 대기업・중견기업간의 오픈이노베이션 및 사업화를 지원하는 사업입니다. 바이오클러스터 조성 지원 사업은 체계적인 바이오 스타트업 육성 기반 구축을 통해 바이오 경제 선도 및 일자리 창출 등을 위한 사업입니다. 창업 7년 이내 바이오융합 및 4차산업 기술기반 스타트업(단, 사업 종료 전 본사/연구소 등을 인천으로 주소 이전 조건) 창업카페 지원 사업은 (예비)창업자 및 창업에 관심 있는 일반시민이 자유롭게 모여 아이디어를 공유하고 네트워크를 구축할 수 있는 창업 소통 공간을 지원하는 사업입니다. 청년 창업 프로그램(교육) 등 창업 활동 지원 창업 7년 이내 바이오융합 및 4차산업 기술기반 스타트업(사업 종료 전 인천으로 본사 이전 조건) 👉 창업 사무실 지원 모두 알아보기(스타트업 및 청년 등) 대구 창업 지원금 및 지원 사업(2024년 최신 정보)'}]""]","인천 스타트업파크 청년을 위한 창업 지원 정책의 연령 제한은 만 18세에서 만 39세까지입니다. 이 프로그램은 청년 창업자를 대상으로 하며, 지원 내용에는 스타트업 네트워킹, 인턴 선발 및 국제 전시회 참가 지원, 인큐베이션, 엑셀러레이팅, 투자 및 보육 지원 등이 포함되어 있습니다. 사업 운영 기간은 2024년 1월부터 12월까지이며, 사업 신청 기간은 2024년 1월 1일부터 12월 31일까지입니다."
대전 청년부상제대군인 진로탐색비 지원사업의 지원 금액은 얼마인가요?,"['정책 이름: 대전 청년부상제대군인 진로탐색비 지원사업', '지원 내용: 지급액 100만원 1회에 한해 지급']",100만원 1회에 한해 지급,"[""[Document(metadata={'name': '청년월세 한시 특별지원 2차 사업 칠곡군 ', 'source': '..\\\\data\\\\policy_result.json'}, page_content='기관:경북 칠곡군 정책 분야:주거분야 지원 내용:  지원한도   실제 납부하는 임대료를 최대 240만원 월 최대 20만원 까지 최대 12개월 회  동안 매월 분할 지원 사업 운영 기간:2022 08 22~2026 12 31 사업 신청 기간:2024년 02월26일 ~ 2025년 02월25일 지원 규모(명):약 370여명 비고:2024 02 26~2025 02 25 연령:만 19세 ~ 34세 거주지 및 소득:  대상자    청년기본법 상 청년 만 19~34세 이하 으로 부모님과 별도 거주하는 무주택자 추가 단서 사항:  지원자격   청년가구 소득 기준 중위소득 60% 이하  원가구 소득 기준 중위소득 100% 이하 신청 절차:  신청방법   방문 신청   주소지 관할 읍면사무소   온라인 신청   복지로 홈페이지 www.bokjiro.go.kr  심사 및 발표:개별연락 주관 기관:국토교통부 운영 기관:칠곡군청 일자리경제과 청년취업팀 '), Document(metadata={'name': '청년 베이스캠프 위기 청년지원  대구 ', 'source': '..\\\\data\\\\policy_result.json'}, page_content='기관:대구 정책 분야:복지.문화분야 지원 내용:   지원금액     1인 최대 200만원 지원  판정회의를  급박한 위기상황 청년 선발 지원  복지 수혜를 받지 못하는 청년을 대상으로 지원하는 사업입니다. 도움이 절실한 청년은 053 710 3350으로 연락주시고  주위에 힘든 친구나 이웃이 있다면 관심을 가지고 정보 공유해주세요. 사업 신청 기간:미정 비고:  신청기간   신청기간    24.2.26. ~  25.2..25. 매월 15일  예산소진시 까지  연령:만 19세 ~ 39세 거주지 및 소득:  지원대상   가족 돌봄 간병  간호 으로 삶의 선택지를 잃어버린 청년   월세가 밀려 거주하는 집에서 내몰릴 위기 청년 공과금  월세 4개월 이상 체납 대상    가족의 학대로 집을 나와 생활고를 겪는 청년 추가 단서 사항:  지원자격   청년가구 소득 기준 중위소득 60% 이하  원가구 소득 기준 중위소득 100% 이하 참여 제한 대상: 부채  개인보험  임대료  저축  지원 불가 신청 절차:  지원절차   매월 15일 접수 마감  판정회의  선정발표    추가 요청 서류제출   매월 30일~익월 5일  지원금 지급   신청방법 신청서 메일접수 wsws1004 hanmail.net 메일 제목에 신복지  성명 이00 신청서 제출이라고 꼭 기재해주세요 주관 기관:대구광역시 운영 기관:월성종합사회복지관'), Document(metadata={'name': '청도군 청년창업 지역정착 지원사업', 'source': '..\\\\data\\\\policy_result.json'}, page_content='기관:경북 청도군 정책 분야:일자리분야 지원 내용:  사업대상   만 39세 이하 전국 청년 개인  팀 최대 2명  구성을 통한 신청 가능   지원내용   청년 1인당 사업화자금  활동비 20백만원 최대 2년간 지원    1년차 사업의 효과를 평가하여 2년차 지원 대상에서 제외할 수 있음    사업내용   지역자원과 특산품 을 활용한 관광상품  기념품 개발 판매 미술  음악  사진  청년문화예술 창작활동 지원 전시 체험공간  청년카페  음식점  게스트하우스  운영 사업 운영 기간:2024 01 01~2024 12 31 사업 신청 기간:미정 지원 규모(명):  사업비   50백만원   지원규모   2명 비고:미정 주관 기관:청도군청 운영 기관:경상북도 경제진흥원'), Document(metadata={'name': '완주군 청년도전사업', 'source': '..\\\\data\\\\policy_result.json'}, page_content='기관:전북 완주군 정책 분야:일자리분야 지원 내용:  주    밀착상담  사례관리  자신감 회복  진로탐색  취업역량강화  외부연계활동  자율활동    별 지원내용   도전  5주 40시간 이상  이수 시 수당 50만원   도전 중기 15주 120시간 이상  이수 시 수당 150만원 50만원 3회   이수인센티브  취업인센티브 지원   도전 장기 25주 200시간 이상  이수 시 수당 250만원 50만원 5회   이수  취업 활동  취업인센티브 지원   사업운영기간   2024 02 21 ~ 2024 12 31   사업신청기간   상시 사업 신청 기간:상시 비고:상시모집 연령:만 18세 ~ 45세 거주지 및 소득:  완주군 주민록상 주소지 기준 에 거주하는 18~45세 청년    구직단념청년  사업 신청일 이전 6개월 이상 취업 교육 직업훈련  이력이 없고  구직단념청년 문답표 21점 이상 만점 30점 인 18~34세 청년    자립준비청년  아동복지시설 에서 보호받고 퇴소한 자 중 퇴소 5년이내의 청년  퇴소 대상자임에도 불구하고 퇴소일을 연장한 18~34세 청년    청소년복지시설 입 퇴소 청년   청소년복지지원법  제31조에  청소년복지시설 청소년쉼터  청소년자립지원관  청소년회복지원시설   입 퇴소한 18~34세 청년    북한이탈청년  북한을 이탈한 자로서 만 18세~34세 청년    지역특화  위 자에 하지 않은 청년  지자체 조례 에서 지원의 필요성이 있다고 인정하는 청년 취업 상태:최근 6개월간 취업  교육 직업훈련  이력이 없는 청년 특화 분야:자립준비청년  청소년복지시설 입퇴소 청년  북한이탈청년  지역특화청년  신청 절차:구글신청서  고용24 신청 심사 및 발표:개별연락 기타 유익 정보:문의전화 063 219 0385 0412 0413 주관 기관:플래닛완주 운영 기관: 사 캠틱종합기술원'), Document(metadata={'name': '2024년 청년 월세 주거비 지원사업', 'source': '..\\\\data\\\\policy_result.json'}, page_content='기관:경북 고령군 정책 분야:주거분야 지원 내용:  지원대상   아래 요건을 모두 충족하는 자   고령군 거주  거주 예정인 18세 이상 45세 청년   청년 1인가구  청년 신혼부부 혼인신고일 7년 이내    임차보증금 5천만원 이하이면서 월세 50만원 이하의 주택에 월세로 거주하는 전국 기준 무주택자   가구당 기준 중위소득 180% 이하 사업 운영 기간:2024 03 11~2024 12 20 사업 신청 기간:미정 지원 규모(명):70명 정도 비고:미정 연령:만 18세 ~ 45세 주관 기관:고령군 운영 기관:고령군')], [{'url': 'https://dingdo.tistory.com/4672', 'content': '대전시는 올해 2024년 1월부터 전국 지자체 최초로 18세~39세 이하 청년부상제대군인과 청년 중·장기복무제대군인에게 진로탐색비를 지원한다고 밝혔습니다.청년부상제대군인은 「국가유공자법」과 「보훈보상자법」에 따른 전상군경, 공상군경, 재해부상군경이며, 청년 중장기 복무제대군인은 「제대군인법」에 따른 중·장기복무제대군인을 말합니다.대전시는 근로 의사가 있음에도 취업이나 창업하지 못한 청년부상제대군인과 청년중장기복무제대군인을 대상으로 일정 자격 심사 후 1회에 한정해 진로탐색비 100만 원을 지급할 예정이다.구체적 지원 대상은 △2024년 1월 1일 이후 전역하고 신청일 기준으로 대전시에 6개월 이상 주민등록을 두고 거주하고 있는 시민이며 △단, 취·창업자, 군인연금 수급권자는 지급에서 제외된다고 합니다. 2024년 1월부터 대전에 6개월 이상 거주해야 지원되나요?아닙니다.신청일 기준 대전에 6개월 이상 거주한 경우 지원 대상이 됩니다.단 지급일까지는 대전 거주가 확인되어야 하며 타 시도 전출 시 지급대상에서 제외될 수 있습니다.3. 진로탐색비를 지원받을 수 있나요?신청일 기준 6개월 이상 대전시에 주민등록이 되어 있어야 하며 주소를 다른 곳으로 이전한 경우 지원 대상이 아닙니다.6.'}, {'url': 'https://m.blog.naver.com/shareofficedaon/223325301354', 'content': '안녕하세요 다온입니다~ 대전광역시에서 전국 최초 청년 부상 제대군인 등 진로탐색비 100만원을 지원해줍'}]""]","아래는 청년을 위한 다양한 지원 사업에 대한 정보입니다:

1. **청년월세 한시 특별지원 (칠곡군)**
   - **지원 내용**: 최대 240만원, 월 최대 20만원까지 12개월 동안 지원.
   - **신청 기간**: 2024년 02월 26일 ~ 2025년 02월 25일.
   - **대상**: 만 19세 ~ 34세 청년, 청년가구 소득 기준 중위소득 60% 이하.
   - **신청 방법**: 방문 신청(읍면사무소) 및 온라인 신청(복지로 홈페이지).

2. **청년 베이스캠프 위기 청년지원 (대구)**
   - **지원 내용**: 1인 최대 200만원 지원.
   - **신청 기간**: 2024년 02월 26일 ~ 2025년 02월 25일.
   - **대상**: 만 19세 ~ 39세 청년, 소득 기준 중위소득 60% 이하.
   - **신청 방법**: 메일 접수(wsws1004@hanmail.net).

3. **청도군 청년창업 지역정착 지원사업**
   - **지원 내용**: 청년 1인당 최대 2000만원 지원(2년간).
   - **대상**: 만 39세 이하 청년.
   - **사업 운영 기간**: 2024년 01월 01일 ~ 2024년 12월 31일.
   - **주관 기관**: 청도군청.

4. **완주군 청년도전사업**
   - **지원 내용**: 도전 프로그램 이수 시 수당 지급, 최대 250만원 지원.
   - **연령**: 만 18세 ~ 45세 청년.
   - **신청 기간**: 상시 모집.
   - **주관 기관**: 플래닛완주.

5. **2024년 청년 월세 주거비 지원사업 (고령군)**
   - **지원 내용**: 월세 50만원 이하 주택 거주 청년에게 지원.
   - **대상**: 만 18세 ~ 45세 청년, 중위소득 180% 이하.
   - **사업 운영 기간**: 2024년 03월 11일 ~ 2024년 12월 20일.

6. **대전 청년 부상 제대군인 진로탐색비 지원**
   - **지원 내용**: 진로탐색비 100만원, 1회 한정 지원.
   - **대상**: 청년 부상 제대군인 및 중장기 복무 제대군인.
   - **신청 조건**: 대전시에 6개월 이상 거주.

이 외에도 추가적인 정보가 필요하시면 말씀해 주세요!"
대전 청년부상제대군인 진로탐색비 지원사업은 어떤 연령대가 신청할 수 있나요?,"['정책 이름: 대전 청년부상제대군인 진로탐색비 지원사업', '연령: 만 18세 39세']",만 18세 39세,"['[Document(metadata={\'name\': \'2024년 청년 자격증 취득 지원사업\', \'source\': \'..\\\\data\\\\policy_result.json\'}, page_content=\'기관:경북 고령군 정책 분야:일자리분야 지원 내용:  지원대상   18세 이상 45세 이하 취업을 준비 중 미취업 인 청년   공인어학 시험의  요건 충족 시 시험응시료 최대 5회   증명서 발급 비용만 지원 가능 사업 운영 기간:2024 02 26~2024 12 20 사업 신청 기간:미정 지원 규모(명):15명 정도 비고:미정 연령:만 18세 ~ 45세 주관 기관:고령군 운영 기관:고령군\'), Document(metadata={\'name\': \'찾아가는 심리상담  오늘도 맑음  지원사업\', \'source\': \'..\\\\data\\\\policy_result.json\'}, page_content=\'기관:전남 정책 분야:복지.문화분야 지원 내용:  사업내용   전담상담사 파견 운영을 통한 청년 심리상담  운영   각 시 군 청년센터에서 이뤄지는 일대일 대면상담 진행   상담분야   직장  개인  가정 내 직면한 다양한 심리 정서 문제  사업 신청 기간:상시 비고:사업기간 상시 모집 사업기간   2024.4.~11.  연령:만 18세 ~ 45세 거주지 및 소득: 전남 청년  신청일 기준 아래 요건 중  한 가지 이상 하는 자   전라남도 거주자   전라남도에 소재하는 학교를 재학 휴학 졸업한 학생   전라남도에 소재하는 직장에 재직  직장 추가 단서 사항:  상담 일정 확정 후  불참사유 발생 시 매칭된 전담상담사와 일정 변경  취소 가능   1회 노쇼시 자동으로 상담 종결   심리상담으로 해소가 어려운 정신증  자살위기  의료기관 진료  추가 적인 사례관리가 필요한  외부기관으로 연계  안내할 수 있음 참여 제한 대상:  공고일 기준 전라남도 미거주자   지원 나이에 되지 않는 자   선정 후 사전 연락 없이 상담을 취소하는   노쇼 1회시 상담종결    단  최종 자와 상담사 간 일정이 맞지 않을  취소 후 재신 신청 절차:  희망하는  도내 시 군 청년센터 에 방문  이메일 접수   시 군 센터 방문 E Mail 신청  붙임 1. 시 군청년센터별 문의처 참조  제출 서류:  신청서    주민록본  재학증명서  재직증명서 중 1부 제출   2024.4월 이후 발급한 서류만 인정하며 본의  본인 전입일을 표기하여 발급   주민록번호 뒷번호는 비공개 처리 후 제출   제출서류는 스캔  선명하게 사진 사본  찍어 신청서와 함께 제출 주관 기관:전라남도청년센터 운영 기관:전라남도청년센터\'), Document(metadata={\'name\': \'2024년 청년 월세 주거비 지원사업\', \'source\': \'..\\\\data\\\\policy_result.json\'}, page_content=\'기관:경북 고령군 정책 분야:주거분야 지원 내용:  지원대상   아래 요건을 모두 충족하는 자   고령군 거주  거주 예정인 18세 이상 45세 청년   청년 1인가구  청년 신혼부부 혼인신고일 7년 이내    임차보증금 5천만원 이하이면서 월세 50만원 이하의 주택에 월세로 거주하는 전국 기준 무주택자   가구당 기준 중위소득 180% 이하 사업 운영 기간:2024 03 11~2024 12 20 사업 신청 기간:미정 지원 규모(명):70명 정도 비고:미정 연령:만 18세 ~ 45세 주관 기관:고령군 운영 기관:고령군\'), Document(metadata={\'name\': \'소셜믹스형 공공임대주택  청년주택 \', \'source\': \'..\\\\data\\\\policy_result.json\'}, page_content=\'기관:서울 금천구 정책 분야:주거분야 지원 내용:주거  자립기반이 취약한 청년층의 주거 공급 사업 신청 기간:미정 비고:수시 연령:만 19세 ~ 39세 거주지 및 소득:서울시 거주 공고문 필히 참고 신청 절차:모집공고를 통한 신청자 접수 주관 기관:금천구청 일자리청년과 운영 기관:02 2627 2587\'), Document(metadata={\'name\': \'청년 생활클리닉\', \'source\': \'..\\\\data\\\\policy_result.json\'}, page_content=\'기관:서울 종로구 정책 분야:복지.문화분야 지원 내용:미취업청년을 위한 진로설계 도움   사회초년생을 위한 재무관리 교육 진행 사업 신청 기간:미정 비고:미정 연령:만 19세 ~ 39세 거주지 및 소득:만 19세 이상 39세 이하 청년 신청 절차:구글폼 신청  신청기간에 구글폼 오픈  심사 및 발표:접수 후 개별대상자에게 통보 기타 유익 정보:문의   일자리경제과    02 2148 2313  주관 기관:종로구청 일자리경제과 운영 기관:주관기관과 동일\')], [{\'url\': \'https://romyismycat.tistory.com/entry/대전-청년부상제대군인-등-진로탐색비-지원사업\', \'content\': ""대전 청년부상제대군인 등 진로탐색비 지원사업 관리 도움되는 글 대전 청년부상제대군인 등 진로탐색비 지원사업 ① 연령 : 신청일 기준 18~39세 이하의 청년 ② 거주 : 신청일 기준 대전광역시에 6개월 이상 주민등록을 하고 거주 ④ 미취업 : 신청일 기준 미취업자(미창업자) 신청기간 및 지급방법 ▶ 신청기간 : 2024. ▶ 접수처 : 대전광역시 보훈정책추진단(042-270-0893) 방문 또는 우편접수 ▶ 구비서류 : (신청월 기준 발급) ※ 보다 자세한 사항은 대전광역시청(대전 청년부상제대군인 등 진로탐색비 지원사업 안내 | 대전광역시청 (daejeon.go.kr)) 홈페이지를 확인하시기 바랍니다. 자세한 사항 및 첨부파일 다운로드 바로가기 게시글 관리 \'도움되는 글\' 카테고리의 다른 글 충청남도 장애인 거주시설 (2022.12.31)\\xa0\\xa0(0)2024.02.072024년 대전광역시 청년매입임대주택 예비입주자 모집공고\\xa0\\xa0(0)2024.01.27충청남도 아이돌봄서비스 소개\\xa0\\xa0(0)2024.01.19대전광역시 아동복지시설 및 기관 운영\\xa0\\xa0(0)2024.01.18영양소 이야기 - 비타민D (1)\\xa0\\xa0(0)2024.01.17 진로탐색비, 청년부상제대군인 대전광역시 아동복지시설 및 기관 운영""}, {\'url\': \'https://m.blog.naver.com/storydaejeon/223699148099\', \'content\': \'대전시, 제대군인 사회 진출 기반 마련! 청년 제대군인 진로탐색비 지원 : 네이버 블로그 대전시, 제대군인 사회 진출 기반 마련! 청년 제대군인 진로탐색비 지원 대전광역시는 청년 부상 제대군인 및 청년 중장기복무 제대군인의 성공적인 사회 복귀를 돕기 위해 진로 탐색비 지원사업을 올해 전국 최초로 시행하고 있습니다. 대전광역시 보훈정책추진단에서 지원하는 이번 사업은 신청일 기준 대전에 거주 중인 청년부상 제대군인 및 청년 중장기복무 제대군인을 대상으로 진로 탐색비 100만 원을 본인 명의 계좌로 지급합니다. 지원 대상: 근로 의사가 있음에도 불구하고 미취업 상태인 대전 거주 청년부상제대군인 및 청년 중장기복무 제대군인 (단, 군인연금 수급권자는 제외) 청년 부상 제대군인 및 청년 중장기복무 제대군인 여러분께서는 적극적으로 지원사업에 참여하여, 새로운 도약을 위한 첫걸음을 내딛는 데 도움이 되길 희망합니다. {""title"":""대전시, 제대군인 사회 진출 기반 마련! 청년 제대군인 진로탐색비 지원"",""source"":""https://blog.naver.com/storydaejeon/223699148099"",""blogName"":""대전광역시.."",""domainIdOrBlogId"":""storydaejeon"",""nicknameOrBlogId"":""대전광역시"",""logNo"":223699148099,""smartEditorVersion"":4,""meDisplay"":true,""lineDisplay"":true,""outsideDisplay"":true,""cafeDisplay"":true,""blogDisplay"":true}\'}]']",대전 청년부상제대군인 진로탐색비 지원사업은 신청일 기준으로 18세에서 39세 이하의 청년이 신청할 수 있습니다.
대전 청년부상제대군인 진로탐색비 지원사업을 신청하려면 어디로 접수해야 하나요?,"['정책 이름: 대전 청년부상제대군인 진로탐색비 지원사업', '신청 절차: 접처 대전광역 보훈정책추진 042 270 0893 방문 우편접']",대전광역 보훈정책추진 042 270 0893 방문 우편접,"['[Document(metadata={\'name\': \'청년 베이스캠프 위기 청년지원  대구 \', \'source\': \'..\\\\data\\\\policy_result.json\'}, page_content=\'기관:대구 정책 분야:복지.문화분야 지원 내용:   지원금액     1인 최대 200만원 지원  판정회의를  급박한 위기상황 청년 선발 지원  복지 수혜를 받지 못하는 청년을 대상으로 지원하는 사업입니다. 도움이 절실한 청년은 053 710 3350으로 연락주시고  주위에 힘든 친구나 이웃이 있다면 관심을 가지고 정보 공유해주세요. 사업 신청 기간:미정 비고:  신청기간   신청기간    24.2.26. ~  25.2..25. 매월 15일  예산소진시 까지  연령:만 19세 ~ 39세 거주지 및 소득:  지원대상   가족 돌봄 간병  간호 으로 삶의 선택지를 잃어버린 청년   월세가 밀려 거주하는 집에서 내몰릴 위기 청년 공과금  월세 4개월 이상 체납 대상    가족의 학대로 집을 나와 생활고를 겪는 청년 추가 단서 사항:  지원자격   청년가구 소득 기준 중위소득 60% 이하  원가구 소득 기준 중위소득 100% 이하 참여 제한 대상: 부채  개인보험  임대료  저축  지원 불가 신청 절차:  지원절차   매월 15일 접수 마감  판정회의  선정발표    추가 요청 서류제출   매월 30일~익월 5일  지원금 지급   신청방법 신청서 메일접수 wsws1004 hanmail.net 메일 제목에 신복지  성명 이00 신청서 제출이라고 꼭 기재해주세요 주관 기관:대구광역시 운영 기관:월성종합사회복지관\'), Document(metadata={\'name\': \'찾아가는 심리상담  오늘도 맑음  지원사업\', \'source\': \'..\\\\data\\\\policy_result.json\'}, page_content=\'기관:전남 정책 분야:복지.문화분야 지원 내용:  사업내용   전담상담사 파견 운영을 통한 청년 심리상담  운영   각 시 군 청년센터에서 이뤄지는 일대일 대면상담 진행   상담분야   직장  개인  가정 내 직면한 다양한 심리 정서 문제  사업 신청 기간:상시 비고:사업기간 상시 모집 사업기간   2024.4.~11.  연령:만 18세 ~ 45세 거주지 및 소득: 전남 청년  신청일 기준 아래 요건 중  한 가지 이상 하는 자   전라남도 거주자   전라남도에 소재하는 학교를 재학 휴학 졸업한 학생   전라남도에 소재하는 직장에 재직  직장 추가 단서 사항:  상담 일정 확정 후  불참사유 발생 시 매칭된 전담상담사와 일정 변경  취소 가능   1회 노쇼시 자동으로 상담 종결   심리상담으로 해소가 어려운 정신증  자살위기  의료기관 진료  추가 적인 사례관리가 필요한  외부기관으로 연계  안내할 수 있음 참여 제한 대상:  공고일 기준 전라남도 미거주자   지원 나이에 되지 않는 자   선정 후 사전 연락 없이 상담을 취소하는   노쇼 1회시 상담종결    단  최종 자와 상담사 간 일정이 맞지 않을  취소 후 재신 신청 절차:  희망하는  도내 시 군 청년센터 에 방문  이메일 접수   시 군 센터 방문 E Mail 신청  붙임 1. 시 군청년센터별 문의처 참조  제출 서류:  신청서    주민록본  재학증명서  재직증명서 중 1부 제출   2024.4월 이후 발급한 서류만 인정하며 본의  본인 전입일을 표기하여 발급   주민록번호 뒷번호는 비공개 처리 후 제출   제출서류는 스캔  선명하게 사진 사본  찍어 신청서와 함께 제출 주관 기관:전라남도청년센터 운영 기관:전라남도청년센터\'), Document(metadata={\'name\': \'장수군 면접활동비 지원사업\', \'source\': \'..\\\\data\\\\policy_result.json\'}, page_content=\'기관:전북 장수군 정책 분야:복지.문화분야 지원 내용:면접 1회 5만원 최대 2회  지원 사업 운영 기간:예산 소진시까지 사업 신청 기간:상시 비고:상시 예산 소진시까지  연령:만 18세 ~ 65세 신청 절차:  문의처   장수군로컬JOB센터  063 352 7898  1  워크넷 구직록 2  면접활동비 신청 3  서류검토  승인처리 4  면접활동비 지급 주관 기관:장수군 운영 기관:장수군로컬JOB센터\'), Document(metadata={\'name\': \'전국민 마음투자 지원사업\', \'source\': \'..\\\\data\\\\policy_result.json\'}, page_content=\'기관:보건복지부 정책 분야:복지.문화분야 지원 내용:   지원내용  총 8회  심리상담   회당 최소 50분 이상     지원기간  바우처 생성일로부터 120일 사업 신청 기간:2024년 07월01일 ~ 2024년 12월31일 비고:2024.07.01. 월  ~ 2024.12.31.  화  거주지 및 소득:   대상  지원 대상 기준을 충족한 자   만 19세 미만 자는 보호자 동의 필요     신청권자  본인  친족  법정대리인  담당공무원 직권신청  추가 단서 사항:   계약   자가 직접 주소지 관계없이 원하는 기관 선택 후 계약체결    기관 검색  사회 전자바우처 포털 www.socialservice.or.kr      가격      단가  1회당 1급 유형 8만원  2급 유형 7만원   인력 자격기준에   유형 1급 2급  구분     본인부담금  소득수준별 0~30% 1회  0 ~ 최대 24 000원  신청 절차:   방문신청  증빙서류 지참  주민록상 거주지 읍 면 동 행정복지센터 방문하여   유형 1급  2급  결정 후 신청    온라인 신청  2024년 10월부터 복지로 www.bokjiro.go.kr 로 신청 가능 심사 및 발표:  시 군 구 보건소  담당자가 대상자 신청기준 여부 확인하여  예산 범위 내에서 선착순으로 선정 통지 기타 유익 정보:  보건복지부 보건복지상담센터  129 www.129.go.kr    읍면동 행정복지센터 주관 기관:보건복지부 운영 기관:지자체\'), Document(metadata={\'name\': \'창녕군 일상돌봄 사업 자 모집\', \'source\': \'..\\\\data\\\\policy_result.json\'}, page_content=\'기관:경남 창녕군 정책 분야:복지.문화분야 지원 내용:  기간  6개월 재판정 5회 가능      내용   기본  돌봄 가사    재가돌봄  신체 청결  식사 도움  신체 수발  지원   가사 청소  설거지  식사 준비  청소  일상생활 지원   동행지원  장보기  외출 동행  업무 보조    특화 병원 동행    병원으로 출발 시부터  집으로 귀가 시까지 동행 지원    병원 내 접수 수납  진료   약국 동행   입 퇴원 지원  투약  질환  정보 전달   특화 심리 지원    월 4회 주 1회      상담  맞춤형    대상 욕구 성격  우울  불안  에  개입  예방   관계  상황적 스트레스 대처 능력 향상     유형   공고문 참고    바우처 총액  본인부담금   공고문 참고 사업 신청 기간:상시 지원 규모(명):돌봄이 필요한 청 중장년 19~61세  20명   예산에  모집인원 변경 가능 비고:2024. 4. 29. ~ 인원 모집 마감 시까지 연령:만 19세 ~ 64세 거주지 및 소득:  자격요건   소득기준   소득기준 없음   연령기준   19 ~ 64세   가구기준   가구기준 없음   욕구기준   아래     를 모두 갖춘    돌봄 필요성   질병  부상  고립 으로 독립적 일상생활이 불가능하거나 곤란한 로 신체적  정신적  사회적 자립이 어려운    자립준비청년  보호연장아동인    판단기준  아래 중 1개 충족시 가능   1  진단서 소견서   2  공공 민간기관 추천서  3  일상돌봄 대상자 선정 조사 필요시   4  자립준비청년 보호종료확인서  보호연장아동시설재원증명서  가정위탁보호확인서   돌봄자 부재 1  ~ 2  중 1개 충족 시 가능 1  주 돌봄을 할 가족  친지 이 없거나 함께 거주하지 않는  2  동거가족이 있더라도 경제활동 으로 돌봄을 하기 어려운    국적 기준   민국 국적을 가진 자 추가 단서 사항:공고문 참고 참여 제한 대상:공고문 참고 신청 절차:  신청방법   방문신청  주소지 읍 면사무소 방문하여 신청   전화 우편 팩스 신청  거동 불편  부득이한 사유로 직접 방문이 불가능한  심사 및 발표:공고문 참고 제출 서류:  사회보장급여 사회권  신청서   사회 자 준수사항 안내확인 동의서   신청자 신분증 주민록증  여권  운전면허증  국가유공자증  국가기관이나 지방자치단체가 발행한 신분증명서류    대리신청 시 위임장  대리신청자의 신분증 추가 제출 필요   증빙서류  신청자 유형별 서류 제출 공고문 붙임 참조  주관 기관:보건복지부 운영 기관:창녕군청 행정복지국 행복나눔과   055 530 1104 \')], [{\'url\': \'https://romyismycat.tistory.com/entry/대전-청년부상제대군인-등-진로탐색비-지원사업\', \'content\': ""대전 청년부상제대군인 등 진로탐색비 지원사업 관리 도움되는 글 대전 청년부상제대군인 등 진로탐색비 지원사업 ① 연령 : 신청일 기준 18~39세 이하의 청년 ② 거주 : 신청일 기준 대전광역시에 6개월 이상 주민등록을 하고 거주 ④ 미취업 : 신청일 기준 미취업자(미창업자) 신청기간 및 지급방법 ▶ 신청기간 : 2024. ▶ 접수처 : 대전광역시 보훈정책추진단(042-270-0893) 방문 또는 우편접수 ▶ 구비서류 : (신청월 기준 발급) ※ 보다 자세한 사항은 대전광역시청(대전 청년부상제대군인 등 진로탐색비 지원사업 안내 | 대전광역시청 (daejeon.go.kr)) 홈페이지를 확인하시기 바랍니다. 자세한 사항 및 첨부파일 다운로드 바로가기 게시글 관리 \'도움되는 글\' 카테고리의 다른 글 충청남도 장애인 거주시설 (2022.12.31)\\xa0\\xa0(0)2024.02.072024년 대전광역시 청년매입임대주택 예비입주자 모집공고\\xa0\\xa0(0)2024.01.27충청남도 아이돌봄서비스 소개\\xa0\\xa0(0)2024.01.19대전광역시 아동복지시설 및 기관 운영\\xa0\\xa0(0)2024.01.18영양소 이야기 - 비타민D (1)\\xa0\\xa0(0)2024.01.17 진로탐색비, 청년부상제대군인 대전광역시 아동복지시설 및 기관 운영""}, {\'url\': \'https://www.daejeon.go.kr/drh/depart/board/boardNormalView.do?boardId=normal_0107&menuSeq=2668&pageIndex=1&ntatcSeq=1446542290\', \'content\': \'대전광역시, 대전시청, 대전광역시청. 제목 대전 청년부상제대군인 등 진로탐색비 지원사업 안내; 작성자 한미영; 작성일 2024-01-05; 문의처 042-270-0893; 첨부파일 붙임 1 진로탐색비 지원 신청서서식.hwpx(55.6KB) 붙임 2 구직활동 기관별 적극적 구직활동 및 인정자료.hwpx(77.1KB)\'}]']","다음은 청년 지원 사업에 관한 정보입니다:

1. **청년 베이스캠프 위기 청년지원 (대구)**
   - **지원 내용**: 1인 최대 200만원 지원.
   - **대상**: 만 19세 ~ 39세, 재정적 위기에 처한 청년.
   - **신청 방법**: 이메일 접수 (wsws1004@hanmail.net).
   - **신청 기간**: 매월 15일 접수 마감, 예산 소진 시까지.
   - **문의처**: 053-710-3350.

2. **찾아가는 심리상담 오늘도 맑음 (전남)**
   - **지원 내용**: 청년 심리 상담, 1대 1 대면 상담 제공.
   - **대상**: 만 18세 ~ 45세, 전라남도 거주자.
   - **신청 방법**: 도내 청년센터 방문 또는 이메일 접수.
   - **신청 기간**: 상시.
   - **문의처**: 각 시 군 청년센터.

3. **장수군 면접활동비 지원사업 (전북)**
   - **지원 내용**: 면접 1회당 5만원, 최대 2회 지원.
   - **대상**: 만 18세 ~ 65세.
   - **신청 방법**: 장수군로컬JOB센터에 문의 후 신청.
   - **신청 기간**: 상시, 예산 소진 시까지.
   - **문의처**: 063-352-7898.

4. **전국민 마음투자 지원사업 (보건복지부)**
   - **지원 내용**: 총 8회 심리 상담, 회당 최소 50분.
   - **대상**: 만 19세 이상, 보호자 동의 필요 시 만 19세 미만.
   - **신청 방법**: 읍면동 행정복지센터 방문 또는 온라인 신청 (2024년 10월부터).
   - **신청 기간**: 2024년 07월01일 ~ 2024년 12월31일.
   - **문의처**: 보건복지부 상담센터 129.

5. **창녕군 일상돌봄 사업 (경남)**
   - **지원 내용**: 돌봄 서비스 제공, 가사 및 신체적 지원.
   - **대상**: 만 19세 ~ 64세, 돌봄 필요성 있는 청년.
   - **신청 방법**: 주소지 읍 면사무소 방문 신청.
   - **신청 기간**: 상시, 예산에 따라 모집 인원 변경 가능.
   - **문의처**: 창녕군청 행복나눔과 055-530-1104.

추가로, **대전 청년부상제대군인 등 진로탐색비 지원사업**도 있으며, 대전에서 18세 이상 39세 이하의 청년을 대상으로 지원하고 있습니다. 더 자세한 사항은 대전광역시청에 문의하시면 됩니다.

각 사업의 신청 절차 및 조건을 확인하시고 필요한 정보를 수집하여 신청하시기 바랍니다."
청년내일저축계좌 정책의 지원대상 연령은 어떻게 되나요?,"['정책 이름: 청년내일저축계좌', '가입령 만 19세 만 34세 월의 전월에 만 19세가 된 월에 만 35세가 되는 급차상위 위소득 50 이하는 만 15세 만 39세까지 허용 월의 전월에 만 15세가 된 월에 만 40세가 되는']","만 19세부터 만 34세까지이며, 기준에 따라 만 15세부터 만 39세까지 허용됩니다.","[""[Document(metadata={'name': '청년층직업지도 CAP  ', 'source': '..\\\\data\\\\policy_result.json'}, page_content='기관:고용노동부 정책 분야:교육분야 지원 내용:청년 취업준비생의 직업진로 선택을 지원하고  취업서류 작성  면접기술 강화  구직기술 강화 지원 사업 운영 기간:연중 사업 신청 기간:상시 지원 규모(명):각 집단별 15~18명 내외 비고:상시  단  과정별 상이  연령:만 15세 ~ 34세 거주지 및 소득:  만 15세 ~ 만 34세 이하 청년   청년구직자  대학생  청년은 누구나  가능 취업 상태:미취업자 신청 절차:   온라인  워크넷 WORK.GO.KR    고용복지정책   구직자취업역량 강화    선택 신청    오프라인  지역 고용센터를 방문   CAP  참가신청 접수   담당자와 협의     심사 및 발표:신청   대상자 선정    운영 제출 서류:별도 제출 서류 없음 기타 유익 정보:소요 기간   15~18명의 소그룹  1회 4일간 하루 6시간씩 진행 총 24시간  주관 기관:고용노동부 운영 기관:전국 고용센터 취업지원과 '), Document(metadata={'name': '2024년 전통시장 청년상인 지원사업 안내', 'source': '..\\\\data\\\\policy_result.json'}, page_content='기관:전북 정책 분야:일자리분야 지원 내용:창업지원  성장지원  판로지원 사업 신청 기간:상시 비고:상시 연령:만 18세 ~ 39세 거주지 및 소득:전통시장  상점가에서 영업  만 39세 이하 청년상인 신청 절차:지원별로 상이  첨부된 파일 참고 심사 및 발표:지원별로 상이  첨부된 파일 참고 제출 서류:지원별로 상이  첨부된 파일 참고 주관 기관: 재 청년상인육성재단 운영 기관: 재 청년상인육성재단'), Document(metadata={'name': '강남 청년의 날 행사', 'source': '..\\\\data\\\\policy_result.json'}, page_content='기관:서울 강남구 정책 분야:.권리분야 지원 내용:청년문화행사  청년정책 경진대회  체험 홍보부스 운영  사업 신청 기간:미정 비고:청년의 날 9월 셋째주 토요일  연령:만 19세 ~ 39세 거주지 및 소득:만19세~39세 청년 누구나 주관 기관:서울시 강남구 일자리정책과 청년정책팀 운영 기관:주관기관 동일'), Document(metadata={'name': '제9기 충북청년광장 구성 운영', 'source': '..\\\\data\\\\policy_result.json'}, page_content='기관:충북 정책 분야:.권리분야 지원 내용:  도정 청년정책제안 팀별 프로젝트 운영  청년정책 모니터링 활동  청년 중심 보장을 위한 간담회의  토론회  온라인 정책제안 추진 사업 운영 기간:2024. 1월 ~ 12월 사업 신청 기간:상시 비고:충북청년광장 회원모집 1월~2월    청년정책 제안 연중  연령:만 19세 ~ 39세 거주지 및 소득:도내 39세 이하 청년 신청 절차:충북청년희망센터 홈페이지 참고충북청년광장 회원모집 1월~2월  신청 심사 및 발표:충북청년희망센터 홈페이지 참고 제출 서류:충북청년희망센터 홈페이지 참고 주관 기관:충청북도 인구청년정책담당관 청년지원팀'), Document(metadata={'name': '자립준비청년 자립수당', 'source': '..\\\\data\\\\policy_result.json'}, page_content='기관:서울 정책 분야:복지.문화분야 지원 내용:최대 60개월 한도 내 매월 20일 마다 50만 원씩 신청 청년 본인 명의 계좌로 지급 사업 신청 기간:상시 비고:상시접수 연령:만 18세 이상 거주지 및 소득: 만 18세가 되어 아동복지시설   가정위탁 보호종료한 지 5년 이내인 자립준비청년   아동복지시설   아동복지법 제52조상 아동양육시설  아동일시보호시설  아동보호치료시설  공동생활가정 추가 단서 사항:    청년  19~39세 청년층 신청 절차:아동복지시설 관할 읍 면 동  본인 주민록 상 주소지 읍 면 동 통한 신청 기타 유익 정보:  다산콜센터 국번없이120   자립수당  자세한 정보는 아동권리보장원 홈페이지  나   보건복지상담센터  129 에 문의 주관 기관:서울시청 아동담당관')], [{'url': 'https://treasurehouse7.tistory.com/entry/청년내일저축계좌의-모든-것연령소득지원금신청방법', 'content': '청년내일저축계좌 요약정리1. 가입연령일 반 • 신청 당시 만 19세 ~ 만 34세 까지수급자‧차상위자 • 신청 당시 만 15세 ~ 만 39세 까지2. 근로소득 사업소득일 반 • 월 50만원 초과 ~ 230만원 이하수급자‧차상위자 • 월 10만원 이상3. 가구소득공 통 • 기준 중위소득 100% 이하4.'}, {'url': 'https://financialkorea.co.kr/2024년-청년내일저축계좌-가입-완벽-가이드-조건-나이/', 'content': '2024년 청년내일저축계좌 가입 완벽 가이드| 조건, 나이, 지원금 총정리 | 청년, 저축, 정부 지원, 재테크 - Financial Korea 2024년 청년내일저축계좌 가입 완벽 가이드| 조건, 나이, 지원금 총정리 | 청년, 저축, 정부 지원, 재테크 2024년 청년내일저축계좌 가입 완벽 설명서| 조건, 나이, 지원금 총정리 | 청년, 저축, 정부 지원, 재테크 2024년 청년내일저축계좌 가입 완벽 설명서| 조건, 나이, 지원금 총정리 | 청년, 저축, 정부 지원, 재테크 에 대해 자주 묻는 질문 TOP 5 2024년 청년내일저축계좌 가입 완벽 설명서| 조건, 나이, 지원금 총정리 | 청년, 저축, 정부 지원, 재테크 에 대해 자주 묻는 질문 TOP 5 2024년 청년내일저축계좌 가입 조건은 크게 만 나이 19세 이상 34세 이하, 소득 기준 충족, 재산 기준 충족 등으로 나눌 수 있습니다.'}]""]","청년내일저축계좌 정책의 지원대상 연령은 다음과 같습니다:

1. **일반 신청자**: 만 19세에서 만 34세까지
2. **특별 신청자**: 만 15세에서 만 39세까지 수급자 및 차상위자

따라서, 청년내일저축계좌는 만 15세 이상부터 만 39세 이하의 청년들이 신청할 수 있으며, 일반적으로는 만 19세에서 만 34세의 청년들이 주된 대상입니다."
청년내일저축계좌의 주관 기관은 어디인가요?,"['정책 이름: 청년내일저축계좌', '주관 기관:활정책과']",활정책과입니다.,"['[Document(metadata={\'name\': \'자립준비청년 자립수당\', \'source\': \'..\\\\data\\\\policy_result.json\'}, page_content=\'기관:서울 정책 분야:복지.문화분야 지원 내용:최대 60개월 한도 내 매월 20일 마다 50만 원씩 신청 청년 본인 명의 계좌로 지급 사업 신청 기간:상시 비고:상시접수 연령:만 18세 이상 거주지 및 소득: 만 18세가 되어 아동복지시설   가정위탁 보호종료한 지 5년 이내인 자립준비청년   아동복지시설   아동복지법 제52조상 아동양육시설  아동일시보호시설  아동보호치료시설  공동생활가정 추가 단서 사항:    청년  19~39세 청년층 신청 절차:아동복지시설 관할 읍 면 동  본인 주민록 상 주소지 읍 면 동 통한 신청 기타 유익 정보:  다산콜센터 국번없이120   자립수당  자세한 정보는 아동권리보장원 홈페이지  나   보건복지상담센터  129 에 문의 주관 기관:서울시청 아동담당관\'), Document(metadata={\'name\': \'재정역량UP클래스\', \'source\': \'..\\\\data\\\\policy_result.json\'}, page_content=\'기관:인천 정책 분야:복지.문화분야 지원 내용: 청년 대상 금융  부동산  재정  온 오프라인 교육 추진  청년에게 꼭 필요한 근로 근로기준법  근로계약    금융 지식 부동산 계약  재테크  저축  소비 방법   함양을 위한 온 오프라인 교육   재무교육을  과다 채무 위험 예방  안정적 재무 구축 기반 조성 사업 운영 기간:2024. 4. ~ 10. 사업 신청 기간:미정 비고:2024.4~10 연령:만 19세 ~ 39세 거주지 및 소득: 19세이상 39세 이하 인천시 청년   주민록지  재 휴학 재직 장소가 인천광역시인 청년 주관 기관:인천광역시 청년정책담당관 운영 기관:인천테크노파크\'), Document(metadata={\'name\': \'전남 청년성장프로젝트 청년카페\', \'source\': \'..\\\\data\\\\policy_result.json\'}, page_content=\'기관:전남 정책 분야:일자리분야 지원 내용:  사업내용  미취업 청년 의 구직단념을 예방하기 위해 맞춤형    청년고용정책 연계  인프라   청년의 일상 유지  심리상담 에 필요한 청년 친화적 공간  시설  인프라   이벤트 홀  공유 주방  VR 체험방  청춘 놀이터  스터디 룸  창업 연구소  비즈팩토리  소회의실       초기상담을  자 특성 파악 후 일상 생활  구직의욕 유지   개인 맞춤형  설계 제안  심리적 소진 청년에게 1 1 심리 상담 지원  후속 지원  청년일경험지원  청년도전지원사업  국민취업지원제도  국민내일배움카드  청년고용정책을 연계 지원하고  자 취업상태  지속적 관리     상세 내용   선재 업고 취업   직장 적응에 어려움을 겪은 청년  졸업 후 진로 결정에 어려움이 있는 청년에게 진로   적성 파악을 통한 경력  재 설계   못말리는 직장인   경제   금융   노동법 교육  불공정 채용이나 직장내 비즈니스 매너. 상담 화법  기초 지식 습득을  직업에  이해도를 높이고 취업  장기근속 도모를 위한 사회초년생 기본교육   꽁꽁얼어붙은면접위로 고양이가 걸어다닙니다   청년이 스스로 성장하고 싶은 목표를 달성하기 위해 지원하고 자기주도적 취업준비생을 대상으로 이력서 쓰기  AI면접  정책현장 방문을 통한 니트청년일상지원 취업워밍업   원영적 사고  전문 심리상담가가 1 1 개별 심리상담을 지원하고 심리적 회복을  일생생활 복귀  구직의욕 제고  추가적인 심층 상담 필요시 최대 10회 지원  사업 운영 기간:2024년 4월 ~ 2024년 11월 사업 신청 기간:상시 지원 규모(명):  600명 20시간 심리상담  200명 3회 비고:2024년 4월 1일 ~ 선착순 연령:만 15세 ~ 45세 거주지 및 소득:15세 ~ 45세 미취업 청년  15~18세  중  고학교 재학생  미진학 검정고시    19~45세  대학교 재학생  취업준비생 신청 절차:전화 문의  070 5001 1786   온라인 신청 네이버폼  기타 유익 정보:수료 시 선물 증정  수료증  대상에 맞는 맞춤  개설 주관 기관:고용노동부  전라남도 운영 기관: 재 전남인력개발원\'), Document(metadata={\'name\': \'은둔고립청년 무료 심리 상담 경기 \', \'source\': \'..\\\\data\\\\policy_result.json\'}, page_content=\'기관:경기 정책 분야:복지.문화분야 지원 내용:  지원내용   고립니트청년 개인 집단상담   오프라인  개인 8회기    은둔청년 개인 집단상담   온라인  2회기    은둔청년 부모상담  3회기    은둔청년 방문상담  1회기3시간     장소   사 파이나다운청년들   분당구 서현동 위치   은둔청년들 대상 비대면  방문 상담 가능    비용   무료 사업 신청 기간:상시 비고:상시모집 선착순 인원마감 연령:만 19세 ~ 34세 거주지 및 소득:  은둔과 고립에서 벗어나고 싶은 만19 34세 청년들  그 부모   거주지  활동지   성남  용인  안성  평택  오산  화성  수원  안산  김포 주관 기관:사회복지공동모금회 운영 기관: 사 파이나다운청년들 031 703 0104  www.pie edu.com \'), Document(metadata={\'name\': \'공공기관 실무형 청년인턴십 운영\', \'source\': \'..\\\\data\\\\policy_result.json\'}, page_content=\'기관:서울 도봉구 정책 분야:일자리분야 지원 내용:공공기관 실무형 청년인턴 배치  운영 9개월  사업 신청 기간:상시 연령:만 19세 ~ 45세 주관 기관:도봉구 청년미래과 운영 기관:주관기관 동일기관\')], [{\'url\': \'https://hisenior.tistory.com/entry/자산형성지원사업청년내일저축계좌-지원금-제도-자세히-알아보기\', \'content\': \'블로그 내 검색 검색 구\\xa0 분    주 요 내 용 신청기간    세부 모집일정은 주민센터 문의 신청방법    ㅇ\\xa0방문신청\\xa0:\\xa0읍면동 주민센터 ㅇ\\xa0온라인신청\\xa0:\\xa0복지로(차세대) 접수기관    주민센터 ○ 연령 현재 근로활동 중이며, 근로·사업소득이 50만원 이상~상한액 이하 (수급자·차상위자는 월 10만원 이상) 기준 중위소득 100% 이하 □ 선정 기준 지원 대상이 기존 차상위 이하 청년에서 기준 중위소득 100% 이하 가구의 저소득 근로청년까지 확대되었으며, 본인적립금(10만 원)에 대해 정부지원금(10~30만 원)을 매칭하여 지급합니다. 본인 저축액(월 10만 원) 대비 1:1 정부매칭 지원 (수급자·차상위 청년은 1:3 정부매칭 지원) ""보건복지부 자산형성지원사업(청년내일저축계좌)"" 지원금 제도가 많은 청년들에게 도움이 되기를 바라며 저축을 통해 미래를 준비하고, 안정적인 삶을 영위할 수 있는 기회를 제공받는 계기가 되길 희망합니다. \\\'지원금\\\' 카테고리의 다른 글 국민취업지원제도 지원금 제도 자세히 알아보기\\xa0\\xa0(2)   2024.11.21 국민취업지원제도 지원금 제도 자세히 알아보기\'}, {\'url\': \'https://fightloveman.co.kr/entry/2025년-청년-내일-저축-계좌-신청-방법-및-팁\', \'content\': \'청년내일저축계좌의 중요성. 청년내일저축계좌는 만 15세 이상 만 39세 이하의 청년들에게 자산 형성을 촉진하는 데 중점을 두고 설계되었습니다. 이를 통해 해당 계좌의 주요 목표는 재정적 안정성과 자립을 위한 기회를 제공하는 것입니다.\'}]']",청년내일저축계좌의 주관 기관은 보건복지부입니다. 이 제도는 만 15세 이상 만 39세 이하의 청년들에게 자산 형성을 촉진하는 데 중점을 두고 설계되었습니다.
청년내일저축계좌 신청 절차는 어떻게 되나요?,"['정책 이름: 청년내일저축계좌', '신청 절차:방문 인터넷']",방문 또는 인터넷을 통해 신청할 수 있습니다.,"[""[Document(metadata={'name': '유스타트 주택청약 종합저축 지원사업', 'source': '..\\\\data\\\\policy_result.json'}, page_content='기관:경남 정책 분야:주거분야 지원 내용:  자립준비청년의 주거 복지를 위한 주택청약종합저축 납입지원금 지원   우리은행 주택청약종합저축  청년우대형 주택청약종합저축  별도자격요건 필요  통장 개설    매월 주택청약종합저축 계좌로 2만원 자동이체   지원예산  1인당 월 2만원씩 24개월 지원  본인 자금으로 1회 납입 후 2회~25회차까지 납입금 지원    신청기간은 모집 마감시까지 사업 신청 기간:상시 비고:2024.01.16.~2024.01.24. 연령:만 19세 ~ 34세 거주지 및 소득:퇴소했거나 재원중이거나 보호가 종료된 아동 만18세~34세  1 000명 신청 절차:온라인 홈페이지 바로가기  신청 주관 기관:적십자사 운영 기관:주관기관과 동일'), Document(metadata={'name': '경상북도 2024년도 청년 신혼부부 월세 지원사업', 'source': '..\\\\data\\\\policy_result.json'}, page_content='기관:경북 정책 분야:주거분야 지원 내용:청년 신혼부부가 기납부한 월세에 대해 연소득 부부합산  구간별 차하여 최대 월 30만원 2년 을 지원하는 방식으로  보조사업자 시 군 가 신청인 본인 계좌로 반기별 6개월분  이체   월별 기준으로 실제 월세금액 임차보증금  관리비 제외 이 지원금액보다 적을  실제 월세금액만 합산하여 지급 사업 신청 기간:2024년 11월18일 ~ 2024년 12월31일  예정  비고:2024. 11월부터 ~ 예산소진시까지 연령:만 19세 ~ 39세 거주지 및 소득: 경상북도 청년 기본조례 상 청년 신혼부부  만19세이상~만39세이하 가 월세 주택  에 주민록상 같이 전입신고 되어 있고  경북도 내 임차보증금 5천만원 이하면서 월세 80만원 이하에 거주하는 연소득 부부합산  6천만원 이하인 무주택자 특화 분야:저소득층 제한없음 추가 단서 사항:  신청일 기준 혼인신고일이 5년 이내이며  신혼부부 모두 19세 이상   39세 이하가 되는 해의 1.1 12.31일로 하고  선정 이후 기준 혼인신고일  연령 조건은 초과하여도 계속 지원 가능 예시  1985. 12. 31. 출생자가 2024. 12. 31.에 신청할    신청년도 2024   출생년도 1985   39세가 되는 해로 신청 가능 1985. 12. 31. 출생자가 2025. 1. 1.에 신청할    신청년도 2025   출생년도 1985   40세가 되는 해로 신청 불가    주택법  제2조제1호에   주택   제4호에   준주택 을 포함하여 거주를 목적으로 하는 시설에 거주하는 청년 신혼부부 예시  단독주택  아파트  연립주택  다세대주택  주거용 오피스텔 업무용 제외  으로 보조사업자 시 군 가 인정하는  참여 제한 대상:  주택 소유자 분양권  입주권 포함    청년 신혼부부 이외 직계존속 형제 자매 과 같이 주민록상 전입되어 있는    직계존속 형제 자매  2촌 이내 주택 임차 배우자의 2촌 이내 혈족 포함    공공주택특별법에  공공임대주택 공공주택특별법 제4조 상 공공주택사업자가 공급하는 주택  공무원연금공단 공무원임대주택  포함  거주   임차인이 법인인  회사 지원 숙소     국민기초생활수급을 받고 있는 사람 생계  의료  주거급여 대상자    단  국민기초생활수급자 중  교육급여  대상자는 신청 가능   국가  지자체에서 시행하는 유사 월세 전세 지원사업을 수혜  사람 수혜 종료 후 신청 가능     특히  청년월세 한시 특별지원 국토부   신혼부부 임차보증금 지원사업 경북도 은 제외   국가 공사 공단 기금 포함   지자체로부터 금융지원을 받는 사람   주거안정 월세대출  청년전용 보증부월세대출  버팀목전세자금  버팀목대출  신청 절차:월세 계약자 가 온라인 신청시스템  을 하여 월세 주소지 시군으로 신청 방문 신청 불가   반드시 월세 계약자가 최초로 신청해야 하며  향후 지원 도중에 월세 계약자가 배우자로 바뀌더라도 이후 신청도 최초 신청인 아이디로 신청 서류 심사 과정에 신청인과 월세계약자 관계 확인    온라인 신청시스템   경상북도 주거복지시스템 www.gbhome.kr 에 회원가입 후 신청 신청인은 반드시 6개월 마다 구비서류를 첨부하여 신청해야 함   신청인은 6개월 총 4회 마다 경상북도 주거복지시스템으로 최초 신청과 동일하게 신청해야 지원 가능   1회차 마다 6개월 단위씩 월세 지원금을 신청하여야 하며  30일 이 지나야 1개월로 인정 단  최초 신청 이후부터는 1개월   단위로 신청 가능    1개월은 30일을 충족해야 하며 다만  2월은 28일을 충족해야 함    1개월 단위로 분할 신청은 불가하며  전세  경북도 외 지역으로 주소 변경 으로 1개월 단위 신청이 필요한  예외적으로 지급   신청인이 최초 신청 이후 도내 타 시군으로 주소지 변경이 있으면 지급기관을 달리 하여 복수로 신청하고  월세 지원 신청서는 각각 지급 기관별로 작성 제출 최초 신청시에는 제외    전입일수가 15일 이전인  새로운 거주지의 시 군으로 신청하고  전입일수가 16일 이후인  과거 거주지의 시 군으로 신청  다만  2월은 14일 이전인  새로운 거주지  15일 이후인  과거 거주지  예시  2024. 11. 01. ~ 2025. 01. 16.까지는 포항시를 지급기관으로 3개월분 신청 2025. 01. 17. ~ 2025. 04. 30.까지는 경주시를 지급기관으로 3개월분 신청 제출 서류:  월세 지원 신청서  서약서  신분증  신청인 본인 명의 통장 사본   월세 임대차계약서   6개월분 월세 납입 증빙서류     임대차계약서 전입신고 필수 는 확정일자 날인된 사본 제출    이체영수증  통장내역  제출 구두를 통한 현금 납부 불인정  은행 을  이루어진 이체만 인정    신청인과 배우자 각각 의 부 모의 가족관계증명서 2촌이내 친족 확인용      신청인 부 모 기준으로 발급    배우자 부 모 기준으로 발급   국세청 전년도 소득금액증명  신청일이 7.1. 이전인  전전년도 소득금액증명    신청인  배우자 모두 소득증빙 서류 필수 제출   소득이 발생하지 않아 소득금액증명이 발급되지 않는 에는  사실증명 신고사실없음   반드시 제출   모든 제출 서류는 신청일 기준 1개월 이내에 발급한 서류로 제출 주관 기관:경상북도 건축디자인과 운영 기관:경상북도 22개 시 군'), Document(metadata={'name': '부모급여 지원', 'source': '..\\\\data\\\\policy_result.json'}, page_content='기관:보건복지부 정책 분야:복지.문화분야 지원 내용:  0세 월 100만원  1세 월 50만원   신청 에  현금  바우처 보육료  종일제 돌봄 로 지급.   어린이집  시 영유아보육로로 신청  종일제 돌봄  시 종일제 아이돌봄으로 신청 필요   바우처 보육료  종일제아이돌봄  지원금액이 부모급여 지원금액보다 적은  차액 현금으로 지원 사업 신청 기간:2024년 01월15일 ~ 2024년 12월31일 비고:20240115~20241231 거주지 및 소득: 민국 국적을 가진 0~1세 아동을 둔 부모  22년 이후 출생아부터 지원  신청 절차:온라인 홈페이지    신청 제출 서류:  사회보장급여 신청 변경 서  출산  통합 처리 신청서   아동 명의  부모 의 명의 통장 사본 주관 기관:보건복지부 운영 기관:보건복지부'), Document(metadata={'name': '제9기 충북청년광장 구성 운영', 'source': '..\\\\data\\\\policy_result.json'}, page_content='기관:충북 정책 분야:.권리분야 지원 내용:  도정 청년정책제안 팀별 프로젝트 운영  청년정책 모니터링 활동  청년 중심 보장을 위한 간담회의  토론회  온라인 정책제안 추진 사업 운영 기간:2024. 1월 ~ 12월 사업 신청 기간:상시 비고:충북청년광장 회원모집 1월~2월    청년정책 제안 연중  연령:만 19세 ~ 39세 거주지 및 소득:도내 39세 이하 청년 신청 절차:충북청년희망센터 홈페이지 참고충북청년광장 회원모집 1월~2월  신청 심사 및 발표:충북청년희망센터 홈페이지 참고 제출 서류:충북청년희망센터 홈페이지 참고 주관 기관:충청북도 인구청년정책담당관 청년지원팀'), Document(metadata={'name': '주택 안심계약 도움 ', 'source': '..\\\\data\\\\policy_result.json'}, page_content='기관:충남 정책 분야:주거분야 지원 내용:  청년 맞춤형 부동산 전문상담  집보기 동행  사업 운영 기간:  2024 01 01~2024 12 31 사업 신청 기간:상시 비고:  상시 연령:만 19세 ~ 45세 거주지 및 소득:  충남거주  거주예정 청년 연령은 시군 사정에  다름  신청 절차:  온라인 예정   유선신청 심사 및 발표:  신청자 개별 통지 유선   주관 기관:  충청남도 운영 기관:  15개 시군')], [{'url': 'https://wealthtips.tistory.com/entry/청년내일저축계좌-조건-신청방법-완벽정리', 'content': '블로그 내 검색 검색 경제 신분증 및 기본금융상품 판매 여부 확인 일반 병사, 사회복무요원, 경찰대학 재학생, 사관학교 재학생, 소득이 없는 근로 장학금을 받는 대학생은 가입 불가 소득인정액 기준 중위소득 100% 이하인 자격자만 신청 가능 청년내일저축계좌의 지원 내용은 다음과 같습니다: 중위소득 50% 초과 ~ 100% 이하인 경우 10만원 매칭, 50% 이하인 경우 30만원 매칭 2024년 신청기간은 2024.05.01 (수)부터 2024.05.21 (화)까지이며, 신청 방법은 다음과 같습니다: 복지로 온라인 신청 교육 이수를 위해서는 자산형성포털 - my서비스 - 교육관리 - 필수교육에서 필요한 교육 내용을 수강하면 됩니다. 청년내일저축계좌는 중복 불가 대상에 속해 있습니다. 금융투자소득세란? 적정한 근로를 하지만 소득이 적은 근로자나 사업자 2024.04.30 - [경제] - 연봉별 실수령액, 연봉실수령액 연봉별 실수령액, 연봉실수령액 금융투자소득세란? 연봉별 실수령액, 연봉실수령액\\xa0\\xa0(0)   2024.04.30 금융투자소득세란? 경제 원룸 투룸 쓰리룸 좋은 방 구하는 방법'}, {'url': 'https://marroncake.tistory.com/21', 'content': '청년내일저축계좌 신청 방법과 자격 요건, 정부 지원 혜택 한눈에 알아보기 청년내일저축계좌 신청 방법과 자격 요건, 정부 지원 혜택 한눈에 알아보기 청년내일저축계좌 신청 방법과 자격 요건, 정부 지원 혜택 한눈에 알아보기 오늘은 청년내일저축계좌의 신청 방법, 자격, 소득 조건, 그리고 정부의 지원 혜택에 대해 자세히 알아보겠습니다. 이 계좌를 통해 3년간 매달 10만원씩 저축하면, 정부에서 매달 같은 금액을 추가로 지원해주기 때문에 총 720만원을 받을 수 있게 됩니다. 신청 방법 및 기간 신청 자격 및 소득 조건 기초생활수급자 또는 차상위 청년의 경우에는 매월 10만원 저축 시, 정부에서 추가로 30만원을 지원받을 수 있어요. A1: 청년내일저축계좌는 매달 10만원을 저축하면 정부도 같은 금액을 지원해주어, 총 최대 720만원을 받을 수 있습니다. A2: 온라인 신청은 복지로 홈페이지를 통해 가능하며, 5월 15일부터 26일까지 신청할 수 있습니다. 청년내일저축계좌 신청 방법과 자격 요건, 정부 지⋯ 2024.12.22'}]""]","여기 청년 및 주거 지원 정책에 대한 정보 요약입니다:

1. **유스타트 주택청약 종합저축 지원사업 (경남)**
   - **대상**: 자립준비청년 (만 19세 ~ 34세)
   - **지원내용**: 주택청약종합저축 계좌로 매월 2만원 지원 (최대 24개월)
   - **신청절차**: 온라인 신청
   - **신청기간**: 상시 (2024.01.16.~2024.01.24.)
   - **주관기관**: 적십자사

2. **경상북도 청년 신혼부부 월세 지원사업**
   - **대상**: 만 19세 ~ 39세 신혼부부
   - **지원내용**: 월세 지원 (최대 월 30만원, 2년간)
   - **신청기간**: 2024년 11월 18일 ~ 2024년 12월 31일
   - **신청절차**: 온라인 신청 (경상북도 주거복지시스템)
   - **주관기관**: 경상북도 건축디자인과

3. **부모급여 지원**
   - **대상**: 0~1세 아동을 둔 부모
   - **지원내용**: 0세 월 100만원, 1세 월 50만원
   - **신청기간**: 2024년 01월 15일 ~ 2024년 12월 31일
   - **신청절차**: 온라인 신청
   - **주관기관**: 보건복지부

4. **충북청년광장 구성 운영**
   - **대상**: 만 19세 ~ 39세 청년
   - **내용**: 청년정책 제안 및 모니터링 활동
   - **신청절차**: 충북청년희망센터 홈페이지 참고
   - **주관기관**: 충청북도 인구청년정책담당관

5. **주택 안심계약 도움 (충남)**
   - **대상**: 만 19세 ~ 45세 청년
   - **지원내용**: 부동산 전문 상담 및 집보기 동행
   - **신청기간**: 상시
   - **신청절차**: 온라인 신청 예정
   - **주관기관**: 충청남도

이 외에도 청년내일저축계좌와 같은 다양한 지원 프로그램이 존재하며, 각각의 자격 요건 및 신청 방법은 상이하니 자세한 내용은 관련 기관의 공식 웹사이트를 참고하시기 바랍니다."
2024년도 창업성장기술개발사업 디딤돌 첫걸음 창업전문기관 R&D 과제를 주관하는 기관은 어디인가요?,"['정책 이름: 2024년도 창업성장기술개발사업 디딤돌 첫걸음 창업전문기관 R D 과제 모집 공고', '주관 기관: 재 경북테크노파크']",재 경북테크노파크,"[""[Document(metadata={'name': '2024년도 창업성장기술개발사업 디딤돌 첫걸음 창업전문기관 R D 과제 모집 공고', 'source': '..\\\\data\\\\policy_result.json'}, page_content='기관:경북 정책 분야:일자리분야 지원 내용:  지원내용   창업 초기 스타트업 발굴  추천  R D  사업화 지원   사업설명회   2024.8.7. 수  13 30 ~ 17 00   경북테크노파크 국제회의실    사업설명회 사전록    https   naver.me 5jJ2sSuo  사업 운영 기간:2024 07 19~2025 03 31 사업 신청 기간:미정 지원 규모(명):  지원대상   창업 7년 이하이면서  최근년도 매출액 20억 미만인 창업기업으로 중소벤처기업부 R D를 처음 하는 기업  주요내용   1  최대 1.2억원 이내 자금 지원  2  차년도 R D 기획 컨설팅  투자 역량강화 교육   재 경   비고:2024 08 16~2024 08 30 추가 단서 사항:  신청방법   SMTECH 홈페이지 통한 접수  kaqd5x  주관 기관: 재 경북테크노파크 운영 기관: 재 경북테크노파크 혁신기업지원센터'), Document(metadata={'name': '탐나는 디지털 창작소 운영사업', 'source': '..\\\\data\\\\policy_result.json'}, page_content='기관:제주 정책 분야:복지.문화분야 지원 내용: 제주특별자치도경제통상진흥원 2024년 탐나는 디지털 창작소 운영사업   지원내용    대표 내용   지원 대상자    예비 창업자 대학생 을 대상으로 독창적인 아이디어와 창업연계     열린공간   디지털 장비 교육 시제품 제작  사업화 지원    예비창업자   지원받을 수 있는 사항    디지털 제조장비 활용 기본교육  연중수시     예비창업자  창작자의 시제품제작  창업공간  네트워킹 지원    3D프린터  레이저커터  디지털 장비를 누구나 활용할 수 있도록 교육  네트워킹 공간을 조성함으로써   지역의 지식 제조업 육성 기반 마련   지원상세    더 자세한 내용은 제주특별자치도 경제진흥통상원 알아보기  index.php 사업 신청 기간:2024년 01월01일 ~ 2024년 12월31일 비고:사업기간2024 01 01 ~ 2024 12 31 운영기간2024 01 01 ~ 2024 12 31 신청기간2024 01 01 ~ 2024 12 31 연령:만 19세 ~ 39세 추가 단서 사항:지역기준   제주도  제주시  서귀포시 주관 기관:제주특별자치도경제통상진흥원   기업성장팀 운영 기관:제주특별자치도경제통상진흥원'), Document(metadata={'name': '청년창업LAB 교육  매월  G 테크샵   메이크스페이스 전문랩 ', 'source': '..\\\\data\\\\policy_result.json'}, page_content='기관:경북 구미시 정책 분야:일자리분야 지원 내용:  교육장소   창년창업LAB  구미시 산동읍 첨단기업1리 17    교육분야    하드웨어LAB   레이저커팅기  레이저각인기     컨텐츠LAB   카메라사용  현수막  스티커 제작     식품LAB   수제쿠키  케이크  타르트 만들기     공예LAB   도자기  유리전사  섬유 자수 공예    자세한 교육 내용은 홈페이지 참조  교육비 무료  교육별 재료비 발생할 수 있음  사업 운영 기간:2024 03 01~2024 12 31 사업 신청 기간:미정 지원 규모(명):창업에 관심 있는 구미시민  39세 이하 예비창업자 대상으로 청년창업LAB 장비 활용 교육을 진행하고 무상 권한을 드리고 있습니다. 비고:2024 04 01~2024 11 29 주관 기관:구미시청 인구청년과 운영 기관:구미전자정보기술원'), Document(metadata={'name': '해양바이오 전문인력양성사업', 'source': '..\\\\data\\\\policy_result.json'}, page_content='기관:경북 정책 분야:.권리분야 지원 내용:  사업내용   해양바이오 전문혁신인재 양성을 위한 현장실습과정 운영   현장실습 해양 실험  장비사용법  을 통한 체험교육  현장견학교육  전문가초청강연 세미나      사업기간   2024.1.1~12.31    위 치   환동해산업연구원 울진군 죽변면 해양과학길 22  사업 운영 기간:2024 01 01~2024 12 31 사업 신청 기간:미정 지원 규모(명):  사 업 량   24주 교육  현장실습 o 사 업 비   64백만원 비고:2024.01.01~ 주관 기관:경상북도 운영 기관:환동해산업연구원'), Document(metadata={'name': '청년 창업지원자금 융자지원', 'source': '..\\\\data\\\\policy_result.json'}, page_content='기관:충북 정책 분야:일자리분야 지원 내용:  지원분야  업종   신성장동력산업  고부가가치 창업분야 집중 지원지식창업   지식콘텐츠  통신업  웹디자인  컴퓨터프로그래밍 기술창업   기계  재료  전기  전자  정보  통신  화공  섬유 일반창업   통신판매업  유통업 도매업   아이디어 창업    1인 1분야만 지원 협업자   중복 지원신청시 지원 제외    지원조건   융자금리 연 3.0%  고정   융자기간 1년거치 4년균분상환   융자한도 1억원 이내    여성기업  장애인기업 0.5%금리우대  사업 운영 기간:2024. 1. 15. ~ 자금소진시까지 사업 신청 기간:상시 지원 규모(명):  지원조건   융자금리 연 3.0%  고정   융자기간 1년거치 4년균분상환   융자한도 1억원 이내    여성기업  장애인기업 0.5%금리우대  비고:2024. 1. 15. ~ 자금소진시까지 연령:만 20세 ~ 39세 거주지 및 소득:충청북도 거주자로 신규창업  창업 5년 이내인 자 학력:없음 전공:없음 취업 상태:충청북도 거주자로 신규창업  창업 5년 이내인 자 특화 분야:신성장동력산업  고부가가치 창업분야 집중 지원 추가 단서 사항:없음 참여 제한 대상:없음 신청 절차:충청북도 기업진흥원 공고 확인 심사 및 발표:충청북도 기업진흥원 공고 확인 제출 서류:충청북도 기업진흥원 공고 확인 주관 기관:충청북도 경제기업과 기업정책팀')], [{'url': 'https://startup.ssu.ac.kr/board/notice/3552', 'content': '2024년 창업성장기술개발 디딤돌 첫걸음 창업전문기관 R&D 추천과제 모집 | 숭실대학교 창업지원단 2024년 창업성장기술개발 디딤돌 첫걸음 창업전문기관 R&D 추천과제 모집 (공고 제2024-436호) 2024년도 창업성장기술개발사업(디딤돌) 제3차(하반기) 시행계획 공고(안).pdf (506.87 kB) (서울테크노파크) 창업전문기관 R&D 기관별 과제 모집 공고.hwp (93.50 kB) (재)서울테크노파크는 2024년 창업성장기술개발사업 디딤돌 첫걸음 운영기관으로 창업전문기관 R&D 추천과제를 모집하고 있으니, 아래의 내용을 참고하시기 바랍니다. 가. 사업명 : 2024년 창업성장기술개발사업 디딤돌 창업전문기관 R&D 운영 - 공 고 명 : 2024년도 창업성장기술개발사업 디딤돌 첫걸음 창업전문기관 R&D 과제 모집 공고 - 지원대상 : ｢중소기업기본법｣ 제2조에 따른 중소기업 중 창업 7년 이하이고, 최근년도 매출액 20억원 미만이면서, 중소벤처기업부 R&D를 처음 수행하는 기업 [숭실대학교 창업지원단] 석·박사급 실험실 창업스쿨 프로그램 참여자 모집2024.08.06 서울특별시 동작구 상도로 369 숭실대학교 벤처중소기업센터 409호 학교법인 숭실대학교 숭실대학교 글로벌미래교육원 숭실대학교 총동문회 숭실대학교 중앙도서관 숭실대학교'}, {'url': 'https://kustartup.korea.ac.kr/program/programView.do?seq=477', 'content': 'KU Startup 고려대학교 창업종합포털 [인덕대학교] 2024년 창업성장기술개발 디딤돌 첫걸음 창업전문기관 R&D 추천과제 모집 등록일2024.08.12(월) 신청기간2024.08.16(금) ~ 2024.08.30(금) 조회수 360 [인덕대학교] 2024년 창업성장기술개발 디딤돌 첫걸음 창업전문기관 R&D 추천과제 모집 - 신청기간: 2024년 8월 16일(금) ~ 8월 30일(금) 18:00 - 지원대상:「중소기업기본법」제2조에 따른 중소기업 중 창업 7년 이하이고, 최근년도 매출액 20억원 미만이면서, 중소벤처기업부 R&D과제를 처음 수행하는 기업 1. (공고문)2024년도 창업성장기술개발사업(디딤돌) 제3차(하반기) 시행계획 공고(안) 1부. 2. (인덕대학교) 창업전문기관 R&D 기관별 과제 모집 공고 1부. 4. 디딤돌(첫걸음_창업전문기관 R&D) 세부 지원내용 1부. 첨부파일▶ 붙임1.(공고_제2024-436호)_2024년도_창업성장기술개발사업(디딤돌)_제3차(하반기)_시행계획_공고(안).pdf▶ 붙임2.(인덕대학교)_창업전문기관 RnD 기관별 과제 모집 공고.hwp▶ 붙임3.신청방법_및_신청_또는_지원_제외사항_등_유의사항(SMTECH_접수과제).pdf▶ 붙임4.디딤돌(첫걸음_창업전문기관RnD) 세부 지원내용.pdf▶ 붙임5.신청서식(디딤돌 3차).zip (02841) 서울특별시 성북구 안암로 145 고려대학교 크림슨창업지원단 (145, Anam-ro, Seongbuk-gu, Seoul, 02841 Republic of Korea)\\xa0\\xa0\\xa0TEL : 02.3290.4000\\xa0\\xa0\\xa0E-MAIL : startup@korea.ac.kr Copyright (C) 2022 Korea University.'}]""]","2024년도 창업성장기술개발사업 디딤돌 첫걸음 창업전문기관 R&D 과제를 주관하는 기관은 경북테크노파크입니다. 이 사업은 창업 7년 이하이며 최근년도 매출액이 20억 미만인 중소기업을 대상으로 하며, 중소벤처기업부의 R&D를 처음 수행하는 기업을 지원합니다."
2024년도 창업성장기술개발사업 디딤돌 첫걸음 창업전문기관 R&D 과제의 사업 운영 기간은 언제인가요?,"['정책 이름: 2024년도 창업성장기술개발사업 디딤돌 첫걸음 창업전문기관 R D 과제 모집 공고', '사업 운영 기간:2024 07 19 2025 03 31']",2024년 7월 19일부터 2025년 3월 31일까지,"[""[Document(metadata={'name': '2024년도 창업성장기술개발사업 디딤돌 첫걸음 창업전문기관 R D 과제 모집 공고', 'source': '..\\\\data\\\\policy_result.json'}, page_content='기관:경북 정책 분야:일자리분야 지원 내용:  지원내용   창업 초기 스타트업 발굴  추천  R D  사업화 지원   사업설명회   2024.8.7. 수  13 30 ~ 17 00   경북테크노파크 국제회의실    사업설명회 사전록    https   naver.me 5jJ2sSuo  사업 운영 기간:2024 07 19~2025 03 31 사업 신청 기간:미정 지원 규모(명):  지원대상   창업 7년 이하이면서  최근년도 매출액 20억 미만인 창업기업으로 중소벤처기업부 R D를 처음 하는 기업  주요내용   1  최대 1.2억원 이내 자금 지원  2  차년도 R D 기획 컨설팅  투자 역량강화 교육   재 경   비고:2024 08 16~2024 08 30 추가 단서 사항:  신청방법   SMTECH 홈페이지 통한 접수  kaqd5x  주관 기관: 재 경북테크노파크 운영 기관: 재 경북테크노파크 혁신기업지원센터'), Document(metadata={'name': '해양바이오 전문인력양성사업', 'source': '..\\\\data\\\\policy_result.json'}, page_content='기관:경북 정책 분야:.권리분야 지원 내용:  사업내용   해양바이오 전문혁신인재 양성을 위한 현장실습과정 운영   현장실습 해양 실험  장비사용법  을 통한 체험교육  현장견학교육  전문가초청강연 세미나      사업기간   2024.1.1~12.31    위 치   환동해산업연구원 울진군 죽변면 해양과학길 22  사업 운영 기간:2024 01 01~2024 12 31 사업 신청 기간:미정 지원 규모(명):  사 업 량   24주 교육  현장실습 o 사 업 비   64백만원 비고:2024.01.01~ 주관 기관:경상북도 운영 기관:환동해산업연구원'), Document(metadata={'name': '탐나는 디지털 창작소 운영사업', 'source': '..\\\\data\\\\policy_result.json'}, page_content='기관:제주 정책 분야:복지.문화분야 지원 내용: 제주특별자치도경제통상진흥원 2024년 탐나는 디지털 창작소 운영사업   지원내용    대표 내용   지원 대상자    예비 창업자 대학생 을 대상으로 독창적인 아이디어와 창업연계     열린공간   디지털 장비 교육 시제품 제작  사업화 지원    예비창업자   지원받을 수 있는 사항    디지털 제조장비 활용 기본교육  연중수시     예비창업자  창작자의 시제품제작  창업공간  네트워킹 지원    3D프린터  레이저커터  디지털 장비를 누구나 활용할 수 있도록 교육  네트워킹 공간을 조성함으로써   지역의 지식 제조업 육성 기반 마련   지원상세    더 자세한 내용은 제주특별자치도 경제진흥통상원 알아보기  index.php 사업 신청 기간:2024년 01월01일 ~ 2024년 12월31일 비고:사업기간2024 01 01 ~ 2024 12 31 운영기간2024 01 01 ~ 2024 12 31 신청기간2024 01 01 ~ 2024 12 31 연령:만 19세 ~ 39세 추가 단서 사항:지역기준   제주도  제주시  서귀포시 주관 기관:제주특별자치도경제통상진흥원   기업성장팀 운영 기관:제주특별자치도경제통상진흥원'), Document(metadata={'name': '지역특화 청년 무역전문가 양성', 'source': '..\\\\data\\\\policy_result.json'}, page_content='기관:충남 정책 분야:일자리분야 지원 내용:  도내 수출기업 해외전시회 참가지원 사업 운영 기간:  2024 01 01~2024 12 31 사업 신청 기간:2024년 06월01일 ~ 2024년 12월31일  예정  지원 규모(명):  1개 대학  350명 비고:  2024 01 01~2024 12 31 연령:만 18세 ~ 39세 학력:  대학재학 취업 상태:  미취업자 신청 절차:  순천향대학교 홈페이지에 접속하여 신청서 제출 심사 및 발표:  개별 통보 주관 기관:  투자통상정책관 운영 기관:  순천향대학교 산학협력단 GTEP사업단'), Document(metadata={'name': '월드잡플러스 해외통합정보망 ', 'source': '..\\\\data\\\\policy_result.json'}, page_content='기관:고용노동부 정책 분야:일자리분야 사업 운영 기간:2024.1.1.~12.31. 사업 신청 기간:2024년 01월01일 ~ 2024년 12월31일 비고:상시 연령:만 0세 ~ 99세 신청 절차:개인회원 가입 주관 기관:고용노동부 운영 기관:한국산업인력공단')], [{'url': 'https://startup.ssu.ac.kr/board/notice/3552', 'content': '2024년 창업성장기술개발 디딤돌 첫걸음 창업전문기관 R&D 추천과제 모집 | 숭실대학교 창업지원단 2024년 창업성장기술개발 디딤돌 첫걸음 창업전문기관 R&D 추천과제 모집 (공고 제2024-436호) 2024년도 창업성장기술개발사업(디딤돌) 제3차(하반기) 시행계획 공고(안).pdf (506.87 kB) (서울테크노파크) 창업전문기관 R&D 기관별 과제 모집 공고.hwp (93.50 kB) (재)서울테크노파크는 2024년 창업성장기술개발사업 디딤돌 첫걸음 운영기관으로 창업전문기관 R&D 추천과제를 모집하고 있으니, 아래의 내용을 참고하시기 바랍니다. 가. 사업명 : 2024년 창업성장기술개발사업 디딤돌 창업전문기관 R&D 운영 - 공 고 명 : 2024년도 창업성장기술개발사업 디딤돌 첫걸음 창업전문기관 R&D 과제 모집 공고 - 지원대상 : ｢중소기업기본법｣ 제2조에 따른 중소기업 중 창업 7년 이하이고, 최근년도 매출액 20억원 미만이면서, 중소벤처기업부 R&D를 처음 수행하는 기업 [숭실대학교 창업지원단] 석·박사급 실험실 창업스쿨 프로그램 참여자 모집2024.08.06 서울특별시 동작구 상도로 369 숭실대학교 벤처중소기업센터 409호 학교법인 숭실대학교 숭실대학교 글로벌미래교육원 숭실대학교 총동문회 숭실대학교 중앙도서관 숭실대학교'}, {'url': 'https://www.mss.go.kr/site/smba/ex/bbs/View.do?cbIdx=310&bcIdx=1052189', 'content': '본문 바로가기 이 누리집은 대한민국 공식 전자정부 누리집입니다. 어린이 홈페이지 영문 홈페이지 중소벤처기업부 중소벤처기업부 블로그 중소벤처기업부 페이스북 중소벤처기업부 인스타그램 중소벤처기업부 트위터 중소벤처기업부 유튜브 통합 검색 통합검색 검색 주요정책 알림소식 통계자료 민원ㆍ신고 정보공개 기관 소개 전체메뉴 사업공고 공유하기 인쇄하기 알림소식 목록 펼치기 새소식 목록 펼치기 사업공고 목록 펼치기 2024년도 창업성장기술개발사업 디딤돌 과제 제3차(하반기) 시행계획 공고 사업공고 - 공고번호,신청기간,담당부서,등록일,첨부파일,내용,키워드 항목을 나타내는 표입니다. 공고번호    제2024-436호  신청기간    2024-08-16 ~ 2024-08-30 담당부서    기술개발과   등록일 2024.07.30 첨부파일   hwp 파일 (공고_제2024-436호)_2024년도_창업성장기술개발사업(디딤돌)_제3차(하반기)_시행계획_공고(안).hwpx [194.16 KB] 바로보기 내려받기 hwp 파일 [붙임1]_신청방법_및_신청_또는_지원_제외사항_등_유의사항(SMTECH_접수과제).hwpx [93.23 KB] 바로보기 내려받기 hwp 파일 [붙임2]_디딤돌(도약_글로벌R&D)_세부_지원내용.hwpx [135.75 KB] 바로보기 내려받기 hwp 파일 [붙임2]_디딤돌(첫걸음_성장네트워크_R&D)_세부_지원내용.hwpx [111.08 KB] [붙임2]_디딤돌(첫걸음_창업전문기관R&D)_세부_지원내용.hwpx [104.41 KB] 키워드  바로가기 서비스 중소벤처기업부 30121세종특별자치시 가름로 180, 세종파이낸스센터 3차 중소벤처기업부 4층 ~ 6층 / 대표전화 : 국번없이 1357 COPYRIGHT ⓒ 중소벤처기업부.'}]""]",2024년도 창업성장기술개발사업 디딤돌 첫걸음 창업전문기관 R&D 과제의 사업 운영 기간은 2024년 7월 19일부터 2025년 3월 31일까지입니다.
2024년도 창업성장기술개발사업 디딤돌 첫걸음 창업전문기관 R&D 과제의 지원 대상은 누구인가요?,"['정책 이름: 2024년도 창업성장기술개발사업 디딤돌 첫걸음 창업전문기관 R D 과제 모집 공고', '지원 대상: 창업 7년 이하이면서 최근년도 매출액 20억 미만인 창업기업으로 소벤처기업부 R D를 처음 하는 기업']",창업 7년 이하이면서 최근년도 매출액 20억 미만인 창업기업으로 소벤처기업부 R&D를 처음 하는 기업,"['[Document(metadata={\'name\': \'2024년도 창업성장기술개발사업 디딤돌 첫걸음 창업전문기관 R D 과제 모집 공고\', \'source\': \'..\\\\data\\\\policy_result.json\'}, page_content=\'기관:경북 정책 분야:일자리분야 지원 내용:  지원내용   창업 초기 스타트업 발굴  추천  R D  사업화 지원   사업설명회   2024.8.7. 수  13 30 ~ 17 00   경북테크노파크 국제회의실    사업설명회 사전록    https   naver.me 5jJ2sSuo  사업 운영 기간:2024 07 19~2025 03 31 사업 신청 기간:미정 지원 규모(명):  지원대상   창업 7년 이하이면서  최근년도 매출액 20억 미만인 창업기업으로 중소벤처기업부 R D를 처음 하는 기업  주요내용   1  최대 1.2억원 이내 자금 지원  2  차년도 R D 기획 컨설팅  투자 역량강화 교육   재 경   비고:2024 08 16~2024 08 30 추가 단서 사항:  신청방법   SMTECH 홈페이지 통한 접수  kaqd5x  주관 기관: 재 경북테크노파크 운영 기관: 재 경북테크노파크 혁신기업지원센터\'), Document(metadata={\'name\': \'탐나는 디지털 창작소 운영사업\', \'source\': \'..\\\\data\\\\policy_result.json\'}, page_content=\'기관:제주 정책 분야:복지.문화분야 지원 내용: 제주특별자치도경제통상진흥원 2024년 탐나는 디지털 창작소 운영사업   지원내용    대표 내용   지원 대상자    예비 창업자 대학생 을 대상으로 독창적인 아이디어와 창업연계     열린공간   디지털 장비 교육 시제품 제작  사업화 지원    예비창업자   지원받을 수 있는 사항    디지털 제조장비 활용 기본교육  연중수시     예비창업자  창작자의 시제품제작  창업공간  네트워킹 지원    3D프린터  레이저커터  디지털 장비를 누구나 활용할 수 있도록 교육  네트워킹 공간을 조성함으로써   지역의 지식 제조업 육성 기반 마련   지원상세    더 자세한 내용은 제주특별자치도 경제진흥통상원 알아보기  index.php 사업 신청 기간:2024년 01월01일 ~ 2024년 12월31일 비고:사업기간2024 01 01 ~ 2024 12 31 운영기간2024 01 01 ~ 2024 12 31 신청기간2024 01 01 ~ 2024 12 31 연령:만 19세 ~ 39세 추가 단서 사항:지역기준   제주도  제주시  서귀포시 주관 기관:제주특별자치도경제통상진흥원   기업성장팀 운영 기관:제주특별자치도경제통상진흥원\'), Document(metadata={\'name\': \'해양바이오 전문인력양성사업\', \'source\': \'..\\\\data\\\\policy_result.json\'}, page_content=\'기관:경북 정책 분야:.권리분야 지원 내용:  사업내용   해양바이오 전문혁신인재 양성을 위한 현장실습과정 운영   현장실습 해양 실험  장비사용법  을 통한 체험교육  현장견학교육  전문가초청강연 세미나      사업기간   2024.1.1~12.31    위 치   환동해산업연구원 울진군 죽변면 해양과학길 22  사업 운영 기간:2024 01 01~2024 12 31 사업 신청 기간:미정 지원 규모(명):  사 업 량   24주 교육  현장실습 o 사 업 비   64백만원 비고:2024.01.01~ 주관 기관:경상북도 운영 기관:환동해산업연구원\'), Document(metadata={\'name\': \'청년 창업지원자금 융자지원\', \'source\': \'..\\\\data\\\\policy_result.json\'}, page_content=\'기관:충북 정책 분야:일자리분야 지원 내용:  지원분야  업종   신성장동력산업  고부가가치 창업분야 집중 지원지식창업   지식콘텐츠  통신업  웹디자인  컴퓨터프로그래밍 기술창업   기계  재료  전기  전자  정보  통신  화공  섬유 일반창업   통신판매업  유통업 도매업   아이디어 창업    1인 1분야만 지원 협업자   중복 지원신청시 지원 제외    지원조건   융자금리 연 3.0%  고정   융자기간 1년거치 4년균분상환   융자한도 1억원 이내    여성기업  장애인기업 0.5%금리우대  사업 운영 기간:2024. 1. 15. ~ 자금소진시까지 사업 신청 기간:상시 지원 규모(명):  지원조건   융자금리 연 3.0%  고정   융자기간 1년거치 4년균분상환   융자한도 1억원 이내    여성기업  장애인기업 0.5%금리우대  비고:2024. 1. 15. ~ 자금소진시까지 연령:만 20세 ~ 39세 거주지 및 소득:충청북도 거주자로 신규창업  창업 5년 이내인 자 학력:없음 전공:없음 취업 상태:충청북도 거주자로 신규창업  창업 5년 이내인 자 특화 분야:신성장동력산업  고부가가치 창업분야 집중 지원 추가 단서 사항:없음 참여 제한 대상:없음 신청 절차:충청북도 기업진흥원 공고 확인 심사 및 발표:충청북도 기업진흥원 공고 확인 제출 서류:충청북도 기업진흥원 공고 확인 주관 기관:충청북도 경제기업과 기업정책팀\'), Document(metadata={\'name\': \'청년창업LAB 교육  매월  G 테크샵   메이크스페이스 전문랩 \', \'source\': \'..\\\\data\\\\policy_result.json\'}, page_content=\'기관:경북 구미시 정책 분야:일자리분야 지원 내용:  교육장소   창년창업LAB  구미시 산동읍 첨단기업1리 17    교육분야    하드웨어LAB   레이저커팅기  레이저각인기     컨텐츠LAB   카메라사용  현수막  스티커 제작     식품LAB   수제쿠키  케이크  타르트 만들기     공예LAB   도자기  유리전사  섬유 자수 공예    자세한 교육 내용은 홈페이지 참조  교육비 무료  교육별 재료비 발생할 수 있음  사업 운영 기간:2024 03 01~2024 12 31 사업 신청 기간:미정 지원 규모(명):창업에 관심 있는 구미시민  39세 이하 예비창업자 대상으로 청년창업LAB 장비 활용 교육을 진행하고 무상 권한을 드리고 있습니다. 비고:2024 04 01~2024 11 29 주관 기관:구미시청 인구청년과 운영 기관:구미전자정보기술원\')], [{\'url\': \'https://svhc.or.kr/Notice/?bmode=view&idx=57947825\', \'content\': \'2024년도 창업성장기술개발사업 디딤돌 첫걸음 창업전문기관 R&D 과제 모집공고 : 공지사항 알림 알림 설정 입주기업 현 입주기업 서울소셜벤처허브 입주기업 현 입주기업 서울소셜벤처허브 2024년도 창업성장기술개발사업 디딤돌 첫걸음 창업전문기관 R&D 과제 모집공고 허브소식 > 공지사항 # 2024년도 창업성장기술개발사업 디딤돌 첫걸음 창업전문기관 R&D 과제 모집공고 안내 - 공 고 명 : 2024년도 창업성장기술개발사업 디딤돌 첫걸음 창업전문기관 R&D 과제 모집 공고 (공고 제2024-436호) 2024년도 창업성장기술개발사업(디딤돌) 제3차(하반기) 시행계획 공고(안).pdf 506KB (서울테크노파크) 창업전문기관 R&D 기관별 과제 모집 공고.hwp 93KB 신청방법 및 신청 또는 지원 제외사항 등 유의사항(SMTECH 접수과제).pdf 293KB 서울특별시 강남구 선릉로93길 40(역삼동 704-45), Copyright 2023 ⓒ 서울소셜벤처허브, ALL Rights reserved 서울특별시 강남구 선릉로93길 40(역삼동 704-45), 나라키움 역삼A빌딩 3~4층 대표자 : 서영우\\xa0 \\xa0 \\xa0성장지원팀 : 02-6230-0306 \\xa0 \\xa0 경영지원팀 : 02-6230-0303 \\xa0 \\xa0 FAX : 02-6230-0307 \\xa0 \\xa0 E-mail : svhc@svhc.or.kr Copyright 2023 ⓒ 서울소셜벤처허브, ALL Rights reserved\'}, {\'url\': \'https://www.bizinfo.go.kr/web/lay1/bbs/S1T122C128/AS/74/view.do?pblancId=PBLN_000000000094750\', \'content\': \'기업마당>정책정보>지원사업 공고 지원사업 공고 저작권 정책 웹접근성 정책 폰트 작게 폰트 크게 지원사업 공고 지원사업 공고 2024년 1차(상반기) 창업성장기술개발사업 디딤돌 과제 시행계획 공고 ☞ 「중소기업기본법」 제2조에 따른 중소기업 중 창업 7년 이하이고, 최근년도 매출액 20억원 미만인 기업 사업신청 방법 사업신청 사이트 2024년 1차(상반기) 창업성장기술개발사업 디딤돌 과제 시행계획 공고 # 해시태그 목록 #첫걸음#2024#도약#디딤돌#예비유니콘#메인비즈#이노비즈#장애인기업#벤처기업#창업기업#여성기업#기술개발#중소기업기술정보진흥원#중소벤처기업부#R&D#제주#경남#경북#전남#전북#충남#충북#강원#경기#세종#울산#대전#광주#인천#대구#부산#서울#창업#기술 (공고_제2024-114호)_2024년도_창업성장기술개발사업(디딤돌)_제1차(상반기)_시행계획_공고(안).pdf 스크랩 링크복사 QR코드 출처 바로가기 이 공고를 열람한 사용자가 함께 본 공고 2025년 지역특화 프로젝트 레전드 50+ 지원사업 통합 수정 공고 2025년 중소벤처기업부 소관 소상공인 정책자금 융자계획 공고 2025년 중소기업 정책자금 융자계획 공고 2025년 코리아 나라장터 엑스포 전시회 참가기업 모집 공고(공공시장 진출 프로그램) 2025년 중소기업 유공자 포상 신청 연장 공고 2025년 재도전성공패키지 주관기관 모집 공고 목록; ""목록으로 이동"") 앱스토어 사용자 및 플레이스토어 사용자 별 QR 코드 안내 테이블\'}]']","2024년도 창업성장기술개발사업 디딤돌 첫걸음 창업전문기관 R&D 과제의 지원 대상은 다음과 같습니다:

1. **창업 7년 이하**인 기업
2. **최근년도 매출액이 20억 원 미만**인 기업
3. **중소벤처기업부 R&D를 처음 하는 기업**

이러한 조건을 충족하는 창업기업이 해당 사업에 신청할 수 있습니다."
울산 남구 문화예술창작촌 운영의 주관 기관은 어디인가요?,"['정책 이름: 울산 남구 문화예술창작촌 운영', '주관 기관: 울산광역 남구 문화예술과 052 226 5422']",울산광역 남구 문화예술과,"['[Document(metadata={\'name\': \'울산 남구 거리음악회 운영\', \'source\': \'..\\\\data\\\\policy_result.json\'}, page_content=\'기관:울산 남구 정책 분야:복지.문화분야 지원 내용:  장소   남구 관내 주요거리  고래문화특구    주요내용   거리공연 추진으로 도심 속 시민 문화향유 활성화 사업 운영 기간:2024. 3. ~ 12. 사업 신청 기간:상시 신청 절차:  문의   울산광역시 남구 문화예술과 052 226 5422 주관 기관:울산광역시 남구 문화예술과 052 226 5422 운영 기관:주관기관과 동일\'), Document(metadata={\'name\': \'울산 북구 스트레스 해소를 위한 워라하 저녁  운영\', \'source\': \'..\\\\data\\\\policy_result.json\'}, page_content=\'기관:울산 북구 정책 분야:복지.문화분야 지원 내용:  장소   문화예술회관 2층 강의실 4개소    운영인력   담당강사 10명 정도   운영방법   매주 1회 수업 18 00 ~ 20 00    내용   직장인 하모니카  9개    음악반   기타  하모니카  바이올린   미술반   한글 한서문예  소묘 여행스케치  수체화 유화   무용반   요가  국선도 사업 운영 기간:  사업기간   연중 3개월 과정  4기  사업 신청 기간:상시 주관 기관:울산광역시 북구 문화예술회관 예술사업팀 052 241 7353  운영 기관:주관기관과 동일\'), Document(metadata={\'name\': \'울산 남구 문화예술창작촌 운영\', \'source\': \'..\\\\data\\\\policy_result.json\'}, page_content=\'기관:울산 남구 정책 분야:복지.문화분야 지원 내용:  장생포 아트스테이   소재지   장생포고래로 139번길 5 15   운영시간   화 ~ 일 09 00 ~ 18 00 매주 월  공휴일 휴무    주요활동   예술가 레지던시 7명   원데이클래스  전시 공연  북카페     창작스튜디오 장생포고래로 131   소재지   장생포고래로 131   운영시간   화 ~ 일 09 00 ~ 18 00 매주 월  공휴일 휴무    주요활동   예술가 레지던시 3명   작품전시 사업 신청 기간:상시 연령:만 19세 ~ 39세 주관 기관:울산광역시 남구 문화예술과 052 226 5422  운영 기관:주관기관과 동일\'), Document(metadata={\'name\': \'울산 북구 청년층을 위한 도서관  운영\', \'source\': \'..\\\\data\\\\policy_result.json\'}, page_content=\'기관:울산 북구 정책 분야:복지.문화분야 지원 내용:  위치   구립도서관 7개관   내용   도서관 주간 행사  청년의 날 특강  운영   청년의 관심사를 반영한 체험   인문학  운영 사업 운영 기간:  사업기간   도서관주관  청년의 날 9. 16.  사업 신청 기간:상시 연령:만 19세 ~ 39세 주관 기관:구립도서관 중앙도서관팀 052 241 7453    농소1동도서관팀 052 241 7441  운영 기관:주관기관과 동일\'), Document(metadata={\'name\': \'울산 문화예술교육사 인턴십 지원사업\', \'source\': \'..\\\\data\\\\policy_result.json\'}, page_content=\'기관:울산 정책 분야:일자리분야 지원 내용:  지원내용   문화예술교육사 채용지원  기관별 특화  운영   주관기관   울산문화관광재단 사업 운영 기간:2024. 1. ~ 12. 사업 신청 기간:상시 연령:만 19세 ~ 39세 거주지 및 소득:만 19세 이상 39세 이하 문화예술교육사 자격증 소지자   문화예술교육사 자격증 취득 후 3년 미만인 자 우대 주관 기관:울산광역시 문화예술과 문예총괄팀 052 229 3724  운영 기관:울산문화관광재단\')], [{\'url\': \'https://www.uwcf.or.kr/namguart/intro/intro1_1\', \'content\': \'본문 바로가기 주메뉴 바로가기 페이지하단 바로가기 문화예술공간 문화예술창작촌 소개 장생포 아트스테이 새미골 문화마당 새소식 레지던시 레지던시 소개 작가 소개 프로그램 소개 프로그램 예약 전시 대관신청 문화예술공간 문화예술창작촌 소개 장생포 아트스테이 새미골 문화마당 새소식 포토 갤러리 레지던시 레지던시 소개 작가 소개 프로그램 소개 프로그램 예약 전시 대관안내 문화예술공간 문화예술공간 새소식 레지던시 프로그램 예약 대관신청 마이페이지 공연 전시 체험·기타행사 대관안내 커뮤니티 소개 문화예술창작촌 소개 __새미골 문화마당 울산광역시남구 문화예술창작촌 문화예술창작촌에는 (재)고래문화재단이 운영하는 장생포 아트스테이, 창작스튜디오 장생포고래로 131, 새미골 문화마당, 장생포 문화창고가 포함되어 있습니다. 울산광역시남구문화예술창작촌 홈페이지 정보 울산광역시남구문화예술창작촌 [주소] 울산광역시 남구 장생포고래로 139번길 5-15 [주소] 울산광역시 남구 장생포고래로 131 새미골 문화마당 [주소]울산광역시 남구 장생포고래로 197번길 1 [주소] 울산 남구 장생포 고래로 110 Copyright(C) 울산광역시 남구 문화예술창작소. 울산 남구청 울산 중구청 울산 북구청 울산 울주군청\'}, {\'url\': \'https://www.ulsanpress.net/news/articleView.html?idxno=412985\', \'content\': ""남구 문예공간 장생포 문화예술창작촌 이달부터 고래문화재단서 운영 새 행보 < 일반 < 문화 < 기사본문 - 울산신문 그동안 울산 남구문화원에서 운영해 오던 시설로, 장생포 아트스테이, 창작스튜디오 장생포고래로 131, 새미골 문화마당, 신화예술인촌 등 4곳이다. 2017년 3월 개관 이래 레시던시는 지역작가들을 발굴하고, 다양한 문화예술인들과 소통을 통해 지역 내에서의 역량을 키워나갈 수 있는 기회를 마련하고 있으며 워크숍, 기획전시, 오픈스튜디오 등 다양한 프로그램을 운영하고 있다. 새미골 문화마당은 장생포 주민을 위한 문화지원센터로 2016년에 개관해 주민 대상 문화예술교육 진행과 주민들의 복사나 팩스 등 간단한 행정 업무를 돕고 있으며, 쉼터나 택배 수령 등 장생포 주민의 편의를 위해 다양한 기능을 하고 있다. 새미골에서 운영하는 대표 프로그램인 \'문화예술아카데미 승승장구\'는 장생포 주민 및 울산 시민을 대상으로 하는 문화예술교육 프로그램으로, 특히, 커피 수업은 장생포 주민 7인이 수강 후 마을공동체를 결성해\\xa0\'새미골할머니고래\'라는 이름으로 \'창작스튜디오 장생포고래로 131\'에서 카페를 운영하고 있다.""}]']","울산 남구 문화예술창작촌 운영의 주관 기관은 **고래문화재단**입니다. 이 재단은 장생포 아트스테이, 창작스튜디오 장생포고래로 131, 새미골 문화마당 등 여러 시설을 운영하고 있으며, 다양한 문화예술 프로그램을 제공하고 있습니다."
울산 남구 문화예술창작촌 운영의 주요 활동은 무엇인가요?,"['정책 이름: 울산 남구 문화예술창작촌 운영', '주요활동: 예술가 레지던 7명, 원데이클래스 전공, 북카페, 창작스튜디오 장생포고래로 131, 예술가 레지던 3명, 작품전']","예술가 레지던 7명, 원데이클래스 전공, 북카페, 창작스튜디오 장생포고래로 131, 예술가 레지던 3명, 작품전","['[Document(metadata={\'name\': \'울산 남구 거리음악회 운영\', \'source\': \'..\\\\data\\\\policy_result.json\'}, page_content=\'기관:울산 남구 정책 분야:복지.문화분야 지원 내용:  장소   남구 관내 주요거리  고래문화특구    주요내용   거리공연 추진으로 도심 속 시민 문화향유 활성화 사업 운영 기간:2024. 3. ~ 12. 사업 신청 기간:상시 신청 절차:  문의   울산광역시 남구 문화예술과 052 226 5422 주관 기관:울산광역시 남구 문화예술과 052 226 5422 운영 기관:주관기관과 동일\'), Document(metadata={\'name\': \'울산 남구 문화예술창작촌 운영\', \'source\': \'..\\\\data\\\\policy_result.json\'}, page_content=\'기관:울산 남구 정책 분야:복지.문화분야 지원 내용:  장생포 아트스테이   소재지   장생포고래로 139번길 5 15   운영시간   화 ~ 일 09 00 ~ 18 00 매주 월  공휴일 휴무    주요활동   예술가 레지던시 7명   원데이클래스  전시 공연  북카페     창작스튜디오 장생포고래로 131   소재지   장생포고래로 131   운영시간   화 ~ 일 09 00 ~ 18 00 매주 월  공휴일 휴무    주요활동   예술가 레지던시 3명   작품전시 사업 신청 기간:상시 연령:만 19세 ~ 39세 주관 기관:울산광역시 남구 문화예술과 052 226 5422  운영 기관:주관기관과 동일\'), Document(metadata={\'name\': \'울산 북구 스트레스 해소를 위한 워라하 저녁  운영\', \'source\': \'..\\\\data\\\\policy_result.json\'}, page_content=\'기관:울산 북구 정책 분야:복지.문화분야 지원 내용:  장소   문화예술회관 2층 강의실 4개소    운영인력   담당강사 10명 정도   운영방법   매주 1회 수업 18 00 ~ 20 00    내용   직장인 하모니카  9개    음악반   기타  하모니카  바이올린   미술반   한글 한서문예  소묘 여행스케치  수체화 유화   무용반   요가  국선도 사업 운영 기간:  사업기간   연중 3개월 과정  4기  사업 신청 기간:상시 주관 기관:울산광역시 북구 문화예술회관 예술사업팀 052 241 7353  운영 기관:주관기관과 동일\'), Document(metadata={\'name\': \'울산 중구 청 장년 고독사 예방 종갓집 희망 이음 사업\', \'source\': \'..\\\\data\\\\policy_result.json\'}, page_content=\'기관:울산 중구 정책 분야:복지.문화분야 지원 내용:  주요내용   사회적 활동  공동체 모임을 통한 관계 형성 지원   욕구   필요도 조사를  지역사회와 연계한 생활 쿠폰 지원   그룹별 회차 진행     종갓집 희망이음    미래   학습  여가활동 지원  취업  일자리사업 정보공유  상담연계   건강한 여가  자기계발   건강   요리 교육  건강관리   올바른 식생활 관리   올바른 식생활 관리   함께   지역문화체험  동네맛집탐방  심리상담  정서지원  사회적 관계  유대활동 지원 사업 운영 기간:  사업기간    24. 2. ~ 12. 사업 신청 기간:상시 연령:만 20세 이상 거주지 및 소득:  대 상   중위소득 100% 이하 20세 이상 1인 가구 40명 주관 기관:울산광역시 중구청 복지지원과 052 290 4492  운영 기관:주관기관과 동일\'), Document(metadata={\'name\': \'울주청년문화프로젝트 청년문화잇소 it so \', \'source\': \'..\\\\data\\\\policy_result.json\'}, page_content=\'기관:울산 울주군 정책 분야:복지.문화분야 지원 내용:  사업장소   울주군 관내   사업내용   청년들이 원하는 문화를 자발적으로 만들고 스스로 즐길 수 있는 울주청년문화프젝트 추진    사업유형   관계중심형   교육  네트워크 구축  소규모 모임  청년들의 관계 확장을 위한 프로젝트   콘텐츠중심형   다양한 행사  축제  공연 의 프로젝트    사 업 비   60백만원 군비  사업 운영 기간:  사업기간    24. 2. ~ 12. 사업 신청 기간:상시 연령:만 18세 ~ 39세 거주지 및 소득:  사업대상   울산 청년단체 18세~39세의 청년 4인 이상      울주군 가산점 부여 주관 기관:울주문화재단 생활문화팀 052 980 2224  운영 기관:주관기관과 동일\')], [{\'url\': \'https://www.welfarehello.com/community/hometownNews/501d7a49-433f-4b0f-ba04-c8a537e6bd11\', \'content\': \'[블로그 기자] 울산 남구 문화 예술창작촌을 소개합니다 | 울산광역시 남구 | 웰로 [블로그 기자] 울산 남구 문화 예술창작촌을 소개합니다 장생포 아트스테이 & 창작스튜디오 장생포 고래로 131로 구성된 울산광역시 남구 문화 예술창작촌은 울산 남구 내에 조성된 창작 공간으로 예술가들에게 안정적인 창작 환경과 전시 기회를 제공하고, 시민과 예술가들의 자연스러운 소통 창구를 마련하고 있습니다. 올해는 2월 5일부터 13일까지 고래문화 재단에서 2024 ‘울산광역시 남구 문화 예술창작촌(장생포 아트스테이, 창작스튜디오 131)’ 레지던시 입주작가를 공개 모집하고 있습니다. 남구 문화 예술창작촌에서는 문학, 시각예술 분야의 레지던시 사업과 각종 문화 예술 프로그램을 운영하며 예술가와 시민들에게 창작활동을 지원해 오고 있습니다. 장생포 아트스테이 작가들은 작년에 신진 창작 아카데미 하반기 프로그램 \\\'나에게 향하는 산책\\\'프로그램도 진행했습니다. 올해도 남구 문화 예술창작촌에서 지낼 작가들과 함께 다양한 인문융합 프로그램이 진행될 예정입니다. {""title"":""[블로그 기자] 울산 남구 문화 예술창작촌을 소개합니다 \\u200b"",""source"":""https://blog.naver.com/ulsan-namgu/223353402418"",""blogName"":""울산광역시.."",""blogId"":""ulsan-namgu"",""domainIdOrBlogId"":""ulsan-namgu"",""logNo"":223353402418,""smartEditorVersion"":4,""meDisplay"":true,""lineDisplay"":true,""outsideDisplay"":true,""cafeDisplay"":true,""blogDisplay"":true}\'}, {\'url\': \'https://www.uwcf.or.kr/namguart/intro/intro1_1\', \'content\': \'본문 바로가기 주메뉴 바로가기 페이지하단 바로가기 문화예술공간 문화예술창작촌 소개 장생포 아트스테이 새미골 문화마당 새소식 레지던시 레지던시 소개 작가 소개 프로그램 소개 프로그램 예약 전시 대관신청 문화예술공간 문화예술창작촌 소개 장생포 아트스테이 새미골 문화마당 새소식 포토 갤러리 레지던시 레지던시 소개 작가 소개 프로그램 소개 프로그램 예약 전시 대관안내 문화예술공간 문화예술공간 새소식 레지던시 프로그램 예약 대관신청 마이페이지 공연 전시 체험·기타행사 대관안내 커뮤니티 소개 문화예술창작촌 소개 __새미골 문화마당 울산광역시남구 문화예술창작촌 문화예술창작촌에는 (재)고래문화재단이 운영하는 장생포 아트스테이, 창작스튜디오 장생포고래로 131, 새미골 문화마당, 장생포 문화창고가 포함되어 있습니다. 울산광역시남구문화예술창작촌 홈페이지 정보 울산광역시남구문화예술창작촌 [주소] 울산광역시 남구 장생포고래로 139번길 5-15 [주소] 울산광역시 남구 장생포고래로 131 새미골 문화마당 [주소]울산광역시 남구 장생포고래로 197번길 1 [주소] 울산 남구 장생포 고래로 110 Copyright(C) 울산광역시 남구 문화예술창작소. 울산 남구청 울산 중구청 울산 북구청 울산 울주군청\'}]']","울산 남구 문화예술창작촌 운영의 주요 활동은 다음과 같습니다:

1. **레지던시 프로그램**: 예술가들이 안정적인 창작 환경에서 활동할 수 있도록 지원하며, 문학 및 시각예술 분야의 레지던시 프로그램을 운영합니다.

2. **전시 및 공연 기회 제공**: 예술가들에게 창작한 작품을 전시하고 공연할 수 있는 기회를 제공합니다.

3. **원데이 클래스 및 다양한 문화 프로그램**: 시민과 예술가 간의 소통을 증진시키기 위한 다양한 문화 프로그램과 원데이 클래스를 운영합니다.

4. **예술가와 시민의 소통 공간**: 창작촌은 예술가와 시민들이 자연스럽게 소통할 수 있는 공간으로, 공동체 형성을 위한 활동도 진행합니다.

5. **문화예술 행사 및 축제**: 다양한 행사와 축제를 개최하여 지역 사회의 문화 향유를 활성화합니다.

위의 활동들은 울산 남구 문화예술창작촌이 지역 사회 내에서 예술과 문화를 발전시키고, 시민들이 예술을 가까이 느낄 수 있도록 돕는 데 중점을 두고 있습니다."
울산 남구 문화예술창작촌 운영의 연령 기준은 어떻게 되나요?,"['정책 이름: 울산 남구 문화예술창작촌 운영', '연령: 만 19세 - 39세']",만 19세 - 39세,"['[Document(metadata={\'name\': \'울산 문화예술교육사 인턴십 지원사업\', \'source\': \'..\\\\data\\\\policy_result.json\'}, page_content=\'기관:울산 정책 분야:일자리분야 지원 내용:  지원내용   문화예술교육사 채용지원  기관별 특화  운영   주관기관   울산문화관광재단 사업 운영 기간:2024. 1. ~ 12. 사업 신청 기간:상시 연령:만 19세 ~ 39세 거주지 및 소득:만 19세 이상 39세 이하 문화예술교육사 자격증 소지자   문화예술교육사 자격증 취득 후 3년 미만인 자 우대 주관 기관:울산광역시 문화예술과 문예총괄팀 052 229 3724  운영 기관:울산문화관광재단\'), Document(metadata={\'name\': \'울산 남구 거리음악회 운영\', \'source\': \'..\\\\data\\\\policy_result.json\'}, page_content=\'기관:울산 남구 정책 분야:복지.문화분야 지원 내용:  장소   남구 관내 주요거리  고래문화특구    주요내용   거리공연 추진으로 도심 속 시민 문화향유 활성화 사업 운영 기간:2024. 3. ~ 12. 사업 신청 기간:상시 신청 절차:  문의   울산광역시 남구 문화예술과 052 226 5422 주관 기관:울산광역시 남구 문화예술과 052 226 5422 운영 기관:주관기관과 동일\'), Document(metadata={\'name\': \'울산 남구 장생포문화창고 신진작가 전시 개최\', \'source\': \'..\\\\data\\\\policy_result.json\'}, page_content=\'기관:울산 남구 정책 분야:일자리분야 지원 내용:  장소   청년장생포문화창고 갤러리B 3층  갤러리C 4층   주요내용   청년작가  지역 신진작가 초청하여 다양한 테마의 기획전시 운영 사업 운영 기간:2024. 3. ~ 2024. 9. 사업 신청 기간:미정 연령:만 19세 ~ 39세 주관 기관:울산광역시 남구 문화예술과 052 226 5422  운영 기관:장생포문화창고 052 226 0010 \'), Document(metadata={\'name\': \'울산 남구 문화예술창작촌 운영\', \'source\': \'..\\\\data\\\\policy_result.json\'}, page_content=\'기관:울산 남구 정책 분야:복지.문화분야 지원 내용:  장생포 아트스테이   소재지   장생포고래로 139번길 5 15   운영시간   화 ~ 일 09 00 ~ 18 00 매주 월  공휴일 휴무    주요활동   예술가 레지던시 7명   원데이클래스  전시 공연  북카페     창작스튜디오 장생포고래로 131   소재지   장생포고래로 131   운영시간   화 ~ 일 09 00 ~ 18 00 매주 월  공휴일 휴무    주요활동   예술가 레지던시 3명   작품전시 사업 신청 기간:상시 연령:만 19세 ~ 39세 주관 기관:울산광역시 남구 문화예술과 052 226 5422  운영 기관:주관기관과 동일\'), Document(metadata={\'name\': \'울주청년문화프로젝트 청년문화잇소 it so \', \'source\': \'..\\\\data\\\\policy_result.json\'}, page_content=\'기관:울산 울주군 정책 분야:복지.문화분야 지원 내용:  사업장소   울주군 관내   사업내용   청년들이 원하는 문화를 자발적으로 만들고 스스로 즐길 수 있는 울주청년문화프젝트 추진    사업유형   관계중심형   교육  네트워크 구축  소규모 모임  청년들의 관계 확장을 위한 프로젝트   콘텐츠중심형   다양한 행사  축제  공연 의 프로젝트    사 업 비   60백만원 군비  사업 운영 기간:  사업기간    24. 2. ~ 12. 사업 신청 기간:상시 연령:만 18세 ~ 39세 거주지 및 소득:  사업대상   울산 청년단체 18세~39세의 청년 4인 이상      울주군 가산점 부여 주관 기관:울주문화재단 생활문화팀 052 980 2224  운영 기관:주관기관과 동일\')], [{\'url\': \'https://www.welfarehello.com/community/hometownNews/501d7a49-433f-4b0f-ba04-c8a537e6bd11\', \'content\': \'[블로그 기자] 울산 남구 문화 예술창작촌을 소개합니다 | 울산광역시 남구 | 웰로 [블로그 기자] 울산 남구 문화 예술창작촌을 소개합니다 장생포 아트스테이 & 창작스튜디오 장생포 고래로 131로 구성된 울산광역시 남구 문화 예술창작촌은 울산 남구 내에 조성된 창작 공간으로 예술가들에게 안정적인 창작 환경과 전시 기회를 제공하고, 시민과 예술가들의 자연스러운 소통 창구를 마련하고 있습니다. 올해는 2월 5일부터 13일까지 고래문화 재단에서 2024 ‘울산광역시 남구 문화 예술창작촌(장생포 아트스테이, 창작스튜디오 131)’ 레지던시 입주작가를 공개 모집하고 있습니다. 남구 문화 예술창작촌에서는 문학, 시각예술 분야의 레지던시 사업과 각종 문화 예술 프로그램을 운영하며 예술가와 시민들에게 창작활동을 지원해 오고 있습니다. 장생포 아트스테이 작가들은 작년에 신진 창작 아카데미 하반기 프로그램 \\\'나에게 향하는 산책\\\'프로그램도 진행했습니다. 올해도 남구 문화 예술창작촌에서 지낼 작가들과 함께 다양한 인문융합 프로그램이 진행될 예정입니다. {""title"":""[블로그 기자] 울산 남구 문화 예술창작촌을 소개합니다 \\u200b"",""source"":""https://blog.naver.com/ulsan-namgu/223353402418"",""blogName"":""울산광역시.."",""blogId"":""ulsan-namgu"",""domainIdOrBlogId"":""ulsan-namgu"",""logNo"":223353402418,""smartEditorVersion"":4,""meDisplay"":true,""lineDisplay"":true,""outsideDisplay"":true,""cafeDisplay"":true,""blogDisplay"":true}\'}, {\'url\': \'https://www.ulsannamgu.go.kr/fieldInfo/youthCultureWelfare01.jsp\', \'content\': \'남구 문화예술창작촌 | 울산광역시 남구청 지방세 안내전화 및 납부방법 새소식 새소식(남구소식) 국민신문고 국민생각함 마을공동체 마을공동체 공모사업 소개 온라인 명예의 전당 구민대상 명예의 전당 남구 브리핑 공업탑소식(e-book) 여천천 유래와 역사 소상공인 지원사업 방사능 방재 정보 정보공개제도 안내 업무추진비 공개 업무추진비 공개(보건소) 복지감면 및 지원 노인일자리 및 사회활동 지원사업 남구 혁신교육 지방세 안내전화 및 납부방법 새소식 새소식(남구소식) 국민신문고 국민생각함 마을공동체 마을공동체 공모사업 소개 온라인 명예의 전당 구민대상 명예의 전당 남구 브리핑 공업탑소식(e-book) 여천천 유래와 역사 소상공인 지원사업 방사능 방재 정보 정보공개제도 안내 업무추진비 공개 업무추진비 공개(보건소) 복지감면 및 지원 노인일자리 및 사회활동 지원사업 남구 혁신교육 분야별정보 > 청년정책 > 문화ㆍ복지 > 남구 문화예술창작촌 분야별정보 > 청년정책 > 문화ㆍ복지 소상공인 지원사업 방사능 방재 정보 남구 문화예술창작촌 남구 문화예술창작촌 남구 문화예술창작촌 운영 COPYRIGHT 울산광역시 남구.\'}]']",울산 남구 문화예술창작촌의 운영 연령 기준은 만 19세 이상 39세 이하입니다. 이 연령대의 청년들이 참여할 수 있는 프로그램과 지원을 제공하고 있습니다.
인공지능 AI 면접진 운영의 지원 연령은 어떻게 되나요?,"['정책 이름: 인공지능 AI 면접진 운영', '연령: 만 19세 39세']",만 19세에서 39세까지입니다.,"['[Document(metadata={\'name\': \'2024년 취업준비생 경쟁력 강화 지원사업 AI취업준비 \', \'source\': \'..\\\\data\\\\policy_result.json\'}, page_content=\'기관:제주 정책 분야:일자리분야 지원 내용:  지원내용   대표 내용   지원 대상자    인공지능 AI 면접을 활용한 기업의 채용 전형에 대비    도내 취업 준비  구직자    지원받을 수 있는 사항    유형별 면접연습  AI채용면접  NCS기반 면접연습  외국어 면접연습     지원상세   인공지능 AI 면접을 활용한 기업의 채용 전형에 대비할 수 있도록 도내 취업 준비  구직자에게 AI 모의면접  AI 자기소개서 진단 지원 사업 신청 기간:미정 비고:사업기간2024 01 01 ~ 2024 12 31 운영기간2024 02 01 ~ 2024 12 31 신청기간2024 02 01 ~ 2024 12 31 연령:만 19세 ~ 39세 추가 단서 사항:지역기준   제주도  제주시  서귀포시 신청 절차:  신청방법   AI 접속  추후 시스템 업체 선정     1  제주고용복지플러스센터홈페이지   jeju main.do  2  회원가입 3  로그인  하기   사용자 편의사항 개선   온라인에서 계정을  자유롭게 사용 가능토록  라이선스 구매 후   주관 기관:제주특별자치도   고용센터 운영 기관:제주특별자치도   고용센터\'), Document(metadata={\'name\': \'울산 인공지능대학원 지원사업\', \'source\': \'..\\\\data\\\\policy_result.json\'}, page_content=\'기관:울산 정책 분야:교육분야 지원 내용:  총사업비   162억원 국 90  시 25  민 47    사업내용 1. 인공지능 분야 전문인력양성   석 박사 인력양성   연 50명 석 30  박 10  통합 10    국내 외 기업 인턴십 지원   연 10명 2. 인공지능 핵심 R D     CORE AI 연구   딥러닝 알고리즘  AGI 범용 AI  개발   AI System 연구   AI 프레임워크  딥러닝 가속기  AI 연산 메모리 소자 개발   AI X 융합연구   AI 기반 제조  신약개발  3D Vision 로봇  자율주행 연구    기관   울산과학기술원 사업 운영 기간:  사업기간  2020. 4. ~ 2024. 12. 5년간  사업 신청 기간:상시 주관 기관:울산광역시 신산업추진단 ICT융합팀 052 229 7894  운영 기관:울산과학기술원\'), Document(metadata={\'name\': \'청년 커리어 고민 솔루션  ALL Question   안양시 \', \'source\': \'..\\\\data\\\\policy_result.json\'}, page_content=\'기관:경기 안양시 정책 분야:일자리분야 지원 내용:  청년의 고민을 현직자가 답해주는 온라인 멘토링    진로  대학  취업  이직  온라인 상담   실무 취업고민 상담사례 열람   AI 자기소개서 튜토리얼  분석    기타 자세한 세부 내용은 참고 사이트를 확인해주세요. 사업 신청 기간:상시 비고:운영시기   2024. 3. 4 ~ 계속 연령:만 16세 ~ 39세 거주지 및 소득:  안양시 거주  활동 직장  학교   하고 있는 청소년  청년   생년월일   2005. 3. 2. ~ 2008. 12. 31. 신청 절차:  16세~18세   안양청년광장 회원가입   ALL Q    19세~39세   안양청년광장 회원가입   인재록 완료   ALL Q  주관 기관:경기도 안양시\'), Document(metadata={\'name\': \'지역 ICT이노베이션스퀘어 확산 사업\', \'source\': \'..\\\\data\\\\policy_result.json\'}, page_content=\'기관:광주 정책 분야:교육분야 지원 내용:디지털신기술교육  온라인코딩  기업프로젝트  세미나  청년창업지원  사업 운영 기간:2024.01.01.~2024.12.31. 사업 신청 기간:상시 지원 규모(명):370여명 추가 단서 사항: 교육 광주 연고자  광주 소재 고학교 졸업생  광주 소재 대학교 졸업생  재 휴 학생  광주 소재 기업 재직자   AI시제품제작지원  ICT이노베이션스퀘어 교육 수료생  ICT 콤플렉스 자  멤버십 가입자 필수 구성원 중 최소 1명 이상 반드시 포함  참여 제한 대상:타 정부기관의 창업지원사업    기타 채무불이행 확인된 자  지원제외 대상 업종 영위자  신청 절차:모집공고   온라인신청   서류제출 심사 및 발표:선발조건에  1차 선발  선발시험 후 적격자 발표 제출 서류:사업신청서  개인정보 에  동의서  주관 기관:광주광역시 인공지능산업실 AI반도체과 운영 기관: 재 광주정보문화산업진흥원\'), Document(metadata={\'name\': \'인공지능 AI  면접진단 운영\', \'source\': \'..\\\\data\\\\policy_result.json\'}, page_content=\'기관:서울 강북구 정책 분야:일자리분야 지원 내용:자기소개서 분석   인공지능 AI  면접진단  사업 운영 기간:2024. 3. ~ 12. 사업 신청 기간:상시 지원 규모(명):200명 연령:만 19세 ~ 39세 신청 절차: 1  강북구 청년일자리센터 네이버 페이지 https   naver.me FrApODPa 에서 화상면접실 예약 후 현장에서 계정 신청  2  강북청년창업마루 홈페이지 https   gbmaru.com  방문하여 카카오톡 챗봇을  상담신청 후 계정 신청  카카오톡에서 강북청년창업마루 채널 검색 후 채팅창을  계정 신청 기타 유익 정보:문 의    강북구 청년일자리센터 02 6227 3200    강북청년창업마루 02 908 8238  주관 기관:강북구 일자리청년과 운영 기관:강북구 청년일자리센터\')], [{\'url\': \'https://m.blog.naver.com/mosfnet/223072119485\', \'content\': \'청년 취업난 속 대세가 된 AI면접, 그 속을 파헤치다 : 네이버 블로그 청년 취업난 속 대세가 된 AI면접, 그 속을 파헤치다 최근 채용 과정에서 AI면접을 도입하는 기업들이 늘고 있습니다. 정확한 평가 기준을 알 수 없어 확인되지 않는 작년 말 한 외국계 반도체 회사에 지원해 AI면접에 응시한 취준생 A씨(27세)는 직접 보이는 외모 등 때문에 평가에 영향이 미칠 수 있는 알고리즘으로 평가가 이뤄지는 만큼 어떤 부분 위주로 평가가 이뤄지는지 알 수 없어 AI가 추출한 개인 성향이 회사나 직무와 맞지 않아 탈락한 것 같다”고 전했습니다 최대한 많이 쌓아서 좋은 등급을 받을 수 있도록 연습할 수밖에 없지만, 국민이 거부하거나 설명을 요구할 수 있는 권리를 신설하였습니다. 앞으로 정보 주체가 신뢰할 수 있는 인공지능 등 {""title"":""청년 취업난 속 대세가 된 AI면접, 그 속을 파헤치다"",""source"":""https://blog.naver.com/mosfnet/223072119485"",""blogName"":""기획재정부.."",""domainIdOrBlogId"":""mosfnet"",""nicknameOrBlogId"":""MOEF"",""logNo"":223072119485,""smartEditorVersion"":4,""meDisplay"":true,""lineDisplay"":true,""outsideDisplay"":true,""cafeDisplay"":true,""blogDisplay"":true}\'}, {\'url\': \'https://community.linkareer.com/employment_data/3166457\', \'content\': \'합격 후기 게시판 면접 합격 후기 인턴 게시판 대외활동 게시판 이 글에서는 AI 면접의 의미와 도입 배경, 질문 및 평가기준, 그리고 준비 팁과 사이트에 대해 자세히 알아보겠습니다. AI 면접이란\\xa0인공지능 기술을 활용하여 구직자를 평가하는 면접 방식을 의미합니다. 전통적인 면접 방식으로는 대량의 지원자를 공정하게 평가하기 어렵기 때문에, AI 면접을 통해 보다 신속하고 객관적인 평가가 가능합니다. AI 면접, 현대 멘토에게 직접 질문해보기 👉 2. AI 면접의 질문 및 평가기준 일반적으로 AI 면접의 질문은 다음과 같은 형태로 구성됩니다. 3. AI 면접 준비 팁 (연습 사이트) (3) 연습: AI 면접 연습 사이트를 활용하여 실제 면접 상황을 미리 경험해보세요. < AI 면접 연습 추천 사이트>-\\xa0잡다-\\xa0뷰인터- 유튜브, 블로그, 커뮤니티 등에서 각종 후기 및 시험 팁 참고-\\xa0링커리어 멘토 게시판에서 각종 팁 질문하기\'}]']","인공지능 AI 면접진 운영의 지원 연령은 만 19세에서 39세입니다. 이 프로그램은 서울 강북구에서 진행되며, 자기소개서 분석과 AI 면접 진단 서비스를 제공합니다. 신청 절차는 강북구 청년일자리센터의 네이버 페이지에서 화상면접실 예약 후 계정을 신청하는 방식입니다. 추가적인 문의는 강북구 청년일자리센터나 강북청년창업마루에 할 수 있습니다."
인공지능 AI 면접진 운영의 사업 신청 절차는 어떻게 되나요?,"['정책 이름: 인공지능 AI 면접진 운영', '신청 절차: 1 강북구 청년일리센터 네이버 페이지 https naver.me FrApODPa 에서 화상면접실 예약 현장에서 계정 2 강북청년창업마루 홈페이지 https gbmaru.com 방문하여 카카오톡 챗봇을 상담 계정 카카오톡에서 강북청년창업마루 채널 검색 채팅창을 계정']",1. 강북구 청년일리센터 네이버 페이지에서 화상면접실을 예약하고 현장에서 계정을 만듭니다. 2. 강북청년창업마루 홈페이지를 방문하여 카카오톡 챗봇을 통해 상담 계정을 만듭니다. 카카오톡에서 강북청년창업마루 채널을 검색하여 채팅창을 엽니다.,"['[Document(metadata={\'name\': \'2024년 취업준비생 경쟁력 강화 지원사업 AI취업준비 \', \'source\': \'..\\\\data\\\\policy_result.json\'}, page_content=\'기관:제주 정책 분야:일자리분야 지원 내용:  지원내용   대표 내용   지원 대상자    인공지능 AI 면접을 활용한 기업의 채용 전형에 대비    도내 취업 준비  구직자    지원받을 수 있는 사항    유형별 면접연습  AI채용면접  NCS기반 면접연습  외국어 면접연습     지원상세   인공지능 AI 면접을 활용한 기업의 채용 전형에 대비할 수 있도록 도내 취업 준비  구직자에게 AI 모의면접  AI 자기소개서 진단 지원 사업 신청 기간:미정 비고:사업기간2024 01 01 ~ 2024 12 31 운영기간2024 02 01 ~ 2024 12 31 신청기간2024 02 01 ~ 2024 12 31 연령:만 19세 ~ 39세 추가 단서 사항:지역기준   제주도  제주시  서귀포시 신청 절차:  신청방법   AI 접속  추후 시스템 업체 선정     1  제주고용복지플러스센터홈페이지   jeju main.do  2  회원가입 3  로그인  하기   사용자 편의사항 개선   온라인에서 계정을  자유롭게 사용 가능토록  라이선스 구매 후   주관 기관:제주특별자치도   고용센터 운영 기관:제주특별자치도   고용센터\'), Document(metadata={\'name\': \'경남 인공지능 AI 면접 체험관 청년 일자리종합센터 \', \'source\': \'..\\\\data\\\\policy_result.json\'}, page_content=\'기관:경남 정책 분야:일자리분야 지원 내용:  지원내용   AI 모의면접   NCS 기반 대면 면접연습   우수응답사례 동영상    역량분석게임   평가결과 확인   AI 자기소개서 분석기   빅데이터 기반 직무 적합도 분석   직무역량 분석  첨삭   현직자 멘토링   비용   무료체험   운영시간 평일 9 00~18 00   장소   창원서 성산구 창원대로 524  경남사회적경제혁신타운 2층 사업 신청 기간:상시 거주지 및 소득:  대상   경남도민 누구나 신청 절차:  신청방법   신청서 팩스나 메일로 접수   대표메일   gnjob naver.com   팩스   055 230 2995   신청문의   055 230 2913~4 주관 기관:경남투자경제진흥원 운영 기관:주관기관과 동일\'), Document(metadata={\'name\': \'울산 인공지능대학원 지원사업\', \'source\': \'..\\\\data\\\\policy_result.json\'}, page_content=\'기관:울산 정책 분야:교육분야 지원 내용:  총사업비   162억원 국 90  시 25  민 47    사업내용 1. 인공지능 분야 전문인력양성   석 박사 인력양성   연 50명 석 30  박 10  통합 10    국내 외 기업 인턴십 지원   연 10명 2. 인공지능 핵심 R D     CORE AI 연구   딥러닝 알고리즘  AGI 범용 AI  개발   AI System 연구   AI 프레임워크  딥러닝 가속기  AI 연산 메모리 소자 개발   AI X 융합연구   AI 기반 제조  신약개발  3D Vision 로봇  자율주행 연구    기관   울산과학기술원 사업 운영 기간:  사업기간  2020. 4. ~ 2024. 12. 5년간  사업 신청 기간:상시 주관 기관:울산광역시 신산업추진단 ICT융합팀 052 229 7894  운영 기관:울산과학기술원\'), Document(metadata={\'name\': \'동래구 청년어울림센터 AI 면접실 오픈  \', \'source\': \'..\\\\data\\\\policy_result.json\'}, page_content=\'기관:부산 동래구 정책 분야:일자리분야 지원 내용:  동래구 청년어울림센터 AI 면접 의 특징 1. 자신의 원하는 직종을 선택하여 면접 진행 가능 2. 면접  입사하고 싶은 기업체를 선택하여 면접 진행 가능 3. 면접 종료 후 실시간 결과 피드백 가능 4. 모바일 스마트폰 을 하여 장소불문  가능 사업 신청 기간:2024년 10월16일 ~ 2024년 12월31일 비고:2024 10 16 ~ 2024 12 31 거주지 및 소득:제한없음   동래구  부산시 거주 취업 준비  청년 취업 상태:미취업자 프리랜서 일용근로자 신청 절차:홈페이지 사전 방문예약  모바일 사용 신청 1. 사전 방문 예약   동래구 청년어울림센터 홈페이지 방문   회원가입  로그인   신청하기   대관 좌석  신청   화면 중앙의  AI 면접실  이미지 버튼 클릭     날짜와 시간 선택   신청 하기 클릭   1일 내 담당자 AI 면접실 신청 승인여부 확인   신청한 날짜에 센터 방문하여 AI 면접실   2. 모바일 사용 신청   동래구 청년어울림센터 홈페이지 방문  회원가입  로그인   신청하기   대관 좌석  신청   화면 중앙의  모바일 AI 면접  이미지 버튼 클릭   신청하기   모바일용 QR코드 접속 기타 유익 정보:센터 오시는 길   지하철   1호선 온천장역 하차 도보 5분    버스   77번  148 1번  110번 탑승 후  금강원 입구  정류소 하차   자동차   네비게이션  동래구혁신어울림센터  검색 주관 기관:동래구 청년어울림센터 운영 기관:동래구 청년어울림센터\'), Document(metadata={\'name\': \'청년 커리어 고민 솔루션  ALL Question   안양시 \', \'source\': \'..\\\\data\\\\policy_result.json\'}, page_content=\'기관:경기 안양시 정책 분야:일자리분야 지원 내용:  청년의 고민을 현직자가 답해주는 온라인 멘토링    진로  대학  취업  이직  온라인 상담   실무 취업고민 상담사례 열람   AI 자기소개서 튜토리얼  분석    기타 자세한 세부 내용은 참고 사이트를 확인해주세요. 사업 신청 기간:상시 비고:운영시기   2024. 3. 4 ~ 계속 연령:만 16세 ~ 39세 거주지 및 소득:  안양시 거주  활동 직장  학교   하고 있는 청소년  청년   생년월일   2005. 3. 2. ~ 2008. 12. 31. 신청 절차:  16세~18세   안양청년광장 회원가입   ALL Q    19세~39세   안양청년광장 회원가입   인재록 완료   ALL Q  주관 기관:경기도 안양시\')], [{\'url\': \'https://m.blog.naver.com/kiat_tech/222850756408\', \'content\': \'인공지능 면접 방식 및 종류까지 완벽하게 : 네이버 블로그 인공지능 면접 방식 및 종류까지 완벽하게 AI 면접 방식 및 종류 애매하거나 두리뭉실한 표현보다는 정확한 단어로 키워드를 잡아 말할 수 있도록 연습하는 것이 좋습니다, AI 면접은 다음과 같은 방식으로 진행됩니다. 이때 AI가 표정 변화, 목소리 높낮이, 톤 등을 분석해서 신뢰도를 판단한다고 하니, 무엇이 옳은 답변일까 또는 이 기업의 성향에 맞는 답변일까 고민하기보다는 솔직하게 답변하는 편이 더욱 좋은 점수를 받을 수 있습니다. 4) 상황대처 능력 면접 5) 온라인 AI 게임 면접 6) 대화형 면접 7) 공감 능력 면접 진중한 태도로 솔직하게 답변하는 것이 좋지만 진중함이 지나쳐서 망설이는 듯한 태도는 오히려 마이너스 요소가 될 수 있습니다. 8) 심층대화 면접 지금까지 AI 면접과 면접 준비 방법에 대해 알아보았습니다. 인공지능 면접 방식 및 종류까지 완벽하게"",""source"":""https://blog.naver.com/kiat_tech/222850756408"",""blogName"":""한국산업기.."",""domainIdOrBlogId"":""kiat_tech"",""nicknameOrBlogId"":""한국산업기술진흥원"",""logNo"":222850756408,""smartEditorVersion"":4,""meDisplay"":true,""lineDisplay"":true,""outsideDisplay"":false,""cafeDisplay"":true,""blogDisplay"":true}\'}, {\'url\': \'https://brunch.co.kr/@saraminhrlab/69\', \'content\': \'이러한 결정의 대상자(정보주체)가 권리 또는 의무 등에 영향을 받은 경우 결정을 거부하거나 결정에 대한 설명을 요구할 수 있는 권리를 보장받게 된다. 그래서인지 AI 면접 솔루션을 제공하는 업체들은 다소 거부감이 들 수 있는 ‘면접’이라는 용어를 그대로 사용하기보다는 ‘검사’ 또는 ‘인터뷰’ 등의 명칭으로 제공하고 있다. 먼저 어떤 데이터가 어떻게 해석되어 결정에 반영되었는지 이해할 수 있도록 AI 결정에 영향을 준 데이터를 특정하고 분석하여 근거를 찾는 데이터 분석기법을 도출해야 한다. 그리고 임의의 AI 모델이 어떤 기능을 학습했는지 밝히고, 특정 입력이 주는 영향을 파악할 수 있도록 내부 작동 방식을 이해하는 데 필요한 범용 모델 해석 기술을 개발해야 한다. 또한 이러한 규명 결과를 지원자 및 정부기관에 제출할 수 있도록 AI 모델의 작동 원리와 결정 근거를 시각적으로 표현할 수 있는 기술을 발전시켜야 할 것이다. 대안으로 AI 면접과 인재선발도구를 결합하는 방법을 검토해 볼 수 있다.\'}]']","인공지능 AI 면접 관련 사업의 신청 절차는 각 기관에 따라 상이하지만, 일반적으로 다음과 같은 절차를 포함합니다:

1. **회원가입 및 로그인**: 각 기관의 웹사이트에 접속하여 회원가입을 진행하고, 로그인합니다.
   
2. **신청하기**: 사이트 내에서 '신청하기' 버튼을 클릭하여 신청 페이지로 이동합니다. 여기서 필요한 정보를 입력합니다.

3. **예약 및 신청**: 
   - 일부 기관에서는 사전 방문 예약이 필요하며, 예약 후 지정된 날짜에 센터를 방문하여 AI 면접을 진행합니다.
   - 모바일 신청이 가능한 경우, QR 코드를 통해 접속하여 신청할 수 있습니다.

4. **신청 승인 확인**: 신청한 날짜에 담당자로부터 면접실 신청 승인 여부를 확인합니다.

5. **면접 진행**: 승인된 날짜에 센터를 방문하여 AI 면접을 실시합니다.

이 외에도 각 기관에서 요구하는 추가 서류나 절차가 있을 수 있으므로, 해당 기관의 공식 웹사이트를 통해 구체적인 정보를 확인하는 것이 중요합니다. 예를 들어, 제주특별자치도의 경우 AI 접속 시스템을 통해 신청할 수 있으며, 경남의 경우 신청서를 팩스나 이메일로 접수해야 합니다."
인공지능 AI 면접진 운영의 사업 신청 기간은 언제인가요?,"['정책 이름: 인공지능 AI 면접진 운영', '사업 신청 기간: 상']",상반기입니다.,"[""[Document(metadata={'name': '2024년 취업준비생 경쟁력 강화 지원사업 AI취업준비 ', 'source': '..\\\\data\\\\policy_result.json'}, page_content='기관:제주 정책 분야:일자리분야 지원 내용:  지원내용   대표 내용   지원 대상자    인공지능 AI 면접을 활용한 기업의 채용 전형에 대비    도내 취업 준비  구직자    지원받을 수 있는 사항    유형별 면접연습  AI채용면접  NCS기반 면접연습  외국어 면접연습     지원상세   인공지능 AI 면접을 활용한 기업의 채용 전형에 대비할 수 있도록 도내 취업 준비  구직자에게 AI 모의면접  AI 자기소개서 진단 지원 사업 신청 기간:미정 비고:사업기간2024 01 01 ~ 2024 12 31 운영기간2024 02 01 ~ 2024 12 31 신청기간2024 02 01 ~ 2024 12 31 연령:만 19세 ~ 39세 추가 단서 사항:지역기준   제주도  제주시  서귀포시 신청 절차:  신청방법   AI 접속  추후 시스템 업체 선정     1  제주고용복지플러스센터홈페이지   jeju main.do  2  회원가입 3  로그인  하기   사용자 편의사항 개선   온라인에서 계정을  자유롭게 사용 가능토록  라이선스 구매 후   주관 기관:제주특별자치도   고용센터 운영 기관:제주특별자치도   고용센터'), Document(metadata={'name': '울산 인공지능대학원 지원사업', 'source': '..\\\\data\\\\policy_result.json'}, page_content='기관:울산 정책 분야:교육분야 지원 내용:  총사업비   162억원 국 90  시 25  민 47    사업내용 1. 인공지능 분야 전문인력양성   석 박사 인력양성   연 50명 석 30  박 10  통합 10    국내 외 기업 인턴십 지원   연 10명 2. 인공지능 핵심 R D     CORE AI 연구   딥러닝 알고리즘  AGI 범용 AI  개발   AI System 연구   AI 프레임워크  딥러닝 가속기  AI 연산 메모리 소자 개발   AI X 융합연구   AI 기반 제조  신약개발  3D Vision 로봇  자율주행 연구    기관   울산과학기술원 사업 운영 기간:  사업기간  2020. 4. ~ 2024. 12. 5년간  사업 신청 기간:상시 주관 기관:울산광역시 신산업추진단 ICT융합팀 052 229 7894  운영 기관:울산과학기술원'), Document(metadata={'name': '인공지능 AI  면접진단 운영', 'source': '..\\\\data\\\\policy_result.json'}, page_content='기관:서울 강북구 정책 분야:일자리분야 지원 내용:자기소개서 분석   인공지능 AI  면접진단  사업 운영 기간:2024. 3. ~ 12. 사업 신청 기간:상시 지원 규모(명):200명 연령:만 19세 ~ 39세 신청 절차: 1  강북구 청년일자리센터 네이버 페이지 https   naver.me FrApODPa 에서 화상면접실 예약 후 현장에서 계정 신청  2  강북청년창업마루 홈페이지 https   gbmaru.com  방문하여 카카오톡 챗봇을  상담신청 후 계정 신청  카카오톡에서 강북청년창업마루 채널 검색 후 채팅창을  계정 신청 기타 유익 정보:문 의    강북구 청년일자리센터 02 6227 3200    강북청년창업마루 02 908 8238  주관 기관:강북구 일자리청년과 운영 기관:강북구 청년일자리센터'), Document(metadata={'name': '청년 커리어 고민 솔루션  ALL Question   안양시 ', 'source': '..\\\\data\\\\policy_result.json'}, page_content='기관:경기 안양시 정책 분야:일자리분야 지원 내용:  청년의 고민을 현직자가 답해주는 온라인 멘토링    진로  대학  취업  이직  온라인 상담   실무 취업고민 상담사례 열람   AI 자기소개서 튜토리얼  분석    기타 자세한 세부 내용은 참고 사이트를 확인해주세요. 사업 신청 기간:상시 비고:운영시기   2024. 3. 4 ~ 계속 연령:만 16세 ~ 39세 거주지 및 소득:  안양시 거주  활동 직장  학교   하고 있는 청소년  청년   생년월일   2005. 3. 2. ~ 2008. 12. 31. 신청 절차:  16세~18세   안양청년광장 회원가입   ALL Q    19세~39세   안양청년광장 회원가입   인재록 완료   ALL Q  주관 기관:경기도 안양시'), Document(metadata={'name': '지역 ICT이노베이션스퀘어 확산 사업', 'source': '..\\\\data\\\\policy_result.json'}, page_content='기관:광주 정책 분야:교육분야 지원 내용:디지털신기술교육  온라인코딩  기업프로젝트  세미나  청년창업지원  사업 운영 기간:2024.01.01.~2024.12.31. 사업 신청 기간:상시 지원 규모(명):370여명 추가 단서 사항: 교육 광주 연고자  광주 소재 고학교 졸업생  광주 소재 대학교 졸업생  재 휴 학생  광주 소재 기업 재직자   AI시제품제작지원  ICT이노베이션스퀘어 교육 수료생  ICT 콤플렉스 자  멤버십 가입자 필수 구성원 중 최소 1명 이상 반드시 포함  참여 제한 대상:타 정부기관의 창업지원사업    기타 채무불이행 확인된 자  지원제외 대상 업종 영위자  신청 절차:모집공고   온라인신청   서류제출 심사 및 발표:선발조건에  1차 선발  선발시험 후 적격자 발표 제출 서류:사업신청서  개인정보 에  동의서  주관 기관:광주광역시 인공지능산업실 AI반도체과 운영 기관: 재 광주정보문화산업진흥원')], [{'url': 'https://www.skelterlabs.com/blog/aivoucher2023', 'content': '기업들의 인공지능 기술 도입을 촉진하고 장려하기 위해서 2020년 부터 시작되었습니다. ... 체크포인트 4. 2023년 ai 바우처 사업 신청 기간은? 2023년 ai 바우처 사업계획서 접수 마감은 1월 30일(월) 15:00시입니다.'}, {'url': 'https://portal.atops.or.kr/Notice/Notice/pblanc-5ca4092e01d947d6a8a674cc5cc862d8', 'content': 'atops는 인공지능 집적단지 조성사업 모든 서비스의 관문 역할로 인공지능데이터센터, 실증, 창업, 인재양성 등 효율적 서비스 제공을 위한 ai 통합지원 서비스 포털입니다. ... 사업 신청 전에 신청 대상, 사전준비자료, 사업안내서 등을'}]""]","여기에 제공된 정보는 다양한 지역에서 진행되고 있는 인공지능 관련 지원 사업에 대한 내용입니다. 각 사업의 구체적인 지원 내용, 신청 기간, 지원 대상 및 절차 등이 포함되어 있습니다. 아래는 각 사업의 요약입니다.

1. **2024년 취업준비생 경쟁력 강화 지원사업 (제주도)**
   - **지원 내용:** AI 면접, 자기소개서 진단 등
   - **지원 대상:** 만 19세 ~ 39세 도내 취업 준비 구직자
   - **신청 기간:** 2024년 2월 1일 ~ 2024년 12월 31일
   - **주관 기관:** 제주특별자치도 고용센터

2. **울산 인공지능대학원 지원사업**
   - **지원 내용:** AI 전문 인력 양성, 인턴십 지원, AI 연구 등
   - **사업 기간:** 2020년 4월 ~ 2024년 12월
   - **주관 기관:** 울산광역시 신산업추진단

3. **인공지능 AI 면접진단 운영 (서울 강북구)**
   - **지원 내용:** 자기소개서 분석, AI 면접진단
   - **지원 규모:** 200명
   - **신청 절차:** 온라인 예약 후 계정 신청
   - **주관 기관:** 강북구 일자리청년과

4. **청년 커리어 고민 솔루션 (안양시)**
   - **지원 내용:** 온라인 멘토링, AI 자기소개서 분석
   - **신청 기간:** 상시
   - **주관 기관:** 경기도 안양시

5. **지역 ICT 이노베이션 스퀘어 확산 사업 (광주)**
   - **지원 내용:** 디지털 신기술 교육, 청년 창업 지원 등
   - **신청 기간:** 상시
   - **주관 기관:** 광주광역시 인공지능산업실

이 외에도 실시간 웹 검색에서 확인된 정보는 기업의 AI 기술 도입 촉진을 위한 바우처 사업에 대한 내용이 포함되어 있습니다. 각 사업의 신청 기간 및 절차는 상이하므로, 관심 있는 사업에 대한 자세한 정보는 해당 기관의 공식 웹사이트를 방문하거나 연락하여 확인하는 것이 좋습니다."
송파 청년CEO포럼의 주관 기관은 어디인가요?,"['정책 이름: 송파 청년CEO포럼', '주관 기관: 송파구청 경제진흥과']",송파구청 경제진흥과,"['[Document(metadata={\'name\': \'송파 청년CEO포럼\', \'source\': \'..\\\\data\\\\policy_result.json\'}, page_content=\'기관:서울 송파구 정책 분야:교육분야 지원 내용:청년CEO간의 네트워킹  교류의 장 형성  현안사항을 공론화 사업 신청 기간:미정 비고:2024.09월 사업공고 예정 연령:만 19세 ~ 39세 거주지 및 소득:송파구에서 활동하고 있는  예비  청년창업가 취업 상태: 예비 창업자 신청 절차:사업공고  24.9월   신청 접수  24.9~10월    행사운영  24.10월    성과보고  24.11월  주관 기관:송파구청 경제진흥과 운영 기관:송파구청\'), Document(metadata={\'name\': \'송파 ICT청년창업지원센터 운영\', \'source\': \'..\\\\data\\\\policy_result.json\'}, page_content=\'기관:서울 송파구 정책 분야:일자리분야 지원 내용:입주사무실 개별 7개  개방형 20석   미팅룸  회의실  창업  컨설팅  사업 운영 기간:2024.1. ~ 2024.12. 사업 신청 기간:상시 지원 규모(명):청년 창업기업 약 20개 비고:상시 연령:만 19세 ~ 39세 거주지 및 소득:청년 창업기업 ICT  기타 기술특허를 활용한 창업 분야  특화 분야:중소기업  기타 ICT  기타 기술특허  신청 절차:  송파구 홈페이지 공고문 참조  양식 다운   구비 서류 양식 작성  증빙서류 구비    송파구 일자리정책담당관 송파구 홈페이지 공고 참조하여  방문 신청 심사 및 발표:공고 일정에 맞춰 심사  발표 일정 확정 제출 서류:신청서  기업소개  사업계획  기타 유익 정보:주요 운영    멘토링 지원  사무공간 지원  창업아카데미 원데이 클래스  창업상담소  네트워킹 데이  IR  데모데이 주관 기관:송파구청 경제진흥과\'), Document(metadata={\'name\': \'청년창업 컨설팅 멘토링 지원 기업 모집  파주시 \', \'source\': \'..\\\\data\\\\policy_result.json\'}, page_content=\'기관:경기 파주시 정책 분야:일자리분야 지원 내용:  사 업 명  청년창업 컨설팅 멘토링 지원   과제기간  컨설팅 멘토링 시작일로부터 2개월 이내   지원규모  5명 내외   지원금액  기업 당 1백만원 4회 기준    세부지원내용은 공고문 참고 사업 신청 기간:2024년 08월30일 ~ 2024년 12월30일 비고:  신청기간  2024.08.21. ~ 예산 소진 시 까지 거주지 및 소득:  파주청년창업지원센터 입주기업 팀  신청 절차:  신청방법  신청서류 이메일 제출 youni1004 gtp.or.kr  기타 유익 정보:  문 의 처  파주청년창업지원센터 운영실 031 940 9797 주관 기관:파주시   재 경기테크노파크 운영 기관:파주시   재 경기테크노파크\'), Document(metadata={\'name\': \'청년 활성화 지원사업\', \'source\': \'..\\\\data\\\\policy_result.json\'}, page_content=\'기관:서울 강서구 정책 분야:.권리분야 지원 내용:1. 강서구 청년기구 운영 청년정책 공론장 운영  2. 강창맨 강서청년 창업지원 멘토링   3. 청년이 맘편히 일하는 강서 직업 강연   4. 푸르름 마음 치유 학교 음악 미술 치료   사업 신청 기간:미정 지원 규모(명):20명 이상 비고:연내 연령:만 19세 ~ 39세 거주지 및 소득:강서구 거주하며 재직  재학  청년 누구나 취업 상태:미취업자  재직자 신청 절차:1. 강서구청 홈페이지 접속 2.  내용 확인 3. 신청서류 제출 예정  4. 개별 사업기간 중 신청 기타 유익 정보:청년 미달 시 재공고 주관 기관:강서구청 일자리정책과\'), Document(metadata={\'name\': \'청년성장프로젝트 영천시 \', \'source\': \'..\\\\data\\\\policy_result.json\'}, page_content=\'기관:경북 영천시 정책 분야:교육분야 지원 내용:  청년카페  미취업 청년 의 구직 의욕 고취를 위한 맞춤형   심리상담  인프라를 하며 기존의 청년고용정책과 연계   직장적응  신입직원 직장적응  지원  CEO  중간관리자 대상 청년친화 조직문화 교육  사업 운영 기간:2024 04 01~2024 12 31 사업 신청 기간:미정 지원 규모(명):  청년카페   도내 미취업 청년    직장적응   도내 입직초기 청년  CEO  중간관리자  비고:미정 주관 기관:경상북도 운영 기관:영천\')], [{\'url\': \'https://blog.naver.com/PostView.naver?blogId=songpaict&logNo=223232755526\', \'content\': \'[송파구청 행사] 송파 청년 CEO 창업 포럼 개최 : 네이버 블로그 NAVER 블로그 블로그 검색 변경 전 공유된 블로그/글/클립 링크는 연결이 끊길 수 있습니다. 내 블로그  블로그 [ ]  블로그 블로그 15:19URL 복사 이웃추가본문 기타 기능공유하기 신고하기송파구에서 청년 CEO들을 위한 능력 향상과 네트워킹을 할 수 있는 행사를 개최합니다\\u200b송파 청년 CEO 창업 포럼\\u200b일시 : 2023.10.31(화) 14시-17시 10분장소 : 송파 아카데미(서울 송파구 잠실로 209, KT 송파빌딩 3층)대상 : 송파구에서 활동하고 있는 청년 창업가 CEO 40여명\\u200b많은 관심을 바랍니다:)\\u200b\\u200b송파ICT청년창업지원센터 컨택 안내👩\\u200d💻 홈페이지 : 서울테크노파크 홈페이지(http://songpaict.or.kr/)👩\\u200d💻 E-mail : 송파ICT청년창업지원센터 대표 메일 (songpaict@seoultp.or.kr)👩\\u200d💻 전화번호 : 02-2142-1950👩\\u200d💻 센터위치 : 서울특별시 송파구 중대로135 IT벤처타운 서관 11층송파ICT청년창업지원센터서울특별시 송파구 중대로 135 서관 11층 송파ICT청년창업지원센터\\u200b\\u200b\\u200b태그 취소 확인공감이 글에 공감한 블로거 열고 닫기댓글 쓰기 이 글에 댓글 단 블로거 열고 닫기인쇄댓글쓰기1/1이전 다음var gAdPostUnitIdForPC = false; var gNotAdPostUnitIdForPC = ""pc_blog_bottom_nrs""; 네이버는 블로그를 통해 저작물이 무단으로 공유되는 것을 막기 위해, 저작권을 침해하는 컨텐츠가 포함되어 있는 게시물의 경우 글보내기 기능을 제한하고 있습니다. 네이버는 블로그를 통해 저작물이 무단으로 공유되는 것을 막기 위해, 저작권을 침해하는 컨텐츠가 포함되어 있는 게시물의 경우 주제 분류 기능을 제한하고 있습니다.\'}, {\'url\': \'http://www.sisanews.kr/news/articleView.html?idxno=111270\', \'content\': ""송파구, 청년창업 성공 전략 \'송파 청년 CEO포럼\' 개최 < 한국지방자치 < 기사본문 - 시사경제신문 주요서비스 바로가기 본문 바로가기 매체정보 바로가기 로그인 바로가기 기사검색 바로가기 전체서비스 바로가기 송파구, 청년창업 성공 전략 \'송파 청년 CEO포럼\' 개최 송파구, 청년창업 성공 전략 \'송파 청년 CEO포럼\' 개최 댓글 0 [시사경제신문=원금희 기자 ] 송파구(구청장 서강석)는 지난 10월 31일 송파아카데미에서 청년 CEO를 대상으로 청년창업의 성공 전략을 논의하고 공유하는 \'2024 송파 청년 CEO포럼\'을 개최했다고 밝혔다. 먼저 창업 활성화 등 지역사회 발전에 기여한 청년 CEO 3인에 대한 표창 수여를 진행했다. 서강석 구청장은 “다양한 직군에 속한 청년들의 출발에 송파가 든든한 힘이 되도록 적극 지원하고 응원할 것”이라며 “미래의 주역인 청년들이 창업하기 좋은 송파를 만들고, 나아가 다양한 분야에서 청년 맞춤형 지원정책을 발굴·확대해 나가겠다”고 전했다. 권성동 대표 “민주당 ‘한덕수 총리’ 탄핵안은 탄핵 인질극”""}]']","송파 청년 CEO 포럼의 주관 기관은 **송파구청**입니다. 이 포럼은 송파구에서 청년 CEO들을 대상으로 창업 성공 전략을 논의하고 공유하는 행사로, 송파구청이 주관하여 진행되었습니다."
송파 청년CEO포럼의 신청 절차는 어떻게 되나요?,"['정책 이름: 송파 청년CEO포럼', '신청 절차: 사업공고 24.9월, 접수 24.9~10월, 행사운영 24.10월, 성과보고 24.11월']","사업공고는 24년 9월에, 접수는 24년 9월부터 10월까지, 행사운영은 24년 10월에, 성과보고는 24년 11월에 진행됩니다.","['[Document(metadata={\'name\': \'송파 청년CEO포럼\', \'source\': \'..\\\\data\\\\policy_result.json\'}, page_content=\'기관:서울 송파구 정책 분야:교육분야 지원 내용:청년CEO간의 네트워킹  교류의 장 형성  현안사항을 공론화 사업 신청 기간:미정 비고:2024.09월 사업공고 예정 연령:만 19세 ~ 39세 거주지 및 소득:송파구에서 활동하고 있는  예비  청년창업가 취업 상태: 예비 창업자 신청 절차:사업공고  24.9월   신청 접수  24.9~10월    행사운영  24.10월    성과보고  24.11월  주관 기관:송파구청 경제진흥과 운영 기관:송파구청\'), Document(metadata={\'name\': \'ICT산업기반 전문인력 양성\', \'source\': \'..\\\\data\\\\policy_result.json\'}, page_content=\'기관:서울 송파구 정책 분야:일자리분야 지원 내용:ICT산업기반 전문인력 양성 과정 교육 사업 신청 기간:미정 비고:각 세부 강의마다 상이함 연령:만 19세 ~ 39세 거주지 및 소득:청년취업준비생  실업자  특화 분야:중소기업 신청 절차:  송파구 홈페이지  심사 및 발표:공고 일정에 맞춰 심사  발표 일정 확정 제출 서류:신청서  자기소개서  재학 휴학 증명서  주관 기관:송파구청 경제진흥과 운영 기관:공모로 선정\'), Document(metadata={\'name\': \'청년 활성화 지원사업\', \'source\': \'..\\\\data\\\\policy_result.json\'}, page_content=\'기관:서울 강서구 정책 분야:.권리분야 지원 내용:1. 강서구 청년기구 운영 청년정책 공론장 운영  2. 강창맨 강서청년 창업지원 멘토링   3. 청년이 맘편히 일하는 강서 직업 강연   4. 푸르름 마음 치유 학교 음악 미술 치료   사업 신청 기간:미정 지원 규모(명):20명 이상 비고:연내 연령:만 19세 ~ 39세 거주지 및 소득:강서구 거주하며 재직  재학  청년 누구나 취업 상태:미취업자  재직자 신청 절차:1. 강서구청 홈페이지 접속 2.  내용 확인 3. 신청서류 제출 예정  4. 개별 사업기간 중 신청 기타 유익 정보:청년 미달 시 재공고 주관 기관:강서구청 일자리정책과\'), Document(metadata={\'name\': \'서울미래인재 모집\', \'source\': \'..\\\\data\\\\policy_result.json\'}, page_content=\'기관:서울 정책 분야:.권리분야 지원 내용:  서울시에서 결정되는 중요한 정책을 자문 조정 심의 의결   서울 시정에 하고자 하는 청년들을 모집하여 시정활동을 더 잘할 수 있도록 역량 강화을  사업 신청 기간:2024년 01월01일 ~ 2024년 12월31일 비고:20240101~20241231 연령:만 19세 ~ 39세 거주지 및 소득:  서울시에 거주  서울을 기반으로 활동  만 19~39세 청년 신청 절차:  운영 절차 미래인재 공개 모집 자격을 만족하는 청년 본인이 청년인재록 신청    미래인재 풀 구축 위원 위촉 추천을 위한 미래인재 데이터베이스 구축    역량 강화  운영 온라인 공통교육  분야별 특화 교육 실시    인재위촉 추천 청년들이 지출할 위원회 수요조사 후 위촉 진행    사후 지원 인재 간 네트워크 형성  청년위원의 위원회 활동 지원  환류  주관 기관:서울시 운영 기관:서울시\'), Document(metadata={\'name\': \'청년 1 1 맞춤형 취업 멘토링 김포시 \', \'source\': \'..\\\\data\\\\policy_result.json\'}, page_content=\'기관:경기 김포시 정책 분야:일자리분야 지원 내용: 개인별 맞춤형 멘토링 5회  횟수  방식  시간 선택가능 사업 신청 기간:상시 비고:2024.2.1~모집완료시 연령:만 19세 ~ 39세 거주지 및 소득: 김포시에 주민록을 둔  취업을 준비하거나 취업에 대해 동기부여가 필요한 청년 만 19세~39세   1985년~2005년생 신청 절차:  온라인접수 잡아바어플라이  기타 유익 정보: 문의처  김포시청 일자리경제과 031 980 5888 주관 기관:경기도 김포시 운영 기관:경기도 김포시\')], [{\'url\': \'https://www.welfarehello.com/community/hometownNews/0624ae0a-f340-4976-976b-7b068dcf3ce5\', \'content\': \'2023 송파 청년 CEO 창업포럼 | 서울특별시 송파구 | 웰로 2023 송파 청년 CEO 창업포럼 청년 CEO 날개를 달다🪽 송파구에서 활동하고 있는 청년 창업가 CEO를 대상으로 2023 송파 청년CEO 창업포럼 참여신청송파구 내 청년 창업 CEO를 대상으로 최근 창업트렌드, 성공 창업 사례, 투자유치방법에 대하여 앞서가는 창업가와 전문가들을 초빙하여 창업 노하우 공유를 공유하고 참여 CEO간 네트워크 기회를 마련하고자 합니다. ○ 일 시: 2023.10.31.(화) 14:00~17:10 ○ 장 소: 송파 아카데미 (서울 송파구 잠실로 209 KT 송파빌딩 3층) ○ 참석대상: 송파구에서 활동하고 있는 청년 창업가 CEO 40여명 ○ 부 제 : 청년 CEO 날개를 달다 ○ 내 용 ... {""title"":""2023 송파 청년 CEO 창업포럼"",""source"":""https://blog.naver.com/happysongpa/223241999108"",""blogName"":""송파구청 .."",""blogId"":""happysongpa"",""domainIdOrBlogId"":""happysongpa"",""logNo"":223241999108,""smartEditorVersion"":4,""cafeDisplay"":true,""blogDisplay"":true,""meDisplay"":true,""lineDisplay"":true,""outsideDisplay"":false} 24.12.23(월) 작성 24.12.23(월) 작성 24.12.23(월) 작성 24.12.23(월) 작성 #### [고령 먹거리] ""두툼한 갈비돈까스 드셔보세요"" <갈돈> 24.12.23(월) 작성\'}, {\'url\': \'https://www.slnews.co.kr/news/articleView.html?idxno=66495\', \'content\': \'송파구, 31일 ‘청년 CEO 창업 포럼’…참여자 모집 - 서울로컬뉴스 스포츠/연예 스포츠/연예 송파구, 31일 ‘청년 CEO 창업 포럼’…참여자 모집 송파구, 31일 ‘청년 CEO 창업 포럼’…참여자 모집 - 송파구 활동 청년창업가 40명 대상, 10월 25일까지 선착순 접수 송파 청년 CEO 창업 포럼 포스터 송파구(구청장 서강석)가 오는 10월 31일 청년 창업가를 대상으로 경영 과정의 어려움을 함께 나누고 해결 방안을 찾는 ‘송파 청년 CEO 창업 포럼(이하 청년창업포럼)’을 개최한다. 전문가 조언을 통해 창업의 난관을 극복할 수 있을 뿐만 아니라 참여 기업 간 다양한 정보교류와 협업을 활성화하는 기회의 장이기도 하다. 서강석 송파구청장은 “청년 창업가들은 지역 일자리 창출의 가장 큰 동력”이라며 “많은 청년 창업가들이 이번 포럼을 통해 창업 초기 어려움을 지혜롭게 극복하고 안정적으로 경영 활동을 이어가기를 기대한다”고 전했다. 이름  비밀번호  8 목동깨비시장, ‘사랑의 김장나눔’ 행사 성황리에 개최\'}]']","송파 청년 CEO 포럼의 신청 절차는 다음과 같습니다:

1. **사업공고 확인**: 송파구청의 공식 홈페이지에서 사업 공고를 확인합니다.
2. **신청 접수**: 포럼의 신청 기간이 정해지면 해당 기간 내에 신청을 접수합니다. (2024년 9월로 예정되어 있음)
3. **행사 운영**: 신청 후, 포럼이 운영되는 일정에 따라 참석합니다.
4. **성과 보고**: 행사 후, 성과를 보고하는 절차가 있을 수 있습니다.

참고로, 2023 송파 청년 CEO 창업포럼은 10월 31일에 개최되며, 선착순으로 40명의 청년 창업가를 모집하고 있다는 점도 기억해 두시면 좋습니다."
송파 청년CEO포럼의 지원 내용은 무엇인가요?,"['정책 이름: 송파 청년CEO포럼', '지원 내용: 청년CEO간의 네트워킹 교류의 장 형성, 현안사항을 공론화']","청년CEO간의 네트워킹 교류의 장을 형성하고, 현안사항을 공론화합니다.","[""[Document(metadata={'name': '송파 청년CEO포럼', 'source': '..\\\\data\\\\policy_result.json'}, page_content='기관:서울 송파구 정책 분야:교육분야 지원 내용:청년CEO간의 네트워킹  교류의 장 형성  현안사항을 공론화 사업 신청 기간:미정 비고:2024.09월 사업공고 예정 연령:만 19세 ~ 39세 거주지 및 소득:송파구에서 활동하고 있는  예비  청년창업가 취업 상태: 예비 창업자 신청 절차:사업공고  24.9월   신청 접수  24.9~10월    행사운영  24.10월    성과보고  24.11월  주관 기관:송파구청 경제진흥과 운영 기관:송파구청'), Document(metadata={'name': '청년 공간 운영', 'source': '..\\\\data\\\\policy_result.json'}, page_content='기관:부산 사하구 정책 분야:.권리분야 지원 내용:   지원내용 창업공간지원  창업교육  상담  인큐베이팅  멘토링  청년취업역량강화 교육  메이커  운영  사업 신청 기간:상시 연령:만 19세 ~ 39세 거주지 및 소득:  청년 누구나 추가 단서 사항:   주요기능 창업보육 청년활동지원    조성시설 입주공간  시제품제작실  세미나실  스터디룸  공유카페  영상작업실  참여 제한 대상:  없음 제출 서류:공고 확인 주관 기관:  사하구 일자리복지과'), Document(metadata={'name': '송파 ICT청년창업지원센터 운영', 'source': '..\\\\data\\\\policy_result.json'}, page_content='기관:서울 송파구 정책 분야:일자리분야 지원 내용:입주사무실 개별 7개  개방형 20석   미팅룸  회의실  창업  컨설팅  사업 운영 기간:2024.1. ~ 2024.12. 사업 신청 기간:상시 지원 규모(명):청년 창업기업 약 20개 비고:상시 연령:만 19세 ~ 39세 거주지 및 소득:청년 창업기업 ICT  기타 기술특허를 활용한 창업 분야  특화 분야:중소기업  기타 ICT  기타 기술특허  신청 절차:  송파구 홈페이지 공고문 참조  양식 다운   구비 서류 양식 작성  증빙서류 구비    송파구 일자리정책담당관 송파구 홈페이지 공고 참조하여  방문 신청 심사 및 발표:공고 일정에 맞춰 심사  발표 일정 확정 제출 서류:신청서  기업소개  사업계획  기타 유익 정보:주요 운영    멘토링 지원  사무공간 지원  창업아카데미 원데이 클래스  창업상담소  네트워킹 데이  IR  데모데이 주관 기관:송파구청 경제진흥과'), Document(metadata={'name': '청년성장프로젝트 상주시 ', 'source': '..\\\\data\\\\policy_result.json'}, page_content='기관:경북 상주시 정책 분야:교육분야 지원 내용:  청년카페  미취업 청년 의 구직 의욕 고취를 위한 맞춤형   심리상담  인프라를 하며 기존의 청년고용정책과 연계   직장적응  신입직원 직장적응  지원  CEO  중간관리자 대상 청년친화 조직문화 교육  사업 운영 기간:2024 04 01~2024 12 31 사업 신청 기간:미정 지원 규모(명):  청년카페   도내 미취업 청년    직장적응   도내 입직초기 청년  CEO  중간관리자  비고:미정 주관 기관:경상북도 운영 기관:상주'), Document(metadata={'name': '청년도전지원사업 파주시 ', 'source': '..\\\\data\\\\policy_result.json'}, page_content='기관:경기 파주시 정책 분야:일자리분야 지원 내용:   소개  교육내용   도전 단기   1 1 상담  밀착상담  사례관리  자신감 회복  진로탐색  취업역량강화    도전  중 장기  도전  내용을 확대  자의 특성  요구에 맞는 외부연계활동  추가 운영   자세한   내용은 홈페이지 참고    활동을 촬영하고  영상  사진  통영시청년센터 홈페이지  SNS에 게시될 예정이니 촬영에 동의하실 청년만 신청 부탁드립니다.     자 혜택   단기   수당 50만원   중기   수당 150만원  이수 인센티브 20만원   장기   수당 250만원  이수 인센티브 20만원 취업 활동시  30만원   취업 인센티브 50만원 사업 신청 기간:상시 지원 규모(명):  90명 비고:  모집기간   2024. 5. 2. ~ 수시 모집  선착순 마감  연령:만 18세 ~ 34세 거주지 및 소득:  모집대상   구직단념청년     사업신청일 이전 6개월 이상 취업  교육 직업훈련  이력이 없고    구직단념청년 상담원 문답표 붙임1  21점이상 만점30점 인 만18~34세 청년   자립준비청년   아동복지시설  에서 보호받고 퇴소한 자 중 퇴소 5년 이내의 청년  퇴소 대상자임에도 불구하고 퇴소일을 연장한 만18세~34세 청년  아동복지시설  아동양육시설  공동생활가정  가정위탁  아동보호치료시설  자립지원시설    청소년복지시설 입퇴소 청년   청소년복지시설 에서 6개월 이상 보호한 만18세~34세 청년  청소년복지시설  청소년쉼터  청소년자립지원관  청소년회복지원시설    북한이탈청년   북한을 이탈한 자로서 만18~34세 청년   지역특화   파주시 거주  만19 ~ 39세 청년 중 아래 1  ~3 에 하는 청년 전체 인원의 30%   1  주 30시간 미만 생계형 아르바이트 근로 청년  2 경력 단절 여성  3  만35~39세 청년도전 지원사업의 지원 조건을 만족하는 청년 참여 제한 대상:  제한  공통  자에 하더라도 다음의 어느 하나에 하는 자는 청년도전 지원사업 를 제한     고용보험법에  구직급여를 받고 있거나 구직급여의 지급이 끝난 날부터 6개월이 지나지 아니한 자    다만  고용보험에 가입되어 구직급여 수급자격을 갖춘 라도 구직급여를 수급하지 않으면  가능    국민취업지원제도에 하여 수혜  자     학점은행제  사이버대학교  대학원  방송통신고 대 학교  재학생  도전     요건 충족 시 재 가능 이수자 재 시 수당  중복지급 불가    도전    후 종료된 자는 종료일로부터 6개월 경과 후에  도전     가능 단  당해연도 중복  불가    도전   이수자는 도전  재 불가   국민취업지원제도  유형   중 IAP 수립 시 구직활동지원 으로 청년도전지원사업 를 계획할  중복  가능  청년도전지원사업  대상 요건 충족 시    단  청년도전지원사업 수당과 국민취업지원제도 구직촉진수당 중복지급 불가    국민취업지원제도  유형   중 직업훈련  일경험 미   전일  중복  가능 청년도전지원사업  대상 요건 충족 시   도전     국가  지자체의 유사 사업에 하여 수당  을 지원받은 자로서 수당 지급이 끝난 날부터 6개월이 지나지 아니한 자는  제외  월평균 50만 원 이상  총 300만 원 이상   6개월 산정 시점은 신청일 기준     도전     후 종료된 자는 종료일 이수일  중도탈락일 로부터 1년 경과 후 같은  재 가능 신청 절차: 신청방법   인터넷 신청 접수   워크넷 홈페이지 접속 후 청년도전지원사업 검색  기관  지에스씨넷 파주지점 필수 선택   QR 코드 접속 후 신청  첨부된 공고문 참고  기타 유익 정보: 문의    지에스씨넷 파주지점 청년도전지원사업 담당자   031 941 1490  070 7711 1315 직통  주관 기관:경기도 파주시 운영 기관:경기도 파주시')], [{'url': 'http://www.swnews.kr/news/articleView.html?idxno=71068', 'content': '송파구, ‘송파 청년 CEO포럼’ 성료 < 미션&서비스 < 기사본문 - 서울복지신문 송파구, 화재 예방 ‘옥상 출입문 자동개폐장치’ 설치 지원 -------------------------------- 송파구, ‘송파 청년 CEO포럼’ 성료 △관내 청년 CEO 간 네트워크 형성 △창업 성공 운영 노하우 공유 댓글 0 [서울복지신문=김수정 기자] 송파구(구청장 서강석)는 지난달 31일 송파아카데미에서 청년 CEO를 대상으로 청년창업의 성공 전략을 논의하고 공유하는 ‘2024 송파 청년 CEO포럼’을 개최했다고 밝혔다. 이날 포럼에서는 청년창업 성공 비결에 대하여 전문가 발제와 참여자의 자유로운 토론을 통해 청년 창업가들이 겪는 경영의 어려움을 함께 논의하고 해결책을 찾아가는 교류의 장이 형성됐다. 먼저, 창업 활성화 등 지역사회 발전에 기여한 청년 CEO 3인에 대한 표창 수여를 진행했다. 두 번째 발제는 이대양 작가가 ‘꿈, 현재 그리고 미래’를 주제로 청년 창업가들이 도전 과정에서 갖춰야 할 마인드와 창의적 사고의 중요성에 대한 이야기를 나눴다. 송파구, 화재 예방 ‘옥상 출입문 자동개폐장치’ 설치 지원 서울복지신문'}, {'url': 'http://www.onseoul.net/news/articleView.html?idxno=37096', 'content': '송파구, 청년지원에 집중!「송파 청년 CEO포럼」성료 < 자치구 < 서울시뉴스 < 기사본문 - 서울자치신문 주요서비스 바로가기 본문 바로가기 매체정보 바로가기 로그인 바로가기 기사검색 바로가기 전체서비스 바로가기 instagram twitter rss mobile 송파구, 청년지원에 집중!「송파 청년 CEO포럼」성료 송파구, 청년지원에 집중!「송파 청년 CEO포럼」성료 - ▲관내 청년 CEO 간 네트워크 형성 ▲창업 성공 운영 노하우 공유 송파구(구청장 서강석)는 지난 10월 31일 송파아카데미에서 청년 CEO를 대상으로 청년창업의 성공 전략을 논의하고 공유하는 「2024 송파 청년 CEO포럼」을 개최했다고 밝혔다. 이날 포럼에서는 청년창업 성공 비결에 대하여 전문가 발제와 참여자의 자유로운 토론을 통해 청년 창업가들이 겪는 경영의 어려움을 함께 논의하고 해결책을 찾아가는 교류의 장이 형성됐다. 먼저, 창업 활성화 등 지역사회 발전에 기여한 청년 CEO 3인에 대한 표창 수여를 진행했다. 뮤지컬 ‘어제의 시는 내일의 노래가 될 수 있을까’, 캐스팅 공개'}]""]","송파구의 '송파 청년 CEO포럼'은 청년 창업가들을 위한 네트워킹 및 교육의 장을 제공하는 프로그램입니다. 이 포럼의 주요 지원 내용은 다음과 같습니다:

1. **네트워킹 및 교류의 장 형성**: 청년 CEO들 간의 네트워킹을 통해 서로의 경험과 노하우를 공유하고, 창업의 성공 전략을 논의합니다.

2. **전문가 발제 및 자유로운 토론**: 창업 관련 전문가가 주제에 대해 발제를 하고, 참여자들이 자유롭게 의견을 나누는 토론의 기회를 제공합니다.

3. **창업 성공 비결 공유**: 청년 창업가들이 겪는 경영의 어려움을 함께 논의하고 해결책을 모색하는 자리입니다.

4. **표창 수여**: 창업 활성화 등 지역사회 발전에 기여한 청년 CEO들에게 표창을 수여하는 과정도 포함되어 있습니다.

사업 신청은 아직 미정이며, 2024년 9월에 사업 공고가 예정되어 있습니다. 연령 제한은 만 19세에서 39세까지의 청년 창업가들로, 송파구에서 활동 중인 예비 창업자들이 해당됩니다."
2024년 무주군로컬JOB센터 면접활동비 지원사업의 지원 금액은 얼마인가요?,"['정책 이름: 2024년 무주군로컬JOB센터 면접활동비 지원사업 모집', '기관: 전북 무주군', '정책 분야: 복지.문화분야', '지원 내용: 관내 사업장에 면접을 응한 구직에게 면접활동비 50 000원 회 지원']","면접활동비 50,000원을 지원합니다.","['[Document(metadata={\'name\': \'울산 남구 저소득층 청년 취업면접 수당 지원\', \'source\': \'..\\\\data\\\\policy_result.json\'}, page_content=\'기관:울산 정책 분야:일자리분야 지원 내용:  지원금액  면접 1회당 20만원  1회 한함  사업 신청 기간:2024년 03월01일 ~ 2024년 12월31일 비고:2024.3.1. ~ 2024.12.31.  예산소진 시 조기 종료 연령:만 18세 ~ 39세 거주지 및 소득:  모집대상  남구거주 18세 이상 39세 이하 저소득층 청년   신청자격   소득인정액 중위소득 100%이하 청년 1985.1.1. ~ 2006.12.31.    2024.3.1. 이후 면접에 응시한 자 참여 제한 대상:  취업 목적이 아닌 각종 교육  훈련 과정에 하기 위한 면접인    사회 통념상 취업을 위한 면접에 응시했다고 인정할 수 없는    취업 의사가 없음에도 수당을 목적으로 면접에 응한 것이 확인된    직계 존비속  배우자  가족이 대표자인 사업장 에 지원하는  신청 절차:  신청장소  주소지 동 행정복지센터 제출 서류:면접확인서  면접기업 채용 공고문 3개월이상 일자리   건강보험자격득실확인서  건강보험료납부확인서  주민록본 주관 기관:울산광역시 남구 복지지원과 운영 기관:주소지 동 행정복지센터\'), Document(metadata={\'name\': \'2024년 무주군로컬JOB센터 면접활동비 지원사업 신청자 모집\', \'source\': \'..\\\\data\\\\policy_result.json\'}, page_content=\'기관:전북 무주군 정책 분야:복지.문화분야 지원 내용:관내 사업장에 면접을 응시한 구직자에게 면접활동비 50 000원 회  지원 사업 운영 기간:공고일 ~ 2024. 12. 31. 예산 소진 시까지  사업 신청 기간:상시 비고:~ 2024 12 31 화   예산소진시까지  거주지 및 소득:  구직신청한 자   지역 내 구인업체 채용면접에 응시한 자  관공서 제외    고용안정정보망 워크넷 에 알선처리한 에만 지원 신청 절차:  구직상담  구직록   센터에서 적합한 일자리 정보   면접 응시 담당자와 사전에 상담 후 진행    구인사업장 채용담당자에게 면접확인서 작성요청   면접활동비 신청서  구비서류 제출 면접 지원 신청서  면접확인서    적격여부 확인 후 지급 제출 서류:  면접활동비 지원 신청서   면접확인서 주관 기관:무주군 운영 기관:무주군\'), Document(metadata={\'name\': \'경북 청년애꿈 수당\', \'source\': \'..\\\\data\\\\policy_result.json\'}, page_content=\'기관:경북 정책 분야:일자리분야 지원 내용:  면접수당   도내 중소 중견기업 면접 시 7만원 지원 1인 최대 5회    취업성공수당   도내 중소 중견기업 생애 최초 취업 성공 시 50만원 지원 1인 1회     근속장려수당   도내 중소 중견기업 1년 이상 재직 시 120만원 지원 1인 1회  사업 운영 기간:2024 04 29~2025 02 28 사업 신청 기간:2024년 04월29일 ~ 2024년 12월31일 지원 규모(명):도내 구직  근로활동을 하는 19세 ~ 39세 청년 1 084명 정도   면접수당   400명   취업성공수당   84명   근속장려수당   600명 비고:2024 04 29~2024 12 31 연령:만 19세 ~ 39세 거주지 및 소득: 19~39세 청년  도내 중소 중견기업 면접자  도내 중소 중견기업 생애 최초 취업성공 청년  도내 중소 중견기업 1년 이상 재직 청년 신청 절차:청년애꿈수당.kr gbwork.kr 주관 기관:경상북도 운영 기관: 재 경상북도경제진흥원\'), Document(metadata={\'name\': \'수원시 청년 도전 지원사업\', \'source\': \'..\\\\data\\\\policy_result.json\'}, page_content=\'기관:경기 수원시 정책 분야:일자리분야 지원 내용:  도전   수당 1인 50만원 지급   도전     5주 단위로 수당 1인 50만원 지급 중기 최대 170만원  장기 최대 300만원   취업인센티브 50만원  별도 사업 신청 기간:상시 비고:  접수기간 2024. 3. 21.~ 선착순 마감   운영일정 2024. 4. 23.~  중기  모집 3.21.~4.10. 진행 4~8월 15주 120시간  장기  모집 6.4.~6.24. 진행 7~12월 5개월 이상 200시간  단기  모집 7.16.~8.5. 진행 8~9월 5주 40시간 연령:만 18세 ~ 39세 거주지 및 소득:   구직단념청년  사업 신청일 이전 6개월 이상 취업 교육 직업훈련  이력이 없는 18~34세 청년    자립준비청년  아동복지시설 에서 보호받고 퇴소한 자 중 퇴소 5년 이내의 청년  퇴소 대상자임에도 불구하고 퇴소일을 연장한 18~34세 청년     기타 상세 자 조건은 첨부파일을 확인해주세요. 주관 기관:  고용노동부 운영 기관:  수원시청년지원센터 청년기획팀 031 231 0713 \'), Document(metadata={\'name\': \'청년 행복알바사업 구리시 \', \'source\': \'..\\\\data\\\\policy_result.json\'}, page_content=\'기관:경기 구리시 정책 분야:일자리분야 지원 내용:  사업기간   2024. 1. ~ 2.   7. ~ 8.  총 4개월    사업내용   공공업무 보조    근무장소   시청  사업소 각 부서  동 행정복지센터   자 임금  근로조건   시 급9 860원 2024년 최저임금    교통비 간식비  부대비용 지급1일 5 000원   주 연차수당 지급4대보험 가입   근로시간주20시간  일 4시간 주5일근무    근무시간 외 휴게시간 30분  사업 신청 기간:미정 지원 규모(명):  모집대상 사업개시일 현재 19세~39세 이하 구리시 거주 미취업 청년 80명.  취약계층  지역경제 침체로 생계지원이 필요한 청년 우선선발. 비고:  모집공고기간   2024. 5월 4째주 예정 연령:만 19세 ~ 39세 주관 기관:  구리시 일자리경제과 일자리정책팀 031 550 8323 \')], [{\'url\': \'https://www.welfarehello.com/policy/9a560b40-52b8-4544-8b9c-374e36239f88\', \'content\': \'2024년 무주군로컬JOB센터 면접활동비 지원 | 전북특별자치도 무주군 | 웰로 서비스가 더 궁금한가요?5,200만 국민에게 정책을 알리고 싶다면? 2024년 무주군로컬JOB센터 면접활동비 지원 전북특별자치도 무주군 정책을 요약했어요 지원대상은 무주군로컬JOB센터를 통해 구직신청하고 지역내 구인업체 채용면접을 본 자로 고용안정정보망에 알선처리된 경우에 한함. 지원내용은 관내 사업장 면접 응시자에게 회당 50,000원의 면접활동비를 지원하며 1인당 최대 2회까지 지원된다. 신청방법은 무주군로컬JOB센터를 방문해 관련 서류를 제출해야 하며 세부 문의는 취업지원팀에 연락하면 된다. ○ 아래 요건을 모두 충족한 자 - 무주군로컬JOB센터를 통해서 구직신청한 자 - 지역 내 구인업체 채용면접에 응시한 자 - 고용안정정보망(워크넷)에 알선처리한 경우에만 지원 ○ 관내 사업장에 면접을 응시한 구직자에게 면접활동비(50,000원/회) 지원 - 1인당 최대 2회 지원(예산상황에 따라 변동가능) - 동일 사업장에 면접 응시한 경우 1회만 지원 ○ 구비서류 - 면접활동비 지원 신청서 ○ 방문 : 무주군로컬JOB센터(일자리센터) - 전북 무주군 무주읍 주계로 116.\'}, {\'url\': \'https://www.jjan.kr/article/20240320580017\', \'content\': \'무주군, 지역 내 구직자들 면접활동비 지원 무주군, 지역 내 구직자들 면접활동비 지원 4 ""원더풀 군산""⋯ 군산 외국인 주민 전체 인구 5% \\\'역대 최다\\\' 홈 chevron_right 지역 chevron_right 무주 무주군, 지역 내 구직자들 면접활동비 지원 무주군이 구직자 면접활동비 지원 계획을 밝혔다. 면접활동비 지원은 면접에 필요한 비용 일부를 보전해주는 것으로 ‘2024년 전북 농·식품 도농(都農)상생형 플러스 일자리 사업’의 일환으로 추진된다. 재원은 무주군이 고용노동부에서 주관한 지역·산업맞춤형 일자리창출 지원 사업 공모에 선정되면서 확보한 예산 3억 원(국비 2억 5000만 원 / 도비 5000만 원)을 토대로 하며 무주군로컬JOB센터(이하 JOB센터)를 통해 구직자들에게 면접활동비 1인당 최대 10만 원을 지원한다. 면접활동비 지원 대상은 JOB센터에 구직 신청 후 무주군 지역 내 구인 업체의 채용 면접에 응시한 사람이다. 3""원더풀 군산""⋯ 군산 외국인 주민 전체 인구 5% \\\'역대 최다\\\' [54931] 전북 전주시 덕진구 기린대로 418 (금암동)\'}]']","2024년 무주군로컬JOB센터 면접활동비 지원사업의 지원 금액은 면접 1회당 50,000원입니다. 1인당 최대 2회까지 지원이 가능하며, 구직자가 관내 사업장에 면접을 응시한 경우에 한해 지원됩니다."
2024년 무주군로컬JOB센터 면접활동비 지원사업의 신청 절차는 어떻게 되나요?,"['정책 이름: 2024년 무주군로컬JOB센터 면접활동비 지원사업 모집', '신청 절차: 구직상담 구직록 센터에서 적합한 일리 정보 면접 응 담당와 사전에 상담 진행 구인사업장 채용담당에게 면접서 작성요청 면접활동비 서 구비서류 제출 면접 지원 서 면접서 적격여부 지급']","구직상담, 구직록 작성, 센터에서 적합한 일자리 정보 제공, 면접 응시 담당과 사전에 상담 진행, 구인사업장 채용담당에게 면접서 작성 요청, 면접활동비 서류 구비 후 제출하여 적격여부 판단 후 지급합니다.","[""[Document(metadata={'name': '온라인 입사지원서  면접 컨설팅 남양주시 ', 'source': '..\\\\data\\\\policy_result.json'}, page_content='기관:경기 남양주시 정책 분야:일자리분야 지원 내용:  지원 내용   입사지원서  화상면접 컨설팅 각 컨설팅 무료 지원 횟수 연 최대 2회    준비사항   구직록 워크넷 구직록확인증  구직인증번호   공통사항   입사지원서 컨설팅   작성된 입사지원서   화상면접 컨설팅   면접증빙자료  작성된 입사지원서  카메라  마이크가 사용 가능한 기기 사업 신청 기간:상시 비고:  2024년 3월~12월 예산 소진 시까지  거주지 및 소득:  남양주시 구직자 누구나 신청 절차:  입사지원서 컨설팅  절차 1. 입사지원서 온라인 신청   통합접수시스템 https   apply.jobaba.net  남양주 온라인 입사지원서  면접 컨설팅 신청 준비사항의 서류 제출    일자리지원팀 접수 2. 피드백   신청자의 메일로 7일 이내 피드백 자소서 항목별 첨삭  주관 기관:  남양주시 일자리정책과   031 590 2679'), Document(metadata={'name': '2024년 무주군로컬JOB센터 면접활동비 지원사업 신청자 모집', 'source': '..\\\\data\\\\policy_result.json'}, page_content='기관:전북 무주군 정책 분야:복지.문화분야 지원 내용:관내 사업장에 면접을 응시한 구직자에게 면접활동비 50 000원 회  지원 사업 운영 기간:공고일 ~ 2024. 12. 31. 예산 소진 시까지  사업 신청 기간:상시 비고:~ 2024 12 31 화   예산소진시까지  거주지 및 소득:  구직신청한 자   지역 내 구인업체 채용면접에 응시한 자  관공서 제외    고용안정정보망 워크넷 에 알선처리한 에만 지원 신청 절차:  구직상담  구직록   센터에서 적합한 일자리 정보   면접 응시 담당자와 사전에 상담 후 진행    구인사업장 채용담당자에게 면접확인서 작성요청   면접활동비 신청서  구비서류 제출 면접 지원 신청서  면접확인서    적격여부 확인 후 지급 제출 서류:  면접활동비 지원 신청서   면접확인서 주관 기관:무주군 운영 기관:무주군'), Document(metadata={'name': '울산 남구 저소득층 청년 취업면접 수당 지원', 'source': '..\\\\data\\\\policy_result.json'}, page_content='기관:울산 정책 분야:일자리분야 지원 내용:  지원금액  면접 1회당 20만원  1회 한함  사업 신청 기간:2024년 03월01일 ~ 2024년 12월31일 비고:2024.3.1. ~ 2024.12.31.  예산소진 시 조기 종료 연령:만 18세 ~ 39세 거주지 및 소득:  모집대상  남구거주 18세 이상 39세 이하 저소득층 청년   신청자격   소득인정액 중위소득 100%이하 청년 1985.1.1. ~ 2006.12.31.    2024.3.1. 이후 면접에 응시한 자 참여 제한 대상:  취업 목적이 아닌 각종 교육  훈련 과정에 하기 위한 면접인    사회 통념상 취업을 위한 면접에 응시했다고 인정할 수 없는    취업 의사가 없음에도 수당을 목적으로 면접에 응한 것이 확인된    직계 존비속  배우자  가족이 대표자인 사업장 에 지원하는  신청 절차:  신청장소  주소지 동 행정복지센터 제출 서류:면접확인서  면접기업 채용 공고문 3개월이상 일자리   건강보험자격득실확인서  건강보험료납부확인서  주민록본 주관 기관:울산광역시 남구 복지지원과 운영 기관:주소지 동 행정복지센터'), Document(metadata={'name': '청년지원센터 더누림 플랫폼  운영 광주시 ', 'source': '..\\\\data\\\\policy_result.json'}, page_content='기관:경기 광주시 정책 분야:일자리분야 지원 내용:  민간위탁 운영 사업 운영 기간:2024.1~12. 사업 신청 기간:상시 비고:2024.1.1.~2024.12.31. 연령:만 19세 ~ 39세 거주지 및 소득:  광주시 청년 누구나 신청 절차:  광주시 청년지원센터 홈페이지 신청 접수 심사 및 발표:  선착순 모집  선정자 개별 연락 주관 기관:  경기도 광주시 운영 기관:  광주시 청년지원센터 더누림플랫폼 '), Document(metadata={'name': ' 울진군  포항고용센터 구직자 취업역량 강화 ', 'source': '..\\\\data\\\\policy_result.json'}, page_content='기관:경북 울진군 정책 분야:교육분야 지원 내용:  운영일시   2024. 7. 17. 수  오후 1시~   운영장소   울진청년일자리센터 울진읍 읍내로 57 6      주요내용  가. 1일 3시간 과정 취업지원 교육 구직활동 인정   나. 변화하는 직업세계 이해  일자리 정보탐색  서류  면접 준비  구직기술 향상 지원  다. 사후관리 일자리 매칭   사업 운영 기간:2024 07 17~2024 07 17 사업 신청 기간:미정 지원 규모(명):15명 선착순  비고:2024 06 25~2024 07 15 연령:만 19세 ~ 49세 취업 상태:미취업 제출 서류:신청서 주관 기관:포항고용복지플러스센터 운영 기관:울진군  포항고용복지플러스센터')], [{'url': 'https://www.welfarehello.com/policy/9a560b40-52b8-4544-8b9c-374e36239f88', 'content': '2024년 무주군로컬JOB센터 면접활동비 지원 | 전북특별자치도 무주군 | 웰로 서비스가 더 궁금한가요?5,200만 국민에게 정책을 알리고 싶다면? 2024년 무주군로컬JOB센터 면접활동비 지원 전북특별자치도 무주군 정책을 요약했어요 지원대상은 무주군로컬JOB센터를 통해 구직신청하고 지역내 구인업체 채용면접을 본 자로 고용안정정보망에 알선처리된 경우에 한함. 지원내용은 관내 사업장 면접 응시자에게 회당 50,000원의 면접활동비를 지원하며 1인당 최대 2회까지 지원된다. 신청방법은 무주군로컬JOB센터를 방문해 관련 서류를 제출해야 하며 세부 문의는 취업지원팀에 연락하면 된다. ○ 아래 요건을 모두 충족한 자 - 무주군로컬JOB센터를 통해서 구직신청한 자 - 지역 내 구인업체 채용면접에 응시한 자 - 고용안정정보망(워크넷)에 알선처리한 경우에만 지원 ○ 관내 사업장에 면접을 응시한 구직자에게 면접활동비(50,000원/회) 지원 - 1인당 최대 2회 지원(예산상황에 따라 변동가능) - 동일 사업장에 면접 응시한 경우 1회만 지원 ○ 구비서류 - 면접활동비 지원 신청서 ○ 방문 : 무주군로컬JOB센터(일자리센터) - 전북 무주군 무주읍 주계로 116.'}, {'url': 'https://www.jb2030.or.kr/policy/p2_view.html?id=1192&tname=wel', 'content': '로그인 ㅣ 회원가입 청년참여예산 바로가기 검색 검색 닫기 청년정책 페이지 위치 청년정책 청년정책 통합검색(맞춤형검색) 청년정책 통합검색(맞춤형검색) 공유하기 인쇄하기 URL 청년정책 통합검색(맞춤형검색) 2024년 무주군로컬JOB센터 면접활동비 지원사업 신청자 모집 작성일 : 2024-07-30 사업개요 해당지역    전체 담당기관명   무주군 대상  다음요건을 모두 충족한 자 (구직신청한 자, 지역 내 구인업체 채용면접에 응시한 자 (※관공서 제외), 고용안정정보망(워크넷)에 알선처리한 경우에만 지원 접수기간    ~ 2024-12-31(화) (예산소진시까지) 문의처 063-322-9297 첨부파일   무주군로컬잡센터면접활동비지원사업.jpg 공고상세보기URL   https://www.muju.go.kr/planweb/board/view.9is?dataUid=4028a6d290b930730190ee51c7871789&page=1&contentUid=ff8080816c5f9d47016cbd3ae19f006b&boardUid=ff8080816d135a54016d1ecde9d8001a&searchType=&keyword=&categoryUid1=&categoryUid2=&categoryUid3= 목록 유관기관배너 개인정보 처리방침 이용약관 오시는길 주요 사이트 전북특별자치도 전주시 덕진구 오공로 123 테크비즈센터 4층 전북청년허브센터 TEL 063-227-2030 FAX 063-229-5509 COPYRIGHT (C) 2020 전북창조경제혁신센터 ALL RIGHT RESERVED'}]""]","2024년 무주군로컬JOB센터 면접활동비 지원사업의 신청 절차는 다음과 같습니다:

1. **지원 자격 확인**: 신청자는 다음 조건을 모두 충족해야 합니다:
   - 무주군로컬JOB센터를 통해 구직신청을 한 자
   - 지역 내 구인업체 채용면접에 응시한 자 (관공서 제외)
   - 고용안정정보망(워크넷)에 알선처리된 경우

2. **신청서 제출**: 지원자는 무주군로컬JOB센터를 방문하여 면접활동비 지원 신청서를 포함한 구비서류를 제출해야 합니다.

3. **구비서류**: 제출해야 할 서류는 다음과 같습니다:
   - 면접활동비 지원 신청서

4. **신청 기간**: 이 사업은 상시 신청 가능하며, 예산 소진 시까지 진행됩니다. (2024년 12월 31일까지 신청 가능)

5. **문의처**: 추가적인 문의는 무주군 취업지원팀에 연락하면 됩니다. 

이 절차를 통해 지원자는 면접활동비를 신청할 수 있습니다."
2024년 무주군로컬JOB센터 면접활동비 지원사업의 운영 기관은 어디인가요?,"['정책 이름: 2024년 무주군로컬JOB센터 면접활동비 지원사업 모집', '주관 기관: 무주군', '운영 기관: 무주군']",운영 기관은 무주군입니다.,"[""[Document(metadata={'name': '울진군   포항고용센터 협업  취업지원 ', 'source': '..\\\\data\\\\policy_result.json'}, page_content='기관:경북 울진군 정책 분야:일자리분야 지원 내용:  명   내일 my job 을 위한 준비   운영일시  2024. 4. 23. 화  오후 1시 3시간 소요     운영장소  울진청년일자리센터 3층 세미나실 울진읍 읍내로 57 6    대상  취업을 준비하고 있는 구직자 누구나    주요내용    취업의욕 고취  구직기술 향상 지원을 위한 구직자 역량강화    변화하는 직업의 세계 이해  일자리 정보탐색  서류  면접준비     교육주관  포항고용센터     신청방법  온라인 청년이끌림   방문 울진군청 일자리경제과  신청서 제출 사업 운영 기간:2024 04 23~2024 04 23 사업 신청 기간:미정 지원 규모(명):15명 비고:2024 04 02~2024 04 20 연령:만 19세 ~ 49세 심사 및 발표:선착순 제출 서류:신청서 작성 주관 기관:울진군 운영 기관:울진군  포항고용센터'), Document(metadata={'name': '2024년 무주군로컬JOB센터 면접활동비 지원사업 신청자 모집', 'source': '..\\\\data\\\\policy_result.json'}, page_content='기관:전북 무주군 정책 분야:복지.문화분야 지원 내용:관내 사업장에 면접을 응시한 구직자에게 면접활동비 50 000원 회  지원 사업 운영 기간:공고일 ~ 2024. 12. 31. 예산 소진 시까지  사업 신청 기간:상시 비고:~ 2024 12 31 화   예산소진시까지  거주지 및 소득:  구직신청한 자   지역 내 구인업체 채용면접에 응시한 자  관공서 제외    고용안정정보망 워크넷 에 알선처리한 에만 지원 신청 절차:  구직상담  구직록   센터에서 적합한 일자리 정보   면접 응시 담당자와 사전에 상담 후 진행    구인사업장 채용담당자에게 면접확인서 작성요청   면접활동비 신청서  구비서류 제출 면접 지원 신청서  면접확인서    적격여부 확인 후 지급 제출 서류:  면접활동비 지원 신청서   면접확인서 주관 기관:무주군 운영 기관:무주군'), Document(metadata={'name': '노원구 청년일자리센터 청년 내일', 'source': '..\\\\data\\\\policy_result.json'}, page_content='기관:서울 노원구 정책 분야:일자리분야 지원 내용:취업상담  취업역량강화 교육  열린공간 운영  이력서  자소서 클리닉  실전 모의면접  면접장 대여  면접사진 촬영 사업 운영 기간:2024.01. ~2024.12. 사업 신청 기간:상시 비고:연중운영 연령:만 19세 ~ 39세 거주지 및 소득:서울시 거주  활동 청년 주관 기관:노원구청청년정책과 운영 기관:청년일자리센터 청년내일'), Document(metadata={'name': '단기집단상담', 'source': '..\\\\data\\\\policy_result.json'}, page_content='기관:제주 정책 분야:교육분야 지원 내용:  지원내용   사업량    운영 100회    사업기간   2024 .1 ~ 12월    주요내용   취업에 어려움을 겪고 있는 취업취약계층  청년 을 대상으로 취업 의욕을 고취 시키고 구직 기술을 향상시켜주는  운영 사업 신청 기간:2024년 01월01일 ~ 2024년 12월31일 비고:사업기간2024 01 01 ~ 2024 12 31 운영기간2024 01 01 ~ 2024 12 31 신청기간2024 01 01 ~ 2024 12 31 취업 상태:4대보험 직장인  불가  사업자 불가 추가 단서 사항:4대보험 직장인  불가  사업자 불가 주관 기관:제주특별자치도   고용센터 취업지원총괄팀  운영 기관:제주특별자치도   고용센터 취업지원총괄팀 '), Document(metadata={'name': '면접사진 촬영 고양시 ', 'source': '..\\\\data\\\\policy_result.json'}, page_content='기관:경기 고양시 정책 분야:일자리분야 지원 내용:  내용   취업 준비에 필요한 이력서 면접용 증명사진 촬영 지원   촬영   더본스튜디오  주엽역 8번 출구    일정   2024년 3월 ~ 예산소진시 마감 매주 금요일   시간   일자별 신청 순서대로 임의 배치 금 10 00~19 00  사업 신청 기간:상시 비고:선착순 상시 접수 연령:만 18세 ~ 39세 거주지 및 소득:  고양시 거주 재학 재직 청년 주관 기관:고양시 청취다방 031 8075 2870 ')], [{'url': 'https://www.jb2030.or.kr/policy/p2_view.html?id=1192&tname=wel', 'content': '로그인 ㅣ 회원가입 청년참여예산 바로가기 검색 검색 닫기 청년정책 페이지 위치 청년정책 청년정책 통합검색(맞춤형검색) 청년정책 통합검색(맞춤형검색) 공유하기 인쇄하기 URL 청년정책 통합검색(맞춤형검색) 2024년 무주군로컬JOB센터 면접활동비 지원사업 신청자 모집 작성일 : 2024-07-30 사업개요 해당지역    전체 담당기관명   무주군 대상  다음요건을 모두 충족한 자 (구직신청한 자, 지역 내 구인업체 채용면접에 응시한 자 (※관공서 제외), 고용안정정보망(워크넷)에 알선처리한 경우에만 지원 접수기간    ~ 2024-12-31(화) (예산소진시까지) 문의처 063-322-9297 첨부파일   무주군로컬잡센터면접활동비지원사업.jpg 공고상세보기URL   https://www.muju.go.kr/planweb/board/view.9is?dataUid=4028a6d290b930730190ee51c7871789&page=1&contentUid=ff8080816c5f9d47016cbd3ae19f006b&boardUid=ff8080816d135a54016d1ecde9d8001a&searchType=&keyword=&categoryUid1=&categoryUid2=&categoryUid3= 목록 유관기관배너 개인정보 처리방침 이용약관 오시는길 주요 사이트 전북특별자치도 전주시 덕진구 오공로 123 테크비즈센터 4층 전북청년허브센터 TEL 063-227-2030 FAX 063-229-5509 COPYRIGHT (C) 2020 전북창조경제혁신센터 ALL RIGHT RESERVED'}, {'url': 'https://www.welfarehello.com/policy/9a560b40-52b8-4544-8b9c-374e36239f88', 'content': '2024년 무주군로컬JOB센터 면접활동비 지원 | 전북특별자치도 무주군 | 웰로 서비스가 더 궁금한가요?5,200만 국민에게 정책을 알리고 싶다면? 2024년 무주군로컬JOB센터 면접활동비 지원 전북특별자치도 무주군 정책을 요약했어요 지원대상은 무주군로컬JOB센터를 통해 구직신청하고 지역내 구인업체 채용면접을 본 자로 고용안정정보망에 알선처리된 경우에 한함. 지원내용은 관내 사업장 면접 응시자에게 회당 50,000원의 면접활동비를 지원하며 1인당 최대 2회까지 지원된다. 신청방법은 무주군로컬JOB센터를 방문해 관련 서류를 제출해야 하며 세부 문의는 취업지원팀에 연락하면 된다. ○ 아래 요건을 모두 충족한 자 - 무주군로컬JOB센터를 통해서 구직신청한 자 - 지역 내 구인업체 채용면접에 응시한 자 - 고용안정정보망(워크넷)에 알선처리한 경우에만 지원 ○ 관내 사업장에 면접을 응시한 구직자에게 면접활동비(50,000원/회) 지원 - 1인당 최대 2회 지원(예산상황에 따라 변동가능) - 동일 사업장에 면접 응시한 경우 1회만 지원 ○ 구비서류 - 면접활동비 지원 신청서 ○ 방문 : 무주군로컬JOB센터(일자리센터) - 전북 무주군 무주읍 주계로 116.'}]""]",2024년 무주군로컬JOB센터 면접활동비 지원사업의 운영 기관은 무주군입니다. 이 사업은 구직 신청한 자가 지역 내 구인업체 채용면접에 응시한 경우에 면접활동비를 지원하는 프로그램입니다.
직업심리검사를 주관하는 기관은 어디인가요?,"['정책 이름: 직업심리검사', '기관:고용노동부', '주관 기관:고용노동부']",고용노동부,"['[Document(metadata={\'name\': \'직업심리검사\', \'source\': \'..\\\\data\\\\policy_result.json\'}, page_content=\'기관:고용노동부 정책 분야:교육분야 지원 내용:  다양한 직업심리검사를  개인의 능력과 흥미  성격 의 심리적인 특성들이 각 직업에서 요구하는 능력수준  특성에 얼마나 적합한지를 과학적인 방법으로 측정하여 보다 성공 가능성이 높고 만족할 만한 직업들을 탐색하도록 지원   검사종류    청소년  고학생 적성검사  직업가치관검사  청소년 진로발달검사  초학생 진로인식검사  청소년 인성검사  청소년 직업흥미검사 개정   중학생 진로적성검사  직업흥미탐색검사 간편형    성인   직업선호도검사 S형 L형   직업적성검사  직업가치관검사  구직준비도검사  창업적성검사  영업직무기본역량검사  IT직무기본역량검사  준고령자직업선호도검사  대학생진로준비도검사  이주민취업준비도검사  중장년직업역량검사  성인용 직업적성검사    검사 실시 후 전문 상담사에게 결과 해석 상담 가능 사업 운영 기간:2024.1.1.~12.31. 사업 신청 기간:상시 비고:상시 거주지 및 소득:청소년  성인 누구나 무료검사 실시 가능  직업심리검사별 검사대상 연령이 초학교 5학년 ~ 중장년까지 다양하므로 검사안내 페이지에서 대상여부 확인 필요  신청 절차:신청사이트 접속   로그인   직업심리검사 클릭   직업심리검사 실시 탭에서 검사 선택 후 검사 실시   검사 완료 후 결과보기  상담 신청 주관 기관:고용노동부 운영 기관:전국 고용센터\'), Document(metadata={\'name\': \'청춘디딤돌 병역진로설계\', \'source\': \'..\\\\data\\\\policy_result.json\'}, page_content=\'기관:병무청 정책 분야:일자리분야 지원 내용:  군특기 연계  직업선호도검사   1 1 대면상담   군생활 자기계발 정보   군지원  입영   개인경력개발   취업지원  사업 신청 기간:상시 비고:상시운영 특화 분야:입영 전 주관 기관:병무청 운영 기관:주관기관 동일\'), Document(metadata={\'name\': \'직업역량강화 \', \'source\': \'..\\\\data\\\\policy_result.json\'}, page_content=\'기관:여성가족부 정책 분야:일자리분야 지원 내용: 개요   진로상담  진로적성검사  1주    상담  진로적성검사 을  기본사항 확인  맞춤 직업군 탐색  실시   자립동기부여 2주    의 전 과정을 잘 수료할 수 있도록  동기  또래 관계성 강화 예. 두드림  맛보기 캠프     기초기술훈련 4주       실제 직업체험 전 대비과정으로 필요 기술 선택하여 훈련 진행 훈련수당 지급     청소년들의 식생활  용돈 관리  생활관리 개선  운영   직장체험 3개월    청소년작업장  청소년우호기업 연계로 3개월 이내 1일 3시간 이내  직장체험 진행 직장체험수당 지급    전문직업훈련  취업연계   사후관리 6개월    고충상담  지속적으로 청소년과 교류하며 직업훈련  취업현황에 대해 관리 사업 신청 기간:상시 비고:상시운영 연령:만 15세 ~ 24세 거주지 및 소득:취업에 관심이 있는 청소년 15세~24세  신청 절차:전국 16개 시도 학교밖청소년지원센터에 신청   서울  부산  대구  인천  광주  대전  울산  경기  강원  충북  충남  전북  전남  경북  경남  제주 기타 유익 정보:문의   운영기관  한국청소년상담복지개발원 학교밖청소년지원부 문의 051 662 3182  주관 기관:여성가족부 운영 기관:전국 16개 시 도 학교밖청소년지원센터 세종 제외 \'), Document(metadata={\'name\': \'직업 트라우마 센터 운영\', \'source\': \'..\\\\data\\\\policy_result.json\'}, page_content=\'기관:고용노동부 정책 분야:복지.문화분야 지원 내용:  전문가 상담  사후관리   사고충격에  심리안정 지속관리   외상 후 스트레스 장애 예방   직 간접 사고 피해자의 심리 안정   일상 직장생활 복귀 도모   필요 시 전문치료 연계 사업 운영 기간:연중 사업 신청 기간:상시 추가 단서 사항:사건을 직접 경험한 피해자 뿐만 아니라 사고를 목격한 사람  1차 피해자의 가족이나 친구  희생자의 유족  사건에 책임이 있다고 생각하는 사람  경찰 소방관  응급직에 종사 사고수습  업무 담당자 하는 사람  신청 절차:전국 직업트라우마센터 대표번호   1588 6497 주관 기관:고용노동부 운영 기관: 산업재해예방 안전보건공단\'), Document(metadata={\'name\': \'학생 친화형 24시간 고민상담 채널  라임 \', \'source\': \'..\\\\data\\\\policy_result.json\'}, page_content=\'기관:교육부 정책 분야:.권리분야 지원 내용:  실시간 채팅 전화 화상 대면  단계별 상담   전문적 심리검사 코칭기법 적용한 기분관리 콘텐츠    일상 속에서 가벼운 고민이 있는 학생부터 심리 정서적으로 불안 정도가 높은 학생까지 모든 학생의 마음건강 지원 사업 신청 기간:상시 비고:연중 상시 주관 기관:교육부 학생건강정책관 사회정서성장지원과 운영 기관:주관기관 동일\')], [{\'url\': \'https://www.work.go.kr/consltJobCarpa/jobPsyExam/jobPsyExamIntro.do?tidx=4\', \'content\': \'직업심리검사-직업심리검사소개 직업심리검사 직업심리검사 소개 직업심리검사 실시 검사결과 보기 검사결과 상담 검사결과 상담 FAQ 학과정보 학과정보 FAQ 직업심리검사 소개 고용노동부 직업심리검사는 개인의 능력과 흥미, 성격 등 다양한 심리적 특성을 객관적으로 측정하여 자신에 대한 이해를 돕고 개인의 특성에 보다 적합한 진로분야를 선택할 수 있도록 도와드립니다. 고용노동부 직업심리검사 이용안내 직업심리검사는 워크넷 회원가입 후 즉시 가능하며 검사결과는 검사 완료 직후, ‘검사결과 보기’를 통해 확인해 보실 수 있습니다. 검사결과에 대한 문의와 상담은 워크넷에서 ‘검사결과 상담’ 메뉴를 이용하거나 가까운 고용센터 (국번없이 ☏1350(유료))를 통해 서비스 받아보시기 바랍니다. 보다 상세한 검사에 대한 안내와 설명 하단의 직업심리검사 [가이드 e북]을 참고해보시기 바랍니다. [가이드 e북]은 Adobe Acrobat Reader를 통해 보실 수 있습니다. 청소년 심리검사 바로가기 성인 심리검사 바로가기 검사결과 보기 검사결과 상담 고용·노동 분야 제도 문의 국번없이 1350 (유료, 고용노동부 고객상담센터, 평일 09시 ~ 18시)\'}, {\'url\': \'https://www.use.go.kr/jobgo/helper/preparation/preparation_4.jsp\', \'content\': ""취업지원센터 : HOME > 현장실습도우미 > 취업준비 > 직업심리검사 전체메뉴 전체메뉴 전체메뉴 닫기 가사·실업 상업,농생명,가사·실업 직업심리검사 통합검색 열기 사이트맵 통합검색 닫기 직업심리검사 직업심리검사 직업심리검사 직업심리검사 직업심리검사 닫기 워크넷 직업심리검사 고용노동부는 청소년과 성인을 대상으로 총 20여종의 심리검사를 개발하여 무료로 서비스 해드리고 있습니다. 회원가입 후 사용 가능하며 결과는 검사 완료직후 \'검사결과 보기\'를 통해 확인해 보실 수 있습니다. 커리어넷 진로심리검사 커리어넷 진로탐색 프로그램-아로플러스는 중·고등학생을 위한 자기이해 및 관심직업을 통한 진로탐색 프로그램입니다. 중간저장 기능이 있어 일부만 실시하고 나머지는 나중에 이어서 실시할 수 있습니다. 한국가이던스 직업심리검사 연령과 목적에 따른 다양한 심리검사가 있으며, E심리검사는 온라인을 통해 바로 검사를 실시하고 결과 확인까지 가능합니다. 한국장애인고용공단 직업심리검사 온라인 직업심리검사는 시간과 공간의 제약없이 활용할 수 있도록 온라인 형태로 구현한 검사입니다. 검사 8종을 온라인화하여 구직자 스스로 검사를 실시하고 결과를 확인할 수 있습니다. 사이트맵""}]']","직업심리검사를 주관하는 기관은 고용노동부입니다. 고용노동부는 청소년과 성인을 대상으로 다양한 직업심리검사를 무료로 제공하고 있으며, 이 검사는 개인의 능력, 흥미, 성격 등의 심리적 특성을 객관적으로 측정하여 적합한 진로 선택을 지원합니다. 검사 결과는 검사 완료 후 즉시 확인할 수 있으며, 상담도 가능합니다."
직업심리검사의 신청 절차는 어떻게 되나요?,"['정책 이름: 직업심리검사', '신청 절차:사이트 접속   로인   직업심리검사 클릭   직업심리검사 실 탭에서 검사 선택  검사 실   검사 완료  결과보기  상담']","사이트 접속, 로그인, 직업심리검사 클릭, 직업심리검사 실 탭에서 검사 선택, 검사 실시, 검사 완료, 결과보기, 상담","[""[Document(metadata={'name': '직업심리검사', 'source': '..\\\\data\\\\policy_result.json'}, page_content='기관:고용노동부 정책 분야:교육분야 지원 내용:  다양한 직업심리검사를  개인의 능력과 흥미  성격 의 심리적인 특성들이 각 직업에서 요구하는 능력수준  특성에 얼마나 적합한지를 과학적인 방법으로 측정하여 보다 성공 가능성이 높고 만족할 만한 직업들을 탐색하도록 지원   검사종류    청소년  고학생 적성검사  직업가치관검사  청소년 진로발달검사  초학생 진로인식검사  청소년 인성검사  청소년 직업흥미검사 개정   중학생 진로적성검사  직업흥미탐색검사 간편형    성인   직업선호도검사 S형 L형   직업적성검사  직업가치관검사  구직준비도검사  창업적성검사  영업직무기본역량검사  IT직무기본역량검사  준고령자직업선호도검사  대학생진로준비도검사  이주민취업준비도검사  중장년직업역량검사  성인용 직업적성검사    검사 실시 후 전문 상담사에게 결과 해석 상담 가능 사업 운영 기간:2024.1.1.~12.31. 사업 신청 기간:상시 비고:상시 거주지 및 소득:청소년  성인 누구나 무료검사 실시 가능  직업심리검사별 검사대상 연령이 초학교 5학년 ~ 중장년까지 다양하므로 검사안내 페이지에서 대상여부 확인 필요  신청 절차:신청사이트 접속   로그인   직업심리검사 클릭   직업심리검사 실시 탭에서 검사 선택 후 검사 실시   검사 완료 후 결과보기  상담 신청 주관 기관:고용노동부 운영 기관:전국 고용센터'), Document(metadata={'name': '온라인 입사지원서  면접 컨설팅 남양주시 ', 'source': '..\\\\data\\\\policy_result.json'}, page_content='기관:경기 남양주시 정책 분야:일자리분야 지원 내용:  지원 내용   입사지원서  화상면접 컨설팅 각 컨설팅 무료 지원 횟수 연 최대 2회    준비사항   구직록 워크넷 구직록확인증  구직인증번호   공통사항   입사지원서 컨설팅   작성된 입사지원서   화상면접 컨설팅   면접증빙자료  작성된 입사지원서  카메라  마이크가 사용 가능한 기기 사업 신청 기간:상시 비고:  2024년 3월~12월 예산 소진 시까지  거주지 및 소득:  남양주시 구직자 누구나 신청 절차:  입사지원서 컨설팅  절차 1. 입사지원서 온라인 신청   통합접수시스템 https   apply.jobaba.net  남양주 온라인 입사지원서  면접 컨설팅 신청 준비사항의 서류 제출    일자리지원팀 접수 2. 피드백   신청자의 메일로 7일 이내 피드백 자소서 항목별 첨삭  주관 기관:  남양주시 일자리정책과   031 590 2679'), Document(metadata={'name': '청년마음건강지원사업', 'source': '..\\\\data\\\\policy_result.json'}, page_content='기관:강원 정책 분야:복지.문화분야 지원 내용:  전문심리상담  맞춤형   10회기  1. 사전사후검사 각 1회 2. 전문심리상담 1 1원칙  50분  주1회 총8회  3. 종결상담 1회 마지막 상담 시   사업 신청 기간:상시 연령:만 19세 ~ 34세 거주지 및 소득:  연령기준   만 19세 이상 34세 이하 출생연도 기준   행정적 부담을 고려하여 만 나이는 출생연도 기준을 적용  1989.1.1.부터 2004.12.31.까지 출생한 자 모두  추가 단서 사항:  우선순위 1순위 자립준비청년 만18세이상 만기 퇴소  연장보호 종료된 자   보호연장아동 아동복지법 제16조의3에  보호기간이 연장된 자  2순위 정신건강복지센터 연계자 3순위 일반청년   강원 행복한 도민심리지원 자의  동시  불가 신청 절차:거주지 읍면동 행정복지센터 신청 제출 서류:신분증 지참 필수공통서류  주민센터 비치    공통서식 제1호 사회복지  급여  변경  신청서   공통서식 제2호 사회복지 권 바우처   변경  신청서   공통서식 제3호 바우처 카드 가상  발급 재발급   개인정보   활용 동의서기타 증빙서류  별도 제출  주관 기관:시군 복지업무 담당부서'), Document(metadata={'name': '공직체험 인턴십', 'source': '..\\\\data\\\\policy_result.json'}, page_content='기관:서울 은평구 정책 분야:일자리분야 지원 내용:공직 체험  직무역량강화 교육  사업 운영 기간:2024.03.~09. 사업 신청 기간:미정 비고:추후 안내 연령:만 19세 ~ 39세 거주지 및 소득:미취업 청년 만 19~39세  취업 상태:미취업자 참여 제한 대상:대학교 재학생 주관 기관:은평구청 사회적경제과 청년지원팀'), Document(metadata={'name': '4월 어수정 청년공간  동두천시 ', 'source': '..\\\\data\\\\policy_result.json'}, page_content='기관:경기 동두천시 정책 분야:복지.문화분야 지원 내용: 4월 6일 토요일    나도 프로 직장인  커리어 설계  MBTI   직업선호도 검사    취업 잘되는 자소서 깨알 코칭  자소서 코칭    사회 초년생 급여로 목돈만들기   2030세대 주식 재태크 비법   각 별 2시간씩 교육  오전 10시 1회차 교육 시작  중복신청 가능   4월 13일 토요일    트랜디한 시대  슈퍼 개인이 되자   창업준비  기업가 정신    마음 건강 마인드셋  스트레스 관리    소소한 행복  미니정원 만들기  봄맞이 힐링만들기    각 별 2시간 교육  오전 11시 1회차 교육 시작  중복신청 가능 사업 신청 기간:상시 비고:월별  수시 신청 중복신청 가능  연령:만 19세 ~ 39세 주관 기관:경기도 동두천시 어수정 청년공간 070 4473 2753 ')], [{'url': 'https://havehope.tistory.com/entry/실업급여-직업심리검사-신청-방법과-효과적인-활용-가이드', 'content': '실업급여 수급자는 직업심리검사를 통해 구직활동 계획을 효과적으로 세울 수 있으며, 고용센터에서 지원받아 무료로 진행할 수 있습니다. 검사 결과는 고용센터 상담 및 맞춤형 직업 훈련 프로그램 설계에 활용됩니다. 구직활동 증빙으로 인정받아 실업급여 수급 과정에서 추가적인 부담을 줄일 수 있습니다. 검사 결과를 바탕으로 맞춤형 직업 추천을 받을 수 있습니다. 고용센터 상담을 통해 결과를 바탕으로 맞춤형 재취업 전략을 수립할 수 있습니다. 검사 완료 후, 활동 내역은 고용센터에 보고하여 실업급여 지급 요건을 충족시킬 수 있습니다. 검사 결과는 재취업 특강, 직업훈련 등과 함께 구직활동으로 인정받을 수 있습니다. 검사 결과는 즉시 출력되며, 고용센터 상담 시간에 활용할 수 있습니다. 결과를 통해 구직자가 선호하는 직업 분야를 명확히 알 수 있습니다. A: 고용센터 방문 또는 고용보험 웹사이트를 통해 신청 후 고용센터에서 받을 수 있습니다. A: 실업급여 수급자는 무료로 직업심리검사를 받을 수 있습니다.'}, {'url': 'https://www.work24.go.kr/cm/c/a/0130/selectBbttInfo.do?bbsClCd=VJQMx/a2p6AfqLQqwR8sSQ==&ntceStno=85', 'content': '(단체검사 실시 가능)온라인으로 심리검사를 받으시기 위해서는 먼저 고용24에 회원가입\\xa0및 로그인\\xa0후 상위 메뉴 중 직업·진로를 선택하신 후 청소년 직업심리검사 실시 또는 성인용 심리검사 실시 메뉴를 클릭하시면 됩니다.본인인증에 어려움이 있는 청소년을 위하여 청소년 대상\\xa0심리검사에 한해 비회원 심리검사 서비스를 제공하고 있습니다.검사결과에 대한 상담을 원하시는 분들은 가까운 고용복지+센터(☎: 1350)의 전문 직업상담원에게 문의하시기 바랍니다. 다량의 개인정보가 포함된 메뉴를 특정사용자만 이용하시려면 비밀번호 설정 후 이용하실 수 있습니다. 다량의 개인정보가 포함된 메뉴를 특정사용자만 이용하시려면 비밀번호 설정 후 이용하실 수 있습니다. 다량의 개인정보가 포함된 메뉴를 특정사용자만 이용하시려면 비밀번호 설정 후 이용하실 수 있습니다. 고용이는 고용정책정보, 채용정보, 훈련정보, 고용센터, 실업급여 정보를 안내해 드리고 있습니다. 아래와 같이 문의하시면 더욱 정확한 정보를 안내 받으실 수 있습니다. 고용이는 정책정보, 채용정보, 훈련정보, 고용센터 위치안내, 실어급여 관련정보 등 5가지 메뉴를 제공하고 있습니다.'}]""]","직업심리검사의 신청 절차는 다음과 같습니다:

1. **신청사이트 접속**: 고용보험 웹사이트 또는 고용24에 접속합니다.
2. **회원가입 및 로그인**: 회원가입 후 로그인을 진행합니다.
3. **검사 선택**: 상위 메뉴에서 '직업·진로'를 선택한 후, 청소년 직업심리검사 또는 성인용 심리검사 실시 메뉴를 클릭합니다.
4. **본인 인증**: 청소년의 경우, 본인 인증에 어려움이 있을 시 비회원으로 심리검사 서비스를 이용할 수 있습니다.
5. **검사 실시**: 선택한 검사를 실시합니다.
6. **결과 확인**: 검사 완료 후 결과를 즉시 확인할 수 있으며, 상담을 원할 경우 가까운 고용복지+센터에 문의하여 전문 상담사와 상담을 진행할 수 있습니다.

실업급여 수급자는 무료로 직업심리검사를 받을 수 있으며, 검사 결과는 구직활동 증빙으로 활용할 수 있습니다."
직업심리검사는 어떤 연령대의 사람들을 대상으로 하나요?,"['정책 이름: 직업심리검사', '거주지 및 소득:청소년  성인 누구나 무료검사 실   직업심리검사별 검사대상 령이 초학교 5학년   장년까지 다양하므로 검사안내 페이지에서 대상여부  필요']",초등학교 5학년부터 장년까지,"['[Document(metadata={\'name\': \'직업심리검사\', \'source\': \'..\\\\data\\\\policy_result.json\'}, page_content=\'기관:고용노동부 정책 분야:교육분야 지원 내용:  다양한 직업심리검사를  개인의 능력과 흥미  성격 의 심리적인 특성들이 각 직업에서 요구하는 능력수준  특성에 얼마나 적합한지를 과학적인 방법으로 측정하여 보다 성공 가능성이 높고 만족할 만한 직업들을 탐색하도록 지원   검사종류    청소년  고학생 적성검사  직업가치관검사  청소년 진로발달검사  초학생 진로인식검사  청소년 인성검사  청소년 직업흥미검사 개정   중학생 진로적성검사  직업흥미탐색검사 간편형    성인   직업선호도검사 S형 L형   직업적성검사  직업가치관검사  구직준비도검사  창업적성검사  영업직무기본역량검사  IT직무기본역량검사  준고령자직업선호도검사  대학생진로준비도검사  이주민취업준비도검사  중장년직업역량검사  성인용 직업적성검사    검사 실시 후 전문 상담사에게 결과 해석 상담 가능 사업 운영 기간:2024.1.1.~12.31. 사업 신청 기간:상시 비고:상시 거주지 및 소득:청소년  성인 누구나 무료검사 실시 가능  직업심리검사별 검사대상 연령이 초학교 5학년 ~ 중장년까지 다양하므로 검사안내 페이지에서 대상여부 확인 필요  신청 절차:신청사이트 접속   로그인   직업심리검사 클릭   직업심리검사 실시 탭에서 검사 선택 후 검사 실시   검사 완료 후 결과보기  상담 신청 주관 기관:고용노동부 운영 기관:전국 고용센터\'), Document(metadata={\'name\': \'청년 국가기술자격시험 응시료 지원사업\', \'source\': \'..\\\\data\\\\policy_result.json\'}, page_content=\'기관:고용노동부 정책 분야:일자리분야 지원 내용:한국산업인력공단 시행  국가기술자격시험 응시료 50% 지원 사업 신청 기간:상시 비고:2024.1.1 ~ 예산소진시까지 연령:만 18세 ~ 34세 거주지 및 소득:만 34세 이하 청년 누구나 1989.1.1 이후 출생  추가 단서 사항:1인당 연간 3회 한도 신청 절차:원서접수 시 응시료 지원받을 시험 선택 후 결제 기타 유익 정보:1인당 지원한도는 연간 3회이며  지원예산 소진시 잔여 지원횟수와 상관없이 신청이 불가  예산소진시 사전 공지 예정  주관 기관:고용노동부 운영 기관:한국산업인력공단\'), Document(metadata={\'name\': \'청년센터 자소서  면접 컨설팅 연천군 \', \'source\': \'..\\\\data\\\\policy_result.json\'}, page_content=\'기관:경기 연천군 정책 분야:일자리분야 지원 내용:  자소서 면접 컨설팅 비대면 무료 컨설팅    전문컨설턴트와 1 1 비대면 코칭 진행 3회    입사지원서 코칭 이력서  자소서  직무기술서     실전 면접 코칭 사업 신청 기간:상시 연령:만 19세 ~ 39세 거주지 및 소득:  컨설팅  대상자   입사지원 기업이 확정된 취업 준비 청년   대상   만19~39세  연천군민  재직자  사업자  주관 기관:  연천군청년센터 031 839 4142 \'), Document(metadata={\'name\': \'청년 면접준비비 지원사업\', \'source\': \'..\\\\data\\\\policy_result.json\'}, page_content=\'기관:경북 경주시 정책 분야:일자리분야 지원 내용:경주시 내 구직활동을 하는 19세 이상 39세 이하 청년이 적극적으로 구직 활동에 할 수 있도록 면접비를 지원함으로써 청년 구직자의 경제적인 부담을 완화하는 데 도움. 사업 신청 기간:2024년 07월01일 ~ 2024년 12월31일 비고:2024.07~ 예산 소진 시 까지 연령:만 19세 ~ 39세 주관 기관:경주시 운영 기관:경주시\'), Document(metadata={\'name\': \'찾아가는 심리상담  오늘도 맑음  지원사업\', \'source\': \'..\\\\data\\\\policy_result.json\'}, page_content=\'기관:전남 정책 분야:복지.문화분야 지원 내용:  사업내용   전담상담사 파견 운영을 통한 청년 심리상담  운영   각 시 군 청년센터에서 이뤄지는 일대일 대면상담 진행   상담분야   직장  개인  가정 내 직면한 다양한 심리 정서 문제  사업 신청 기간:상시 비고:사업기간 상시 모집 사업기간   2024.4.~11.  연령:만 18세 ~ 45세 거주지 및 소득: 전남 청년  신청일 기준 아래 요건 중  한 가지 이상 하는 자   전라남도 거주자   전라남도에 소재하는 학교를 재학 휴학 졸업한 학생   전라남도에 소재하는 직장에 재직  직장 추가 단서 사항:  상담 일정 확정 후  불참사유 발생 시 매칭된 전담상담사와 일정 변경  취소 가능   1회 노쇼시 자동으로 상담 종결   심리상담으로 해소가 어려운 정신증  자살위기  의료기관 진료  추가 적인 사례관리가 필요한  외부기관으로 연계  안내할 수 있음 참여 제한 대상:  공고일 기준 전라남도 미거주자   지원 나이에 되지 않는 자   선정 후 사전 연락 없이 상담을 취소하는   노쇼 1회시 상담종결    단  최종 자와 상담사 간 일정이 맞지 않을  취소 후 재신 신청 절차:  희망하는  도내 시 군 청년센터 에 방문  이메일 접수   시 군 센터 방문 E Mail 신청  붙임 1. 시 군청년센터별 문의처 참조  제출 서류:  신청서    주민록본  재학증명서  재직증명서 중 1부 제출   2024.4월 이후 발급한 서류만 인정하며 본의  본인 전입일을 표기하여 발급   주민록번호 뒷번호는 비공개 처리 후 제출   제출서류는 스캔  선명하게 사진 사본  찍어 신청서와 함께 제출 주관 기관:전라남도청년센터 운영 기관:전라남도청년센터\')], [{\'url\': \'https://fnmnews.com/직업심리검사-청소년-및-성인-2가지-방법-안내-feat-워크/\', \'content\': \'직업심리검사는 ""나를 알아가는 또 하나의 방법"" 이라는 캐치프라이즈로 청소년 및 대학생, 성인등을 대상으로 워크넷에서 무료로 검사받아 보실수 있습니다. 개개인의 능력과 흥미가 천차만별인듯 직업에 관련된 다양한 심리적 특성을 직업심리검사를 통해\'}, {\'url\': \'https://fivemoneys.com/직업심리검사-제대로-된-방법-알려드릴게요/\', \'content\': \'만든글은 워크넷 직업심리검사란? 워크넷 직업심리검사는 개인의 성격과 적성을 측정하여 적합한 직업을 선택할 수 있도록 도움을 주는 무료 검사입니다. 고용노동부에서 제공하는 이 검사는 청소년과 성인을 대상으로 20여종의 심리 검사를 지원합니다.\'}]']","직업심리검사는 다양한 연령대의 사람들을 대상으로 시행됩니다. 구체적으로, 초등학교 5학년부터 중장년층까지 폭넓은 연령층이 포함됩니다. 

검사 대상 연령은 다음과 같습니다:
- 청소년: 초등학생, 중학생, 고등학생
- 성인: 대학생, 직장인, 중장년층

이 검사는 개인의 능력, 흥미, 성격 등의 심리적 특성을 과학적으로 측정하여, 각 직업에서 요구하는 능력 수준과 특성에 얼마나 적합한지를 평가합니다. 이를 통해 보다 성공 가능성이 높고 만족할 만한 직업을 탐색할 수 있도록 지원합니다. 검사 결과는 전문 상담사와의 상담을 통해 해석받을 수 있습니다."
울산 동구 청년 면접정장 대여 사업의 대여 기간은 얼마인가요?,"['정책 이름: 울산 동구 청년 면접정장 대여 사업', '대여품목: 면접용 정장 재킷, 바지, 셔츠, 블라우스, 넥타이, 구두', '대여기간: 3박 4일, 3회']","대여 기간은 3박 4일이며, 3회 가능합니다.","[""[Document(metadata={'name': '울산 동구 청년 면접정장 대여 사업', 'source': '..\\\\data\\\\policy_result.json'}, page_content='기관:울산 동구 정책 분야:일자리분야 지원 내용:  대여품목   면접용 정장 재킷  바지 스머트  셔츠 블라우스  넥타이   구두   대여기간   3박 4일 연 3회 가능  사업 운영 기간:  사업기간    24. 1. ~ 12. 사업 신청 기간:상시 연령:만 18세 ~ 39세 거주지 및 소득:  대 상   동구 거주 주민록  청년 구직자 18세 ~ 39세  신청 절차:울산동구청년센터 문의 052 209 3487  제출 서류:  구비서류   신분증  주민록  초본  면접응시 증빙자료 주관 기관:울산광역시 동구 일자리정책과 청년정책팀 052 209 3487  운영 기관:울산 동구 청년센터 052 209 3487 '), Document(metadata={'name': '청년취업 면접복장 대여 안산시 ', 'source': '..\\\\data\\\\policy_result.json'}, page_content='기관:경기 안산시 정책 분야:일자리분야 지원 내용: 청년취업 면접복장 대여  대여횟수   1인당 연간 최대 3회까지 가능 사업 신청 기간:상시 비고:예산소진 시 마감 연령:만 18세 ~ 39세 거주지 및 소득: 안산시에 주민록이 된 18세 ~ 39세 거주 청년 신청 절차: 방법   면접 3일 전에 신청하여야 면접복장 대여 가능  신청서작성   일자리센터 승인   정장대여   반납 기타 유익 정보: 문의 안산시 일자리센터 Tel. 031 481 2930 ~ 2931   2882  주관 기관:경기도 안산시 운영 기관:경기도 안산시'), Document(metadata={'name': '경남 청년 면접정장 무료대여 사업', 'source': '..\\\\data\\\\policy_result.json'}, page_content='기관:경남 정책 분야:일자리분야 지원 내용:  사업내용   구직청년에  면접 정장 무료 대여 사업   대여품목   남 여 정장 셔츠  블라우스  넥타이 포함     대여기간   4일 연 5회 1인당     대여업체   창원  오르테가   창원시 의창구 원이대로 320  W202호   055 600 1620  일 휴무일    영업시간   평일 11시~20시  창원  포튼가먼트 사림점 창원시 의창구 용지로 291번지 1층   055 285 6007   일 휴무일    영업시간   11시~19시  진주  살로토   진주시 진주대로 981 1  2층   055 752 9996   화 휴무일    영업시간   12시~20시  진주  브라이드앤그룸   진주시 진주대로 984 2층   010 6666 1204   화 휴무일    영업시간   11시~20시  김해  라사르토 비스포크   김해시 분성로 349 1층   055 326 0158   일 휴무일    영업시간   평일 11시~20시   토 12시~19시  양산  빅플랜   양산시 물금읍 야리로 127 2층 204호   055 913 8616   휴무   토 일 공휴일    영업시간   평일 10시~18시   업체사정으로 휴무일과 영업시간이 조정될 수 있으며 문의 사항은 상기 대여업체로 연락 바람 사업 신청 기간:2024년 03월11일 ~ 2024년 12월31일 비고:2024.3.11. 월  ~ 예산 소진 시까지 연령:만 18세 ~ 39세 거주지 및 소득:  신청자격   경남에 주소를 둔 청년 고교졸업예정자 포함    청년   18~39세 1984~2006년생     자격요건   취업 면접 자   모의면접  대학 원  진학면접  학군단면접  체험형 인턴  단순 일자리 박람회  취업과 직접 연계되지 않는 는 대여 불가 추가 단서 사항:  공고문 유의사항 확인 신청 절차:  대여절차 1. 온라인 신청   2. 업체 대여승인   3. 업체 방문예약   4. 정장대여   5. 정장수령  반납   택배 신청 가능 신청자 비용 부담    예약 업체와 유선으로 조율 필수   업체 방문예약 시 방문 예정시간  사이즈 여부 유선으로 확인 필수   신청방법   경남청년정보플랫폼 홈페이지   일자리   청년 면접정장 무료대여    하단  신청 바로가기   경상남도 홈페이지 회원가입 필수 제출 서류:  필수자료   면접일자와 내용을 확인할 수 있는 증빙자료  면접 확인서   면접일시  회사명 이 기재된 면접확인 서류 문자  이메일  를  신청 시 업로드   전화로 면접을 통보받았을  회사 측과 통화한 내역 휴대전화 화면 캡쳐 과 입사 지원 사실을 확인할 수 있는 자료를 캡쳐하여 업로드 주관 기관:경상남도 운영 기관:주관기관과 동일'), Document(metadata={'name': '울산 북구 청년창업 제조공간 지원', 'source': '..\\\\data\\\\policy_result.json'}, page_content='기관:울산 북구 정책 분야:일자리분야 지원 내용:  입주대상   창업 7년 미만 청년 창업기업 9개사   사업내용   청년 창업가 제조공간  엑설러레이팅 지원  강연   입주공간   9개소 제조공간 3  사무공간 6  사업 운영 기간:  사업기간    24. 1. ~ 12. 연중  사업 신청 기간:상시 연령:만 19세 ~ 39세 주관 기관:울산광역시 북구 경제일자리과 청년정책팀 052 241 7717  운영 기관:주관기관과 동일'), Document(metadata={'name': '구직청년 면접정장 대여', 'source': '..\\\\data\\\\policy_result.json'}, page_content='기관:강원 동해시 정책 분야:일자리분야 지원 내용:면접정장 대여 사업 운영 기간:상시 사업 신청 기간:상시 비고:연 3회 대여 연령:만 19세 ~ 39세 거주지 및 소득:동해시 지역청년 추가 단서 사항:지역청년 신청 절차:http   청년공간열림.com 심사 및 발표:적합여부 심사 후 대여 제출 서류:면접응시 증빙자료 주관 기관:동해시 경제과')], [{'url': 'https://vop.co.kr/A00001626524.html', 'content': '울산 동구, 구직청년 면접정장 무료 대여사업 추진 - 민중의소리 • Media vop 독자투고 지자체기사 울산 동구, 구직청년 면접정장 무료 대여사업 추진 최지현 기자 cjh@vop.co.kr 울산시 동구청은 취업을 준비 중인 지역 청년들의 구직비용 절감과 경제적 부담 완화를 위해 무료로 면접 정장을 대여하는 사업을 추진한다고 17일 밝혔다. 동구청은 대여 전문 업체와의 협약을 통해 면접에 필요한 의류 일체를 대여해주며, 예산이 소진될 때까지 이를 지원할 방침이다. 무료 정장 대여 사업은 지난 12일부터 시작됐으며. 울산 동구에 주소를 둔 만 18세 이상 39세 이하, 면접이 예정된 청년이면 누구나 신청할 수 있다. 대여를 희망하는 청년은 울산동구청년센터(명덕5길 6, 3층)를 방문하여 신분증, 주민등록등·초본, 취업확인서류 등 관련 서류를 제출하면 된다. 신청 후 대여업체에 연락하여 예약을 잡고 대여를 진행하면 된다. 보다 자세한 사항은 울산동구청년센터(209-3487)로 문의하면 된다. 민중의소리 후원하기 민중의 소리 후원하기 후원하기 독자투고 TOP'}, {'url': 'https://www.yna.co.kr/view/AKR20230117091400057', 'content': '[울산 동구소식] 청년 면접정장 무료 대여 | 연합뉴스 국가기간뉴스 통신사 연합뉴스 북한 영상 국가기간뉴스 통신사 연합뉴스 [울산 동구소식] 청년 면접정장 무료 대여 이 뉴스 공유하기 닫기 카카오톡 페이스북 X 카카오 [울산 동구소식] 청년 면접정장 무료 대여 울산시 동구는 구직 청년에게 면접 정장 무료 대여 사업을 추진 중이라고 17일 밝혔다. 이 뉴스 공유하기 닫기 카카오톡 페이스북 X 카카오 울산동구청사[연합뉴스 자료사진] (울산=연합뉴스) 울산시 동구는 구직 청년에게 면접 정장 무료 대여 사업을 추진 중이라고 17일 밝혔다. 연합뉴스 Games [전문] 韓권한대행, 헌법재판관 임명 관련 대국민 담화 [1보] 환율, 1,464.8원 마감…금융위기 이후 첫 1,460원대 영상 영상 기사   영상 기사   영상 기사   유튜브 채널 연합뉴스 유튜브채널 통통컬쳐 유튜브채널 통통테크 유튜브채널 통통리빙 유튜브채널 코리아나우 유튜브채널 NK NOW K-VIBE SNS 연합뉴스 페이스북 연합뉴스 트위터 연합뉴스 인스타그램 북한 영상'}]""]","울산 동구 청년 면접정장 대여 사업의 대여 기간은 3박 4일입니다. 이 사업은 연 3회 대여가 가능하며, 지원 대상은 울산 동구 거주 주민으로 만 18세에서 39세 사이의 청년 구직자입니다."
울산 동구 청년 면접정장 대여 사업 신청 절차는 어떻게 되나요?,"['정책 이름: 울산 동구 청년 면접정장 대여 사업', '신청 절차: 울산동구청년센터 문의 052 209 3487']",신청 절차는 울산동구청년센터에 문의하면 됩니다. 전화번호는 052 209 3487입니다.,"['[Document(metadata={\'name\': \'울산 동구 청년 면접정장 대여 사업\', \'source\': \'..\\\\data\\\\policy_result.json\'}, page_content=\'기관:울산 동구 정책 분야:일자리분야 지원 내용:  대여품목   면접용 정장 재킷  바지 스머트  셔츠 블라우스  넥타이   구두   대여기간   3박 4일 연 3회 가능  사업 운영 기간:  사업기간    24. 1. ~ 12. 사업 신청 기간:상시 연령:만 18세 ~ 39세 거주지 및 소득:  대 상   동구 거주 주민록  청년 구직자 18세 ~ 39세  신청 절차:울산동구청년센터 문의 052 209 3487  제출 서류:  구비서류   신분증  주민록  초본  면접응시 증빙자료 주관 기관:울산광역시 동구 일자리정책과 청년정책팀 052 209 3487  운영 기관:울산 동구 청년센터 052 209 3487 \'), Document(metadata={\'name\': \'청년취업 면접복장 대여 안산시 \', \'source\': \'..\\\\data\\\\policy_result.json\'}, page_content=\'기관:경기 안산시 정책 분야:일자리분야 지원 내용: 청년취업 면접복장 대여  대여횟수   1인당 연간 최대 3회까지 가능 사업 신청 기간:상시 비고:예산소진 시 마감 연령:만 18세 ~ 39세 거주지 및 소득: 안산시에 주민록이 된 18세 ~ 39세 거주 청년 신청 절차: 방법   면접 3일 전에 신청하여야 면접복장 대여 가능  신청서작성   일자리센터 승인   정장대여   반납 기타 유익 정보: 문의 안산시 일자리센터 Tel. 031 481 2930 ~ 2931   2882  주관 기관:경기도 안산시 운영 기관:경기도 안산시\'), Document(metadata={\'name\': \'울산 동구 청년 AI 가상  면접체험 사업\', \'source\': \'..\\\\data\\\\policy_result.json\'}, page_content=\'기관:울산 동구 정책 분야:일자리분야 지원 내용:  주요내용   취업을 준비하는 청년에게 AI 가상 면접 체험 지원 사업 운영 기간:  사업기간    24. 2. ~ 12. 사업 신청 기간:상시 연령:만 18세 ~ 39세 거주지 및 소득:  대 상   18세 ~ 39세 청년 신청 절차:  방법   온라인 신청  현장 방문  주관 기관:울산광역시 동구 일자리정책과 청년정책팀 052 209 3487  운영 기관:울산 동구 청년센터 052 209 3485 \'), Document(metadata={\'name\': \'경남 청년 면접정장 무료대여 사업\', \'source\': \'..\\\\data\\\\policy_result.json\'}, page_content=\'기관:경남 정책 분야:일자리분야 지원 내용:  사업내용   구직청년에  면접 정장 무료 대여 사업   대여품목   남 여 정장 셔츠  블라우스  넥타이 포함     대여기간   4일 연 5회 1인당     대여업체   창원  오르테가   창원시 의창구 원이대로 320  W202호   055 600 1620  일 휴무일    영업시간   평일 11시~20시  창원  포튼가먼트 사림점 창원시 의창구 용지로 291번지 1층   055 285 6007   일 휴무일    영업시간   11시~19시  진주  살로토   진주시 진주대로 981 1  2층   055 752 9996   화 휴무일    영업시간   12시~20시  진주  브라이드앤그룸   진주시 진주대로 984 2층   010 6666 1204   화 휴무일    영업시간   11시~20시  김해  라사르토 비스포크   김해시 분성로 349 1층   055 326 0158   일 휴무일    영업시간   평일 11시~20시   토 12시~19시  양산  빅플랜   양산시 물금읍 야리로 127 2층 204호   055 913 8616   휴무   토 일 공휴일    영업시간   평일 10시~18시   업체사정으로 휴무일과 영업시간이 조정될 수 있으며 문의 사항은 상기 대여업체로 연락 바람 사업 신청 기간:2024년 03월11일 ~ 2024년 12월31일 비고:2024.3.11. 월  ~ 예산 소진 시까지 연령:만 18세 ~ 39세 거주지 및 소득:  신청자격   경남에 주소를 둔 청년 고교졸업예정자 포함    청년   18~39세 1984~2006년생     자격요건   취업 면접 자   모의면접  대학 원  진학면접  학군단면접  체험형 인턴  단순 일자리 박람회  취업과 직접 연계되지 않는 는 대여 불가 추가 단서 사항:  공고문 유의사항 확인 신청 절차:  대여절차 1. 온라인 신청   2. 업체 대여승인   3. 업체 방문예약   4. 정장대여   5. 정장수령  반납   택배 신청 가능 신청자 비용 부담    예약 업체와 유선으로 조율 필수   업체 방문예약 시 방문 예정시간  사이즈 여부 유선으로 확인 필수   신청방법   경남청년정보플랫폼 홈페이지   일자리   청년 면접정장 무료대여    하단  신청 바로가기   경상남도 홈페이지 회원가입 필수 제출 서류:  필수자료   면접일자와 내용을 확인할 수 있는 증빙자료  면접 확인서   면접일시  회사명 이 기재된 면접확인 서류 문자  이메일  를  신청 시 업로드   전화로 면접을 통보받았을  회사 측과 통화한 내역 휴대전화 화면 캡쳐 과 입사 지원 사실을 확인할 수 있는 자료를 캡쳐하여 업로드 주관 기관:경상남도 운영 기관:주관기관과 동일\'), Document(metadata={\'name\': \'청년 면접정장 대여비 지원 사업 가평군 \', \'source\': \'..\\\\data\\\\policy_result.json\'}, page_content=\'기관:경기 가평군 정책 분야:일자리분야 지원 내용:  사업 내용   사업기간   2024. 1. ~ 12. 예산 소진 시까지    2024년 면접자 가능    지원대상   가평군에 주소를 둔 취업 준비를 하는 청년  2024. 1. 1. 기준 만15세 ~ 만39세 이하     일반교육  모의면접  대학교 원  면접  자 제외   대여내용    대여품목   정장 상 하의   셔츠  블라우스  넥타이  구두     대여기간   3~4일 대여한 사업장 상황에  상이     방법   개별로 원하는 업체에서 면접정장을 대여 선결제 후  비용 청구    지원내용    지원금액   1인당 1회 최대 10만원 이내     지급방법   계좌 입금 신청자 제출서류 심사 후 지급  사업 신청 기간:상시 비고: 예산 소진 시까지  연령:만 15세 ~ 39세 신청 절차:  가평군 홈페이지  에서 신청서 다운로드  작성 후  증빙서류와 함께 일자리정책과 청년팀 로 직접  이메일 kws1049 korea.kr  제출   2024년에 실시한 면접 자에 한하여 지원 가능   면접정장 대여비 지원은 1인 연 1회로 제한 제출 서류:청년 면접정장 대여비 지원 신청서 1부. 개인정보 수집   제3자  동의서 1부. 신청자 유의사항 확인서 1부. 주민록본 1부.  신청자 본인만 주민록번호 포함 제출  면접응시 증빙자료 1부. 면접정장 대여확인서  대여점 증빙서류 1부. 면접정장 대여 지출증빙서 1부.  신청자 명의 통장사본 1부. 주관 기관:경기도 가평군 운영 기관:가평군 일자리정책과 청년팀  연락처   031 580 4169\')], [{\'url\': \'https://vop.co.kr/A00001626524.html\', \'content\': \'울산 동구, 구직청년 면접정장 무료 대여사업 추진 - 민중의소리 • Media vop 독자투고 지자체기사 울산 동구, 구직청년 면접정장 무료 대여사업 추진 최지현 기자 cjh@vop.co.kr 울산시 동구청은 취업을 준비 중인 지역 청년들의 구직비용 절감과 경제적 부담 완화를 위해 무료로 면접 정장을 대여하는 사업을 추진한다고 17일 밝혔다. 동구청은 대여 전문 업체와의 협약을 통해 면접에 필요한 의류 일체를 대여해주며, 예산이 소진될 때까지 이를 지원할 방침이다. 무료 정장 대여 사업은 지난 12일부터 시작됐으며. 울산 동구에 주소를 둔 만 18세 이상 39세 이하, 면접이 예정된 청년이면 누구나 신청할 수 있다. 대여를 희망하는 청년은 울산동구청년센터(명덕5길 6, 3층)를 방문하여 신분증, 주민등록등·초본, 취업확인서류 등 관련 서류를 제출하면 된다. 신청 후 대여업체에 연락하여 예약을 잡고 대여를 진행하면 된다. 보다 자세한 사항은 울산동구청년센터(209-3487)로 문의하면 된다. 민중의소리 후원하기 민중의 소리 후원하기 후원하기 독자투고 TOP\'}, {\'url\': \'https://m.blog.naver.com/ulsanyouth_dong9/223010401919\', \'content\': \'울산동구, 면접정장대여사업 청년드림(Dream) 슛 안내 : 네이버 블로그 본문 바로가기 카테고리 이동 울산동구청년센터 울산동구, 면접정장대여사업 청년드림(Dream) 슛 안내 울산동구청년센터 이웃추가 본문 기타 기능 청년드림(Dream) 슛 면접정장 지원사업 이용대상 : 만 18세~39세 울산 동구(주소지) 청년 구직자 - 만 18세~39세 울산 동구(주소지) 청년 구직자 - 울산동구청년센터 방문 신청 및 서류 제출 - 대여업체 방문 예약(날짜, 시간) - 예약일에 대여업체 방문 정장수령 및 반납 - 방문신청: 울산동구청년센터, 울산광역시 동구 명덕 5길 6(서부동), 리얼소통발전소 3층 (052-209-3487) - 대여업체: 살로토 울산점, 울산광역시 남구 월평로 213 (052-266-5852) - 남성: 자켓, 셔츠, 바지, 넥타이, 구두 - 여성: 자켓, 블라우스, 치마(바지), 구두 -방문신청 시 : 울산 동구 거주 확인 가능 신분증, 주민등록등·초본, 면접 관련 증빙서류 -대여업체 방문 시 : 신분증, 접수증 {""title"":""울산동구, 면접정장대여사업 청년드림(Dream) 슛 안내"",""source"":""https://blog.naver.com/ulsanyouth_dong9/223010401919"",""blogName"":""울산동구청.."",""domainIdOrBlogId"":""ulsanyouth_dong9"",""nicknameOrBlogId"":""울산동구청년센터"",""logNo"":223010401919,""smartEditorVersion"":4,""outsideDisplay"":true,""lineDisplay"":true,""blogDisplay"":true,""meDisplay"":true,""cafeDisplay"":true} 취소 이웃추가\'}]']","울산 동구 청년 면접정장 대여 사업의 신청 절차는 다음과 같습니다:

1. **대상 확인**: 신청자는 만 18세에서 39세 사이의 울산 동구 거주 청년 구직자여야 합니다.

2. **신청서 제출**: 울산동구청년센터를 방문하여 신분증, 주민등록등본, 초본, 면접 관련 증명서류를 제출합니다. 주소지는 울산광역시 동구 명덕 5길 6, 3층입니다.

3. **대여업체 예약**: 신청 후, 대여업체에 연락하여 면접 정장 대여 예약을 진행합니다. 예약 시 날짜와 시간을 조율해야 합니다.

4. **정장 대여**: 예약한 날짜에 대여업체를 방문하여 정장을 수령합니다. 이때 신분증과 접수증을 지참해야 합니다.

5. **정장 반납**: 면접 후, 대여한 정장을 정해진 기한 내에 반납합니다.

문의 사항이 있을 경우, 울산 동구 청년센터(전화: 052-209-3487)로 연락하면 추가 정보를 얻을 수 있습니다."
울산 동구 청년 면접정장 대여 사업의 제출 서류는 무엇인가요?,"['정책 이름: 울산 동구 청년 면접정장 대여 사업', '제출 서류: 구비서류, 신분증, 주민록 초본, 면접응 증빙료']","제출 서류는 신분증, 주민등록 초본, 면접응시 증빙서류입니다.","['[Document(metadata={\'name\': \'울산 동구 청년 면접정장 대여 사업\', \'source\': \'..\\\\data\\\\policy_result.json\'}, page_content=\'기관:울산 동구 정책 분야:일자리분야 지원 내용:  대여품목   면접용 정장 재킷  바지 스머트  셔츠 블라우스  넥타이   구두   대여기간   3박 4일 연 3회 가능  사업 운영 기간:  사업기간    24. 1. ~ 12. 사업 신청 기간:상시 연령:만 18세 ~ 39세 거주지 및 소득:  대 상   동구 거주 주민록  청년 구직자 18세 ~ 39세  신청 절차:울산동구청년센터 문의 052 209 3487  제출 서류:  구비서류   신분증  주민록  초본  면접응시 증빙자료 주관 기관:울산광역시 동구 일자리정책과 청년정책팀 052 209 3487  운영 기관:울산 동구 청년센터 052 209 3487 \'), Document(metadata={\'name\': \'울산 남구 1사 1청년 채용사업\', \'source\': \'..\\\\data\\\\policy_result.json\'}, page_content=\'기관:울산 남구 정책 분야:일자리분야 지원 내용:  사업내용   남구 중소기업협의회와 MOU체결  1사 1청년 취업 연계 사업 운영 기간:2024. 3. ~ 12 사업 신청 기간:상시 연령:만 19세 ~ 39세 거주지 및 소득:  대상   남구 거주 19세 ~ 39세 이하 미취업 청년 주관 기관:울산광역시 남구 일자리정책과 청년정책팀 052 226 3122  운영 기관:주관기관과 동일\'), Document(metadata={\'name\': \'청년 면접정장 대여비 지원 사업 가평군 \', \'source\': \'..\\\\data\\\\policy_result.json\'}, page_content=\'기관:경기 가평군 정책 분야:일자리분야 지원 내용:  사업 내용   사업기간   2024. 1. ~ 12. 예산 소진 시까지    2024년 면접자 가능    지원대상   가평군에 주소를 둔 취업 준비를 하는 청년  2024. 1. 1. 기준 만15세 ~ 만39세 이하     일반교육  모의면접  대학교 원  면접  자 제외   대여내용    대여품목   정장 상 하의   셔츠  블라우스  넥타이  구두     대여기간   3~4일 대여한 사업장 상황에  상이     방법   개별로 원하는 업체에서 면접정장을 대여 선결제 후  비용 청구    지원내용    지원금액   1인당 1회 최대 10만원 이내     지급방법   계좌 입금 신청자 제출서류 심사 후 지급  사업 신청 기간:상시 비고: 예산 소진 시까지  연령:만 15세 ~ 39세 신청 절차:  가평군 홈페이지  에서 신청서 다운로드  작성 후  증빙서류와 함께 일자리정책과 청년팀 로 직접  이메일 kws1049 korea.kr  제출   2024년에 실시한 면접 자에 한하여 지원 가능   면접정장 대여비 지원은 1인 연 1회로 제한 제출 서류:청년 면접정장 대여비 지원 신청서 1부. 개인정보 수집   제3자  동의서 1부. 신청자 유의사항 확인서 1부. 주민록본 1부.  신청자 본인만 주민록번호 포함 제출  면접응시 증빙자료 1부. 면접정장 대여확인서  대여점 증빙서류 1부. 면접정장 대여 지출증빙서 1부.  신청자 명의 통장사본 1부. 주관 기관:경기도 가평군 운영 기관:가평군 일자리정책과 청년팀  연락처   031 580 4169\'), Document(metadata={\'name\': \'구직청년 면접정장 대여\', \'source\': \'..\\\\data\\\\policy_result.json\'}, page_content=\'기관:강원 동해시 정책 분야:일자리분야 지원 내용:면접정장 대여 사업 운영 기간:상시 사업 신청 기간:상시 비고:연 3회 대여 연령:만 19세 ~ 39세 거주지 및 소득:동해시 지역청년 추가 단서 사항:지역청년 신청 절차:http   청년공간열림.com 심사 및 발표:적합여부 심사 후 대여 제출 서류:면접응시 증빙자료 주관 기관:동해시 경제과\'), Document(metadata={\'name\': \'면접 A to Z 운영\', \'source\': \'..\\\\data\\\\policy_result.json\'}, page_content=\'기관:부산 사상구 정책 분야:일자리분야 지원 내용:   목적  면접 기술  경험 체득으로 청년들의 자신감  취업 경쟁령 향상    주요내용  면접 컨설팅 4회  사업 신청 기간:상시 연령:만 19세 ~ 39세 거주지 및 소득:  사상구 거주  활동하는 취업준비생 취업 상태:미취업자 참여 제한 대상:없음 제출 서류:  공고 확인 기타 유익 정보:없음 주관 기관:  부산광역 사상구 운영 기관:  구청직접\')], [{\'url\': \'https://m.blog.naver.com/ulsanyouth_dong9/223010401919\', \'content\': \'울산동구, 면접정장대여사업 청년드림(Dream) 슛 안내 : 네이버 블로그 본문 바로가기 카테고리 이동 울산동구청년센터 울산동구, 면접정장대여사업 청년드림(Dream) 슛 안내 울산동구청년센터 이웃추가 본문 기타 기능 청년드림(Dream) 슛 면접정장 지원사업 이용대상 : 만 18세~39세 울산 동구(주소지) 청년 구직자 - 만 18세~39세 울산 동구(주소지) 청년 구직자 - 울산동구청년센터 방문 신청 및 서류 제출 - 대여업체 방문 예약(날짜, 시간) - 예약일에 대여업체 방문 정장수령 및 반납 - 방문신청: 울산동구청년센터, 울산광역시 동구 명덕 5길 6(서부동), 리얼소통발전소 3층 (052-209-3487) - 대여업체: 살로토 울산점, 울산광역시 남구 월평로 213 (052-266-5852) - 남성: 자켓, 셔츠, 바지, 넥타이, 구두 - 여성: 자켓, 블라우스, 치마(바지), 구두 -방문신청 시 : 울산 동구 거주 확인 가능 신분증, 주민등록등·초본, 면접 관련 증빙서류 -대여업체 방문 시 : 신분증, 접수증 {""title"":""울산동구, 면접정장대여사업 청년드림(Dream) 슛 안내"",""source"":""https://blog.naver.com/ulsanyouth_dong9/223010401919"",""blogName"":""울산동구청.."",""domainIdOrBlogId"":""ulsanyouth_dong9"",""nicknameOrBlogId"":""울산동구청년센터"",""logNo"":223010401919,""smartEditorVersion"":4,""outsideDisplay"":true,""lineDisplay"":true,""blogDisplay"":true,""meDisplay"":true,""cafeDisplay"":true} 취소 이웃추가\'}, {\'url\': \'https://donggu.ulsan.kr/cop/bbs/selectBoardArticle.do?bbsId=BBSMSTR_000000000323&nttId=189941\', \'content\': \'울산광역시 동구청 | 동구소식 > 알림사항 | 보기 울산광역시 동구청 해피콜(생활민원기동반) 운영 안내 여권발급 안내 구제제도 안내 온라인 출생신고 안내 정책실명제 안내 공공데이터 수요자 의견수렴 안내 해피콜(생활민원기동반) 운영 안내 여권발급 안내 구제제도 안내 온라인 출생신고 안내 수수료 안내 감사실시 안내 정책실명제 안내 공공데이터 수요자 의견수렴 안내 장애인 출산지원금 보육료 안내 교육 관련 사이트 착한가격업소 안내 안심식당 현황 안내 동물보호소 안내 마을버스 안내 자동차검사 및 과태료 안내 자동차책임보험 및 과태료 안내 주정차서비스 안내 주정차 과태료 안내 의견진술 안내 이륜자동차 안내 건축공사장 안내 - 청년 면접 정장 대여사업 안내 - - 예약일에 대여업체 방문 정장수령 및 반납 - 방문신청: 울산동구청년센터,\\xa0울산광역시 동구 명덕 5길 6(서부동), 리얼소통발전소 3층 (052-209-3487) -방문신청 시 : 울산 동구 거주 확인 가능 신분증, 주민등록등·초본, 면접 관련 증빙서류\'}]']","울산 동구 청년 면접정장 대여 사업의 제출 서류는 다음과 같습니다:

1. **신분증** - 신청자의 신분을 확인할 수 있는 신분증.
2. **주민등록초본** - 주소지 확인을 위한 주민등록 초본.
3. **면접응시 증빙자료** - 면접에 응시하는 것을 증명할 수 있는 자료.

이 서류들은 울산 동구청년센터에 방문 신청 시 제출해야 합니다."
의령군 전세보증금반환보증 보증료 지원사업의 지원 내용은 무엇인가요?,"['정책 이름: 의령군 전세보증금반환보증 보증료 지원사업', '기관:경남 의령군', '정책 분야:주거분야', '지원 내용:인이 기 납부한 보증료의 전부  일부 최대 30만원 를  지체가 인 본인 계좌로 이체', '사업 운영 기간:2024. 4.   2024. 12.']",인이 기 납부한 보증료의 전부 또는 일부 최대 30만원을 지체가 인 본인 계좌로 이체합니다.,"['[Document(metadata={\'name\': \'전세보증금반환보증 보험료 지원\', \'source\': \'..\\\\data\\\\policy_result.json\'}, page_content=\'기관:경북 청송군 정책 분야:주거분야 지원 내용:  지원 내용   전세보증금반환보증 보증료 지원 최대 30만원    청년  임차인   신청인이 기납부한 보증료 최대 30만원    청년 외 임차인   신청인이 기납부한 보증료의 90% 최대 30만원    신혼부부   임차인   신청인이 기납부한 보증료 최대 30만원    청년   19~39세    신청일 기준 혼인신고일이 7년 이내인 부부 연령 무관  사업 운영 기간:2024 03 04~2024 12 31 사업 신청 기간:2024년 03월04일 ~ 2024년 12월31일 비고:2024 03 04~2024 12 31 연령:만 19세 ~ 39세 거주지 및 소득:  지원대상   신청일 기준 보증 효력이 유효한 전세보증금반환보증 HUG  HF  SGI 에 가입한 임차보증금 3억원 이하    연소득     청년 5천만원     청년 외 6천만원    신혼부부 7.5천만원 이하 무주택 임차인 참여 제한 대상:  제외대상   외국인  국내에 거주하지 않는 재외국민    민간임대주택에  특별법 에  록임대사업자의 임대주택에 거주하는 임차인   록임대사업자는 임대보증금보증 가입이 의무이며  만약 록임대사업자가 임대보증금보증에 들지 않고 임차인이 전세보증금반환보증에 가입한    민간임대주택에  특별법  제49조 제7항 제3조에  임대인에게 보증료 청구 가능   임차인이 법인인  회사 지원 숙소     그 밖에  지자체장이 지원이 적합하지 않다고 판단하는  신청 절차:  신청방법   오프라인   신청자 주소  전세물건 주소  관할 시군청 담당부서 방문 신청   온라인   청년e끌림     지원절차   보증보험 가입  보험료 납부 신청자 보증기관    보증료 지원 신청 신청자 시군    지원대상 심사  결과 통지 시군  신청일로부터 30일 이내  연장이 필요한  신청인에게 통지 후 15일까지 연장    지원금 지급 시군 신청자  결과통지 후 15일 이내  제출 서류:  제출서류   보증료 지원 신청서  서약서  본인 명의 통장 사본   전세보증금반환보증 보증서  보증료 납부 증빙서류  납부액 기재    HUG와 SGI의  보증서에 보증료 기재되어 있으므로 별도 증빙서류 불필요   임대차계약서  부동산 기사항 전부증명서   주민록본  혼인관계증명서   전년도 소득금액증명 신청일이 7.1. 이전인  전전년도 소득금액증명    소득이 발생하지 않아 소득금액증명이 발급되지 않는 에는  사실증명 신고사실없음   제출   기혼자는 배우자의 소득증빙 서류도 필수 제출   모든 제출 서류는 신청일 기준 1개월 이내에 발급한 서류로 제출 주관 기관:국토교통부 운영 기관:청송군\'), Document(metadata={\'name\': \'사천시 전세보증금반환보증 보증료 지원사업\', \'source\': \'..\\\\data\\\\policy_result.json\'}, page_content=\'기관:경남 사천시 정책 분야:주거분야 지원 내용:임차인이 기 납부한 전세보증금 반환보증 보증료를  지자체에서 전액  일부 최대 30만원  지원 사업 신청 기간:2024년 03월04일 ~ 2024년 12월31일 비고:2024. 3. 4. 09 00 ~ 2024. 12. 31. 23 59  예산 소진시까지  연령:만 19세 ~ 39세 거주지 및 소득:신청일 기준 보증 효력이 유효한 전세보증금반환보증 HUG  HF  SGI 에 가입한 전세보증금 3억원 이하  연 소득 6천만원 신혼부부 7.5천만원  청년 5천만원  이하 무주택 세대 추가 단서 사항:운영기관 문의 참여 제한 대상:운영기관 문의 신청 절차:경남바로 온라인 접수 심사 및 발표:운영기관 문의 제출 서류:운영기관 문의 기타 유익 정보:운영기관 문의 주관 기관:국토교통부 운영 기관:사천시청 건축과 055 831 3218\'), Document(metadata={\'name\': \'의령군 청년 이사비용 지원사업\', \'source\': \'..\\\\data\\\\policy_result.json\'}, page_content=\'기관:경남 의령군 정책 분야:주거분야 지원 내용:  지원내용  이사에 실제 소요된 비용 이삿짐센터비용  입주청소비  중개수수료   50만원 지원   이사비용이 50만원 미만일  실제 납부한 금액만 지원   지급방법  지역화폐 의령사랑상품권 으로 지급 사업 운영 기간:2024. 1. ~ 2024. 12. 사업 신청 기간:상시 비고:2024. 1. ~ 2024. 12. 연령:만 18세 ~ 49세 거주지 및 소득:  신청자격  아래의 요건을 모두 충족하고  지원 제외 대상에 하지 않는 자   2023. 1. 1. 이후 의령군 전입  관내 이사하고 신청일 기준 주민록상 주소지가 의령군이며  18~49세 이하인 자   의령군 청년 기준   18세 ~ 49세 1975. 1. 1. ~ 2006. 12. 31. 출생    가구 기준 중위소득 180% 이하 이며  부동산 매매 계약자  전 월세 임차 계약자   가구소득은 사업 신청 전월 건강보험료 납부액으로 확인  공고문 참고    가구원 중위소득 산정  가구원 수에 포함되는 가구원 중 건강보험료를납부하는 모든 사람의 보험료를 합산 참여 제한 대상:  지원 제외 대상   공동생활가정  사회보장시설 입소자  시설수급자   지원금 수령 후 타 지역 전출 후 재 전입한    국가  지자체  공공기관  유사 사업 지원 수혜자   직계가족 조부모  외조부모  부모  자녀  이 소유한 집에 이사하는    학교  회사 의 기숙사로 이사하는  신청 절차:  신청방법   기우편  이메일 lkh22800 korea.kr   읍 면사무소 방문   신청서류  의령군 홈페이지   고시 공고에서 다운   제출방법  주소지 관할 읍 면사무소  군청 소멸위기대응추진단 방문 신청    방문 신청은 평일 근무시간 09 00~18 00  내 가능하며  가족 부모  형제  배우자 에 한하여 대리 접수 가능하나  위임장 붙임2   위임서류 제출 필요 제출 서류:  제출서류   모든 발급서류는 공고일 이후 발급된 서류로 제출   신청서 붙임1   신분증 사본 각 1부   주민록본  주민록초본 최근 2년간 주소변동 사항 포함  각 1부   가족관계증명서 1부   건강보험료 자격확인서  건강보험료 납부확인서 부양자 기준  각 1부   부동산 매매 계약서  전 월세 임차 계약서 사본 1부   이사비용  결제영수증 이삿짐센터비용  입주청소비  중개수수료     현금영수증  전자세금계산서  카드결제영수증  이사일 기준 3개월 이내  당해연도    제외대상   계좌이체내역  주거이전에  자산취득 물품 전자제품  가구   구입 증빙 영수증   위임장  기타 위임서류 대리인 신청 시  주관 기관:의령군 소멸위기대응추진단 청년정책팀  570 2934  운영 기관:주관기관과 동일\'), Document(metadata={\'name\': \'전세보증금반환보증 보증료지원\', \'source\': \'..\\\\data\\\\policy_result.json\'}, page_content=\'기관:부산 정책 분야:주거분야 지원 내용:  지원내용   전세보증금반환보증 보증료 지원 최대 30만원    반환보증료에 한해 지원   청년  신혼부부 임차인   신청인이 기납부한 보증료  최대 30만원    청년 외 임차인   신청인이 기납부한 보증료의 90%  최대 30만원  사업 신청 기간:2024년 03월04일 ~ 2024년 12월31일 연령:만 19세 ~ 39세 거주지 및 소득:  아래   ~   기준을 모두 충족하는 주민록 상 부산 거주 시민   신청일 기준 보증 효력이 유효한 전세보증금반환보증에 가입   임차보증금 3억원 이하   연소득  청년  5천만원   청년 외  6천만원   신혼부부  7.5천만원 이하   무주택   분양권  입주권 주택 포함   본인  배우자 모두 무주택    청년   18세~39세  신혼부부   신청일 기준 혼인신고일 7년이내 부부 연령무관    동일 지자체 구군기준 에 한하여 2년간 신청 제한. 단  다른 지자체 이전하는  제한 없음. 참여 제한 대상:  지원제외대상   외국인  국내에 거주하지 않는 재외국민   민간임대주택에  특별법 에  록임대사업자의 임대주택에 거주하는 임차인   임차인이 법인인  회사 지원 숙소     그 밖에  지자체장이 지원이 적합하지 않다고 판단하는  신청 절차:  온라인신청   정부24 보조금24  온라인 신청 회원가입  본인인증절차 필요    정부24  자주찾는 검색   부산광역시 전세보증금 반환보증 보증료 지원  입력   정부24  신청서 작성 신청인 정보  자격요건  유의사항   구비서류 첨부 심사 및 발표: portal rcvfvrSvc dtlEx 626000000612 administOrgCd  주관 기관:국토교통부 운영 기관:부산시\'), Document(metadata={\'name\': \'울산 북구 전세보증금 반환보증 보증료 지원\', \'source\': \'..\\\\data\\\\policy_result.json\'}, page_content=\'기관:울산 북구 정책 분야:주거분야 지원 내용:  지원내용   전세보증금반환보증에 가입한 보증료 전부  일부 지원  보증기관  1. 주택도시보증공사 HUG   2. 한국주택금융공사 HF   3. SGI서울보증   신청인이 기 납부한 보증료를 최대 30만원  신청인 본인 계좌로 이체   청년  신혼부부   기 납부한 보증료의 100% 지원  최대 30만원    청년 외   기 납부한 보증료의 90% 지원  최대 30만원   기타 자세한 사항은 사업 공고문 참조 사업 신청 기간:2024년 03월04일 ~ 2024년 12월31일 비고:2024. 3. 4. 부터 신청 가능  연중  연령:만 19세 ~ 39세 거주지 및 소득:  지원대상   거주지   신청일 기준 보증 효력이 유효한 전세보증금반환보증에 가입한 울산광역시 북구 거주자   외국인  재외국민은 제외   2024. 1. 1. ~ 3. 4. 사업시행일  기간에 보증 효력이 유효한 전세보증금반환보증에 가입된  신청 가능  2024. 6. 30. 이전 신청자에 한함.    연령   전 연령   소득   청년    연소득 5천만원 이하   청년 외   연소득 6천만원 이하   신혼부부     부부 합산 연소득 7천5백만원 이하    울산광역시 청년 기본 조례에  연령 만19세 ~ 만39세     혼인신고일로부터 7년 이내   주택   임대차계약 보증금이 3억원 이하인 주민록 주소지와 일치하는 주거용 주택 추가 단서 사항:공고문 참고 참여 제한 대상:공고문 참고 신청 절차:울산광역시 북구청 건축주택과 방문 신청 심사 및 발표:공고문 참고 제출 서류:공고문 참고 기타 유익 정보:공고문 참고 주관 기관:울산광역시 북구 건축주택과 052 241 8029  운영 기관:주관기관과 동일\')], [{\'url\': \'https://inzicf.com/entry/2024-의령군-전세보증금-반환보증-보증료-지원사업-안내\', \'content\': ""2024 의령군 전세보증금 반환보증 보증료 지원사업 안내 2024 의령군 전세보증금 반환보증 보증료 지원사업 안내   2024 의령군 전세보증금 반환보증 보증료 지원사업 안내 이번 글에서는 경상남도에서 제공하는 의령군 전세보증금 반환보증 보증료 지원사업에 대해 자세히 안내해드리겠습니다. 지원 대상, 지원 내용, 신청 방법 및 제출 서류에 대해 자세히 설명드리겠습니다. 신청 방법 🌟 온라인 신청 (보조금24) \'대구광역시 다자녀가정 고등학교 입학축하금 지원 신청\' 선택 신청 정보 입력 및 재학증명서 파일 첨부 제출 서류: 지원신청서, 주민등록등본, 재학증명서, 가족관계증명서(필요 시) 전세보증금 반환보증 보증서 사본 및 보증료 납부 증빙서류 신청 대상 및 조건 경상남도의 전세보증금 반환보증 보증료 지원사업은 저소득층 가정을 지원하여 전세금 미반환 피해를 예방하는 중요한 제도입니다. << 이전글 2024년 거창군 전세보증금반환보증 보증료 지원사업 안내 타보소 DRT 이용방법 및 요금 안내: 포항시 맞춤형 교통 서비스!""}, {\'url\': \'https://www.uiryeong.go.kr/board/view.uiryeong?boardId=BBS_0000070&menuCd=DOM_000000203003001001&startPage=1&dataSid=316445&gosiNo=31336\', \'content\': \'군정소식 > 공고/고시 > 공고/고시 > 공고/고시 > 글보기용 게시물 | 의령군청 의령군청 주요 누리집 의령군의회 의령군 UIRYEONG 변화의시작 더 살기좋은 의령 무인민원발급창구 안내 민원이용 안내 민원서식 작성예시 민원서식 외국어 해석본 민원제증명 수수료 면제 안내 구술·전화민원 안내 분야별 민원 안내 교통/자동차 온라인민원 신청 신고센터 부동산 불법거래 신고센터 공공데이터 소개 국민신청실명제 신청 적극행정 적극행정/소극행정 소극행정 신고센터 공공저작물 의령군 소식지 블로그 소식 공고/고시 공고/고시 행사/교육 의/약업소 안내 경제/일자리 일자리 교육/문화/체육 교육 공무원 정원 공무원 1인당 주민수 소속기관 및 읍면동 공무원 비율 전화 팩스번호 안내 의령군의회 의령군 소식지 블로그 소식 공고/고시 공고/고시 행사/교육 공고/고시 대표 군정소식 공고/고시 공고/고시 블로그 공고/고시 완료된 공고/고시 전세보증금반환보증 보증료 지원사업 안내 의령군 공고 제2024-448호 부동산 불법행위통합 신고센터 의령군 의령군의회 (52140) 경상남도 의령군 의령읍 충익로 63 대표전화 : 055-570-2114\'}]']","의령군 전세보증금 반환보증 보증료 지원사업의 지원 내용은 다음과 같습니다:

1. **지원 금액**: 이사에 실제 소요된 비용에 대해 지원하며, 이사비용이 50만원 미만일 경우에는 실제 납부한 금액만 지원합니다. 지원 최대 금액은 50만원입니다.

2. **지원 항목**: 지원 항목에는 이삿짐센터 비용, 입주 청소비, 중개 수수료 등이 포함됩니다.

3. **지급 방법**: 지원금은 지역화폐인 의령사랑상품권으로 지급됩니다.

4. **신청 자격**: 
   - 2023년 1월 1일 이후 의령군으로 전입한 자.
   - 신청일 기준 주민등록상 주소지가 의령군이며, 만 18세에서 49세 사이의 자.
   - 가구 기준 중위소득 180% 이하인 자.
   - 부동산 매매 계약자 또는 전 월세 임차 계약자.

5. **신청 방법**: 신청은 이메일이나 읍 면사무소를 방문하여 가능하며, 필요한 서류는 의령군 홈페이지에서 다운로드하여 제출해야 합니다.

6. **제출 서류**: 
   - 신청서, 신분증 사본, 주민등록등본, 가족관계증명서, 건강보험료 자격 확인서, 부동산 계약서 사본, 이사비용 결제 영수증 등이 포함됩니다.

이 지원사업은 저소득층 가정을 지원하여 전세금 미반환 피해를 예방하는 중요한 제도입니다."
의령군 전세보증금반환보증 보증료 지원사업의 신청 기간은 언제인가요?,"['정책 이름: 의령군 전세보증금반환보증 보증료 지원사업', '기관:경남 의령군', '사업 신청 기간:2024년 04월01일   2024년 12월31일']",2024년 04월01일부터 2024년 12월31일까지입니다.,"['[Document(metadata={\'name\': \'의령군 전세보증금반환보증 보증료 지원사업\', \'source\': \'..\\\\data\\\\policy_result.json\'}, page_content=\'기관:경남 의령군 정책 분야:주거분야 지원 내용:신청인이 기 납부한 보증료의 전부  일부 최대 30만원 를  지자체가 신청인 본인 계좌로 이체 사업 운영 기간:2024. 4. ~ 2024. 12. 사업 신청 기간:2024년 04월01일 ~ 2024년 12월31일 비고:2024. 4. 1. ~ 2024. 12. 31. 거주지 및 소득:  지원대상 신청일 기준 보증 효력이 유효한 전세금반환보증 HUG  HF  SGI 에 가입한 임차보증금 3억원 이하 청년 5천만원  청년 외 6천만원  신혼부부 7.5천만원 이하인 무주택 임차인 참여 제한 대상:  지원 제외 대상   외국인  국내에 거주하지 않는 재외국민   민간임대주택에  특별법 에  록임대사업자의 임대주택에 거주하는 임차인   록임대사업자는 임대보증금보증 가입이 의무이며  임차인이 전세보증금반환보증 가입하는  임대인에게 보증료 청구 가능   임차인이 법인인  회사 지원 숙소     그 밖에 지자체장이 지원이 적합하지 않다고 판단하는  신청 절차:경남바로 신청 제출 서류:  보증료 지원 신청서  서약서   전세보증금 반환보증 보증서 사본 보증료  전세보증금 확인  보증료 납부 증빙서류 납부액 기재    임대차계약서 사본    부동산 기사항 전부 증명서   주민록본 임차주택 전입 여부    혼인관계증명서 혼인기간 7년이내 여부    본인명의 통장 사본    전년도 소득금액증명  기혼자는 배우자의 소득증빙 서류도 필수 제출    기타 군수가 필요하다고 인정하는 서류 주관 기관:국토교통부 운영 기관:의령군 소멸위기대응추진단 055 570 2924 \'), Document(metadata={\'name\': \'전입장려금 경북 고령군 \', \'source\': \'..\\\\data\\\\policy_result.json\'}, page_content=\'기관:경북 고령군 정책 분야:주거분야 지원 내용:1인당 10만원 사업 신청 기간:2024년 01월01일 ~ 2024년 12월31일 비고:2024.01.01~2024.12.31 거주지 및 소득:  다른 시 군 구에서 고령군으로  주민록법 에  주소지를 이동한 세대   6개월 이상 군에 주소를  거주하고 있는 사람 학력:고졸 미만 고교 재학 고졸 예정 고교 졸업 대학 재학 대졸 예정 대학 졸업 석 박사 전공:인문계열 사회계열 상경계열 이학계열 공학계열 예체능계열 농산업계열 취업 상태:재직자 자영업자 미취업자 프리랜서 일용근로자 창업자 단기근로자 영농종사자 특화 분야:중소기업 여성 저소득층 장애인 농업인 군인 지역인재 추가 단서 사항:  2022.10.17.일 이후 전입자부터 적용 신청 절차:전입 후 2년 이내에 신청서를 작성하여 읍 면장에게 제출 제출 서류:신청서 고령군 인구증가 시책 지원 조례 별지 제1호 서식  주관 기관:고령군청 운영 기관:인구정책과 인구정책팀\'), Document(metadata={\'name\': \'울산 울주군 전세보증금 반환보증 보증료 지원\', \'source\': \'..\\\\data\\\\policy_result.json\'}, page_content=\'기관:울산 울주군 정책 분야:주거분야 지원 내용:  지원내용   신청일 기준 보증 효력이 유효한 전세보증금반환보증 HUG  HF  SGI 에 가입한 신청인이 기납부한 전세보증금반환보증 보증료에 대해 전부  일부 최대 30만원 를 환급하는 방식으로 지자체가 신청인 본인 계좌로 이체  최대 30만원  사업 신청 기간:2024년 03월04일 ~ 2024년 12월31일 비고:연중  지자체별 예산 소진시 조기 마감  연령:만 19세 ~ 39세 거주지 및 소득:  지원대상    거주지    신청일 기준 주민록상 울주군 거주자    외국인  재외국민은 지원 제외    소득    청년  5천만원   청년 외  6천만원   신혼부부  7.5천만원 이하의 무주택 임차인    주택    전세보증금반환보증 보증서  임대차계약서 보증금이 3억원 이하인 주민록 주소지와 일치하는 주거용 주택 신청 절차:군청  읍사무소에 방문신청 제출 서류:1. 보증료 지원 신청서  서약서 홈페이지 첨부  2. 전세보증금반환보증 보증증서 사본 보증료  전세보증금 확인   보증료 납부 증빙서류 납부액 기재    가입한 보증기관 발급  3. 임대차계약서 사본 4. 부동산 기사항 전부증명서   인터넷기소  행정복지센터 무인발급기 5. 주민록본  혼인관계증명서 신혼부부 7년이내 여부   6. 본인명의 통장 사본 7. 전년도 소득금액증명 신청일이 7.1 이전인  전전년도 소득금액증명    소득이 발생하지 않아 소득금액증명이 발급되지 않는 에는  사실증명 신고사실없음   제출   기혼자는 배우자의 소득증빙 서류도 필수 제출   홈택스  세무서 발급 주관 기관:국토교통부 민원콜센터  1599 0001  운영 기관:울주군청 주택과   052 204 2057 \'), Document(metadata={\'name\': \'의령군 청년 이사비용 지원사업\', \'source\': \'..\\\\data\\\\policy_result.json\'}, page_content=\'기관:경남 의령군 정책 분야:주거분야 지원 내용:  지원내용  이사에 실제 소요된 비용 이삿짐센터비용  입주청소비  중개수수료   50만원 지원   이사비용이 50만원 미만일  실제 납부한 금액만 지원   지급방법  지역화폐 의령사랑상품권 으로 지급 사업 운영 기간:2024. 1. ~ 2024. 12. 사업 신청 기간:상시 비고:2024. 1. ~ 2024. 12. 연령:만 18세 ~ 49세 거주지 및 소득:  신청자격  아래의 요건을 모두 충족하고  지원 제외 대상에 하지 않는 자   2023. 1. 1. 이후 의령군 전입  관내 이사하고 신청일 기준 주민록상 주소지가 의령군이며  18~49세 이하인 자   의령군 청년 기준   18세 ~ 49세 1975. 1. 1. ~ 2006. 12. 31. 출생    가구 기준 중위소득 180% 이하 이며  부동산 매매 계약자  전 월세 임차 계약자   가구소득은 사업 신청 전월 건강보험료 납부액으로 확인  공고문 참고    가구원 중위소득 산정  가구원 수에 포함되는 가구원 중 건강보험료를납부하는 모든 사람의 보험료를 합산 참여 제한 대상:  지원 제외 대상   공동생활가정  사회보장시설 입소자  시설수급자   지원금 수령 후 타 지역 전출 후 재 전입한    국가  지자체  공공기관  유사 사업 지원 수혜자   직계가족 조부모  외조부모  부모  자녀  이 소유한 집에 이사하는    학교  회사 의 기숙사로 이사하는  신청 절차:  신청방법   기우편  이메일 lkh22800 korea.kr   읍 면사무소 방문   신청서류  의령군 홈페이지   고시 공고에서 다운   제출방법  주소지 관할 읍 면사무소  군청 소멸위기대응추진단 방문 신청    방문 신청은 평일 근무시간 09 00~18 00  내 가능하며  가족 부모  형제  배우자 에 한하여 대리 접수 가능하나  위임장 붙임2   위임서류 제출 필요 제출 서류:  제출서류   모든 발급서류는 공고일 이후 발급된 서류로 제출   신청서 붙임1   신분증 사본 각 1부   주민록본  주민록초본 최근 2년간 주소변동 사항 포함  각 1부   가족관계증명서 1부   건강보험료 자격확인서  건강보험료 납부확인서 부양자 기준  각 1부   부동산 매매 계약서  전 월세 임차 계약서 사본 1부   이사비용  결제영수증 이삿짐센터비용  입주청소비  중개수수료     현금영수증  전자세금계산서  카드결제영수증  이사일 기준 3개월 이내  당해연도    제외대상   계좌이체내역  주거이전에  자산취득 물품 전자제품  가구   구입 증빙 영수증   위임장  기타 위임서류 대리인 신청 시  주관 기관:의령군 소멸위기대응추진단 청년정책팀  570 2934  운영 기관:주관기관과 동일\'), Document(metadata={\'name\': \'청년 취업수당 지원\', \'source\': \'..\\\\data\\\\policy_result.json\'}, page_content=\'기관:강원 고성군 정책 분야:일자리분야 지원 내용:월 300천원씩 12개월간 지원 사업 운영 기간:연중 사업 신청 기간:상시 지원 규모(명):54 000천원   15명   3 600천원 비고:상시 연령:만 19세 ~ 39세 거주지 및 소득:  공고일로부터 3개월 이전월 이후 관내업체에 정규직으로 취업한 고성군 거주 청년  공고일 기준 주민록상 고성군 거주  전입예정인 청년 전입 후 신청 가능  학력:기타 취업 상태:재직자 추가 단서 사항:지원중 관외 전출  퇴사시 지원종료 연중 재취업시 잔여기간에 대해 지원  참여 제한 대상:   중소기업 인력지원 특별법 제3조 적용범위 의 지원 제외업체  보조금 취지상 지원이 적합하지 않은 업종에 취업한    부동산업  일반유흥 주점업  무도유흥 주점업  기타 갬블링업    단순노무  일시사역 인부   공무원  공공기관  공공단체  공기업  운영비 인건비를 지원받는 기관   정부 취업성공수당  청년 내일채움공제  강원특별자치도 안심공제 수령자  인건비성 지원사업 자   사업주의 직계존비속  배우자  형제자매인  신청 절차:서류지참 후 군청 방문   적격여부 심사 후 선정 여부 통보 심사 및 발표:상시 제출 서류:최초 신청시   2023년 청년 취업수당 지원 신청서 서식 1    개인정보 수집 동의서 지원자  서식 2    개인정보 수집 동의서 사업장  서식 3    주민록 본  초본 1부   근로계약서 사본 1부   4대보험 사업장 가입자 명부 1부   통장사본 본인명의 통장  1부매월 청구 서류  지원여부 확정 후  매월 23일까지 전월분 수당청구   청구서 도장지참  1부   4대보험 가입내역확인서 1부   급여명세서 1부   임금입금확인증 거래내역증빙  1부 기타 유익 정보:사항 없음 주관 기관:고성군 경제체육과 운영 기관:고성군\')], [{\'url\': \'https://inzicf.com/entry/2024-의령군-전세보증금-반환보증-보증료-지원사업-안내\', \'content\': ""2024 의령군 전세보증금 반환보증 보증료 지원사업 안내 2024 의령군 전세보증금 반환보증 보증료 지원사업 안내   2024 의령군 전세보증금 반환보증 보증료 지원사업 안내 이번 글에서는 경상남도에서 제공하는 의령군 전세보증금 반환보증 보증료 지원사업에 대해 자세히 안내해드리겠습니다. 지원 대상, 지원 내용, 신청 방법 및 제출 서류에 대해 자세히 설명드리겠습니다. 신청 방법 🌟 온라인 신청 (보조금24) \'대구광역시 다자녀가정 고등학교 입학축하금 지원 신청\' 선택 신청 정보 입력 및 재학증명서 파일 첨부 제출 서류: 지원신청서, 주민등록등본, 재학증명서, 가족관계증명서(필요 시) 전세보증금 반환보증 보증서 사본 및 보증료 납부 증빙서류 신청 대상 및 조건 경상남도의 전세보증금 반환보증 보증료 지원사업은 저소득층 가정을 지원하여 전세금 미반환 피해를 예방하는 중요한 제도입니다. << 이전글 2024년 거창군 전세보증금반환보증 보증료 지원사업 안내 타보소 DRT 이용방법 및 요금 안내: 포항시 맞춤형 교통 서비스!""}, {\'url\': \'https://www.uiryeong.go.kr/board/view.uiryeong?boardId=BBS_0000070&menuCd=DOM_000000203003001001&startPage=1&dataSid=316445&gosiNo=31336\', \'content\': \'군정소식 > 공고/고시 > 공고/고시 > 공고/고시 > 글보기용 게시물 | 의령군청 의령군청 주요 누리집 의령군의회 의령군 UIRYEONG 변화의시작 더 살기좋은 의령 무인민원발급창구 안내 민원이용 안내 민원서식 작성예시 민원서식 외국어 해석본 민원제증명 수수료 면제 안내 구술·전화민원 안내 분야별 민원 안내 교통/자동차 온라인민원 신청 신고센터 부동산 불법거래 신고센터 공공데이터 소개 국민신청실명제 신청 적극행정 적극행정/소극행정 소극행정 신고센터 공공저작물 의령군 소식지 블로그 소식 공고/고시 공고/고시 행사/교육 의/약업소 안내 경제/일자리 일자리 교육/문화/체육 교육 공무원 정원 공무원 1인당 주민수 소속기관 및 읍면동 공무원 비율 전화 팩스번호 안내 의령군의회 의령군 소식지 블로그 소식 공고/고시 공고/고시 행사/교육 공고/고시 대표 군정소식 공고/고시 공고/고시 블로그 공고/고시 완료된 공고/고시 전세보증금반환보증 보증료 지원사업 안내 의령군 공고 제2024-448호 부동산 불법행위통합 신고센터 의령군 의령군의회 (52140) 경상남도 의령군 의령읍 충익로 63 대표전화 : 055-570-2114\'}]']",의령군 전세보증금 반환보증 보증료 지원사업의 신청 기간은 2024년 4월 1일부터 2024년 12월 31일까지입니다. 이 기간 동안 신청자는 보증료 지원을 받을 수 있습니다.
의령군 전세보증금반환보증 보증료 지원사업의 주관 기관은 어디인가요?,"['정책 이름: 의령군 전세보증금반환보증 보증료 지원사업', '주관 기관:국토교통부']",국토교통부입니다.,"['[Document(metadata={\'name\': \'사천시 전세보증금반환보증 보증료 지원사업\', \'source\': \'..\\\\data\\\\policy_result.json\'}, page_content=\'기관:경남 사천시 정책 분야:주거분야 지원 내용:임차인이 기 납부한 전세보증금 반환보증 보증료를  지자체에서 전액  일부 최대 30만원  지원 사업 신청 기간:2024년 03월04일 ~ 2024년 12월31일 비고:2024. 3. 4. 09 00 ~ 2024. 12. 31. 23 59  예산 소진시까지  연령:만 19세 ~ 39세 거주지 및 소득:신청일 기준 보증 효력이 유효한 전세보증금반환보증 HUG  HF  SGI 에 가입한 전세보증금 3억원 이하  연 소득 6천만원 신혼부부 7.5천만원  청년 5천만원  이하 무주택 세대 추가 단서 사항:운영기관 문의 참여 제한 대상:운영기관 문의 신청 절차:경남바로 온라인 접수 심사 및 발표:운영기관 문의 제출 서류:운영기관 문의 기타 유익 정보:운영기관 문의 주관 기관:국토교통부 운영 기관:사천시청 건축과 055 831 3218\'), Document(metadata={\'name\': \'전세보증금반환보증 보험료 지원\', \'source\': \'..\\\\data\\\\policy_result.json\'}, page_content=\'기관:경북 청송군 정책 분야:주거분야 지원 내용:  지원 내용   전세보증금반환보증 보증료 지원 최대 30만원    청년  임차인   신청인이 기납부한 보증료 최대 30만원    청년 외 임차인   신청인이 기납부한 보증료의 90% 최대 30만원    신혼부부   임차인   신청인이 기납부한 보증료 최대 30만원    청년   19~39세    신청일 기준 혼인신고일이 7년 이내인 부부 연령 무관  사업 운영 기간:2024 03 04~2024 12 31 사업 신청 기간:2024년 03월04일 ~ 2024년 12월31일 비고:2024 03 04~2024 12 31 연령:만 19세 ~ 39세 거주지 및 소득:  지원대상   신청일 기준 보증 효력이 유효한 전세보증금반환보증 HUG  HF  SGI 에 가입한 임차보증금 3억원 이하    연소득     청년 5천만원     청년 외 6천만원    신혼부부 7.5천만원 이하 무주택 임차인 참여 제한 대상:  제외대상   외국인  국내에 거주하지 않는 재외국민    민간임대주택에  특별법 에  록임대사업자의 임대주택에 거주하는 임차인   록임대사업자는 임대보증금보증 가입이 의무이며  만약 록임대사업자가 임대보증금보증에 들지 않고 임차인이 전세보증금반환보증에 가입한    민간임대주택에  특별법  제49조 제7항 제3조에  임대인에게 보증료 청구 가능   임차인이 법인인  회사 지원 숙소     그 밖에  지자체장이 지원이 적합하지 않다고 판단하는  신청 절차:  신청방법   오프라인   신청자 주소  전세물건 주소  관할 시군청 담당부서 방문 신청   온라인   청년e끌림     지원절차   보증보험 가입  보험료 납부 신청자 보증기관    보증료 지원 신청 신청자 시군    지원대상 심사  결과 통지 시군  신청일로부터 30일 이내  연장이 필요한  신청인에게 통지 후 15일까지 연장    지원금 지급 시군 신청자  결과통지 후 15일 이내  제출 서류:  제출서류   보증료 지원 신청서  서약서  본인 명의 통장 사본   전세보증금반환보증 보증서  보증료 납부 증빙서류  납부액 기재    HUG와 SGI의  보증서에 보증료 기재되어 있으므로 별도 증빙서류 불필요   임대차계약서  부동산 기사항 전부증명서   주민록본  혼인관계증명서   전년도 소득금액증명 신청일이 7.1. 이전인  전전년도 소득금액증명    소득이 발생하지 않아 소득금액증명이 발급되지 않는 에는  사실증명 신고사실없음   제출   기혼자는 배우자의 소득증빙 서류도 필수 제출   모든 제출 서류는 신청일 기준 1개월 이내에 발급한 서류로 제출 주관 기관:국토교통부 운영 기관:청송군\'), Document(metadata={\'name\': \'울산 울주군 전세보증금 반환보증 보증료 지원\', \'source\': \'..\\\\data\\\\policy_result.json\'}, page_content=\'기관:울산 울주군 정책 분야:주거분야 지원 내용:  지원내용   신청일 기준 보증 효력이 유효한 전세보증금반환보증 HUG  HF  SGI 에 가입한 신청인이 기납부한 전세보증금반환보증 보증료에 대해 전부  일부 최대 30만원 를 환급하는 방식으로 지자체가 신청인 본인 계좌로 이체  최대 30만원  사업 신청 기간:2024년 03월04일 ~ 2024년 12월31일 비고:연중  지자체별 예산 소진시 조기 마감  연령:만 19세 ~ 39세 거주지 및 소득:  지원대상    거주지    신청일 기준 주민록상 울주군 거주자    외국인  재외국민은 지원 제외    소득    청년  5천만원   청년 외  6천만원   신혼부부  7.5천만원 이하의 무주택 임차인    주택    전세보증금반환보증 보증서  임대차계약서 보증금이 3억원 이하인 주민록 주소지와 일치하는 주거용 주택 신청 절차:군청  읍사무소에 방문신청 제출 서류:1. 보증료 지원 신청서  서약서 홈페이지 첨부  2. 전세보증금반환보증 보증증서 사본 보증료  전세보증금 확인   보증료 납부 증빙서류 납부액 기재    가입한 보증기관 발급  3. 임대차계약서 사본 4. 부동산 기사항 전부증명서   인터넷기소  행정복지센터 무인발급기 5. 주민록본  혼인관계증명서 신혼부부 7년이내 여부   6. 본인명의 통장 사본 7. 전년도 소득금액증명 신청일이 7.1 이전인  전전년도 소득금액증명    소득이 발생하지 않아 소득금액증명이 발급되지 않는 에는  사실증명 신고사실없음   제출   기혼자는 배우자의 소득증빙 서류도 필수 제출   홈택스  세무서 발급 주관 기관:국토교통부 민원콜센터  1599 0001  운영 기관:울주군청 주택과   052 204 2057 \'), Document(metadata={\'name\': \'의령군 청년 이사비용 지원사업\', \'source\': \'..\\\\data\\\\policy_result.json\'}, page_content=\'기관:경남 의령군 정책 분야:주거분야 지원 내용:  지원내용  이사에 실제 소요된 비용 이삿짐센터비용  입주청소비  중개수수료   50만원 지원   이사비용이 50만원 미만일  실제 납부한 금액만 지원   지급방법  지역화폐 의령사랑상품권 으로 지급 사업 운영 기간:2024. 1. ~ 2024. 12. 사업 신청 기간:상시 비고:2024. 1. ~ 2024. 12. 연령:만 18세 ~ 49세 거주지 및 소득:  신청자격  아래의 요건을 모두 충족하고  지원 제외 대상에 하지 않는 자   2023. 1. 1. 이후 의령군 전입  관내 이사하고 신청일 기준 주민록상 주소지가 의령군이며  18~49세 이하인 자   의령군 청년 기준   18세 ~ 49세 1975. 1. 1. ~ 2006. 12. 31. 출생    가구 기준 중위소득 180% 이하 이며  부동산 매매 계약자  전 월세 임차 계약자   가구소득은 사업 신청 전월 건강보험료 납부액으로 확인  공고문 참고    가구원 중위소득 산정  가구원 수에 포함되는 가구원 중 건강보험료를납부하는 모든 사람의 보험료를 합산 참여 제한 대상:  지원 제외 대상   공동생활가정  사회보장시설 입소자  시설수급자   지원금 수령 후 타 지역 전출 후 재 전입한    국가  지자체  공공기관  유사 사업 지원 수혜자   직계가족 조부모  외조부모  부모  자녀  이 소유한 집에 이사하는    학교  회사 의 기숙사로 이사하는  신청 절차:  신청방법   기우편  이메일 lkh22800 korea.kr   읍 면사무소 방문   신청서류  의령군 홈페이지   고시 공고에서 다운   제출방법  주소지 관할 읍 면사무소  군청 소멸위기대응추진단 방문 신청    방문 신청은 평일 근무시간 09 00~18 00  내 가능하며  가족 부모  형제  배우자 에 한하여 대리 접수 가능하나  위임장 붙임2   위임서류 제출 필요 제출 서류:  제출서류   모든 발급서류는 공고일 이후 발급된 서류로 제출   신청서 붙임1   신분증 사본 각 1부   주민록본  주민록초본 최근 2년간 주소변동 사항 포함  각 1부   가족관계증명서 1부   건강보험료 자격확인서  건강보험료 납부확인서 부양자 기준  각 1부   부동산 매매 계약서  전 월세 임차 계약서 사본 1부   이사비용  결제영수증 이삿짐센터비용  입주청소비  중개수수료     현금영수증  전자세금계산서  카드결제영수증  이사일 기준 3개월 이내  당해연도    제외대상   계좌이체내역  주거이전에  자산취득 물품 전자제품  가구   구입 증빙 영수증   위임장  기타 위임서류 대리인 신청 시  주관 기관:의령군 소멸위기대응추진단 청년정책팀  570 2934  운영 기관:주관기관과 동일\'), Document(metadata={\'name\': \'청년창업 특례보증 안양시 \', \'source\': \'..\\\\data\\\\policy_result.json\'}, page_content=\'기관:경기 안양시 정책 분야:일자리분야 지원 내용:  보증한도   업체당 5천만원 이내   보증기간   3년 이내   보증기관   경기신용보증재단    보다 상세한 내용은 공고문을 참고해주세요. 사업 신청 기간:상시 비고:예산 소진시 마감 연령:만 19세 ~ 39세 거주지 및 소득:  지원대상   중소기업기본법에 의한 중소기업으로서   안양시에 사업자록 을 필한 업체로 대표자가 만 19세 이상 만 39세 이하이며 사업경력이 5년 이내인 기업 신청 절차: 지원절차 신청 기업 경기신용보증재단  추천 안양시  경기신용보증재단  보증서발급 경기신용보증재단  주관 기관:  문의   경기신용보증재단 안양지점 1577 5900  031 387 3525 내선 109  \')], [{\'url\': \'https://www.uiryeong.go.kr/board/view.uiryeong?boardId=BBS_0000070&menuCd=DOM_000000203003001001&startPage=1&dataSid=316445&gosiNo=31336\', \'content\': \'군정소식 > 공고/고시 > 공고/고시 > 공고/고시 > 글보기용 게시물 | 의령군청 의령군청 주요 누리집 의령군의회 의령군 UIRYEONG 변화의시작 더 살기좋은 의령 무인민원발급창구 안내 민원이용 안내 민원서식 작성예시 민원서식 외국어 해석본 민원제증명 수수료 면제 안내 구술·전화민원 안내 분야별 민원 안내 교통/자동차 온라인민원 신청 신고센터 부동산 불법거래 신고센터 공공데이터 소개 국민신청실명제 신청 적극행정 적극행정/소극행정 소극행정 신고센터 공공저작물 의령군 소식지 블로그 소식 공고/고시 공고/고시 행사/교육 의/약업소 안내 경제/일자리 일자리 교육/문화/체육 교육 공무원 정원 공무원 1인당 주민수 소속기관 및 읍면동 공무원 비율 전화 팩스번호 안내 의령군의회 의령군 소식지 블로그 소식 공고/고시 공고/고시 행사/교육 공고/고시 대표 군정소식 공고/고시 공고/고시 블로그 공고/고시 완료된 공고/고시 전세보증금반환보증 보증료 지원사업 안내 의령군 공고 제2024-448호 부동산 불법행위통합 신고센터 의령군 의령군의회 (52140) 경상남도 의령군 의령읍 충익로 63 대표전화 : 055-570-2114\'}, {\'url\': \'https://inzicf.com/entry/2024-의령군-전세보증금-반환보증-보증료-지원사업-안내\', \'content\': ""2024 의령군 전세보증금 반환보증 보증료 지원사업 안내 2024 의령군 전세보증금 반환보증 보증료 지원사업 안내   2024 의령군 전세보증금 반환보증 보증료 지원사업 안내 이번 글에서는 경상남도에서 제공하는 의령군 전세보증금 반환보증 보증료 지원사업에 대해 자세히 안내해드리겠습니다. 지원 대상, 지원 내용, 신청 방법 및 제출 서류에 대해 자세히 설명드리겠습니다. 신청 방법 🌟 온라인 신청 (보조금24) \'대구광역시 다자녀가정 고등학교 입학축하금 지원 신청\' 선택 신청 정보 입력 및 재학증명서 파일 첨부 제출 서류: 지원신청서, 주민등록등본, 재학증명서, 가족관계증명서(필요 시) 전세보증금 반환보증 보증서 사본 및 보증료 납부 증빙서류 신청 대상 및 조건 경상남도의 전세보증금 반환보증 보증료 지원사업은 저소득층 가정을 지원하여 전세금 미반환 피해를 예방하는 중요한 제도입니다. << 이전글 2024년 거창군 전세보증금반환보증 보증료 지원사업 안내 타보소 DRT 이용방법 및 요금 안내: 포항시 맞춤형 교통 서비스!""}]']",의령군 전세보증금 반환보증 보증료 지원사업의 주관 기관은 **의령군 소멸위기대응추진단 청년정책팀**입니다. 이 사업은 저소득층 가정을 지원하여 전세금 미반환 피해를 예방하는 중요한 제도입니다.
동두천 청년들을 위한 11월 청년 특강의 지원 내용은 무엇인가요?,"['정책 이름: 동두천 청년들을 위한  11월 청년 특강    모집', '지원 내용:  강료 무료     모집강좌 퍼스널컬러  가죽공예 카드지갑만들기  감정향 만들기  천비누 만들기  모루인형 키링만들기']","강료 무료이며, 모집 강좌로 퍼스널컬러, 가죽공예 카드지갑 만들기, 감정향 만들기, 천비누 만들기, 모루인형 키링 만들기가 있습니다.","['[Document(metadata={\'name\': \'청년 행복꾸러미 나눔\', \'source\': \'..\\\\data\\\\policy_result.json\'}, page_content=\'기관:인천 동구 정책 분야:복지.문화분야 지원 내용:청년의 날을 맞아 청년정책 수요와 한 설문조사에 한 청년을 대상으로 추첨을  행복꾸러미  사업 운영 기간:2024. 1. ~ 12. 사업 신청 기간:미정 지원 규모(명):300명 비고:사업기간   2024.1~12 연령:만 19세 ~ 39세 거주지 및 소득:  거주지   제한없음.   청년정책 수요와 한 설문조사에 한 청년 대상 주관 기관:인천광역시 동구 일자리경제과 운영 기관:인천광역시 동구 일자리경제과\'), Document(metadata={\'name\': \'청년합격 지원세트 동두천시 \', \'source\': \'..\\\\data\\\\policy_result.json\'}, page_content=\'기관:경기 동두천시 정책 분야:일자리분야 지원 내용:  신청기간   2024. 1.   12. 20. 예산 소진 시까지    지원대상   동두천시 만19세 만39세 면접준비  시험준비 청년   지원내용    면접준비 청년   면접정장 구입  면접정장 대여  이력서 사진촬영  헤어 메이크업    시험준비 청년   시험응시료  교재비 수험서    수강료 취창업  수험  강의    지원단가  지원횟수  업체  증빙서류  상세내용은 공고문을 확인해주세요.   지원 방법   자 선 지출 후 30일 이내 지역화폐로 환급   시험응시료의  계좌 지급 경기청년 역량강화 기회지원 사업과 동일  사업 신청 기간:상시 비고:예산 소진 시까지 연령:만 19세 ~ 39세 신청 절차:  신청방법   신청방법   온라인 신청 일자리지원사업 통합접수시스템    신청범위   2024. 1. 1. 부터 비용 지출 분 주관 기관:경기도 동두천시\'), Document(metadata={\'name\': \'취업준비생 레벨업 지원\', \'source\': \'..\\\\data\\\\policy_result.json\'}, page_content=\'기관:충북 정책 분야:일자리분야 지원 내용:   비대면  청년의 역량강화를 위한 인터넷 강의 외국어  자격증   직무 교육    온라인 강의  자격증 취득  서적 구입 은 1인당 100천원  팀당 600천원 사업 운영 기간:2024. 1. ~ 12. 사업 신청 기간:2024년 02월01일 ~ 2024년 12월31일 지원 규모(명):40개팀 팀원 최대 10명    청년 300여명 팀당 평균 약 7명  비고:2024.2월 연령:만 19세 ~ 39세 거주지 및 소득:도내 거주  취업준비생 취업 상태:미취업자 추가 단서 사항:없음 참여 제한 대상:없음 신청 절차:충청북도기업진흥원 공고 확인 심사 및 발표:충청북도기업진흥원 공고 확인 제출 서류:충청북도기업진흥원 공고 확인 주관 기관:충청북도 인구청년정책담당관 청년지원팀\'), Document(metadata={\'name\': \'거제시 청년도전지원사업 자 모집\', \'source\': \'..\\\\data\\\\policy_result.json\'}, page_content=\'기관:경남 거제시 정책 분야:일자리분야 지원 내용:  지원내용   도전   수당 1인 50만원 지급   도전     5주 단위로 수당 1인 50만원 지급 중기 최대 170만원  장기 최대 300만원   취업인센티브 50만원  별도 사업 운영 기간:  운영기간   거제   도전 5주    9 9~10 13   도전  중기 1주 1기   1 29~5 12   도전  장기 25주  1기   5 20~11 10 사업 신청 기간:상시 비고:사업기간 항목의  운영기간  참고 연령:만 18세 ~ 39세 거주지 및 소득:  자 조건   최근 6개월 이상 취업 교육 직업훈련  이력이 없는 18~34세 청년    자립준비청년  아동복지시설  에서 보호받고 퇴소한 자 중 퇴소 5년 이내의 청년  퇴소 대상자임에도 불구하고 퇴소일을 연장한 18~34세 청년   아동양육시설  공동생활가정  가정위탁  아동보호치료시설  자립지원시설     지역특화청년  기타 지원의 필요성이 있다고 인정받은 39세 이하 청년  지역특화 조건으로 경남도민의  39세까지 가능 방문신청  참여 제한 대상:  제한 공통    고용보험법에  구직급여 실업급여 를 수급중이거나 지급이 끝난 날로부터 6개월이 지나지 아니한 자   국민취업지원제도에 하여 수혜  자 예외 조건이 있으므로 기관에  가능 여부 확인    재학생   학점은행제  사이버대학교  대학원  방송통신고 대 학교  포함 졸업예정자  졸업생  가능  신청 절차:  신청방법   문의   경남경영자총협회 청년도전지원사업팀 T.055 266 1934   신청   워크넷 work.go.kr  고용복지정책 청년도전지원사업 운영기관 선택 경남경영자총협회     워크넷 회원가입 필수  PC로만 신청 가능   창원 외 지역의 에도 운영기관 창원 경남경영자총협회 로 신청 주관 기관:고용노동부 운영 기관:경남경영자총협회 청년도전지원사업팀\'), Document(metadata={\'name\': \'전주시 청년성장프로젝트 자 모집 힐링 베이킹 클래스 \', \'source\': \'..\\\\data\\\\policy_result.json\'}, page_content=\'기관:전북 전주시 정책 분야:복지.문화분야 지원 내용:일시   12월 매주 화 목  진행  19 00~21 00  대상   전주시 우선지원 대상 기업 재직  청년 15~39세  선착순 20명 장소 전북 전주시 덕진구 기린대로 499 5층  궁전요리제빵미용직업전문학교 본점 사업 신청 기간:2024년 11월29일 ~ 2024년 12월25일 비고: 행사일정   12월 매주 화 목  진행 19 00 ~ 21 00  참여 제한 대상:전주시 우선지원 대상 기업 재직  청년 15~39세  선착순 20명 주관 기관: 주 휴먼제이앤씨 운영 기관: 주 휴먼제이앤씨\')], [{\'url\': \'https://www.welfarehello.com/community/hometownNews/5692f5de-fbfe-4683-a603-3607b930e760\', \'content\': \'동두천시 청년들을 위한 <11월 청년 특강 프로그램> 참여자 모집 | 경기도 동두천시 | 웰로 동두천시 청년들을 위한 <11월 청년 특강 프로그램> 참여자 모집 11월 청년 특강 프로그램 동두천 어수정 청년공간(@ddc_youth_center) • Instagram 사진 및 동영상팔로워 435명, 팔로잉 23명, 게시물 421개 - 동두천 어수정 청년공간(@ddc_youth_center)님의 Instagram 사진 및 동영상 보기 www.instagram.com 퍼스널컬러, 가죽공예 카드지갑만들기, 감정향수 만들기, 천연비누 만들기, {""title"":""동두천시 청년들을 위한 <11월 청년 특강 프로그램> 참여자 모집"",""source"":""https://blog.naver.com/ddccity/223642411503"",""blogName"":""동두천시 .."",""blogId"":""ddccity"",""domainIdOrBlogId"":""ddccity"",""nicknameOrBlogId"":""행복쉼터 동두천"",""logNo"":223642411503,""smartEditorVersion"":4,""meDisplay"":true,""lineDisplay"":true,""outsideDisplay"":true,""cafeDisplay"":true,""blogDisplay"":true} #### ‘내 일(My job)이 있는 청춘’, 함평군 청년특강 신청 안내 24.11.12(화) 작성 N잡러!” 24.11.11(월) 작성 #### [청년퓰리처기자] 남구 청년 테마 특강 - 프레디저 카드로 찾는 나만의 커리어 24.10.29(화) 작성 #### 동두천시 청년들을 위한 <10월 청년 특강 프로그램> 참여자 모집 24.09.26(목) 작성 청년의 날 #김경일교수 #존박 #성남시청 #20240927 24.09.23(월) 작성 #### 2024 창원청년주간 행사 안내 24.09.09(월) 작성\'}, {\'url\': \'https://m.blog.naver.com/PostView.naver?blogId=ddccity&logNo=223642411503\', \'content\': \'동두천시 청년들을 위한 <11월 청년 특강 프로그램> 참여자 모집 : 네이버 블로그 본문 바로가기 블로그 카테고리 이동 동두천시 공식 블로그 동두천시 청년들을 위한 <11월 청년 특강 프로그램> 참여자 모집 행복쉼터 동두천 공식블로그 이웃추가 본문 기타 기능 본문 폰트 크기 조정 본문 폰트 크기 작게 보기 본문 폰트 크기 크게 보기 가 동두천시에서 19세 ~ 39세 청년들을 위한 11월 청년 특강 프로그램 동두천 어수정 청년공간(@ddc_youth_center) • Instagram 사진 및 동영상팔로워 435명, 팔로잉 23명, 게시물 421개 - 동두천 어수정 청년공간(@ddc_youth_center)님의 Instagram 사진 및 동영상 보기 www.instagram.com 퍼스널컬러, 가죽공예 카드지갑만들기, 감정향수 만들기, 천연비누 만들기, 동두천시 청소년수련관 포스터 QR코드 접속 및 #동두천 #동두천시 #퍼스널컬러 #가죽공예 #감정향수 #천연비누 {""title"":""동두천시 청년들을 위한 <11월 청년 특강 프로그램> 참여자 모집"",""source"":""https://blog.naver.com/ddccity/223642411503"",""blogName"":""동두천시 .."",""domainIdOrBlogId"":""ddccity"",""nicknameOrBlogId"":""행복쉼터 동두천"",""logNo"":223642411503,""smartEditorVersion"":4,""meDisplay"":true,""lineDisplay"":true,""outsideDisplay"":true,""cafeDisplay"":true,""blogDisplay"":true} 행복쉼터 동두천(ddccity) 님을 이웃추가하고 새글을 받아보세요 취소 이웃추가\'}]']","동두천시에서 진행하는 11월 청년 특강 프로그램은 19세에서 39세의 청년들을 대상으로 하고 있습니다. 이 프로그램은 다양한 주제로 진행되며, 예를 들면 퍼스널컬러, 가죽공예 카드지갑 만들기, 감정향수 만들기, 천연비누 만들기 등의 내용이 포함되어 있습니다. 참여자는 각 강좌에 따라 선착순으로 모집되며, 자세한 내용은 동두천시 공식 블로그나 관련 기관의 안내를 통해 확인할 수 있습니다. 

혹시 다른 정보가 필요하시면 말씀해 주세요!"
동두천 청년들을 위한 11월 청년 특강의 신청 절차는 어떻게 되나요?,"['정책 이름: 동두천 청년들을 위한  11월 청년 특강    모집', '신청 절차:포스터 QR코드 접속  인스타 ddc youth center']",포스터 QR코드 접속 또는 인스타그램 ddc youth center를 통해 신청할 수 있습니다.,"['[Document(metadata={\'name\': \'청년합격 지원세트 동두천시 \', \'source\': \'..\\\\data\\\\policy_result.json\'}, page_content=\'기관:경기 동두천시 정책 분야:일자리분야 지원 내용:  신청기간   2024. 1.   12. 20. 예산 소진 시까지    지원대상   동두천시 만19세 만39세 면접준비  시험준비 청년   지원내용    면접준비 청년   면접정장 구입  면접정장 대여  이력서 사진촬영  헤어 메이크업    시험준비 청년   시험응시료  교재비 수험서    수강료 취창업  수험  강의    지원단가  지원횟수  업체  증빙서류  상세내용은 공고문을 확인해주세요.   지원 방법   자 선 지출 후 30일 이내 지역화폐로 환급   시험응시료의  계좌 지급 경기청년 역량강화 기회지원 사업과 동일  사업 신청 기간:상시 비고:예산 소진 시까지 연령:만 19세 ~ 39세 신청 절차:  신청방법   신청방법   온라인 신청 일자리지원사업 통합접수시스템    신청범위   2024. 1. 1. 부터 비용 지출 분 주관 기관:경기도 동두천시\'), Document(metadata={\'name\': \'청년 소상공인을 위한 고민상담소\', \'source\': \'..\\\\data\\\\policy_result.json\'}, page_content=\'기관:서울 중구 정책 분야:교육분야 지원 내용:청년 소상공인을 위한 심리교육 사업 신청 기간:2024년 06월21일 ~ 2024년 12월31일 비고:  모집기간  2024.6.21. 금  ~ 상시모집 연령:만 19세 ~ 34세 거주지 및 소득:19세이상 34세이하 청년사장님 사업자록증 확인  취업 상태:청년 소상공인 신청 절차:  신청방법   서울심리지원 제4권역 중부 센터 홈페이지  포스터 QR 신청   첨부파일 필수 확인 주관 기관:서울시 중구청 운영 기관:행복잇다 사회적협동조합\'), Document(metadata={\'name\': \'취업준비생 레벨업 지원\', \'source\': \'..\\\\data\\\\policy_result.json\'}, page_content=\'기관:충북 정책 분야:일자리분야 지원 내용:   비대면  청년의 역량강화를 위한 인터넷 강의 외국어  자격증   직무 교육    온라인 강의  자격증 취득  서적 구입 은 1인당 100천원  팀당 600천원 사업 운영 기간:2024. 1. ~ 12. 사업 신청 기간:2024년 02월01일 ~ 2024년 12월31일 지원 규모(명):40개팀 팀원 최대 10명    청년 300여명 팀당 평균 약 7명  비고:2024.2월 연령:만 19세 ~ 39세 거주지 및 소득:도내 거주  취업준비생 취업 상태:미취업자 추가 단서 사항:없음 참여 제한 대상:없음 신청 절차:충청북도기업진흥원 공고 확인 심사 및 발표:충청북도기업진흥원 공고 확인 제출 서류:충청북도기업진흥원 공고 확인 주관 기관:충청북도 인구청년정책담당관 청년지원팀\'), Document(metadata={\'name\': \'충남 청년 뮤직 페스타\', \'source\': \'..\\\\data\\\\policy_result.json\'}, page_content=\'기관:충남 정책 분야:복지.문화분야 지원 내용:  청년예술인 공연기회  사업 신청 기간:2024년 07월01일 ~ 2024년 12월31일  예정  지원 규모(명):  청년예술인 10팀 이상 비고:  2024 07 01~2025 12 31 연령:만 19세 ~ 39세 거주지 및 소득:  버스킹이 가능한 충남의 청년 뮤지션  소규모 청년단체 5인 이하  신청 절차:  민간보조사업자 선정 후 현행화 예정 제출 서류:  충남 청년 뮤직 페스타 기타 유익 정보:  민간보조사업자 선정 후 현행화 예정 주관 기관:  충청남도 문화정책과 운영 기관:  민간보조사업자 선정 후 현행화 예정\'), Document(metadata={\'name\': \'청년축제 강북구 \', \'source\': \'..\\\\data\\\\policy_result.json\'}, page_content=\'기관:서울 강북구 정책 분야:.권리분야 지원 내용:  청년의 날 청년주간 을 맞이하여 청년이 소통하고 즐길 수 있는  운영   청년사업 홍보부스  포토존  플리마켓 운영   지역 내 청년단체  대학교   운영   청년 힐링   지역 청년예술인 기반 문화공연  사업 신청 기간:미정 비고:청년의 날   매년 9월 세 번째 토요일 연령:만 19세 ~ 39세 거주지 및 소득:19~39세 강북구 거주  활동 청년 기타 유익 정보:강북구청 일자리청년과 02 901 2642 주관 기관:강북구청 일자리청년과 운영 기관:주관기관\')], [{\'url\': \'https://www.welfarehello.com/community/hometownNews/5692f5de-fbfe-4683-a603-3607b930e760\', \'content\': \'동두천시 청년들을 위한 <11월 청년 특강 프로그램> 참여자 모집 | 경기도 동두천시 | 웰로 동두천시 청년들을 위한 <11월 청년 특강 프로그램> 참여자 모집 11월 청년 특강 프로그램 동두천 어수정 청년공간(@ddc_youth_center) • Instagram 사진 및 동영상팔로워 435명, 팔로잉 23명, 게시물 421개 - 동두천 어수정 청년공간(@ddc_youth_center)님의 Instagram 사진 및 동영상 보기 www.instagram.com 퍼스널컬러, 가죽공예 카드지갑만들기, 감정향수 만들기, 천연비누 만들기, {""title"":""동두천시 청년들을 위한 <11월 청년 특강 프로그램> 참여자 모집"",""source"":""https://blog.naver.com/ddccity/223642411503"",""blogName"":""동두천시 .."",""blogId"":""ddccity"",""domainIdOrBlogId"":""ddccity"",""nicknameOrBlogId"":""행복쉼터 동두천"",""logNo"":223642411503,""smartEditorVersion"":4,""meDisplay"":true,""lineDisplay"":true,""outsideDisplay"":true,""cafeDisplay"":true,""blogDisplay"":true} #### ‘내 일(My job)이 있는 청춘’, 함평군 청년특강 신청 안내 24.11.12(화) 작성 N잡러!” 24.11.11(월) 작성 #### [청년퓰리처기자] 남구 청년 테마 특강 - 프레디저 카드로 찾는 나만의 커리어 24.10.29(화) 작성 #### 동두천시 청년들을 위한 <10월 청년 특강 프로그램> 참여자 모집 24.09.26(목) 작성 청년의 날 #김경일교수 #존박 #성남시청 #20240927 24.09.23(월) 작성 #### 2024 창원청년주간 행사 안내 24.09.09(월) 작성\'}, {\'url\': \'https://www.instagram.com/p/DBikdceTWb7/\', \'content\': \'4 likes, 0 comments - ddc_youth_center on October 25, 2024: ""[청년특강 11월 프로그램 모집] 막바지에 접어드는 인기 만점 프로그램들만 모아서 준비했습니다! 중간에 식사는 제공되지 않으니 미리 식사 챙겨드시고 오세요殺 1. 동두천시 거주 청년 선착순 모집 (만 19세-만 39세 가능) 2. 교육비: 전액 무료, 중복 선택\'}]']","동두천시에서 제공하는 **11월 청년 특강 프로그램**에 대한 신청 절차는 다음과 같습니다:

1. **대상**: 동두천시에 거주하는 만 19세에서 만 39세까지의 청년.
2. **신청 방법**: 선착순 모집으로 진행되며, 참여를 원하는 청년들은 사전에 신청을 해야 합니다.
3. **교육비**: 전액 무료입니다.
4. **신청 절차**: 자세한 신청 방법은 동두천 청년센터의 공식 홈페이지나 관련 공지사항을 통해 확인할 수 있습니다.

추가적인 정보나 변경 사항은 동두천청년센터나 해당 프로그램의 공고문을 통해 확인하는 것이 좋습니다."
동두천 청년들을 위한 11월 청년 특강의 운영 장소는 어디인가요?,"['정책 이름: 동두천 청년들을 위한  11월 청년 특강    모집', '운영장소 동두천 청소년련관 3층 분임토의실']",운영 장소는 동두천 청소년련관 3층 분임토의실입니다.,"['[Document(metadata={\'name\': \'청년축제 강북구 \', \'source\': \'..\\\\data\\\\policy_result.json\'}, page_content=\'기관:서울 강북구 정책 분야:.권리분야 지원 내용:  청년의 날 청년주간 을 맞이하여 청년이 소통하고 즐길 수 있는  운영   청년사업 홍보부스  포토존  플리마켓 운영   지역 내 청년단체  대학교   운영   청년 힐링   지역 청년예술인 기반 문화공연  사업 신청 기간:미정 비고:청년의 날   매년 9월 세 번째 토요일 연령:만 19세 ~ 39세 거주지 및 소득:19~39세 강북구 거주  활동 청년 기타 유익 정보:강북구청 일자리청년과 02 901 2642 주관 기관:강북구청 일자리청년과 운영 기관:주관기관\'), Document(metadata={\'name\': \'공공기관 실무형 청년인턴십 운영\', \'source\': \'..\\\\data\\\\policy_result.json\'}, page_content=\'기관:서울 도봉구 정책 분야:일자리분야 지원 내용:공공기관 실무형 청년인턴 배치  운영 9개월  사업 신청 기간:상시 연령:만 19세 ~ 45세 주관 기관:도봉구 청년미래과 운영 기관:주관기관 동일기관\'), Document(metadata={\'name\': \'동안청소년수련관 후기청소년 사업  청춘을 잡아라  안양시 \', \'source\': \'..\\\\data\\\\policy_result.json\'}, page_content=\'기관:경기 안양시 정책 분야:복지.문화분야 지원 내용:  운영기간   2024. 6월 ~ 9월   활동장소   동안청소년수련관  태안 신두리  야외활동장    활동내용    사전활동 2회    참가 청소년 관계 형성  청년마을 벤치마킹  캠프기획    갓 캠프 2박 3일  1회    청년마을 멘토 연계 네트워크 힐링 캠프 운영   청춘 갓 러 1회    안양 청년마을 ART3 연계  후기 청소년 네트워크 형성   참가비 무료   모아폼 QR\\xa0 코드 태그 후 신청 GO  사업 신청 기간:상시 지원 규모(명):  모집인원  10명 선착순 모집  비고:  모집기간   24.6.7 ~ 상시모집 연령:만 20세 ~ 24세 거주지 및 소득:  참가 청소년   20세~24세 후기 청소년 20명   안양 거주  관내 대학교 재학  후기 청소년 우선 모집   청년마을 멘토   태안 청년마을  오락발전소  청년멘토 5인  안양 청년마을 ART3 청년멘토 2인 주관 기관:  동안청소년수련관    031 8045 4900~4901 \'), Document(metadata={\'name\': \'울산 청년크루 페스티벌\', \'source\': \'..\\\\data\\\\policy_result.json\'}, page_content=\'기관:울산 정책 분야:복지.문화분야 지원 내용:  기간    24. 9. 중   매년 9월 세 번째 토요일   청년의 날 법정기념일    장소   태화강체육공원    인원   3 000여명 청년크루 50개 팀  울산시민     주요내용   개막식  축하공연  버스킹 플리마켓 테마존 운영  사업 신청 기간:미정 연령:만 19세 ~ 39세 주관 기관:울산광역시 문화예술과 문예총괄팀 052 229 3723  운영 기관:주관기관과 동일\'), Document(metadata={\'name\': \'청년합격 지원세트 동두천시 \', \'source\': \'..\\\\data\\\\policy_result.json\'}, page_content=\'기관:경기 동두천시 정책 분야:일자리분야 지원 내용:  신청기간   2024. 1.   12. 20. 예산 소진 시까지    지원대상   동두천시 만19세 만39세 면접준비  시험준비 청년   지원내용    면접준비 청년   면접정장 구입  면접정장 대여  이력서 사진촬영  헤어 메이크업    시험준비 청년   시험응시료  교재비 수험서    수강료 취창업  수험  강의    지원단가  지원횟수  업체  증빙서류  상세내용은 공고문을 확인해주세요.   지원 방법   자 선 지출 후 30일 이내 지역화폐로 환급   시험응시료의  계좌 지급 경기청년 역량강화 기회지원 사업과 동일  사업 신청 기간:상시 비고:예산 소진 시까지 연령:만 19세 ~ 39세 신청 절차:  신청방법   신청방법   온라인 신청 일자리지원사업 통합접수시스템    신청범위   2024. 1. 1. 부터 비용 지출 분 주관 기관:경기도 동두천시\')], [{\'url\': \'https://www.welfarehello.com/community/hometownNews/5692f5de-fbfe-4683-a603-3607b930e760\', \'content\': \'동두천시 청년들을 위한 <11월 청년 특강 프로그램> 참여자 모집 | 경기도 동두천시 | 웰로 동두천시 청년들을 위한 <11월 청년 특강 프로그램> 참여자 모집 11월 청년 특강 프로그램 동두천 어수정 청년공간(@ddc_youth_center) • Instagram 사진 및 동영상팔로워 435명, 팔로잉 23명, 게시물 421개 - 동두천 어수정 청년공간(@ddc_youth_center)님의 Instagram 사진 및 동영상 보기 www.instagram.com 퍼스널컬러, 가죽공예 카드지갑만들기, 감정향수 만들기, 천연비누 만들기, {""title"":""동두천시 청년들을 위한 <11월 청년 특강 프로그램> 참여자 모집"",""source"":""https://blog.naver.com/ddccity/223642411503"",""blogName"":""동두천시 .."",""blogId"":""ddccity"",""domainIdOrBlogId"":""ddccity"",""nicknameOrBlogId"":""행복쉼터 동두천"",""logNo"":223642411503,""smartEditorVersion"":4,""meDisplay"":true,""lineDisplay"":true,""outsideDisplay"":true,""cafeDisplay"":true,""blogDisplay"":true} #### ‘내 일(My job)이 있는 청춘’, 함평군 청년특강 신청 안내 24.11.12(화) 작성 N잡러!” 24.11.11(월) 작성 #### [청년퓰리처기자] 남구 청년 테마 특강 - 프레디저 카드로 찾는 나만의 커리어 24.10.29(화) 작성 #### 동두천시 청년들을 위한 <10월 청년 특강 프로그램> 참여자 모집 24.09.26(목) 작성 청년의 날 #김경일교수 #존박 #성남시청 #20240927 24.09.23(월) 작성 #### 2024 창원청년주간 행사 안내 24.09.09(월) 작성\'}, {\'url\': \'https://m.blog.naver.com/PostView.naver?blogId=ddccity&logNo=223642411503\', \'content\': \'동두천시 청년들을 위한 <11월 청년 특강 프로그램> 참여자 모집 : 네이버 블로그 본문 바로가기 블로그 카테고리 이동 동두천시 공식 블로그 동두천시 청년들을 위한 <11월 청년 특강 프로그램> 참여자 모집 행복쉼터 동두천 공식블로그 이웃추가 본문 기타 기능 본문 폰트 크기 조정 본문 폰트 크기 작게 보기 본문 폰트 크기 크게 보기 가 동두천시에서 19세 ~ 39세 청년들을 위한 11월 청년 특강 프로그램 동두천 어수정 청년공간(@ddc_youth_center) • Instagram 사진 및 동영상팔로워 435명, 팔로잉 23명, 게시물 421개 - 동두천 어수정 청년공간(@ddc_youth_center)님의 Instagram 사진 및 동영상 보기 www.instagram.com 퍼스널컬러, 가죽공예 카드지갑만들기, 감정향수 만들기, 천연비누 만들기, 동두천시 청소년수련관 포스터 QR코드 접속 및 #동두천 #동두천시 #퍼스널컬러 #가죽공예 #감정향수 #천연비누 {""title"":""동두천시 청년들을 위한 <11월 청년 특강 프로그램> 참여자 모집"",""source"":""https://blog.naver.com/ddccity/223642411503"",""blogName"":""동두천시 .."",""domainIdOrBlogId"":""ddccity"",""nicknameOrBlogId"":""행복쉼터 동두천"",""logNo"":223642411503,""smartEditorVersion"":4,""meDisplay"":true,""lineDisplay"":true,""outsideDisplay"":true,""cafeDisplay"":true,""blogDisplay"":true} 행복쉼터 동두천(ddccity) 님을 이웃추가하고 새글을 받아보세요 취소 이웃추가\'}]']","동두천시 청년들을 위한 11월 청년 특강 프로그램은 동두천 어수정 청년공간에서 운영됩니다. 이 프로그램은 퍼스널컬러, 가죽공예 카드지갑 만들기, 감정향수 만들기, 천연비누 만들기 등의 다양한 활동을 포함하고 있으며, 19세에서 39세의 청년들을 대상으로 합니다. 참여를 원하시는 분들은 동두천시 청소년수련관의 포스터에 있는 QR코드를 통해 신청할 수 있습니다."
하동군 청년 여가활동비 지원사업의 최대 지원액은 얼마인가요?,"['정책 이름: 하동군 청년 여가활동비 지원사업', '지원 내용: 지원내용 도서 격증 어학 문화 예술 2024년 지출한 여가활동비 지원 1인당 간 최대 지원액 20만원 실제 지출금액의 80 지원 기 과목에 금액이 달라질 있으므로 지원하는 금액은 인이실제로 지출한 실비로 산정 금액이 지원 상한액 20만원 초과 초과금액 미지급']",1인당 최대 지원액은 20만원입니다.,"[""[Document(metadata={'name': '청도군 청년창업 지역정착 지원사업', 'source': '..\\\\data\\\\policy_result.json'}, page_content='기관:경북 청도군 정책 분야:일자리분야 지원 내용:  사업대상   만 39세 이하 전국 청년 개인  팀 최대 2명  구성을 통한 신청 가능   지원내용   청년 1인당 사업화자금  활동비 20백만원 최대 2년간 지원    1년차 사업의 효과를 평가하여 2년차 지원 대상에서 제외할 수 있음    사업내용   지역자원과 특산품 을 활용한 관광상품  기념품 개발 판매 미술  음악  사진  청년문화예술 창작활동 지원 전시 체험공간  청년카페  음식점  게스트하우스  운영 사업 운영 기간:2024 01 01~2024 12 31 사업 신청 기간:미정 지원 규모(명):  사업비   50백만원   지원규모   2명 비고:미정 주관 기관:청도군청 운영 기관:경상북도 경제진흥원'), Document(metadata={'name': '청년월세 한시 특별지원 2차 사업 칠곡군 ', 'source': '..\\\\data\\\\policy_result.json'}, page_content='기관:경북 칠곡군 정책 분야:주거분야 지원 내용:  지원한도   실제 납부하는 임대료를 최대 240만원 월 최대 20만원 까지 최대 12개월 회  동안 매월 분할 지원 사업 운영 기간:2022 08 22~2026 12 31 사업 신청 기간:2024년 02월26일 ~ 2025년 02월25일 지원 규모(명):약 370여명 비고:2024 02 26~2025 02 25 연령:만 19세 ~ 34세 거주지 및 소득:  대상자    청년기본법 상 청년 만 19~34세 이하 으로 부모님과 별도 거주하는 무주택자 추가 단서 사항:  지원자격   청년가구 소득 기준 중위소득 60% 이하  원가구 소득 기준 중위소득 100% 이하 신청 절차:  신청방법   방문 신청   주소지 관할 읍면사무소   온라인 신청   복지로 홈페이지 www.bokjiro.go.kr  심사 및 발표:개별연락 주관 기관:국토교통부 운영 기관:칠곡군청 일자리경제과 청년취업팀 '), Document(metadata={'name': '청년 베이스캠프 위기 청년지원  대구 ', 'source': '..\\\\data\\\\policy_result.json'}, page_content='기관:대구 정책 분야:복지.문화분야 지원 내용:   지원금액     1인 최대 200만원 지원  판정회의를  급박한 위기상황 청년 선발 지원  복지 수혜를 받지 못하는 청년을 대상으로 지원하는 사업입니다. 도움이 절실한 청년은 053 710 3350으로 연락주시고  주위에 힘든 친구나 이웃이 있다면 관심을 가지고 정보 공유해주세요. 사업 신청 기간:미정 비고:  신청기간   신청기간    24.2.26. ~  25.2..25. 매월 15일  예산소진시 까지  연령:만 19세 ~ 39세 거주지 및 소득:  지원대상   가족 돌봄 간병  간호 으로 삶의 선택지를 잃어버린 청년   월세가 밀려 거주하는 집에서 내몰릴 위기 청년 공과금  월세 4개월 이상 체납 대상    가족의 학대로 집을 나와 생활고를 겪는 청년 추가 단서 사항:  지원자격   청년가구 소득 기준 중위소득 60% 이하  원가구 소득 기준 중위소득 100% 이하 참여 제한 대상: 부채  개인보험  임대료  저축  지원 불가 신청 절차:  지원절차   매월 15일 접수 마감  판정회의  선정발표    추가 요청 서류제출   매월 30일~익월 5일  지원금 지급   신청방법 신청서 메일접수 wsws1004 hanmail.net 메일 제목에 신복지  성명 이00 신청서 제출이라고 꼭 기재해주세요 주관 기관:대구광역시 운영 기관:월성종합사회복지관'), Document(metadata={'name': '하동군 청년 여가활동비 지원사업', 'source': '..\\\\data\\\\policy_result.json'}, page_content='기관:경남 하동군 정책 분야:복지.문화분야 지원 내용:  지원내용   도서  자격증  어학  문화  예술  2024년 지출한 여가활동비 지원  1인당 연간 최대 지원액 20만원  실제 지출금액의 80%지원   신청 시기  과목에  금액이 달라질 수 있으므로  지원하는 금액은 신청인이실제로 지출한 실비로 산정  신청금액이 지원 상한액 20만원  초과시  초과금액 미지급    지급시기   선정발표 다음 월 첫째 주 개인별 지급예정 사업 신청 기간:2024년 02월19일 ~ 2024년 12월31일 비고:2024년 상시 접수    예산소진 시 조기 종료될 수 있음 연령:만 19세 ~ 45세 거주지 및 소득:신청일 기준 하동군에 주민록 된 청년 만 19세 ~ 만 45세  신청 절차:제출서류 작성 후 읍 면 사무소 제출  증빙서류는 신청월 발급본만 인정  스캔본  pdf 출력본 제출을 원칙으로 하며  사진일  선명하게 찍어 제출 심사 및 발표:  선정방법   증빙서류 검토 후 자격요건 충족 시 선정 가. 확인내용  연령  거주지  지원부문 포함 여부  유사 정책 수혜자 여부   나. 지원 제외 대상  문화체육관광부  문화누리카드 사업  유사정책 수혜자  다. 예산 범위 내에서 선착순 선정    선정발표   매분기 마지막월 마지막 주 개별 연락 제출 서류:공고문 참고 주관 기관:하동군청 운영 기관:주관기관과 동일'), Document(metadata={'name': '울산 동구 청소년부모 아동양육비 지원', 'source': '..\\\\data\\\\policy_result.json'}, page_content='기관:울산 동구 정책 분야:복지.문화분야 지원 내용:  추진배경   자녀양육과 협업 취업을 병행하고 있는 24세 이하 청소년부모와 그 자녀의 생활안정을 위해 아동양육비 지원   지원내용   청소년부모 아동양육비 지원 자녀 1인당 25만원  사업 운영 기간:  사업기간    24. 1. ~ 12. 사업 신청 기간:상시 거주지 및 소득:  사업대상   기준 중위소득 63% 이하  부 모 나이가 모두 24세 이하인 청소년부모 주관 기관:울산광역시 동구 가족정책과 여성청소년팀 052 209 3913  운영 기관:주관기관과 동일')], [{'url': 'http://www.koreaeaglenews.com/news/articleView.html?idxno=63771', 'content': '하동군, 청년 여가활동비 지원…연간 최대 20만 원 지원 < 경남 < 지방 < 기사본문 - 코리아이글뉴스 주요서비스 바로가기 본문 바로가기 매체정보 바로가기 로그인 바로가기 기사검색 바로가기 전체서비스 바로가기 인물/포토 하동군, 청년 여가활동비 지원…연간 최대 20만 원 지원 하동군, 청년 여가활동비 지원…연간 최대 20만 원 지원 하동군(군수 하승철)은 청년정책 ‘청년이 원하는 대로’의 일환으로 하동군 거주 청년의 자기계발 및 역량강화 기회를 제공하고 청년들의 여가생활 만족도를 높이기 위해 ‘2024년 청년 여가활동비 지원사업’을 추진한다고 22일 밝혔다. 청년 여가활동비 지원사업은 지난해 시행된 청년 역량강화사업의 지원대상(자격증 시험응시료, 도서 구입비)에 학원비와 문화·여가 생활비까지 추가로 지원하고 1인당 연간 최대 20만 원, 실 지출액의 80%까지 지원한다. 지원 내용은 자기계발 부문의 △어학 및 자격증 시험응시료 △도서구입비 △취업·자격증 취득을 위한 온·오프라인 학원비와 문화·여가생활 부문의 △문화 및 예술활동비 △관광활동비 △체육활동비 등이다. 인물/포토'}, {'url': 'http://www.hadongnews.co.kr/news/articleView.html?idxno=12750', 'content': '하동뉴스 군, 2024년 청년 여가활동비 지원사업 추진한다 군, 2024년 청년 여가활동비 지원사업 추진한다 하동뉴스 하동군은 22일 보도자료를\\xa0통해 ‘2024년 청년 여가활동비 지원사업’을 추진한다고 이같이 밝혔다. 군내 거주 청년의 자기계발 및 역량강화 기회 제공을 위하고 청년들의 여가생활 만족도를 높이기 위한 이 사업은 지난해 시행된 청년 역량강화사업의 지원대상(자격증 시험응시료, 도서 구입비)에 학원비와 문화·여가 생활비까지 추가 지원하고 1인당 연간 최대 20만 원을 지원한다. 지원 내용으로 자기계발 부문은 △어학 및 자격증 시험응시료 △도서구입비 △취업·자격증 취득을 위한 온·오프라인 학원비를, 문화·여가생활 부문은 △문화 및 예술활동비 △관광활동비 △체육활동비 등이다. 군 관계자는 “이번 사업이 하동군의 부족한 문화·여가·교육 기반 시설을 보완하고 청년들의 문화 및 여가생활 만족도를 향상할 것으로 기대한다”고 말했다. 저작권자 © 하동뉴스 무단전재 및 재배포 금지 이름  비밀번호  명칭 : (주)하동뉴스 제호 : 하동뉴스 Copyright © 2024 하동뉴스.'}]""]","하동군 청년 여가활동비 지원사업의 최대 지원액은 1인당 연간 20만원입니다. 지원 내용은 실제 지출액의 80%까지 지원되며, 지원 가능한 항목으로는 어학 및 자격증 시험응시료, 도서 구입비, 문화 및 여가 활동비 등이 포함됩니다."
하동군 청년 여가활동비 지원사업의 신청 기간은 언제부터 언제까지인가요?,"['정책 이름: 하동군 청년 여가활동비 지원사업', '사업 신청 기간: 2024년 02월19일 2024년 12월31일']",2024년 02월 19일부터 2024년 12월 31일까지입니다.,"['[Document(metadata={\'name\': \'청년축제 강북구 \', \'source\': \'..\\\\data\\\\policy_result.json\'}, page_content=\'기관:서울 강북구 정책 분야:.권리분야 지원 내용:  청년의 날 청년주간 을 맞이하여 청년이 소통하고 즐길 수 있는  운영   청년사업 홍보부스  포토존  플리마켓 운영   지역 내 청년단체  대학교   운영   청년 힐링   지역 청년예술인 기반 문화공연  사업 신청 기간:미정 비고:청년의 날   매년 9월 세 번째 토요일 연령:만 19세 ~ 39세 거주지 및 소득:19~39세 강북구 거주  활동 청년 기타 유익 정보:강북구청 일자리청년과 02 901 2642 주관 기관:강북구청 일자리청년과 운영 기관:주관기관\'), Document(metadata={\'name\': \'청년합격 지원세트 동두천시 \', \'source\': \'..\\\\data\\\\policy_result.json\'}, page_content=\'기관:경기 동두천시 정책 분야:일자리분야 지원 내용:  신청기간   2024. 1.   12. 20. 예산 소진 시까지    지원대상   동두천시 만19세 만39세 면접준비  시험준비 청년   지원내용    면접준비 청년   면접정장 구입  면접정장 대여  이력서 사진촬영  헤어 메이크업    시험준비 청년   시험응시료  교재비 수험서    수강료 취창업  수험  강의    지원단가  지원횟수  업체  증빙서류  상세내용은 공고문을 확인해주세요.   지원 방법   자 선 지출 후 30일 이내 지역화폐로 환급   시험응시료의  계좌 지급 경기청년 역량강화 기회지원 사업과 동일  사업 신청 기간:상시 비고:예산 소진 시까지 연령:만 19세 ~ 39세 신청 절차:  신청방법   신청방법   온라인 신청 일자리지원사업 통합접수시스템    신청범위   2024. 1. 1. 부터 비용 지출 분 주관 기관:경기도 동두천시\'), Document(metadata={\'name\': \'동구 청년복합공간 운영\', \'source\': \'..\\\\data\\\\policy_result.json\'}, page_content=\'기관:인천 동구 정책 분야:.권리분야 지원 내용:청년활동 공간  문화 예술 교육    취 창업 준비 지원  운영  진로 상담 컨설팅 사업 운영 기간:2022.1. ~ 계속 사업 신청 기간:미정 비고:사업기간   2022.1~계속 연령:만 16세 ~ 39세 거주지 및 소득:  대상   인천시 거주 16세~39세 청년 주관 기관:인천광역시 동구 일자리경제과 운영 기관:인천광역시 동구 일자리경제과\'), Document(metadata={\'name\': \'창업공간지원 누구나가게 운영지원사업\', \'source\': \'..\\\\data\\\\policy_result.json\'}, page_content=\'기관:충남 청양군 정책 분야:일자리분야 지원 내용:  미창업 청년에게 6개월간 창업도전지원 사업 운영 기간:  2024 01 01~2024 12 31 사업 신청 기간:상시 지원 규모(명):  4개소 비고:  상시 연령:만 18세 ~ 45세 거주지 및 소득:  청양군에 주소를 두거나 입점계약전 주소를 둔자 취업 상태:  미창업자 특화 분야:  계속 주관 기관:  청양군 운영 기관:  청양군 미래전략과\'), Document(metadata={\'name\': \'보호종료아동 자립수당 지급\', \'source\': \'..\\\\data\\\\policy_result.json\'}, page_content=\'기관:대구 정책 분야:복지.문화분야 지원 내용:매월 50만원 현금지원 최대 5년  사업 신청 기간:미정 지원 규모(명):432명 정도 비고:2024. 1월 ~ 12월 연령:만 18세 ~ 29세 거주지 및 소득:  대상 아래 자격에 되는 자   만18~29세 보호종료 5년 이내 아동 중  보호종료일 기준  과거 2년 이상 연속하여 아동복지시설  가정위탁 보호를 받은 자   만18세 이후 만기  연장 보호 종료된 자  단   18.8월 이후 보호종료된 자    만 15세 이후 보호조치가 조기 종료된 자로서 만18세가 된 때로부터 5년 이내인 자 단  아동복지법 시행  24.2.9. 이후 만 18세가 된 자부터 적용  신청 절차:  읍면동 행정복지센터 방문   우편  팩스  온라인 복지로 신청 주관 기관:2024. 1월 ~ 12월 운영 기관:읍면동 행정복지센터\')], [{\'url\': \'https://kamsworld.tistory.com/565304\', \'content\': \'하동군 관내 청년들 여가 활동비 지원 신청 방법 :: 이코노미 뉴스 메뉴 검색 컨텐츠 검색  하동군 관내 청년들 여가 활동비 지원 신청 방법 신청 기간은 10월 4일까지이며, 다양한 자기 계발 및 문화·여가생활 부문에서 지원을 받을 수 있습니다. 신청 대상 및 조건 자기 계발 부문에서는 어학 및 자격증 시험응시료, 도서 구입비, 취업·자격증 취득을 위한 온오프라인 학원비를 지원받으실 수 있습니다. 문화·여가생활 부문에서는 문화 및 예술활동비, 관광활동비, 체육활동비 등을 지원받으실 수 있습니다. 신청 방법 및 유의사항 신청을 희망하시는 분들은 하동군청 홈페이지 공고문에 기재된 구비서류를 갖추어 주소지 읍·면사무소 또는 하동군청 지역활력추진단 청년정책 부서를 방문하시거나, 메일로 신청하실 수 있습니다. 하동군은 지난해 청년정책 전담 부서를 신설하여 여가 활동비 지원과 더불어 주거비 지원, 렌터카 지원 등 청년들의 안정적인 정착을 위한 다양한 정책을 추진해 오고 있습니다. 댓글 0댓글 접기 댓글 펼치기 이전 댓글 더보기 ADMIN admin 글쓰기\'}, {\'url\': \'https://m.joongdo.co.kr/view.php?key=20240924010006305\', \'content\': ""중도일보 - 하동군, 청년 여가비 지원사업 2차 대상자 모집 하동군, 청년 여가비 지원사업 2차 대상자 모집 하동군이 청년들의 문화생활과 자기 계발을 지원하기 위해 \'2024년 청년 여가비 지원사업\' 2차 대상자를 모집한다. 모집 기간은 10월 4일까지로, 하동군에 주소를 둔 19세에서 45세 이하의 청년들이 신청 가능하다. 지원 항목은 자기 계발과 문화·여가생활 두 부문으로 나뉜다. 군 관계자는 이번 사업이 지역 청년들의 경제적 부담을 완화하고, 다양한 자기 계발과 문화 활동을 경험할 수 있는 기회가 될 것이라고 기대하고 있다. 하동군은 청년들의 안정적 정착을 위해 여가비 지원 외에도 주거비 및 렌터카 지원 등의 다양한 정책을 지속적으로 추진 중이다. 중도일보(www.joongdo.co.kr), 무단전재 및 수집, 재배포 금지 대전시 청년부부 결혼장려금, 26일부터 지급 대전시 내년부터 참전유공자 명예수당 20만원 지급 2024년 하반기 대전 청년월세 본격 지급 대전광역시 중구 계룡로 832 (우) 34908 전화 : 042-220-1114""}]']","하동군 청년 여가활동비 지원사업의 신청 기간은 2024년 10월 4일까지입니다. 이 지원사업은 청년들의 문화생활과 자기 계발을 지원하기 위해 마련된 것으로, 19세에서 45세 이하의 하동군에 주소를 둔 청년들이 신청할 수 있습니다."
하동군 청년 여가활동비 지원사업의 지원 대상 연령은 어떻게 되나요?,"['정책 이름: 하동군 청년 여가활동비 지원사업', '연령: 만 19세 45세']",만 19세부터 만 45세까지입니다.,"['[Document(metadata={\'name\': \'4 H회 육성지원사업\', \'source\': \'..\\\\data\\\\policy_result.json\'}, page_content=\'기관:경북 칠곡군 정책 분야:.권리분야 지원 내용:  내용  청년농업인 대상으로 하는 교육  선진지견학  과제활동 지원  청년농업인4 H회 운영 활성화  사업 운영 기간:미정 사업 신청 기간:상시 지원 규모(명):1개소 비고:연중 연령:만 19세 ~ 39세 거주지 및 소득:  가입대상  칠곡군에서 농사를 짓는 예정  칠곡군청년농업인 신청 절차:  신청방법  방문신청   칠곡군농업기술센터 칠곡군 약목면 동덕로 146  주관 기관:칠곡군농업기술센터 운영 기관:칠곡군농업기술센터\'), Document(metadata={\'name\': \'청도군 청년창업 지역정착 지원사업\', \'source\': \'..\\\\data\\\\policy_result.json\'}, page_content=\'기관:경북 청도군 정책 분야:일자리분야 지원 내용:  사업대상   만 39세 이하 전국 청년 개인  팀 최대 2명  구성을 통한 신청 가능   지원내용   청년 1인당 사업화자금  활동비 20백만원 최대 2년간 지원    1년차 사업의 효과를 평가하여 2년차 지원 대상에서 제외할 수 있음    사업내용   지역자원과 특산품 을 활용한 관광상품  기념품 개발 판매 미술  음악  사진  청년문화예술 창작활동 지원 전시 체험공간  청년카페  음식점  게스트하우스  운영 사업 운영 기간:2024 01 01~2024 12 31 사업 신청 기간:미정 지원 규모(명):  사업비   50백만원   지원규모   2명 비고:미정 주관 기관:청도군청 운영 기관:경상북도 경제진흥원\'), Document(metadata={\'name\': \'2024년 청년도전지원사업 자 모집\', \'source\': \'..\\\\data\\\\policy_result.json\'}, page_content=\'기관:경북 안동시 정책 분야:교육분야 지원 내용:  지원대상   6개월이상 취업  교육  직업훈련  이력이 없는 만 18 ~ 34세 청년  안동시 거주자는 39세까지 모집    지원내용   미취업 청년의 사회활동  의욕 고취와 자신감 향상을 위한   수당  인센티브 지원    지원방법   워크넷 접속 후  청년도전지원사업  신청 사업 신청 기간:미정 지원 규모(명):선착순 90명 모집  모집완료시 마감 비고:2023.4.1~선착순 90명 모집   모집완료시 마감 연령:만 18세 ~ 39세 주관 기관: 사  사회적경제허브센터 운영 기관: 사  사회적경제허브센터\'), Document(metadata={\'name\': \'서울청년센터 양천\', \'source\': \'..\\\\data\\\\policy_result.json\'}, page_content=\'기관:서울 양천구 정책 분야:복지.문화분야 지원 내용:청년종합상담  자원연계  지역청년간소통  문화생활 지원  지역밀착형 청년공간  청년 맞춤형  운영 사업 운영 기간:2024.1~2024.12 사업 신청 기간:상시 비고:각 마다 운영기간 상이함 연령:만 19세 ~ 39세 거주지 및 소득:만19세 이상 39세 이하 청년 주관 기관:양천구청 기획재정국 일자리경제과 운영 기관:양천구\'), Document(metadata={\'name\': \'청년 면접 지원 사업 가평군 \', \'source\': \'..\\\\data\\\\policy_result.json\'}, page_content=\'기관:경기 가평군 정책 분야:일자리분야 지원 내용:  지원내용   증명사진  헤어 메이크업  정장 상 하의  셔츠  블라우스  넥타이  구두   대여비 사업 신청 기간:상시 비고:  사업기간   2024. 4. ~ 12. 예산 소진 시까지    2024년 면접자 가능 연령:만 19세 ~ 39세 거주지 및 소득:  지원대상   신청일 현재 주민록상 가평군에 거주하는 19세 이상 39세 이하의 구직 청년 신청 절차:  가평군 홈페이지   신청서 다운로드  작성   증빙서류와 함께 일자리정책과 청년팀 로 직접  이메일 kws1049 korea.kr  제출 주관 기관:  가평군 일자리정책과 청년팀 031 580 4169 \')], [{\'url\': \'http://www.knyhnews.co.kr/news/articleView.html?idxno=21241\', \'content\': ""하동군이 지역 청년들의 문화생활 향유와 역량 개발 기회 제공을 위해 오는 10월 4일까지 \'2024년 청년 여가비 지원사업\' 2차 대상자를 모집한다.신청 대상은 공고일 기준 하동군에 주소를 둔 19~45세 이하 청년(1978~2005년생)으로, 신청 월의 전월 건강보험료 기준 본인부담금이 중위소득 150% 이하여야""}, {\'url\': \'https://www.youthcenter.go.kr/youngPlcyUnif/youngPlcyUnifDtl.do?bizId=R2024040321370\', \'content\': \'하동군 거주 청년들의 문화 및 여가생활 및 역량계발을 지원 □ 지원내용 : 도서, 자격증, 어학, 문화, 예술 등 2024년 지출한 여가활동비 지원 나. 지원 제외 대상: 문화체육관광부 「문화누리카드」사업 등 유사정책 수혜자 경북 영덕군 AIDS 환자 의료비 지원 경북 영덕군 AIDS 환자 의료비 지원 서울 구로구 0세아 의료비 지원 동절기 및 사업 공백기 보일러 등 긴급지원으로 취약계층 보호 - 보일러 긴급지원이 필요한 취약계층 가구에 단독 맞춤형 지원을 통해 복지 사각지대 해소 도모 및 에너지복지 지원 강화 [전주시 청년성장프로젝트]힐링 베이킹 클래스 및 다양한 체험 프로그램 무료 제공 <프로그램 안내> 일시 : 12월 매주 수/금 프로그램 진행 (19:00~21:00) 대상 : 전주시 거주 청년 15~39세, 선착순 20명 장소: 전북 전주시 완산구 현무1길 31-7, 볼드건물 1층 카페 매주 새로운 레시피로 진행되는 힐링 베이킹 클래스와 다양한 체험 프로그램을 무료로 제공합니다!\'}]']","하동군의 2024년 청년 여가비 지원사업의 지원 대상 연령은 19세부터 45세 이하입니다. 구체적으로는 1978년부터 2005년생까지의 청년들이 신청할 수 있으며, 신청 월의 전월 건강보험료 기준 본인부담금이 중위소득 150% 이하여야 합니다."
2024 구미청년 취업준비 프리패스 취준PASS의 지원 대상은 누구인가요?,"['정책 이름: 2024 구미청년 취업준비 프리패스 취준PASS 변경', '지원대상: 구미에 주소를 둔 19세에서 39세 이하의 미취업자']",구미에 주소를 둔 19세에서 39세 이하의 미취업자입니다.,"['[Document(metadata={\'name\': \'2024  구미청년 취업준비 프리패스 취준PASS   변경 \', \'source\': \'..\\\\data\\\\policy_result.json\'}, page_content=\'기관:경북 구미시 정책 분야:일자리분야 지원 내용:1. 사업 개요 가. 사 업 명   2024  구미청년 취업준비 프리패스 취준PASS   나. 신청기간   2024. 8. 26. ~ 예산 소진 시까지 다. 지원대상   구미시에 주소를 둔 19~39세 이하 취업 지원자 미취업자  라. 지원내용   면접정장 대여비 지원   구미소재기업 취업지원자 면접정장 2박 3일 대여  1인당 연 210 000원 한도   대여장소   레포르 테일러 구미 원남로 134   453 1154      대여일 기준 최소 5일전 주말제외  주말신청 월요일 확인 가능  신청해야 원하는 날짜 대여 가능    취업사진 촬영비 지원   관내 사진관에서 취업준비용 증명사진 촬영시 촬영비 지급  1인당 연 70 000원 한도   자격증 응시료 지원   2024년 자격증 시험 응시료 지원  1인당 연 10만원 한도 내 마. 지급방법   청년 본인 계좌로 현금 지급 바. 신청방법   청년e끌림  main.tc  온라인 접수 2. 제출서류   공통서류  신청서  주민록초본 신청일 발급분  주민록번호 뒷자리 포함   신청자 명의 통장사본   면접정장대여  면접증빙자료 회사명  면접일시  장소 이 기재된 문자  이메일 캡쳐본    대여신청서 정장대여 시 작성   면접정장대여 카드결제 영수증 qae0110 korea.kr 제출    취업사진촬영  촬영사진  관내업체 결제 내역 신용카드 영수증    소득금액증명원 2022~2023   건강보험자격득실확인서 신청일 발급분   택1    자격증 응시료  시험 응시사실 증명서류 응시확인서  성적표   시험 결제 내역 신용카드 영수증    소득금액증명원 2022~2023   건강보험자격득실확인서 신청일 발급분   택1 3. 지원 결정  결과 통보 가. 신청서 접수 사항과 구비서류 검토를  지원 대상 결정 나. 조사결과 지원 대상에 하는  구미시가 구미청년 취준패스 결정결과를 문자메시지 의 방법으로 통지 사업 운영 기간:2024 08 26~2024 12 31 사업 신청 기간:미정 지원 규모(명):  면접정장 대여비 지원   100여명  취업사진 촬영비 지원   230여명  자격증 응시료 지원   360여명 비고:2024 08 26~2024 12 31 취업 상태:미취업 주관 기관:구미시 운영 기관:구미시\'), Document(metadata={\'name\': \'2024년 청년 자격증 취득 지원사업\', \'source\': \'..\\\\data\\\\policy_result.json\'}, page_content=\'기관:경북 고령군 정책 분야:일자리분야 지원 내용:  지원대상   18세 이상 45세 이하 취업을 준비 중 미취업 인 청년   공인어학 시험의  요건 충족 시 시험응시료 최대 5회   증명서 발급 비용만 지원 가능 사업 운영 기간:2024 02 26~2024 12 20 사업 신청 기간:미정 지원 규모(명):15명 정도 비고:미정 연령:만 18세 ~ 45세 주관 기관:고령군 운영 기관:고령군\'), Document(metadata={\'name\': \'서울청년 기업 직무체험 프로젝트\', \'source\': \'..\\\\data\\\\policy_result.json\'}, page_content=\'기관:서울 정책 분야:일자리분야 지원 내용:대학 재학생이 기업에서 직무를 경험하고  적성에 맞는 진로탐색을   기업요구에 맞는 실무형 인재 육성 사업 운영 기간:2024. 1.~12. 1회 4개월  총 2 사업 신청 기간:상시 지원 규모(명):서울시 대학 재학생 약 100명 휴학생 포함  연령:만 19세 ~ 39세 거주지 및 소득:서울에서 거주  활동하는 만 19 39세 청년 학력: 대학재학  대졸예정 취업 상태: 미취업자 주관 기관:미래청년기획단\'), Document(metadata={\'name\': \'지역특화 청년 무역전문가 양성\', \'source\': \'..\\\\data\\\\policy_result.json\'}, page_content=\'기관:충남 정책 분야:일자리분야 지원 내용:  도내 수출기업 해외전시회 참가지원 사업 운영 기간:  2024 01 01~2024 12 31 사업 신청 기간:2024년 06월01일 ~ 2024년 12월31일  예정  지원 규모(명):  1개 대학  350명 비고:  2024 01 01~2024 12 31 연령:만 18세 ~ 39세 학력:  대학재학 취업 상태:  미취업자 신청 절차:  순천향대학교 홈페이지에 접속하여 신청서 제출 심사 및 발표:  개별 통보 주관 기관:  투자통상정책관 운영 기관:  순천향대학교 산학협력단 GTEP사업단\'), Document(metadata={\'name\': \'단기집단상담\', \'source\': \'..\\\\data\\\\policy_result.json\'}, page_content=\'기관:제주 정책 분야:교육분야 지원 내용:  지원내용   사업량    운영 100회    사업기간   2024 .1 ~ 12월    주요내용   취업에 어려움을 겪고 있는 취업취약계층  청년 을 대상으로 취업 의욕을 고취 시키고 구직 기술을 향상시켜주는  운영 사업 신청 기간:2024년 01월01일 ~ 2024년 12월31일 비고:사업기간2024 01 01 ~ 2024 12 31 운영기간2024 01 01 ~ 2024 12 31 신청기간2024 01 01 ~ 2024 12 31 취업 상태:4대보험 직장인  불가  사업자 불가 추가 단서 사항:4대보험 직장인  불가  사업자 불가 주관 기관:제주특별자치도   고용센터 취업지원총괄팀  운영 기관:제주특별자치도   고용센터 취업지원총괄팀 \')], [{\'url\': \'https://m.blog.naver.com/PostView.naver?blogId=gumisns&logNo=223649353148\', \'content\': \'👔구미청년 취업준비프리패스(취준PASS)👔 : 네이버 블로그 본문 바로가기 블로그 카테고리 이동 구미시 공식 블로그 👔구미청년 취업준비프리패스(취준PASS)👔 구미시 공식블로그 이웃추가 본문 기타 기능 본문 폰트 크기 조정 본문 폰트 크기 작게 보기 본문 폰트 크기 크게 보기 가 공유하기 • 신청기간 : 2024. • 신청대상 • 지원내용 - 면접정장 대여비 지원 : 1인당 연 21만원 한도 내 - 취업사진 촬영비 지원 : 1인당 연 7만원 한도 내 - 자격증 응시료 지원 : 1인당 연 10만원 한도 내 • 신청방법 : 청년e끌림(https://gbyouth.co.kr/main.tc) • 문의처 : 구미시청 인구청년과(☎054-480-2523) 👉👉자세히 보기 : https://www.gumi.go.kr/portal/saeol/gosi/view.do?notAncmtMgtNo=62163&mid=0401040000 구미 #구미시 #구미시청 #구미스타그램 #새희망구미시대 #gumi #취업준비 #취준패스 #취준PASS #청년e끌림 #구미시 #취준PASS 댓글 3 공유하기 {""title"":""👔구미청년 취업준비프리패스(취준PASS)👔"",""source"":""https://blog.naver.com/gumisns/223649353148"",""blogName"":""구미시 공.."",""domainIdOrBlogId"":""gumisns"",""nicknameOrBlogId"":""구미시"",""logNo"":223649353148,""smartEditorVersion"":4,""outsideDisplay"":true,""lineDisplay"":true,""blogDisplay"":true,""meDisplay"":true,""cafeDisplay"":true} 이 블로그 홈 댓글 3 공유하기 구미시(gumisns) 님을 이웃추가하고 새글을 받아보세요 취소 이웃추가\'}, {\'url\': \'https://www.gmilbo.net/news/article.html?no=74544\', \'content\': ""구미시, \'취업 준비 프리패스(취준PASS)\' 사업 확대 구미시, \'취업 준비 프리패스(취준PASS)\' 사업 확대 자격증 응시료 지원은 어학분야, 한국사능력검정시험, 국가공인자격증의 2024년도 시험 응시료를 대상으로 하며, 2024년 1월 1일 이후 시험에 응시한 경우 소급신청도 가능하다. 구미시, 「2024년 1회용품 및 포장재 감량 우수기관 선정」 환경부장관 표창 수상 구미시, 2025년 4월부터 결혼장려금 지급 구미시 선산읍 완전·동부지구, 2024년 국토교통부 뉴:빌리지 공모사업 선정! 4김창혁 경상북도의회 의원, 5분발언에서 「2025 구미아시아육상경기선수권대회」 경상북도 지원 촉구 인당㈜, 금오공대 장학금 500만원 전달  금오공과대학교(총장 김영식)는 27일, 인당㈜(대표 서인숙)으로부터 장학금 500만원을 전달 받았다. 대학 본관에서 열린 장학금 전달식에는 김영식 금오공대 총장을 비롯해 인당㈜ 서인숙 대표와 임직원 등 관계자 10여명이 참석했다. 발행인 : 이송희(안성) |편집인 : 이서온| 청소년 보호책임자 :김창섭 | 등록번호 : 경북 아 00052 | 신문등록일 : 2007년 8월 7일 UPDATE: 2024년 12월 27일 00시 11분""}]']","2024 구미청년 취업준비 프리패스(취준PASS)의 지원 대상은 다음과 같습니다:

- 구미시에 주소를 둔 19세에서 39세 이하의 취업 지원자 및 미취업자입니다. 

이 프로그램은 구미시에 거주하는 청년들이 취업 준비를 지원받기 위해 마련된 정책입니다."
2024 구미청년 취업준비 프리패스 취준PASS에서 면접정장 대여비 지원 한도는 얼마인가요?,"['정책 이름: 2024 구미청년 취업준비 프리패스 취준PASS 변경', '지원내용: 면접정장 대여비 지원, 1인당 210,000원 한도']","1인당 210,000원 한도입니다.","['[Document(metadata={\'name\': \'2024  구미청년 취업준비 프리패스 취준PASS   변경 \', \'source\': \'..\\\\data\\\\policy_result.json\'}, page_content=\'기관:경북 구미시 정책 분야:일자리분야 지원 내용:1. 사업 개요 가. 사 업 명   2024  구미청년 취업준비 프리패스 취준PASS   나. 신청기간   2024. 8. 26. ~ 예산 소진 시까지 다. 지원대상   구미시에 주소를 둔 19~39세 이하 취업 지원자 미취업자  라. 지원내용   면접정장 대여비 지원   구미소재기업 취업지원자 면접정장 2박 3일 대여  1인당 연 210 000원 한도   대여장소   레포르 테일러 구미 원남로 134   453 1154      대여일 기준 최소 5일전 주말제외  주말신청 월요일 확인 가능  신청해야 원하는 날짜 대여 가능    취업사진 촬영비 지원   관내 사진관에서 취업준비용 증명사진 촬영시 촬영비 지급  1인당 연 70 000원 한도   자격증 응시료 지원   2024년 자격증 시험 응시료 지원  1인당 연 10만원 한도 내 마. 지급방법   청년 본인 계좌로 현금 지급 바. 신청방법   청년e끌림  main.tc  온라인 접수 2. 제출서류   공통서류  신청서  주민록초본 신청일 발급분  주민록번호 뒷자리 포함   신청자 명의 통장사본   면접정장대여  면접증빙자료 회사명  면접일시  장소 이 기재된 문자  이메일 캡쳐본    대여신청서 정장대여 시 작성   면접정장대여 카드결제 영수증 qae0110 korea.kr 제출    취업사진촬영  촬영사진  관내업체 결제 내역 신용카드 영수증    소득금액증명원 2022~2023   건강보험자격득실확인서 신청일 발급분   택1    자격증 응시료  시험 응시사실 증명서류 응시확인서  성적표   시험 결제 내역 신용카드 영수증    소득금액증명원 2022~2023   건강보험자격득실확인서 신청일 발급분   택1 3. 지원 결정  결과 통보 가. 신청서 접수 사항과 구비서류 검토를  지원 대상 결정 나. 조사결과 지원 대상에 하는  구미시가 구미청년 취준패스 결정결과를 문자메시지 의 방법으로 통지 사업 운영 기간:2024 08 26~2024 12 31 사업 신청 기간:미정 지원 규모(명):  면접정장 대여비 지원   100여명  취업사진 촬영비 지원   230여명  자격증 응시료 지원   360여명 비고:2024 08 26~2024 12 31 취업 상태:미취업 주관 기관:구미시 운영 기관:구미시\'), Document(metadata={\'name\': \'경북 청년애꿈 수당\', \'source\': \'..\\\\data\\\\policy_result.json\'}, page_content=\'기관:경북 정책 분야:일자리분야 지원 내용:  면접수당   도내 중소 중견기업 면접 시 7만원 지원 1인 최대 5회    취업성공수당   도내 중소 중견기업 생애 최초 취업 성공 시 50만원 지원 1인 1회     근속장려수당   도내 중소 중견기업 1년 이상 재직 시 120만원 지원 1인 1회  사업 운영 기간:2024 04 29~2025 02 28 사업 신청 기간:2024년 04월29일 ~ 2024년 12월31일 지원 규모(명):도내 구직  근로활동을 하는 19세 ~ 39세 청년 1 084명 정도   면접수당   400명   취업성공수당   84명   근속장려수당   600명 비고:2024 04 29~2024 12 31 연령:만 19세 ~ 39세 거주지 및 소득: 19~39세 청년  도내 중소 중견기업 면접자  도내 중소 중견기업 생애 최초 취업성공 청년  도내 중소 중견기업 1년 이상 재직 청년 신청 절차:청년애꿈수당.kr gbwork.kr 주관 기관:경상북도 운영 기관: 재 경상북도경제진흥원\'), Document(metadata={\'name\': \'면접사진 촬영 고양시 \', \'source\': \'..\\\\data\\\\policy_result.json\'}, page_content=\'기관:경기 고양시 정책 분야:일자리분야 지원 내용:  내용   취업 준비에 필요한 이력서 면접용 증명사진 촬영 지원   촬영   더본스튜디오  주엽역 8번 출구    일정   2024년 3월 ~ 예산소진시 마감 매주 금요일   시간   일자별 신청 순서대로 임의 배치 금 10 00~19 00  사업 신청 기간:상시 비고:선착순 상시 접수 연령:만 18세 ~ 39세 거주지 및 소득:  고양시 거주 재학 재직 청년 주관 기관:고양시 청취다방 031 8075 2870 \'), Document(metadata={\'name\': \'예산군 구직자 면접비 지원사업\', \'source\': \'..\\\\data\\\\policy_result.json\'}, page_content=\'기관:충남 예산군 정책 분야:일자리분야 지원 내용:  1회 3만원 면접비 지원  최대 2회 사업 운영 기간: 2024.1.1.~2024.12.31. 사업 신청 기간:상시 지원 규모(명): 200명 비고:  2024.1.1.~2024.12.31. 연령:만 18세 ~ 45세 거주지 및 소득:  신청일 기준 18세 이상 45세 이하 예산군민   2024. 1. 1.이후 관내  중소기업에 면접을 응시한 자 전공:  미취업자 참여 제한 대상:  재직  자 사업자록    실업급여  기타 구직활동수당  타 산업 자 신청 절차:  신청기간내에 일자리지원센터 방문접수 심사 및 발표:  개별 통보 제출 서류:  구직자 면접비 지원 신청서   개인정보 수집  동의서    신분증  통장 사본 주관 기관: 산업건설국 경제과 운영 기관: 041 339 7285\'), Document(metadata={\'name\': \'청년 행복알바사업 구리시 \', \'source\': \'..\\\\data\\\\policy_result.json\'}, page_content=\'기관:경기 구리시 정책 분야:일자리분야 지원 내용:  사업기간   2024. 1. ~ 2.   7. ~ 8.  총 4개월    사업내용   공공업무 보조    근무장소   시청  사업소 각 부서  동 행정복지센터   자 임금  근로조건   시 급9 860원 2024년 최저임금    교통비 간식비  부대비용 지급1일 5 000원   주 연차수당 지급4대보험 가입   근로시간주20시간  일 4시간 주5일근무    근무시간 외 휴게시간 30분  사업 신청 기간:미정 지원 규모(명):  모집대상 사업개시일 현재 19세~39세 이하 구리시 거주 미취업 청년 80명.  취약계층  지역경제 침체로 생계지원이 필요한 청년 우선선발. 비고:  모집공고기간   2024. 5월 4째주 예정 연령:만 19세 ~ 39세 주관 기관:  구리시 일자리경제과 일자리정책팀 031 550 8323 \')], [{\'url\': \'https://www.facebook.com/gumi.korea/photos/구미청년-취업준비프리패스취준pass-신청기간-2024-11-6-예산소진시까지-신청대상-관내-주소를-둔-1939세-이하-취업-지원자미취업자-면접정/978060001023774/\', \'content\': \'구미청년 취업준비프리패스(취준PASS) • 신청기간 : 2024. 11. 6. ~ 예산소진시까지. • 신청대상 - 관내 주소를 둔 19~39세 이하 취업 지원자(미취업자) ※ 면접정장 대여 사업의 경우 구미소재기업 취업지원자 • 지원내용 - 면접정장 대여비 지원 : 1인당 연 21만원 한도 내 - 취업사진 촬영비 지원 : 1인당\'}, {\'url\': \'https://m.blog.naver.com/PostView.naver?blogId=gumisns&logNo=223649353148\', \'content\': \'👔구미청년 취업준비프리패스(취준PASS)👔 : 네이버 블로그 본문 바로가기 블로그 카테고리 이동 구미시 공식 블로그 👔구미청년 취업준비프리패스(취준PASS)👔 구미시 공식블로그 이웃추가 본문 기타 기능 본문 폰트 크기 조정 본문 폰트 크기 작게 보기 본문 폰트 크기 크게 보기 가 공유하기 • 신청기간 : 2024. • 신청대상 • 지원내용 - 면접정장 대여비 지원 : 1인당 연 21만원 한도 내 - 취업사진 촬영비 지원 : 1인당 연 7만원 한도 내 - 자격증 응시료 지원 : 1인당 연 10만원 한도 내 • 신청방법 : 청년e끌림(https://gbyouth.co.kr/main.tc) • 문의처 : 구미시청 인구청년과(☎054-480-2523) 👉👉자세히 보기 : https://www.gumi.go.kr/portal/saeol/gosi/view.do?notAncmtMgtNo=62163&mid=0401040000 구미 #구미시 #구미시청 #구미스타그램 #새희망구미시대 #gumi #취업준비 #취준패스 #취준PASS #청년e끌림 #구미시 #취준PASS 댓글 3 공유하기 {""title"":""👔구미청년 취업준비프리패스(취준PASS)👔"",""source"":""https://blog.naver.com/gumisns/223649353148"",""blogName"":""구미시 공.."",""domainIdOrBlogId"":""gumisns"",""nicknameOrBlogId"":""구미시"",""logNo"":223649353148,""smartEditorVersion"":4,""outsideDisplay"":true,""lineDisplay"":true,""blogDisplay"":true,""meDisplay"":true,""cafeDisplay"":true} 이 블로그 홈 댓글 3 공유하기 구미시(gumisns) 님을 이웃추가하고 새글을 받아보세요 취소 이웃추가\'}]']",2024 구미청년 취업준비 프리패스(취준PASS)에서 면접정장 대여비 지원 한도는 1인당 연 21만원입니다.
2024 구미청년 취업준비 프리패스 취준PASS의 취업사진 촬영비 지원 한도는 얼마인가요?,"['정책 이름: 2024 구미청년 취업준비 프리패스 취준PASS 변경', '지원내용: 취업사진 촬영비 지원, 1인당 70,000원 한도']","1인당 70,000원 한도입니다.","['[Document(metadata={\'name\': \'2024  구미청년 취업준비 프리패스 취준PASS   변경 \', \'source\': \'..\\\\data\\\\policy_result.json\'}, page_content=\'기관:경북 구미시 정책 분야:일자리분야 지원 내용:1. 사업 개요 가. 사 업 명   2024  구미청년 취업준비 프리패스 취준PASS   나. 신청기간   2024. 8. 26. ~ 예산 소진 시까지 다. 지원대상   구미시에 주소를 둔 19~39세 이하 취업 지원자 미취업자  라. 지원내용   면접정장 대여비 지원   구미소재기업 취업지원자 면접정장 2박 3일 대여  1인당 연 210 000원 한도   대여장소   레포르 테일러 구미 원남로 134   453 1154      대여일 기준 최소 5일전 주말제외  주말신청 월요일 확인 가능  신청해야 원하는 날짜 대여 가능    취업사진 촬영비 지원   관내 사진관에서 취업준비용 증명사진 촬영시 촬영비 지급  1인당 연 70 000원 한도   자격증 응시료 지원   2024년 자격증 시험 응시료 지원  1인당 연 10만원 한도 내 마. 지급방법   청년 본인 계좌로 현금 지급 바. 신청방법   청년e끌림  main.tc  온라인 접수 2. 제출서류   공통서류  신청서  주민록초본 신청일 발급분  주민록번호 뒷자리 포함   신청자 명의 통장사본   면접정장대여  면접증빙자료 회사명  면접일시  장소 이 기재된 문자  이메일 캡쳐본    대여신청서 정장대여 시 작성   면접정장대여 카드결제 영수증 qae0110 korea.kr 제출    취업사진촬영  촬영사진  관내업체 결제 내역 신용카드 영수증    소득금액증명원 2022~2023   건강보험자격득실확인서 신청일 발급분   택1    자격증 응시료  시험 응시사실 증명서류 응시확인서  성적표   시험 결제 내역 신용카드 영수증    소득금액증명원 2022~2023   건강보험자격득실확인서 신청일 발급분   택1 3. 지원 결정  결과 통보 가. 신청서 접수 사항과 구비서류 검토를  지원 대상 결정 나. 조사결과 지원 대상에 하는  구미시가 구미청년 취준패스 결정결과를 문자메시지 의 방법으로 통지 사업 운영 기간:2024 08 26~2024 12 31 사업 신청 기간:미정 지원 규모(명):  면접정장 대여비 지원   100여명  취업사진 촬영비 지원   230여명  자격증 응시료 지원   360여명 비고:2024 08 26~2024 12 31 취업 상태:미취업 주관 기관:구미시 운영 기관:구미시\'), Document(metadata={\'name\': \'면접사진 촬영 고양시 \', \'source\': \'..\\\\data\\\\policy_result.json\'}, page_content=\'기관:경기 고양시 정책 분야:일자리분야 지원 내용:  내용   취업 준비에 필요한 이력서 면접용 증명사진 촬영 지원   촬영   더본스튜디오  주엽역 8번 출구    일정   2024년 3월 ~ 예산소진시 마감 매주 금요일   시간   일자별 신청 순서대로 임의 배치 금 10 00~19 00  사업 신청 기간:상시 비고:선착순 상시 접수 연령:만 18세 ~ 39세 거주지 및 소득:  고양시 거주 재학 재직 청년 주관 기관:고양시 청취다방 031 8075 2870 \'), Document(metadata={\'name\': \'청년 구직자 취업활동비 지원\', \'source\': \'..\\\\data\\\\policy_result.json\'}, page_content=\'기관:인천 동구 정책 분야:일자리분야 지원 내용:직활동에 필요한 헤어  메이크업  사진촬영비  정장대여비  지원 사업 운영 기간:2024.1. ~ 12. 사업 신청 기간:2024년 01월01일 ~ 2024년 12월31일 지원 규모(명):50명 비고:2024.01.01 00 00 ~ 2024.12.31 00 00 연령:만 19세 ~ 39세 거주지 및 소득:  거주지   제한없음   소득   동구 거주 만 19세 이상 39세 이하 미취업 청년 취업 상태:미취업자 주관 기관:인천광역시 동구 일자리경제과 운영 기관:인천광역시 동구 일자리경제과\'), Document(metadata={\'name\': \'청년 행복알바사업 구리시 \', \'source\': \'..\\\\data\\\\policy_result.json\'}, page_content=\'기관:경기 구리시 정책 분야:일자리분야 지원 내용:  사업기간   2024. 1. ~ 2.   7. ~ 8.  총 4개월    사업내용   공공업무 보조    근무장소   시청  사업소 각 부서  동 행정복지센터   자 임금  근로조건   시 급9 860원 2024년 최저임금    교통비 간식비  부대비용 지급1일 5 000원   주 연차수당 지급4대보험 가입   근로시간주20시간  일 4시간 주5일근무    근무시간 외 휴게시간 30분  사업 신청 기간:미정 지원 규모(명):  모집대상 사업개시일 현재 19세~39세 이하 구리시 거주 미취업 청년 80명.  취약계층  지역경제 침체로 생계지원이 필요한 청년 우선선발. 비고:  모집공고기간   2024. 5월 4째주 예정 연령:만 19세 ~ 39세 주관 기관:  구리시 일자리경제과 일자리정책팀 031 550 8323 \'), Document(metadata={\'name\': \'경북 청년애꿈 수당\', \'source\': \'..\\\\data\\\\policy_result.json\'}, page_content=\'기관:경북 정책 분야:일자리분야 지원 내용:  면접수당   도내 중소 중견기업 면접 시 7만원 지원 1인 최대 5회    취업성공수당   도내 중소 중견기업 생애 최초 취업 성공 시 50만원 지원 1인 1회     근속장려수당   도내 중소 중견기업 1년 이상 재직 시 120만원 지원 1인 1회  사업 운영 기간:2024 04 29~2025 02 28 사업 신청 기간:2024년 04월29일 ~ 2024년 12월31일 지원 규모(명):도내 구직  근로활동을 하는 19세 ~ 39세 청년 1 084명 정도   면접수당   400명   취업성공수당   84명   근속장려수당   600명 비고:2024 04 29~2024 12 31 연령:만 19세 ~ 39세 거주지 및 소득: 19~39세 청년  도내 중소 중견기업 면접자  도내 중소 중견기업 생애 최초 취업성공 청년  도내 중소 중견기업 1년 이상 재직 청년 신청 절차:청년애꿈수당.kr gbwork.kr 주관 기관:경상북도 운영 기관: 재 경상북도경제진흥원\')], [{\'url\': \'https://m.blog.naver.com/PostView.naver?blogId=gumisns&logNo=223649353148\', \'content\': \'👔구미청년 취업준비프리패스(취준PASS)👔 : 네이버 블로그 본문 바로가기 블로그 카테고리 이동 구미시 공식 블로그 👔구미청년 취업준비프리패스(취준PASS)👔 구미시 공식블로그 이웃추가 본문 기타 기능 본문 폰트 크기 조정 본문 폰트 크기 작게 보기 본문 폰트 크기 크게 보기 가 공유하기 • 신청기간 : 2024. • 신청대상 • 지원내용 - 면접정장 대여비 지원 : 1인당 연 21만원 한도 내 - 취업사진 촬영비 지원 : 1인당 연 7만원 한도 내 - 자격증 응시료 지원 : 1인당 연 10만원 한도 내 • 신청방법 : 청년e끌림(https://gbyouth.co.kr/main.tc) • 문의처 : 구미시청 인구청년과(☎054-480-2523) 👉👉자세히 보기 : https://www.gumi.go.kr/portal/saeol/gosi/view.do?notAncmtMgtNo=62163&mid=0401040000 구미 #구미시 #구미시청 #구미스타그램 #새희망구미시대 #gumi #취업준비 #취준패스 #취준PASS #청년e끌림 #구미시 #취준PASS 댓글 3 공유하기 {""title"":""👔구미청년 취업준비프리패스(취준PASS)👔"",""source"":""https://blog.naver.com/gumisns/223649353148"",""blogName"":""구미시 공.."",""domainIdOrBlogId"":""gumisns"",""nicknameOrBlogId"":""구미시"",""logNo"":223649353148,""smartEditorVersion"":4,""outsideDisplay"":true,""lineDisplay"":true,""blogDisplay"":true,""meDisplay"":true,""cafeDisplay"":true} 이 블로그 홈 댓글 3 공유하기 구미시(gumisns) 님을 이웃추가하고 새글을 받아보세요 취소 이웃추가\'}, {\'url\': \'https://www.facebook.com/gumi.korea/photos/구미청년-취업준비프리패스취준pass-신청기간-2024-11-6-예산소진시까지-신청대상-관내-주소를-둔-1939세-이하-취업-지원자미취업자-면접정/978060001023774/\', \'content\': \'구미청년 취업준비프리패스(취준PASS) • 신청기간 : 2024. 11. 6. ~ 예산소진시까지. • 신청대상 - 관내 주소를 둔 19~39세 이하 취업 지원자(미취업자) ※ 면접정장 대여 사업의 경우 구미소재기업 취업지원자 • 지원내용 - 면접정장 대여비 지원 : 1인당 연 21만원 한도 내 - 취업사진 촬영비 지원 : 1인당\'}]']","2024 구미청년 취업준비 프리패스(취준PASS) 프로그램에서 취업사진 촬영비 지원 한도는 1인당 연 70,000원입니다."
2024 서울 관악구 친환경 보일러 교체 보조금 3차 접 알림의 신청 기간은 언제인가요?,['사업 신청 기간:2024년 11월27일 2024년 12월31일'],2024년 11월 27일부터 2024년 12월 31일까지입니다.,"['[Document(metadata={\'name\': \'2024 서울 관악구 친환경 보일러 교체 보조금 3차 추가 접수 알림\', \'source\': \'..\\\\data\\\\policy_result.json\'}, page_content=\'기관:서울 관악구 정책 분야:복지.문화분야 지원 내용:가정용 친환경보일러 교체 보조금 지원  60만원 대  사업 신청 기간:2024년 11월27일 ~ 2024년 12월31일 지원 규모(명):총 20대 저소득층  취약계층 20대  60만원 대  비고:2024 11 27~2024 12 31 거주지 및 소득:2024년에 관악구 내 친환경보일러를 설치 교체 하는 자로써 아래중 한가지에 속하는 저소득층  취약계층   국민기초생활보장법 제2조제1호에  수급권자  동법 제2조제10호에  차상위계층   국민기초생활보장법 차상위자활사업 대상자   장애인복지법 제49조  50조에  장애 아동 수당 수급자   장애인연금법에  장애인연금 수급자   국민건강보험 시행령에  차상위본인부담 경감 대상자   한부모가족지원법에  한부모가족지원 대상자   차상위계층확인서 발급대상자 차상위계층 확인사업에 선정된 자    지자체 저소득층 지원사업에 선정된자   기준중위소득 70% 이하 인 다자녀 2자녀 이상   가구    신청일이 속한 달의  전월 부과보험료 를 기준으로 전체 가구원 중  보험가입자 의 본인부담금을 합산한 금액을 기준     막내자녀 만 18세 이하인 에    사회복지시설 아동  노인  장애인복지시설  사회복지사업법 제2조제1호 각 목에  시설  특화 분야:저소득층 장애인 참여 제한 대상:공공기관과 공공시설  신축건물중 주택건설사업계획 승인대상 공동주택  친환경보일러를 설치 교체 하여 보조금을 지급 받은 가구 신청 절차:  온라인접수    boiler 회원가입 후 매뉴얼 참조하여 신청   11. 27. 수  09 00 이후 접수된 신청만 인정   오프라인 접수   제출서류 구비 후  관악구청 4층 녹색환경과 녹색에너지관리팀 방문 제출 서류:  대상 자격 증명서 1부  기초생활수급자 증명서  차상위계층 증명서  장애인연금 장애수당 증명서  한부모가족증명서     보일러 교체 후 사진 총 3장  시공 전경 사진1장  시공표지판 사진 1장  제조명판 사진 1장    주민록본 1부   카드전표  현금영수증  전자세금계산서 중 하나 첨부 간이영수증 불가    입금희망 통장사본 1부   친환경보일러 보조금 신청서 서식 첨부파일 확인    건축물대장  건물기부본 1부   가족관계증명서 1부 시    건강보험료 납부확인서 시   건강보험 자격득실 확인서 시    임대차계약서 사본 1부 시  주관 기관:관악구청 녹색환경과 운영 기관:관악구청 녹색환경과\'), Document(metadata={\'name\': \'울산 동구 청년 공공근로 일자리 창출사업\', \'source\': \'..\\\\data\\\\policy_result.json\'}, page_content=\'기관:울산 동구 정책 분야:일자리분야 지원 내용:  대상사업   공공시설관리  환경정화사업  30여개 사업 사업 운영 기간:  사업기간    24. 3. ~ 11. 3단계 추진    1단계  3. 4. ~ 5. 31.   2단계 6월 ~ 8월   3단계 9월 ~ 12월  사업 신청 기간:미정 지원 규모(명):  인원   200명 정도 1단계 90  2단계 60  3단계 50  연령:만 19세 ~ 39세 주관 기관:울산광역시 동구 일자리정책과 일자리정책팀 052 209 4554  운영 기관:주관기관과 동일\'), Document(metadata={\'name\': \'기간제 채용 공고 문자 알림 신청\', \'source\': \'..\\\\data\\\\policy_result.json\'}, page_content=\'기관:경기 정책 분야:일자리분야 지원 내용:경기도 내 기간제 일자리 안내 문자 수신  사업 신청 기간:2024년 06월20일 ~ 2024년 12월30일 비고:1. 신청 기간  2023. 6. 20. 화  ~ 2024.12. 30. 월  2.  기간  2023. 7. 3. 월  ~ 2024.12. 30. 월  기타 유익 정보:  확인사항     생활임금을 기준으로 급여를 하는 공고의 비율이 높고  복리후생은 각 채용에  다를 수 있습니다.     알림 는 경쟁률이 낮은 공고를 우선으로 문자가 발송됩니다. 주관 기관:경기도일자리재단 운영 기관:일자리플랫폼팀\'), Document(metadata={\'name\': \'4월 찾아가는 자기소개팅 고양시 \', \'source\': \'..\\\\data\\\\policy_result.json\'}, page_content=\'기관:경기 고양시 정책 분야:일자리분야 지원 내용:  지원내용   진로  자소서  면접컨설팅  맞춤 상담   기간   2024년 4월 1일~2024년 4월 30일 사업 신청 기간:상시 비고:선착순 상시 접수 연령:만 18세 ~ 39세 거주지 및 소득:  18세~39세 고양시 거주 재학 재직 청년 누구나 주관 기관:고양시 청취다방 031 8075 2870 \'), Document(metadata={\'name\': \'전라남도 임산부 친환경농산물 지원사업\', \'source\': \'..\\\\data\\\\policy_result.json\'}, page_content=\'기관:전남 정책 분야:복지.문화분야 지원 내용:  연간 48만원 상당의 친환경 농산물  자부담 96천원    대상자 확정 후 안내되는 고유번호로 www.ecoemall.com에 로그인  임산부가 원하는 품목을 직접 선택하여 주문  택배 배송 사업 신청 기간:상시 비고:상시 신청 거주지 및 소득:전라남도 거주자 중 2023년 1월 1일 이후 출산한 산모와 신청일 현재 임신부 특화 분야:여성 신청 절차: 온라인  통합쇼핑몰 www.ecoemall.com   오프라인  임신  출산확인서  출생증명서  임신과 출산 여부를 확인할 수 있는 서류를 지참하여 주민록 주소지 읍면동 주민센터 방문 주관 기관:전라남도 친환경농업과 운영 기관:전라남도 친환경농업과\')], [{\'url\': \'https://www.gwanak.go.kr/site/gwanak/ex/bbs/View.do?cbIdx=239&bcIdx=167959\', \'content\': \'우리구 안내 우리구 안내 정책자문단 안내 시민고충처리위원회 안내 청년 동아리 활동 지원 의료급여 지원 여성 일자리(교육) 정보 관악산 안내 관악구 유아숲체험원 관악구 유아자연배움터 분야별정보 > 도시/주택/부동산 체비지 안내 공동주택자문단 안내 기계설비 유지관리기준 및 유지관리자 선임 안내 개별공시지가 안내 표준지공시지가 안내 도로명주소 안내 전세사기피해 지원사업 총괄 안내 분야별정보 > 경제/환경 대형폐기물 배출 분야별정보 > 안전/교통 2024 친환경 보일러 교체 보조금 3차 추가 접수 알림 및 잔여 대수 안내 2024년 가정용 친환경보일러 교체 보조금 3차 추가 접수 일정을 안내 하오니 3.지원대상\\xa0:\\xa02024년에\\xa0관악구\\xa0내\\xa0친환경보일러를\\xa0설치(교체)하는\\xa0자로써\\xa0아래중\\xa0한가지에\\xa0속하는\\xa0저소득층\\xa0및\\xa0취약계층 ○ 온라인\\xa0\\xa0접수\\xa0:\\xa0http://ecosq.or.kr/boiler\\xa0회원가입\\xa0후\\xa0매뉴얼\\xa0참조하여\\xa0신청 ○ 오프라인\\xa0접수\\xa0:\\xa0제출서류 구비 후,\\xa0관악구청 4층 녹색환경과 녹색에너지관리팀 방문 (제목)2024/25년 관악구 한파쉼터 운영 안내 (등록일)2024.11.29\'}, {\'url\': \'https://www.gwanak.go.kr/site/enews/bbs/board_view.do?spid=7&sid=16&aid=11443\', \'content\': ""관악구청 해피매거진 본문 바로가기 주메뉴 바로가기 사이트정보 바로가기 관악구청 홈 라이징 관악(기획취재) 관악 파스타 관악 파스타 관악구는 미세먼지 저감을 위해 가정용 친환경 보일러로 교체 시 보조금 60만원을 지원합니다. ▶ 신청기간 : 2024. ▶ 지원대상 : ‘24년도에 가정용 친환경보일러로 교체한(하는) 저소득층 및 취약계층 ▶ 지원금액 및 대수 : 60만원/대, 총 126대 ▶ 신청서류 : 보조금 지급요청서, 설치확인서, 수급자증명서 등 ▶ 신청방법 ② 방문신청(관악구청 녹색환경과) ③ 우편제출[(우)08832 서울시 관악구 관악로145, 4층 녹색환경과(봉천동, 관악구청)] ▶ 문의처 : 다산콜센터(☎120) 또는 관악구청 녹색환경과(☎02-879-6282/6291/6281) 1 2025년 겨울 청년행정체험단 모집 SOCIETY 사회 2025년 환경개선부담금 연납 신청 안내SOCIETY 사회 더보기 CULTURE 문화 싱글벙글교육센터, 2025년 1분기 평생학습 교육프로그램 수강생 모집CULTURE 문화 더보기 INFO 정보 금연, 관악구 보건소가 도와드립니다! \'금연 클리닉\'INFO 정보 더보기 ECONOMY 경제 경제활력의 도시 관악, ‘10원의 경제’로 미래를 꿈꾸다ECONOMY 경제 더보기""}]']",2024 서울 관악구 친환경 보일러 교체 보조금 3차 추가 접수의 신청 기간은 2024년 11월 27일부터 2024년 12월 31일까지입니다.
2024 서울 관악구 친환경 보일러 교체 보조금을 신청할 수 있는 대상은 누구인가요?,['거주지 및 소득:2024년에 관악구 내 친환경보일러를 설치 교체 하는 로써 아래 한가지에 속하는 저소득층 취약계층 국민기초생활보장법 제2조제1호에 급권 동법 제2조제10호에 차상위계층 국민기초생활보장법 차상위활사업 대상 장애인복지법 제49조 50조에 장애 아동 당 급 장애인금법에 장애인금 급 국민건강보험 행령에 차상위본인부담 경감 대상 한부모가족지원법에 한부모가족지원 대상 차상위계층서 발급대상 차상위계층 사업에 선정된 지체 저소득층 지원사업에 선정된 위소득 70 이하 인 다녀 2녀 이상 가구 일이 속한 달의 전월 부과보험료 를 으로 전체 가구원 보험가입 의 본인부담금을 합산한 금액을 막내녀 만 18세 이하인 에 사회복지설 아동 노인 장애인복지설 사회복지사업법 제2조제1호 각 목에 설'],"관악구에 거주하며 친환경 보일러를 설치 또는 교체하는 저소득층, 취약계층, 장애인 등이 대상입니다.","[""[Document(metadata={'name': '2024 서울 관악구 친환경 보일러 교체 보조금 3차 추가 접수 알림', 'source': '..\\\\data\\\\policy_result.json'}, page_content='기관:서울 관악구 정책 분야:복지.문화분야 지원 내용:가정용 친환경보일러 교체 보조금 지원  60만원 대  사업 신청 기간:2024년 11월27일 ~ 2024년 12월31일 지원 규모(명):총 20대 저소득층  취약계층 20대  60만원 대  비고:2024 11 27~2024 12 31 거주지 및 소득:2024년에 관악구 내 친환경보일러를 설치 교체 하는 자로써 아래중 한가지에 속하는 저소득층  취약계층   국민기초생활보장법 제2조제1호에  수급권자  동법 제2조제10호에  차상위계층   국민기초생활보장법 차상위자활사업 대상자   장애인복지법 제49조  50조에  장애 아동 수당 수급자   장애인연금법에  장애인연금 수급자   국민건강보험 시행령에  차상위본인부담 경감 대상자   한부모가족지원법에  한부모가족지원 대상자   차상위계층확인서 발급대상자 차상위계층 확인사업에 선정된 자    지자체 저소득층 지원사업에 선정된자   기준중위소득 70% 이하 인 다자녀 2자녀 이상   가구    신청일이 속한 달의  전월 부과보험료 를 기준으로 전체 가구원 중  보험가입자 의 본인부담금을 합산한 금액을 기준     막내자녀 만 18세 이하인 에    사회복지시설 아동  노인  장애인복지시설  사회복지사업법 제2조제1호 각 목에  시설  특화 분야:저소득층 장애인 참여 제한 대상:공공기관과 공공시설  신축건물중 주택건설사업계획 승인대상 공동주택  친환경보일러를 설치 교체 하여 보조금을 지급 받은 가구 신청 절차:  온라인접수    boiler 회원가입 후 매뉴얼 참조하여 신청   11. 27. 수  09 00 이후 접수된 신청만 인정   오프라인 접수   제출서류 구비 후  관악구청 4층 녹색환경과 녹색에너지관리팀 방문 제출 서류:  대상 자격 증명서 1부  기초생활수급자 증명서  차상위계층 증명서  장애인연금 장애수당 증명서  한부모가족증명서     보일러 교체 후 사진 총 3장  시공 전경 사진1장  시공표지판 사진 1장  제조명판 사진 1장    주민록본 1부   카드전표  현금영수증  전자세금계산서 중 하나 첨부 간이영수증 불가    입금희망 통장사본 1부   친환경보일러 보조금 신청서 서식 첨부파일 확인    건축물대장  건물기부본 1부   가족관계증명서 1부 시    건강보험료 납부확인서 시   건강보험 자격득실 확인서 시    임대차계약서 사본 1부 시  주관 기관:관악구청 녹색환경과 운영 기관:관악구청 녹색환경과'), Document(metadata={'name': '전입지원금 인구증가시책  경북 문경시 ', 'source': '..\\\\data\\\\policy_result.json'}, page_content='기관:경북 문경시 정책 분야:주거분야 지원 내용:  전입이사비용 1인당 30만원 1인가구 지원 가능   전입추천자   1인당 문경사랑 상품권 10만원   전입세대 주택수리비 200만원 지원   전세자금 대출 5천만원 한도  이자 50%를 2년 간 지원 최대 100만원    전입세대 자동차번호판 변경 비용 전액 지원   신혼부부에  주택구입  전세 자금 대출잔액의 2% 이내로 이자 3년 간 지원 최대 100만원  사업 신청 기간:2024년 01월01일 ~ 2024년 12월31일 비고:2024.01.01~2024.12.31 거주지 및 소득:문경시로 6개월 이상 정착을 위해 2인 이상 전입 세대 전입신고 후 2년 이내 신청  학력:고졸 미만 고교 재학 고졸 예정 고교 졸업 대학 재학 대졸 예정 대학 졸업 석 박사 전공:인문계열 사회계열 상경계열 이학계열 공학계열 예체능계열 농산업계열 취업 상태:재직자 자영업자 미취업자 프리랜서 일용근로자 창업자 단기근로자 영농종사자 특화 분야:중소기업 여성 저소득층 장애인 농업인 군인 지역인재 신청 절차:방문접수  읍면동사무소  제출 서류:인구증가지원신청서 주관 기관:문경시청 운영 기관:정책기획단'), Document(metadata={'name': '저소득층 에너지효율개선사업', 'source': '..\\\\data\\\\policy_result.json'}, page_content='기관:산업통상자원부 정책 분야:복지.문화분야 지원 내용:1. 단열공사 2. 창호공사 3. 바닥공사 4. 보일러 교체 지원 5. 냉방기기 지원 사업 신청 기간:상시 비고:상시 신청 절차:읍면동 주민센터 방문 접수 주관 기관:산업통상자원부 운영 기관:한국에너지재단'), Document(metadata={'name': '울산 동구 청년 공공근로 일자리 창출사업', 'source': '..\\\\data\\\\policy_result.json'}, page_content='기관:울산 동구 정책 분야:일자리분야 지원 내용:  대상사업   공공시설관리  환경정화사업  30여개 사업 사업 운영 기간:  사업기간    24. 3. ~ 11. 3단계 추진    1단계  3. 4. ~ 5. 31.   2단계 6월 ~ 8월   3단계 9월 ~ 12월  사업 신청 기간:미정 지원 규모(명):  인원   200명 정도 1단계 90  2단계 60  3단계 50  연령:만 19세 ~ 39세 주관 기관:울산광역시 동구 일자리정책과 일자리정책팀 052 209 4554  운영 기관:주관기관과 동일'), Document(metadata={'name': '청년합격 지원세트 동두천시 ', 'source': '..\\\\data\\\\policy_result.json'}, page_content='기관:경기 동두천시 정책 분야:일자리분야 지원 내용:  신청기간   2024. 1.   12. 20. 예산 소진 시까지    지원대상   동두천시 만19세 만39세 면접준비  시험준비 청년   지원내용    면접준비 청년   면접정장 구입  면접정장 대여  이력서 사진촬영  헤어 메이크업    시험준비 청년   시험응시료  교재비 수험서    수강료 취창업  수험  강의    지원단가  지원횟수  업체  증빙서류  상세내용은 공고문을 확인해주세요.   지원 방법   자 선 지출 후 30일 이내 지역화폐로 환급   시험응시료의  계좌 지급 경기청년 역량강화 기회지원 사업과 동일  사업 신청 기간:상시 비고:예산 소진 시까지 연령:만 19세 ~ 39세 신청 절차:  신청방법   신청방법   온라인 신청 일자리지원사업 통합접수시스템    신청범위   2024. 1. 1. 부터 비용 지출 분 주관 기관:경기도 동두천시')], [{'url': 'https://diyaago.com/202', 'content': '서울 관악구 친환경 보일러 지원금 신청방법 대상 자격 기간 서류 서울 관악구 친환경 보일러 지원금 신청방법 대상 자격 기간 서류 관악구 친환경 보일러 지원금 지원 내용 아래 버튼을 누르시면 친환경 보일러 교체 상품 정보를 확인하실 수 있습니다. 친환경 보일러 교체 지원금 신청 방법 신청인: 지원 대상, 보일러 공급자(판매자 또는 설치 시공자), 또는 대리인이 될 수 있습니다. 친환경 보일러 교체 지원금 신청 기간 친환경 보일러 지원금 신청 서류 친환경 보일러 지원금은 주택이나 건물에 기존 보일러를 교체하거나 새로 설치하는 경우에 신청할 수 있습니다. 서울 금천구 친환경 보일러 지원금 신청방법 대상 자격 기간 서류 서울 광진구 친환경 보일러 지원금 신청방법 대상 자격 기간 서류 서울 강북구 친환경 보일러 지원금 신청방법 대상 자격 기간 서류 서울 강동구 친환경 보일러 지원금 신청방법 대상 자격 기간 서류'}, {'url': 'https://chaechaerry.com/entry/2024년-친환경-보일러-교체-지원금-지원-대상과-방법-금액', 'content': '2024년 친환경 보일러 교체 지원사업 주요 내용 1. 지원 금액 및 대상. 2024년 친환경 보일러 교체 지원사업에서는 가구당 60만 원의 지원금을 제공합니다.지원 대상은 약 2만 가구로, 전국적으로 고르게 지원할 예정입니다.. 그러나 올해부터 지원 대상에 중요한 변화가 있었습니다.'}]""]","2024 서울 관악구 친환경 보일러 교체 보조금을 신청할 수 있는 대상은 다음과 같습니다:

1. **저소득층 및 취약계층**: 국민기초생활보장법에 따른 수급권자, 차상위계층, 장애인복지법에 따른 장애 아동 수당 수급자, 장애인연금 수급자, 한부모가족지원법에 따른 한부모가족지원 대상자, 차상위계층 확인서 발급 대상자 등.
   
2. **소득 기준**: 기준중위소득 70% 이하인 다자녀(2자녀 이상) 가구로, 신청일이 속한 달의 전월 부과 보험료를 기준으로 전체 가구원 중 보험가입자의 본인부담금을 합산한 금액이 기준이 됩니다.

3. **거주 요건**: 2024년 동안 관악구 내에서 친환경 보일러를 설치 또는 교체하는 자.

신청 기간은 2024년 11월 27일부터 2024년 12월 31일까지이며, 신청은 온라인 또는 오프라인으로 가능하고, 제출해야 할 서류가 있습니다."
2024 서울 관악구 친환경 보일러 교체 보조금 사업의 주관 기관은 어디인가요?,['주관 기관:관악구청 녹색환경과'],관악구청 녹색환경과입니다.,"['[Document(metadata={\'name\': \'2024 서울 관악구 친환경 보일러 교체 보조금 3차 추가 접수 알림\', \'source\': \'..\\\\data\\\\policy_result.json\'}, page_content=\'기관:서울 관악구 정책 분야:복지.문화분야 지원 내용:가정용 친환경보일러 교체 보조금 지원  60만원 대  사업 신청 기간:2024년 11월27일 ~ 2024년 12월31일 지원 규모(명):총 20대 저소득층  취약계층 20대  60만원 대  비고:2024 11 27~2024 12 31 거주지 및 소득:2024년에 관악구 내 친환경보일러를 설치 교체 하는 자로써 아래중 한가지에 속하는 저소득층  취약계층   국민기초생활보장법 제2조제1호에  수급권자  동법 제2조제10호에  차상위계층   국민기초생활보장법 차상위자활사업 대상자   장애인복지법 제49조  50조에  장애 아동 수당 수급자   장애인연금법에  장애인연금 수급자   국민건강보험 시행령에  차상위본인부담 경감 대상자   한부모가족지원법에  한부모가족지원 대상자   차상위계층확인서 발급대상자 차상위계층 확인사업에 선정된 자    지자체 저소득층 지원사업에 선정된자   기준중위소득 70% 이하 인 다자녀 2자녀 이상   가구    신청일이 속한 달의  전월 부과보험료 를 기준으로 전체 가구원 중  보험가입자 의 본인부담금을 합산한 금액을 기준     막내자녀 만 18세 이하인 에    사회복지시설 아동  노인  장애인복지시설  사회복지사업법 제2조제1호 각 목에  시설  특화 분야:저소득층 장애인 참여 제한 대상:공공기관과 공공시설  신축건물중 주택건설사업계획 승인대상 공동주택  친환경보일러를 설치 교체 하여 보조금을 지급 받은 가구 신청 절차:  온라인접수    boiler 회원가입 후 매뉴얼 참조하여 신청   11. 27. 수  09 00 이후 접수된 신청만 인정   오프라인 접수   제출서류 구비 후  관악구청 4층 녹색환경과 녹색에너지관리팀 방문 제출 서류:  대상 자격 증명서 1부  기초생활수급자 증명서  차상위계층 증명서  장애인연금 장애수당 증명서  한부모가족증명서     보일러 교체 후 사진 총 3장  시공 전경 사진1장  시공표지판 사진 1장  제조명판 사진 1장    주민록본 1부   카드전표  현금영수증  전자세금계산서 중 하나 첨부 간이영수증 불가    입금희망 통장사본 1부   친환경보일러 보조금 신청서 서식 첨부파일 확인    건축물대장  건물기부본 1부   가족관계증명서 1부 시    건강보험료 납부확인서 시   건강보험 자격득실 확인서 시    임대차계약서 사본 1부 시  주관 기관:관악구청 녹색환경과 운영 기관:관악구청 녹색환경과\'), Document(metadata={\'name\': \'울산 동구 청년 공공근로 일자리 창출사업\', \'source\': \'..\\\\data\\\\policy_result.json\'}, page_content=\'기관:울산 동구 정책 분야:일자리분야 지원 내용:  대상사업   공공시설관리  환경정화사업  30여개 사업 사업 운영 기간:  사업기간    24. 3. ~ 11. 3단계 추진    1단계  3. 4. ~ 5. 31.   2단계 6월 ~ 8월   3단계 9월 ~ 12월  사업 신청 기간:미정 지원 규모(명):  인원   200명 정도 1단계 90  2단계 60  3단계 50  연령:만 19세 ~ 39세 주관 기관:울산광역시 동구 일자리정책과 일자리정책팀 052 209 4554  운영 기관:주관기관과 동일\'), Document(metadata={\'name\': \'울산 비보이 페스티벌\', \'source\': \'..\\\\data\\\\policy_result.json\'}, page_content=\'기관:울산 정책 분야:복지.문화분야 지원 내용:  행사일   2024. 9   대상   전국 내 비보이  댄서    행사내용   비보이배틀경연대회  축하공연  그래피티 포토존    주최 주관    경상일보 사업 신청 기간:미정 연령:만 19세 ~ 39세 주관 기관:울산광역시 문화예술과 문화산업팀 052 259 3752  운영 기관: 주 경상일보\'), Document(metadata={\'name\': \'2024년  청년일자리창출 우수기업 지원사업 \', \'source\': \'..\\\\data\\\\policy_result.json\'}, page_content=\'기관:경북 김천시 정책 분야:복지.문화분야 지원 내용:  사업기간   2024년 3월 ~ 2025년 2월   사 업 비   24 000천원  도비 7 200 시군비 16 800    사업대상   신규 청년고용실적이 우수한 김천 관내중소기업  1개사 정도   전년도 12월말 대비 고용 인원  증가가 있으며   24년도 신규청년 고용 실적이 우수한 관내 중소기업   사업내용   근로자 복지시설 개보수  물품 구입 비용 지원   지원내용   기업당 10백만원 ~ 40백만원   지원금액  신규청년채용인원에  차 지원   운영방법    재 경상북도경제진흥원 위탁운영   지원금액   신규청년채용인원에  차지원  10백만원 ~ 40백만원    3인 이상 ~ 4인 이하   10백만원 단  50인 이하 소규모 기업    5인 이상 ~ 6인 이하   20백만원   7인 이상 ~ 8인 이하   30백만원   9인 이상   40백만원   지원분야   근로자 복지시설 개보수  물품 구입 지원  시설 개보수 지원   휴게실  기숙사  체력단련실  목욕시설  화장실  구내식당  노후화로 인한 근로환경개선 시설 설치  개보수 비용 지원  물품 구입 지원   냉난방기  운동기구  냉장고  세탁기  공기정화기  기숙사 휴게실 식당  근로자 복지시설 내 근로환경개선 물품 지원   단  물품 구입만 지원하는 것은 불가하며 지원금액의 50% 초과 불가   임대사업장은 물품 구입만 지원가능   자가 사업장은 시설 개보수지원   물품 구입 지원 사업 운영 기간:2024 03 01~2024 12 31 사업 신청 기간:2024년 03월01일 ~ 2024년 12월31일 지원 규모(명):김천관내 중소기업 1개사정도 비고:사업기간   2024 03 01~2024 12 31 추가 단서 사항:  우수기업 인센티브  1. 정규직 프로젝트 우선지원  중소기업 운전자금 지원우대  벤처기업 운전자금 우대  지방세무조사 3년간 유예  주관 기관:김천시청 일자리경제과 운영 기관:경상북도경제진흥원\'), Document(metadata={\'name\': \'저소득층 에너지효율개선사업\', \'source\': \'..\\\\data\\\\policy_result.json\'}, page_content=\'기관:산업통상자원부 정책 분야:복지.문화분야 지원 내용:1. 단열공사 2. 창호공사 3. 바닥공사 4. 보일러 교체 지원 5. 냉방기기 지원 사업 신청 기간:상시 비고:상시 신청 절차:읍면동 주민센터 방문 접수 주관 기관:산업통상자원부 운영 기관:한국에너지재단\')], [{\'url\': \'https://www.gwanak.go.kr/site/enews/bbs/board_view.do?spid=7&sid=16&aid=11443\', \'content\': ""관악구청 해피매거진 본문 바로가기 주메뉴 바로가기 사이트정보 바로가기 관악구청 홈 라이징 관악(기획취재) 관악 파스타 관악 파스타 관악구는 미세먼지 저감을 위해 가정용 친환경 보일러로 교체 시 보조금 60만원을 지원합니다. ▶ 신청기간 : 2024. ▶ 지원대상 : ‘24년도에 가정용 친환경보일러로 교체한(하는) 저소득층 및 취약계층 ▶ 지원금액 및 대수 : 60만원/대, 총 126대 ▶ 신청서류 : 보조금 지급요청서, 설치확인서, 수급자증명서 등 ▶ 신청방법 ② 방문신청(관악구청 녹색환경과) ③ 우편제출[(우)08832 서울시 관악구 관악로145, 4층 녹색환경과(봉천동, 관악구청)] ▶ 문의처 : 다산콜센터(☎120) 또는 관악구청 녹색환경과(☎02-879-6282/6291/6281) 1 2025년 겨울 청년행정체험단 모집 SOCIETY 사회 2025년 환경개선부담금 연납 신청 안내SOCIETY 사회 더보기 CULTURE 문화 싱글벙글교육센터, 2025년 1분기 평생학습 교육프로그램 수강생 모집CULTURE 문화 더보기 INFO 정보 금연, 관악구 보건소가 도와드립니다! \'금연 클리닉\'INFO 정보 더보기 ECONOMY 경제 경제활력의 도시 관악, ‘10원의 경제’로 미래를 꿈꾸다ECONOMY 경제 더보기""}, {\'url\': \'https://www.gwanak.go.kr/site/gwanak/ex/bbs/View.do?cbIdx=239&bcIdx=167959\', \'content\': \'우리구 안내 우리구 안내 정책자문단 안내 시민고충처리위원회 안내 청년 동아리 활동 지원 의료급여 지원 여성 일자리(교육) 정보 관악산 안내 관악구 유아숲체험원 관악구 유아자연배움터 분야별정보 > 도시/주택/부동산 체비지 안내 공동주택자문단 안내 기계설비 유지관리기준 및 유지관리자 선임 안내 개별공시지가 안내 표준지공시지가 안내 도로명주소 안내 전세사기피해 지원사업 총괄 안내 분야별정보 > 경제/환경 대형폐기물 배출 분야별정보 > 안전/교통 2024 친환경 보일러 교체 보조금 3차 추가 접수 알림 및 잔여 대수 안내 2024년 가정용 친환경보일러 교체 보조금 3차 추가 접수 일정을 안내 하오니 3.지원대상\\xa0:\\xa02024년에\\xa0관악구\\xa0내\\xa0친환경보일러를\\xa0설치(교체)하는\\xa0자로써\\xa0아래중\\xa0한가지에\\xa0속하는\\xa0저소득층\\xa0및\\xa0취약계층 ○ 온라인\\xa0\\xa0접수\\xa0:\\xa0http://ecosq.or.kr/boiler\\xa0회원가입\\xa0후\\xa0매뉴얼\\xa0참조하여\\xa0신청 ○ 오프라인\\xa0접수\\xa0:\\xa0제출서류 구비 후,\\xa0관악구청 4층 녹색환경과 녹색에너지관리팀 방문 (제목)2024/25년 관악구 한파쉼터 운영 안내 (등록일)2024.11.29\'}]']",2024 서울 관악구 친환경 보일러 교체 보조금 사업의 주관 기관은 **관악구청 녹색환경과**입니다.
밀양 청년 일리 장려금 대상 모집은 어떤 기관에서 주관하나요?,"['정책 이름: 밀양 청년 일리 장려금 대상 모집', '주관 기관: 밀양청 일리경제과 055 359 5068']",밀양청 일리경제과에서 주관합니다.,"['[Document(metadata={\'name\': \'청년축제 강북구 \', \'source\': \'..\\\\data\\\\policy_result.json\'}, page_content=\'기관:서울 강북구 정책 분야:.권리분야 지원 내용:  청년의 날 청년주간 을 맞이하여 청년이 소통하고 즐길 수 있는  운영   청년사업 홍보부스  포토존  플리마켓 운영   지역 내 청년단체  대학교   운영   청년 힐링   지역 청년예술인 기반 문화공연  사업 신청 기간:미정 비고:청년의 날   매년 9월 세 번째 토요일 연령:만 19세 ~ 39세 거주지 및 소득:19~39세 강북구 거주  활동 청년 기타 유익 정보:강북구청 일자리청년과 02 901 2642 주관 기관:강북구청 일자리청년과 운영 기관:주관기관\'), Document(metadata={\'name\': \'공공기관 실무형 청년인턴십 운영\', \'source\': \'..\\\\data\\\\policy_result.json\'}, page_content=\'기관:서울 도봉구 정책 분야:일자리분야 지원 내용:공공기관 실무형 청년인턴 배치  운영 9개월  사업 신청 기간:상시 연령:만 19세 ~ 45세 주관 기관:도봉구 청년미래과 운영 기관:주관기관 동일기관\'), Document(metadata={\'name\': \'자립준비청년 지원 양천구 \', \'source\': \'..\\\\data\\\\policy_result.json\'}, page_content=\'기관:서울 양천구 정책 분야:복지.문화분야 지원 내용:  멘토 멘티 결연사업   자립준비청년동아리 지원   LH  SH 임대 주택 지원   자립준비청년 자립정착금 지원   대학진학자 학업유지비  취업준비금 지원   자립준비청년 자립수당 지급   자립준비청년 대중교통비 지원   자립준비청년 의료비 지원 사업 신청 기간:상시 비고:상시 운영 연령:만 18세 ~ 30세 거주지 및 소득:보호종료 5년 이내 자립준비청년 18세 ~ 30세  특화 분야:자립준비청년 추가 단서 사항:과거 2년 이상  연속하여 아동복지시설   가정위탁 보호를 받은  만기  연장 보호종료 5년 이내 자립준비청년   과거 2년 계산 시 보호시작일  보호종료일이 속한  월  기준으로 산정    아동복지법 상 아동양육시설  아동일시보호시설  아동보호치료시설  공동생활가정 기타 유익 정보:서울시 자립지원전담기관 02 2226 1524 서울시 가정위탁지원센터 02 799 0484 주관 기관:양천구청 가족정책과 아동보호팀\'), Document(metadata={\'name\': \'서울미래인재 모집\', \'source\': \'..\\\\data\\\\policy_result.json\'}, page_content=\'기관:서울 정책 분야:.권리분야 지원 내용:  서울시에서 결정되는 중요한 정책을 자문 조정 심의 의결   서울 시정에 하고자 하는 청년들을 모집하여 시정활동을 더 잘할 수 있도록 역량 강화을  사업 신청 기간:2024년 01월01일 ~ 2024년 12월31일 비고:20240101~20241231 연령:만 19세 ~ 39세 거주지 및 소득:  서울시에 거주  서울을 기반으로 활동  만 19~39세 청년 신청 절차:  운영 절차 미래인재 공개 모집 자격을 만족하는 청년 본인이 청년인재록 신청    미래인재 풀 구축 위원 위촉 추천을 위한 미래인재 데이터베이스 구축    역량 강화  운영 온라인 공통교육  분야별 특화 교육 실시    인재위촉 추천 청년들이 지출할 위원회 수요조사 후 위촉 진행    사후 지원 인재 간 네트워크 형성  청년위원의 위원회 활동 지원  환류  주관 기관:서울시 운영 기관:서울시\'), Document(metadata={\'name\': \'청년도전지원사업 안산시 \', \'source\': \'..\\\\data\\\\policy_result.json\'}, page_content=\'기관:경기 안산시 정책 분야:일자리분야 지원 내용:  지원내용   도전 단 중 장기   중 선택   도전 단 중 장기 이수 시 각 50 150 250만원  인센티브 지급  구체적인  내용  이수요건 은 참고사이트  첨부파일  확인 필수 사업 신청 기간:상시 비고: 선착순 마감  연령:만 18세 ~ 39세 거주지 및 소득:  모집대상   구직단념청년   최근 6개월간 취업  교육 직업훈련  이력이 없는 만 18~34세 청년   자립준비청년   아동복지시설 에서 보호받고 퇴소한 자 중 퇴소 5년 이내의 청년    청소년복지시설 입퇴소 청년   청소년복지시설에서 6개월 이상 보호한 만18세~34세 청년    북한이탈청년   북한을 이탈한 자로서 만 18~34세 청년    지역특화   기타 지원의 필요성이 있다고 인정받은 39세 이하 청년    주 30시간 미만 생계형 아르바이트 근로 청년  폐업 자영업 청년  취업 문제로 졸업을유예 장기 휴학 대학생 1년 이상   다문화 가정 청년  미혼모 가정 청년  보호시설 독립 후취업지원  가 어려운 청년  정신과 진료를 받고 있거나 심리상담이 필요한 청년  기타 자세한 사항은 참고사이트  첨부파일을  상세 확인 필수 참여 제한 대상: 고용보험법에  구직급여를 받고있거나  구직급여의 지급이 끝난 날로부터 6개월이 지나지 아니한 자  국민취업지원제도 하여 수혜 자  고학교  대학교 학점은행제  사이버대학교  대학원 포함  재학 자 신청 절차:  온라인 접수   사 가치있는누림 전화 접수   워크넷 홈페이지 접속 후 청년도전지원사업 검색   QR 코드 접속 후 신청  첨부파일 확인    온라인 신청이 어려운     사 가치있는 누림 방문 접수 가능 기타 유익 정보:문의   사 가치있는누림 031 402 4145  안산시 청년정책관 031 369 1655  주관 기관:고용노동부  안산시 운영 기관:사단법인 가치있는누림\')], [{\'url\': \'https://www.idomin.com/news/articleView.html?idxno=910377\', \'content\': ""밀양시 청년 일자리 장려금 지원 대상 접수 < 밀양 < 지역 < 기사본문 - 경남도민일보 후원하기 더보기 밀양시 청년 일자리 장려금 지원 대상 접수 후원하기 더보기 지역 밀양 댓글 0 페이스북(으)로 기사보내기 트위터(으)로 기사보내기 카카오톡(으)로 기사보내기 네이버밴드(으)로 기사보내기 URL복사(으)로 기사보내기 이메일(으)로 기사보내기 다른 공유 찾기 기사스크랩하기  밀양시가 취업 초기 청년들의 재정안정을 돕고 지역 내 중소기업 장기근속 유도를 위한 \'2024년 청년 일자리 장려금 지원사업\' 대상자를 모집한다. 지난해 1월 1일 이후 관내 중소기업에 정규직으로 취업하거나 정규직 전환된 만 18~39세 청년 근로자로, 직장 건강보험료 기준 중위소득 150% 이하에 해당하고 신청 시 밀양시에 주민등록을 둔 경우에 가능하다. /이일균 기자 iglee@idomin.com 이일균 기자 iglee@idomin.com 창원 의창 김종양 의원, 행정안전부 특별교부세 25억 확보 창원 성산 허성무 의원, 행정안전부 특별교부세 16억 확보 창원 청년 이야기 영화 속 클래식 이야기""}, {\'url\': \'https://www.miryang.go.kr/youth/_Web/\', \'content\': \'밀양 청년 아르바이트 . 문의처 : 일자리경제과 ☎359-5068; 밀양형 청년 내일채움공제 . 문의처 : 일자리경제과 ☎359-5068; 청년 월세 지원사업 . 문의처 : 일자리경제과 ☎359-5067; ... 2024년 밀양시 청년 일자리 장려금 대상자\'}]']","밀양시의 **청년 일자리 장려금 지원사업**은 관내 중소기업에 정규직으로 취업하거나 정규직으로 전환된 만 18세에서 39세 사이의 청년 근로자를 대상으로 합니다. 이 사업은 청년들의 재정안정을 돕고, 지역 내 중소기업의 장기 근속을 유도하기 위한 목적을 가지고 있습니다. 

신청 자격은 다음과 같습니다:

- 2023년 1월 1일 이후 관내 중소기업에 정규직으로 취업한 경우
- 직장 건강보험료 기준 중위소득 150% 이하
- 신청 시 밀양시에 주민등록을 둔 경우

이 사업은 밀양시청 일자리경제과에서 주관하고 있습니다. 추가적인 문의는 해당 부서에 연락하면 됩니다."
밀양 청년 일리 장려금 대상 모집의 지원 금액은 얼마인가요?,"['정책 이름: 밀양 청년 일리 장려금 대상 모집', '지원 내용: 지원금액  분기별 50만 원 지원 1년간 최대 4분기 지원']","분기별 50만 원을 지원하며, 1년간 최대 4분기 지원됩니다.","['[Document(metadata={\'name\': \'청년월세 한시 특별지원 사업 문경시 \', \'source\': \'..\\\\data\\\\policy_result.json\'}, page_content=\'기관:경북 문경시 정책 분야:주거분야 지원 내용:  대상자    청년기본법 상 청년 만 19~34세 이하 으로 부모님과 별도 거주하고  임차보증금 5천만원  월세 60만원 이하 주택에 거주하는 무주택자   지원한도   실제 납부하는 임대료를 최대 240만원 월 최대 20만원 까지 최대 12개월 회  동안 매월 분할 지원   지원자격   청년가구 소득 기준 중위소득 60% 이하  원가구 소득 기준 중위소득 100% 이하   신청기간    24.2. ~  25.2.   지급기간    24.2. ~  26.2. 사업 운영 기간:2024 02 26~2025 02 25 사업 신청 기간:2024년 03월01일 ~ 2025년 02월25일 지원 규모(명):실제 납부하는 임대료를 최대 240만원 월 최대 20만원 까지 최대 12개월 회  동안 매월 분할 지원 비고:2024 03 01~2025 02 25 연령:만 19세 ~ 34세 주관 기관:국토교통부 운영 기관:문경시청 일자리경제과 \'), Document(metadata={\'name\': \'청년도전지원사업 안산시 \', \'source\': \'..\\\\data\\\\policy_result.json\'}, page_content=\'기관:경기 안산시 정책 분야:일자리분야 지원 내용:  지원내용   도전 단 중 장기   중 선택   도전 단 중 장기 이수 시 각 50 150 250만원  인센티브 지급  구체적인  내용  이수요건 은 참고사이트  첨부파일  확인 필수 사업 신청 기간:상시 비고: 선착순 마감  연령:만 18세 ~ 39세 거주지 및 소득:  모집대상   구직단념청년   최근 6개월간 취업  교육 직업훈련  이력이 없는 만 18~34세 청년   자립준비청년   아동복지시설 에서 보호받고 퇴소한 자 중 퇴소 5년 이내의 청년    청소년복지시설 입퇴소 청년   청소년복지시설에서 6개월 이상 보호한 만18세~34세 청년    북한이탈청년   북한을 이탈한 자로서 만 18~34세 청년    지역특화   기타 지원의 필요성이 있다고 인정받은 39세 이하 청년    주 30시간 미만 생계형 아르바이트 근로 청년  폐업 자영업 청년  취업 문제로 졸업을유예 장기 휴학 대학생 1년 이상   다문화 가정 청년  미혼모 가정 청년  보호시설 독립 후취업지원  가 어려운 청년  정신과 진료를 받고 있거나 심리상담이 필요한 청년  기타 자세한 사항은 참고사이트  첨부파일을  상세 확인 필수 참여 제한 대상: 고용보험법에  구직급여를 받고있거나  구직급여의 지급이 끝난 날로부터 6개월이 지나지 아니한 자  국민취업지원제도 하여 수혜 자  고학교  대학교 학점은행제  사이버대학교  대학원 포함  재학 자 신청 절차:  온라인 접수   사 가치있는누림 전화 접수   워크넷 홈페이지 접속 후 청년도전지원사업 검색   QR 코드 접속 후 신청  첨부파일 확인    온라인 신청이 어려운     사 가치있는 누림 방문 접수 가능 기타 유익 정보:문의   사 가치있는누림 031 402 4145  안산시 청년정책관 031 369 1655  주관 기관:고용노동부  안산시 운영 기관:사단법인 가치있는누림\'), Document(metadata={\'name\': \'울산 북구 청소년한부모 자립지원\', \'source\': \'..\\\\data\\\\policy_result.json\'}, page_content=\'기관:울산 북구 정책 분야:복지.문화분야 지원 내용:  내용   아동양육비   아동 당 월 35 ~ 40만원   0~1세 자녀  40만원   2세 이상 자녀  35만원   아동양육비 지원 시 150 ~ 200천원 지급    자립지원촉진수당   가구당 월 10만원   1년 단위   최근 1년 내 학업 직업훈련 취업  자립 활동에 한 가구    검정고시 학습비   가구별 연 154만원 한도 지원 사업 운영 기간:  사업기간   연중 사업 신청 기간:상시 거주지 및 소득:  대상   24세 이하 저소득 청소년한부모 가구 주관 기관:울산광역시 북구 가족정책과 여성정책팀 052 241 7674   운영 기관:주관기관과 동일\'), Document(metadata={\'name\': \'청년 베이스캠프 위기 청년지원  대구 \', \'source\': \'..\\\\data\\\\policy_result.json\'}, page_content=\'기관:대구 정책 분야:복지.문화분야 지원 내용:   지원금액     1인 최대 200만원 지원  판정회의를  급박한 위기상황 청년 선발 지원  복지 수혜를 받지 못하는 청년을 대상으로 지원하는 사업입니다. 도움이 절실한 청년은 053 710 3350으로 연락주시고  주위에 힘든 친구나 이웃이 있다면 관심을 가지고 정보 공유해주세요. 사업 신청 기간:미정 비고:  신청기간   신청기간    24.2.26. ~  25.2..25. 매월 15일  예산소진시 까지  연령:만 19세 ~ 39세 거주지 및 소득:  지원대상   가족 돌봄 간병  간호 으로 삶의 선택지를 잃어버린 청년   월세가 밀려 거주하는 집에서 내몰릴 위기 청년 공과금  월세 4개월 이상 체납 대상    가족의 학대로 집을 나와 생활고를 겪는 청년 추가 단서 사항:  지원자격   청년가구 소득 기준 중위소득 60% 이하  원가구 소득 기준 중위소득 100% 이하 참여 제한 대상: 부채  개인보험  임대료  저축  지원 불가 신청 절차:  지원절차   매월 15일 접수 마감  판정회의  선정발표    추가 요청 서류제출   매월 30일~익월 5일  지원금 지급   신청방법 신청서 메일접수 wsws1004 hanmail.net 메일 제목에 신복지  성명 이00 신청서 제출이라고 꼭 기재해주세요 주관 기관:대구광역시 운영 기관:월성종합사회복지관\'), Document(metadata={\'name\': \'서울형 강소기업 지원\', \'source\': \'..\\\\data\\\\policy_result.json\'}, page_content=\'기관:서울 정책 분야:일자리분야 지원 내용:  근무환경개선금 지원액   1인당 1 000만원 최대 1 500만원 지원    청년 정규직 신규채용 1인당 1 000만원 지원 12개월 만근 기준    추가 지원금   1인당 500만원 사업 운영 기간:2024.01~2024.12. 사업 신청 기간:미정 비고:2024년 신규 신청은 상반기 중 공고 예정 거주지 및 소득:서울시 소재 중소기업 중 공공기관 인증을 받은 기업   공공기관 인증 중소기업   하이서울브랜드 기업  청년친화 강소기업  가족친화 인증기업  이노비즈  메인비즈  벤처기업    기업의 재무제표 19년  20년  을 확인하기 위해 2년의 최소 업력 필요 특화 분야:중소중견기업 신청 절차: 사이트에서 온라인 신청   서울시 홈페이지 공고 확인 심사 및 발표:지원사업 운영 공고문 참조 제출 서류:지원사업 운영 공고문 참조 주관 기관:서울시청 일자리정책과 청년일자리팀 운영 기관:주관기관과 동일\')], [{\'url\': \'https://www.miryang.go.kr/youth/nmprogram/board/default.php?mod=o&idx=34&se=34&cb=1\', \'content\': \'지원금액: 분기별 50만 원 지원(1년간 최대 4분기 지원) 문 의 처: 밀양시청 일자리경제과(055-359-5068) ※ 자세한 내용은 아래의 공고문을 참고하시기 바랍니다. 첨부파일. 2024년+밀양시+청년+일자리+장려금+지원+이미지.jpg; 2024년+청년+일자리+장려+지원금+공고문.hwp\'}, {\'url\': \'https://www.idomin.com/news/articleView.html?idxno=910377\', \'content\': ""밀양시 청년 일자리 장려금 지원 대상 접수 < 밀양 < 지역 < 기사본문 - 경남도민일보 후원하기 더보기 밀양시 청년 일자리 장려금 지원 대상 접수 후원하기 더보기 지역 밀양 댓글 0 페이스북(으)로 기사보내기 트위터(으)로 기사보내기 카카오톡(으)로 기사보내기 네이버밴드(으)로 기사보내기 URL복사(으)로 기사보내기 이메일(으)로 기사보내기 다른 공유 찾기 기사스크랩하기  밀양시가 취업 초기 청년들의 재정안정을 돕고 지역 내 중소기업 장기근속 유도를 위한 \'2024년 청년 일자리 장려금 지원사업\' 대상자를 모집한다. 지난해 1월 1일 이후 관내 중소기업에 정규직으로 취업하거나 정규직 전환된 만 18~39세 청년 근로자로, 직장 건강보험료 기준 중위소득 150% 이하에 해당하고 신청 시 밀양시에 주민등록을 둔 경우에 가능하다. /이일균 기자 iglee@idomin.com 이일균 기자 iglee@idomin.com 창원 의창 김종양 의원, 행정안전부 특별교부세 25억 확보 창원 성산 허성무 의원, 행정안전부 특별교부세 16억 확보 창원 청년 이야기 영화 속 클래식 이야기""}]']","밀양시 청년 일자리 장려금 지원사업에 대한 정보는 다음과 같습니다:

- **지원 금액**: 분기별 50만 원 지원 (최대 1년간 4분기 지원 가능)
- **지원 대상**: 2023년 1월 1일 이후 밀양시 관내 중소기업에 정규직으로 취업하거나 정규직 전환된 만 18~39세 청년 근로자
- **소득 기준**: 직장 건강보험료 기준 중위소득 150% 이하
- **신청 조건**: 신청 시 밀양시에 주민등록이 되어 있어야 함
- **문의처**: 밀양시청 일자리경제과 (055-359-5068)

자세한 사항은 밀양시청의 공고문을 참고하시기 바랍니다."
밀양 청년 일리 장려금 대상 모집의 신청 절차는 어떻게 되나요?,"['정책 이름: 밀양 청년 일리 장려금 대상 모집', '신청 절차:  방법   서류   밀양 홈페이지 www.miryang.go.kr  고공고에서 다운로드   제출방법   방문접  기우편 접 마감일 도착분에 한함    제출처   밀양 일리경제과 청년정책담당']",신청은 서류를 밀양 홈페이지에서 다운로드하여 방문 접수하거나 우편 접수로 제출합니다. 제출처는 밀양 일리경제과 청년정책담당입니다.,"['[Document(metadata={\'name\': \'청년 소상공인을 위한 고민상담소\', \'source\': \'..\\\\data\\\\policy_result.json\'}, page_content=\'기관:서울 중구 정책 분야:교육분야 지원 내용:청년 소상공인을 위한 심리교육 사업 신청 기간:2024년 06월21일 ~ 2024년 12월31일 비고:  모집기간  2024.6.21. 금  ~ 상시모집 연령:만 19세 ~ 34세 거주지 및 소득:19세이상 34세이하 청년사장님 사업자록증 확인  취업 상태:청년 소상공인 신청 절차:  신청방법   서울심리지원 제4권역 중부 센터 홈페이지  포스터 QR 신청   첨부파일 필수 확인 주관 기관:서울시 중구청 운영 기관:행복잇다 사회적협동조합\'), Document(metadata={\'name\': \'청년 커리어 고민 솔루션  ALL Question   안양시 \', \'source\': \'..\\\\data\\\\policy_result.json\'}, page_content=\'기관:경기 안양시 정책 분야:일자리분야 지원 내용:  청년의 고민을 현직자가 답해주는 온라인 멘토링    진로  대학  취업  이직  온라인 상담   실무 취업고민 상담사례 열람   AI 자기소개서 튜토리얼  분석    기타 자세한 세부 내용은 참고 사이트를 확인해주세요. 사업 신청 기간:상시 비고:운영시기   2024. 3. 4 ~ 계속 연령:만 16세 ~ 39세 거주지 및 소득:  안양시 거주  활동 직장  학교   하고 있는 청소년  청년   생년월일   2005. 3. 2. ~ 2008. 12. 31. 신청 절차:  16세~18세   안양청년광장 회원가입   ALL Q    19세~39세   안양청년광장 회원가입   인재록 완료   ALL Q  주관 기관:경기도 안양시\'), Document(metadata={\'name\': \'면접 준비 청년 헤어스타일링 무료지원 남양주시 \', \'source\': \'..\\\\data\\\\policy_result.json\'}, page_content=\'기관:경기 남양주시 정책 분야:일자리분야 지원 내용:  지원내용   면접 준비 청년 헤어스타일링 무료지원   지원혜택   1인 연 최대 2회이며  업체별 가능한 시술 종류와 월 대상인원은 변동 가능 사업 신청 기간:상시 연령:만 19세 ~ 39세 거주지 및 소득:  남양주시에 주민록이 되어있는 19세 이상 39세 이하  면접을 앞둔  서류전형 합격일 후부터 면접일까지  청년 신청 절차:1호점   센느  경춘로 490 힐스테이트 지금디포레  2238호  네이버예약 2호점   바인  해밀예당1로200번길 13 4  103호  유선접수   0507 1359 3706 3호점   기분좋은날  도농로 중촌1길6  1층  유선접수   010 5206 9538 주관 기관:남양주시 청년정책과   031 590 8539 \'), Document(metadata={\'name\': \'면접사진 촬영 고양시 \', \'source\': \'..\\\\data\\\\policy_result.json\'}, page_content=\'기관:경기 고양시 정책 분야:일자리분야 지원 내용:  내용   취업 준비에 필요한 이력서 면접용 증명사진 촬영 지원   촬영   더본스튜디오  주엽역 8번 출구    일정   2024년 3월 ~ 예산소진시 마감 매주 금요일   시간   일자별 신청 순서대로 임의 배치 금 10 00~19 00  사업 신청 기간:상시 비고:선착순 상시 접수 연령:만 18세 ~ 39세 거주지 및 소득:  고양시 거주 재학 재직 청년 주관 기관:고양시 청취다방 031 8075 2870 \'), Document(metadata={\'name\': \'정신건강 치료비 지원  청 소 년 마인드 케어 사업  안양시 \', \'source\': \'..\\\\data\\\\policy_result.json\'}, page_content=\'기관:경기 안양시 정책 분야:복지.문화분야 지원 내용:  내용   정신건강의학적 진단비  치료비 지원 사업 신청 기간:상시 비고:  기간   ~ 2024년 12월 예산 소진 시까지  연령:만 15세 ~ 34세 거주지 및 소득:  모집대상   안양시 청년  청소년 신청 절차:  신청방법   QR코드 신청 주관 기관:  안양시정신건강복지센터   031 360 2989  2390 \')], [{\'url\': \'https://www.idomin.com/news/articleView.html?idxno=910377\', \'content\': ""밀양시 청년 일자리 장려금 지원 대상 접수 < 밀양 < 지역 < 기사본문 - 경남도민일보 후원하기 더보기 밀양시 청년 일자리 장려금 지원 대상 접수 후원하기 더보기 지역 밀양 댓글 0 페이스북(으)로 기사보내기 트위터(으)로 기사보내기 카카오톡(으)로 기사보내기 네이버밴드(으)로 기사보내기 URL복사(으)로 기사보내기 이메일(으)로 기사보내기 다른 공유 찾기 기사스크랩하기  밀양시가 취업 초기 청년들의 재정안정을 돕고 지역 내 중소기업 장기근속 유도를 위한 \'2024년 청년 일자리 장려금 지원사업\' 대상자를 모집한다. 지난해 1월 1일 이후 관내 중소기업에 정규직으로 취업하거나 정규직 전환된 만 18~39세 청년 근로자로, 직장 건강보험료 기준 중위소득 150% 이하에 해당하고 신청 시 밀양시에 주민등록을 둔 경우에 가능하다. /이일균 기자 iglee@idomin.com 이일균 기자 iglee@idomin.com 창원 의창 김종양 의원, 행정안전부 특별교부세 25억 확보 창원 성산 허성무 의원, 행정안전부 특별교부세 16억 확보 창원 청년 이야기 영화 속 클래식 이야기""}, {\'url\': \'https://www.youthcenter.go.kr/youngPlcyUnif/youngPlcyUnifDtl.do?bizId=R2024050222406\', \'content\': \'밀양시 청년 일자리 장려금 대상자 모집 “ 밀양시 청년 일자리 장려금 대상자 모집 ” 와 동일분야 청년정책 경상남도 기업체험활동 지원사업 참여 청년 모집 성남시에서는 미취업 청년들을 대상으로 구직활동에 필요한 자격증 시험 응시료와 수강료를 지원하는 「미취업 청년 지원사업[ALL-Pass]」 참여자를 아래와 같이 모집하오니 많은 신청 바랍니다. 청년 면접수당 지원을 통한 구직단념 청년의 사회활동 진입 및 구직활동 활성화 구미시 청년 취업 지원 청년 구직자 취업활동비 지원 2024 여수시 청년 멘토링 사업 경주시 내 구직활동을 하는 19세 이상 39세 이하 청년이 적극적으로 구직 활동에 참여할 수 있도록 면접비를 지원함으로써 청년 구직자의 경제적인 부담을 완화하는 데 도움. 청년 취‧창업 지원 프로그램 참여자 선착순 모집 하남시 청년 취‧창업지원 프로그램을 아래와 같이 안내 드리오니 많은 신청 바랍니다. 의성군 소상공인 및 중소 청년기업에 저금리 융자 지원\'}]']","### 청년 소상공인 및 일자리 지원 정책 정보

#### 1. 청년 소상공인을 위한 고민상담소 (서울 중구)
- **정책 분야:** 교육 분야
- **지원 내용:** 청년 소상공인을 위한 심리교육 사업
- **신청 기간:** 2024년 06월 21일 ~ 2024년 12월 31일 (상시 모집)
- **대상:** 만 19세 ~ 34세 청년 소상공인 (사업자 등록증 확인 필수)
- **신청 방법:** 서울심리지원 제4권역 중부 센터 홈페이지에서 QR 코드로 신청
- **주관 기관:** 서울시 중구청, 운영 기관: 행복잇다 사회적협동조합

#### 2. 청년 커리어 고민 솔루션 (경기 안양시)
- **정책 분야:** 일자리 분야
- **지원 내용:** 현직자가 답해주는 온라인 멘토링, AI 자기소개서 튜토리얼 등
- **신청 기간:** 상시
- **대상:** 만 16세 ~ 39세 청소년 및 청년 (안양시 거주)
- **신청 방법:** 안양청년광장 회원가입 후 신청
- **주관 기관:** 경기도 안양시

#### 3. 면접 준비 청년 헤어스타일링 무료 지원 (경기 남양주시)
- **정책 분야:** 일자리 분야
- **지원 내용:** 면접 준비를 위한 청년 헤어스타일링 무료 지원
- **신청 기간:** 상시
- **대상:** 만 19세 ~ 39세, 남양주 주민등록자
- **신청 방법:** 지정된 미용실에 전화 예약
- **주관 기관:** 남양주시 청년정책과

#### 4. 면접사진 촬영 지원 (경기 고양시)
- **정책 분야:** 일자리 분야
- **지원 내용:** 이력서 및 면접용 증명사진 촬영 지원
- **신청 기간:** 상시
- **대상:** 만 18세 ~ 39세, 고양시 거주자
- **신청 방법:** 매주 금요일 예약
- **주관 기관:** 고양시 청취다방

#### 5. 정신건강 치료비 지원 (경기 안양시)
- **정책 분야:** 복지·문화 분야
- **지원 내용:** 정신건강 진단비 및 치료비 지원
- **신청 기간:** 상시 (2024년 12월까지)
- **대상:** 만 15세 ~ 34세, 안양시 청소년 및 청년
- **신청 방법:** QR 코드로 신청
- **주관 기관:** 안양시정신건강복지센터

### 추가 정보: 밀양시 청년 일자리 장려금
- **정책 내용:** 취업 초기 청년들의 재정안정을 돕기 위한 '2024년 청년 일자리 장려금 지원사업' 모집
- **대상:** 2023년 1월 1일 이후 관내 중소기업에 정규직으로 취업한 만 18~39세 청년
- **신청 자격:** 직장 건강보험료 기준 중위소득 150% 이하, 밀양시에 주민등록
- **신청 방법:** 상세 신청 절차는 밀양시청 또는 관련 기관에 문의 필요

이 외에도 다양한 청년 지원 정책이 있으니, 각 지자체의 공식 웹사이트를 통해 최신 정보를 확인하는 것이 좋습니다."
제대군인 사이버교육을 주관하는 기관은 어디인가요?,"['정책 이름: 제대군인 사이버교육', '주관 기관: 국가보훈처']",국가보훈처,"['[Document(metadata={\'name\': \'제대군인 사이버교육\', \'source\': \'..\\\\data\\\\policy_result.json\'}, page_content=\'기관:국가보훈부 정책 분야:교육분야 지원 내용:1인당 월 3개  연 12개  과목 사이버교육  1인당 교재비 6권 지원 사업 신청 기간:상시 비고:상시 거주지 및 소득:전역자 중 제대군인제원센터 회원으로 가입되어 있거나 보훈 지 청에 제대군인으로 록된 사람  전역 예정자 중 제대군인지원센터 회원으로 가입되어 있거나 5년 이상 복무자로 각 군본부로부터 사이버교육 신청자로 통보되었거나 전직기본교육 수료증  연대장급 이상 추천서  전역예정을 증명할 수 있는 서류가 있는 자 취업 상태:미취업자 특화 분야:군인 추가 단서 사항:수강신청  교재구매   전월 10일 09시 ~ 20일 24시    vnet 로그인   사이버연수원 로그인   수강신청   승인   수강 신청 절차:제대군인지원센터 사이버연수원 홈페이지에 접속해서 별도 회원가입한 후 수강신청 심사 및 발표:제대군인지원센터에서 자격검증  결정 후 수강 가능 기타 유익 정보:  과정불성실 이수의  2개월간 수강신청 정지 패널티 적용 무료과정 포함    문의   서울제대군인지원센터 자격검증  대상자 선정 담당자  02 3480 6833   사이버교육연수원 멀티캠퍼스  교재발송  오류   문의  1544 9001 주관 기관:국가보훈처 운영 기관:서울제대군인지원센터\'), Document(metadata={\'name\': \'전북 사이버 도민강좌\', \'source\': \'..\\\\data\\\\policy_result.json\'}, page_content=\'기관:전북 정책 분야:교육분야 지원 내용:  전북사이버도민강좌   전북 도민에게 외국어 제2외국어   취업 자격증  취미 예술  인문교양  온라인 강좌 무료    다양한 분야의 전문화된 고품질 교육콘텐츠 을 통한 비대면 학습 기회    학습이력  학습정보관리  교육  사업 신청 기간:상시 비고:상시신청 거주지 및 소득:전북 도민 특화 분야:지역인재 신청 절차:전북시민대학 홈페이지 신청    주관 기관:전북특별자치도평생교육장학진흥원 운영 기관:전북특별자치도평생교육장학진흥원\'), Document(metadata={\'name\': \'제대군인지원센터\', \'source\': \'..\\\\data\\\\policy_result.json\'}, page_content=\'기관:국가보훈부 정책 분야:복지.문화분야 지원 내용:  직업능력개발 교육비   전직지원금   사이버교육   무료법률 구조   심리재활  지원 사업 신청 기간:상시 거주지 및 소득:  5년 이상 중   장기복무 제대군인 특화 분야:군인 신청 절차:  지원별 상이 기타 유익 정보:  문의처   1666 9279 주관 기관:국가보훈부\'), Document(metadata={\'name\': \'울산 북구 미래를 위한 교육패러다임  온택트 강좌  운영\', \'source\': \'..\\\\data\\\\policy_result.json\'}, page_content=\'기관:울산 북구 정책 분야:교육분야 지원 내용:  운영체계   북구 평생학습관 홈페이지  각종 소셜네트워크 Youtube  zoom     세부내용   전문컨텐츠 기관과 업무협약에 의한 온라인 강좌   국가공인자격증 과정 유료    사회복지사  보육교사   국가록민간자격증과정 무료    방과후지도사  총 90개 강좌   외국어강좌 무료    영어  일본어  중국어  총 40개 강좌   국가평생학습포털 늘배움  k MOOC 온라인 강의 연계 사업 운영 기간:  운영기간   연중 사업 신청 기간:상시 거주지 및 소득:  수강대상   북구민 전체 주관 기관:울산광역시 북구 교육청소년과 평생학습팀 052 219 7394  운영 기관:주관기관과 동일\'), Document(metadata={\'name\': \'전남 청년성장프로젝트 직장적응지원\', \'source\': \'..\\\\data\\\\policy_result.json\'}, page_content=\'기관:전남 정책 분야:일자리분야 지원 내용:  입사 1년 이내 청년 신입직원에게 직장 적응  업무능력 향상  경력개발을 위한 교육을    소규모 채용으로 신입 사원 교육을 따로 진행하지 못한 기업에 교육을 무료로    기업 단독 교육 신청 시 선택을 통한 맞춤형     회 당 모집인원   10명 이상   12회 운영     CEO  인사관리자  부서별 중간관리자  선임급 을 대상으로 한 조직문화교육    조직문화와 비즈니스 성과의 연계를 중심으로 인적자원관리  ESG경영  경영트랜드  기업지원제도  효율적인 기업 운영에 필요한 교육    이수 시 청년친화강소기업 선정기준 중 5점 배점 사항 충족   기업 단독 교육 신청 시 선택을 통한 맞춤형     회 당 모집인원   10명 이상   12회 운영 사업 운영 기간:2024년 4월 ~ 2024년 11월 사업 신청 기간:상시 비고:2024년 4월 1일 ~ 선착순 연령:만 15세 ~ 34세 거주지 및 소득:  신입직원 온보딩    연령   만 15~34세   취업상태   현 회사 재직 1년 이내 입사자   근로계약을 확정한 후 입사 대기  자  지역조례에  30%에 한해서 만 45세까지 가능   청년친화 조직문화교육   연령   제한 없음   취업상태   현재 재직  CEO  인사관리자  부서별 중간관리자  선임급 신청 절차:전화 문의  061 284 2842     팩스  061 802 2847   온라인 신청 네이버폼  기타 유익 정보:수료 시 선물 증정  수료증  점심   경력개발 경제교육 개설  주관 기관:고용노동부  전라남도 운영 기관: 재 전남인력개발원  061 284 2842 \')], [{\'url\': \'https://blog.naver.com/PostView.nhn?blogId=harukomm&logNo=223087570026\', \'content\': \'블로그 블로그 검색 내 블로그  블로그 홈  블로그 메뉴 블로그 블로그 제대군인 사이버교육 대상 및 신청방법 (ft. 교재비, 수강신청, 과목, 기간, 수료) 바로 ""제대군인 사이버교육""에 대하여 알아보겠습니다. 국가보훈처 제대군인지원센터는 5년 이상 국토방위의 임무를 성실히 수행하고 전역한 중장기복무 제대군인의 취업역량 강화를 위해 직업능력개발 교육, 사이버연수원교육 등 다양한 교육을 국비로 실시하고 있습니다. 제대군인 사이버교육 대상 및 기준 제대군인지원센터(vnet) 회원으로 가입 제대군인지원센터(vnet) 회원으로 가입 제대군인 사이버교육 수강신청 및 승인 수강신청 및 교재구매 -전월 10일 09시 ~ 20일 24시 -vnet 로그인 -> 사이버연수원 로그인 -> 수강신청 -> 승인 -> 수강 -전월 21일 ~ 23일(3일) -전월 23일 ~ 24일 -서울제대군인지원센터 : 02)3480-6833 수강신청 자격확인 및 교육대상자 선정 제대군인 사이버교육 수강료 및 교재비 제대군인 사이버교육 신청절차 및 유의사항 신청 (신청인) 자격검증/결정 (제대군인지원센터) 이 블로그 전체 카테고리 글 검색 글 검색\'}, {\'url\': \'https://inmotion.tistory.com/460\', \'content\': \'국가보훈처 제대군인지원센터 - 사이버교육 신청 안내 검색하기 폼 검색하기  국가보훈처 제대군인지원센터 - 사이버교육 신청 안내 제대군인지원센터는 제대군인의 사이버 교육을 지원하는 곳으로, 사이버교육 신청 방법과 내용에 대해 알려드릴게요. 또한, 국가보훈처 홈페이지에서도 [열린도우미] 메뉴를 선택하여 [민원행정서비스] 카테고리에서 [사이버교육 신청]으로 들어갈 수 있습니다. 사이버교육 신청 방법 사이버교육 대상 확인: 전역자 및 전역예정자인지 확인합니다. 교재구매: 수강신청한 과목에 대한 교재를 전월 10일부터 20일까지 구매할 수 있습니다. 사이버교육 신청 대상 교재 및 자격검증 자격검증: 전월 21일부터 23일까지 진행 신청 교재발송 및 문의 수강신청 자격 확인 및 교육대상자 선정 문의: 서울제대군인지원센터 02-3480-6833 이렇게 국가보훈처 제대군인지원센터의 사이버교육 신청에 대해 알려드렸습니다. 국가보훈처 제대군인지원센터 최근에 올라온 글 동양생명 보험금 청구 절차, 필요한 서류, 간단히⋯ 최근에 달린 댓글 안녕하세요 블로그 글 보고 연락 드립니다. 구인구직 서해교차로 구인구직 글 보관함\'}]']","제대군인 사이버교육에 대한 정보는 다음과 같습니다:

### 제대군인 사이버교육

- **주관 기관**: 국가보훈처
- **운영 기관**: 서울제대군인지원센터
- **정책 분야**: 교육
- **지원 내용**:
  - 1인당 월 3개, 연 12개 과목 사이버교육 제공
  - 1인당 교재비 6권 지원
- **신청 기간**: 상시
- **대상**:
  - 전역자 중 제대군인지원센터 회원으로 가입되어 있거나 보훈지청에 제대군인으로 등록된 사람
  - 전역 예정자 (5년 이상 복무자 포함)
- **신청 절차**:
  1. vnet 로그인
  2. 사이버연수원 로그인
  3. 수강신청
  4. 승인 후 수강
- **신청 기간**: 매달 10일 09시부터 20일 24시까지
- **자격 검증 및 결정**: 제대군인지원센터에서 진행
- **기타 유익 정보**:
  - 과정 불성실 이수 시 2개월간 수강신청 정지 패널티 적용
  - 무료 과정 포함
- **문의처**:
  - 서울제대군인지원센터: 02-3480-6833
  - 사이버교육연수원 멀티캠퍼스 교재발송 오류 문의: 1544-9001

이 프로그램은 제대군인의 취업 역량 강화를 위해 마련된 교육 지원으로, 다양한 과목을 제공하며 교재비도 지원됩니다. 신청 방법과 절차에 대한 자세한 정보는 제대군인지원센터의 공식 웹사이트나 문의처를 통해 확인할 수 있습니다."
제대군인 사이버교육에서 지원되는 교재 수는 몇 권인가요?,"['정책 이름: 제대군인 사이버교육', '지원 내용: 1인당 교재비 6권 지원']",1인당 6권,"['[Document(metadata={\'name\': \'제대군인 사이버교육\', \'source\': \'..\\\\data\\\\policy_result.json\'}, page_content=\'기관:국가보훈부 정책 분야:교육분야 지원 내용:1인당 월 3개  연 12개  과목 사이버교육  1인당 교재비 6권 지원 사업 신청 기간:상시 비고:상시 거주지 및 소득:전역자 중 제대군인제원센터 회원으로 가입되어 있거나 보훈 지 청에 제대군인으로 록된 사람  전역 예정자 중 제대군인지원센터 회원으로 가입되어 있거나 5년 이상 복무자로 각 군본부로부터 사이버교육 신청자로 통보되었거나 전직기본교육 수료증  연대장급 이상 추천서  전역예정을 증명할 수 있는 서류가 있는 자 취업 상태:미취업자 특화 분야:군인 추가 단서 사항:수강신청  교재구매   전월 10일 09시 ~ 20일 24시    vnet 로그인   사이버연수원 로그인   수강신청   승인   수강 신청 절차:제대군인지원센터 사이버연수원 홈페이지에 접속해서 별도 회원가입한 후 수강신청 심사 및 발표:제대군인지원센터에서 자격검증  결정 후 수강 가능 기타 유익 정보:  과정불성실 이수의  2개월간 수강신청 정지 패널티 적용 무료과정 포함    문의   서울제대군인지원센터 자격검증  대상자 선정 담당자  02 3480 6833   사이버교육연수원 멀티캠퍼스  교재발송  오류   문의  1544 9001 주관 기관:국가보훈처 운영 기관:서울제대군인지원센터\'), Document(metadata={\'name\': \'해남군 다문화가정 행복장려금 지원\', \'source\': \'..\\\\data\\\\policy_result.json\'}, page_content=\'기관:전남 해남군 정책 분야:.권리분야 지원 내용:장려금 지급   1차 지급  교육이수 실적 확인 후 지급 3백만원    2차 지급  1차 지급 후 6개월 이후 혼인관계 사업 신청 기간:상시 비고:1회성 거주지 및 소득:  지원기준   국제결혼 혼인 신고일 당시 해남군에 주민록을  혼인신고 후 배우자가 입국하여 외국인 록을 한 날부터 혼인상태 유지기간이 6개월 미만인 사람으로 교육이수조건을 충족한 사람   예산의 범위에서 일정액을 지원하되  외국인 배우자와 결혼한 횟수에 관계없이 최초 신청 1회만 지급한다. 학력:고졸 미만 고교 재학 고졸 예정 고교 졸업 대학 재학 대졸 예정 대학 졸업 석 박사 전공:인문계열 사회계열 상경계열 이학계열 공학계열 예체능계열 농산업계열 취업 상태:재직자 자영업자 미취업자 프리랜서 일용근로자 창업자 단기근로자 영농종사자 특화 분야:중소기업 여성 저소득층 장애인 농업인 군인 지역인재 추가 단서 사항:  선정기준 외국인 록을 한날부터 혼인상태 유지기간이 6개월미만인자로 제시된 교육과정 90%이상 이수한 자 신청 절차:  지원신청  읍면사무소 제출 서류:  제출서류   다문화가정 행복장려금 지원 신청서 1부   외국인 록증 사본 1부   혼인관계증명서 1부 주관 기관:해남군 가족행복과 운영 기관:해남군 가족행복과\'), Document(metadata={\'name\': \'이공계 전문기술 연수 학사 사업\', \'source\': \'..\\\\data\\\\policy_result.json\'}, page_content=\'기관:과학기술정보통신부 정책 분야:교육분야 지원 내용:주요 내용    전문 연수  4개월 이내 교육운영  제반경비 전담인력 인건비  강사료  교육재료비   지원  전문분야 이론  실습교육    기업체 실무 연수  2개월 이내  교육운영  제반경비 전담인력 인건비  강사료  교육재료비   지원  주관기관과 채용약정된 기업에서 채용을 전제로 현장실무 교육    사업비   연수생 1인당 770만원 지원 연수수당 300만원 교육지원금 470만원   교육기간은 연수분야의 특성을 고려하여 주관기관에서 탄력적으로 구성 운영 사업 신청 기간:상시 지원 규모(명):주관기관별 200명 내외 비고:과정별 상이 연령:만 18세 ~ 34세 거주지 및 소득:이공계 대졸 미취업자 전문대졸 포함 로서  공고일 기준 만 34세 이하인 자   89.1.1 이후 출생자    8월 졸업예정자 포함  정부 실업대책 지원금을 수혜  자  동 사업에 하여 연수수당을 1회 이상 지급받은 자    자  대학원 재학  자는 제외 세부 추가 단서 사항  제한 대상 정부 실업대책 지원금을 수혜  자  동 사업에 하여 연수수당을 1회 이상 지급받은 자    자  대학원 재학  자는 제외 학력:이학  공학계열 대졸 전문대졸 포함  전공:이학계열  공학계열 취업 상태:미취업자 참여 제한 대상:정부 실업대책 지원금을 수혜  자  동 사업에 하여 연수수당을 1회 이상 지급받은 자    자  대학원 재학  자는 제외 신청 절차:  홈페이지에서 연수정보 연수과정 검색 신청에서 온라인 연수 신청   연수과정 검색 회원가입 연수생 정보 록 연수신청 주관기관   1단계  홈페이지를 통한 사업계획서 온라인 신청   2단계 신청서류 직접 제출  기우편접수 신청기간 내 도착분에 한함    회원가입 로그인 사업신청 온라인  신청서류 제출 오프라인  심사 및 발표:평가항목   사업목표 추진전략 명확성  사업능력  취업지원능력  사업비 적정성     전문연수  연관 자격증 취득 지원  교육과정 내 우선채용약정 기업 의견반영   사항  실제 직무와 연관성  전문연수의 현장반영  우수성    기업연수  우수한 중소 중견 우선채용 약정기업 보유여부  전문연수와 유 직무 보유 여부  기업과 연수생의 니즈를 반영한 기업연수 진행 체계 보유 여부    우대사항  가점항목  주관기관별 취업 목표인원 수에 하는 만큼의 우선 채용약정 체결 여부 주관 기관:과학기술정보통신부 미래인재양성과 운영 기관:한국산업기술진흥협회\'), Document(metadata={\'name\': \' K 디지털 산업 맞춤형 스마트팩토리 전문가 양성 과정\', \'source\': \'..\\\\data\\\\policy_result.json\'}, page_content=\'기관:경남 정책 분야:교육분야 지원 내용:  교육비 전액 무료 약 1 000만원 1인    훈련장려금 지급 최대 월 316 000원   출석 일수에  차 지급  국민취업지원제도 연계 시  수당 추가 지급 가능   미니프로젝트 2회  메인 프로젝트 1회 진행   실무이론 4개월  프로젝트 실습 2개월  프로젝트 실습   스마트공장 SW개발 선도기업 현직자와 함께하는 프로젝트 실습으로 실습 기간동안 현직 멘토 투입 5~6회    입사지원서  포트폴리오 제작 교육 진행   교육 종료 후 취업연계 지원 사업 신청 기간:2024년 12월02일 ~ 2024년 12월31일 비고:20241202~20241231 연령:만 19세 ~ 39세 거주지 및 소득:  만 39세 미만의 구직자 중 교육 종료 후 취업 가능자  국민내일배움카드 발급 가능자  대학 졸업 예정 자  재학생  휴학생 포함  졸업까지 남은 수업연한이 2년 이내인 자  신청 절차:한국품질재단 취업지원센터 온라인 신청 kcm.kfq.or.kr  주관 기관: 재 한국품질재단 운영 기관:주관기관과 동일\'), Document(metadata={\'name\': \' 재 부산강서구장학회 장학금 지원 사업\', \'source\': \'..\\\\data\\\\policy_result.json\'}, page_content=\'기관:부산 강서구 정책 분야:교육분야 지원 내용:   지원금액   고학생  1인당 1 000천원   대학생  1인당 2 000천원 사업 신청 기간:미정 연령:만 19세 ~ 39세 거주지 및 소득:  세대주  보호자가 장학금 신청일 현재 강서구에 거주하며  생활이 어려움에도 학업성적이 우수하거나 모범 적인 학교생활을 하고있는 고학교  대학교 재학  학생 추가 단서 사항:  저소득 가정 자녀 장학생  자격요건   기초생활수급자 가정   추천권자   강서구 행정복지센터    학업성적 우수 장학생    대학생  평점이 B학점 이상   추천권자   강서구 행정복지센터 기타 유익 정보:  신청방법  동행정복지센터 방문 신청 주관 기관:  재단법인 부산강서구장학회 운영 기관:  부산광역시 강서구 총무과\')], [{\'url\': \'https://jalanwang.tistory.com/1459\', \'content\': \'국가보훈처 제대군인지원센터, 사이버교육 대상 확인하고 지금 신청하세요 검색하기 폼 검색하기  국가보훈처 제대군인지원센터, 사이버교육 대상 확인하고 지금 신청하세요 국가보훈처 제대군인지원센터 를 통해 사이버교육 신청에 대한 안내를 받을 수 있습니다. 사이버교육 신청 : 국가보훈처 홈페이지의 [열린도우미] - [민원행정서비스] - [사이버교육 신청] 사이버교육 대상 : 전역자 및 전역예정자 사이버교육 수강신청 기간 : 전월 10일 09시부터 20일 24시까지 교재지원 : 1인당 6권, 본인부담금 50% 문의처 : 교재발송/서비스오류/기타기술지원/학습내용문의 - 멀티캠퍼스, 수강신청 자격 확인 및 교육대상자 선정 문의 - 서울제대군인지원센터 | 사이버교육 신청 | 국가보훈처 홈페이지의 [열린도우미] - [민원행정서비스] - [사이버교육 신청] | 교재발송/서비스오류/기타기술지원/학습내용문의 - 멀티캠퍼스 수강신청 자격 확인 및 교육대상자 선정 문의 - 서울제대군인지원센터 | 사이버교육 신청 | 국가보훈처 홈페이지의 [열린도우미] - [민원행정서비스] - [사이버교육 신청] | 교재발송/서비스오류/기타기술지원/학습내용문의 - 멀티캠퍼스 수강신청 자격 확인 및 교육대상자 선정 문의 - 서울제대군인지원센터\'}, {\'url\': \'https://blog.naver.com/PostView.nhn?blogId=harukomm&logNo=223087570026\', \'content\': \'블로그 블로그 검색 내 블로그  블로그 홈  블로그 메뉴 블로그 블로그 제대군인 사이버교육 대상 및 신청방법 (ft. 교재비, 수강신청, 과목, 기간, 수료) 바로 ""제대군인 사이버교육""에 대하여 알아보겠습니다. 국가보훈처 제대군인지원센터는 5년 이상 국토방위의 임무를 성실히 수행하고 전역한 중장기복무 제대군인의 취업역량 강화를 위해 직업능력개발 교육, 사이버연수원교육 등 다양한 교육을 국비로 실시하고 있습니다. 제대군인 사이버교육 대상 및 기준 제대군인지원센터(vnet) 회원으로 가입 제대군인지원센터(vnet) 회원으로 가입 제대군인 사이버교육 수강신청 및 승인 수강신청 및 교재구매 -전월 10일 09시 ~ 20일 24시 -vnet 로그인 -> 사이버연수원 로그인 -> 수강신청 -> 승인 -> 수강 -전월 21일 ~ 23일(3일) -전월 23일 ~ 24일 -서울제대군인지원센터 : 02)3480-6833 수강신청 자격확인 및 교육대상자 선정 제대군인 사이버교육 수강료 및 교재비 제대군인 사이버교육 신청절차 및 유의사항 신청 (신청인) 자격검증/결정 (제대군인지원센터) 이 블로그 전체 카테고리 글 검색 글 검색\'}]']",제대군인 사이버교육에서 지원되는 교재는 1인당 6권입니다. 이 교재비는 지원되지만 신청자는 50%의 본인 부담금이 있습니다. 추가적인 정보는 국가보훈처 제대군인지원센터의 홈페이지를 통해 확인할 수 있습니다.
제대군인 사이버교육 신청은 어느 사이트에서 합니까?,"['정책 이름: 제대군인 사이버교육', '신청 절차: 제대군인지원센터 사이버원 홈페이지에 접속해서 별도 회원가입한 강']",제대군인지원센터 사이버원 홈페이지,"['[Document(metadata={\'name\': \'제대군인 사이버교육\', \'source\': \'..\\\\data\\\\policy_result.json\'}, page_content=\'기관:국가보훈부 정책 분야:교육분야 지원 내용:1인당 월 3개  연 12개  과목 사이버교육  1인당 교재비 6권 지원 사업 신청 기간:상시 비고:상시 거주지 및 소득:전역자 중 제대군인제원센터 회원으로 가입되어 있거나 보훈 지 청에 제대군인으로 록된 사람  전역 예정자 중 제대군인지원센터 회원으로 가입되어 있거나 5년 이상 복무자로 각 군본부로부터 사이버교육 신청자로 통보되었거나 전직기본교육 수료증  연대장급 이상 추천서  전역예정을 증명할 수 있는 서류가 있는 자 취업 상태:미취업자 특화 분야:군인 추가 단서 사항:수강신청  교재구매   전월 10일 09시 ~ 20일 24시    vnet 로그인   사이버연수원 로그인   수강신청   승인   수강 신청 절차:제대군인지원센터 사이버연수원 홈페이지에 접속해서 별도 회원가입한 후 수강신청 심사 및 발표:제대군인지원센터에서 자격검증  결정 후 수강 가능 기타 유익 정보:  과정불성실 이수의  2개월간 수강신청 정지 패널티 적용 무료과정 포함    문의   서울제대군인지원센터 자격검증  대상자 선정 담당자  02 3480 6833   사이버교육연수원 멀티캠퍼스  교재발송  오류   문의  1544 9001 주관 기관:국가보훈처 운영 기관:서울제대군인지원센터\'), Document(metadata={\'name\': \'전북 사이버 도민강좌\', \'source\': \'..\\\\data\\\\policy_result.json\'}, page_content=\'기관:전북 정책 분야:교육분야 지원 내용:  전북사이버도민강좌   전북 도민에게 외국어 제2외국어   취업 자격증  취미 예술  인문교양  온라인 강좌 무료    다양한 분야의 전문화된 고품질 교육콘텐츠 을 통한 비대면 학습 기회    학습이력  학습정보관리  교육  사업 신청 기간:상시 비고:상시신청 거주지 및 소득:전북 도민 특화 분야:지역인재 신청 절차:전북시민대학 홈페이지 신청    주관 기관:전북특별자치도평생교육장학진흥원 운영 기관:전북특별자치도평생교육장학진흥원\'), Document(metadata={\'name\': \'의령군 청년센터 청춘만개   강사풀 모집\', \'source\': \'..\\\\data\\\\policy_result.json\'}, page_content=\'기관:경남 의령군 정책 분야:일자리분야 지원 내용:  강의시간   교육유형   정규    원데이     교육시간    평일  오전 10 00 ~ 12 00    평일  오후 14 00 ~ 17 00    평일  저녁 19 00 ~ 21 00    토요일  오전   오후    교육일정 추후 협의 가능    선발된 강사는 의령청년센터 강사풀에 재함 사업 신청 기간:상시 비고:상시 모집 연령:만 19세 이상 거주지 및 소득:  신청자격   연령  공고일 현재 만19세 이상   주소 성별  제한없음    분야 전문 자격증  학위를 가지고 있는 자   필수요건  하나 이상 충족     분야  12개월 이상의 실경력을 보유한 강의경력자    분야 박사 이상 학위를 보유한 강의경력자    분야  자격증 국가공인  민간 을 소지한 강의경력자   이외  분야에  연구실적  저서  업적과 전문성을 갖춘 강의경력자 추가 단서 사항:공고문 참고 참여 제한 대상:공고문 참고 신청 절차:  신청방법  이메일  우편  방문   이메일 주소  fog7640 naver.com   제목  제안제목 입력   첨부파일  강사지원서  강의계획서  제출서류  첨부 록    파일명  2024년 강의 제안 ooo 지원자 성명    우편 방문    우 52134 의령군 칠곡면 칠곡로 97 신포리 418 1번지    문의전화    055 574 9393 의령청년센터    방문 접수는 업무시간 9시 21시 에 가능   공휴일  점심시간 12시 13시   저녁시간 18 19시  제외 심사 및 발표:공고문 참고 제출 서류:공고문 참고 기타 유익 정보:공고문 참고 주관 기관:의령청년센터    055 574 9393  운영 기관:주관기관과 동일\'), Document(metadata={\'name\': \'서울시 대학생 아르바이트 사업\', \'source\': \'..\\\\data\\\\policy_result.json\'}, page_content=\'기관:서울 정책 분야:일자리분야 지원 내용:공고문 참조 사업 운영 기간:연 2회  여름겨울방학 중 6주 사업 신청 기간:미정 비고:  여름방학   2024. 6월 중   겨울방학 2024. 12월 중 연령:만 18세 ~ 39세 학력:대학 재학  대졸 예정 참여 제한 대상:  2023년 기준   평생교육법에 의한 원격대학  사내대학  전산원  평생교육원  평생교육시설  방송통신대학  사이버대학  국가평생교육진흥원  학점은행 교육기관 학생  해외대학 학생 신청 절차:  서울특별시 앱    서울특별시  누리집 분야별정보 행정 새소식 을  신청   gov news all  기타 유익 정보:  다산콜센터  120   인력개발과 교육팀  02 2133 5766  5767  5764    자치구는 별도로 대학생 아르바이트를 시행하오니 구청  동주민센터에서 아르바이트를 하고자 하는 대학생은 거주지의  구청으로 문의하시기 바랍니다. 주관 기관:서울시청 운영 기관:주관기관 동일\'), Document(metadata={\'name\': \'찾아가는 창업동아리 멘토링\', \'source\': \'..\\\\data\\\\policy_result.json\'}, page_content=\'기관:국방부 정책 분야:교육분야 지원 내용:  대상별 맞춤 교육과 집중 멘토링 지원 사업 신청 기간:상시 거주지 및 소득:  현역 신분의 장병 2~5명 구성된 팀 특화 분야:국군장병 추가 단서 사항:  직접 방문 멘토링  온라인 멘토링  일과 전 후  주말  공휴일 가능  신청 절차:  온라인신청   국방전직교육원 홈페이지  일자리지원   사업참가   창업멘토링   신청 기타 유익 정보:  일자리지원부 창업멘토링 담당031 760 9352 주관 기관:국방부 운영 기관:국방전직교육원\')], [{\'url\': \'https://blog.naver.com/PostView.nhn?blogId=harukomm&logNo=223087570026\', \'content\': \'블로그 블로그 검색 내 블로그  블로그 홈  블로그 메뉴 블로그 블로그 제대군인 사이버교육 대상 및 신청방법 (ft. 교재비, 수강신청, 과목, 기간, 수료) 바로 ""제대군인 사이버교육""에 대하여 알아보겠습니다. 국가보훈처 제대군인지원센터는 5년 이상 국토방위의 임무를 성실히 수행하고 전역한 중장기복무 제대군인의 취업역량 강화를 위해 직업능력개발 교육, 사이버연수원교육 등 다양한 교육을 국비로 실시하고 있습니다. 제대군인 사이버교육 대상 및 기준 제대군인지원센터(vnet) 회원으로 가입 제대군인지원센터(vnet) 회원으로 가입 제대군인 사이버교육 수강신청 및 승인 수강신청 및 교재구매 -전월 10일 09시 ~ 20일 24시 -vnet 로그인 -> 사이버연수원 로그인 -> 수강신청 -> 승인 -> 수강 -전월 21일 ~ 23일(3일) -전월 23일 ~ 24일 -서울제대군인지원센터 : 02)3480-6833 수강신청 자격확인 및 교육대상자 선정 제대군인 사이버교육 수강료 및 교재비 제대군인 사이버교육 신청절차 및 유의사항 신청 (신청인) 자격검증/결정 (제대군인지원센터) 이 블로그 전체 카테고리 글 검색 글 검색\'}, {\'url\': \'https://inmotion.tistory.com/1336\', \'content\': \'국가보훈처 제대군인지원센터, 사이버교육 신청 클릭하세요 검색하기 폼 검색하기  국가보훈처 제대군인지원센터, 사이버교육 신청 클릭하세요 _국가보훈처 제대군인지원센터_를 통해 사이버교육에 대한 정보를 알아볼까요? 사이버교육 신청 국가보훈처 홈페이지 접속 : 국가보훈처 홈페이지에 접속하여 [열린도우미] - [민원행정서비스] - [사이버교육 신청]을 클릭합니다. 수료 기준 : 학습 진도율 80% 이상, 학습기간 종료까지 과정진도 20% 미만일 경우 2개월간 수강 정지 국가보훈처 제대군인지원센터 를 통해 사이버교육 신청에 대한 안내를 받을 수 있습니다. | 사이버교육 신청 | 국가보훈처 홈페이지의 [열린도우미] - [민원행정서비스] - [사이버교육 신청] | 교재발송/서비스오류/기타기술지원/학습내용문의 - 멀티캠퍼스 수강신청 자격 확인 및 교육대상자 선정 문의 - 서울제대군인지원센터 | 사이버교육 신청 | 국가보훈처 홈페이지의 [열린도우미] - [민원행정서비스] - [사이버교육 신청] | 교재발송/서비스오류/기타기술지원/학습내용문의 - 멀티캠퍼스 수강신청 자격 확인 및 교육대상자 선정 문의 - 서울제대군인지원센터 동양생명 보험금 청구 절차, 필요한 서류, 간단히⋯\'}]']","제대군인 사이버교육에 대한 정보는 다음과 같습니다:

### 교육 개요
- **기관**: 국가보훈부
- **정책 분야**: 교육 분야
- **지원 내용**: 
  - 1인당 월 3개, 연 12개 과목 사이버교육 제공
  - 1인당 교재비 6권 지원
- **사업 신청 기간**: 상시
- **거주지 및 소득**: 
  - 전역자 중 제대군인지원센터 회원으로 가입되어 있거나 보훈 지청에 제대군인으로 등록된 사람
  - 전역 예정자 중 제대군인지원센터 회원으로 가입되어 있거나 5년 이상 복무자로 각 군본부로부터 사이버교육 신청자로 통보되었거나 전직기본교육 수료증, 연대장급 이상 추천서, 전역예정을 증명할 수 있는 서류가 있는 자
- **취업 상태**: 미취업자
- **특화 분야**: 군인

### 신청 절차
1. **신청 및 승인**
   - 전월 10일 09시 ~ 20일 24시 사이에 신청
   - vnet 로그인 후 사이버연수원 로그인
   - 수강신청 후 승인
2. **자격검증**
   - 제대군인지원센터에서 자격검증 및 결정 후 수강 가능

### 기타 정보
- **과정 불성실 이수의 경우**: 2개월간 수강신청 정지 패널티 적용
- **문의**: 서울제대군인지원센터 자격검증 담당자 (전화: 02-3480-6833), 사이버교육연수원 멀티캠퍼스 (전화: 1544-9001)

### 추가 안내
- 사이버교육 신청은 국가보훈처 홈페이지를 통해 가능하며, '열린도우미' - '민원행정서비스' - '사이버교육 신청' 메뉴를 통해 신청할 수 있습니다.
- 수료 기준은 학습 진도율 80% 이상이며, 학습기간 종료까지 과정 진도 20% 미만일 경우 2개월간 수강 정지됩니다.

이와 같은 내용을 바탕으로 제대군인 사이버교육에 대한 자세한 신청 방법과 요구 사항을 확인할 수 있습니다."
김해 긴급돌봄 지원사업 모집의 신청 기간은 언제인가요?,['사업 신청 기간:2024년 06월12일 2024년 12월31일'],2024년 06월 12일부터 2024년 12월 31일까지입니다.,"[""[Document(metadata={'name': '청년 면접 지원 사업 가평군 ', 'source': '..\\\\data\\\\policy_result.json'}, page_content='기관:경기 가평군 정책 분야:일자리분야 지원 내용:  지원내용   증명사진  헤어 메이크업  정장 상 하의  셔츠  블라우스  넥타이  구두   대여비 사업 신청 기간:상시 비고:  사업기간   2024. 4. ~ 12. 예산 소진 시까지    2024년 면접자 가능 연령:만 19세 ~ 39세 거주지 및 소득:  지원대상   신청일 현재 주민록상 가평군에 거주하는 19세 이상 39세 이하의 구직 청년 신청 절차:  가평군 홈페이지   신청서 다운로드  작성   증빙서류와 함께 일자리정책과 청년팀 로 직접  이메일 kws1049 korea.kr  제출 주관 기관:  가평군 일자리정책과 청년팀 031 580 4169 '), Document(metadata={'name': '5월 찾아가는 자기소개팅 대면 고양시 ', 'source': '..\\\\data\\\\policy_result.json'}, page_content='기관:경기 고양시 정책 분야:일자리분야 지원 내용:  내용   취업 전문 상담사와 함께하는 1 1 대면 컨설팅  진로  자소서  면접컨설팅  맞춤 상담    기간   2024년 5월 1일~2024년 5월 31일   일정   신청 후 상담사와 협의  60분  사업 신청 기간:상시 비고:  선착순 상시 접수 연령:만 18세 ~ 39세 거주지 및 소득:  18세~39세 고양시 거주 재학 재직 청년 누구나 주관 기관:  고양시 청취다방 031 8075 2870 '), Document(metadata={'name': '2024 동해시 청년도전지원사업', 'source': '..\\\\data\\\\policy_result.json'}, page_content='기관:강원 동해시 정책 분야:일자리분야 지원 내용:밀착상당  취창업 역량 강화  자신감회복     이수시 취창업 장려금 지급 사업 신청 기간:상시 지원 규모(명):선착순 90명 모집 비고:집중접수 기간   2.19. 월 ~ 연중   선착순 90명 연령:만 18세 ~ 39세 거주지 및 소득:최근 6개월 이상 취업  교육  직업훈련이 없는 만 18세~39세 동해  강원지역 거주청년 취업 상태:미취업자 신청 절차:온오프라인 접수   첨부 전단지 내 QR코드 스캔 구글 신청서 제출    동해시 청년도전지원센터 방문 주관 기관:동해시청 경제과 운영 기관:동해시청 경제과'), Document(metadata={'name': '함안군 초기창업 컨설팅 지원 창업상담 ', 'source': '..\\\\data\\\\policy_result.json'}, page_content='기관:경남 함안군 정책 분야:일자리분야 지원 내용:  일시   매월 셋째주 목요일  10 00   추진방법   사전 신청을 통한 대면 상담    상담내용   투자 비용 절감을 위한 추기창업 상담   창업지원  사회적경제기업 지원  창업  지원정책 안내   청년창업 생태계 기분 조성을 위한 초기 컨설팅  청년창업기 상시 발굴    장소   군청1층 민원실 사업 운영 기간:2024. 4. ~ 2024. 12. 사업 신청 기간:상시 비고:상시모집 거주지 및 소득:  대상   함안군민 연령제한 없음    청년 창업가 우선 상담 신청 절차:  모집   상시모집 1일 최대 2~4명    신청인원 초과시 익월 배정   신청방법   포스터 내 QR코드 신청 주관 기관:함안군 혁신전략담당관  055 580 2544  운영 기관:사회적협동조합 시드  055 715 5021 '), Document(metadata={'name': '중소기업 정규직 프로젝트 문경시 ', 'source': '..\\\\data\\\\policy_result.json'}, page_content='기관:경북 문경시 정책 분야:일자리분야 지원 내용:1. 개 요 가. 모집기간   2024. 3. 7. 목  ~ 예산 소진 시까지 선착순 모집  나. 사업기간    24. 1월 ~ 12월  다. 사 업 비   18 000천원 도비5 400  시비12 600  라. 자격조건   청년  미취업자  결혼이민자  새터민   마. 사 업 량   3명 기업당 1명   2. 사업내용  가. 대상기업   관내 소재 중소기업체  나. 인턴사원   주소지가 문경시인 청년  취업애로 계층  다. 지원 기간  내용   12개월  총600만원 기업 300만원  인턴 300만원  1  기업  고용지원금    인턴 2개월간 1월차 150만원  2월차 150만원  총 300만원 지급 2  인턴  근속장려금    정규직 전환일로부터 10개월간 3월차 150만원  10월차 150만원  총 300만원 지급    자세한 내용은 공고문을 참고해주세요 사업 운영 기간:2024 03 07~2024 12 31 사업 신청 기간:2024년 03월07일 ~ 2024년 12월31일 지원 규모(명):지원 규모   3명 1개 기업당 1명  비고:2024 03 07~2024 12 31 참여 제한 대상:첨부파일 공고문 참조 제출 서류:첨부파일 공고문 참조 주관 기관:경상북도 운영 기관:문경시청 일자리경제과 ')], [{'url': 'https://www.gimhae.go.kr/03360/00023/00024.web?gcode=1171&idx=2542052&amode=view', 'content': '공지사항 | 김해시청 > [종합소식]2024년 긴급돌봄 지원사업 제공기관 모집 공고 주 메뉴 닫기 과태료 및 범칙금 안내 차량등록사업소 소개 신고 및 확인 시민명예감사관 안내 신고 및 확인 안전신문고 소개 고향사랑기부제 소개 정보공개 신청 및 확인 공유재산 안내 공공데이터 제공제도 안내 및 신청 김해 소식 진영읍 소개 주촌면 소개 진례면 소개 한림면 소개 생림면 소개 상동면 소개 대동면 소개 동상동 소개 회현동 소개 부원동 소개 내외동 소개 북부동 소개 칠산서부동 소개 활천동 소개 삼안동 소개 불암동 소개 장유1동 소개 장유2동 소개 장유3동 소개 투데이김해 닫기 [종합소식] 2024년 긴급돌봄 지원사업 제공기관 모집 공고 [공고문] 2024년 경남 긴급돌봄 지원사업 제공기관 모집 공고문.hwp(91.5 KB) 변환중 ○\\xa0공\\xa0고\\xa0명\\xa0:\\xa02024년\\xa0긴급돌봄\\xa0지원사업\\xa0\\xa0 이전 보기 정책홍보모음. 인사이드 김해 닫기 50924 경상남도 김해시 김해대로 2401(부원동) 김해시청'}, {'url': 'https://godqhrhealth.com/entry/긴급돌봄-지원사업-가능-지역-확인하고-빠르게-신청', 'content': '긴급돌봄 지원사업 가능 지역 확인하고 빠르게 신청! 긴급돌봄 지원사업 가능 지역 확인하고 빠르게 신청! 긴급돌봄 지원사업 가능 지역 확인하고 빠르게 신청! 긴급돌봄\\xa0지원사업\\xa0가능\\xa0지역\\xa0확인하고\\xa0빠르게\\xa0신청! 이 사업은 질병이나 부상 등으로 인해 갑작스럽게 돌봄이 필요한 분들을 위해 마련된 서비스입니다. 긴급돌봄 서비스는 갑작스러운 상황에서 돌봄이 필요한 가정에 신속하게 도움을 주기 위한 프로그램입니다. 예를 들어, 부모가 아프거나 사고로 인해 아이를 돌볼 수 없는 경우, 이 서비스를 통해 전문적인 돌봄을 받을 수 있습니다. 올해부터는 누구나 이 서비스를 이용할 수 있도록 확대되었습니다. 긴급돌봄 서비스를 신청하는 방법은 매우 간단합니다! 전문 인력 배치 : 해당 지역에서 훈련받은 요양보호사 등이 가정에 방문해 신체활동 지원 등 기본 돌봄, 가사, 이동 지원 서비스를 제공합니다. Q1: 긴급돌봄 서비스는 언제까지 이용할 수 있나요? 삼성전자 주가전망 왜 하락\\xa0\\xa0(0)2024.09.19문화누리카드 잔액조회 빠르게\\xa0\\xa0(0)2024.09.16소상공인 전기요금 특별지원 빠르게!'}]""]","현재 제공된 정보에 따르면, 2024년 김해시의 긴급돌봄 지원사업에 대한 구체적인 신청 기간은 명시되어 있지 않습니다. 하지만, 일반적으로 긴급돌봄 서비스는 갑작스럽게 돌봄이 필요한 가정을 위해 신속하게 도움을 주기 위한 프로그램으로, 서비스 신청 방법이 간단하다고 언급되어 있습니다.

김해시청의 공지사항에서 제공된 자료를 통해 자세한 정보와 신청 방법을 확인할 수 있습니다. 또한, 긴급돌봄 서비스는 질병이나 부상 등으로 인해 갑작스럽게 돌봄이 필요한 상황에 맞춰 지원됩니다. 해당 서비스의 제공기관 모집 공고가 올라온 만큼, 관련 정보는 김해시청의 공식 웹사이트나 해당 부서에 직접 문의하여 확인하는 것이 좋습니다. 

문서에 기재된 다른 정책이나 프로그램에 대한 정보가 필요하시다면, 추가로 질문해 주시면 도움을 드리겠습니다."
김해 긴급돌봄 지원사업 모집의 주관 기관은 어디인가요?,['주관 기관:김해 생활보장과 055 330 4554'],김해 생활보장과입니다.,"[""[Document(metadata={'name': '가족돌봄청년 영케어러 의 돌봄부담 경감을 위한 사회적 돌봄사업', 'source': '..\\\\data\\\\policy_result.json'}, page_content='기관:광주 서구 정책 분야:복지.문화분야 지원 내용:  지원내용   돌봄 지원   돌봄지원사 파견 월 16시간 으로 청 소 년들의 돌봄부담 완화   추가지원이 필요한  사례회의를  월 16시간 이내 추가지원 가능   일상생활지원  가사지원  식사지원  만성질환돌봄  장애가족돌봄     내일희망   청 소 년들의 자립과 성장에 필요한 다양한 배움과 쉼 기회에 할 수 있도록 자립교육비 학원비    쉼여행비 지원 연 1회  50만원    사용계획서 제출 후 선정된 청 소 년 대상으로 본인 선결제 후 영수증빙   금액 지원   교육비의  기관에서 선결제 가능   그 외 상담를  자립.자활에 필요한 다양한 복지 연계   돌봄 대상자에 한하여 내일희망 지원 사업 운영 기간:2024년 08월 ~ 2025년 07월 사업 신청 기간:상시 비고:접수기간  상시모집 연령:만 13세 ~ 34세 거주지 및 소득:  지원대상  광주 서구에 실거주  돌봄대상자 중증질환  장애인  를 돌보고 있는 만13 ~ 34세의 청소년  청년   소득기준은 무관하나  다수의 사례 신청 시 중위소득 120% 미만 대상가정을 우선 선정 신청 절차:  신청방법   온라인신청   https   forms.gle n2AZbmEpEiczaVCs6   타기관 의뢰 신청 시 공고문  붙임2  첨부하여 공문과 함께 접수 문의   070 4418 7888 가족돌봄청년지원사업 담당자 김수아  심사 및 발표:  지원 대상자 선정절차 모집공고  서류접수   서류심사  가정방문상담   대상자 선정  결과안내   돌봄 지원   필요 시 돌봄 추가지원 내일희망  지원   점검  종결   사업 운영상황에  일부 변동 가능 기타 유익 정보:  기관의 지원항목에 되나 사회보장 혹은 타기관 지원과 중복되는 항목의  지원할 수 없음   단  대상자의 돌봄 상황  시급성에  중복지원 가능   허위사실을 기재하는  돌봄 종결될 수 있음 주관 기관:광주광역시 서구청 운영 기관:광주 서구지역사회보장협의체 070 4418 7888 '), Document(metadata={'name': '달리는 국민신문고', 'source': '..\\\\data\\\\policy_result.json'}, page_content='기관:국민권익위원회 정책 분야:.권리분야 지원 내용:지원내용  1. 지역형 이동신문고   고충이나 애로가 있어도 국민권익위원회에 직접 방문하기 어렵거나 인터넷 민원신청이 익숙하지 않은 지역 주민들을 찾아가 현장에서 모든 공공행정분야에  고충을 상담   법률구조공단  한국사회복지협의회  한국소비자원 과 민관협업을  생활 속 고충 문제도 한 장소에서 한꺼번에 상담   생활법률  긴급 복지 지원  소비자피해   2. 맞춤형 이동신문고   사회적 약자 예  복지사각 계층  외국인근로자  북한이탈주민 을 찾아가 특정 분야에 맞는 상담반을 구성하여 고충 상담 사업 신청 기간:미정 비고:지자체별 상이  홈페이지 확인  주관 기관:국민권익위원회 운영 기관:주관기관과 동일'), Document(metadata={'name': '무료법률상담', 'source': '..\\\\data\\\\policy_result.json'}, page_content='기관:경기 정책 분야:복지.문화분야 지원 내용:민사  가사  형사  시민 생활과 밀접한 분야의 법률 세무 노무 상담  을  법률적으로 어려움에 처해있는 청년들에게 도움이 될 것으로 보임. 사업 신청 기간:상시 비고:상시 주관 기관:경기도 운영 기관:경기도'), Document(metadata={'name': '청년축제 강북구 ', 'source': '..\\\\data\\\\policy_result.json'}, page_content='기관:서울 강북구 정책 분야:.권리분야 지원 내용:  청년의 날 청년주간 을 맞이하여 청년이 소통하고 즐길 수 있는  운영   청년사업 홍보부스  포토존  플리마켓 운영   지역 내 청년단체  대학교   운영   청년 힐링   지역 청년예술인 기반 문화공연  사업 신청 기간:미정 비고:청년의 날   매년 9월 세 번째 토요일 연령:만 19세 ~ 39세 거주지 및 소득:19~39세 강북구 거주  활동 청년 기타 유익 정보:강북구청 일자리청년과 02 901 2642 주관 기관:강북구청 일자리청년과 운영 기관:주관기관'), Document(metadata={'name': '청년 공간 운영', 'source': '..\\\\data\\\\policy_result.json'}, page_content='기관:부산 사하구 정책 분야:.권리분야 지원 내용:   지원내용 창업공간지원  창업교육  상담  인큐베이팅  멘토링  청년취업역량강화 교육  메이커  운영  사업 신청 기간:상시 연령:만 19세 ~ 39세 거주지 및 소득:  청년 누구나 추가 단서 사항:   주요기능 창업보육 청년활동지원    조성시설 입주공간  시제품제작실  세미나실  스터디룸  공유카페  영상작업실  참여 제한 대상:  없음 제출 서류:공고 확인 주관 기관:  사하구 일자리복지과')], [{'url': 'https://www.gimhae.go.kr/03360/00023/00024.web?gcode=1171&idx=2542052&amode=view', 'content': '공지사항 | 김해시청 > [종합소식]2024년 긴급돌봄 지원사업 제공기관 모집 공고 주 메뉴 닫기 과태료 및 범칙금 안내 차량등록사업소 소개 신고 및 확인 시민명예감사관 안내 신고 및 확인 안전신문고 소개 고향사랑기부제 소개 정보공개 신청 및 확인 공유재산 안내 공공데이터 제공제도 안내 및 신청 김해 소식 진영읍 소개 주촌면 소개 진례면 소개 한림면 소개 생림면 소개 상동면 소개 대동면 소개 동상동 소개 회현동 소개 부원동 소개 내외동 소개 북부동 소개 칠산서부동 소개 활천동 소개 삼안동 소개 불암동 소개 장유1동 소개 장유2동 소개 장유3동 소개 투데이김해 닫기 [종합소식] 2024년 긴급돌봄 지원사업 제공기관 모집 공고 [공고문] 2024년 경남 긴급돌봄 지원사업 제공기관 모집 공고문.hwp(91.5 KB) 변환중 ○\\xa0공\\xa0고\\xa0명\\xa0:\\xa02024년\\xa0긴급돌봄\\xa0지원사업\\xa0\\xa0 이전 보기 정책홍보모음. 인사이드 김해 닫기 50924 경상남도 김해시 김해대로 2401(부원동) 김해시청'}, {'url': 'https://www.anewsa.com/detail.php?number=2907010', 'content': '[서울=아시아뉴스통신] 장희연기자 송고시간\\xa02024-05-17 20:46 이에 경남도는 이런 어려움을 해소하고자 주(主)\\xa0돌봄자의 부재,\\xa0질병,\\xa0사고 등으로 긴급하고 일시적 돌봄 지원이 필요하나 기존 서비스로 돌봄을 받기 어려운 도민을 대상으로\\xa0▲돌봄 필요성\\xa0▲긴급성(질병,\\xa0부상 등이 갑자기 발생한 사유)\\xa0▲보충성(타 돌봄서비스 부재)의 세 가지 요건을 갖추면 소득 수준에 관계없이\\xa0누구나 서비스를 이용할 수 있도록 하였다. 서비스 신청 및 접수는 거주지역 읍면동 행정복지센터에서 할 수 있으며,\\xa0서비스 제공기관에서 현장 확인 후 시군에서 대상자를 선정하면 서비스를 이용할 수 있다. 특히 이용자의\\xa0편의를 제공하기 위해 병원 내 퇴원지원실 및 시군구(희망복지지원단,\\xa0노인의료요양통합돌봄팀 등)\\xa0추천서,\\xa0퇴원확인서 등으로 필요성이 확인되는 경우,\\xa0별도 현장 확인 없이 서비스를 이용할 수 있게 하였으며,\\xa0기존 서류만으로 확인이 어려운 경우에 한해 읍면동,\\xa0제공기관 등의 현장 확인을 거쳐 서비스를 지원한다.'}]""]",김해 긴급돌봄 지원사업 모집의 주관 기관은 김해시청입니다.
김해 긴급돌봄 지원사업 모집의 본인부담금 면제 대상은 누구인가요?,['지원 내용:  내용  신체활동  가사  이동지원     간  일적인 위기상황 1회당 총72간 30일 내    본인부담금  면제 급 차상위     100  위소득 160  초과'],차상위 및 소득 160% 초과 대상입니다.,"[""[Document(metadata={'name': '청년내일저축계좌 대구 ', 'source': '..\\\\data\\\\policy_result.json'}, page_content='기관:대구 정책 분야:복지.문화분야 지원 내용:  지원내용 3년만기  차상위 이하  본인적립금  이자   근로소득장려금 월 30만원    차상위 초과  본인적립금  이자   근로소득장려금 월 10만원     본인적립금   월 10만원 이상 자율저축 최대 50만원까지 가능  사업 신청 기간:미정 지원 규모(명):모집규모   7 500명 정도 비고:모집기간   2024. 5월 1회 모집  거주지 및 소득:  대상  차상위이하  만 15세 이상 ~ 만 39세 이하  차상위초과  만 19세 이상 ~ 만 34세 이하    근로기준  차상위이하  현재 근로 중이며 근로 사업소득 월 10만원 이상  차상위초과  현재 근로 중이며 근로 사업소득 월 50만원 초과~ 월 230만원 이하    가구소득   소득인정액이 기준 중위소득 100% 이하  차상위 이하  기준 중위소득 50% 이하  차상위 이하  기준 중위소득 50% 초과 ~ 100% 이하 특화 분야:일하는 차상위 이하  차상위 초과 청년 신청 절차:읍면동 주민센터 방문 신청 주관 기관:대구광역시 복지정책과 운영 기관: 재 한국자활복지개발원'), Document(metadata={'name': '의령군 전세보증금반환보증 보증료 지원사업', 'source': '..\\\\data\\\\policy_result.json'}, page_content='기관:경남 의령군 정책 분야:주거분야 지원 내용:신청인이 기 납부한 보증료의 전부  일부 최대 30만원 를  지자체가 신청인 본인 계좌로 이체 사업 운영 기간:2024. 4. ~ 2024. 12. 사업 신청 기간:2024년 04월01일 ~ 2024년 12월31일 비고:2024. 4. 1. ~ 2024. 12. 31. 거주지 및 소득:  지원대상 신청일 기준 보증 효력이 유효한 전세금반환보증 HUG  HF  SGI 에 가입한 임차보증금 3억원 이하 청년 5천만원  청년 외 6천만원  신혼부부 7.5천만원 이하인 무주택 임차인 참여 제한 대상:  지원 제외 대상   외국인  국내에 거주하지 않는 재외국민   민간임대주택에  특별법 에  록임대사업자의 임대주택에 거주하는 임차인   록임대사업자는 임대보증금보증 가입이 의무이며  임차인이 전세보증금반환보증 가입하는  임대인에게 보증료 청구 가능   임차인이 법인인  회사 지원 숙소     그 밖에 지자체장이 지원이 적합하지 않다고 판단하는  신청 절차:경남바로 신청 제출 서류:  보증료 지원 신청서  서약서   전세보증금 반환보증 보증서 사본 보증료  전세보증금 확인  보증료 납부 증빙서류 납부액 기재    임대차계약서 사본    부동산 기사항 전부 증명서   주민록본 임차주택 전입 여부    혼인관계증명서 혼인기간 7년이내 여부    본인명의 통장 사본    전년도 소득금액증명  기혼자는 배우자의 소득증빙 서류도 필수 제출    기타 군수가 필요하다고 인정하는 서류 주관 기관:국토교통부 운영 기관:의령군 소멸위기대응추진단 055 570 2924 '), Document(metadata={'name': '긴급돌봄 지원사업', 'source': '..\\\\data\\\\policy_result.json'}, page_content='기관:보건복지부 사회보장정보원 정책 분야:주거분야 지원 내용:  대상   질병  부상  주돌봄자 부재 으로 긴급하게 돌봄이 필요한 위기상황이 발생했으나 기존 로 돌봄을 받기 어려운 자   지원원칙  긴급성  갑작스러운 질병  부상  퇴원 후 주 한시적 돌봄이 필요  필요성  혼자서는 독립적으로 일상생활 이 불가능하나  돌볼 수 있는 가구원이 없는   보충성  다른 공적 돌봄를 받고 있지 않은     장소   대상자 가정    내용   재가 돌봄   목욕  신체청결  옷 갈아입히기  몸단장 지원  식사 도움  체위변경  안전관리  신체 수발지원  건강지원   가사 지원   청소  설거지  식사 준비  가정 내 일상생활을 위한 가정 환경 마련   이동 지원   장보기  은행 방문  외출 시 동행하여 이동 지원  업무보조      일정 자격을 갖춘 인력이 대상자의 가정을 방문해 기본돌봄 신체활동 지원   가사 이동 지원   지원 시간  최대 30일 이내  월 72시간의 범위 내에서 지원  하루 3시간씩  시 24일간  4시간씩  시 18일  가능   72시간 한도 내에서 개인의 선택에  희망하는 시간을 부여   1회 방문에  시간은 지원한도 내 개인의 필요에  선택하되 하루 최대 8시간까지  가능하도록 함    예외적으로 지자체장이 인정하는  긴급돌봄심의위원회 심의 1달 월 72시간  추가지원  월 144시간 최대 1달  가능 지원 기간  한시성이 특징인 만큼  시작 시부터 30일 내  을 마치도록 하고   예외적으로 1달 추가지원 시  추가지원 시부터 30일 내  종료 권장  지원이 종료되면 동일한 위기상황을 사유로 다시 지원은 불가    새로운 사유 발생 시  연간 1회에 한해 다시 지원 가능  가격  노인장기요양보험 단가에 준해 가격을 지불 자세한 금액은 지침  참조    30분만 은 불가  1시간 이상부터는 30분 단위  가능   야간 사례에 대해서는 지자체별로 기준을 마련해 가산 수가 30분당 1 500원 내외 를 받을 수 있으며 자 부담이 원칙     다만  본인부담 면제대상자에  가산 수가 부과여부는 지역 재원 을 감안해 지자체별로 달리 결정할 수 있음 사업 운영 기간:20240501~99991231 사업 신청 기간:2024년 06월01일 ~ 2024년 12월31일 비고:2024.06. ~ 2024.12. 거주지 및 소득:   긴급성  돌봄 필요성  보충성을 모두 충족한 자    긴급성 한시성    갑작스러운 질병  부상  퇴원 후 한시적 돌봄 필요   주 돌봄자의 갑작스러운 부재로 돌봄이 필요   타  신청 후 처리기간  기타 한시적 돌봄 필요  돌봄 필요성   혼자서는 돌깁적으로 일상생활 이 불가능하나  돌볼 수 있는 가구원이 없는    다른 공적 돌봄를 받고 있지 않고 할 수 있는 다른 공적 돌봄 가 없는   소득기준   소득과 관계없이  이 가능하나  건강보험료 납부 기준 중위소득에  본인부담금 발생  중위소득 160%이상은 전액 자기부담  특화 분야:요건 확인 추가 단서 사항:  대상자 선정조사 실시하여 대상자를 선정   조사방법   신청자의 가정에 방문하여 대면으로 요구로 평가표를  조사    선정기준  지원필요도를 상 14점 이상   중 6점 이상   하로 평가   상 으로 판단 시 대상자로 선정 가능   중 으로 판단 시 대상자의 희망에  긴급돌봄심위원회 실무위원회 를 개최하여 예외적으로 대상자로 승인 요청    하 로 판단 시  지원 불필요  결정선정된 대상자의 소득에  본인부담금을 차 부과 신청 절차:  방문접수  방문이 어려운  팩스  유선으로 가능    읍 면 동 행정복지센터로 신청접수    상담 가능  시 군 구  복지진흥사회원   접수기관 주민센터 기타 유익 정보:복지가족진흥사회원  052 243 3100  주관 기관:사회사업과 운영 기관:사회사업과'), Document(metadata={'name': '체불근로자 무료법률구조지원', 'source': '..\\\\data\\\\policy_result.json'}, page_content='기관:고용노동부 정책 분야:.권리분야 지원 내용:  체불근로자가 사업주를 상대로 민사절차를  임금채권을 확보할 수 있도록 법률구조공단에서 체불근로자에 대하여 무료로 소송을 지원하는 제도   무료법률구조 범위   체불임금 임금채권 청구  소송대리  소장 작성    단  소송에서 패소한 에는 상대방의 소송비용 변호사비용  은 지원하지 않음    지원 기관   고용노동부  법률구조공단 사업 신청 기간:상시 비고:접수기관 별 상이 거주지 및 소득:  임금  퇴직금 체불로 인한 피해 근로자 국내 거주 외국인 포함    임금  퇴직금 체불 당시 최종 3개월분의 월평균 임금이 400만원 미만인 자에 한함 신청 절차:  처리 절차   고용노동청에 체불 사건 접수   체불금품 조사   체불 금품 확정   체불 임금  사업주 확인서 발급   무료법률구조신청 법률구조공단    방문   각 지역 법률구조공단 지부 제출 서류: 공통  체불 임금 사업주확인서  근로자의 주민록본 각 1부   사업주가 법인인   법인기부본 1부 가압류  강제집행시 각 1부 추가    가압류하는     부동산 가압류  부동산기부본 토지  건물 각 1부   자동차 가압류  자동차록원부 1부   채권 가압류  사업주 소재지  영업장소  부동산기부본 1부  제3채무자 인적사항 법인인  기부본   가압류할 채권의 표시 주관 기관:고용노동부 운영 기관:법률구조공단 법률상담  무료법률상담센터'), Document(metadata={'name': '김해시 청년도전지원사업 자 모집', 'source': '..\\\\data\\\\policy_result.json'}, page_content='기관:경남 김해시 정책 분야:일자리분야 지원 내용:  지원내용   도전   수당 1인 50만원 지급   도전     5주 단위로 수당 1인 50만원 지급 중기 최대 170만원  장기 최대 300만원   취업인센티브 50만원  별도 사업 운영 기간:  운영기간   김해    도전 5주    10 21~11 24   도전  중기 1주  1기   7 22~11 3   도전  장기 25주  1기   3 18~9 8 사업 신청 기간:상시 비고:사업기간 항목의  운영기간  참고 연령:만 18세 ~ 39세 거주지 및 소득:  자 조건   최근 6개월 이상 취업 교육 직업훈련  이력이 없는 18~34세 청년    자립준비청년  아동복지시설  에서 보호받고 퇴소한 자 중 퇴소 5년 이내의 청년  퇴소 대상자임에도 불구하고 퇴소일을 연장한 18~34세 청년   아동양육시설  공동생활가정  가정위탁  아동보호치료시설  자립지원시설     지역특화청년  기타 지원의 필요성이 있다고 인정받은 39세 이하 청년  지역특화 조건으로 경남도민의  39세까지 가능 방문신청  참여 제한 대상:  제한 공통    고용보험법에  구직급여 실업급여 를 수급중이거나 지급이 끝난 날로부터 6개월이 지나지 아니한 자   국민취업지원제도에 하여 수혜  자 예외 조건이 있으므로 기관에  가능 여부 확인    재학생   학점은행제  사이버대학교  대학원  방송통신고 대 학교  포함 졸업예정자  졸업생  가능  신청 절차:  신청방법   문의   경남경영자총협회 청년도전지원사업팀 T.055 266 1934   신청   워크넷 work.go.kr  고용복지정책 청년도전지원사업 운영기관 선택 경남경영자총협회     워크넷 회원가입 필수  PC로만 신청 가능   창원 외 지역의 에도 운영기관 창원 경남경영자총협회 로 신청 주관 기관:고용노동부 운영 기관:경남경영자총협회 청년도전지원사업팀')], [{'url': 'https://notion2937.tistory.com/entry/긴급돌봄-지원사업-지원-대상-신청-방법-주의사항-총정리', 'content': '긴급돌봄 지원사업은 소득에 관계없이 누구나 신청할 수 있지만, 본인 부담금은 소득에 따라 차등 적용됩니다. 기초생활수급자 및 차상위계층: 본인 부담금 면제. 중위소득 160% 이하: 일부 본인 부담금 발생. 중위소득 160% 이상: 전액 본인 부담.'}, {'url': 'https://www.gimhae.go.kr/03360/00023/00024.web?gcode=1171&idx=2542503&amode=view', 'content': '공지사항 | 김해시청 > [종합소식]2024년 긴급돌봄 지원사업 이용자 모집 안내 주 메뉴 닫기 과태료 및 범칙금 안내 차량등록사업소 소개 신고 및 확인 시민명예감사관 안내 신고 및 확인 고향사랑기부제 소개 정보공개 신청 및 확인 공유재산 안내 공공데이터 제공제도 안내 및 신청 주촌면 소개 진례면 소개 한림면 소개 생림면 소개 상동면 소개 동상동 소개 회현동 소개 부원동 소개 내외동 소개 북부동 소개 칠산서부동 소개 삼안동 소개 불암동 소개 장유1동 소개 장유2동 소개 장유3동 소개 투데이김해 닫기 [종합소식] 2024년 긴급돌봄 지원사업 이용자 모집 안내 ❍\\xa0사\\xa0\\xa0업\\xa0\\xa0명:\\xa02024년\\xa0긴급돌봄\\xa0지원사업\\xa0 ❍\\xa0서비스내용:\\xa0신체활동\\xa0및\\xa0가사,\\xa0이동지원\\xa0서비스\\xa0등 ❍\\xa0이용절차:\\xa0신청\\xa0접수\\xa0및\\xa0대상자\\xa0자격확인(읍면동)\\xa0⇒\\xa0현장방문(제공기관)\\xa0⇒\\xa0대상자\\xa0\\xa0승인요청(서비스원)\\xa0⇒\\xa0대상자\\xa0선정\\xa0및\\xa0통지서\\xa0발송(시군구)\\xa0⇒\\xa0서비스\\xa0이용 인사이드 김해 닫기'}]""]","김해시의 긴급돌봄 지원사업에서 본인 부담금 면제 대상은 기초생활수급자 및 차상위계층입니다. 이들은 소득에 관계없이 본인 부담금이 면제되며, 중위소득 160% 이하인 경우 일부 본인 부담금이 발생합니다. 중위소득 160% 이상인 경우에는 전액 본인 부담이 적용됩니다. 

따라서, 긴급돌봄 서비스가 필요한 경우, 본인 부담금 면제를 받기 위해서는 기초생활수급자나 차상위계층으로 등록되어 있어야 합니다."
청년창업 특례보증 안양 정책의 보증한도는 얼마인가요?,"['정책 이름: 청년창업 특례보증 안양', '기관:경기 안양', '정책 분야:일리분야', '지원 내용:  보증한도   업체당 5천만원 이내   보증기간   3년 이내   보증기관   경기신용보증재    보다 상세한 내용은 공고문을 참고해주세요.', '사업 신청 기간:상', '비고:예산 소진 마감', '연령:만 19세   39세', '거주지 및 소득:  지원대상   소기업기본법에 의한 소기업으로서   안양에 사업록 을 필한 업체로 대표가 만 19세 이상 만 39세 이하이며 사업경력이 5년 이내인 기업', '신청 절차: 지원절차  기업 경기신용보증재  추천 안양  경기신용보증재  보증서발급 경기신용보증재', '주관 기관:  문의   경기신용보증재 안양지점 1577 5900  031 387 3525 내선 109']",업체당 5천만원 이내,"[""[Document(metadata={'name': '청년창업 특례보증 안양시 ', 'source': '..\\\\data\\\\policy_result.json'}, page_content='기관:경기 안양시 정책 분야:일자리분야 지원 내용:  보증한도   업체당 5천만원 이내   보증기간   3년 이내   보증기관   경기신용보증재단    보다 상세한 내용은 공고문을 참고해주세요. 사업 신청 기간:상시 비고:예산 소진시 마감 연령:만 19세 ~ 39세 거주지 및 소득:  지원대상   중소기업기본법에 의한 중소기업으로서   안양시에 사업자록 을 필한 업체로 대표자가 만 19세 이상 만 39세 이하이며 사업경력이 5년 이내인 기업 신청 절차: 지원절차 신청 기업 경기신용보증재단  추천 안양시  경기신용보증재단  보증서발급 경기신용보증재단  주관 기관:  문의   경기신용보증재단 안양지점 1577 5900  031 387 3525 내선 109  '), Document(metadata={'name': '경상남도 청년주택 임차보증금 이자 지원사업', 'source': '..\\\\data\\\\policy_result.json'}, page_content='기관:경남 정책 분야:주거분야 지원 내용:  사업내용   청년 주거 안정을 위한 주택임차보증금 융자 추천  이자 지원   임차보증금 1억원 이하  전용면적 60  이하의 주택 임차보증금 융자 추천 최대 9천만원 한도     4천만원 한도 주택 임차보증금 대출금의 이자 3% 지원 최장 6년간  사업 신청 기간:상시 비고:20240110~20241231 연령:만 19세 ~ 34세 거주지 및 소득:  경상남도에 소재한 임차보증금 1억원 이하  전용면적 60  이하인 주택  아파트  오피스텔  주거용 건물에 임대차계약 체결 예정자  계약체결 3개월 이내인 신청일 기준 만 19~34세 무주택 청년 신청 절차:온라인 신청 경남 바로   주관 기관:경상남도 건축주택과 운영 기관:주관기관과 동일'), Document(metadata={'name': '청년도전지원사업 안산시 ', 'source': '..\\\\data\\\\policy_result.json'}, page_content='기관:경기 안산시 정책 분야:일자리분야 지원 내용:  지원내용   도전 단 중 장기   중 선택   도전 단 중 장기 이수 시 각 50 150 250만원  인센티브 지급  구체적인  내용  이수요건 은 참고사이트  첨부파일  확인 필수 사업 신청 기간:상시 비고: 선착순 마감  연령:만 18세 ~ 39세 거주지 및 소득:  모집대상   구직단념청년   최근 6개월간 취업  교육 직업훈련  이력이 없는 만 18~34세 청년   자립준비청년   아동복지시설 에서 보호받고 퇴소한 자 중 퇴소 5년 이내의 청년    청소년복지시설 입퇴소 청년   청소년복지시설에서 6개월 이상 보호한 만18세~34세 청년    북한이탈청년   북한을 이탈한 자로서 만 18~34세 청년    지역특화   기타 지원의 필요성이 있다고 인정받은 39세 이하 청년    주 30시간 미만 생계형 아르바이트 근로 청년  폐업 자영업 청년  취업 문제로 졸업을유예 장기 휴학 대학생 1년 이상   다문화 가정 청년  미혼모 가정 청년  보호시설 독립 후취업지원  가 어려운 청년  정신과 진료를 받고 있거나 심리상담이 필요한 청년  기타 자세한 사항은 참고사이트  첨부파일을  상세 확인 필수 참여 제한 대상: 고용보험법에  구직급여를 받고있거나  구직급여의 지급이 끝난 날로부터 6개월이 지나지 아니한 자  국민취업지원제도 하여 수혜 자  고학교  대학교 학점은행제  사이버대학교  대학원 포함  재학 자 신청 절차:  온라인 접수   사 가치있는누림 전화 접수   워크넷 홈페이지 접속 후 청년도전지원사업 검색   QR 코드 접속 후 신청  첨부파일 확인    온라인 신청이 어려운     사 가치있는 누림 방문 접수 가능 기타 유익 정보:문의   사 가치있는누림 031 402 4145  안산시 청년정책관 031 369 1655  주관 기관:고용노동부  안산시 운영 기관:사단법인 가치있는누림'), Document(metadata={'name': '청년소상공인 희망키움 특례보증 이자지원 구리시 ', 'source': '..\\\\data\\\\policy_result.json'}, page_content='기관:경기 구리시 정책 분야:일자리분야 지원 내용:사업명   청년소상공인 희망키움 특례보증 이자지원 지원내용   특례보증  이자지원  융자규모   2 335백만원   기타 자세한 모집요강  세부 내용은 첨부된 공고문을 참고하시기 바랍니다. 사업 신청 기간:상시 비고:사업기간   2024년 4월 15일 ~ 자금 소진 시까지 연령:만 19세 ~ 39세 취업 상태:접수일 현재 구리시에 사업장을  사업자록일로부터 2개월 이상 영업  대표자 연령이 19세 이상 ~ 39세 이하인 관내 소상공인 주관 기관:경기신용보증재단 구리지점'), Document(metadata={'name': '전세보증금반환보증 보증료 지원사업 안내', 'source': '..\\\\data\\\\policy_result.json'}, page_content='기관:전북 정책 분야:주거분야 지원 내용:  지원 내용   전세보증금반환보증 보증료 지원 최대 30만원    청년  임차인   신청인이 기납부한 보증료 최대 30만원    청년 외 임차인   신청인이 기납부한 보증료의 90% 최대 30만원    신혼부부   임차인   신청인이 기납부한 보증료 최대 30만원    청년   19~39세    신청일 기준 혼인신고일이 7년 이내인 부부 연령 무관  사업 운영 기간:2024.3.4. 월  ~ 2024.12.31. 화  사업 신청 기간:상시 비고:2024 03 04 월  ~ 연중 연령:만 19세 ~ 39세 거주지 및 소득:  지원대상   신청일 기준 보증 효력이 유효한 전세보증금반환보증 HUG  HF  SGI 에 가입한 임차보증금 3억원 이하    연소득    청년 5천만원    청년 외 6천만원    신혼부부 7.5천만원 이하 무주택 임차인 참여 제한 대상:  제외대상   외국인  국내에 거주하지 않는 재외국민    민간임대주택에  특별법 에  록임대사업자의 임대주택에 거주하는 임차인   록임대사업자는 임대보증금보증 가입이 의무이며  만약 록임대사업자가 임대보증금보증에 들지 않고 임차인이 전세보증금반환보증에 가입한    민간임대주택에  특별법  제49조 제7항 제3조에  임대인에게 보증료 청구 가능   임차인이 법인인  회사 지원 숙소     그 밖에  지자체장이 지원이 적합하지 않다고 판단하는  신청 절차:  신청방법   오프라인   신청자 주소  전세물건 주소  관할 시군청 담당부서 방문 신청   지원절차   보증보험 가입  보험료 납부 신청자 보증기관    보증료 지원 신청 신청자 시군    지원대상 심사  결과 통지 시군  신청일로부터 30일 이내  연장이 필요한  신청인에게 통지 후 15일까지 연장    지원금 지급 시군 신청자  결과통지 후 15일 이내  제출 서류:  제출서류   보증료 지원 신청서  서약서  본인 명의 통장 사본   전세보증금반환보증 보증서  보증료 납부 증빙서류  납부액 기재    HUG와 SGI의  보증서에 보증료 기재되어 있으므로 별도 증빙서류 불필요   임대차계약서  부동산 기사항 전부증명서   주민록본  혼인관계증명서   전년도 소득금액증명 신청일이 7.1. 이전인  전전년도 소득금액증명    소득이 발생하지 않아 소득금액증명이 발급되지 않는 에는  사실증명 신고사실없음   제출   기혼자는 배우자의 소득증빙 서류도 필수 제출   모든 제출 서류는 신청일 기준 1개월 이내에 발급한 서류로 제출 주관 기관:국토교통부 운영 기관:국토교통부')], [{'url': 'https://www.anyang.go.kr/youth/selectBbsNttView.do?key=3543&bbsNo=1184&nttNo=363440', 'content': '안양청년정책 > 공지사항 상세보기 - 제목, 내용, 파일 정보 제공 안양시 청년창업 특례보증 지원 핫이슈 □\\xa0특례보증 개요 가. 사업기간 : 연중(보증규모 소진 시까지) 나. 보증대상 ❍ 안양시에 사업자등록 등을 필한 업체로 대표자가 만 19세 이상 만 39세 이하이며 사업경력이 5년 이내인 기업 다. 보증한도 : 업체당 5천만원 이내 가. 접수기간 : 연중 수시(보증규모 소진 시까지) 나. 접 수 처 : 경기신용보증재단 안양지점 다. 구비서류 : 신청서【별첨 1】, 주민등록 등본(미혼 또는 분리거주 시 가족관계증명서), 사업자등록증 사본, 사업자등록증명원, 납세증명서, 부가가치세 과세표준증명원, 사업장 임차계약서 사본(임차 시), 금융거래확인서(기존 대출은행) 등 hwp 파일 2024년 안양시 청년창업 특례보증 지원 계획 공고.hwp   미리보기 (파일크기 : 72.5KB, 다운로드 : 184회) 이전글 2024년 상반기 청년 전월세보증금 대출이자 지원 대상자 모집 안내(인터레스트 지원사업) 우)14053 경기도 안양시 동안구 시민대로 235(관양동) 안양시 운영 안양시 관련기관'}, {'url': 'https://post.naver.com/viewer/postView.naver?volumeNo=35110916&vType=VERTICAL', 'content': '보증한도는 최고 5천만원으로 최장 3년까지다. 중소기업·청년창업기업 특례보증은 경기신용보증재단 안양지점에 구비서류를 준비해 방문·접수하면 된다. 중소기업 육성자금 지원, 중소기업·청년창업기업 특례보증의 구비서류, 신청기한 등 자세한 사항은'}]""]","안양시의 청년창업 특례보증 정책에 대한 정보는 다음과 같습니다:

- **지원 기관**: 경기 안양시
- **정책 분야**: 일자리 분야
- **지원 내용**:
  - **보증 한도**: 업체당 5천만원 이내
  - **보증 기간**: 3년 이내
  - **보증 기관**: 경기신용보증재단
- **사업 신청 기간**: 상시 (예산 소진 시 마감)
- **지원 대상**: 
  - 만 19세 이상 만 39세 이하의 대표자를 가진 중소기업
  - 사업 경력이 5년 이내인 업체
  - 안양시에 사업자 등록을 필한 기업
- **신청 절차**: 
  1. 신청 기업이 경기신용보증재단에 추천 요청
  2. 경기신용보증재단에서 보증서 발급
- **문의**: 경기신용보증재단 안양지점 (전화: 1577-5900, 031-387-3525 내선 109)

구체적인 신청 방법이나 구비서류는 해당 정책의 공고문을 참고해야 합니다."
청년창업 특례보증 안양 정책의 보증기간은 어떻게 되나요?,"['정책 이름: 청년창업 특례보증 안양', '기관:경기 안양', '정책 분야:일리분야', '지원 내용:  보증한도   업체당 5천만원 이내   보증기간   3년 이내   보증기관   경기신용보증재    보다 상세한 내용은 공고문을 참고해주세요.', '사업 신청 기간:상', '비고:예산 소진 마감', '연령:만 19세   39세', '거주지 및 소득:  지원대상   소기업기본법에 의한 소기업으로서   안양에 사업록 을 필한 업체로 대표가 만 19세 이상 만 39세 이하이며 사업경력이 5년 이내인 기업', '신청 절차: 지원절차  기업 경기신용보증재  추천 안양  경기신용보증재  보증서발급 경기신용보증재', '주관 기관:  문의   경기신용보증재 안양지점 1577 5900  031 387 3525 내선 109']",3년 이내,"['[Document(metadata={\'name\': \'청년월세 한시 특별지원 사업 문경시 \', \'source\': \'..\\\\data\\\\policy_result.json\'}, page_content=\'기관:경북 문경시 정책 분야:주거분야 지원 내용:  대상자    청년기본법 상 청년 만 19~34세 이하 으로 부모님과 별도 거주하고  임차보증금 5천만원  월세 60만원 이하 주택에 거주하는 무주택자   지원한도   실제 납부하는 임대료를 최대 240만원 월 최대 20만원 까지 최대 12개월 회  동안 매월 분할 지원   지원자격   청년가구 소득 기준 중위소득 60% 이하  원가구 소득 기준 중위소득 100% 이하   신청기간    24.2. ~  25.2.   지급기간    24.2. ~  26.2. 사업 운영 기간:2024 02 26~2025 02 25 사업 신청 기간:2024년 03월01일 ~ 2025년 02월25일 지원 규모(명):실제 납부하는 임대료를 최대 240만원 월 최대 20만원 까지 최대 12개월 회  동안 매월 분할 지원 비고:2024 03 01~2025 02 25 연령:만 19세 ~ 34세 주관 기관:국토교통부 운영 기관:문경시청 일자리경제과 \'), Document(metadata={\'name\': \'청년마음 건강사업\', \'source\': \'..\\\\data\\\\policy_result.json\'}, page_content=\'기관:세종 정책 분야:복지.문화분야 지원 내용:  관내 청년을 대상으로 전문적인 심리상담   소득기준 없음     기간  3개월 재판정을  최대 1년까지 연장 가능  사업 신청 기간:2024년 01월01일 ~ 2024년 12월31일 비고: 24년 예산 소진시 까지 ~ 연령:만 19세 ~ 34세 거주지 및 소득:   대상  만19세~34세  1990.1.1.~2005.12.31.출생자  참여 제한 대상:  만19세~34세  1990.1.1.~2005.12.31.출생자  신청 절차: 신청방법  주민록상 읍 면 동 주민센터 방문    신청인  자 본인  친족  법정대리인 후견인    각 신분증 지참 제출 서류:  신분증  사회보장급여신청서  개인정보 동의서  붙임  주관 기관:세종시 운영 기관:세종시 지역사회 지원단\'), Document(metadata={\'name\': \'제9기 충북청년광장 구성 운영\', \'source\': \'..\\\\data\\\\policy_result.json\'}, page_content=\'기관:충북 정책 분야:.권리분야 지원 내용:  도정 청년정책제안 팀별 프로젝트 운영  청년정책 모니터링 활동  청년 중심 보장을 위한 간담회의  토론회  온라인 정책제안 추진 사업 운영 기간:2024. 1월 ~ 12월 사업 신청 기간:상시 비고:충북청년광장 회원모집 1월~2월    청년정책 제안 연중  연령:만 19세 ~ 39세 거주지 및 소득:도내 39세 이하 청년 신청 절차:충북청년희망센터 홈페이지 참고충북청년광장 회원모집 1월~2월  신청 심사 및 발표:충북청년희망센터 홈페이지 참고 제출 서류:충북청년희망센터 홈페이지 참고 주관 기관:충청북도 인구청년정책담당관 청년지원팀\'), Document(metadata={\'name\': \'청년층직업지도 CAP  \', \'source\': \'..\\\\data\\\\policy_result.json\'}, page_content=\'기관:고용노동부 정책 분야:교육분야 지원 내용:청년 취업준비생의 직업진로 선택을 지원하고  취업서류 작성  면접기술 강화  구직기술 강화 지원 사업 운영 기간:연중 사업 신청 기간:상시 지원 규모(명):각 집단별 15~18명 내외 비고:상시  단  과정별 상이  연령:만 15세 ~ 34세 거주지 및 소득:  만 15세 ~ 만 34세 이하 청년   청년구직자  대학생  청년은 누구나  가능 취업 상태:미취업자 신청 절차:   온라인  워크넷 WORK.GO.KR    고용복지정책   구직자취업역량 강화    선택 신청    오프라인  지역 고용센터를 방문   CAP  참가신청 접수   담당자와 협의     심사 및 발표:신청   대상자 선정    운영 제출 서류:별도 제출 서류 없음 기타 유익 정보:소요 기간   15~18명의 소그룹  1회 4일간 하루 6시간씩 진행 총 24시간  주관 기관:고용노동부 운영 기관:전국 고용센터 취업지원과 \'), Document(metadata={\'name\': \'청년일자리도약장려금 사업 2024  지원대상   사업주 \', \'source\': \'..\\\\data\\\\policy_result.json\'}, page_content=\'기관:고용노동부 정책 분야:일자리분야 지원 내용:  신규 채용 청년 1인당 월 최대 60만원씩 1년간 지원  최초 채용 후 2년 근속시 480만원 일시 지급 2년간 최대 12 00만원     24년  최초 1년은  60만원 12개월 지급  2년 근속시 480만원 일시 지급 사업 신청 기간:상시 지원 규모(명):   지원 한도  사업 신청 직전 월말부터 이전 1년간 평균 고용보험 피보험자 수의 50% 비수도권 지역은 100% 까지 지원 단  최대 30명  연령:만 15세 ~ 34세 거주지 및 소득:   지원 요건  정규직 채용 후 6개월 이상 고용유지  주 30시간 이상 근로  최저임금 이상 지급  고용보험 가입  신청 절차:   방법  청년일자리창출지원 사업 누리집에서 기업 소재지를 담당하는 운영기관을 지정하여  신청   온라인  승인 이후 청년을 채용하는 것이 원칙이며  사업  신청 전 청년을 먼저 채용한   3개월 이내 사업  신청을 해야 지원 가능    지원절차  사전  신청 운영기관  후 청년 채용  6개월 후 지원금 지급 주관 기관:고용노동부 운영 기관:지역별 운영 기관 별도 확인\')], [{\'url\': \'https://www.anyang.go.kr/youth/selectBbsNttView.do?key=3543&bbsNo=1184&nttNo=363440\', \'content\': \'안양청년정책 > 공지사항 상세보기 - 제목, 내용, 파일 정보 제공 안양시 청년창업 특례보증 지원 핫이슈 □\\xa0특례보증 개요 가. 사업기간 : 연중(보증규모 소진 시까지) 나. 보증대상 ❍ 안양시에 사업자등록 등을 필한 업체로 대표자가 만 19세 이상 만 39세 이하이며 사업경력이 5년 이내인 기업 다. 보증한도 : 업체당 5천만원 이내 가. 접수기간 : 연중 수시(보증규모 소진 시까지) 나. 접 수 처 : 경기신용보증재단 안양지점 다. 구비서류 : 신청서【별첨 1】, 주민등록 등본(미혼 또는 분리거주 시 가족관계증명서), 사업자등록증 사본, 사업자등록증명원, 납세증명서, 부가가치세 과세표준증명원, 사업장 임차계약서 사본(임차 시), 금융거래확인서(기존 대출은행) 등 hwp 파일 2024년 안양시 청년창업 특례보증 지원 계획 공고.hwp   미리보기 (파일크기 : 72.5KB, 다운로드 : 184회) 이전글 2024년 상반기 청년 전월세보증금 대출이자 지원 대상자 모집 안내(인터레스트 지원사업) 우)14053 경기도 안양시 동안구 시민대로 235(관양동) 안양시 운영 안양시 관련기관\'}, {\'url\': \'https://www.anyang.go.kr/youth/contents.do?key=3644\', \'content\': ""청년창업 특례보증 - 안양청년광장 주메뉴 토글 주메뉴 청년 ALL 지도 청년정보 청년정보 사이트 청년동아리 지원사업 청년상 시상 청년 자원봉사 프로그램 공모사업 청년 역량강화 프로그램 운영 안양1번가 청년공간 조성 청년인재등록 플랫폼 운영 역대 청년상 수상자 청년 어학·자격시험 응시료 및 수강료 지원 청년 일자리박람회 개최 대학 일자리센터 운영 지원 청년도전 지원사업 청년창업 청년창업 특례보증 청년창업 스케일업 안양 청년 전·월세보증금 대출이자 지원사업 안양 청년 이사비 지원 사업 안양 청년 학자금대출 연체자 신용회복 지원사업 청년 정신건강 외래치료비 지원 찾아가는 정신건강상담실 \'청년 비상구\' 안양문화예술인 지원사업 후기청소년 지원사업 주메뉴 닫기 위원회 소개 위원회 현황 청년창업 청년창업 청년창업 특례보증 청년창업 특례보증 청년창업 스케일업 안양 청년창업 특례보증 보증한도업체당 5천만원 이내 우)14053 경기도 안양시 동안구 시민대로 235(관양동) 안양시 운영 안양시 운영 선택 안양시 보건소 안양시 관련기관 안양시 관련기관 선택""}]']","안양시의 청년창업 특례보증 정책은 연중 운영되며, 보증규모 소진 시까지 신청이 가능합니다. 보증한도는 업체당 5천만원 이내로 설정되어 있습니다. 보증기간에 대한 구체적인 정보는 제공되지 않았으나, 일반적으로 특례보증의 경우 보증을 받은 후 사업이 지속되는 동안 보증의 유효성이 유지될 수 있습니다. 더 자세한 내용은 안양시청이나 경기신용보증재단 안양지점에 문의하시기 바랍니다."
청년창업 특례보증 안양 정책의 신청 절차는 어떻게 되나요?,"['정책 이름: 청년창업 특례보증 안양', '기관:경기 안양', '정책 분야:일리분야', '지원 내용:  보증한도   업체당 5천만원 이내   보증기간   3년 이내   보증기관   경기신용보증재    보다 상세한 내용은 공고문을 참고해주세요.', '사업 신청 기간:상', '비고:예산 소진 마감', '연령:만 19세   39세', '거주지 및 소득:  지원대상   소기업기본법에 의한 소기업으로서   안양에 사업록 을 필한 업체로 대표가 만 19세 이상 만 39세 이하이며 사업경력이 5년 이내인 기업', '신청 절차: 지원절차  기업 경기신용보증재  추천 안양  경기신용보증재  보증서발급 경기신용보증재', '주관 기관:  문의   경기신용보증재 안양지점 1577 5900  031 387 3525 내선 109']",기업 경기신용보증재 추천 안양 경기신용보증재 보증서발급 경기신용보증재,"[""[Document(metadata={'name': '청년마음 건강사업', 'source': '..\\\\data\\\\policy_result.json'}, page_content='기관:세종 정책 분야:복지.문화분야 지원 내용:  관내 청년을 대상으로 전문적인 심리상담   소득기준 없음     기간  3개월 재판정을  최대 1년까지 연장 가능  사업 신청 기간:2024년 01월01일 ~ 2024년 12월31일 비고: 24년 예산 소진시 까지 ~ 연령:만 19세 ~ 34세 거주지 및 소득:   대상  만19세~34세  1990.1.1.~2005.12.31.출생자  참여 제한 대상:  만19세~34세  1990.1.1.~2005.12.31.출생자  신청 절차: 신청방법  주민록상 읍 면 동 주민센터 방문    신청인  자 본인  친족  법정대리인 후견인    각 신분증 지참 제출 서류:  신분증  사회보장급여신청서  개인정보 동의서  붙임  주관 기관:세종시 운영 기관:세종시 지역사회 지원단'), Document(metadata={'name': '군복무 청년 상해보험 지원', 'source': '..\\\\data\\\\policy_result.json'}, page_content='기관:충남 공주시 정책 분야:복지.문화분야 지원 내용:  공주시에 주소를 둔 청년  군복무 중 상해보험 자동 가입  지원  11개 항목 보장 상해  질병 사망  후유장해  정신질환위로금  수술비   사업 운영 기간:  2024. 3. ~ 2025. 2. 사업 신청 기간:상시 지원 규모(명):  약 614명 비고:  상시 연령:만 19세 ~ 45세 거주지 및 소득:  공주시로 주소가 되어있는 현역 군복무 청년 추가 단서 사항:  보험사 직접 안내 신청 절차:  보험사에 전화 신청 심사 및 발표:  심사 후 개별 통보 주관 기관:  공주시 운영 기관:  메리츠화재해상보험 '), Document(metadata={'name': '청소년산모 임신 출산 의료비 지원', 'source': '..\\\\data\\\\policy_result.json'}, page_content='기관:보건복지부 사회보장정보원 정책 분야:복지.문화분야 지원 내용: 임신확인서 로 임신이 확인된 만 19세 이하의 청소년산모를지원합니다. 사업 운영 기간:20110101~99991231 사업 신청 기간:상시 지원 규모(명):임신 1회당 120만원이내의 의료비를 지원합니다. 비고:수시 거주지 및 소득:만 19세 이하 산모로  청소년산모 임신 출산 의료비 지원  신청자를 지원합니다. 임신확인서 상 임신확인일 기준으로 만 19세 이하까지 지원 신청 절차:우편  인터넷 주관 기관:출산정책과 운영 기관:출산정책과'), Document(metadata={'name': '자립준비청년 상담센터', 'source': '..\\\\data\\\\policy_result.json'}, page_content='기관:보건복지부 아동권리보장원 정책 분야:.권리분야 지원 내용:  각종 자립 정보 문의  도움 필요 시 연락 가능한 자립준비청년 전용 콜센터 운영  전문상담사 배치 사업 운영 기간:   22년도 4분기 콜센터 운영 계획 수립    23년도 1분기 콜센터 운영 업체 선정  운영 준비  운영 개시   23년도 2분기 콜센터 운영 계속  사업 신청 기간:상시 지원 규모(명):  전국 00명 거주지 및 소득:  보호종료를 앞 자립정보가 필요한 보호대상아동  아동양육시설 공동생활가정 가정위탁 에서 보호종료된 자립준비청년 특화 분야:자립준비청년 추가 단서 사항:  방법  평일 9시 ~ 18시 상담 가능   전화상담   1855 2455 온라인 상담   아동권리보장원 아동자립지원  카카오톡 채널 1 1 채팅 상담   18시 이후부터는 익일 순차적으로 상담이 진행 신청 절차:   1855 2455 전화 문의   아동권리보장원 아동자립지원  카카오톡 채널 문의 기타 유익 정보:  공공 민간 기관 자립지원 사업에  정보는  자립지원 활동 가이드북 에서 확인하실 수 있으며  분야별 자립정보는  자립정보북 에서 확인하실 수 있습니다. 주관 기관:  보건복지부 운영 기관:  아동권리보장원'), Document(metadata={'name': '부모급여 지원', 'source': '..\\\\data\\\\policy_result.json'}, page_content='기관:보건복지부 정책 분야:복지.문화분야 지원 내용:  0세 월 100만원  1세 월 50만원   신청 에  현금  바우처 보육료  종일제 돌봄 로 지급.   어린이집  시 영유아보육로로 신청  종일제 돌봄  시 종일제 아이돌봄으로 신청 필요   바우처 보육료  종일제아이돌봄  지원금액이 부모급여 지원금액보다 적은  차액 현금으로 지원 사업 신청 기간:2024년 01월15일 ~ 2024년 12월31일 비고:20240115~20241231 거주지 및 소득: 민국 국적을 가진 0~1세 아동을 둔 부모  22년 이후 출생아부터 지원  신청 절차:온라인 홈페이지    신청 제출 서류:  사회보장급여 신청 변경 서  출산  통합 처리 신청서   아동 명의  부모 의 명의 통장 사본 주관 기관:보건복지부 운영 기관:보건복지부')], [{'url': 'https://beboy.co.kr/안양시-청년창업-특례보증/', 'content': '경기도 안양시 청년창업 특례보증 조건 신청방법 - 솔루치오네 블로그 경기도 안양시 청년창업 특례보증 조건 신청방법 안양시 청년창업 특례보증 안양시 청년창업 특례보증 ▶ 안양시 관내 사업자등록을 필한 중소기업으로서, 안양시 중소기업육성자금 지원 대상 565개 업종 해당 기업 중 대표자가 만 19세 이상 39세 이하, 사업경력 5년 이하인 기업 ▶ (지원대상) 안양시 관내 사업자등록을 필한 중소기업으로서, 안양시 중소기업육성자금 지원 대상 565개 업종 해당 기업 중 대표자가 만 19세 이상 만 39세 이하, 사업경력 5년 이하인 기업 ▶ (접수처) 경기신용보증재단 안양지점(☎1577 – 5900) ▶ 방문 신청 : 경기신용보증재단 안양지점(☎1577 – 5900) ※ 아래 정부24 홈페이지에서 안양시 청년창업 특례보증 상세정보에 대해 확인할 수 있습니다. ▶ 경기신용보증재단 안양지점(☎1577 – 5900) ▶ 경기신용보증재단 안양지점(☎1577 – 5900) 경기도 안양시 어린이집 입학준비금 지원 조건 신청방법'}, {'url': 'https://dingdo.tistory.com/1686', 'content': '2023 안양시 청년창업 특례보증 지원 신청 방법 2023 안양시 청년창업 특례보증 지원 신청 방법 안양시 청년창업 특례보증 지원   가. 신청일 현재 대표자 배우자 포함)가 금융기관으로부터 신용불량 거래처로 분류되어 있는 경우/여신거래 불가능 업체)   나. 신청일 현재 사업장 또는 대표자의 거주 주택이 압류, 가압류 가처분 또는 경매 진행 중인 경우   다. 신청일 현재 국세 및 지방세를 체납하고 있는 경우   4. 특례보증 신청 및 접수 가. 대상자 결정 : 경기신용보증재단 접수 및 기업의 경영상황, 사업 계획, 경영자 신뢰도 등을 검토• 평가 후 안양시 추천, 경기신용보증재단 특례보증 결정   2023 안양시 청년창업 특례보증 지원, 2023 안양시 청년창업 특례보증 지원 신청, 2023년 안양시 청년창업 특례보증 지원, 안양시 청년 사업, 안양시 청년 창업지원, 안양시 청년창업 특례보증 지원, 안양시 청년창업 특례보증 지원 신청 방법, 청년 창업지원금, 청년 창업지원제도, 청년창업 특례보증'}]""]","안양시 청년창업 특례보증의 신청 절차는 다음과 같습니다:

1. **신청 자격 확인**: 신청자는 안양시 관내에서 사업자등록을 마친 중소기업의 대표로, 만 19세 이상 39세 이하이며 사업 경력이 5년 이하인 기업이어야 합니다. 또한, 금융기관으로부터 신용불량으로 분류되지 않아야 하며, 사업장 또는 대표자의 거주 주택이 압류, 가압류, 경매 진행 중이지 않아야 하고, 국세 및 지방세를 체납하고 있지 않아야 합니다.

2. **신청 방법**: 신청자는 경기도 안양시의 경기신용보증재단 안양지점에 방문하여 신청할 수 있습니다. 전화 번호는 1577-5900입니다. 

3. **서류 제출**: 신청 시 필요한 서류를 준비하여 제출해야 합니다. 필요한 서류 목록은 경기신용보증재단에서 확인할 수 있습니다.

4. **접수 및 평가**: 경기신용보증재단에 신청서가 접수되면, 기업의 경영상황, 사업 계획, 경영자 신뢰도 등을 검토 후 안양시 추천 및 특례보증 결정이 이루어집니다.

5. **결과 통보**: 심사 결과는 개별적으로 통보됩니다.

자세한 사항은 경기신용보증재단 안양지점에서 확인하시기 바랍니다."
보호종료아동 립당 지급 정책의 지원 내용은 무엇인가요?,"['정책 이름: 보호종료아동 립당 지급', '지원 내용: 매월 50만원 현금지원 최대 5년']",매월 50만원 현금지원 최대 5년,"[""[Document(metadata={'name': '보호종료아동 자립수당', 'source': '..\\\\data\\\\policy_result.json'}, page_content='기관:보건복지부 정책 분야:주거분야 지원 내용:  아동복지시설  가정위탁 보호종료아동 자립수당 지급 1인당 매월 50만원  사업 신청 기간:상시 비고:상시 거주지 및 소득:아동복지시설  가정위탁 보호종료 5년 이내 아동 중 다음 사항에 모두 하는    만18세 이후 만기  연장 보호 종료된 자 단  18.8월 이후 보호종료된 자    보호종료일 기준으로  과거 2년 이상 연속하여 보호를 받은 자 특화 분야:보호종료아동 추가 단서 사항:아동복지시설  가정위탁의 보호종료 5년 이내 아동만 가능 신청 절차:  방문 신청   주민센터   관할 주민센터 문의  방문 신청 심사 및 발표:관할 시군구청에서 조사  가격을 심사 제출 서류:1. 보호종료아동 자립수당 지급 신청서 1부. 2. 신분증  통장사본 1부. 3. 사이버 강의 이수증 1부. 서민금융진흥원 금융교육포털에서  보호종료아동 자립교육  강의 이수 후 이수증 출력  기타 유익 정보:문의처 보건복지상담센터  129  주관 기관:보건복지부 아동권리과 운영 기관:읍면동 주민센터'), Document(metadata={'name': '자립준비청년 자조모임 바람개비서포터즈 ', 'source': '..\\\\data\\\\policy_result.json'}, page_content='기관:보건복지부 아동권리보장원 정책 분야:.권리분야 지원 내용:  바람개비서포터즈 자립준비청년 를 위한 역량강화 교육  전문가 멘토링   보호대상아동 자립교육 멘토링 활동 사전교육   자립준비청년 지역별 맞춤형 자립역량강화교육   분야별 전문가와 자립준비청년을 연계하여 특강  소규모  1 1 멘토링 지원   보호대상아동 대상 자립교육  자립멘토링   아동복지시설 가정위탁 보호대상아동에게 자립선배로서 경험  노하우  정보  교육   바람개비서포터즈 자조모임   자립준비청년의 심리 정서적 지지  정책 제안 을 위한 자발적 교류활동 지원   월별 최소 1회 이상 활동실적이 있는 바람개비서포터즈에게  수당 지급   바람개비서포터즈 전국 워크숍  대표회의 운영      세부  내용은 각 지역별 자립지원전담기관 문의 사업 운영 기간:2011년~ 사업 신청 기간:상시 거주지 및 소득:보호연장아동  자립준비청년만  가능 신청 절차:각 지역별 자립지원전담기관 문의   제출서류 작성  접수 기타 유익 정보:각 지역별 자립지원전담기관 홈페이지 혹은 전화 문의 붙임 첨부파일 참고  주관 기관:보건복지부 운영 기관:아동권리보장원'), Document(metadata={'name': '울산 북구 아이돌봄 지원사업', 'source': '..\\\\data\\\\policy_result.json'}, page_content='기관:울산 북구 정책 분야:복지.문화분야 지원 내용:  위 치   각 가정   운영인력   전담인력 5명  아이돌보미 200명   내용  사업대상   양육공백이 발생한 관내 12세 이하 아동  소득수준에  가구 유형별로 차하여 정부지원   영아종일제   생후 3개월 이상 ~ 36개월 이하 영아   시간제   생후 3개월 ~ 12세 아동  기본형  종합형으로 구분   질병감염아동지원   법정 전염성  유행성 질병에 감염된 12세 이하의 시설  아동   기관연계   사회복지시설  학교  유치원  보육시설 의 아동 사업 운영 기간:  사업기간   연중 사업 신청 기간:상시 지원 규모(명):800명 주관 기관:울산광역시 북구 건축정책과 여성정책팀 052 241 7674  운영 기관:주관기관과 동일'), Document(metadata={'name': '가정양육수당 지원사업', 'source': '..\\\\data\\\\policy_result.json'}, page_content='기관:교육부 정책 분야:.권리분야 지원 내용:취학 전 24개월 이상 86개월 미만 아동에게 월 10만원을 지원   부모급여 도입에  0~23개월 아동은 부모급여를 지원하고  24개월 이상부터 가정양육수당을 지원   장애아동  농어촌아동은 연령별로 차 지원 장애아동 10~20만원  농어촌아동 10~15.6만원  사업 신청 기간:상시 비고:상시 거주지 및 소득:  어린이집 유치원 특수학교 포함  종일제 아이돌봄 을 하지 않고 가정에서 양육되는 영유아로서 초학교 미취학 24개월 이상~86개월 미만 아동을 대상으로 지원   부모급여 도입에  0~23개월 아동은 부모급여를 지원하고  24개월 이상부터 가정양육수당 지원    초학교 취학년도 2월까지 최대 86개월 미만  지원    소득 수준에 상관없이 지원 학력:고졸 미만 고교 재학 고졸 예정 고교 졸업 대학 재학 대졸 예정 대학 졸업 석 박사 전공:인문계열 사회계열 상경계열 이학계열 공학계열 예체능계열 농산업계열 취업 상태:재직자 자영업자 미취업자 프리랜서 일용근로자 창업자 단기근로자 영농종사자 특화 분야:중소기업 여성 저소득층 장애인 농업인 군인 지역인재 추가 단서 사항:의 변경 예  양육수당   보육료  을 원할 때에는 반드시  변경신청절차 를 완료하여야만 변경된 사비스 지원받을 수 있음    변경 시  지원 기준이 상이할 수 있으므로 사전에 반드시 변경신청 지원기준을 확인 후 변경신청 필요   보육료  유아학비   양육수당 변경신청시   신청일이 15일 이전   신청 월부터 양육수당 지원   신청일이 16일 이후   신청 익월부터 양육수당 지원   종일제 아이돌봄   양육수당 변경신청 시   신청 익월부터 양육수당 지원 신청 절차:읍  면  동 행정복지센터에 방문  복지로 www.bokjiro.go.kr   신청을  온라인으로 신청 가능   복지로 온라인신청 경로   복지로 로그인    신청   복지 신청   복지급여 신청   영유아   양육수당 가정양육    복지로의 신청 온라인 은 영유아의 부모만 신청이 가능하므로 신청이 불가한  방문 신청을 해주시기 바랍니다. 주관 기관:교육부 영유아재정과 운영 기관:교육부 영유아재정과'), Document(metadata={'name': '부모급여 지원', 'source': '..\\\\data\\\\policy_result.json'}, page_content='기관:보건복지부 정책 분야:복지.문화분야 지원 내용:  0세 월 100만원  1세 월 50만원   신청 에  현금  바우처 보육료  종일제 돌봄 로 지급.   어린이집  시 영유아보육로로 신청  종일제 돌봄  시 종일제 아이돌봄으로 신청 필요   바우처 보육료  종일제아이돌봄  지원금액이 부모급여 지원금액보다 적은  차액 현금으로 지원 사업 신청 기간:2024년 01월15일 ~ 2024년 12월31일 비고:20240115~20241231 거주지 및 소득: 민국 국적을 가진 0~1세 아동을 둔 부모  22년 이후 출생아부터 지원  신청 절차:온라인 홈페이지    신청 제출 서류:  사회보장급여 신청 변경 서  출산  통합 처리 신청서   아동 명의  부모 의 명의 통장 사본 주관 기관:보건복지부 운영 기관:보건복지부')], [{'url': 'https://utopiaeuro.com/보호종료아동-자립수당-지급-사업-정부-정책을-알/', 'content': '자립수당 지급 지원대상 . 보호종료아동 자립수당 지급 사업의 지원대상은 다음과 같습니다. ㆍ 아동복지시설, 가정위탁 보호종료 5년 이내 자립준비청년(보호종료아동)을 지원 합니다. * 아동복지시설이란 「아동복지법」 제52조에 따른 아동양육시설, 아동일시보호시설, 아동보호치료시설, 공동'}, {'url': 'https://m.blog.naver.com/taenafit/222430108250', 'content': '◈ (자립역량) ▴고등교육 기회 보장(장학금 및 기숙사 입주요건 확대 등) ▴취업 지원(국민취업지원제도, 청년도전지원사업 연계)▴기술훈련 확대(마이스터고 진학기회, 내일배움카드 훈련비 지원 우대) □ 진학기회 확대 : 고등교육 기회, 안정적 학업여건 지원 등 □ 직업경험 및 고용기회 제공 : 국민취업지원제도, 전문기술 훈련 등 (개요) 4년 주기 표본조사, (대상) 보호종료아동, 보호종료 직전의 만 17세 등 3,836명, (내용) ①건강, ②심리·정서, ③사회적 관계, ④주거, ⑤교육, ⑥고용 및 경제, ⑦서비스 이용 등 ⇒ (확대) 안정적 자립 준비를 위해 보호연장아동에게도 LH 전세·매입·건설임대주택* 및 주거비 등 공공주거 지원 ⇒ (제도개선) 심리상담·치료채활 효과 향상을 위한 보호(종료)아동 심리지원 사업 및 상담서비스 지원 확대(’22~) ⇒ (제도개선) 보호아동 심리지원사업 통합 및 상담·치료, 사례관리 등 대상자 중심의 체계적 심리지원 서비스 제공방안 마련(’21, 연구추진) ⇒ (확대) 보호종료아동·종사자 대상으로 지역사회 정신건강복지센터의 ‘청년 마음건강 프로그램’ 등 제도 홍보 및 연계 지원(`22~)'}]""]","보호종료아동 자립수당 지급 정책의 지원 내용은 다음과 같습니다:

1. **지원대상**: 아동복지시설이나 가정위탁 보호 종료 후 5년 이내의 자립준비청년(보호종료아동)에게 지원됩니다.

2. **지원금액**: 1인당 매월 50만원이 지급됩니다.

3. **신청 기간**: 연중 상시 신청이 가능하며, 신청 절차는 관할 주민센터를 통해 진행됩니다.

4. **거주지 및 소득 기준**: 아동복지시설 또는 가정위탁에서 보호 종료된 지 5년 이내의 아동으로, 만 18세 이후 보호가 종료된 자가 해당합니다.

5. **신청 절차**: 
   - 방문 신청: 관할 주민센터에 직접 방문하여 신청합니다.
   - 제출 서류: 
     1. 보호종료아동 자립수당 지급 신청서
     2. 신분증
     3. 통장 사본
     4. 사이버 강의 이수증 (보호종료아동 자립교육 강의를 이수한 후 출력)

6. **심사 및 발표**: 관할 시군구청에서 신청자의 자격을 조사하고 심사한 후, 결과를 발표합니다.

7. **문의처**: 보건복지상담센터(129)에서 추가적인 문의가 가능합니다.

이 정책은 보호종료아동의 자립을 지원하여, 그들이 사회에 잘 적응하고 경제적으로 자립할 수 있도록 돕기 위한 목적으로 시행되고 있습니다."
대구에서 보호종료아동 립당 지급 정책에 신청할 수 있는 연령은 어떻게 되나요?,"['정책 이름: 보호종료아동 립당 지급', '연령: 만 18세 - 29세']",만 18세 - 29세,"['[Document(metadata={\'name\': \'울산 보호종료아동 자립수당\', \'source\': \'..\\\\data\\\\policy_result.json\'}, page_content=\'기관:울산 정책 분야:복지.문화분야 지원 내용:  지원내용   매월 50만원 지급   지원기간   보호종료 5년 이내  최대 5년간 60개월  사업 운영 기간:  사업기간   2024. 1. ~ 12. 사업 신청 기간:상시 지원 규모(명):118명 연령:만 19세 ~ 34세 거주지 및 소득:  지원대상   보호종료아동   아동복지시설   가정위탁 보호종료 5년 이내 18세 이후 아동     아동복지법 제 52조상 아동양욱시설  아동일시보호시설  공동생활가정   보호종료일 기준으로 과거 2년 이상 연속하여 보호받는 자 주관 기관:울산광역시 복지정책과 아동복지팀 052 229 3444  운영 기관:주관기관과 동일\'), Document(metadata={\'name\': \'청년마음 건강사업\', \'source\': \'..\\\\data\\\\policy_result.json\'}, page_content=\'기관:세종 정책 분야:복지.문화분야 지원 내용:  관내 청년을 대상으로 전문적인 심리상담   소득기준 없음     기간  3개월 재판정을  최대 1년까지 연장 가능  사업 신청 기간:2024년 01월01일 ~ 2024년 12월31일 비고: 24년 예산 소진시 까지 ~ 연령:만 19세 ~ 34세 거주지 및 소득:   대상  만19세~34세  1990.1.1.~2005.12.31.출생자  참여 제한 대상:  만19세~34세  1990.1.1.~2005.12.31.출생자  신청 절차: 신청방법  주민록상 읍 면 동 주민센터 방문    신청인  자 본인  친족  법정대리인 후견인    각 신분증 지참 제출 서류:  신분증  사회보장급여신청서  개인정보 동의서  붙임  주관 기관:세종시 운영 기관:세종시 지역사회 지원단\'), Document(metadata={\'name\': \'울산 남구 청년 자격시험 응시료 지원사업\', \'source\': \'..\\\\data\\\\policy_result.json\'}, page_content=\'기관:울산 남구 정책 분야:일자리분야 지원 내용:  기간    24. 3. ~ 12.   대상   울산 남구에 6개월 이상 거주한 19세 ~ 39세 청년    주요내용   어학  자격증 시험 응시료 지원 최대 10만원  청년 자부담 20% 포함  사업 신청 기간:상시 연령:만 19세 ~ 39세 신청 절차:  문의   울산광역시 남구 일자리정책과 일자리정책팀 052 226 3122  주관 기관:울산광역시 남구 일자리정책과 일자리정책팀 052 226 3122  운영 기관:주관기관과 동일\'), Document(metadata={\'name\': \'청년월세 한시 특별지원 사업 문경시 \', \'source\': \'..\\\\data\\\\policy_result.json\'}, page_content=\'기관:경북 문경시 정책 분야:주거분야 지원 내용:  대상자    청년기본법 상 청년 만 19~34세 이하 으로 부모님과 별도 거주하고  임차보증금 5천만원  월세 60만원 이하 주택에 거주하는 무주택자   지원한도   실제 납부하는 임대료를 최대 240만원 월 최대 20만원 까지 최대 12개월 회  동안 매월 분할 지원   지원자격   청년가구 소득 기준 중위소득 60% 이하  원가구 소득 기준 중위소득 100% 이하   신청기간    24.2. ~  25.2.   지급기간    24.2. ~  26.2. 사업 운영 기간:2024 02 26~2025 02 25 사업 신청 기간:2024년 03월01일 ~ 2025년 02월25일 지원 규모(명):실제 납부하는 임대료를 최대 240만원 월 최대 20만원 까지 최대 12개월 회  동안 매월 분할 지원 비고:2024 03 01~2025 02 25 연령:만 19세 ~ 34세 주관 기관:국토교통부 운영 기관:문경시청 일자리경제과 \'), Document(metadata={\'name\': \'소셜믹스형 공공임대주택  청년주택 \', \'source\': \'..\\\\data\\\\policy_result.json\'}, page_content=\'기관:서울 금천구 정책 분야:주거분야 지원 내용:주거  자립기반이 취약한 청년층의 주거 공급 사업 신청 기간:미정 비고:수시 연령:만 19세 ~ 39세 거주지 및 소득:서울시 거주 공고문 필히 참고 신청 절차:모집공고를 통한 신청자 접수 주관 기관:금천구청 일자리청년과 운영 기관:02 2627 2587\')], [{\'url\': \'https://www.mohw.go.kr/menu.es?mid=a10711040900\', \'content\': ""자립수당 < 아동보호자립 < 인구아동 < 정책 : 힘이 되는 평생 친구, 보건복지부 건강보험 거짓청구 요양기관 명단공표 보건복지부 개인정보처리방침 건강보험 거짓청구 요양기관 명단공표 보건복지부 개인정보처리방침 만 18세 이후 만기 또는 연장 보호종료된 자로서 보호종료 5년 이내인 자 (단, \'18.8월 이후 보호종료된 자) 만 15세 이후 보호조치가 조기 종료된 자로서 만 18세가 된 때로부터 5년 이내인 자 (단, 아동복지법 시행(’24.2.9.)이후 만 18세가 된 자부터 적용) -아동복지시설: 본인 또는 시설종사자가 보호종료 전 30일 이내 시설 관할 읍·면·동 행정복지센터 방문 가정위탁 : 본인 또는 대리인이 보호종료 전 30일 이내 본인 주민등록 상 주소지 읍·면·동 행정복지센터 방문 본인 또는 대리인이 본인 주민등록 상 주소지 읍·면·동 행정복지센터 방문* 대리 신청 시 신원 확인이 가능한 증빙 서류 제출 필요 보건복지부 자료실 외청 및 소속기관 홈페이지_목록 열기_ 미국 보건복지부 미국 약물남용 및 정신건강청""}, {\'url\': \'https://soyujini24.com/entry/보호종료아동-자립수당-신청-총정리-월-40만원\', \'content\': \'보호종료아동 자립수당 신청 총정리 (월 40만원) 보호종료아동 자립수당 신청 총정리 (월 40만원) 보호종료된 자와 예정인 자 모두 지원받을 수 있으며 월 40만 원을 지급받을 수 있습니다. 보호종료아동 자립수당은 매월 40만 원씩 지원받을 수 있습니다. 보호종료된 자 또는 보호종료 예정인 자(아동복지시설, 가정위탁 보호종료 전 30일 이내) 본인만 직접 신청할 수 있으며, 아래 복지로 홈페이지에서 진행할 수 있습니다. - 아동복지시설 : 본인 또는 시설종사자가 관할 주민센터에서 사전 신청 가능 - 가정위탁 : 본인 또는 대리인이 본인 주민등록상 관할 주민센터에서 사전 신청 가능 - 본인 또는 대리인이 본인 주민등록상 관할 주민센터에서 방문하여 신청 - 보호종료아동 자립수당 지급 신청서 1부 (아래 첨부파일 참고) 답변 : 자립수당은 보호종료 후 60일 이내에 신청할 경우 소급 지급됩니다.\'}]']","대구에서 보호종료아동 자립수당 지급 정책에 신청할 수 있는 연령은 만 18세 이상부터 만 24세 이하입니다. 보호종료 후 60일 이내에 신청할 경우 소급 지급이 가능하며, 아동복지시설이나 가정위탁으로 보호받았던 아동이 해당됩니다. 구체적인 신청 방법은 거주지 관할 주민센터를 통해 진행할 수 있습니다."
보호종료아동 립당 지급 정책의 신청 절차는 무엇인가요?,"['정책 이름: 보호종료아동 립당 지급', '신청 절차: 읍면동 행정복지센터 방문, 우편, 팩스, 온라인 복지로']","읍면동 행정복지센터 방문, 우편, 팩스, 온라인 복지로","[""[Document(metadata={'name': '아동수당', 'source': '..\\\\data\\\\policy_result.json'}, page_content='기관:보건복지부 정책 분야:복지.문화분야 지원 내용:  신청일이 속하는 달부터 매달 25일에 대상 아동 1인당 10만원이 지급   25일이 토 일요일 공휴일인  그 전일에 지급    수급을 받던 아동이 90일 출국일 포함  이상 국외에 체류하는  지급이 정지   아동수당은 보육료  양육수당  다른 복지급여를 받고 있는지와 상관없이  지급 연령 국적  주민록 요건이 충족되면 아동수당 지급    신청 기간   출생 신고 후 언제든지 신청 가능   출생일 포함 60일 이내 아동수당 신청 시  출생일이 속하는 달부터 소급하여 지급 사업 신청 기간:상시 비고:상시신청 신청 절차:  방문 신청   보호자  대리인 아동의 주민록상 주소지  거주지  전국 읍면동 주민센터   온라인 신청   복지로 온라인    모바일  복지로  앱으로 신청   정부24 온라인  으로 신청   온라인 신청은 아동의 보호자가 부모인 에만 가능하며  그 외의 에는 방문 신청이 필요 제출 서류:  공통서류   아동수당 지급 신청서   신청인의 신분증   대리신청인 구비서류   대리 신청 시 위임장  대리인 신분증  보호자 신분증 사본  지참 주관 기관:보건복지부 아동복지정책과 운영 기관:보건복지상담센터'), Document(metadata={'name': '자립준비청년 자조모임 바람개비서포터즈 ', 'source': '..\\\\data\\\\policy_result.json'}, page_content='기관:보건복지부 아동권리보장원 정책 분야:.권리분야 지원 내용:  바람개비서포터즈 자립준비청년 를 위한 역량강화 교육  전문가 멘토링   보호대상아동 자립교육 멘토링 활동 사전교육   자립준비청년 지역별 맞춤형 자립역량강화교육   분야별 전문가와 자립준비청년을 연계하여 특강  소규모  1 1 멘토링 지원   보호대상아동 대상 자립교육  자립멘토링   아동복지시설 가정위탁 보호대상아동에게 자립선배로서 경험  노하우  정보  교육   바람개비서포터즈 자조모임   자립준비청년의 심리 정서적 지지  정책 제안 을 위한 자발적 교류활동 지원   월별 최소 1회 이상 활동실적이 있는 바람개비서포터즈에게  수당 지급   바람개비서포터즈 전국 워크숍  대표회의 운영      세부  내용은 각 지역별 자립지원전담기관 문의 사업 운영 기간:2011년~ 사업 신청 기간:상시 거주지 및 소득:보호연장아동  자립준비청년만  가능 신청 절차:각 지역별 자립지원전담기관 문의   제출서류 작성  접수 기타 유익 정보:각 지역별 자립지원전담기관 홈페이지 혹은 전화 문의 붙임 첨부파일 참고  주관 기관:보건복지부 운영 기관:아동권리보장원'), Document(metadata={'name': '자립준비청년 보호종료아동  자립정착금 지원', 'source': '..\\\\data\\\\policy_result.json'}, page_content='기관:보건복지부 사회보장정보원 정책 분야:주거분야 지원 내용:  만 18세 이상의 아동이 아동복지시설 퇴소 후  자립하는 데 필요한 주거마련  생활용품 구입비 지원   1인 1000만원 지급  구 자체 추가지원100만원 1인  사업 운영 기간:2024.01~2024.12 사업 신청 기간:상시 지원 규모(명):지급대상 모두에게 자립정착금 1인당 최소 1 000만원 이상 되도록 지급을 권고합니다.   지자체 재원으로하는 지방이양사업 비고:상시운영   보호종료가 이루어진 당해년도 연령:만 18세 이상 거주지 및 소득:  만18세 이상의 보호가 종료된 아동복지시설 퇴소 아동 신청 절차:  보호가 종료된 아동복지시설에서 자립정착금 사용계획서 작성하여 신청서  청구서를 시설정보 시스템으로 제출.   접수기관   시 군 구청 기타 유익 정보:아동보육과   053 666 4647  주관 기관:아동복지정책과 운영 기관:아동복지정책과'), Document(metadata={'name': '자립준비청년 교통비 지원사업', 'source': '..\\\\data\\\\policy_result.json'}, page_content='기관:서울 정책 분야:복지.문화분야 지원 내용:보호종료 후 5년간 매월 20알 6만원의 교통비 지원 사업 운영 기간:2024.1~2024.12 사업 신청 기간:상시 비고:상시운영 연령:만 18세 이상 거주지 및 소득:아동복지시설  가정위탁 보호 종료된 지 5년 이내인 아동 중 다음 사항에 모두 하는    만 18세 이후 만기  연장 보호종료된 자 단  2018년 8월 이후 보호종료된 자     보호종료일을 기준으로 과거 2년 이상 연속하여 보호를 받은 자 신청 절차:연중 상시 거주지 관할 동주민센터 방문 신청   대리 신청시 위임장  신분 확인 서류 지참 주관 기관:서울시청 아동담당관'), Document(metadata={'name': '울산 북구 자립준비청년 자립수당 지원', 'source': '..\\\\data\\\\policy_result.json'}, page_content='기관:울산 북구 정책 분야:복지.문화분야 지원 내용:  내용   월 50만원 현금 지급 최대 60개월 지원  사업 운영 기간:  사업기간   연중 사업 신청 기간:상시 거주지 및 소득:  사업대상   아동복지시설  가정위탁 보호종료 5년 이내 아동 18세 이후 보호종료  보호종료일 기준 2년 이상 연속 보호받은 자  주관 기관:울산광역시 북구 가족정책과 아동보호팀 052 241 7493  운영 기관:주관기관과 동일')], [{'url': 'https://moneypicker.kr/보호종료아동-자립수당-지원대상-및-신청방법/', 'content': '보호종료아동 자립수당 지원 대상 및 신청방법 (월 40만원) 보호종료아동 자립수당 지원 대상 및 신청방법 (월 40만원) 보호종료아동의 시설 퇴소 후 사회 정착과 자립지원을 돕기 위해 생계비 지원 목적의 자립수당을 지원하는 보호종료아동 자립수당의 지원 대상 및 신청방법에 대해서 알아보도록 하겠습니다. 아동복지시설 및 가정위탁 보호 종료 5년 이내 자립준비 청년(보호종료아동)을 지원 시설종사자가 보호종료 전 30일 이내 시설 관할 읍면동 행정복지센터에서 사전 신청 – 가정위탁 본인 또는 대리인이 보호종료 전 30일 이내 본인 주민등록 상 주소지 읍면동 행정복지센터에 신청 – 본인 또는 대리인인 본인 주민등록 상 주소지 읍면동 행정복지센터 방문 신청 온라인 신청 방법 보호종료 예정자 및 보호종료자 본인은 복지로누리집에 접속하여 본인인증 후 서비스 신청 가능 – 복지로 온라인 신청 경로: 복지로 로그인 > 서비스 신청 > 복지급여 신청 > 아동청소년 > 보호종료아동자립수당'}, {'url': 'https://eyg-room.com/57', 'content': '블로그 내 검색 검색 정책 및 제도 보호종료아동 자립수당 지급 지원대상 및 선정기준 지원대상 ■ 아동복지시설, 가정위탁 보호종료 5년 이내 자립준비청년(보호종료아동)을 지원 선정기준 ■ 다음 사항에 모두 해당하는 경우 지원 사전신청을 한 경우에도 수당 지급 시작은 보호종료일이 속한 달부터 지급 ※ 대리 신청시 신원확인이 필요한 증빙 서류 제출 필요 제한 사유를 증빙할 수 있는 서류를 제출 필요 오늘도 행복하고 즐거운 하루 보내세요.^^ 정책 및 제도 정신건강 복지센터 및 정신건강상담전화 운영 총정리 불금이네요 즐거운 시간 보내셔요^^ 포스팅 잘 보고 갑⋯ 의료비 지원 생활지원 노인지원사업 빈혈 노인자원 서민금융 한부모가족 치매 초기 검사 삼국지 노인일자리정보 본인부담상한제 신청방법 장비 신고 포상금 국민연금 유비 본인부담상한제 실비보상 조조 정사삼국지 임산부 1366 저소득층 지원 의료비 환급 신청 치매검사 비용 지원 무주택 수술비 부담 촉나라 청년일자리 지원사업 아동수당 삼국지연의 영웅'}]""]","보호종료아동 자립수당 지원에 대한 정보는 다음과 같습니다:

### 지원 대상
- 아동복지시설 및 가정위탁 보호 종료 5년 이내의 자립준비청년(보호종료아동)

### 지원 내용
- 자립수당: 월 40만원 또는 월 50만원 (정보에 따라 다름)
- 지원 기간: 최대 60개월

### 신청 방법
1. **사전 신청**:
   - 보호 종료 30일 이내에 시설 종사자가 관할 읍면동 행정복지센터에 신청
   - 가정위탁의 경우 본인 또는 대리인이 본인 주민등록 상 주소지 읍면동 행정복지센터에 신청

2. **온라인 신청**:
   - 복지로 누리집에 접속하여 본인 인증 후 서비스 신청 가능
   - 경로: 복지로 로그인 > 서비스 신청 > 복지급여 신청 > 아동청소년 > 보호종료아동자립수당

### 제출 서류
- 대리 신청 시 신원 확인을 위한 증빙 서류 필요

### 지급 시기
- 사전 신청을 한 경우에도 수당 지급은 보호 종료일이 속한 달부터 시작

위의 내용은 보호종료아동 자립수당의 지원 대상과 신청 방법에 대한 정보입니다. 추가적인 세부사항은 관련 기관에 문의하여 확인하시기 바랍니다."
